
#rangermoms #tailgating postoaklittleleague #rangers vs #indians #championshipbound buzz_lady… https://www. instagram.com/p/BUVV6BgDGrs/,0,0
. @Mike_Anthony13 helps @Indians shut out @astros for 3-0 win http:// ow.ly/H2EC30bTWM5 #RallyTogether pic.twitter.com/nJAorNDztV,6,28
Clevinger Helps Indians Shut Out Astros For 3-0 Win #Indians #MLB http:// sport-ne.ws/4t7y pic.twitter.com/R5Rfkcc4jy,0,0
Seven glorious shutout innings from Mike Clevinger carry the Indians past the Astros 3-0 #Indians #MLB http:// sport-ne.ws/4t81 pic.twitter.com/Lnh8euf1BU,0,0
In other news fellow former Bulldog pitcher @Mike_Anthony13 started today with 6 no-hit innings for the @Indians ! He also earned the win!! https:// twitter.com/indians/status /866056510283149315 …,1,13
Congress leadership under Mirganj dynasty claimed 2b Indians but de-facto against India a Hindu Majority Nation. - http:// timesofindia.indiatimes.com/india/in-2004- upa-replaced-salve-with-pak-lawyer-for-enron-arbitration/articleshow/58770109.cms …,0,1
Look out there are Indians  loads of them at the #Shannons #Tamworth #Motorshow  inside and outside Tamworth Regional Entertainment Centre! pic.twitter.com/tRR7tJsHjF,0,0
Tough players make their teammates' jobs easier and their opponents' jobs tougher. – Jay Bilas #indians,0,0
I've played two separate Indians fans in The Show online today and I beat both of them. I feel kinda bad about it.,0,0
Mike Clevinger struck out eight over seven scoreless innings and the Indians blanked the Astros 3-0 on Saturday.,0,0
many indians owned slaves as well. be it africans or other indians from war. im cherokee 1/8 and my white lineage owned none but my indian..,0,1
Francisco Mejia wastes no time. #Indians No. 2 prospect ( @MLB No. 35) homers for @AkronRubberDuck in return from DL: http:// atmlb.com/2m979Bs pic.twitter.com/2O0AuzyjL5,6,28
I'm not from Cleveland and if u look at my TL and anything sports I've talked about its always been in support of Cavs Browns & Indians,0,0
Clevinger helps Indians shut out Astros for 3-0 win (May 20 2017) http:// dlvr.it/PBvvdj pic.twitter.com/8ogpiJOrBo,0,0
Who's head to Houston tomorrow to cheer on another @Indians win over the Astros?! That would be me!!! #RallyTogether #GoTribe,0,2
Astros lose to Indians 3-0 at Minute… https:// houstoninformer.com/144055/astros- lose-to-indians-3-0-at-minute/ … pic.twitter.com/t9v2UsRpxb,0,0
We won yesterday. We won today. If we win tomorrow that's called a "winning streak." Go @Indians ! pic.twitter.com/Ax12LSjSFO,0,0
SHS Tribe: Very Special Prom Guest Stephen and his 92 Year Old Grandmother! Gooooo Indians ! pic.twitter.com/IP2PHI0QJ2,38,159
Vía ESPN: Indians Video: Lonnie Chisenhall rockets 446-foot home run to deep center field in 3-0 victory over Ast… http:// espn.go.com/mlb/,0,0
Keiron Pollard Mumbai Indians second highest six scorer.. http:// videos.oneindia.in/watch/80356/ke iron-pollard-mumbai-indians-second-highest-six-scorer.html …,0,0
Mumbai Indians Celebrate 1st IPL Title Victory.. http:// videos.oneindia.in/watch/80638/mu mbai-indians-celebrate-1st-ipl-title-victory.html …,0,0
Mike Clevinger flirts with no-hitter in 3-0 win over Astros #Indians #Astros #MLB http://www. scout.com/mlb/indians/st ory/1779521-clevinger-flirts-with-no-hitter-in-3-0-win …,1,6
Clevinger helps Indians shut out Astros for 3-0 win http://www. espn.com/mlb/recap?game Id=370520118 …,0,0
ROCKIES VS INDIANS https:// twitter.com/graysonhargett /status/865798087171874817 …,0,2
Gee I thought the democrat narrative was true that everybody hates us we should hate us for what we did to the Indians and everyone,0,0
Encarnacion’s 2-run homer helps Indians beat Astros 5-3 – Washington Times http:// pressaware.com/?p=46851 #sport pic.twitter.com/3y7qUCUtoK,0,0
Nice! We're glad to hear that. Enjoy streaming the Indians in GO!,0,0
RPS vs MI Final Live Score Mumbai Indians v Rising Pune Supergiants IPL 2017 - CricketZine http:// fb.me/DYr9JeY4,0,0
Indians drawing highest TV ratings in MLB http:// qoo.ly/fc5gg pic.twitter.com/CkRjca3ATy,3,6
Clevinger helps Indians shut out Astros for 3-0 win (May 20 2017) http:// dlvr.it/PBvrjF pic.twitter.com/TwjTTL2DLC,0,0
How exactly did he help the Indians reach Game 7 of the WS?,0,0
Astros se estrella ante Indians http:// tvsa.mx/2r4bc4w,1,6
Drinking an Indians Lager by @SunKingBrewing - http:// untp.beer/s/c454923364,0,0
The shoe goes on the other foot Wind seems to be out of BJP sail of late 3 yr jumla governance is showing Indians they been FOOLED badly https:// twitter.com/Rajivmehra27/s tatus/865897210122088448 …,3,0
Carr of @CMTNAthletics follows sprint win in 50 with long-distance triumph in 500 boosts Indians ' lead atop team standings. @gazettepreps,3,4
Tommy Boy!!!,0,1
Astros held to 3 hits 0 runs over the last 12 1/3 innings by Indians pitching. Losing streak at 2. And Dallas Keuchel is hurt.,0,0
aznidentity: The thread seems to be mainly filled with Northern Upper Caste Indians . Based on the obser http:// np.reddit.com/r/aznidentity/ comments/6cchod//dhtsti6 … pic.twitter.com/UlLM9ZbdDY,0,0
#MLB : CIN Reds-COL Rockies 12-8 HOU Astros-CLE Indians 0-3 PIT Pirates-PHI Phillies 6-3 OAK Athletics-BOS Red Sox 8-3 #baseball,1,0
Are you seeing tomorrow's Indians game in GO?,0,0
Good win Indians #gotribe,0,0
"What hit Kolkata Knight Riders vs Mumbai Indians - Karn Sharma explains - Hindustan Times" http:// ift.tt/2q4zGXv #Kolkata,1,1
#सुप्रभात #goodmorning #Indians #jai pic.twitter.com/htRzZTFtso,0,3
Astros shut down by Mike Clevinger in loss to Indians http:// dlvr.it/PBvpYk #Astros #EarnIt pic.twitter.com/xTjNOFtje1,0,0
#HoustonAstros #Astros #AstrosNation Clevinger helps Indians shut out Astros for 3-0 win http:// dld.bz/fJbUG,0,0
#HoustonAstros Fiers' quality start not enough vs. Indians http:// dld.bz/fJcct,0,0
See you tomorrow!! #RallyTogether,0,0
#TribeTown #RollTribe #Indians #GoTribe Cleveland Indians 3 Houston Astros 0: Mike Clevinger takes no-hitter .. http:// dld.bz/fJcav,0,0
Ask us Indians about it! https:// twitter.com/intheyear1611_ /status/865950542610272256 …,0,0
Good job Mike. I knew you had it in you.,0,0
and Americans aren't bent on the destruction of Indians the way the Palestinians are on destroying Israel is my point!,0,0
Today in 1960s Baseball: Indians beat Red Sox 2-0 on Jim Piersall 7th-inning 2-run double (1960) http:// bit.ly/2c20Pqb pic.twitter.com/bkgWQIXEfH,2,6
#Rolltribe @Indianapolis Indians Baseball https://www. instagram.com/p/BUVUN8zl3s1/,0,0
Biggest challenge for Indians today is looters of past walking around freely as innocent souls,1,1
2 Cleveland Indians vs Detroit Tigers Tickets 7/9 Lower Box Aisle Seats CHEAP: $89.98 End… https:// goo.gl/fb/09Bn2r,0,0
HAPPY HOLADAY! Holaday doubles to drive in his second run of the game and we're back in the lead. Top 3: #MudHens 3 Indians 2 pic.twitter.com/Jhik9BBX2Y,1,16
First off I'm not Indian. But I do get that I look kind off Indian. Second off if I was Indian why would you assume all Indians are Patel,0,0
@Indians win #dailyMattTifftgif pic.twitter.com/rUdO0YCl9W,0,0
I really rely on your tweets to keep up with the Indians . Many many thanks!,0,1
Spanish I was speaking Navajo! If you want to speak English you need to go to England!" Indians are not trying to force out Americans,0,1
#indians #tittyfuck twink #kikmegirls #spain filme #freewebcams princess pic.twitter.com/1ocyq76cdk,0,0
Win over Kolkata Knight Riders gives Mumbai Indians a lot of confidence: Rohit Sharma https://www. m-news.info/win-over-kolka ta-knight-riders-gives-mumbai-indians-a-lot-of-confidence-rohit-sharma.html … pic.twitter.com/buOmB4Z5qE,0,0
I was asking this to my friends yesterday! I only know of West Indians going to Florida and that's it. https:// twitter.com/urbangaygriot/ status/866072303708372993 …,0,0
Cleveland Indians blank the Houston Astros: http:// bit.ly/2rEtLIW #MLB #Indians #Astros pic.twitter.com/w2AIwnB6VX,1,0
Cricket Ki Baat: MS Dhoni The secret of success against Mumbai Indians in IPL 2017 SUBSCRIBE to India TV Here:... http:// fb.me/z05OhGq2,0,0
#TribeTown #Indians #ClevelandIndians Indians 3 Astros 0: Mike Clevinger helps Indians shut out Astros http:// dld.bz/fJcau,0,0
"Beach Indians ",0,1
@byrnebabyybyrne I see our Reds and Indians are doing a few games. Are you gonna go to any?,0,0
1-0 (+2.1 units) so far on the day!!! 2u Indians ML (+105) 3u & 2u Plays tonight,0,0
Cleveland Indians blank the Houston Astros: http:// bit.ly/2rEtLIW #MLB #Indians #Astros pic.twitter.com/EiBEdKwwqd,2,2
"MI v KKR IPL 2017: Karn Sharma spins Mumbai Indians into final - Times of India" http:// ift.tt/2qGiWJk #Mumbai #hashmumbai,0,0
In his first game off the DL #Indians No. 2 prospect Francisco Mejia homers for @AkronRubberDuck . Watch LIVE: http:// atmilb.com/2q7X6ua pic.twitter.com/krOq8XgEeM,2,6
Let's go Indians ! Miss seeing you guys play in Altoona @TylerEppler36 @ErichWeiss6 @Max_Moroff @austin_meadows @AltoonaCurve,0,2
their Indian Market Share is less than 1% thanks to their low fuel efficient Cars.We Indians Prefer"Kitna Deti Hai" Japanese nd Korean cars https:// twitter.com/Rakshak919/sta tus/866073423247687680 …,0,0
My bestie & I at the #Indians game! https://www. instagram.com/p/BUVTidSgMWQ/,1,1
In his return from the DL Francisco Mejia hit his second HR of the season. ( Indians  AA),1,0
Also the last two Astros/ Indians games changed my mind. Chief Wahoo is racist,1,0
Had a friend who was a Mohawk Indian. He once said to me that Indians killed each other stole land and the White... http:// fb.me/6tJCb8ms2,0,0
3rd Boys - Pool A - Indians def. AirKev - Kingdom 29-15 #PlayForPinkKSC @exposurebball,0,0
Clevinger helps Indians shut out Astros for 3-0 win http:// dlvr.it/PBvjtJ pic.twitter.com/CmAqAyGNyw,0,0
Chisenhall homers scores twice vs. Astros - Lonnie Chisenhall (OF) Cleveland Indians http:// dlvr.it/PBvjnq,0,0
Allen closes out Astros to earn 12th save - Cody Allen (R) Cleveland Indians http:// dlvr.it/PBvjjL,0,0
khou​.com >> Astros lose to Indians 3-0 at Minute... http:// buzztap.com/-o1IgbE,0,0
Check out Huge 20 different OREL HERSHISER cards lot RC 1985 - 2004 Dodgers Indians http://www. ebay.com/itm/-/25294785 6010?roken=cUgayN&soutkn=h6gM2Q … via @eBay,0,0
#TribeTown #Indians #ClevelandIndians Clevinger Helps Indians Shut Out Astros For 3-0 Win http:// dld.bz/fJcat,0,1
Normal screen but before it was only Cowherd and some ancillary shows. Indians /Astros only showed when not signed in. Has worked all season pic.twitter.com/9sKxugo0up,0,0
Astros lose to Indians 3-0 at Minute... http:// dld.bz/fJcaR,0,0
Hey @bee1dible  Clevinger went deep into the game. On board yet? Lol #Indians,0,1
A comprehensive list of everyone who ruined Mike Clevinger's no-hitter #Indians #MLB http:// sport-ne.ws/4t7q pic.twitter.com/VVeDPKJjb7,0,0
. @Indians have beaten @astros 4 of 5 times this year. Today Clevinger took no no into 7th. Gave up 2 hits with 8 k . Miller-Allen finished,3,14
In India and instead of being positive the black people in the comment section are mad that she is helping Indians ! #NickiBBMAs,0,0
She stole my hat. #indians #8days http:// ift.tt/2rDcIYH pic.twitter.com/zgm1cPwfPt,0,0
What needs to be done - and is being done - to employ more Indians  and to make them employable http:// ecoti.in/ARE1oY @PMOIndia @CimGOI,0,1
@Indians major league,0,1
Clevinger loses no-hit bid #indians https:// fanly.link/cb2e45fce7 pic.twitter.com/M0HV1sNgW1,0,0
Francisco Mejia goes deep in is return to the @AkronRubberDuck !! #Indians,1,4
Yeh har cheez main chaud chaud chod keun dalte ho tum indians ?,0,0
Francisco Mejia HR (2) @AkronRubberDuck @Indians,0,0
#Cleveland @Indians Lou Boudreau with Fans. Found @Cleveland_PL 1869-1965 Pictorial Review. @BDbaseball6 @hoynsie @MLBastian @OTBaseballPhoto pic.twitter.com/n38l6m0FXX,9,23
Been off the grid much of day. @indians shutout Astros 3-0. @celtics Isaiah Thomas ruled out of rest of playoffs w/ hip injury.,0,7
said Native Americans actual Indians from India... Africans the Chinese ... even Italians and Irish... that's just off the top of my head,0,0
#TribeTown #RollTribe #Indians #GoTribe Clevinger helps Indians shut out Astros for 3-0 win http:// dld.bz/fJbUG,0,0
Owens family outing to the ballpark go Indians ! @indyindians #victoryfield #rolltribe pic.twitter.com/pbbOz8YJ2Y – bei Victory Field,0,1
How can the @Indians use their success in Houston to achieve greater things? @a_miller48 offers his take. #RallyTogether pic.twitter.com/G8WfXbBGhg,6,49
#Clevinger helps Indians shut out Astros for 3-0 win https://www. 48.pm/clevinger-help s-indians-shut-out-astros-for-win-h5knfv1?utm_source=piratesnews48&utm_medium=twitter …,0,0
After Modiji's message - Indians have started travelling within India more-proof-what you get to see on the highway every weekend.Wonderful!,4,8
Rising Pune Supergiants vs Mumbai Indians on Sunday in the #IPLFinal Preview #IPL tips... https://www. bettingpro.com/category/crick et/rising-pune-supergiants-v-mumbai-indians-ipl-final-predictions-betting-tips-20170520-0006/ …,1,2
Will be supporting RPS in today's match ! And if Mumbai Indians win for the third time it won't sound good. #IPLfinal,1,10
Rising Pune Supergiants vs Mumbai Indians on Sunday in the #IPLFinal Preview #IPL tips... https://www. bettingpro.com/category/crick et/rising-pune-supergiants-v-mumbai-indians-ipl-final-predictions-betting-tips-20170520-0006/ …,1,0
#Indians ' Cody Allen works a scoreless one-hit inning for his 12th save.,0,2
Our event of the day is the 2017 IPL final as Rising Pune Supergiant face the Mumbai Indians http:// fixturetravel.com/blog/ #sportcalendar pic.twitter.com/4Pqnz80Ebu,0,0
Cleveland Indians - ESPN (blog) - http:// tinyurl.com/lt44bo2,0,0
and tht rlly sucks bc indians are literally oppressing themselves by striving for conventional European looks,0,0
Just checked stros record. Didn't realize they were that good. Go get em!,0,1
Indians 3 Astros 0: Mike Clevinger helps Indians shut out Astros http:// dlvr.it/PBvbH8 pic.twitter.com/S2Oq9hh4VJ,2,1
#Windians #RallyTogether #RollTribe Seven glorious shutout innings from Mike Clevinger carry the Indians past .. http:// dld.bz/fJbUE,0,0
On last year's roster too. (Team named after Cleveland Spiders). Thanks @terrypluto for teaching me the history of that squad. pic.twitter.com/vb21k1q7pm,0,0
Go Indians ! #rolltribe pic.twitter.com/U2MFKTieiP,0,0
new shirt? @Indians @starwars #rolltribe #cleveland pic.twitter.com/9qQeqXaiWz,0,1
Mumbai Indians chase record third IPL crown http://www. cricbuzz.com/cricket-news/9 4739/mumbai-indians-chase-record-third-ipl-crown … via @cricbuzz,0,0
Very good win for the Indians . Clevinger seven strong Miller then Allen close it out. Offense still sputtering. Series win assured.,0,2
Nice win @Indians !! pic.twitter.com/GYpOnt46W0,0,0
Not rookie,0,0
Only way to do it.,0,0
MLB Top Play: Cleveland Indians WINNER!!! 62% Winning Rate Last 21 Top Plays!!! #realwinners #mlb #provensystem http:// vegaslinereader.com pic.twitter.com/WzScEV2zYV,2,4
Today in 1960s Baseball: Indians beat Angels 7-5; Gary Bell gets 1st save after Leon Wagner’s 3-run HR in 9th (1963) http:// bit.ly/2c20Pqb pic.twitter.com/mwwEIcOsH1,0,2
fake me out with some indians,0,0
I can't live anywhere I can't be around other West Indians in some way. I need access to my foods and some sort of culture,3,8
Even though I'm an Indians fan she made the Braves game fun @… https://www. instagram.com/p/BUVR4fshbuyg Jr_JADsb-IJ841KT-SYkCwq52g0/ …,1,0
Was it even a designated shitting street? That meme is used for a reason ya know... And it's not just Indians .,0,0
You an idiot: Watches Astros get shut out by the Indians Me an intellectual: Spends $65 spread out over two different Buc-ee's today,0,2
Clevinger helps Indians shut out Astros for 3-0 win http:// dlvr.it/PBvX2J,0,0
Gee...you think the blacks look at the Indians the way some people look at the blacks? Have to admit pretty surprised by some of this.,0,0
Clevinger helps Indians shut out Astros for 3-0 win http://www. foxsports.com/ohio/story/mik e-clevinger-helps-cleveland-indians-shut-out-houston-astros-for-3-0-win-052017?utm_source=dlvr.it&utm_medium=twitter …,0,0
Seven glorious shutout innings from Mike Clevinger carry the Indians pas... #TribeTown https:// fanly.link/cf00e35456 pic.twitter.com/XTglKRxwDI,0,0
Astros shut down by Mike Clevinger in loss to Indians http:// houston.dailydigest.us/2017/05/20/ast ros-shut-down-by-mike-clevinger-in-loss-to-indians/ …,0,0
Two games two wins. Yessir @Indians ! pic.twitter.com/p7JIo9Plaz,0,13
@CHS_ Indians @SJNPSports @kq2 @NPNowZenner @DCLau5 https:// twitter.com/chs__trackfiel d/status/866057502227660800 …,0,2
You vs. the guy she told you not to worry about #RallyTogether #indians #rolltribe @Indians pic.twitter.com/dndwuIuAIK,0,0
IOWAS: ; sing. Iowa. (Ethnol.) A tribe of Indians which formerlyoccupied the region now included in the State of Iowa.,0,0
So true. Not sure why he started the 8th though?,0,0
@Indians I love you guys so much,0,2
Clevinger helps Indians shut out Astros for 3-0 win... http:// fb.me/ALZD1oFR,0,0
Cleveland Indians beat the Houston Astros 3-0. My Cleveland Indians player of the game is Mike… https://www. instagram.com/p/BUVRfmyFrtk/,0,0
Honey let go of the past. It's not even yours. It was awful what happened to the Indians ! But it's happened to many cultures over land,0,0
I'm replacing Contact by DP and using this as my walk up music and let it finish before batting.,0,1
Many Indians in Saudi are Russian spies. Odds are Russia will get this technology just in time for the LM upgrade. https:// sputniknews.com/world/20170520 1053818244-us-saudi-arabia-thaad-patriot/ …,0,0
Clevinger helps Indians shut out Astros for 3-0 win https:// goo.gl/8MbtDd #ohio,0,0
If there was any doubt before today what my favorite sport is now I know because that was worse than the Indians losing the World Series,1,37
@AlexisBlakeCB The Cleveland Indians played shut out baseball today Cleveland Indians : 3 Houston Astros: 0.,0,1
#News Clevinger helps Indians shut out Astros for 3-0 win http:// shink.in/qJ9Kk #ohio #USA #America #EEUU pic.twitter.com/VfgxiB5Z8I,0,0
Astros lose 3-0. Lose 2 straight for the first time since late April to the Indians http:// toplocalnow.com/us/houston/at/ 17#t4044260 …,0,0
End 1 | Toledo 2 #Indians 0. Bad news: A 2-out E7 leads to two runs for Toledo. Good news: We just received their game notes and roster. pic.twitter.com/4HseQAt8Sl,2,14
dont insult Ricky Vaughn and that Indians staff by comparing him to tanaka,0,1
the other day i got sassy with dakota and he said "wow that was intense. know what else is intense? indians ." and it's still making me laugh,0,6
Best part of such news is Indians always defending the terrorist mobs. Talk about being terrorist sympathisers.,0,0
Indians . https:// twitter.com/nvdngspn/statu s/865735354988584964 …,0,0
I liked a @YouTube video http:// youtu.be/ZwG3Od7mTYc?a THE INDIANS BROTHER: 1911 D. W. GRIFFITH PUBLIC DOMAIN,0,0
#MLB #Astros - #Indians ; Clavinger bajó a los Astros dejandólos en blanco #ZOOMAlHome pic.twitter.com/5pUY98dzhK,0,0
#indians fan spotted in the crowd at the New York Redbulls game last… https://www. instagram.com/p/BUVRJVsgyqVn 0jG3PhXdppy69bKvByMBxrXiS40/ …,0,0
WE INDIANS BEEN WAITING FOR THIS MOMENT,0,0
vía @ESPN : Indians Video: Lonnie Chisenhall rockets 446-foot home run to deep center field in 3-0 victory over Ast… http:// espn.go.com/mlb/,0,0
@INDIANS Cody Allen % of saves vs each individual teams this year. HOU: 33.3% ! KC: 16.7% TEX: 16.7% DET: 8.3% KC: 8.3% MIN: 8.3% TB: 8.3%,2,6
Indians Video: Lonnie Chisenhall rockets 446-foot home run to deep center field in 3-0 victory over Astros (ESPN) http:// espn.go.com/mlb/,0,0
Our very own bat boy Jaxson Trueblood throwing out first pitch at the Indians game tonight. pic.twitter.com/wkiUomrLii,3,15
Indians Video: Lonnie Chisenhall rockets 446-foot home run to deep center field in 3-0 victory over Astros (ESPN) http:// espn.go.com/mlb/,0,0
Cleveland Indians vs. Houston Astros: Live updates and chat Game 41 - http:// cleveland.com http:// dlvr.it/PBvS29,0,0
Jeff Schudel's Cleveland Beat: Cleveland Indians  Cubs suffer World Series hangover - http:// News-Herald.com http:// dlvr.it/PBvS13,0,0
Right now in BASEBALL (America's Sport): Indians Video: Lonnie Chisenhall rockets 446-foot home run to deep center… http:// espn.go.com/mlb/,0,0
pic.twitter.com/Bn5Sx9t6kL,0,1
Indians won W I N D I A N S #DefendtheLand,0,0
Indians Video: Lonnie Chisenhall rockets 446-foot home run to deep center field in 3-0 victory over Astros (ESPN) http:// espn.go.com/mlb/ …,0,0
Indians Video: Lonnie Chisenhall rockets 446-foot home run to deep center field in 3-0 victory over Astros (ESPN) http:// espn.go.com/mlb/,0,0
Happenin' in baseball: Indians Video: Lonnie Chisenhall rockets 446-foot home run to deep center field in 3-0 victory over Astros (ESPN) …,0,0
Indians Video: Lonnie Chisenhall rockets 446-foot home run to deep center field in 3-0 victory over Astros (ESPN) pic.twitter.com/KFDbneIglN,0,0
Indians Video: Lonnie Chisenhall rockets 446-foot home run to deep center field in 3-0 victory over Astros (ESPN),0,0
Indians Video: Lonnie Chisenhall rockets 446-foot home run to deep center field in 3-0 victory over Astros (ESPN) http:// espn.go.com/mlb/,0,0
17 Indians = 16 Rangers,0,2
How much did it cost to send Boris the animal to try sell whisky to tee total Indians ? Canny make this up ye really canny man.,3,6
Indians Video: Lonnie Chisenhall rockets 446-foot home run to deep center field in 3-0 victory over Astros (ESPN) http:// ift.tt/16Z1qyq,0,0
Indians Video: Lonnie Chisenhall rockets 446-foot home run to deep center field in 3-0 victory over Astros (ESPN) http:// ift.tt/16Z1qyq,0,0
Indians Video: Lonnie Chisenhall rockets 446-foot home run to deep center field in 3-0 victory over Astros (ESPN) http:// ift.tt/16Z1qyq,1,1
Indians Video: Lonnie Chisenhall rockets 446-foot home run to deep center field in 3-0 victory over Astros (ESPN) http:// ift.tt/16Z1qyq,0,0
Indians Video: Lonnie Chisenhall rockets 446-foot home run to deep center field in 3-0 victory over Astros (ESPN) http:// ift.tt/16Z1qyq,0,1
Indians Video: Lonnie Chisenhall rockets 446-foot home run to deep center field in 3-0 victory over Astros (ESPN) http:// ift.tt/16Z1qyq,0,0
http:// an.drwlng.me/fntsybaseball Indians Video: Lonnie Chisenhall rockets 446-foot home run to deep center field in 3-0 victory over Astros (ESPN),0,0
@Ethan_awesome Yo dude Indians Video: Lonnie Chisenhall rockets 446-foot home run to deep center field in 3-0 vic… http:// ift.tt/16Z1qyq,0,0
Indians Video: Lonnie Chisenhall rockets 446-foot home run to deep center field in 3-0 victory over Astros (ESPN) http:// ift.tt/16Z1qyq,0,0
Indians Fans! $5 Off Ticket Orders $30 or More at Venue Kings! Use Code: SPRING17 (Exp.6/20/17) Find Tickets Now! http:// ift.tt/2rDlCW4,0,0
CC arm overworked with Brewers Indians and even us.Tanaka looks like he has issues,0,1
Ohone & Yrgin Indians Spanish rancheros & apricot farmers all played an important role in #Hayward 's history: http:// ow.ly/g2ES30bMuQt pic.twitter.com/svUnKTa4MV,1,2
Houston Astros vs. Cleveland Indians - 5/21/17 MLB Pick Odds and Prediction - Sports Chat Place http:// po.st/Lm612V via @po_st,0,0
The Japanese they hit us first. We are responsible for the Killing of Native American Indians . Your turn: Who killed the Natives in Mexico?,0,0
Good and terrible. Sexual Chocolate!,0,1
MI v KKR Qualifier 2: Mumbai Indians won by 6 wkts. MoM: Karn Sharma. MI 111/4 (14.3 Ovs) KKR 107 (18.5 Ovs).... http:// fb.me/7cSaTksfp,0,0
Astros lose to Indians 3-0 at Minute Maid Park http:// on.khou.com/2rpK9AF,2,2
GOAL. Aaron Barber gives Central the lead and the Indians have scored 3 unanswered. 4-3 in the 64' #wyovarsity,0,0
Pool A: Ridge Meadows Royals 5 Whalley Jr Chiefs 2 Pool B: North Delta Jr Blue Jays 8 Tri-City Indians 5 #SpringShowdown,0,2
The city of Cleveland has won its last championship.. besides Indians,0,7
The real Cleveland Indians https:// twitter.com/EwingerJ/statu s/866047531654017025 …,0,0
" Clevinger helps Indians shut out Astros for 3-0 win " http:// ift.tt/2qGcMc8,0,0
news-herald​.com >> Cleveland Indians 3 Houston Astros 0: Mike Clevinger takes no-hitter into seventh http:// buzztap.com/-47OkjF,0,0
New post: "Clevinger helps Indians shut out Astros for 3-0 win" http:// ift.tt/2r46eoo,0,0
South African Indians history is different to others bc not a history of immigration rather forced movement and slavelike conditions,0,0
What is the Indians record this year against games started by a Keuchel or McCullers???,0,1
Clevinger helps Indians shut out Astros for 3-0 win http:// corneey.com/qDJ9i9 pic.twitter.com/JdP4pRN4kT,0,0
Clevinger helps Indians shut out Astros for 3-0 win http:// corneey.com/qDJ9im pic.twitter.com/zmas1yGNR4,0,0
Clevinger helps Indians shut out Astros for 3-0 win http:// corneey.com/qDJ9uS pic.twitter.com/jR8qIFsgxl,0,0
Clevinger helps Indians shut out Astros for 3-0 win http:// bhne.ws/9wMAQNw pic.twitter.com/6xy0rbyB2V,1,2
Clevinger helps Indians shut out Astros for 3-0 win http:// ift.tt/2r46eoo,0,0
I'm aware of this just pointing out they have lost 4 of 5 vs Indians,0,0
Anyone who can heave a spittoon deserves respect! @Indians Win Count,0,1
Clevinger helps Indians shut out Astros for 3-0 win https://www. usatoday.com/story/sports/m lb/2017/05/20/clevinger-helps-indians-shut-out-astros-for-3-0-win/101938848/?utm_source=dlvr.it&utm_medium=twitter … pic.twitter.com/ESyiHearnE,0,0
@realslamtana 1RBI(22) 2B pone 3-0 @Indians en el 8vo Enviado con @MLB At Bat http:// mlb.mlb.com/r/video?conten t_id=1409078983 …,0,0
[FoxSport] Clevinger helps Indians shut out Astros for 3-0 win http:// foxs.pt/2pXm0Bw,0,0
