
what are the odds JV throws a perfect game this season for the Astros fully killing the Tigers' fans soul,0,0
I am thinking Dodgers and the Astros .,0,1
Maybin better,0,0
2017 Freshmen World Championship October 20-23 at the Ballpark of the Palm Beaches Astros & Nats Spring home https://www. perfectgame.org/Events/Default .aspx?event=4497 … pic.twitter.com/rqayH3wgGi,15,57
He hasn't played in 4 games,0,0
NFL stadium in another market similar to what happened with Astros and Rangers,0,0
What if I told you that the Arlington #Rangers at 15 games behind the #Astros ?,0,1
Y en una de esas si los astros se acomodan hasta termina fuera del repechaje. https:// twitter.com/lahinchadamx/s tatus/905191307529871361 …,0,1
I will not while watching @JustinVerlander Astros debut. I will cheer him on. No longer in denial. #stillsad #tigers #rebuild #toughtimes,0,0
New post: MLB Tuesday scores highlights updates news: Verlander making Astros debut - http:// CBSSports.com http://www. BaseballNewsandScores.info/110943,0,0
I hate that @MLBNetwork will not let DISH subscribers watch the @astros games "because I live too close" but to block the other one too.,0,0
Y ala y los astros,0,0
Conociéndonos tarot astros y salud Invitada: Daisy Alma de Horus @drguillearias @Rsintonia1420am https://www. youtube.com/watch?v=9qj9_g phdOc …,1,0
No,0,0
Happy Verlander day! #Astros #EarnIt,0,2
that's probably the free http:// MLB.TV game of the day. (You don't want that one. You want the Astros .),0,0
Verlander is pitching tonight and I honestly can't be more excited! @astros,0,1
Avoids lefty against lefty and Reddick deserves a day off,0,1
Please elaborate on bad luck. If you mean injuries luck is always involved but #Astros f/o has put great emphasis on medicals in the past.,0,0
1 Just pitch your game. 2 get 17-21 outs.,0,1
#Harvey golpeó a Houston y @astros se vengó venciendo a Matt Harvey de @Mets en el regreso al Minutemaid Park,0,1
Ask the #cardinals how they stole #Astros secrets lol https:// twitter.com/yahoosports/st atus/905216905069420544 …,0,0
Mets opponents have lined into 1 infield double play in 2017. Astros lead MLB with 12 opponent line drive DPs. Generally considered unlucky. pic.twitter.com/uL974HNahw,0,0
Ida na banca : Superman Action Comics 5 BATMAN Grandes Astros 3 Origem secreta de BATMAN dos… https://www. instagram.com/p/BYrapKMHsxh/,0,0
pic.twitter.com/pdnba8NzkT,0,0
The #Astros could be a rallying point for the city of Houston. https:// calltothepen.com/2017/09/05/hou ston-astros-chasing-history-after-hurricane-harvey/ …,0,0
@astros tell him I said hi,0,0
New: Connecticut Operation Partners With Houston Astros All-Star For Harvey Relief http:// snip.ly/mxnlx,0,0
Los astros se nos alinean esta en nuestras manos #vamospanama,0,1
Catch Spaceman on Astrology and the Astros  and PMcGuire on #Habs playoff chances here: http://www. tsn.ca/radio/montreal -690/shows/melnick-in-the-afternoon-1.52953 … #tsn690,0,0
You and the scout that said the Astros won't succeed because they strike out too much should go get a room.,0,3
Best sign ever. #AstrosHarvey http:// YouCaring.com/AstrosHarvey pic.twitter.com/PrMw3rR0We,77,441
Damn you to all cable provides who don't show the astros game. I'm gonna miss verlander debut #verlanderdebut#astrosharvey,0,0
Surprising he got his first career RBI in his last game w/ Tigers,0,1
It's funny cause he might buy Astros but that's his rival team lol,0,1
BREGMAN! (Damn autocorrect),1,2
Bueno se alinearon los astros para la sele,0,2
Nationals vs Astros World Series Confirmed https:// twitter.com/LeemLeem00/sta tus/905208642923876359 …,1,0
Verlander debutará con los Astros de Houston este martes / Vía @CaraotaDeportes http:// bit.ly/2wFvSjw pic.twitter.com/wn5YiMFVCW,0,0
Bergman summed up my thoughts of tonight's lineup quite nicely,1,2
"o que os astros desse universo tem contra nos?" acho que é impossível dar certo algum dia @ferriflucca,0,1
I wasn't falling baseball or the Astros at the time. I would have been 7 at the time so I don't really know.,0,0
#Astros lineup @SEA (9/5/17): Springer RF Bregman 3B Altuve 2B Correa SS Gurriel 1B González LF Beltrán DH McCann C Maybin CF Verlander P pic.twitter.com/q92lij3dL9,0,0
[Hey folks join me for @JustinVerlander 's first start with @Astros !!!! Looking forward to this new opportunity!!!!],0,1
How is changing Reddick for Beltrán an improvement? Smh,0,1
Porqué indios en segundo si astros y nacionales tienen mejor porcentaje en ganados y perdidos,0,0
Play Marisnick,0,1
Hoe does this compare with the hacking scandal between the Astros and Cardinals. Is punishment from that a basis?,0,0
Hello Astros . Can the Daily Cougar newspaper use this photo for their article calling for Houstonian's to attend the games post Harvey?,0,0
i just spent $10 to promote @JVpitchcount to Astros fans lol,0,5
Se alinean los Astros ... Vamos #Paraguay carajooo!,0,0
@JustinVerlander good luck tonight in ur @astros debut,0,1
I love seeing Fiers moved out of the starting rotation and into the pen where we can choose who he faces and when. #Astros https:// twitter.com/astros/status/ 905208207727054850 …,0,1
MLB Tuesday scores highlights updates news: Verlander making Astros debut http:// ow.ly/VH7e50dRAdC,0,0
#MLB Tuesday scores highlights updates news: Verlander making #Astros debut https://www. cbssports.com/mlb/news/mlb-t uesday-scores-highlights-updates-news-verlander-making-astros-debut/ … #CBSSports,0,0
Que los astros se alineen y juguemos como en Chile. Vamos Paraguay @MaricelThomen,0,1
Hello Astros . Can the Daily Cougar newspaper use this photo for their article calling for Houstonian's to attend the games post Harvey?,0,1
9-5-17 Astros ML (-150) Get em Verlander BOL,2,7
Hello Astros . Can the Daily Cougar newspaper use this photo for their article calling for Houstonian's to attend the games post Harvey?,0,0
Its Verlander tonight!! #astros,0,1
pic.twitter.com/CXrQFcUMHv,0,0
Los astros dicen que sí @inestylesos5 https:// twitter.com/takemetoshawn/ status/905141804529590274 …,0,0
You ALL know what today is!! @Astros @Mariners  here are the Keys to the Game 1. Be U 2. 17-21,1,10
Brother ya todos los astros estan a nuestro favor solo falta que la Sele se desahueve pues y listo Rusia 2018.,0,1
Se alinearon los astros hoy para Panamá espero y ganemos,0,0
MLB Tuesday scores highlights updates news: Verlander making Astros debut #JacksonvilleJaguars http://www. newslocker.com/en-us/sport/ja cksonville-jaguars/mlb-tuesday-scores-highlights-updates-news-verlander-making-astros-debut/ …,0,0
What if I told you #Astros fans 'overreaction' in early May was justified? https:// twitter.com/daveraymond4/s tatus/905213604852637696 …,0,0
So ready for Verlander's Astros debut tonight,0,1
Los astros se están alineando el mismísimo Bobby Wood empato el partido de USA-HON. Hoy es el… https://www. instagram.com/p/BYrZkfSFvgB/,0,0
(2)CruzSeagerCano but Astros still come out on top 10-8 hopefully https:// twitter.com/astros_dude/st atus/905211972924399618 …,0,0
Do we know if Verlander's home debut is Sept. 16th or 17th? #Astros,0,0
Today is Verlander Day and for some crazy reason @ATTSportsNetSW and @directvnow can't get on the same page still can't watch my @astros,0,0
astros : 3 mariners: 2 https:// twitter.com/astros_dude/st atus/905211972924399618 …,1,4
Cano Segura Seager OH WAIT THATS NOT WHAT YOU MEANT AT ALL OOPS,0,1
EP_Mundo: ► Antes de iniciar la jornada toma los consejos de los astros http:// bit.ly/2wBVIqa pic.twitter.com/lTvuVHIs40 …,0,0
Happy Justin Verlander Day #Astros,0,0
The man Verlander about to do work for the Astros !,0,2
Duvida da luz dos astros  De que o sol tenha calor Duvida até da… https://www. instagram.com/p/BYrZN-NBM3h8 zbpAaQ585mgy77NRqvihPJ_izE0/ …,0,0
#STLCardsBlog #StLouisCardinals #mlb Astros Sent Evan Gattis To Single-A Quad Cities To Begin Rehab Assignment http:// dld.bz/gd6qH,0,0
MLB Tuesday scores highlights updates news: Verlander making Astros debut http:// dlvr.it/Pl2q2v pic.twitter.com/EhVMXe4rFe,0,0
Checked in @Safeco Field for the #astros vs #mariners game w/ http:// MLB.com,0,1
I'm ultimately going for the Astros to win the WS.,0,2
RHP Justin Verlander will be making his first start since being acquired by the Astros against Seattle tonight. Watch it on @ATTSportsNetSW . pic.twitter.com/CmsY2BwZUG,0,1
Coki tú lo pronósticaste están pasando cosas a favor de la selección los astros se han alineado y creo que no paramos hasta RUSIA,0,0
Houston Astros moneyline -131.0 PICK DATA: http:// CappedSports.com/posts/217928/m lb/houston-astros-vs-seattle-mariners-pick … @dsmll63 On it? RETWEET #Astros,0,1
Well hope the @Cubs make tonight better and Verlander as well #Astros,0,0
When someone says they've been an Astros fan @Cooley6Seth pic.twitter.com/2qK6HQ4BdD,1,4
West Coast baseball sucks especially on #VerlanderDay !! #astros #threemorehours #butthatsnotsoonenough,0,0
MLB Tuesday scores highlights updates news: Verlander making Astros debut https:// goo.gl/fb/tndPYs,0,0
Strong lineup.,0,0
Good luck. The Astros need you to accomplish what they want,0,0
#larojaxfox esto es producto de la falta de una táctica productiva y exceso de tozudez de parte de los " astros " cada vez peor es el juego,0,0
pic.twitter.com/dz6U1BQV9M,1,1
Hey JV your catcher's names is Brian not James. @JustinVerlander,0,1
It can rain wildfire ash and throw horrific traffic at us but there's no way we are missing this @astros game! #VerlanderDay pic.twitter.com/7JANOGUc8O,0,1
Putting the "cock" in Cocky I see!,1,0
parlay 150 win 300 Slovenia +5 basket wed Astros mlb tue,0,0
Astros should sign Derek Holland I'm sure he'll do a better job than Sipp and Liriano for sure @astrosCTH,0,0
Geeeeez ain't it a thing of beauty??? #astros @astros https:// twitter.com/juliamorales/s tatus/905209832457748480 …,0,0
Deus universo astros  não me manda essa enxurrada de peso nas costas sem resposta não plmdds parece andre dando aula de guerra da crimeia,0,0
,0,0
cool but our pitching out matches youre pitching more then your batting does ours... Indians are the best team in AL and its not close,0,1
Verlander making his first start in an #Astros uniform. Let's go. 9:10pm @ATTSportsNetSW  @MLBNetwork @SportsTalk790  La Nueva 94.1 pic.twitter.com/Qd5T9l6wWl,200,620
We ready for you !! #VerlanderDay @JustinVerlander @astros pic.twitter.com/9RGuqly2YS,0,0
Quote this with your HR predictions for tonight's Astros game.,0,1
MLB Tuesday scores highlights updates news: Verlander making Astros debut - http:// CBSSports.com http:// dlvr.it/Pl2mRD,0,0
#Athletics Daniel Mengden will start the nightcap of Saturday's doubleheader against the Astros . http:// bit.ly/jMu7Md,0,0
Que es eso del derecho a la luz estelar y observancia de los astros ? Que se supone que trata?,0,0
Se han alineado los astros y parece que el destino quiere a mi país en el Mundial,1,2
Got my copy any upcoming updates to reflect the Verlander/ Astros trade?,0,0
Chilling in the motel room w Cameron before #Mariners v Astros . #GoMariners pic.twitter.com/P8rgoyd5ur,0,2
Y de nuevo se aliniaron los astros !!!!! #VAMOSPANAMA !!!!,0,0
Talk about a hurricane Harvey auction item. Have Verlander sign it and out it up. @astros,0,0
VERLANDERS PITCHING TONIGHT! #Astros @RealToddKalas @JuliaMorales @blummer27 @ATTSportsNetSW pic.twitter.com/eA2FpmA5nC,0,0
Lmao. "I can't stand that mofo",0,2
@RealSoxNews@astros Schilling enroute2 feed hundreds of animals in shelter in TX Pics of donations at use paypal greenmonstergames@gmail.com,0,0
MLB Tuesday scores highlights updates news: Verlander making Astros debut http:// ow.ly/bjfh50dRzT5,0,0
The Cubs and Astros also all with young talent through draft and trades..,0,0
Lmao yea,0,1
#Horóscopo (Video) No dejes que se acabe el día sin saber qué te deparan los astros para mañana http:// ow.ly/Nn9Z30eW8gI,0,1
Looking at the upcoming pitching matchup we're basically giving up the Astros series to hopefully win the Anaheim series. #Mariners,0,0
Josh Reddick is not in the Astros ' Tuesday lineup http:// bit.ly/2wFDVws,0,0
Gracias Tigre por darnos majestuoso goooool. Sólo los astros como tu son capaces de hacer vibrar a un país,0,1
Lies... he DMd me and was like "you know that guy astros _dude? I can't stand him!",0,2
Con los indios el pitcher principal es Kluber no Bauer y con los Astros es Keuchel no Kluber el resto me cague de risa muy bueno!,0,1
Es la alineación de los astros ...,0,0
Astros have the better offense and it's not even close,0,1
pic.twitter.com/Sk6J9NEdi9,0,0
They know they're gonna have to catch lightning in a bottle to beat Astros  but need the wins vs angels throw the aces!,0,0
pero apuestele pura pantalla...,0,0
then obviously the run differential would be skewed,0,0
Lmao yea I honestly have no idea. You didn't do anything to piss me off....yet,0,1
I looked at your shit and it said I wasn't following lol. So weird.,0,1
Verlander debutará con los Astros de Houston este martes / Vía @CaraotaDeportes http:// bit.ly/2wFvSjw pic.twitter.com/wn5YiMFVCW,1,2
I definitely didn't do it on purpose lmao. This is like the tenth time this has happened in recent mknths.,0,0
Alguém que entenda de astros sabe se há alguma mudança rolando hoje ? #astrologia será que são os efeitos do #Eclipse ?,0,0
pic.twitter.com/ucy30qYoDn,1,7
I'm so excited pic.twitter.com/pU3RZhHH3j,0,0
Dude I have no idea lol.,0,0
Let's go get em boys,0,0
MLB Tuesday scores highlights updates news: Verlander making Astros debut - http:// sportmacro.com/2017/09/05/mlb -tuesday-scores-highlights-updates-news-verlander-making-astros-debut/ …,0,0
in the AL the Yankees are LMAO,0,0
#Astros lineup @SEA (Miranda) RF Springer 3B Bregman 2B Altuve SS Correa 1B Gurriel LF Gonzalez DH Beltran C McCann CF Maybin P Verlander,1,0
light years? lol right idians have the seconed best run diffrental in baseball and omly trail dodgers by 9 runs.. the astros aren't even 2nd,0,1
16 pitchers on this team right now. AJ will trim this down especially for the playoff push.,0,0
I bet your dads just belted you round the hair with your Astros  fucking love it.,0,1
Eso te digo yo mira futbol porque kante fisicamente bien pero tecnicamente no se puede comparar a los astros como kroos modric,0,0
pic.twitter.com/xbn0Wuq1a0,0,0
You need to start rockin those Astros colors!!!,0,0
Per @astros here's the guys behind Verlander #khou11 pic.twitter.com/5Z5DDBywcv,4,7
Lineup for Verlander's first start for the Astros . pic.twitter.com/PdhAK0p4xV,49,317
" @LVBP_Oficial : José Altuve igualó marca de Luis Aparicio #Astros #Orioles #MediasBlancas http:// ow.ly/r8lM30eUFTl ",0,0
pic.twitter.com/2e1H7WNsON,0,0
How bout when the Cardinals hacked into the Astros database and got a slap on the wrist.No excuse but MLB discipline isn't exactly tough.,0,0
Astros since All- Star break 24-24 Indians since All-Star break 33-16 pic.twitter.com/Lskctb5bcd,1,1
9/5 @Astros lineup at SEA Springer RF Bregman 3B Altuve 2B Correa SS Gurriel 1B Gonzalez LF Beltran DH McCann C Maybin CF Verlander P,8,16
Anyone know who's pitching for the #Astros tonight?,0,2
"Cuántos astros se alinearon si yo te encontré",0,0
MLB Tuesday scores highlights updates news: Verlander making Astros debut pic.twitter.com/OyaHenPAmd,0,0
Today's the day! After tonight's @Astros v. @Mariners game I will have visited all 30 Major League Ballparks. #blessed,2,3
Verlander Astros debut!!!!!!! #GoStros https:// twitter.com/astros/status/ 905208207727054850 …,0,0
Mariners rotation: Miranda (today) Moore (tomorrow) vs. Astros . Leake (Fri) Albers (Sat) Erasmo (Sun) vs. Angels. Gallardo to bullpen,4,24
#Astros 9/5 Lineup G Springer RF A Bregman 3B J Altuve 2B C Correa SS Y Gurriel 1B M Gonzalez LF C Beltran DH B McCann C C Maybin CF,1,1
#NBA Wire: MLB Tuesday scores highlights updates news: Verlander making Astros debut https://www. cbssports.com/mlb/news/mlb-t uesday-scores-highlights-updates-news-verlander-making-astros-debut/ … http:// playerpress.com #…,0,0
I'd ask "Why you gotta me so rude" but then I remembered you got no love for the Astros .,0,0
VERLANDER,0,1
MLB Tuesday scores highlights updates news: Verlander making Astros debut http:// ift.tt/2f1pknR,0,0
dbacks?,0,2
#Astros lineup: Springer RF Bregman 3B Altuve 2B Correa SS Gurriel 1B Gonzalez LF Beltran DH McCann C Maybin CF Verlander P ( Astros debut) https:// twitter.com/kendalljonesgc n/status/905194201947660288 …,0,0
#happyverlanderday #astros #earnit pic.twitter.com/xTCaR2oOcF,0,0
Watch Verlander pitches a perfect game @astros,0,0
José Altuve igualó marca de Luis Aparicio #Astros #Orioles #MediasBlancas http:// ow.ly/r8lM30eUFTl,0,0
#NFL Wire: MLB Tuesday scores highlights updates news: Verlander making Astros debut https://www. cbssports.com/mlb/news/mlb-t uesday-scores-highlights-updates-news-verlander-making-astros-debut/ … http:// playerpress.com #…,0,0
Yeah Maybin can be pinch runner late in the game,0,0
José Altuve igualó marca de Luis Aparicio #Astros #Orioles #MediasBlancas http:// ow.ly/r8lM30eUFTl,0,1
Love High Heat but miss u in the radio talking all sports. Your the best ever Mad Dog.,0,0
Really thought today would be a #JakeDay and he'd go yard,0,0
#Astros lineup @Ariel Miranda (LHP) and the #Mariners | http://www. thedailydugout.com/teams/houston- astros/ … pic.twitter.com/r50wEhcKW7,0,0
#PowerLineUp #PowerBattery #ForHouston,0,0
That doesn't look right.,0,0
Franscisco Lindor #Indians y Carlos Correa #Astros desde ya se solidarizan con sus compatriotas en Puerto Rico #Irma,1,6
cbssports​.com >> MLB Tuesday scores highlights updates news: Verlander making Astros debut http:// buzztap.com/-0bDyIs,0,0
Verlander,0,0
Astros looking beautiful https:// twitter.com/astros/status/ 905208207727054850 …,1,0
Today's MLB Picks: 10:10 PM EST - Houston Astros vs. Seattle Mariners - 34 PICKS AVAILABLE (2 FREE) - https://www. cappertek.com/todaysPicks.as p?d=mlb-baseball-betting-predictions-houston-astros-vs-seattle-mariners-tuesday-september-05-2017&gameID=99240 …,0,0
#Astros #Lineup 09/05: #DFS Daily Fantasy MLB #Startinglineups http:// bit.ly/2aId0bM #AstrosLineup,0,0
Mix and match. Miranda is a lefty Reddick can have the day off.,0,0
17 minutes late. On the lineup post pic.twitter.com/nZfpu8lL8u,0,4
#MLB #Lineup #Astros Springer (R) RF Bregman (R) 3B Altuve (R) 2B Correa (R) SS Gurriel (R) 1B Gonzalez (S) LF… http:// bit.ly/jMu7Md,1,0
Espero que los granos que me están saliendo es una señal de que se están alineando los putos astros porque me cago en mi vida,0,1
Didn't we host the Astros game last week? Why can't we move it like the MLB did?,0,0
Go Astros Go,0,0
Astros lineup behind Verlander pic.twitter.com/hMLNSvs4of,22,73
Me waiting for tonight's game,0,1
Astros fans are so cute...,0,1
1975 TOPPS KEN BOSWELL #479 PSA GRADED 8.5 NM-MT+ VINTAGE NQ ASTROS / METS http:// ift.tt/2f0Cgdh,0,0
No. 138 #Astros pic.twitter.com/X9sRNUhjIj,146,545
@Nationals played Houston Astros just before #Harvey hit. Now playing Miami Marlins just ahead of #Irma . Don't let #Nats come to your park!,0,0
@astros can eliminate Rangers from AL West with 11 wins. 19 games before away series with Rangers. #ClinchALWestInArlington,0,0
Such a shame Between this series and the showing for the Astros looks like the Rays should be Las Vegas bound...,0,0
Let's go Justin Verlander!!! #Astros,0,1
MLB Tuesday scores highlights updates news: Verlander making Astros debut http:// ift.tt/2f1pknR,0,0
@ICEgelski Geoff Blum is really a color analyst for the Astros ?,0,0
#NFL Wire: MLB Tuesday scores highlights updates news: Verlander making Astros debut https://www. cbssports.com/mlb/news/mlb-t uesday-scores-highlights-updates-news-verlander-making-astros-debut/ … http:// playerpress.com,0,0
9/5 - #Astros #Lineup (10:10pm @#Mariners ) #FantasyBaseball #RotoAlerts #MLB #Baseball #StartingLineups #DFS pic.twitter.com/sG6Qk6tI1D,0,0
Should have left the Astros in the NL (Central) and sent the Brewers back,0,0
Before we cry injuries injuries Mike Fiers leads the Astros in innings pitched.,0,0
The tongue thing is childish man. You did that at champs with the new Astros and it was cringeworthy. Be a professional..,0,0
Qual está mais escandaloso ? Noticiario politico dos EUA ou do Brasil ? Os astros dos escândalos estão alinhados ?,0,0
Astros vs angels in the ALDS,0,0
Why MLB put the Astros in AL and leave the Brewers in the NL?,0,0
Nominations were submitted before he was acquired by the Astros .,1,6
Veamos qué nos tiene preparado ese tal @JustinVerlander  good luck in your first game as an astros,0,0
Houston Astros lineup for 9/5 10:10 pm http://www. baseballpress.com/team-lineups/H OU … #roto #mlb #dfs #Astros,0,0
The subject was the Red Sox and Astros having two Cy Young winners on them. Thats what we are discussing not the Cubs,0,0
The Night Cap is on @SportsTalk790 until 8:30pm as we celebrate #VerlanderDay ! @SteveSparks37 Astros  Sox cheating Texans and more!,0,4
who's gonna win? astros or mets? #MLBLive,0,0
Proj Update Josh Reddick (OF) #Astros DK: $4600 6.6 → 0.0 #DFS,0,0
Proj Update Juan Centeno (C) #Astros DK: $2100 4.7 → 0.0 #DFS,0,0
Proj Update J.D. Davis (3B) #Astros FD: $2700 11.8 → 0.0 #DFS,0,0
#Astros Lineup 9/5 Springer OF Bregman 3B Altuve 2B Correa SS Gurriel 1B Gonzalez OF Beltran DH McCann C Maybin OF,0,1
#Astros Lineup 9/5 Springer OF Bregman 3B Altuve 2B Correa SS Gurriel 1B Gonzalez OF Beltran DH McCann C Maybin OF,0,0
After J.D Martinez's performance Justin Verlander will throw a no hitter in Astros debut.,1,20
Astros Lineup 9/5 Springer OF Bregman 3B Altuve 2B Correa SS Gurriel 1B Gonzalez OF Beltran DH McCann C Maybin OF #DFS #MLB,0,1
Astros 9/5 - http:// bit.ly/mlblineups Springer RF Bregman 3B Altuve 2B Correa SS Gurriel 1B Gonzalez LF Beltran DH McCann C Maybin CF,1,0
Right? Like that time they literally hacked the Astros database to steal player data?,0,0
The Astros at full strength are a terrifying thing to behold https:// twitter.com/jakemkaplan/st atus/905206755772162048 …,0,0
Astros lineup tonight for Justin Verlander's team debut pic.twitter.com/ou1znP4UKV,34,71
,0,0
Nah. Lol he does a great job.,0,0
This intern needs to be fired,0,0
henrique nunes no insta: "duvide da luz dos astros  que o sol tenha calor duvide até da vdd mas confia em mim amor" - William Shakespeare,0,1
Hope to see a good first outing from @JustinVerlander in Seattle tonight. @astros let's finish these last 25 games 16-9 to get to 100 wins,0,0
At least I'm back at home in my own bed and I can watch Verlander pitch tonight. @astros,0,0
FREE MLB PICKS Astros -150 Brewers -135 Tigers +115 St Louis -155 St Louis UN 8.5 Dodgers UN 8 #sportspicks #baseballpicks #betting #parlay pic.twitter.com/5binTim0H8,1,4
Esto es lo que los astros han preparado para ti esta semana: http:// buff.ly/2eYsIzC pic.twitter.com/8IyXG1Xc0B http:// dlvr.it/Pl2bHR pic.twitter.com/tndz7m55Wh,0,0
I'll fill in the rest later just gonna let this settle for a bit. #Astros @Safeco Field https://www. instagram.com/p/BYrV5ODnxdH/,20,211
@astros #lineup ??,0,0
I know. I'm just sitting over here like... pic.twitter.com/wl4I6vT0eb,0,0
Cardinals better thank the Red Sox for taking the heat off them from that Astros fiasco.,0,1
Forrest Whitley 2016 Bowman's Best Prospect Signed Auto Rookie RC SP Astros http:// ift.tt/2xMZ8oq,0,0
First start for Verlander in Astros uniform. Gonna be a tough game to win for the Mariners. Have to battle all night,0,1
I never referenced injuries the team is currently in a slump,0,0
I might watch the Astros instead of the Red Sox.,0,0
As someone who #likes the Astros I've gotta say I'm pretty upset with you,0,1
That Astros beat writer certainly didn't help their case,0,3
The wait is over !!!! today is the day @astros and fans been waiting for let's get em @JustinVerlander #TexasStrong #GeauxStros pic.twitter.com/UHugoYdFSh,0,0
My boss told me I can wear any college/pro teams shirts anytime I get bored w/ wearing scrubs. Looks like I'll be reppin the Astros a lot,0,0
FREE PICKS BASEBALL (+84 Net TY) Astros -150 Tigers +115 Padres UN 8.5 Dodgers UN 8 #sportspicks #robbreport #sportswagering #invest #money pic.twitter.com/8n6JItf0uQ,0,3
Amazing.....St. Louis Cardinals hacked into Astros computers....and got a slap on the wrist...don't hear any http:// outrage.wtf,0,0
My Astros friends where telling me Happy V Day and I almost cried of happiness lol #VerlanderDay,0,0
So where's that @astros lineup? It's 6pm,0,0
MLB Tuesday scores highlights updates news: Verlander making Astros debut http:// cbsprt.co/2xNlruk pic.twitter.com/l9Ek6gFzT6,0,1
Go @astros,0,0
That would change the entire American League standings also penalizing the Astros and Indians,0,1
@ABREG_1 @musgrove23Stros @el_yuly10 @BulldogBeing @JDDavis26 @astros Madelyn is 10 today !! Happy birthday to the biggest fan! pic.twitter.com/LsxOSHScd0,1,1
So ready to see Justin Verlander debut. #HoustonStrong #Astros,0,0
Will #Verlander get a W tonight in his very first start for his new Astros team?,0,0
Right! The baseball gods are being cruel!,0,0
I love Altuve an Springer! Good luck Justin!! Go Astros !,0,1
Waiting on #VerlanderDay to get underway on west coast. @Astros pic.twitter.com/B0eGsRv3GM,0,1
@JuliaMorales @ATTSportsNetSW is there anywhere I a lowly Astros fan in Vermont can watch the pregame show?,0,0
Me encanta cuando se alinean los astros .,0,0
Verlander Tonight!!!! #Astros,0,0
Hablando de otra cosa no se quien está más emocionado si J.V los fans de Astros o los Astros players,0,0
... HUMANOS. ENTRE TODOS. A LA LUZ DE LA LUNA. Luego nos bañamos en su sangre. Es una comunión de los astros .,0,3
MLB HOU Astros (J. Verlander) @SEA Mariners (A. Miranda) SEA Mariners RL (+1.5) @1.84 #hqbaseball,0,3
Past my weekday bedtime. Is it dorky to DVR it? #Astros #VerlanderDay https:// twitter.com/attsportsnetsw /status/905201425424293888 …,0,0
