
Justin Verlander makes Astros debut Tuesday but his presence is already felt.. Related Articles: http:// bit.ly/2eDqh4O,0,0
Even though the Astros won that series that has to be in the top three most memorable Cardinal home runs ever.,0,1
Where's the line-up? pic.twitter.com/pqArIzlWz7,0,1
What's worse: stealing signals or 2.5 years of corporate espionage (Cards/ Astros )? There's your bar for punishment.,0,8
Happy 54th B-Day to former Mariners Astros  D-Backs & Yankees Ace Cy Young winning P Randy "The Big Unit" Johnson!,0,0
How the @astros  @Mets  @Twins & others are using data #analytics in baseball #sportstech http:// tech.mg/XSTftw,0,0
It's time! pic.twitter.com/qqxOxWrGce,0,1
A pesar de esta victoria de peru.. Se estan acomodando todos los astros a Favor ... Aniiii que Paraguay  Anii que Luego,0,0
FREE PICKS BASEBALL TUESDAY! Astros -150 Padres UN 8.5 Dodgers UN 8 #sportspicks #mlbpicks #handicapper #winningpicks #sportsbetting pic.twitter.com/37m1VXsaZI,0,1
Justin Verlander is set to make is #Astros debut tonight but should you be starting him as well? https://www. faketeams.com/2017/9/3/16243 624/mlb-fantasy-baseball-forecaster-september-4-10-rick-porcello-michael-wacha-scooter-gennett … pic.twitter.com/M50nuWEuNL,0,0
9/5/1971: In his MLB debut the #Astros ' J.R. Richard fans 15 en route to a complete-game 5-3 win over the Giants http:// astrosdaily.com/history/197109 05/ … pic.twitter.com/DTHx6OFiTt,0,2
Especially on #VerlanderDay,0,0
A big project in SLC.,0,2
Patrick Obley: Buies Creek Astros ' success will be remembered as will lack of support http:// fayobserver.com/sports/2017090 5/patrick-obley-buies-creek-astros-success-will-be-remembered-as-will-lack-of-support …,1,3
So OTD day in 1972 THIS happened! The great JR Richard whiffs 15 in @MLB debut! @astros @70sBaseball pic.twitter.com/wlOjimp2gL,14,37
No perdió Colombia y me gane la polla los astros están a favor.,0,0
4. Minutes. pic.twitter.com/cItCrVAxtj,0,1
For fricks sake who is playing third for the Astros tonight.,0,0
PARLAY PLAY: INDIANS ML ASTROS ML ASTROS UNDER 9 2.5 UNITS WINS 7.5,0,0
#Cuba Los Astros dominan a los Marineros - Primera Hora http:// ift.tt/2xMKA8p,0,0
Equipo vs Equipo ó Pitcher vs Pitcher,0,1
I think Bob is telling us the Astros are never going to lose again while the Tigers are never going to win again.,0,0
@astros Thanks for all the Prayers for Puerto Rico eventhough you guys have the problem right in backyard #PrayForPuertoRico,0,0
nadie esta en comunión con los astros como yo ...saquen,0,0
Astros repair time to go hard in the paint.,0,2
Nolan Ryan 55 card lot Texas Rangers Astros MLB baseball hall of fame famer http:// ift.tt/2x8IDGh,0,0
These 9pm start times are brutal,0,1
Precisely  im almost positive he's humping astros leg,0,3
Emitiendo: Astros - Ciro y Los Persas en Radio Encuentro Lujan,0,0
¿Está pasando algo con los astros o por qué los exes se están manifestando? @nosoyalexalejo  digo Google voy a tener suerte,1,8
Los espero a las 10:00 en #MLBDIGITAL15 junto a @fgeraldino con @astros vs @Mariners dilo tú @ncboomstick23 Ufff @MLBDigital15 @hgomez27 Uff pic.twitter.com/oc36MgA7fD,9,32
Get fema toolbag,0,0
#Free 21-7-1 L29 $300 Orioles vs Yankees @http:// ibnsportswrap.com/freePicks.php AD 148-83-7 L238AD's 10-3 +$3545 L13 $800 Mariners vs Astros *TP,4,2
Verlander debutará con los Astros de Houston este martes http:// bit.ly/2xNn1wr,0,1
9 more mins. pic.twitter.com/TqE25nxG6g,0,7
9/5 Brewers ML 2U Royals F5 -.5 2U Rays F5 -.5 1U Pirates ML +150 1U Astros ML 1U Parlay:Indians/Angles ML+170 bol #dd,0,3
For all the @astros fans claiming they've won the World Series by acquiring Verlander. pic.twitter.com/HI1klD8Hzh,0,0
GET A ROOF LOSERS! Go @astros !! #GETAROOF pic.twitter.com/Kcy7hAv7To,0,0
I think the season might come down to what if ANYTHING the #Astros have to play for the last 4 days #RedSox pic.twitter.com/dCQIGpFWhp,0,0
Even back on the road Astros are relishing their post-Harvey homecoming http:// badbodymagazine.com/even-back-on-t he-road-astros-are-relishing-their-post-harvey-homecoming/ …,0,0
ainda não estou chateada com os astros,0,0
Reid Ryan on Hurricane Harvey and Verlander's @Astros debut #HighHeat https://www. mlb.com/video/high-hea t-reid-ryan/c-1813176083?tid=7417714 …,1,10
K. IRVING 2011: 1˚ pick jovem promissor. 2017: um dos principais astros da liga 4 aparições no all star game 1 anel cesta do título. pic.twitter.com/BFrlHajufm,9,31
Man... Astros should sweep this series but you know how that goes. https:// twitter.com/tnt_mariners/s tatus/905198027261984768 …,0,3
Houston has his back!,0,1
Meu horóscopo falou que eu ia conseguir um job pau no cu dos astros,0,0
I like that matchup.,0,1
Se alinearon los astros  vispera de Luna llena Paraguay tiene que hacer lo suyo esta noche!!,0,4
Me voy a duchar ahora en sERIO. EN DIEZ MINUTOS VENGO QUE LOS ASTROS SE HAN ALINEADO Y FOLLO.,0,1
Les dirigeants des @Astros qui ont préféré la Floride à Montréal pour relocaliser temporairement leur club... #Fail #Harvey #Irma pic.twitter.com/czouTJRn2U,0,1
Astros and Destiny 2 tonight >>>,0,1
Nunca entendere que cuando menos ruido quieres hacer+ ruido haces.Es como si los astros se alinearan para que tu hagas el mas ruido posible,0,2
9/5 3* Yankees (-115) 2* Nationals(-190) 1* Astros (-157),0,1
Los Astros oran por Puerto Rico @PrimeraHora http:// fw.to/OljXHWW,3,3
Taylor Motter back on Mariners' bench against Astros http:// bit.ly/2wFyayQ,0,0
Seguro ya crees que los astros deciden tu futuro,0,0
Funny I don't remember seeing the headline "Justin Verlander boyfriend of Kate Upton traded to Astros ." Poor form by @NYDNSports https:// twitter.com/NYDNSports/sta tus/904581720141434880 …,6,8
somebody get me an astros jersey from my job. i can a kid size medium i think... or is it a large?,0,0
Gracias Dios mío todo poderosolos astros se han alineado today. Por fin mi puto crush reacciona a la vida pic.twitter.com/uv4b7pu0e4,0,0
Tablazo de Seager no fue suficiente contra los Astros http://www. elmundous.com/2017/09/05/tab lazo-de-seager-no-fue-suficiente-contra-los-astros/ … vía @www .elmundous.com,0,0
That's the thought in my head not saying it's right just what's in my head!!!,0,0
Can 8:30pm hurry up and get here? I want to see @JuliaMorales 's interview with @JustinVerlander on the #Astros pregame show,6,58
Please point out your outrage over the Cardinals being caught hacking the Astros . Thanks I'll hang up and listen...,0,1
Sidebar to #Astros fans: Do not panic when JV gives up a 1st inning HR. That's just how he warms up. #yourewelcome,1,13
Culpo a los astros mis ganas de mandar Alv y no poder reprimir lo q quiero decir estoy por explotar aiiuudaa @WaldoCasal @mia_astral,0,0
It's not a big deal. The cardinals literally got hackers to get into the Astros database and steal information. Every team does this lol,0,0
That's money out of owners pockets don't be ridiculous lol. Remember when the Texans wouldn't change home games with astros last week?,0,0
They are about to talk about the impact of Verlander on #MLBTonight @astros,0,0
Alex Cintron is uniform for the Astros as an extra coach. He's the team's Spanish translator.,7,43
This sounds right. Far from the expert follow @Astros _MN for the latest. https:// twitter.com/MikeRevere/sta tus/905195991003004928 …,1,1
Miller your team hacked the Astros ' scouting system,0,1
Wow the Astros picked up verlander,0,0
Ay che Dio! las veces que los astros  el horóscopo tailandes y Kichi mufo intencionalmente.. no salieron bien las cosas.. ANINATI,0,0
Woah Astros traded for Verlander? Jesus.,0,0
Added a fun personal parlay for the day : Red Sox ML Nats ML Mets ML Twins +1.5 Indians ML Astros ML Royals ML $20 to win $595,0,1
Saw this stat salt in the wound: Tigers haven't won since JV's departure & Astros haven't lost since JV's arrival. #Sigh #NotToMentionJDToo https:// twitter.com/MLB/status/905 185045035540480 …,0,0
Os astros estão alinhados para a Malena conseguir ganhar uma partida de Bed Wars #MPN #MalenaGames,0,0
Good luck to @JustinVerlander on his first start with the Houston Astros .,0,1
U r truly Astros angel This really means a lotthxs Moos need see not all fandoms hate us https:// twitter.com/astros_angel/s tatus/905195561015500800 …,0,4
Justin Verlander hace su debut con @Astros esta noche en contra de @Mariners . pic.twitter.com/mWk8sdb5y9,0,1
What astros did u get my guy?,0,1
Did you watch guardians of the galaxy 2 yet?,0,1
Andrew Moore starting tomorrow against Astros . Mike Leake pushed to Friday against Angels. Yovani Gallardo to the bullpen.,19,21
@astros #astrosharvey #MoreThanJustAGame #RallyCap http:// thehayride.com/2017/09/bayham -houston-comeback/ …,0,0
Guess what day it is...... it's #VerlanderDay ! #Astros,0,0
#Freepicks Milwaykee ML Washigton ML Sl ML Astros ML,0,0
Justin Verlander makes his astros debut tonight. Will he be making a difference? https:// twitter.com/i/live/8852737 41764083712 …,0,0
Mariners change rotation. Andrew Moore will start tomorrow vs Astros . Mike Leake moved back to Friday vs Angels.,4,23
Astros : It was a good trade even if Verlander struggles tonight http:// dlvr.it/Pl2Lrq via @astroscth pic.twitter.com/NcO0IyEAG3,0,0
A healthy @LMcCullers43 would give @astros the edge.,0,0
Astros 2B Jose Altuve! #TotallyDistortedTuesday,0,0
Gaaaaaaaaaaaaaaaaalll!! Los astros se alinean #PeruvsEcuador,0,1
LOS ASTROS SE HAN ALINEADO.,0,0
The Indians are the deepest team in baseball who despite injuries have won 12 in a row.,0,0
Mariners did it in 2001 but what do I know. The deepest team in baseball should be able to sustain their level of play even with injuries.,0,0
Top Stacks: 1. Cleveland Indians 2. Colorado Rockies 3. Tampa Bay Rays 4. Cincinnati Reds 5. Houston Astros #DFS #MLB #Draftkings,0,0
Los Astros se estan Alineando para la #SeleccionParaguaya #VamosParaguay Garra y Corazon..,0,0
I expect great things from our new pitcher!!! #Astros #AstrosFanInAustin #EarnIt #ILoveThisGame https:// twitter.com/AstrosOnScout/ status/905158153356050434 …,1,2
#MLB Public%(Top 5)Bets Updated @http:// ibnsportswrap.com/bettingpercent .php … Dbacks +115 66% Brewers -135 64% Astros -150 MLB Public: 4-1 Yday: 15-5 L4Days,7,2
The Astros  Carlos Carrasco gets the start of an Indian.,0,0
Um.. someone get that dude a jersey. @astros https:// twitter.com/mlb/status/905 185045035540480 …,0,0
Astros ' Evan Gattis to begin rehab assignment Wednesday #Astros #MLB http:// sport-ne.ws/6uwr pic.twitter.com/Yskd7JsPwQ,0,0
Astros set weekend rotation against Athletics #Astros #MLB http:// sport-ne.ws/6uwp pic.twitter.com/jlQY1qSu8Q,0,0
Astros vencen a Marineros - http:// tuzonadeportiva.com.ve/astros-vencen- a-marineros/ … pic.twitter.com/JpOtcmzaeY,0,0
Los astros están alineados para favorecer a la @Albirroja . Vamos que se puede! #NeikeAlbirroja #VamosParaguay,1,1
So no one from Astros @'d you you trolled Astros team Twitter account @'d a screenshot of a negative flawed stat and we're sensitive.,0,0
Justin Verlander makes his @astros debut tonight. Will he be making a difference? https:// twitter.com/i/live/8852737 41764083712 …,0,1
Quem substitui o trio de astros ? Veja balanço do Monaco na janela http:// ow.ly/4yNa50dRxvw,0,0
Where can I watch @JustinVerlander in his first start as an @astros if I'm in Tennessee?,1,0
Conoce los cambios que traerán los astros en septiembre según @mia_astral . http:// bit.ly/2eIRvuR,0,3
Looking forward to watching @JustinVerlander pitch tonight for the Astros ! #HoustonStrong,0,0
Check out 2017 Topps Chrome Green Refractors #9A Alex Bregman #'d 60/99- Houston Astros https://www. ebay.com/itm/2226349085 36 … @eBay #HoustonAstros #Topps,0,0
And less than 4 hours Justin Verlander makes his 'nerve-wracking' debut with #Astros in Seattle vs #Mariners . https:// usat.ly/2eFmqbo,5,27
You earned it! What specifically is the "good stuff?",0,0
Vamos Paraguay que se estan alineando los astros  ahora a hacer tu parte!!! https:// twitter.com/brunopont/stat us/905195603306713088 …,1,0
Justin Verlander makes his Astros debut tonight.,0,5
I had a long day of volunteering so I'm enjoying the good stuff,0,0
Se alinean los astros  NEIKE PARAGUAY NDE AÑARAKOPEGUARE!!! https:// twitter.com/brunopont/stat us/905195603306713088 …,0,0
Just water at the moment haha,0,0
Whiskey?!?,0,1
Pelos vistos até os astros estão contra mim xD,0,0
Ojalá algún día se pongan en linea los astros y vuelva don Marcelo Bielsa.,0,0
I have the same opinion of the Cardinals and the Astros email hacking. They did it.,0,0
1U:Cubs -.5 F5 -120 1U: Astros ML -156 1U:Rays/Twins O 9 -110 3U:BIGBET @GBSportPicksVIP,1,3
Se creen astros intocables los giles,0,1
Adriana Azzi revela qué le deparan los astros esta semana http:// bit.ly/2xHvj8K pic.twitter.com/iBt8t78X6y,0,0
Digamos q por ahora los astros conjugan a nuestro favor,0,1
Se alinearon todos los astros a favor de @Albirroja solo falta nuestra parte!! Vamos que se puede,0,0
Astros ' Evan Gattis to begin rehab assignment Wednesday - http:// Chron.com http:// dlvr.it/Pl2Gns,1,3
Hey we're drinking from the same cup right now,0,1
I'm pretty chill I'm in Florida just waiting on this hurricane no sweat here lol pun intended!,0,0
José Altuve igualó marca de Luis Aparicio #Astros #Orioles #MediasBlancas http:// ow.ly/stEN30eUFTP,0,0
Neymar puede jugar bien pero ese teatro q cada q pierde un balon se tira lo caga eso le hace perder respeto comparado a los astros de antes,0,1
He is really making an important difference in @Dbacks performance. Hope we keep him. I'm sure Astros regret letting him go.,0,0
Hands up all those who will be watching the Astros game tonight... #tigers #Verlander,0,1
Can I watch the Astros on the MLB app tonight or will it be blacked out?,0,0
Report: St. Louis Cardinals Under FBI Investigation for Hacking Houston Astros - Breitbart http:// ref.gl/UCHS0l1e,0,0
Game two Astros ! Ready for the third and final game!! pic.twitter.com/nQ1h0sG91v,0,2
Los astros se alinean,0,0
,0,0
Kudos to @LilWoods_HTown for their A+ signage. #Astros pic.twitter.com/zU3j0CboRT,0,1
Could it be because the Astros are fired up for a Justin Verlander first start as an Astro?,0,3
Forrest Whitley 2016 Bowman best of '16 Houston Astros auto autograph http:// ift.tt/2xNDosS,0,0
FORREST WHITLEY ASTROS 2016 BOWMAN DRAFT JUMBO CASE BREAK PLAYER BREAK http:// ift.tt/2x9qwQo,0,0
FORREST WHITLEY 2016 BOWMAN CHROME DRAFT GREEN REFRACTOR #88/99 ASTROS ! http:// ift.tt/2xNjnCL,0,0
CRAIG BIGGIO BGS 9 MINT /100 FLAIR SHOWCASE LEGACY BLUE ROW 0 ASTROS #14 1997 97 http:// ift.tt/2x86yWg,0,0
#Mariners lineup vs Astros : Segura SS Alonso 1B Cano 2B Cruz DH Seager 3B Haniger RF Gamel LF Zunino C Heredia CF Miranda P,0,1
Get hyped! @Skull_N_Cubone pic.twitter.com/OCIx2vHDqW,0,1
I agree and truly believe (as Astros fan) that baseball's cheating traditions should have supported lenient sentence for Chris Correa.,0,0
2017 Topps Chrome David Paulino Houston Astros RC Auto Blue Wave Refractor 30/75 http:// ift.tt/2gJuQz3,0,0
Astros prove why games early in the season matters http:// dlvr.it/Pl2DbF via @astroscth pic.twitter.com/QBzxQuq5P2,0,0
2017 Topps Chrome Joe Musgrove RC Blue Wave Refractor 102/150 Card #120 Astros http:// ift.tt/2f0FzBx,0,0
Good luck tonight @JustinVerlander in your first outing with the @astros I have my hat and ready to cheer you #JvFan4Life pic.twitter.com/janoneXI5j,0,0
Astros 24-24 since the break 9th in the AL https:// twitter.com/BxBombers2791/ status/905193565571121154 …,0,2
climbingtalshill​.com >> Astros prove why games early in the season matters http:// buzztap.com/-iA6X92,0,0
Sad day for Detroit.,0,0
Perhaps the players on the Houston Astros ' roster don't realize it yet but they're about to play a colossal role... http:// fb.me/6e1RcGVAI,0,1
WHWHHWTAFCJF OKAY GOT IT MESSAGE RECEIVED,0,1
José Altuve igualó marca de Luis Aparicio #Astros #Orioles #MediasBlancas http:// ow.ly/stEN30eUFTP,0,2
Check out SIGNED BASEBALL RUSS JOHNSON HOUSTON ASTROS http://www. ebay.com/itm/-/23247476 4000?roken=cUgayN&soutkn=hc4BCD … via @eBay,0,0
Los astros se alinean a favor de Paraguay pic.twitter.com/ep44VMOlLk,0,0
Shippeando shippeando shippeando. Son preciosas Ahora a esperar que los astros se alineen para que Sandra presente el debate,0,1
Bring him up to pitch against the Astros ! Please?,0,1
What's the Astros,0,0
Verlander debutará con los Astros de Houston este martes http:// bit.ly/2gEezHU,0,0
The 2017 #Astros prove why games early in the season matter https:// climbingtalshill.com/2017/09/05/ast ros-prove-games-early-season-matters/ …,1,6
#AstrosTwitter this is Molli be like Molli and take a nap so you can be awake for #VerlanderDay late tonight @astros #EarnIt #ForHouston pic.twitter.com/10pZqWS9VQ,0,15
Justin Verlander makes his @Astros debut tonight. He's put up Cy Young calibre numbers since the All-Star break pic.twitter.com/TBXwtgtzVy,6,12
Houston Astros Hurricane Relief Fund https://www. youcaring.com/victimsofhurri caneharvey-918107 … via @youcaring,0,0
Brewers & Astros ML,0,0
Para leer en forma interrogativa (Cortázar) Has visto verdaderamente has visto la nieve los astros  los pasos... http://www. tupoemadeamor.net.ve/index.php/juli o-cortazar/1555-para-leer-en-forma-interrogativa …,0,0
AJ Hinch on angst anxiety healing & role of sports after Hurricane Harvey https:// buff.ly/2f0QVFA @astros @DSmithShow,1,0
What about just swapping cities and naming Montreal Boston and naming Boston Montreal? Then Fenway can be dismantled & shipped to Canada.,0,0
Verlander Astros debut tonight. #DarkSummoner,0,0
WHY SPORTS? Too much to hope this blows over by the time the Astros playoffs start? Or should I just brace for more soul-crushing defeats? pic.twitter.com/S2YOkZuJso,1,0
The @Mariners will have a pair of new options on the bench tonight against Justin Verlander in his Astros debut. http:// mynw.me/2w4SI24,1,8
Most Lopsided #MLB Games Tonight 83% on #Nats -188 at MIA 82% on #Astros -157 at SEA 76% on #Cubs -170 at PIT http:// sportsinsights.com/mlb pic.twitter.com/G3DMyk913W,2,6
Astros and Boston-1.5,0,0
#Mariners Jarrod Dyson (groin) is out of the Mariners' lineup again on Tuesday night against the Astros . http:// bit.ly/jMu7Md,0,0
Alright @JustinVerlander let's see what you can do in an Astros uniform. We all have high expectations for you good luck. #Astros,0,1
If I am being honest yes.... My feeling is be better than the other team. In everything. I hate the Sox. Pure hatred but I blame the Yanks,0,0
Justin time! Verlander's Astros debut on http:// MLB.TV Sent with @MLB At Bat http:// mlb.com/r/game_article ?gid=2017_09_05_houmlb_seamlb_1&mode=preview&vkey=preview_web_away&c_id=hou …,0,0
That'd be Astros Dog Day!,0,0
Verlander debutará con los Astros de Houston este martes / Vía @CaraotaDeportes http:// bit.ly/2wFvSjw pic.twitter.com/wn5YiMFVCW,0,1
Cuando los astros se alinean en tu contra https:// twitter.com/GolDNakama/sta tus/905190720314765313 …,0,0
Los astros se están alineando a favor de la albirroja!,0,0
Happy Verlanday @astros fans!! @JustinVerlander @ATTSportsNetSW @blummer27 @JuliaMorales @RealToddKalas,0,0
Se alinean los astros para que la selección querida se ubique bien en la tabla GANEEEENNNN POR FAVOOORRRR!!!,0,0
Que se alineen los astros para que USA y HON empaten y Panamá gane. Solo le pido eso a la vida,2,0
Los astros esperemos se alinean de nuevo por ahora Bolivia vamos Albirroja !!!,0,0
Lance Berkman Bobblehead Houston Astros - SGA Bobble. Retirement Ceremony w/box http:// ift.tt/2iV3V3Y,0,0
Tonight Verlander starts for the Astros . / the manchild then wet his pants in glee,0,0
Los astros están a nuestro favor .... Ahahahahaha #CHONGOPERU4NO,0,0
Royals ML Astros ML Rockies ML Parlay Royals Cubs,1,1
Kate Upton is coming to Houston omg thank u astros !!!!!!!,1,2
Los astros se están alineando a favor de la @Albirroja @APFOficial los dioses están con nosotros sólo depende de nosotros la clasificación!,0,0
Astros set weekend rotation against Athletics http:// houston.dailydigest.us/2017/09/05/ast ros-set-weekend-rotation-against-athletics/ …,0,0
Verlander starts tonight #Astros,0,0
Los astros y las señales cósmicas si alinearon,0,0
The #Astros are amazing proud of them always. Irma is scary miedoso what miedoso yo estoy embarrao DIOS nos PROTEGA SIEMPRE @astros,0,0
Altuve llegó a su juego 100 con tres imparables con Astros http:// dlvr.it/Pl249F pic.twitter.com/x5zFqR90LT,0,0
So using electronic devices is ok?,0,0
Let's go VerrrrLalalalander. #EarnIt,0,1
That said I'd also like to add Fuck Boston Forever,0,1
@newyscruggs @Rangers & @astros Just did itbut pick a venue where ppl will actually attend?,0,0
100% it's that...similar to Cards Astros scandel...could see Yanks getting 1 or 2 picks from Sox,0,0
It's the Yankees fault for letting them get stolen. Sign stealing had happened since day 1 of the game. Yankees need to be better at it,0,0
Mariners lineup for 7:10 p.m. start vs. Astros . Jarrod Dyson still out. pic.twitter.com/SljcWFadd2,0,0
lancenet: Quem substitui o trio de astros ? Veja balanço do Monaco na janela http://www. lance.com.br/vaivem/monaco. html?utm_source=dlvr.it&utm_medium=twitter … pic.twitter.com/0qx66U6Hw7 #TimBeta,0,0
Angels vs. Astros ! Which team are you cheering for? #MLB #SmallBusinessLoans pic.twitter.com/HsrjRMaOyY,0,2
Este fin de semana Bostich+Fussible #Nortec ! Viernes 8 @Valle de Guadalupe Ensenada Sábado 9 @Carpa Astros  cdmx pic.twitter.com/HsFcaFkMpF,1,1
A neutral site? Maybe the Alamodome does get an NFL game. If Astros /Rangers play in FL FL can come to TX @JoeKENS5 http://www. espn.com/nfl/story/_/id /20593668/bucs-opener-vs-dolphins-played-miami-sunday-irma-looms …,0,0
pic.twitter.com/e5V0TYgYS7,0,5
PELAMOR DE DEUS VEM LOGO MEU ANIVERSÁRIO PROS ASTROS RENOVAREM MEU ANO,0,0
Mariners lineup for 7:10 p.m. PT game against Justin Verlander in his Astros debut. No Jarrod Dyson again due to sore groin muscle. pic.twitter.com/v2fMxyoNx1,0,6
Este fin de semana Bostich+Fussible #Nortec ! Viernes 8 @Valle de Guadalupe Ensenada Sábado 9 @Carpa Astros  cdmx pic.twitter.com/Ly4lF0aj28,12,46
I am not thrilled with Ariel Miranda starting against the Astros lineup. #GoMariners pic.twitter.com/hTGVGfe0op,0,0
Y mientras tanto Chile pierde con Bolivia... los astros se confabulan con Colombia,0,1
@JustinVerlander on the bump tonight for the @astros pic.twitter.com/PstLLMU7Lx,0,1
Yes there was. $2mil in fines and 2 draft picks taken from St.Louis and given to the Astros  among the penalties.,0,3
Que vergüenza el partido #LaRojaxFOX malo malo vergüenza por todos lados los astros chilenos nada pura fama Bolivia patético final,0,0
#Libra 06/09/2017: La suerte no sólo depende de los Astros  tienes que ser tú el que luche por seguir los caminos... http:// bit.ly/2eIpzqY,0,0
Quem substitui o trio de astros ? Veja balanço do Monaco na janela http:// ift.tt/2f0wHvA,0,0
Numa seleção que não tem astros claro que ele ia sobressair,0,0
Hora de conferir as previsões da semana! #Astros #Horóscopo pic.twitter.com/wHWU77tSVL,0,3
Quem substitui o trio de astros ? Veja balanço do Monaco na janela http://www. lance.com.br/vaivem/monaco. html?utm_source=dlvr.it&utm_medium=twitter … pic.twitter.com/utI5WE3jRL,0,8
Yep,0,0
9/5 - #Mariners #Lineup (10:10pm vs #Astros ) #FantasyBaseball #RotoAlerts #MLB #Baseball #StartingLineups #DFS pic.twitter.com/dCKCU4quHO,2,0
José Altuve igualó marca de Luis Aparicio #Astros #Orioles #MediasBlancas http:// ow.ly/Q4VL30eUFUb,0,0
9/5/1969: #Astros ' Denis Menke belts a two-run blast in the ninth off Gaylord Perry for 2-0 shocker over the Giants http:// astrosdaily.com/history/thisda te/#0905 … pic.twitter.com/bV1xxLcWxF,0,0
Qro dizer aos astros q me prometeram coisa boa no dia 05/09: nada aconteceu.,0,0
***Daily Free Play*** We like Verlander and the Houston Astros tonight on the road as a strong lean. Best of luck!,0,0
Astros run line,0,0
Yeah right after game 1,0,0
Astros manager AJ Hinch told me that he never suspected the Red Sox of doing anything illegal to steal signs against his team.,1,4
Thanks that'll make the Indians postseason a little easier now,0,1
The Astros game and AHS both come on at the same time... #decisionsdecisions,0,1
Drinking cup of coffee so I can stay awake and watch whole game.,0,0
It was 12 before we won yesterday,0,0
That was also a bullpen session from Saturday,0,0
Randy Johnson struck out 12 batters in seven innings and allowed two runs and six hits in beating the Pirates in his Astros debut on 8/2/98.,19,94
#Mariners lineup vs. Justin Verlander (RHP) and the #Astros | http://www. thedailydugout.com/teams/seattle- mariners/ … pic.twitter.com/9RRJJGZONK,0,0
Terra #Flu - Quem substitui o trio de astros ? Veja balanço do Monaco na janela https:// goo.gl/fb/5g3KR2,0,0
For those tired of Harvey & Irma Verlander is pitching for the @astros tonight & it is going to be glorious. #EarnIt #MyAstros,0,0
Astros Dbacks 2017 World Series,1,3
In those 4 games 2 bad outings 1 of which came in wk 2 of season with a 19.62 ERA. In other 2 games he pitched 13.2 innings 1.98 ERA.,0,1
My friends would love a scuff controller and Astros .,0,1
Digamos que los astros se asocian conmigo para ver hoy a la Selección,0,0
It's the way the shirt is pic.twitter.com/vAUDaCcOjD,0,0
Astros set weekend rotation against Athletics http:// dlvr.it/Pl20hq pic.twitter.com/cP6pwc32pM,0,0
Biiieeeeen Boliviiiiiaaaa!!! Vamos Brasil que deben ganar también QUE SE ALINEEN LOS ASTROS !!!,0,0
#Mariners Gameday Info - Sept. 5 vs. #Astros . Lineups Game Notes & More: http:// bit.ly/2f0tIDf pic.twitter.com/WmZHJfaALv,3,10
I just realized Randy Johnson's final start of his career was against the Astros .,1,35
Here's what Astros manager AJ Hinch told me about the Red Sox being investigated by MLB for stealing signs using... http://www. espn.com/espn/now?nowId =21-0696840697256353438-4 …,0,7
New phone who dis,0,0
