
TB let the Astros play over there we can return the favor with football,0,1
@blummer27 @RealToddKalas @astros The W is really up the team... the retweet is on y'all! #manythanks ! I'll be watching.,0,0
Check out RANDY NIEMANN SIGNED AUTOGRAPHED NL BASEBALL HOUSTON ASTROS METS http://www. ebay.com/itm/-/23247471 4296?roken=cUgayN&soutkn=8P7n8l … via @eBay,0,0
Justin Verlander debut on the big screen tonight. #astros,2,17
Verlander se estrena con los Astros de Houston http:// dlvr.it/Pl2033,0,0
Quem substitui o trio de astros ? Veja balanço do Monaco na janela. Leia mais: https:// goo.gl/VNYGiE,0,0
Verlander se estrena con los Astros de Houston http:// dlvr.it/Pl1zx8 pic.twitter.com/arIwYaPMnX,0,0
Justin Verlander makes his @astros debut later tonight. Coming in he's 11 off Luis Tiant (2384) for the 13th most strikeouts in AL history,1,6
Astros en la plenitud de la noche.... #Really https:// twitter.com/cotamix/status /905152753139363840 …,0,0
hasta los astros periodísticos lo pidieron... o no @riquelmeclaudio ? https:// twitter.com/QuintanaChile/ status/905183418597695488 …,0,0
Nuevo laburo y fin de una carrera astros de mi lado #Aries https:// twitter.com/WaldoCasal/sta tus/904772017026727940 …,0,1
Ow my boy Moey I’ve wanted Astros for two years and my parents surprised me. I’ll never forget it.,0,1
pic.twitter.com/qTgGoSIBKL,0,12
Well it's really no different from what the Astros did despite Arlington being a much-closer and valid option.,0,0
YESSSSS.,0,0
But really dude the astros have a legit chance go watch verlander make his debut,1,0
"Yo me sigo preguntando si no te busqué cuántos astros se alinearon si yo te encontré. Tú debes ser mi Karma y lo sabes",1,1
FORREST WHITLEY 2016 Bowman Chrome Refractor AUTO RC #'d/499 Rookie Card ASTROS http:// ift.tt/2gDmBAJ,0,0
Let's all relax about this. The Astros just played a home series in Tampa Bay,0,0
Well the Astros went to Tampa and continued to play so I don't really count that as a valid argument.,0,1
Either 11 or 12,0,0
In his career Ariel Miranda has given up 28 hits to the Astros current roster. 10 are HR. Hahahaha oh man,0,1
Not me unfortunately. But the @astros are playing tonight and @JustinVerlander is pitching so I'm a happy girl. Have fun!,0,0
I realize now good lord no wonder there's so many surgeries going around today chill out,0,0
So if he holds them hitless will the headlines be "Gohara waxes Astros !"? #Braves,0,0
For Detroit fans rooting for Astros  what colors are tonight's away uniforms?,0,0
Lupica: MLB composes regular-season epic: The Astros  Dodgers and Indians have all gone on… https:// goo.gl/fb/m7a883,0,0
Please devote the next Citations Needed to breaking down the Astros ' pennant chase thank you in advance,0,1
You do realize before a game starts between long toss and warmup they already throw over 300 pitches,0,0
@astros _dude https:// twitter.com/tuveystongue/s tatus/905186087630450689 …,1,2
Los astros se le están alineado a argentina Brasil juega como Brasil y el tigre la mete mientras escribía este tuit #EliminatoriasCONMEBOL,0,0
When Indians fans claim their team "owns" Verlander they fail to mention in 2 of those 4 games his ERA was 1.98 against them. #CircleThat,0,2
Free Pick Houston Astros F5 Cleveland / NY Mets Parlay pic.twitter.com/UHwP8brk2n,4,5
Check out ASTROS J.R RICHARD 1977 TOPPS Signed CARD VINTAGE http://www. ebay.com/itm/-/23247833 0785?roken=cUgayN&soutkn=bfwxPn … via @eBay,0,0
Altuve llegó a su juego 100 con tres imparables con Astros http:// dlvr.it/Pl1xW0,0,0
@miklasz So do some Red Sox need to get indicted convicted and jailed for sign stealing? Hard to distinguish this scheme from Cards- Astros .,0,0
Pour les couche-tard ou les leve-tot a ne pas manquer les débuts de Justin Verlander pour les Astros . https:// twitter.com/MLB/status/905 185045035540480 …,0,2
Good lord he's soaked how many pitches he warm up with?,0,0
THere gonna be tough to beat,0,0
Astros set weekend rotation against Athletics http:// ift.tt/2j11Ovl,0,7
New uni same heat. JustinVerlander is set to make his Astros debut TONIGHT. http:// atmlb.com/2eD4Alt pic.twitter.com/9Qg3DWOuCJ,0,0
sweet! #ArlingtonRangersSuck,0,0
That's a t shirt not a uni tbh,0,0
Houston Astros -160 Vs +140 Seattle Mariners Astros ha ganado 5 de los últimos 6 duelos en Seattle. ¿Seguirá la tendencia? ¡Apuesta! #MLB pic.twitter.com/lPgS3JQiFE,0,0
New uni same heat. JustinVerlander is set to make his Astros debut TONIGHT. http:// atmlb.com/2eD4Alt pic.twitter.com/5oXzVViNyy,0,0
Gif,0,1
And I know I know... the Cardinals broke into the Astros ' scouting system. Or whatever.,0,0
#astros Altuve Maybin nominated for Clemente Award - On Tuesday Major League Baseball announced the 30 club n... http:// ow.ly/fFYt50dRvZW,0,1
Yooooooo those Astros though,0,0
#WorldSeries or bust? What will it take for the Justin Verlander trade to be considered a success for the Astros ? #IntentionalTalk pic.twitter.com/Z7M7rgRERH,43,130
New uni same heat. @JustinVerlander is set to make his @Astros debut TONIGHT. http:// atmlb.com/2eD4Alt pic.twitter.com/NRkyyECvTE,438,1440
Houston sports making nat'l headlines...back-to-back subjects on the @PTI rundown today! #Astros @JustinVerlander #Rockets @TilmanJFertitta pic.twitter.com/WTxIopwHrH,1,2
Part Time Retail Associates (Postseason) - Houston Astros (Houston TX) http:// ift.tt/2xMUyqt http:// sportsjoblistings.com #sportsjobs,0,0
Part Time Retail Associates (Postseason) - Houston Astros (Houston TX) http:// ift.tt/2x8zldd http:// sportsjoblistings.com #sportsjobs,0,0
Did a @Nationals One too #ROBLOXDev pic.twitter.com/KawhWgRHVo,0,1
MLB DFS - 9/5 Pitchers: deGrom Verlander Wacha GPP Stacks: Rangers Rays Astros Fav one-offs: Jose Ramirez Ryan Braun,1,4
Still tripping on how @JustinVerlander is with the Astros !! Good luck tonight,0,0
Los astros se están alineando. A ganar o ganar,0,0
you're welcome! I'm glad it arrived safely! Thank you! ~,0,1
Newest #Jobs Posted: Part Time Retail Associates (Postseason) - @astros (Houston TX) http:// dlvr.it/Pl1v71,0,0
Newest #Jobs Posted: Part Time Retail Associates (Postseason) - @astros (Houston TX) http:// dlvr.it/Pl1v2B,0,1
Agradecemos a los Scout de Los Astros de Houston quienes estuvieron presente en las instalaciones de nuestra... http:// fb.me/35Ijh6bdK,1,1
Astros are going to win the World Series because Hurricane Harvey happened,0,2
This is just wrong. @tigers @The_Ty_Cobb @JohnNiyo @RyanSchuiling @Lynn_Henning @astros @MLB @KateUpton pic.twitter.com/7L2TzXt4Mk,1,2
Esta noche en el Safeco Field casa de los Marineros de Seattle hará su debut con los Astros de Houston el lanzador Justin Verlander pic.twitter.com/KvLPW3d5PU,0,0
The world is my playground but Houston is home. Houston Astros Hurricane Relief Fund https://www. youcaring.com/victimsofhurri caneharvey-918107 … via @youcaring,0,0
Yup when the Boston Cardinals hacked the Astros draft database that was enough for me. https:// twitter.com/outonalemb/sta tus/905180368319414272 …,0,0
Houston Astros Hurricane Relief Fund https://www. youcaring.com/victimsofhurri caneharvey-918107 … vía @youcaring,0,0
Consultei os astros pra tentar entender não foi por acaso te trombar no rolê..,4,5
Seattle Mariners - Houston Astros betting tip. Read in full > http:// zpr.io/PQxzN . Seattle Mariners vs. Houston Astros  MLB match i see,0,0
Tom you know it takes a lot to get a Texan out of Texas but I'm following my #Coogs & #Astros while enjoying some fun up north!,0,2
Interesting probably unnecessary criticism ~~ Op-Ed: Astros ' Decision To Play In Houston Saturday Was In Poor Taste http:// cbsloc.al/2eSG54d#.Wa8ZW Kig-yw.twitter …,0,0
You're gonna have weeks where you struggle.,0,0
*crickets*,0,0
Astros https:// twitter.com/IntentionalTal k/status/905167517928357893 …,0,0
Ever look up the timeline of Cubs Astros ?,0,1
Yeah you don't know shit about baseball dude you're not gonna have a .700 winning percentage for an entire 162 game season.,1,1
ao menos 1 dos 4 astros do pódio precisa brilhar nas novelacres senao eu choro!,0,0
Se están alineando los astros ?),1,2
Gonna have to nap when I get home so I can watch @JustinVerlander debut for @astros tonight! #astrosafterdark,0,0
Quiero ver a Verlander con los Astros hoy,0,0
Los astros de alinean?,0,0
Analysis | Astros could push Babe Ruth and Lou Gehrig's Yankees out of the record books http:// wapo.st/2eZjK5l?tid=ss _tw&utm_term=.9ca217827e1e …,0,0
Neutral site games as we saw in the Astros vs. Rangers series held in Tampa drew flies despite all tix $10. Theory is great; reality diff.,0,0
#NuncaFaltaElQue se le ocurre innovar y así desalinear los astros hasta que colapsen pic.twitter.com/Wlv22zNG3P,0,7
kkkkkeu quando tento bater fotos dos astros https:// twitter.com/eduardotwets/s tatus/905181041920540672 …,0,0
Great article on #Harvey and the #Houston #Astros #HoustonStrong https:// twitter.com/flemespn/statu s/905173632900513792 …,1,0
Bolivia está ganando 1 a 0 será que hoy también se alinean los astros ? pic.twitter.com/rSr5Yx2iax,0,0
Cuando los astros se alinean #VamosParaguay https:// twitter.com/VarskySports/s tatus/905179818672754688 …,1,1
Astros set weekend rotation against Athletics http:// ift.tt/2j11Ovl,1,1
Los astros se están alineando a favor de Perú.,0,1
I'll translate it for you: Dodgers = Warriors Astros = Cavs Red Sox = Celtics Yankees = Wizards Indians = Spurs Nationals = Rockets,0,2
Keuchel has been better against the Indians than Kluber has been against the Astros pic.twitter.com/WX9C8MYXmv,2,5
Even back on the road Astros are relishing their post-Harvey homecoming http:// weteachsports.com/2017/09/05/eve n-back-on-the-road-astros-are-relishing-their-post-harvey-homecoming/?utm_campaign=twitter&utm_medium=twitter&utm_source=twitter …,0,0
With Verlander in the fold it’s all coming together for the Astros http:// weteachsports.com/2017/09/05/wit h-verlander-in-the-fold-its-all-coming-together-for-the-astros/?utm_campaign=twitter&utm_medium=twitter&utm_source=twitter …,0,0
.. Es cosa mia? O los Astros de estan alineando por la Albirro? .. ..,0,1
what were you in for?,0,0
Keuchel: Astros in better spirits after adding 'proven leaders' https://www. thescore.com/news/1365923 (via http:// thesco.re/theScore_app ),0,0
Verlander excited for Astros debut: It's 'a first-day-of-school feeling' https://www. thescore.com/news/1365955 (via http:// thesco.re/theScore_app ),0,0
Los astros se están alineando... Anikena pemborea la albichota,8,6
#Horóscopo de AdrianaAzzias Descubre lo que le depraran los astros esta semana a Aries Tauro y Géminis… https:// twitter.com/i/web/status/9 05181295495479299 …,0,0
Que se alineen los astros ! #VamosParaguay #NeikeAlbirroja,0,0
Hacked the Astros scouting reports.,0,0
#Horóscopo de @AdrianaAzzias Descubre lo que le depraran los astros esta semana a Aries Tauro y Géminis http:// bit.ly/2eCwgHg pic.twitter.com/UpiSKOwhOt,0,0
Ahora Valdivia puede cambiar las cosas... Junto a Paredes... Los astros no se han visto... #LaRojaxFOX,0,0
Te sigo,0,1
Astros set weekend rotation against Athletics http:// ift.tt/2eHZdFg,0,0
Coreeeeee... Los astros de nuevo están a nuestro favoooor,0,0
Lupica: MLB composes regular-season epic: The Astros  Dodgers and Indians have all gone on… https:// goo.gl/fb/Usg3T5,0,1
Feel like the cardinals hacking into the astros data base might be worse than this but it is Boston so everything is 10X worse,0,0
Even back on the road Astros are relishing their post-Harvey homecoming http://www. espn.com/mlb/story/_/id /20294325 …,0,0
Se están alineando los astros,1,1
Huge Houston Astros Star + RC Lot Altuve Springer Keuchel Biggio Ryan Verlander http://www. ebay.com/itm/-/22263251 7233?roken=cUgayN&soutkn=xciZxr … via @eBay,0,0
So is cleveland but nah.Gotta look at who they've beaten during their streaks,0,0
Se alinean los astros,0,1
Ti dos estos chulos de separatistas les auguró una ruina total.me lo han dicho los astros .,0,0
@RealMichaelKay Punishment should be the same as the Cards/ Astros Hacking scandal...sum of $2 million and their first two draft picks,0,1
Se alinean los astros Pierde Colombia 0-1 ante Brasil. Y Gana Bolivia 1-0 ante Chile.,0,1
Los astros se alinean,0,0
Eo astros do turano eos menino do atlético,1,0
Icymi...Justin Verlander pitches tonight for the #Astros vs Seattle,0,1
Jose Altuve selected as Astros ' nominee for Roberto Clemente Award http://www. chron.com/sports/astros/ article/Jose-Altuve-selected-as-Astros-nominee-for-12174205.php?cmpid=twitter-desktop … via @houstonchron,0,0
Even back on the road Astros are relishing their post-Harvey homecoming http://www. espn.com/mlb/story/_/id /20294325 …,0,0
Thanks Tags. That was my assumption but I'm trying to choose my words more carefully after all my Astros aren't getting Verlander tweets.,0,3
Houston sports is pretty much the only thing motivating me through this busy busy week. #GOCOOGS #WeAreTexans #Astros,0,2
Boston punishment should be the Same Astros happy with Cardinals' hacking penalty https://www. si.com/mlb/2017/01/30 /houston-astros-hacking-scandal-st-louis-cardinals-punishment … via @SInow,0,1
Ronaldo pegaria muito mais experiencia treinando com os astros do Flamengo vivendo o dia a dia da decisão da Sulamericana do Brasileirão.,0,0
Good. But I think they don't care about that they are focuse to build a strong rotation and give play time to key players and stay HEALTHY,0,0
AZ is a great team. Didn't say otherwise. Indians still hottest team in baseball,0,0
Voy contigo hermano,0,1
Angels vs. Houston Astros Baseball Tickets From http:// VetTix.org https:// shar.es/1S9Uvi,0,0
EP_Mundo: ► Antes de iniciar la jornada toma los consejos de los astros http:// bit.ly/2wBVIqa pic.twitter.com/B7jAK7dsOY …,0,0
Que belo dia hein senhores?! Tá tudo dando certo! Os astros se alinharam positivamente? Uau!,0,0
That's great your team has a whole 1 more game in their current winning steak but AZs beating the top team in baseball not the worst,0,0
Tonight's itinerary-Tigers game at 7PM Astros game at 10PM,0,0
The Mariners go into tonight's game against the Astros with a .500 winning % for the 14th time this season. Catch all the action at 6:30PM pic.twitter.com/7x1NXLvAcL,2,9
The astros and cardinals literally had hacked computers. It's baseball... no one gives a shit. https:// twitter.com/nytsports/stat us/905163342674874368 …,0,0
Oh did the Indians just sweep the Dodgers then beat them at home 13-0 w/o their best player?,0,0
astros alineados para el examen de mañana pls,0,0
Gimme your astros,0,0
José Altuve igualó marca de Luis Aparicio #Astros #Orioles #MediasBlancas http:// ow.ly/Q4VL30eUFUb,0,0
José Altuve igualó marca de Luis Aparicio #Astros #Orioles #MediasBlancas http:// ow.ly/Q4VL30eUFUb,3,1
Astros had their pick of the crop a few years back took Mark Appel. Cubs got Bryant at 2. If the Cubs drafted first Bryant might be a Stro,0,0
google cardinals astros hacking,0,0
Funny how this is getting more attention than Cards hacking Astros  which was a federal crime.,0,1
Not my Astros - we like facial hair pic.twitter.com/9GmiMUBkJ7,0,1
The only way to settle this is to give the Astros the AL spot https:// twitter.com/bradfo/status/ 905174386487037952 …,0,1
Verlander se estrena con los Astros de Houston http:// dlvr.it/Pl1gQL pic.twitter.com/vKcIPjNcAq,0,0
I really think the dodgers and astros are making it to the world series,4,10
Ojalá que se unan todos los astros y ganemos hoy,0,0
That's what I am saying 16 straight is way worse than the pockets & hell treat it the way the Astros did,0,1
All 3 and BTW THANKS TO D ENTIRE TEAM AND without this AAA guys where #Astros will be now WHAT A BLESS HAVING THEM,0,0
Anyone interested in buying my PS4 with many games Astros TRs and a BenQ Monitor??,0,0
@ErniePalladino your op-ed abt the #astros playing at mmp was in poor taste. Many wanted to go home. Very insensitive article.,0,0
Game two Astros ! 7th undefeated! pic.twitter.com/KxfWtOFGj3,0,2
Cardinals literally broke a federal law to hack into the astros player database but ok. I'm sure this will get blown way out of proportion,0,0
Best immediate impact acquisition at #MLB trade deadline? -Randy Johnson to Astros -JD Martinez to Dbacks -Carlos Beltran to Astros Others?,0,0
Lo prometido es deuda!!! @JustinVerlander lograra su primera victoria con Los @astros Creanme es un pavito. pic.twitter.com/NtcUTmmVv4,2,7
Double play...This humidity here is something serious! #HarleyDavidson & #Astros pic.twitter.com/vIjG0pfIMV,0,3
As a fan of many sports. Power rankings are pure garbage. I get their record is best. But a "weekly" record is what matters right?,0,0
shhh,0,0
Not as nefarious as Cardinals/ Astros password hack but sounds sanctionable by MLB. Stay tuned. #sportslaw http:// bleacherreport.com/articles/27316 06-red-sox-reportedly-caught-using-electronic-devices-to-steal-yankees-signs …,0,0
Verlander se estrena con los Astros de Houston http:// dlvr.it/Pl1dwK,0,0
NIGHT CAP: ORIOLES ML -103 RED SOX UNDER TWINS ML F5 +120 WHITE SOX OVER ASTROS OVER (+340) & (+300) PARLAY IN DM's -FTP,0,1
Great stuff! Even back on the road Astros are relishing their post-Harvey homecoming: Even back on the road Astros … #sports #sportsnews,0,0
Saw these ladies on tv for the Astros game yesterday. Impressive ! https:// twitter.com/frankietoong/s tatus/904830708639817729 …,0,0
Tge cardinals hacked astros computer bro let it go,0,0
I had it on my Astros but I literally cancels out all noise and I then tend to speak to loud at my house. So only using for LAN mainly,0,0
@AstrosCounty have you done a piece forecasting astros ' 25-man playoff roster? mostly curious abt bullpen options,0,0
Me encantaría!!! La idea es llevarlos al Salón del Manga de Barcelona tendrían que alinearse muchos astros pero... quién sabe!,0,0
I will no longer accept your Karl-looks-Amish jokes.,0,0
Connecticut Operation Partners With Houston Astros All-Star For Harvey Relief: Premier Limousine is… http://www. lctmag.com/operations/new s/725174/connecticut-operation-partners-with-houston-astros-all-star-for-harvey-relief?utm_source=dlvr.it&utm_medium=twitter … #LCT #Limo pic.twitter.com/Ra8BJ1y4fl,0,0
First pitch for Justin Verlander's Houston Astros debut is scheduled for 10:10 p.m. in Seattle: http:// wp.me/p4yStY-1F1w,1,10
Eddie Matthews Houston Astros pic.twitter.com/bqZE32Nvue,0,1
GO River Bandits!! A team that plays together Wins Together! TEAM= TOGETHER EVERYONE ACHIEVES MORE,0,1
Good luck to @JustinVerlander as he makes his debut tonight for the @astros #MustSeeJV pic.twitter.com/EV1XYm65uZ,0,0
Just happen to be in Seattle when @JustinVerlander is pitching for the Astros for the first time. I'm gonna cry in my @tigers shirt now,0,2
So I guess the @Mariners are losing in Verlander's Astros debut 2nd most lopsided count of the slate #Mariners pic.twitter.com/mU7y5Qugya,0,0
According to SRS the #Indians are the best team in MLB 0.1 runs ahead of the #Dodgers and #Astros https://www. baseball-reference.com/leagues/MLB-st andings.shtml#expanded_standings_overall::12 … pic.twitter.com/4vkCoAjGb7,8,11
Should it be any worse punishment than what happened to Cards in hacking Astros ?,0,0
Spend even less. I don't care. Be the 2012/2013 Astros . But being average is sooooo boring,0,0
Go @JustinVerlander ! #Astros https:// twitter.com/mlbnetwork/sta tus/905132150923698177 …,0,1
Well its weird when you put it like that,0,2
Justin Verlander To Make Astros Debut Tonight More: http:// LineStarApp.com/News/Sport/MLB /Story/19222 … #DFS #MLB #News #HOU,0,0
I'm a #Dolphins  #Astros fan & in the wake of #HurricaneHarvey  public safety comes first not football bye week be damned. #HurricaneIrma,0,0
#FACEOFF OF THE NIGHT Justin Verlander makes his #Astros debut tonight in #Seattle . Who Ya got!? #Houston #Mariners #MLB pic.twitter.com/9MkJYSXCxj,0,0
Cubs literally are about to miss the playoffs so I guess that makes top 5 lmao,0,0
Looking at the rest of the league like pic.twitter.com/8qfc4umzwx,0,1
Watch the Astros manager's speech before the first baseball game in Houston after #Harvey http:// read.bi/2vB7KB6 via @BI_Sports #MARK301,0,2
Adriana Azzi revela qué le deparan los astros esta semana http:// bit.ly/2xHvj8K pic.twitter.com/iBt8t78X6y,0,2
If this Red Sox cheating thing could potentially cost the jobs of Farrell and Dombrowski I hope it's worse than the Astros /Cardinals thing,0,2
Checking my Apple iWatch to see the Red Sox and Yankees scandal from this week and disappointed it's not 9:10 pm cst yet. #Verlander #Astros,0,7
Man that big market bias is real. Cubs over Dbacks? What is this September 2016?,0,0
9/5/1965: 51839 #Astrodome fans see Sandy Koufax's Dodgers get the best of Robin Roberts & the #Astros 4-2 http:// astrosdaily.com/1965/1965.html #0905 … pic.twitter.com/6juMWau0KM,0,0
The Cardinals- Astros scandal >>> Boston stealing signs. Nothing more consequential than a loss of draft picks will happen to the Red Sox.,0,5
The @astros safe at home. FlemFile from Houston - http:// dlvr.it/Pl0dpM,7,6
ATS Stats Forecast: HOU 5 - SEA 3.3 - Generated from 12 Previous Games #Astros #Mariners,0,0
Gotta be an Astros fan.,0,0
Justin Verlander is on the mound for the Houston Astros tonight. Still can't wrap my head around it. #GoStros,1,7
Astros are the best,0,0
Sólo falta que Bonnet diga algo parecido y los astros de la sal se alinean y ¡bum! Gol de Brasil.,0,0
Back in Houston more than 40 kids played ball at Allen Parkway Boys and Girls club this morning! #PlayBall pic.twitter.com/B5IU6s0zjh,23,184
How will the #RedSox punishment compare to the Cardinals- Astros scouting scandal?,0,0
@PamNorman17 Hi pam can you follow me so I can get some more info from you. Astros want to contact you,0,0
Love you blots...you are so Passionate About your Hometown teams ...just for the record I agree..everyone will be rooting for the Astros,0,0
Would love to see the league hammer them like they did the Cardinals for hacking the Astros .,0,0
Justin Verlander To Make Astros Debut Tonight http:// dlvr.it/Pl1WYK #FantasyBaseball,0,0
NEW: Justin Verlander To Make Astros Debut Tonight http:// dlvr.it/Pl1WJ6 #FantasyBaseball,1,0
joining the ranks of the Cardinals/ Astros,0,0
The tribe  Boston  h-town. In that order. Astros with verlander,0,0
Several non-Coors teams ( Astros  Indians Orioles) have multiple top projected batters tonight https:// rotogrinders.com/news/mlb,0,0
That would line him up to start at Minute Maid Park for first time with Astros on Sunday Sept. 17 vs. Seattle. https:// twitter.com/brianmctaggart /status/905172184192040960 …,10,31
He's said before the league needs to do something about sign stealing,0,0
Who knows. They gave the Astros and Cardinals Stuff next to nothing https:// twitter.com/thekavofficial /status/905167747474235392 …,0,1
Can't wait for the outrage meanwhile the Astros /Cardinals hack was laughed at.,0,3
It'll be on at bww,0,1
So do the Red Sox face more serious sanctions than the Cardinals for hacking the Astros ?,0,0
The Astros didn't "waive" Martinez after his age 25 season; they released him after he cleared waivers.,0,0
Astros ' Evan Gattis to begin rehab assignment Wednesday http:// dlvr.it/Pl1TMy pic.twitter.com/8G4e3Tu0pe,0,0
"Duvide da luz dos astros Que o sol tenha calor Duvida até da verdade Mas confia em mim amor",0,2
Hollywood Sportsbook Odds & Trends: Mariners vs. Astros http:// fb.me/wxgLM8iH,0,0
Houston Astros 8GB USB Credit Card Style Flash Drive http://www. shareasale.com/m-pr.cfm?merch antID=7124&userID=1420179&productID=678635662 …,0,0
me,0,2
Si la miras fijamente los astros confabularan a tu favor y La dejaran en tu corazón para siempre.,0,0
After he shut down the Dodgers a couple weeks ago he said he treated like a playoff game. He has a whole different level he can go to.,1,1
Except when the St. Louis Cardinals actually hacked into the Astros ' computer system. Literally nobody cared.,0,0
A New England sports team got caught cheating but what's new.,0,3
The cardinals were the team that hacked the Astros,0,0
Fixed the Mets one pic.twitter.com/5OlSqCLrd8,0,1
Astros had a hacker steal information and got off fairly easy. They'll be okay.,0,1
You getting dem astros,0,1
If anyone wants to bet on baseball I got Giants Astros and Rays RT pls!,0,0
Really!!! Suspend Farrell for 100 games... St Louis hacked into the Astros computers last year. The sox were wrong and it was dumb.,0,0
Se han alineado los astros y las clases de la uní se me han quedado en perfecta armonía con las de inglés pic.twitter.com/rSCmBx5PNH,0,0
Astros shirts and new hair pic.twitter.com/B7LfhPa94c,1,18
Me tonight watching @JustinVerlander make his @astros debate on the West Coast. #astros pic.twitter.com/xmjiJajh39,0,0
RT @Sportsnews202 : RT @MLBPipeline : Team of the Week: #Astros ' Tucker #STLCards ' O'Neill #Braves ' Jackson … https:// twitter.com/i/web/status/9 04782081334575106 …,0,0
Astros just did this,0,0
2/2 Johnson's debut was on Ch. 51 so it had full distribution. But tonight's game could approach 5 which would be huge for ATTSW. #Astros,1,5
They guessed the astros dudes password. And the guy that did it is going to prison. They were fined $2million and lost 2 picks But ya barely,0,0
JUSTIN TIME: Tonight marks the much-anticipated Astros debut for Justin Verlander. 6- time All-Star. O6 ROY MVP & Cy Young Award winner. pic.twitter.com/ODz0G0eBej,1,7
Ah but will @KateUpton be there? More importantly will she be at MMP when he pitches there?,0,0
I vote the Verlander signing..,0,4
1/2 Regardless of what Justin Verlander does in #Astros debut don't expect Nielsen to match the 10.0 rating for Randy Johnson's 1998 debut.,4,8
Verlander se estrena con los Astros de Houston http:// dlvr.it/Pl1QBD,0,0
All the members of astros are always in sync when they dance.,0,1
Indians but Astros are inching closer. Depends on Lance McCullers.,0,0
