
EP_Mundo: ► Antes de iniciar la jornada toma los consejos de los astros http:// bit.ly/2wBVIqa pic.twitter.com/6dXvM7glt8 …,0,0
EP_Mundo: ► Antes de iniciar la jornada toma los consejos de los astros http:// bit.ly/2wBVIqa pic.twitter.com/CfNOusG4vU …,0,0
We got verlander,0,0
Nominados pa'l Premio ROBERTO CLEMENTE aparen tres venezolanos: Carlos Carrasco Indios Miguel Cabrera Tigres y José Altuve Astros .,2,0
Yes pretty dumb. Who knows. Considering the Cardinals hacked the Astros computers and got slapped on the wrist don't expect much.,0,0
If it wasn't for cheating the #Astros would probably have 100 wins by now.,1,20
Leave it to a Boston cheating scandal to take away from #VerlanderDay #Astros,0,0
Fuck the Red Sox. I'm done. Go Astros /Dodgers,0,0
2 things Boston is known for 1.) cheating 2.) being racist,0,0
Verlander se estrena con los Astros de Houston http:// ift.tt/2gK4b5h #SiguemeYTeSigo,3,0
#NowPlaying "26 Píldoras Escépticas #Astros " from Lobo on @anchor : https:// anchor.fm/lobo/episodes/ c94f8c …,0,0
STL actually had to GIVE the Astros two draft picks and pay a $2M fine + guy who did it was banned for life AND sent to fed prison.,0,0
#Enterate Verlander se estrena con los Astros de Houston http:// ift.tt/2gK4b5h #SiguemeYTeSigo,0,0
Verlander se estrena con los Astros de Houston http:// dlvr.it/Pl1N2S pic.twitter.com/Y1clC6Q0UG,0,0
The Astros lost one draft pick for literally committing a federal crime. Can't imagine we lose much,0,0
MLB: 2* Yankees -117 4* Cubs -176 3* Royals -132 1* Reds +124 2* Rays/ Twins 1st 5 over 5 runs (-120) 2* Astros / Indians parlay,4,8
Terrible. Hopefully we see an Astros v Indians alcs. #RallyTogether,0,0
Boston... Caught cheating... How could this be?,0,0
Keep the Astros away from this negotiation or they will have to change extra games just because. https:// twitter.com/ktfuntweets/st atus/905167291138142217 …,0,0
Based on a schedule change I just received looks like Fox has picked up the 9/16 Mariners- #Astros game. Would air here on Ch. 26.,3,4
Lets not forget about the 2 series we have played the Astros this year..but reg season prob doesn't count,0,1
That's what I'm counting on. Good juju in that clubhouse too,0,0
sike probably the Indians or the new and improved Astros,0,0
Indians and Astros and it's not even close,0,0
Hoy en el Montículo Verlander con los Astros de Houston pic.twitter.com/WTUrgZResp,0,0
This is outrageous. And my favorite team was found guilty of hacking Astros pre-draft scouting reports. But this is cheating during games! https:// twitter.com/nytsports/stat us/905163342674874368 …,0,0
love you too man,0,1
Cardinals barely got in trouble for using a legit hacker to steal the Astros ' draft info can't imagine an Apple Watch is a big deal.,108,436
Tb tem isso né qdo a gente nao bate com algo no signo tem mil astros pra justificar kk,0,0
Verlander #Astros debut tonight at Sea. His post all-star break stats: 2.41 ERA .186 BAvg. 2016 post all-star break: 1.96 ERA .180 BAvg,1,11
I believe Justin Upton saying he'd leave the Tigers caused Avila to trade Verlander to the Astros and I am sticking by it. Money not cause,0,0
Oficialmente quito a Boston como mi favorito en la americana. Nueva predicción para el alcs indians vs. astros,0,0
The Milk Man is famous bro,0,0
Crab Racing & Star (Pitcher) Gazing tonight! Crab Races live + new @astros pitcher Justin Verlander debuts on TV vs. Seattle! pic.twitter.com/2VtvJmGXQZ,0,2
I'm not as think as Astros Twitter stupids I am.,0,1
Texans have the 12th most followers of all 32 teams. Rockets have the 9th most of all 30 teams. Astros have the 15th most of all 30 teams.,0,2
Damn.. I wasn't an Astros fan but I did like him.. just wondered where he went after aseball.. that stroke changed his entire life,0,1
. @ajhinch @astros do you guys know of any local charities in PR that would be good to send $$ or supplies to?,0,0
Verlander,0,4
Good luck to @JustinVerlander in your first start in an #Astros uniform tonight!! CANNOT wait!! #HOUvsSEA #Mariners #MLB #HoustonStrong,3,0
@BleacherNation I'm sure I missed it but considering that the Astros gave up are you happy or sad the Cubs didn't get Verlander,0,0
The Nike astros that I've had for 10 years broke at training tonight and I can't pretend I'm not a tiny bit gutted about it.,0,3
The Cardinals were caught hacking into the Astros draft database and stealing info and lost like one draft pick..,7,35
Lmao I love Adam I hope he knows its all in good fun,0,0
There were a ton of big hits in August but what was the Honda Drive of the Month?,11,57
#Astros Top Prospect Report http://www. astrosfuture.com/2017/09/astros -top-prospect-report-828-93/ …,4,8
Now if we can only get the Astros and Indians to do it too the Yankees will go to the World Series https:// twitter.com/nytimes/status /905163675480281088 …,0,0
Adriana Azzi revela qué le deparan los astros esta semana http:// bit.ly/2xHvj8K pic.twitter.com/iBt8t78X6y,0,1
He was talking about me??,0,0
E olhos postos em ti vivo de rastros: "Ah! Podem voar mundos morrer astros  Que tu és como Deus: princípio e fim!...",0,0
Bahaha you're right. Thanks. Duhhh. That was dumb.,0,0
Today's MLB Picks: 10:10 PM EST - Houston Astros vs. Seattle Mariners - 23 PICKS AVAILABLE - https://www. cappertek.com/todaysPicks.as p?d=mlb-baseball-betting-predictions-houston-astros-vs-seattle-mariners-tuesday-september-05-2017&gameID=99240 …,0,0
But you're Astros fan so you're basically just as bad. Haha jk man yeah I know not every person agrees w/ every decision. Just the reality.,0,2
They're number two behind the Dodgers.,0,1
I believe that is Astros 2B Jose Altuve!! #TotallyDistortedTuesday,0,0
Astros ?,0,3
still getting swept by the astros still won't make the playoffs serva,0,0
Right? It's just them. Like that time they hacked into the Astros database? And that year they were punished for the salary cap violations?,0,0
Ojalá y los astros se alineen hoy para ir a MiPueblito,0,0
Oh Astros Rants not making the point you think you are making.,0,1
6 bands worth of free mattresses if the astros win He'll nawl Its a NO GO,0,0
Great news !!! The curfew has been lifted and we are back to regular hours !!! Tonight The Astros live from... http:// fb.me/7NMEogfFg,0,0
It's SOOOOOO weird seeing jv in a Astros jersey,0,0
Astros ?,0,0
I need to send you send Astros . PM me the address!,0,2
It's been quite a few weeks for everyone in Houston- great to have #Astros manager @ajhinch join @DSmithShow right now,0,1
It was nice to meet you at the Rose Bowl. Enjoyed the hoops update. And yes how 'bout those Astros,0,1
And the Astros will have a tough Indians team that's 5-1 against them this year. Should be fun!,0,1
por favor acordaos de mí y pedidles a los astros que las cosas vayan bien este curso porque lo necesito,0,0
Happy #VerlanderDay my fellow Astros fans...it feels just like christmas morning,0,0
Trash. Where's the hottest team in baseball rn?,0,2
Cheer up Justin Verlander Astros debut tonight.,0,0
Seeing @JustinVerlander in a astros cap is weird,0,0
can't believe verlander got moved to the astros now i can't even see her at games https:// twitter.com/weadorebabes/s tatus/903623004374097920 …,0,0
#Verlander makes his #Astros debut vs the #Mariners . Tickets starting at $5 dollars!!! Yes $5!!!! #MLB #Bargain http://www. ticketstarz.com/2933411/Seattl e-Mariners-vs-Houston-Astros …,0,0
Vas a subir vídeo ?! Madre mía cuánto tiempo  los astros se habrán aliñado o algo así :vv,0,0
Y'all think astros will hit 100 wins? Gotta go 16-9 for the rest of the games to do it,0,0
A team that's about to have a tough Astros team challenge come playoff time.,0,0
Not an Astros fan but I'm rooting for JV.,0,1
Duvide da luz dos astros mas não duvide do meu amor,0,0
LA dodgers vs Houston astros in the World Series. You heard it here first,0,0
They want to be us so bad,0,0
Verlander se estrena con los Astros de Houston http:// ift.tt/2gK4b5h http:// ift.tt/eA8V8J,0,0
José Altuve igualó marca de Luis Aparicio #Astros #Orioles #MediasBlancas http:// ow.ly/Rtwh30eUFUT,0,0
Ariel Miranda toes the rubber as the Mariners look to even the series vs. the Astros . Preview: http:// atmlb.com/2f0CFg8 pic.twitter.com/zZGn4JdHnu,2,34
@RealJoshReddick Love you Astros !,0,0
9/5/1965: Jeff Baldwin is born in Milford DE. The OF went 0-for-8 in 7 games for the 1990 #Astros http:// astrosdaily.com/players/Baldwi n_Jeff.html … pic.twitter.com/AyRDZIY03e,0,1
Straight Astros With it https:// twitter.com/trvisXX/status /897903193899675649 …,0,0
Olha uma cena não há uma cena nos astros que diga que signos são mais prováveis acreditar nos signos??,0,0
Astro users. On pc do you use your astros in pc mode or no?,0,0
Do not start this. The only thing we know is that we'd both cheat on each other with Marwin and that's okay,0,1
" @ESPNStatsInfo Justin Verlander makes his Astros debut tonight. He has a 2.06 ERA since July 30 4th-best in MLB in that span,0,0
Mas os astros dizem,0,0
We share him just like how we share Correa but I think we all know who loves Marwin more,0,1
José Altuve igualó marca de Luis Aparicio #Astros #Orioles #MediasBlancas http:// ow.ly/Rtwh30eUFUT,3,4
This is a joke,0,0
That's like saying I hate the Astros cause there Star player isn't tall enough to ride a roller coaster,0,5
I am predicting Houston vs. Dodgers in the World Series. I was rooting for Dodgers but wouldn't it be great for the Astros to win because..,0,1
I still forget the Astros are in the AL,0,1
Jajaja otra que Mia. A full con los astros .,0,1
Play anyone and everyone who can hit off the astros,0,0
Double Sad!,0,0
Verlander se estrena con los Astros de Houston http:// dlvr.it/Pl1BF5 pic.twitter.com/xNyzh2jxFf,0,0
http:// nypost.com/2017/09/02/how -the-mets-quietly-aided-houston-relief-efforts/ … @Mets thank you for helping our city #respect @astros,0,2
Este mes se van a revelar secretos escondidos. No lo digo yo lo dicen los astros .........,3,6
Que sea lo que los astros quieran que gane o que pierda #Peruvsecuador #CHONGOPERU4NO #ArribaPeru #Russia2018 #VamosPeru,0,1
Verlander se estrena con los Astros de Houston pic.twitter.com/ljzKrLCReV,0,0
BOLD PREDICTION: The @astros pull a @Saints and win the big one the year their city needs it the most. (please?),1,1
Verlander se estrena con los Astros de Houston http:// bit.ly/2xMNn1o,0,0
Six total. Lost 7-5 and 2-1,0,0
1 in the first game 5 in the second,0,1
Yeah Astros are basically your go to. @trevmay65 thoughts since you game,0,0
I like it. I'm cheering for you guys to go all the way.,0,1
Astros have a better 1-4 NOW with Verlander trade https:// twitter.com/tmksespn/statu s/905148411992834048 …,0,1
Adriana Azzi revela qué le deparan los astros esta semana http:// bit.ly/2xHvj8K pic.twitter.com/iBt8t78X6y,0,0
Wtf? I think Arizona should top the list. Dodgers not worthy after crap week.,0,2
Verlander se estrena con los Astros de Houston pic.twitter.com/EFkkqaXt8K,0,0
Is this following the Cubs or Astros tank model?,0,0
,0,1
Is it just me or are these "1st day back at school" photo's utter cringe?! No one cares about your ugly kid in school trousers n astros,1,6
I got indians vs Astros ya got better starting pitching but they got the better pen,0,0
¿En qué invierten los astros de La Roja? http:// bit.ly/2eIgDS8,0,1
Don't trust his ass telling u game on the line that's a heart attack but don't worry I still see the Astros vs Indians in the Alcs,0,0
" #Dodgers have been the best team in MLB since April." No #Astros were the best team until June/July,0,0
Astros v. Angels tickets (2) (Section 128 Row 2) $200 http:// ift.tt/2iZsf4y #astrostickets,0,1
FIFA 18 | EA Sports divulga notas de astros do game https://www. jornadageek.com.br/videogame/noti cias-games/fifa-18-ratings/ …,0,0
#Beisbol : Verlander se estrena con los Astros de Houston http:// ift.tt/2gK4b5h,0,0
No le tengo mucha fe a la selección peruana pero creo que esta vez los astros están conspirando.,0,2
Les regalo hoy martes rl astros . Rl mets. Rl nacionales saludos y jueguen confiados,0,0
Los latinos nominados al Premio Roberto Clemente: el cubano José Abreu de los Medias Blancas; el venezolano José Altuve de los Astros ...,0,0
Nice Astros,0,1
Soon. #Astros @Astros #VerlanderDay pic.twitter.com/FvKIf1fqVv,0,1
Astros ' Evan Gattis to begin rehab assignment Wednesday http:// ift.tt/2gIXgJk,1,1
I saw his penis once,0,0
Astros ' Evan Gattis to begin rehab assignment Wednesday http:// ift.tt/2gIXgJk,3,20
Justin Verlander makes his Astros debut tonight. He has a 2.06 ERA since July 30 4th-best in MLB in that span,0,0
what's astros twt page ?,0,1
Haha I would imagine so.. the living room looked empty the last I walked through it,1,1
I know but the Astros think this move will help them get past Cleveland and it wont,0,1
Y sí los astros habían estado demasiado a nuestro favor...suddenly...,0,0
Happy Verlander Day!!! @adamclanton @JaysonBraddock @MC790 @RealSeanJones #Astros,1,0
It feels empty here at the house lmao,0,0
For future reference... @Indians pic.twitter.com/XnaKWyiRDB,0,2
You say they are the deepest team but you're currently experiencing the effects of not being deep.,0,0
Astros ' Evan Gattis to begin rehab assignment Wednesday http:// ift.tt/2eCjUyR,1,1
term for Cubs and Astros ?,0,0
Justin Verlander pitches for the @astros tonight. Insane,0,0
Oh ok,0,0
On root they play every Astros game,0,0
This is a joke Alyson footer needs to stop horsing around and do her homework @Dbacks are on a 11 game winning streak,0,2
no respect for the sneks. Oh well...I prefer to keep off the radar in some ways. The truth is that every team fears us anyways...,0,2
@JustinVerlander on the mound today!!! #Astros,0,0
Is that gonna be televised?,0,0
Happy @JustinVerlander day #Houston @astros,0,2
listen w your astros https://www. youtube.com/watch?v=M6MjRn ntM88 …,0,0
@BrittMcHenry Debut With the Houston Astros,0,0
wireless astros playa,0,3
I am so excited to see #Verlander pitch in an @astros uniform tonight I can hardly stand it. The streak is coming at the right time!!,1,3
The Astros are in it to win it.,0,0
Esta personagem deve ter uma avaria!.. Uma coisa parece "escrita nos astros ": dentro de sete anos Vasco Cordeiro... http:// fb.me/8RHChGxK5,0,0
Free Pick: Seattle Mariners - Houston Astros https:// statwagering.blogabet.com/pick/18120099/ seattle-mariners-houston-astros#.Wa8BFpZpmYQ.twitter …,0,1
Sei GRANDE GRANDE GRANDE @pabloalboran ..... Tanto quanto SATURNO Siempre cerca por muy lejos que estés ASTROS QUE BRILLARÁN SIEMPRE,4,2
Gotta make some @astros grills!! I'd be all over that https:// twitter.com/webergrills/st atus/905158606546448385 …,0,1
Lol in what world did the astros make the trades,0,0
@LAIreland @VeniceMase @BergmanGreg what would be a great World Series dodgers vs Angels Indians astros  Yankees or red soxs,0,0
This is fair when I watch the team this year the difference between the Mets and dodgers/ Astros ? Tolo https:// twitter.com/marccarig/stat us/905158244833923072 …,0,0
A couple? Seriously? It feels like the Sox are tanking intenionally because they have no shot of catching the Indians or Astros ..,0,0
REAL FUN BEGINS! - MLB 17 The Show Astros Franchise @Indians [ALDS gm1]: http:// youtu.be/XkSijTWtuq0?a via @YouTube,0,0
Justin Verlander makes his Astros debut tonight. He has a 2.06 ERA since July 30 4th-best in MLB in that span,68,279
Not liking this one bit. Security cam messing up. Only thing you can see is my Astros flag and just barely. pic.twitter.com/kORxSS9kPc,0,0
Am I a bitch if I still hate the Rockets Astros  and Texans? #HurricaneHarvey #DallasCowboys #TexasRangers #DallasMavericks,0,0
Peak 2017 Astros is Justin Verlander being an Astro.,0,6
Tonight Justin Verlander ( @JustinVerlander ) makes his #Astros debut. Here's what to watch for: http:// scout.com/mlb/astros/Gal lery/-What-to-Watch-for-in-Justin-Verlanders-First-Start-with-the-Ast-106996109 …,2,12
Next on the #3T  @SeanTPendergast and @RichLordSR610 discuss their expectations and hopes for Verlander's debut with the #Astros tonight.,0,1
If Florida is hit hard maybe the Astros organization can return the favor to the Rays if need be... praying that there is no need to.,0,2
Astros ML -160 $$$$$$$$$ Miranda 5.70 ERA against Astros  a full run higher than his ERA against the rest of the AL,0,0
Any chance we borrow Astros field this time around?,0,2
MLB Game Simulator: 10:10 PM EST - Houston Astros vs. Seattle Mariners - SIMULATE THIS GAME NOW: https://www. cappertek.com/xSimulator.asp ?n=99240 …,0,0
Time for the @SSalisburyShow on @SBNation1560. We’ll be talking #Texans  #Astros  college football and more. pic.twitter.com/PTVVP3NIoH,0,0
Time for the @SSalisburyShow on @SBNation1560. We’ll be talking #Texans  #Astros  college football and more. pic.twitter.com/7Zyms2sEub,0,0
Pirates +160 Rockies -175 Rangers +102 Cards -157 Astros -156 Let's Eat,0,0
Cardinals investigated by FBI for hacking Astros  stealing data | Fox News http:// ref.gl/a6QqJzVg,0,0
En la MUD deben leer los astros pic.twitter.com/GJsWM27UMn,0,0
Justin Verlander pitches for the Houston Astros today. Incredible.,0,9
Russians'd do it first. American astros tend to be pretty straight-laced but prob wouldn't report it. That being said there's no still,0,0
Yeah he told me that. He said I never use it but yes that's me.,0,1
Tudo culpa dos astros essa porra,0,0
Is that what the Astros did? Firing scouts,0,0
Wouldn't today be a great time to try MERICA Bourbon Whiskey? With hot #dancers plus #Astros at 9pm? #Houston #HoustonStrong pic.twitter.com/zjNvJVy3Ut,0,0
I would guess it's an Astros fan but it wasn't written in crayon so I'm stumped.,1,30
I feel like there might be a lot of Jays fans joining in the fun.,1,3
From @ryanfagan Justin Verlander makes Astros debut Tuesday but his presence is already felt http://www. sportingnews.com/mlb/news/houst on-astros-justin-verlander-detroit-tigers-debut-seattle-mariners-playoffs-trade-rumors-deadline/1u51r0bmnwcj012ixnsbzymi77 …,0,1
Justin Verlander makes Astros debut Tuesday but his presence http:// sport24top.com/?p=154728 #sport #news #football #tennis #basket #live #stream,0,0
Baseball #MLB is a fraternity of players all over the globe. Praying for those in the path of #Irma #Astros,47,411
Astros .,0,0
lol I can dig it. Miranda has horrible numbers against Astros although they beat Astros in July during his start. But it took a lot of runs,0,1
Soñé que los Astros ganaban la Serie Mundial.,0,0
Justin Verlander makes Astros debut Tuesday but his presence is already felt http://www. sportingnews.com/mlb/news/houst on-astros-justin-verlander-detroit-tigers-debut-seattle-mariners-playoffs-trade-rumors-deadline/1u51r0bmnwcj012ixnsbzymi77 …,0,1
Genio te escuche!! Quiero estar el 26 en el Astros !! Como hago??,0,0
NBC Sports - HardballTalk: Justin Verlander to make his Astros debut tonight http:// mlb.nbcsports.com/2017/09/05/jus tin-verlander-to-make-his-astros-debut-tonight/ …,0,0
Justin Verlander spent his first game in the Astros ' dugout making his teammates laugh. Tonight he makes his debut. http:// bit.ly/2w3SSqk pic.twitter.com/DpuHObt44E,5,7
Tonight Justin Verlander will make his Astros debut Houston Astros vs Seattle Mariners,0,1
Just forgot about the @Dbacks 11 game win streak? Okay MLB we see you pic.twitter.com/oK7L6g831W,0,2
#Kenneth Giles since the All Star Break- 21.1 IP 33 K 0.84 ERA 0.703 WHIP 13.9 K/9 #astros,0,1
Should lead to at least 3 good years.,0,0
Astros Make Return to Houston Looking to Help in Hurricane’s Wake The Houston Astros ’ doubleheader against the Ne… https:// buff.ly/2iSVkij,0,0
Adriana Azzi revela qué le deparan los astros esta semana http:// bit.ly/2xHvj8K pic.twitter.com/iBt8t78X6y,1,1
Colombia le gana a Brazil esta tarde xq los astros se confabulan a nuestro favor. No duden así será @AndGomezSuarez @artemisa_88,0,0
"Instant Fantasy Baseball Reaction: Justin Verlander's stock rises a little more with trade to the Astros http:// allexpressnews.com ",1,1
Justin Verlander makes Astros debut Tuesday but his presence is already felt | MLB - http:// sportmacro.com/2017/09/05/jus tin-verlander-makes-astros-debut-tuesday-but-his-presence-is-already-felt-mlb/ …,0,0
9/5/71 #Astros J.R. Richard makes his debut and strikes out 15 #SFGiants to tie a record set by Karl Spooner in 1954. pic.twitter.com/w68lJNPbHH,4,10
Soon...more like #swoon,0,2
oh like Cubs and Astros ?,0,1
#LosMarineros continúan su serie con los Astros . Ariel Miranda 7:10 p.m. PT Previa http:// atmlb.com/2f0NXB5 pic.twitter.com/SUDrkJosLK,0,0
Can we all band together and agree to stop referring to the Astros as the "Stros?" 'Cause this nonsense is keeping me up at night.,0,8
@HumoCardenal8 no es @SantaFe el q juega ni colombia tiene un DT como el q tiene el leon. Aqui solo vale q los astros estén alineados,0,0
We had a great wknd at the Astros /Mets series. It was a quick vacation w/ a lot of memories. 3 wins+Verlander+emotional return to Houston. pic.twitter.com/lb0wG573rT,0,8
@JDMartinez14 was straight up released by the Astros . Since then straight up killing the game. #oppotaco20rowsup #4tanks1game,43,149
Tonight the Justin Verlander #Astros era begins.... https:// twitter.com/astros/status/ 905137135732346881 …,0,0
Justin Verlander makes Astros debut Tuesday but his presence is already felt | MLB http://www. fleekist.com/justin-verland er-makes-astros-debut-tuesday-but-his-presence-is-already-felt-mlb/ … pic.twitter.com/nv0amXQ6eS,0,0
Justin Verlander makes Astros debut Tuesday but his presence is already felt | MLB http://www. fleekist.com/justin-verland er-makes-astros-debut-tuesday-but-his-presence-is-already-felt-mlb/ … pic.twitter.com/5u7mLMDRrJ,0,0
Cuando los astros se alineen sacaré mi tarot mágico sólo para ti,0,0
Updated World Series Odds @5Dimes #Dodgers +215 #Astros +490 #Indians +530 #RedSox +730 #Cubs +750 #Nats +800 #Yankees +1600 #DBacks +2350 pic.twitter.com/k3D9VnMDfZ,12,8
Astros by getting Verlander,0,0
Justin Verlander makes Astros debut Tuesday but his presence is already felt http:// zpr.io/PQX9H,0,0
But But But the #RedSox .... better team without #Pedroia,0,0
Logo eu logo as minhas balizas que só dão certo em dias raros quando os astros estão a favor os deuses estão de bom humor e eu tô de boa dms,0,0
If the Astros could win consistently without scouts-which they could not-but IF they could would it be ethical to do so?,1,1
Verlander makes debut with Astros on http:// MLB.TV Sent with @MLB At Bat??? http:// mlb.com/r/article?ymd= 20170904&content_id=252472746&vkey=news_mlb&c_id=mlb …,0,0
Can't they send them to the bullpen? That's what the Astros did with their wild Fiers.,0,0