
Will Rogers Elementary here then hs in Sugarland....Dulles! Nice talking to ya fellow Texan! Got your cookbook for bday. Love it!,0,1
about to turn the stream on and now my astros don't work the bad luck continues,0,13
I love it - PFP. #Astros #AgsWin #MLB #EarnIt #GottaBelieve #ThisIsSpecial #backtothebasics @… https://www. instagram.com/p/BXTpRttFpU5/,0,1
Sound like a great deal either way have a great evening #GoAstros,0,1
Can you see Astros claiming him now since they failed at the deadline though?,1,1
Under in the Astros game. Nothing else to tell you.,0,1
I haven't ever seen that show!!!!,0,0
Astros,1,3
,0,1
Nah keep an eye out for starters that get injured on playoff teams though. Unless Astros reconsider him after failing to get Z Britton.,0,0
,0,1
Are you going to the game as well?,0,1
I know... it's calling my name,0,1
Good point! Plus they have the coca-cola seat deal tonight as well... $18 for a drink popcorn hotdog and ticket! #CocaColaValueNight,0,1
The oral history of the @Astros rainbow uniforms http://www. espn.com/mlb/story/_/id /20219881 …,0,0
Yes! Originally I'm from Dallas but I lived in Houston from the age of 9 until college and went to Cy-Fair HS. My mom is still there.,0,1
The #BlueJays take down the #WhiteSox 5-1 in Chicago. Toronto is 51-57 on the season Jays back in action Friday vs. #Astros @FrankDangelo23 pic.twitter.com/9sPbxdv0Hk,0,1
I like this package to get Justin VerUpton & you may throw in Gregerson #Astros JSmith. https:// twitter.com/Mike_Zierlein/ status/892860896179097601 …,0,1
do you think the Astros  Indians Tampa kc or Boston haven't done that? Lol. It's frustrating but it's not exclusive to the NYY,0,3
Still laughing at this one,0,0
I loved it!! You from Houston?,0,0
Evan Gattis? ASTROS !!!!!,0,0
I love all sports & I live in Houston and although I my Cowboys Astros  and Dynamo...my love for @TigresOficial is much greater!,1,4
¿Quieres saber qué tienen los astros para ti? @montillaeddy te lo cuenta de lunes a viernes a las 8 am por #TVES pic.twitter.com/Xnc9sN0Gup,3,1
When it's #Littlesaturday AND $1 hotdogs at the @astros game tonight!! @FeitsBarstool pic.twitter.com/FFfUa04Dlt,0,0
Yessssss!,0,0
Frank Isola on PTI just now: "Pipe down Dallas Keuchel." Can't remember last time I saw #Astros discussed on PTI let alone the 4th item.,2,5
I mean Dallas Keuchel is pretty amazing...,0,0
Justin Verlander to @astros sounds great to me! @jluhnow @blummer27 @SportsTalk790,0,0
Here's tonight's @SaudadesSteaks Starting Lineup for the series finale against the Buies Creek Astros pic.twitter.com/DQyZNZEggF,2,3
Hopefully only a couple days wait and he lands Verlander.,0,0
2017 BOWMAN PLATINUM ORANGE REFRACTOR #'d 02/25 ALEX BREGMAN ASTROS L@@K!!!!!! http:// dlvr.it/PbMsmr pic.twitter.com/lEDKblyeCN,0,0
Por fin los astros se han alineado y nos traen tu vídeo con Skippy,0,1
Out of the big name guys I see leaving its correa. Though to be honest... talk of players leaving is 1 way too early & 2 real sad Lol,0,0
I'm not sure this year around. The astros have such a complete team this year compared to lasts,0,0
...doable! For sure... I could go to a game then a late showing afterwards!,0,0
Hi @OrbitAstros ! I hope you can stop by the @BabiesBaseball section on August 22nd when the #Astros play the #Nationals ! #BaseballForBabies,0,1
José Altuve quiere llegar a la Serie Mundial con los Astros http:// dlvr.it/PbMrW3 pic.twitter.com/9U3NXVP3Iq,0,0
well verlander just went on waivers. still time to make a move,0,0
Good idea I'm leaning towards the @astros ! Just love my team.,0,1
Yeah I think astros make a lot of sense just not sure if they would their top prospects for Verlander,0,0
Those are all wonderful ideas!,0,1
Parlay of the Day @Rockies (Chatwood) & @astros (Keuchel) Risk: 1u Return: 2.5u YTD: 24-35-1 & +3.7u #MLB #parlay #Cash,0,0
Oooh #60 on the Astros #caliente,0,1
Longoria bateó la escalera https:// goo.gl/vVo6Fg #astros #mlb #rays,0,0
Hahaha girl! I'm supposed to have a date tonight... but not sure this guy really likes baseball...so we shall see #baseballfanforlife,0,1
i'm gonna be watching astros predebut vids dm me if u need me,0,6
Not to say they won't make a move but my guess is even clubhouse concerns will have minimal sway on FO.,0,0
Feel the @astros rainbow uniforms - The oral history of the Astros ' rainbow uniforms http://www. espn.com/mlb/story/_/id /20219881 … #rainbowuniforms #Astros,0,0
I have two. Princeton upsets UCLA in the 1996 NCAA tourney and Kerry Woods strikes out 20 Astros in 2008. Also at Buehrle's perfect game.,0,0
Saw Astros prospect Kyle Tucker's candy swing live from the box pic.twitter.com/yDpeYHrfnk,0,0
The Tigers' performance against the Astros and Yankees has brought me some life.,0,2
Fair enough just think if he feels he's got the best chance to be a winner here that will keep him here,0,0
Idk. He seems as dogmatic to his plan as anyone. For better or worse. Hell they printed up "process" shirts.,0,0
,0,0
,0,0
I saw it and absolutely loved it!,0,0
Can't wait for that,0,1
Binge watch Ozark!!,0,1
Yes they are!,0,1
,0,2
But but but there are tickets for sale for tonight online,0,1
That may be something the negotiating clubs and Verlander could amend but that's currently how the option reads.,0,0
There's a story about the #Astros ' Burger King uniforms? Oh this will be an exciting read indeed! Thanks Uniform Columnist! https:// twitter.com/UniWatch/statu s/892797274279075840 …,0,1
The game is fast approaching! Make sure you #StepUptothePlate and purchase your tickets for the @astros vs @Nationals game on August 22nd! pic.twitter.com/fY5OC4LYoy,1,1
Oh from what Keuchel said & their general demeanour they're hugely disappointed but I don't think our management is the appeasing type.,0,0
No. If Verlander finishes in the top-five in AL Cy Young voting in 2019 the option automatically triggers.,0,0
1981 Topps Stickers #173 Nolan Ryan * ASTROS * #HoustonAstros http://www. ebay.com/itm/1981-Topps -Stickers-173-Nolan-Ryan-ASTROS-/162604714614?roken=cUgayN&soutkn=AbMbJh … pic.twitter.com/OmL17ZnuKX,2,1
Speaking of idk why people think keuchel is gonna leave,0,0
Enter @astros https:// twitter.com/jcrasnick/stat us/892852324455993344 …,1,0
Still wouldn't be surprised to see Astros take a shot,0,0
Get verlander. #Astros,0,1
Let's hope the Astros will take him. :),0,1
Blue Jays take the series 2-1 against the White Sox. Next Stop? HOUSTON! Blue Jays vs. Astros Friday Saturday and Sunday #LetsRISE,0,3
En algún momento los astros se alinearon para que Daddy Yankee hiciera una colaboración con Snoop Dogg. Nomás digo.,1,1
How does the surprisingly quiet trade deadline affect the Houston Astros ? - http:// isportsweb.com (blog) http:// dlvr.it/PbMnNj,0,0
Hello Astros !!! Pick him up PLEASE!!,0,0
Come on Astros https:// twitter.com/jcrasnick/stat us/892852324455993344 …,0,1
astros cover of view,0,3
Not that I think he won't make a move but I think he's proven he won't be goaded by media or fans into something outside his framework.,0,0
If a salary dump (+low-value prospects) Cubs could work. If they eat salary & want prospects... Astros ? If they want BOTH...nobody.,0,0
El viernes necesito que todos lo astros se alineen y tenga mi día ojalá jaja,0,0
If and it's a massive if the jays can win the series at the Astros  then that could signal a little intent for a run at the WC #BlueJays,0,1
Writing a blog on Friday about the Dodgers and Astros .,0,0
Bottom line it comes down to crane,0,0
I think he was very honest and said what alot of fans were thinking. I'm not mad at him at all.,3,5
I don't think they will. The club's been clear that it is what it is.,0,0
Exclusiva: 'Putita' de Babasónicos al son cumbiero de Astros de Mendoza http:// bit.ly/2hoc2p0 pic.twitter.com/nts4Tea20A,1,1
any sugar daddies out there wanna buy me this astros jersey,0,0
Ballgame! #BlueJays win! Now they rest before taking on the #Astros . Will Aoki play? Who will be the back-up catcher? Will Liriano win?,0,2
The Yankees HAD to improve!!! The Astros are still better unless the injury bug continues to bite...,0,0
Thank god Keuchel said he was annoyed at the lack of moves from the Astros .,1,1
Astros going to work on controlling the running game before optional bp. pic.twitter.com/q5WTeNXj6W,16,121
@RobertoOsuna1 picks up the save and the @BlueJays defeat the @whitesox 5 to 1 and the blue jays win the series and play the astros next,1,2
#BlueJays take the series against the White Sox. Next up: #Astros on Aug. 4. https:// twitter.com/BlueJays/statu s/892859297796734976 …,0,1
I'm an Astros & Cowboys fan. You ain't alone.,0,1
No it automatically vests if Verlander meets the previously-mentioned standard.,0,1
Dallas Keuchel unhappy with Astros quiet trade deadline http://www. yardbarker.com/mlb/articles/d allas_keuchel_unhappy_with_astros_quiet_trade_deadline/s1_12680_24453370 … pic.twitter.com/9gJ7z0Ex14,0,0
Astros obviously not going to claim him because of that contract. He'll pass through tho..,0,0
MLB Rays/ Astros F5 o4.5 3u (-115) #wrightpicks,3,10
Astros should go all in!,1,1
We’ve got a pitcher-mascot beef brewing between the Rays’ Chris Archer and the Astros ’ Orbit. [Houst http:// deadspin.com/1797463712?utm _medium=sharefromsite&utm_source=Deadspin_twitter … via @deadspin,0,1
Right. Which is why I think the Yankees will claim him just to keep him from going to the Astros .,0,0
No way in the world would Verlander accept a trade to the Nats I see Cubs Astros or Dodgers that's about it.,0,1
I know it isn't 2010-2011 but the Astros get him............. https:// twitter.com/jcrasnick/stat us/892852324455993344 …,0,1
THIS is what I was referring to. As I said he has the fewest TOTAL strikeouts on the team. Percentage rate is a different story. #Astros pic.twitter.com/MUEz6oLZOv,0,0
1983 Topps #361 Nolan Ryan SV * METS ASTROS * #NewYorkMets http://www. ebay.com/itm/1983-Topps -361-Nolan-Ryan-SV-METS-ASTROS-/162604714609?roken=cUgayN&soutkn=b9g3LI … pic.twitter.com/hgHaqzQmJi,2,2
The risk is on the Astros not the Tigers. Tigers can pull him back. If Astros claim him and Tigers decide to let him go the Astros are on,0,0
#astros http:// bleacherreport.com/articles/27253 43 …,0,0
Increible!!..... Los 2 nombres empiezan con N!!! Los astros estan alineados!!,1,6
I thought the Astros had the choice to pick up that option?,0,0
I know how these waivers work. Just noodling in why the Ms wouldn't claim him to block a potential trade to the Astros .,0,0
http:// ift.tt/2vulMUW Astros mascot Orbit escalates 'war' with Chris Archer #SportsTap,0,0
http:// ift.tt/2wmrG6S Astros mascot Orbit escalates 'war' with Chris Archer #SportsTap,0,0
Thanks @kidkeuchy for showing there is no crying but there is whining in baseball. @astros @AstrosRadioMLB @MLB_PLAYERS,0,0
WAIVER DEALS ARE TRICKY HOUSTON NEEDS A GOOD STARTER WOULD NOT SHOCK ME TO SEE JV END UP WITH THE ASTROS,0,0
OS ASTROS NAO MENTEM (só quando eu quero),0,0
MLB Game Simulator: 8:10 PM EST - Tampa Bay Rays vs. Houston Astros - SIMULATE THIS GAME NOW: https://www. cappertek.com/xSimulator.asp ?n=97628 …,0,0
Escribir por ejemplo: "La noche está estrellada y tiritan azules los astros  a lo lejos".,1,2
@HoustonTexans Astros in Series. Texans in Bowl. That would be my kind of year!,0,0
@ATTTPanama donde están los astros de la nasa qué pasa en Albrook,0,0
It's crane's money tho lol and those young guys in arbitration years ain't gonna be happy bout the old man comin in and gettin so much money,0,1
Maybe but that wasn't the point. The Astros have no say on whether the 2020 option is declined.,0,1
Also I don't drive a Mazda.,0,2
@EWPod maybe Nolan Ryan made the @astros and @Rangers fight for his soul and that's why they hate each other,0,0
Every time he does something bad happens Made one abt Texans--Schaub imploded Astros --choked against KC Today--Fuller breaks collarbone,0,0
3 units Giants (-136) 2 units Astros (-192) 2 units Rangers (-111),1,1
@TonyReali Astros the team that gave away JD D Santana Villiar and JD Phillips sure damn good for dumping ALOT of good players,0,0
I thought @willmoriarty86 was going to corpus,0,2
It's hard being a Houstonian who loves his Rockets Astros  and Dynamo... but loves the Cowboys. It reminds me of when I was a kid...,0,0
Siiii me gusta la obscuridad....siiii puedo ver las estrellas y los astros . Que buena sos vidalita me llenas de fe y alegria. :):):) https:// twitter.com/24samuel1S/sta tus/892852776358825984 …,0,0
'nother 'w' not gonna be tonite. Rookie Pruitt and LH ace on mound for Astros . Can we say 'nother blowout.,0,0
Astros didn't have to improve to be the same team that's kicked the Yankees ass all year! Did you faceroll your keyboard to come up w/ this?,0,0
The Astros seem like the kind of team to buy low on Brett Anderson right now. "Look Dallas! We brought you help!",0,1
there's literally an american baseball called the astros but with an S. y'all need to wear their hats and jerseys https:// twitter.com/offclastro/sta tus/892787090110398464 …,0,0
The oral history of the @Astros ' rainbow uniforms – via @espn http:// buff.ly/2honFwd pic.twitter.com/mRtnS2ChN1,0,3
I think they shorten the game which gives Astros Starters better chance of winning. We won't be scoring 15 runs/game in playoffs,0,0
José Altuve cerró julio con un histórico .485 de promedio de bateo #Astros #MLB http:// ow.ly/GFwL30e61fN,4,5
O seu relógio é o sol Seu calendário é a posição dos astros no mar sideral,1,1
José Altuve piensa en llegar a la Serie Mundial con #Astros http:// bit.ly/2f7Qwnr pic.twitter.com/vaREZbyVEw,0,4
Focusing all your attention on O's didn't seem to be wise given reports owner was gonna be cunty w haul hoping to receive,0,0
This Astros jersey cake is awesome plus check out that old A Fistful of Soul 'Save the Dome' shirt! http:// fb.me/40d5pIu6G,0,0
Astros will be the last AL team. He will go through AL first and then NL.,0,1
Not if he finishes in the top-five in AL Cy Young Award voting in 2019.,0,1
No es la verdad absoluta pero los astros estan ahi la gente cree en entidades q ni siquiera se ven y ya ves tu :/,0,0
great point - forgot Choo isn't a FA. I mean the Astros make it work keep all/make Gallo a Marwin of sorts rotate 3B/1B/COF/DH?,0,0
If Astros were totally cashing in chips for maximum value they would trade Marwin and Jake this winter to fill critical pitching upgrades,0,1
Anyone the highlights so I don't have to hear Josh's voice?,0,1
- vas a rendir? + yo sigo los consejos de los astros - y qué te dicen? https:// twitter.com/WaldoCasal/sta tus/892100137270554624 …,0,1
#MLB #GrandesLigas Es Agosto y ya estamos hablando #Dodgers vs #Astros en #SerieMundial ? Un poco temprano o realidad ?,0,0
For fans of the Astros and Nats it should be however.,0,0
I hope the Astros at least look into Verlander!,0,0
2* Parlay: Astros + Brewers. 2 wins 3.78 units,0,0
He'll be wearing an Astros uniform by the end of next week I guarantee it,0,1
Astros you need starting pitching here you go! https:// twitter.com/Doug_Rush/stat us/892855559812239361 …,0,0
Absolutely. And when you hear your #2 is going back to DL and sit on your hands that's really bad on Luhnow's part.,1,2
Good game to be at with good cheap dogs and @kidkeuchy pitching. Too bad I'm out in the heat marching for band #KeuchelDay #KeuchelsKorner,0,0
any deals n works w/ waiver players? @astros @KevinEsch1 @MikeStanton29,0,0
I really want a new Astros jersey/shirt!,0,2
And apparently Astros are the last team on the list that can claim Verlander?,0,5
Astros you know what to do! https:// twitter.com/_TheSportsTalk /status/892856248894402560 …,0,5
This is kinda an idiotic tweet. You think this current Astros team can't win any given series as is? https:// twitter.com/rocka71/status /892852550399139842 …,0,2
I think #Astros should go claim him https:// twitter.com/jcrasnick/stat us/892852324455993344 …,0,0
É os astros da Marago é os menino do Fiel,0,0
Gawd I pray they don't send him back,0,0
Verlander put on "revocable" waivers today. #Astros ?,0,1
Verlander on waivers,0,0
El as de Houston Dallas Keuchel optimista con los Astros pese a que no consiguió buenas adiciones http:// fb.me/8UIZMoE5p,0,0
He's no David Price that's for sure,0,0
Rays vs. Astros Lineups 8/2/17: http://www. palaceofsports.com/fantasy1/rays- vs-astros-lineups-8217 … #MLB #Rays #Astros,0,0
Rays vs. Astros Lineups 8/2/17: http://www. palaceofsports.com/fantasy1/rays- vs-astros-lineups-8217 … #MLB #Rays #Astros,0,0
Rays vs. Astros Lineups 8/2/17: http://www. palaceofsports.com/fantasy1/rays- vs-astros-lineups-8217 … #MLB #Rays #Astros,0,0
Don't miss: "The exclusive untold story behind the Houston #Astros ' rainbow uniform" (via Paul Lukas @UniWatch ) #MLB http://www. espn.com/mlb/story/_/id /20219881/the-history-houston-iconic-rainbow-uniforms-story-worth-telling …,11,14
Thinking out loud would a team like the Mariners claim him to block the Astros knowing that JV wouldn't accept going to Seattle?,0,0
Marwin's been my favorite Astro since we got him. I knew he was something special from the start. He just needed a chance to play & prove it,0,0
[Shi Davidi] #BlueJays and #Astros deal for @liriano47 is pending a physical. Sounds like an... http:// baseball.seventeaswithmilk.com/site/houston-a stros/1702489/ … #astros,0,0
As an Astros fan I want the dodgers or nats in the big series like our odds tiny bit better against Washington tho,0,1
El as Houston Dallas Keuchel optimista con Astros pese a que no consiguió buenas adiciones http:// armariolibre.com.do/site/index.php /deportes/item/30583-el-as-de-houston-dallas-keuchel-optimista-con-los-astros-pese-a-que-no-consiguio-buenas-adiciones … vía @@armariolibrecom,0,0
@astros GET TO WORK DAMNIT!!!,0,1
Who will be the most impactful player for the Astros for the rest of the season? #AskTheExperts,0,0
@astros Prayers for Springer Correa and all on the D.L. Prayers for the safety of all the team. We love wins but want these guys well.,0,0
@adamclanton verlander just got put on revocable waivers could the Astros possibly snatch him up?,0,0
Hmmmm,0,0
Yo también soy sagitario! :D y yo tampoco tengo dinero! :D Los astros funcionan!!!,0,1
Keuchel comments aside do you really think any trades will improve our chances if the rotation isn't healthy.,0,0
Checked in @Minute Maid Park for the #rays vs #astros game w/ http:// MLB.com,0,1
@DirtAndSprague The Astros don't want to give up their prospects in case Altuve Springer Correia etc. all leave in the coming seasons.,0,0
28. Astros don't make impact trades...,1,1
8/2 Braves ML (+160) (1U) Royals ML (+120) (2U) Red Sox ML (-117) (2U) Astros ML (-200) (5U),0,1
26 anos jogando em um dos melhores do mundo e com dois astros do lado. Foi buscar o protagonismo individualidade entendo mas não concordo,0,0
LA DESHONESTIDAD Y LOS ASTROS https:// rubenjungbluth.wordpress.com/2017/06/26/la- deshonestidad-y-los-astros/ … vía @rubenjungbluth,1,1
Cuando el encanto de una mujer radica en su sonrisa hasta los astros le rinden pleitesía por iluminar el mundo de forma natural.,11,74
Babasónicos Antonio Fargas Teatro Astros 1994 @babasonicos pic.twitter.com/T3DlYOoeiI,5,14
They're Houston Astros fans! https:// twitter.com/astros/status/ 892814775775666176 …,0,0
ICYMI @Astros GM @JeffLuhnow Joined The @JoshInnesShow This Morning to Talk Post-Trade Deadline http:// sports790.iheart.com/content/2017-0 8-02-jeff-luhnow-talks-missed-trade-opportunities-on-790/ …,0,5
Gotta go for Verlander if you're the Astros . After Keuchel's comments yesterday the front office needs to show the players that they care,0,4
"Some people loved it others hated [it] but nobody could ignore it." A history of the @astros rainbow uniform. http://www. espn.com/mlb/story/_/id /20219881/the-history-houston-iconic-rainbow-uniforms-story-worth-telling …,1,11
Astros,0,0
Agree. I get the other point of view but I'm glad he said it.,0,1
4 Astros vs Blue Jays Sec 118 Right behind home plate (Houston) $600 http:// ift.tt/2ul6vk2 #astrostickets,0,0
ASTROS VS TAMPA BAY RAYS (Minute Maid Park) $150 http:// ift.tt/2ukGIsu #astrostickets,0,0
Houston Astros tickets tonight Tampa Bay Rays easy pick up (Row 4 aisle) $45 http:// ift.tt/2u5iszf #astrostickets,0,0
i think it's astros or nothing like last time it was cubs or nothing,0,0
The public is backing the #Astros (Keuchel) but the sharp money is on the #Rays (Pruitt). #MLB #TBvsHOU,0,2
eu e vc nossos brothers litrão de 5 conto porção d buteco terminando nte bebados cntndo e contndo hstrs na rua olhando os astros vamo?,0,0
This is good news I guess. The #Astros need Springer back ASAP. Not a knock on @defish21 . Springer is an MVP candidate. @MLBNetwork https:// twitter.com/JuliaMorales/s tatus/892851084338671616 …,0,0
Grinds my gears. Texans -> rockets -> Astros . As it should be,1,2
If it ain't The Astros I don't want to hear about it dude is poised to get back to WS and win a ring! https:// twitter.com/jcrasnick/stat us/892852324455993344 …,0,0
SO MUCH THIS. #Astros https:// twitter.com/AdamAllred/sta tus/892849950085787648 …,0,3
• Astros -1.5 (+100),3,29
On my way to Minute Maid park,0,0
#CapsOffToBagwell @CocaCola @astros pic.twitter.com/CVXSroHpAF,0,2
Pergunta honesta: o povo da terra plana acha q a lua é plana tbem? Essa coisa de ser plana se estende aos outros astros bola?,0,0
Fui al de Astros  recién en junio pero quizá era otro dibujito y no yo. ¡Saludos! :),0,0
I wonder if the Astros would be willing to trade for Verlander after Keuchel's comments yesterday.,3,9
#CapsOffToBagwell @CocaCola @astros pic.twitter.com/LERo2uiGb9,0,0
It's basically between the Cubs Astros  and Dodgers for that title,0,0
@astros you know what to do. https:// twitter.com/jcrasnick/stat us/892852324455993344 …,0,0
Pero macaneo a los Tomateros en la serie de repesca jajajajaj,0,0
Keuchel comeback tonight? #Astros #MLB #DFS #DraftKings #FanDuel,1,4
#Astros http:// bleacherreport.com/articles/27244 25-5-impact-trades-that-can-still-be-made-after-mlb-trade-deadline …,1,1
Sí mi pene topa con el asiento del inodoro ¿Que dicen los astros al respecto?,0,0
Hinch said he didn't have much of a reaction to Keuchel's comments. #Astros have an expressive team. Trade deadline is over.,6,26
#GattisStat With the departure of Nori Aoki Evan Gattis now has the fewest strikeouts on the team at 41 in 259 plate appearances #Astros,0,0
Tus ojos son preciosos son como dos astros en la obscuridad bellisimos como tu,0,1
I agree with this take. Fans thought it. They WANT their star players to agree with their frustration.,0,1
Se alinearon los astros .,0,0
Hey Al Avila. There's a call on Line 1. It's Jeff Luhnow and the Astros . https:// twitter.com/jcrasnick/stat us/892852324455993344 …,0,5
#ParleyAbierto #FreePicks #2Jul #MLB #Royals #Indians #Astros #Angels #ConstituyenteFraudulenta #FelizMiercoles,1,0
Do it Astros ! Make Kuechel proud.,1,8
He is one guy on the Astros  sounds a little afraid that his team didn't improve and the Yankees did,0,1
If I am a competing team I would place the claim just to make sure the Astros DON'T get him. The Tigers can then trade to that team...,0,0
Did the #astros hit a double last night?,0,0
Bourjos in the leadoff spot tonight for #Rays v #Astros Corey Dickerson 5-for-19 this year against HOU is in the 7 spot. pic.twitter.com/ynfoc40amc,0,0
Don't hold your breath #Astros fans. https:// twitter.com/jcrasnick/stat us/892852740677750784 …,0,5
Aaron on the new Wave with the astros . His hat is fire https:// twitter.com/astros/status/ 892814775775666176 …,0,2
. @astros did everything it could last night but what about the fans? http:// bit.ly/2u55YaB,2,2
#Astros @astros lineup posted for 08/02/2017 at 8:10 PM ET #MLBLineups #FantasyBaseball http:// mlbstartinglineups.com,0,0
If the Astros are up for it...I'll send along 18 million with JV for Whitley and Fisher,0,1