
It's becoming an all-out war. pic.twitter.com/xI8ToArU7X,432,1195
Only reason I'd ever come to an Astros game alone. @kidkeuchy pic.twitter.com/cSIVyHZEZ9,1,6
The untold story of the Astros ' rainbow uniforms http://www. espn.com/mlb/story/_/id /20219881 …,0,0
Astros wouldn't claim that contract.,0,1
Yuli I love you!!,0,0
Se han alineado todos los astros y los planetas,0,1
Valdez eyes rebound in opener vs. Astros http:// dld.bz/fXTuj,0,0
#Astros Gettin ready. Gonna kill em all tonight!! Need a win... pic.twitter.com/sVDQA2z9Fv,0,0
No rain delay?,0,2
Picks for tonight: LA Angels (-182) Houston Astros (-238) Texas Rangers (-125) Time to go big *Numbers via Oddsshark,0,0
8/2 MLB Plays: Brewers -111 Rays/ Astros Over 8.5 Rockies -132 Mets/Rockies Over 12.5 #mlbpicks #sportsbetting #freepicks #swagbookkc,1,0
I've been an astros fan my whole life and a dodgers fan for 5 years and I didn't think they would be the 2 best teams in the MLB lol,0,1
It's becoming an all-out war. pic.twitter.com/xI8ToArU7X,432,1195
The Astros are about to start.,0,4
Loved this! The untold story of the Astros ' rainbow uniforms http://www. espn.com/mlb/story/_/id /20219881 …,0,1
Um imã natural pra pessoas de peixes. Que isso astros ?,0,0
Get a ROOF! Go @astros !!! pic.twitter.com/UQbDiV6g7E,0,0
Dallas Keuchel Calls Astros Lack of Activity at Trade Deadline 'Disappointment' http:// bleacherreport.com/articles/27251 48-dallas-keuchel-calls-astros-lack-of-activity-at-trade-deadline-disappointment …,0,0
Yes Gary. Astros pregame - Drinking an U-P-G-R-A-Y-E-D-D by @B52Brewing at @conservatoryhtx — http:// untp.beer/s/c486003403 #photo,0,0
The untold story of the Astros ' rainbow uniforms http:// dlvr.it/PbNzMR pic.twitter.com/FgvLg2a8bS,0,0
Stop taking marwin Gonzalez out of the lineup he is in there tonight and needs to be in there for the rest of the year!! @astros,0,0
Watching Astros hoping for a Liriano sighting You?,0,2
Marwin González es la "navaja suiza" de Astros http:// dlvr.it/PbNz8T pic.twitter.com/OZZynBo6fs,0,0
Marwin González es la "navaja suiza" de Astros http:// dlvr.it/PbNz82 pic.twitter.com/luCWLWjbam,0,0
,0,1
The untold story of the Astros ' rainbow uniforms http:// dlvr.it/PbNyk9 pic.twitter.com/uRbjT9wHsY,0,0
Florida Midday Minute: Marlins can takes series from Nats; Rays face Astros ace http:// tinyurl.com/ybvo8hpb,0,0
Ready for some Astros Baseball! #KeuchelDay #EarnIt,0,0
ATTENTION #BASEBALLFANS ! We are giving away 2 #FREEtickets to the Houston #Astros vs Texas… https://www. instagram.com/p/BXT3eJmhk1B/,0,1
LET'S GO #Astros pic.twitter.com/Kf2IKc1iYL,0,0
Astros may be better off targeting relief pitching at the deadline https:// climbingtalshill.com/2017/07/22/ast ros-may-better-off-targeting-relief-pitching-deadline/ …,0,0
Where this "Little Boss" stuff come from? First I've seen it.,0,0
Hahaha!,0,1
pic.twitter.com/9ZcK0gbNc8,0,2
What happens if he is not claimed? Can a team block a trade if Astros get in trade discusssions? Or do u have to claim to work a trade?,0,1
Dollar hot dog night at the @astros game!! Thanks guys!!! #GoAstros #earnit pic.twitter.com/2gJAmbZVCQ,0,5
Hahaha perfect! Will do.,0,1
Consultei os astros pra tentar entender não foi por acaso te trombar no rolê.,0,0
There was a water balloon fight happening on the field between @OrbitAstros and @ChrisArcher22 ! #Astros,0,4
Chris Archer set up Orbit. #Rays started throwing water balloons at it. Orbit puts on poncho breaks out water gun. #Astros #Bullying,1,10
ラインナップ9人中8人が二桁本塁打wwwww Astros の打線は凄いや。なお投手(RP)陣…,0,0
Mi vieja esta re metida con los astros tipo el lunes va a haber eclipse lunar en acuario te podes calmar susana,0,1
Nice. Enjoy!,0,2
ATS Stats Forecast: TAM 1.5 - HOU 5 - Generated from 18 Previous Games #Rays #Astros,0,0
Houston Astros : What team needs to trade to get Gerrit Cole https:// houseofhouston.com/2017/05/26/hou ston-astros-team-needs-trade-get-gerrit-cole/ …,0,0
The untold story of the Astros ' rainbow uniforms http:// es.pn/2v0RhTe pic.twitter.com/NkCjo7RVP4,0,0
Assessing Astros ' trade needs as baseball's best team faces high cost of title dreams https://www. si.com/mlb/2017/06/21 /houston-astros-trade-rumors …,0,0
2017 Topps Archives Carlos Correa Retro Originals SP! Houston Astros http:// ift.tt/2v0tmDn,0,0
The untold story of the Astros ' rainbow uniforms http:// dlvr.it/PbNwZH pic.twitter.com/csiQ2r83iO,0,0
The untold story of the Astros ' rainbow uniforms http:// dlvr.it/PbNwfj,0,0
The untold story of the Astros ' rainbow uniforms http:// festyy.com/qN7b3t pic.twitter.com/nk6mqYH2ba,0,0
The untold story of the Astros ' rainbow uniforms http:// dlvr.it/PbNwZd,0,0
@el_yuly10 ¡Enhorabuena!,0,0
The untold story of the Astros ' rainbow uniforms http:// dlvr.it/PbNwY2,0,0
AUCTION ENDING NOW! FINAL BIDS Carlos Beltran ASTROS YANKEES autograph baseball COA Memorabilia Lane http://www. ebay.com/itm/Carlos-Bel tran-ASTROS-YANKEES-autograph-baseball-COA-Memorabilia-Lane-/253065223977?roken=cUgayN&soutkn=8sBO7K … via @eBay,0,0
The untold story of the Astros ' rainbow uniforms http:// dlvr.it/PbNwWP,0,0
Watching Astros on the box tonight #Astros,0,0
ummm an Astros player just liked my Astros pic-post on IG. pic.twitter.com/HdpLoKXXNh,0,1
Ready for astros vs rays @minutemaidpark ! pic.twitter.com/TI7unPUJqy,0,0
Going Sunday probably #Astros,1,3
Unfortunately I have to disagree. I'm a fan of Fatbacks… I think they have good names already selected.,0,1
Foi desafiado a participar de um torneio de skate com astros das manobras,0,0
Damn who's going with me to the next astros game I go to,0,1
probably later tonight man i'm sorry ru for late response trying to fix astros,0,1
Sorry in Galveston,0,3
Could we see a Garza trade then? Astros or Red Sox maybe...,0,0
i now have a new favorite Astros player and his name is Carlos Munoz.,0,0
MLB Picks: Astros lead after 5 innings Phillies ML Rangers ML Indians/RedSox U 9.5,0,0
Houston Astros Parking Tickets https:// goo.gl/pihvo6,0,0
"We're nice interlopers. We're not Astros fans for christ's sake." -Me justifying being Mariners fans in the season ticket club,0,2
Acho q o Flamengo deveria estar garimpando mais jovens talentos até por que os nosso astros do time tem média de idade alta.,0,1
consultei os astros pra tentar entender não foi por acaso te trombar no rolê,0,1
you think the Astros have the pitching?,0,0
Absolutely! We did the same stuff with Apollo moon samples and astronauts from the first 3 landings. Astros were quarantined for 3 weeks pic.twitter.com/mTZBBgaQOe,0,1
Springer's that dude. Love the guy #Astros,0,1
@JuliaMorales @MLB @astros,0,0
Bien merecido campeón!,0,0
Astros game with all my coworkers tomorrow,0,3
2-0 on the day with cinci under dodgers under Red Sox under marlins over started! Cubs Astros  giants over yet to start,0,0
#MLB : Red Sox O9.5 Giants O8.5 Rockies O12.5 Brewers -109 Astros RL -120 Rangers -109 (4u each) #TopTierPicks,3,1
The untold story of the Astros ’ rainbow uniforms http:// ift.tt/2vqHgRC,0,0
En el día de hoy se han alineado los astros o como va la cosa?,0,1
Less than the Astros did.,0,0
i'm setting the over/under on number of pitchers the astros claim on waivers slightly below "all of them" https:// twitter.com/pgammo/status/ 892790342092804097 …,0,0
Galera a banda foi selecionada como uma das melhores do #Cervejazul no mês de JULHO! Parabéns aos nossos astros ! #ASM #ROCK #UNDERGROUND,0,0
Cuz he not gonna be here after his FA year plus Astros /Lunhow not gonna throw 80/100mil at him to stay! Money for Altuve Springer etc..,0,0
MIKE FIERS HOUSTON ASTROS SIGNED AUTOGRAPHED 8X10 PHOTO W/COA http:// ift.tt/2wnsdW2,0,0
pic.twitter.com/N4KowTb41Q,0,2
IT'S LIT! @Whataburger @astros pic.twitter.com/Bw7XhsAvXv,0,2
hmm looks like the Tim Beckham trade has vaulted the Orioles into the dodgers/Nationals/ Astros tier as we all knew it would,0,1
Astros do jiu-jítsu Rodolfo Vieira e Malfacine são escalados para o Shooto http:// dlvr.it/PbNtc3 pic.twitter.com/nymWGE8c2m,1,0
Your the beast @el_yuly10,0,1
#MLB August 2nd 2017 Braves +157 Redsox -116 Mariners +101 Astros /A's +1.5 +139,0,1
@jluhnow as a #Astros fan I believe in U guys.Personally if it wasn't Degrom/a g8 bullpen guy I wouldn't B pumped as long it's a fair deal,0,0
@astros @JuliaMorales @blummer27 @RealToddKalas @ATTSportsNetSW Catching a game with my coworkers pic.twitter.com/4a8DMNEOPM,0,1
Astros game tonight!,0,0
Congratulations!! Take us all the way there this year Jose! #TheLittleBoss #Altuve #Astros pic.twitter.com/GwZYnr3Qtb,0,4
MLB 8-2 Astros -1.5 - 3U Brewers ML - 2U,0,1
I'm an Astros ' fan and I LOVE this! Baseball is supposed to be fun! Hell LIFE is supposed to be fun! Hell of a pitcher. Better guy.,0,0
Felicidades! Y suerte!,0,0
Jim Johnson > (Any Astros RP not named Giles/Devo). Time to make a claim.,0,1
so excited for White Sox vs Astros !,0,0
Then look the fk out ....mirrors of the Astros ...possibly better imo,0,1
Very rare I'd agree with you on something relating to the Astros . This is one of those times.,0,2
#Rays new lineup vs #Astros Dickerson LF Plouffe 1B Longoria 3B Morrison DH Raamos C Hechavarria SS Miller 2B Bourjos CF Smith RF Pruitt,0,0
"We did everything we could to get good deals done (by the deadline) for the Houston Astros ..." -J. Luhnow,0,0
As recordações são os únicos belos astros que adornam a noite da velhice,2,1
Pull up. Hop out. Skrt skrt. Gang. #astros https://www. instagram.com/p/BXT1-INldB0/,0,0
Congratulations! Keep it up #Astros pic.twitter.com/A4XjxpuNyM,4,18
#sports #news The untold story of the Astros ' rainbow uniforms http:// dlvr.it/PWVJPq,0,0
Marwin González es la "navaja suiza" de Astros http:// dlvr.it/PbNrXk pic.twitter.com/EX9pBKkQ94,0,0
Getting our keuchel on #keuchelskorner #astros #earnit #houstonastros pic.twitter.com/5noVBpC9FS,0,0
Right now the Dodgers. I want a Dodgers- Astros World Series but it wouldn't surprise me if the Indians won the AL again.,0,0
Astros say no!,0,2
irei colocar a culpa nos astros,0,0
Raining outside. Nice to be inside to see Astros & Rays tonight.,0,0
@astros make @kidkeuchy and everyone happy! Please!!!,1,1
Jeff Luhnow get on the phone RIGHT NOW! #Astros https:// twitter.com/DevontaeJField s/status/892889867545436161 …,0,2
dos días que salgo de trabajar to esmayao y que acabo comiendo gratis los astros se portan de vez en cuando,0,0
MLB | Transmisión En Vivo Directo | Tampa Bay Rays vs Houston Astros | #Baseboll #MLB | http:// sportsbetparlay.com/mlb-transmisio n-en-vivo-directo-tampa-bay-rays-vs-houston-astros-baseboll-mlb-2/ … pic.twitter.com/MXtBVj4Wt6,0,0
Princeton Rays Greeneville Astros and a Royal flush are on the docket http:// notesfromthesally.com/2017/08/02/pri nceton-rays-greeneville-astros-and-a-royal-flush-are-on-the-docket/ …,0,0
MLB | Transmisión En Vivo Directo | Tampa Bay Rays vs Houston Astros | #Baseboll #MLB | http:// sportsbetparlay.com/mlb-transmisio n-en-vivo-directo-tampa-bay-rays-vs-houston-astros-baseboll-mlb-2/ … pic.twitter.com/8e08zNoIv2,0,0
MLB | Transmisión En Vivo Directo | Tampa Bay Rays vs Houston Astros | #Baseboll #MLB | http:// sportsbetparlay.com/mlb-transmisio n-en-vivo-directo-tampa-bay-rays-vs-houston-astros-baseboll-mlb-2/ … pic.twitter.com/xVIVckNTmm,0,0
I know Austin Pruitt is a former UH alum so I apologize but the Astros are boutta light you up,0,2
The oral history of the Astros ’ rainbow uniforms http:// ift.tt/2uXKviM,0,0
pic.twitter.com/ku8VsYsx8d,0,0
Astros game tonight !!,0,0
Rain delay inane chatter alert! Does it bother anyone else the Astros are whining about lack of trade action? They're friggin 15 games up!,0,0
& brillar volar.. sin mas como dos astros en la inmensidad. Nadie mas lucirá como diamantes en… https://www. instagram.com/p/BXT1ndijF6w/,0,0
ML: Rays (+180) at Astros (-200) - Astros with 0.9295 prob of being correct #RaysAtAstros http:// sports.snoozle.net/mlb/prediction s.jsp …,0,0
Rays at Astros OU:9.0 (+105/-125) OVER with 0.5983 prob of being correct #RaysAtAstros http:// sports.snoozle.net/mlb/prediction s.jsp …,0,0
Suspect we'll see Aoki get his first action as a #bluejays in the Astros series. Great career numbers vs. Morton & Fiers.,0,0
The OVER hit yet again last night between the Astros and Rays bringing the streak up to eight straight. http://www. oddsshark.com/mlb/tampa-bay- rays-houston-astros-betting-august-2-2017-762116 … pic.twitter.com/rpPue4Le8n,0,2
Tampa Bay Rays vs. Houston Astros Free MLB Baseball Picks and Predictions 8/3/17: The Tampa… https:// goo.gl/fb/7xwxNT http:// fb.me/8Jon7Jry7,0,0
Tampa Bay Rays vs. Houston Astros Free MLB Baseball Picks and Predictions 8/3/17: The Tampa… https:// goo.gl/fb/7xwxNT,0,0
Let's cash the parlay and get a streak going! #money #blowoutwinner #bookiebashing #RaysUp #astros #MLBPicks #VIPs,0,0
The untold story of the Astros ’ rainbow uniforms https:// sport24top.com/?p=114713 #sport #news #football #tennis #basket #live #stream,0,0
Tech Talk Interview: James from Astros County http:// fb.me/1uVRBAKbQ,0,1
Congratulations to Jose Alllllllllttttttuuuuuuuvvvvveeeeee for AL July POTM as he did some seriously raking at the dish!!!!! @astros #EarnIt https:// twitter.com/mlb/status/892 874978588229634 …,0,0
@KevinRothWx hows the astros game looking delay ppd?,0,0
#JoséAltuve no tuvo rival en julio #MLB #Astros http:// bit.ly/2vqK5lD pic.twitter.com/qkqlYX7MjD,10,8
Grateful for Jays in 30 to catch the @BlueJays win this afternoon. Nice to take the series ahead of the Astros .,0,1
Consultei os astros para entender Lua cheia eu me batizei no mar,0,0
I'm here for you! Just give him this look if he says he doesn't like baseball! pic.twitter.com/kh0FMP69PE,0,1
No hay señal de mis satélites ni de tus astros ...tu pierdes mi rumbo cuando yo pierdo tu rastro https:// youtu.be/5xGqUompVVQ,0,0
Checked in @Minute Maid Park for the #rays vs #astros game w/ http:// MLB.com,0,0
Retweeted Astros de Houston ( @LosAstros ): ¡Felicitamos @JoseAltuve27 por ser nombrado el Jugador del Mes en la... http:// fb.me/xqwKk3To,0,0
#TeamDST is looking forward to watching #DSTathlete & @RaysBaseball RHP @aus13tin start against @astros tonight! #DSTstrong,3,8
Retweeted Astros de Houston ( @LosAstros ): ¡Felicitaciones a @el_yuly10  quien se lleva los honores de Novato del... http:// fb.me/1KpvS3spD,0,0
@RicNHavoc sooo happy for you. You have worked very hard! No one deserves this more! #Astros love from cape cod,0,0
My is full!!! @el_yuly10 is trending Not a rookie but we'll take it! Way to go @astros pic.twitter.com/3JMXmhDgsT,0,2
The guy sounds like a loser if he doesn't like baseball. If it doesn't work out let me know. pic.twitter.com/grihWuOXAN,0,1
Congrats,0,0
Astros game tonight x Dollar Hot Dogs x Keuchel gets his groove back!,0,0
BRUJERÍA ECHARÁN CHINGAZOS EN LA CARPA ASTROS https:// elalebrije.net/2017/08/02/bru jeria-echaran-chingazos-en-la-carpa-astros/ … vía @_ElAlebrije,0,1
Te lo ganaste bien ganado,0,0
Astros 2B Jose Altuve named AL Player of the Month; Yuli Gurriel named AL Rookie of the Month… http:// toplocalnow.com/us/houston/at/ 18#t6474148 …,0,0
Astros y Boston,0,1
Surrounded by #Astros fans in downtown #HTX catch our host @faination tonight at @SecretGroupHTX #GoDodgers https:// twitter.com/faination/stat us/892887465882779650 …,0,1
Says the guy not in the league..,0,1
#Astros #STLCards Yuli Gurriel named A.L. Pitcher of Lib… FACT: Emma Lazarus' The New Colossus,0,0
@ATTSportsNetSW all the way from Temple Tx 2 c @JuliaMorales & the @astros . We need a selfie with @JuliaMorales . Sec153 row 14 seats 21-24!,0,0
@walmer - I'm realizing I should have gone the MiLB marketing route... #eclipsers,0,1
At Astros game sitting in Crawford boxes and Rays fans just sat in front of me. Do I ...,0,0
Missing out shots are flowing now,0,1
Astros ' Jose Altuve selected as American League player of the month http:// dlvr.it/PbNmwm pic.twitter.com/vcUAMCmm2o,0,0
Astros ' Yuli Gurriel selected as American League rookie of the month http:// dlvr.it/PbNmt0 pic.twitter.com/Jf3XvqMcih,0,0
Bringing in @Vince_Marcucci for thoughts on the team name #eclipsers,0,0
Love this new Yankees squad but still can't count out the Astros or the Dodgers. Both Houston and LA are my favorites to win World Series.,0,0
Getting ready to watch the #Rays take on the #Astros by settling into my recliner in my #DJKitty … https://www. instagram.com/p/BXT0gt5l194/,0,1
See you in a minute @astros,0,5
budin amarillo cuentame algo son por menores los astros de un diamante lo dulce de averiguar con el traficante y... http:// fb.me/912ZmP3Ye,0,0
The oral history of the Astros ’ rainbow uniforms http:// ift.tt/2vunDJc,0,0
Marwin González es la "navaja suiza" de Astros http:// dlvr.it/PbNm6G #26Oct pic.twitter.com/uDsq0qbec0,1,0
The oral history of the Astros ' rainbow uniforms http:// dlvr.it/PbNm5V,0,0
Congrats Yuli！,0,0
@fayobserver I hope #eclipsers is still on your radar. I'll fly back to Fayetteville and stay with family if I need to lead a town hall,0,0
Game Thread: Rays at Astros 8:00 PM ET http:// ift.tt/2hpqo8m - Go to the link to find online streams of the event enjoy.,0,0
A win would make Dallas Keuchel the 1st Houston pitcher to ever open a season 10-0 #TBvsHOU #Rays #Astros #MLB,0,0
Tell him to stretch. A couple of swings. Run by hospital for body MRI. Cryogenic stretch good night sleep,0,1
Lobbying @_maddiefrost (artist / lab partner) to consider #eclipsers as a team name and all the mascots of suns and moons.,0,1
Congratulations Yuli!!! pic.twitter.com/su4MwH3xqF,0,8
The oral history of the Astros ' rainbow uniforms http:// dlvr.it/PbNlCh pic.twitter.com/r1foidGkBI,0,0
The oral history of the Astros ' rainbow uniforms http:// dlvr.it/PbNlGK pic.twitter.com/ckOkr6Px1h,0,0
The oral history of the Astros ' rainbow uniforms http:// dlvr.it/PbNlHM,0,0
The oral history of the Astros ' rainbow uniforms http:// dlvr.it/PbNlBG,0,0
Alex Bregman is batting .346 with 11 doubles 4 HRs 9 RBI 25 runs and a 1.095 OPS in his last 22 games #Rays #Astros #TBvsHOU #MLB,6,8
I say go to the @astros game.,0,1
I need to go to a @astros game soon.,1,0
AUCTION ENDING NOW! FINAL BIDS Jed Lowrie Astros A's autograph baseball COA Memorabilia Lane & Promotions http://www. ebay.com/itm/Jed-Lowrie -Astros-A-039-s-autograph-baseball-COA-Memorabilia-Lane-amp-Promotions-/263109201219?roken=cUgayN&soutkn=M6rb4x … via @eBay,0,0
Wonder if Avila is getting a nibble from the #Astros or Brewers? https:// twitter.com/SInow/status/8 92875172780417025 …,0,0
Thank you for being a Stro,0,0
MLB: Giants over 8.5 Astros over 8.5,1,0
Astros .,0,1
Rockies ML Astros -1.5 Brewers ML Mariners ML BOL everyone!!!,1,3
Watch Tampa Bay Rays vs Houston Astros LIVE STREAMING HD FREE MLB BASEBALL http:// pupless.com/watch-tampa-ba y-rays-vs-houston-astros-live-streaming-hd-free-mlb-baseball/ … pic.twitter.com/j7BCOBtDzO,0,0
Dallas Keuchel has an active 11-game winning streak 1 win shy of the all-time Houston record #Rays #Astros #TBvsHOU #MLB,0,0
Marwin González asciende al igual que #Astros http:// bit.ly/2hobsHK pic.twitter.com/ssXH9W3ryW,0,0
We miss you George!,0,1
Go #astros ! About to enjoy another Astros ' win and be able to see my #twingirls sign the… https://www. instagram.com/p/BXT0LM9gEAr/,0,0
Obviously the #Astros should destroy their competition every game but a good comeback and preferably a walk-off would go a long way rt now.,0,0
Astros do jiu-jítsu Rodolfo Vieira e Malfacine são escalados para o Shooto http:// dlvr.it/PbNks4 pic.twitter.com/7v8Kg66NAU,0,0
The oral history of the Astros ' rainbow uniforms http:// bit.ly/2hpwWDW pic.twitter.com/JQBGW4h9Rk,0,0
#madrid #venezuela Marwin González es la "navaja suiza" de Astros http:// dlvr.it/PbNkN9 #venezuela pic.twitter.com/dmXgHxEuMC,0,0
#venezuela #madrid Marwin González es la "navaja suiza" de Astros http:// dlvr.it/PbNkP8 pic.twitter.com/G0RQNAOmWJ,0,0
Marwin González es la "navaja suiza" de Astros http://www. meridiano.com.ve/beisbol/beisbo l-grandes-ligas/159767/marwin-gonzalez-es-la--navaja-suiza--de-astros.html?utm_source=dlvr.it&utm_medium=twitter … pic.twitter.com/BZdkpKs73Q,0,0
Plays today: O's Red Sox Rangers Marlins +1.5 Red Sox Over 9.5 Cardinals Astros -1.5,1,4
Video games and flying. Oh well!,0,2
,0,0
Yuli Gurriel and Paul DeJong named MLB Rookies of the Month: https://www. fanragsports.com/news/yuli-gurr iel-paul-dejong-named-rookies-month/ … #Astros #STLCards,0,1
Yuli Gurriel and Paul DeJong named MLB Rookies of the Month: https://www. fanragsports.com/news/yuli-gurr iel-paul-dejong-named-rookies-month/ … #Astros #STLCards,1,2
Astros are smart padres would have asked for too much and he ain't worth it,0,0
Consultei os astros pra tenta entender não foi por acaso te trombar no role,0,0
Lucas Duda has hit safely in all 5 games since joining Tampa Bay batting .375/.500/1.000 with 1 2B 3 HR & 4 RBI #Rays #Astros #TBvsHOU #MLB,0,2
Yuli Gurriel has 28 doubles which leads all MLB rookies #Rays #Astros #TBvsHOU #MLB,0,0
@astros,0,0
Poor young pitcher about to get his bell rung,0,0
Not there!,0,0
Springer working his way back. pic.twitter.com/ySX47Nv9FV,161,850
Haha but they aren't! I'm all about the cheap seats too!,0,1
Evan Longoria is hitting .361 since the All-Star Break #Rays #Astros #TBvsHOU #MLB,0,0
Tampa Bay has outscored opponents 329-251 (+78) in innings 1-thru-5 but have been outscored 243-168 after that #Rays #Astros #TBvsHOU #MLB,0,0
Hahah thanks Shayne!,0,0
Happy birthday to this man @ConorDavis13 miss those Astros days! Let's hang soon and catch up,0,2
Nothing but respect for ur astros tho.....fun team to watch. See u in the WS,0,0
Cubs Vs. Astros 9/2/09 Wrigley Field – Chicago Picture https:// chicagoinformer.com/424556/cubs-vs -astros-9209-wrigley-field-chicago-picture-30/ … pic.twitter.com/hbptjw2Bsu,0,0
let's make this very clear. i would NEVER request a texans souvenir. just astros .,0,1
Evan Longoria alcanzó el ciclo ante Astros http:// ow.ly/D52q30e73Ji,0,0
NEED,0,0
O Sporting lá vai ser cabeça de série no playoff astros alinhados será desta?,2,2
Rays fans will be treated to a batting practice session tonight to the Astros  performed by Mr Pruitt. #AllAboard,0,2
Omg.,0,0
Astros 2B Jose Altuve named AL Player of the Month; Yuli Gurriel named AL Rookie of the Month http:// htownxchange.com/2017/08/02/ast ros-2b-jose-altuve-named-al-player-of-the-month-yuli-gurriel-named-al-rookie-of-the-month/ …,0,1
@Caring4Everyone,0,0
Finally a weekend to look forward to. Cowboys tomorrow LTC class Saturday and the Astros on Sunday.,0,2
08-02-17 _MLB Pick: 5* Astros -1.5 $600 to win $500 Good luck!!! pic.twitter.com/dlUuXXlN7D,0,0
It's nice to take off my Astros and enjoy the sounds of my game without extra weight on my head. Even if it's not surround sound :p,0,0
The oral history of the Astros ' rainbow uniforms http:// dlvr.it/PbNhCc pic.twitter.com/8NDff33a36,0,0
The oral history of the Astros ' rainbow uniforms http:// es.pn/2hpdlEc #sports #updates pic.twitter.com/CHSDNmt9Ce,0,0
The oral history of the Astros ' rainbow uniforms http:// dlvr.it/PbNgvg pic.twitter.com/MFTcRydxkh,0,0
Nice return today from brief @astros middle infielder Lee Bales. pic.twitter.com/tdgDi2fEVH,0,1
#Astros and Aaron Watson music are two of my favorite things!,0,0
Nope no way. If he don't like them he is not for you girl!,0,1
The oral history of the Astros ' rainbow uniforms http:// ift.tt/2vpixgK,0,0
@astros are you watching this? Different division but quite possibly your WS opponent if you make it. I hope you do!!!,0,0
It's nice that the Astros are playing the Rays right now because that means I get to watch them on the local Fox Sports channel,0,0
Astros dominating awards this year. PitcherOM in April&May. PlayerOM in May. Chilled in June. Now July with Altuve & Yuli & Bags HoF,0,1
Not fully how that works but I'd love to see te astros claim him,0,1
@juliaessington have you seen this?!?!,0,1
Brothers' first ball caps @astros #nicu #nicunursing #astros pic.twitter.com/ga0ZyzvArf – bei Minute Maid Park,0,1
Yes I didi,0,1
The oral history of the Astros ' rainbow uniforms http:// ift.tt/2vpixgK,0,0
Nope,0,1
¡Enhorabuena!,0,0
If he doesn't like baseball you shouldn't even give him a chance lol either way lucky guy,0,1
#Rays vs #Astros ! HOU is 8-1 in pitcher Keuchel's last 9 Wednesday starts. Will Keuchel get to 10-0 on the season?,0,1
Even if the Astros put in a claim the Tigers can pull him back,0,0
After all the #MLBTradeDeadline hate and after what @kidkeuchy said it really feels like we need to win this one tonight. #Astros #EarnIt,0,2
The oral history of the Astros ' rainbow uniforms http:// ift.tt/2vpixgK,0,0
The oral history of the Astros ' rainbow uniforms http:// ift.tt/2vpixgK,0,0
Rain delay inane chatter alert! Does it bother anyone else the Astros are whining about lack of trade action? They're friggin 15 games up!,0,2
GUIA DEL DIA Yankees RT Blue Jays Twins Pirates Giants Rockies Astros  Cubs Rangers Nationals Red Sox,0,1
Astros hit lefties better but Kershaw is a beast. I'm an astros fan but love the game too much to not respect him. Love to see LA vs HOU,0,1
#SabíasQue La gripe también es conocida como influenza porque el papa Benedicto XIV creía que las epidemias eran la influencia de los astros,0,0
The oral history of the Astros ' rainbow uniforms http:// ift.tt/2vpixgK,0,0
The oral history of the Astros ' rainbow uniforms http:// itruck.news/the-oral-histo ry-of-the-astros-rainbow-uniforms/ …,0,0
hoy lei 1horoscopo en la pelu y basikament m dijo q m van a re garchar en primavra y la voy a pasar bomba nanana los astros estan de mi lado,0,0
#Astros going over 8.5 total MLB Aug 2nd TOR@CWS U10.5 TB@HOU O8.5 PHI@LAA O9 CIN@PIT O9 Double on CWS U10.5 and HOU O8.5 pic.twitter.com/YDyhI1AwWT,0,0
Classic,0,0
