
i love angels https:// twitter.com/yoongisoutfit/ status/860874135936937985 …,0,1
All of my friends are literally angels sent from heaven like perfect in all aspects.. why tf are they single,1,2
#firstholycommunion #nephew #niece #family @Holy Angels Parish https://www. instagram.com/p/BTxGcgYhuhxI aCf9s6goS_9HwaeFjcjW6QY7-M0/ …,0,0
I'm a son of a single black mother and I know our perception on women is out of wack. We think our moms are angels .,0,3
#8: Witnessing of Angels : Witnessing of Angels Amazon Video ~ Patrick Macnee (7) Download: $1… https:// goo.gl/fb/Z684Nx #Faith #Spiritualit,0,0
Great people die because they deserve a better place to live they become angels .,3,19
The Astros' lineup tonight vs. Angels RHP JC Ramirez pic.twitter.com/eD4vfhe9XA,3,7
Her voice is like a chariot of angels,0,0
Being apart is torture. Stolen moments are all they can have. #angels #romance #asmsg #bookboost http:// buff.ly/2ndepNi pic.twitter.com/Z1O1Vwj5sz,1,1
#MLB #Astros - Jose Altuve Rest - is not in the starting lineup Saturday (5/6) at Los Angeles Angels,5,1
MY ANGELS SINGING,0,0
@angels __18 selam dilay nasılsın iyimisin,0,0
#Gifts For The Heart & Home Decor #Angels #Art #MothersDay Beattitudes https://www. beattitudesgift.com / http:// ClickForMore.Info/DNiC2 pic.twitter.com/FEQwPM3pVK,0,0
Jord nd tash are angels sent from above,0,1
he's gonna paint hammer and sickles onto his blood angels,0,1
I added a video to a @YouTube playlist http:// youtu.be/z_lByro4LJE?a Red Hot Chili Peppers - Goodbye Angels (Lyrics) HD,0,0
Spiritual Warfare Angels and Demons - PDF Drive http://www. pdfdrive.net/spiritual-warf are-angels-and-demons-e18901494.html#.WQ5Jr7g8lNw.twitter …,1,0
@JackHEmmott 's #faith shines in BENDING ANGELS . My REVIEW on the #LoneStarLit Blog Tour #inspiration #bendingangels http:// bit.ly/2pkCcZi pic.twitter.com/1sFwpdVjxa,0,0
I added a video to a @YouTube playlist http:// youtu.be/k0FdhpzO9lA?a ~ Angels Like Her by Trent Tomlinson~,0,0
we are angels é tão linda :((((((((((,0,0
[Fan Vs Fan: LA Angels Insider] 2017 Game 31: Astros at Angels http:// sportspyder.com/teams/los-ange les-angels/articles/21414690 … #Angels,0,0
I've been seeing Angels ...,0,0
Will Pink win her battle against evil? Will angels and demons help? #YA series #video http:// clc.li/yIN pic.twitter.com/x0v9P24YHr,1,1
SUPPORT PRECIOUS ANGELS I vote for @BTS_twt for #BTSBBMAs Top Social Artist Award,3,1
Right. How do we shut this old feed down so that it stops?,0,4
Arguing whether 1 graph is accurate/well written up there w how many dancing angels on pin. Your points are well made. Bias is no accident. https:// twitter.com/samswey/status /860146273378291713 …,0,0
Having coffee and sending love to all much love Rhonda and her Angels http:// fb.me/25rA8zQ7A,0,0
#WeLoveLA #Angels Angels acquire Damien Magnifico from Orioles for Jordan Kipper http:// srhlink.com/P4hBLP #SportsRoadhouse,0,0
#WeLoveLA #Angels Angels Acquire Damien Magnifico; Designate Jose Valdez For Assignment http:// srhlink.com/P4hBFJ #SportsRoadhouse,0,0
Here we go again the "Rock is Dead" cliche. Pretty sure bands like Royal Blood Deap Vally The Black Angels  Biffy Clyro exist. https:// twitter.com/NME/status/860 465491344842752 …,0,0
Headed to @Angels wooo!!! #baseball,0,0
Houston Astros are playing the Angels ! My love interest Julia Morales is a sideline reporter! She has brains and beauty (U2) Check it out!,0,0
@shariatPR “When one has tasted watermelon he knows what the angels eat” - Mark Twain pic.twitter.com/ixvw2PFgHL,0,1
Wisdom Moment - Michael Stillwater - " Angels All Around You" http:// fb.me/t0iXLdx9,0,0
Diabetic alert dogs are lil angels,0,0
If you learn to connect with your Guides & Angels  your life will be blessed beyond recognition. http:// dld.bz/eDHXJ= pic.twitter.com/3IUFsZZ3ws,0,0
#Angels Lineup Sat 5/06/17 607P v. #Astros Lets Go @Angels ! #LetsGoAngels #MLB #TheHaloWay pic.twitter.com/jX1fPxaBtX,0,2
3 minutes left Check out 1980 Topps ANGELS 26 card NM team set HOFers RYAN CAREW Tanana Lansford Downing http://www. ebay.com/itm/-/25284784 5638?roken=cUgayN&soutkn=p5M6cc … via @eBay,1,0
my angels pic.twitter.com/3fZPlGY6tf,3,3
Urban Knights - Dancing Angels http:// rdo.to/JAZZVNU https:// twitter.com/i/connect,0,0
Drinking a 'Merican by @JekyllBrewing @Cowboys & Angels — http:// untp.beer/s/c449199809,0,0
My God I did not see you but I saw the beauty of your angels that have engraved ...,0,0
言っちゃいました（笑） ドグマさんを狙撃するのは また次の機会ですね,0,1
angeliñ@Boas Noites,0,5
#MarxenDownTheAisle Charlie's Angels pic.twitter.com/JJECrfSGQn,0,0
Anaya's Angels we do what we do for Anaya and everyone living with… https://www. instagram.com/p/BTxFxtMBeMPa rd5VIBzxVLujr1ocKm99_E7vfI0/ …,1,0
Friends are angels who lift our feet when our own wings have trouble remembering how to fly.,1,0
antes n ia de jeito nenhum serio n entrava musica nenhuma na minha cabeça so o tema de evangelion amem cruel angels thesis amem yoko,0,0
Podoba mi się film SHOWING AND TESTING VALKYRIE ON A FAN ACCOUNT in League of Angels 2 w @YouTube – http:// youtu.be/LozvczwlHNk?a,0,0
☆ AOA’s “Brain among the angels ” -Seolhyun Fact,0,0
awesome tipping my friend you made our angels day,0,1
How do I unwind from Commencement work? TV. ... Charlie's Angels throwback and now #KyDerby #DERBYDAY,0,1
It's crazy how some of the nurses here are literal angels and others are like.... not.,0,0
Super cool talking to @GRICHARDS26 during @ocwaste EcoChallenge! @Angels pic.twitter.com/Jl7k1XKDRt,1,0
Oh No ! Rest well angels . Sigh. https:// twitter.com/cnnbrk/status/ 860974961867051008 …,0,0
Team Flock Cancer sending Love to Andy's Angels ! @Willow Glen… https://www. instagram.com/p/BTxFoGcBULWG m2iIJ_6A_xNVC1VdT5hiiTbWsM0/ …,0,1
HE PLAYED THE SHORT VERSON OF ESNY!!! also im so ready for only angels 4:51 thank u pic.twitter.com/sQUXqnnoyk,0,0
Amy have you gotten the box from me? It should be there today or Monday. I did a two day shipping.,0,1
BN @pdediost @mablanco60 @angels _blaus @notarioalcala @gisb_sus @_CCarbonell @maritahermano @grarmen https:// youtu.be/kelrjsdfs6k pic.twitter.com/j8DODBPLyF,9,16
entirely what you mean. Tell me darling are you out to make any connections while in the City of Angels ?" Her question seemed innocent-,0,0
Antarctica Nephilim and Fallen Angels Mystery http:// youtu.be/EBsuRXHa9Go?a,0,0
Angels scream from the tainted touch of my caress.,0,1
The black angels . . . . . #boston #paradiserockclub #rockmusic #rock #psychedelic #strobelights … https://www. instagram.com/p/BTxFh_YjUWI/,1,3
Cause even angels got a favorite sin,1,0
Oops ... and Abraham-Hicks! I love the law of attraction. That and the angels has changed my life!,2,1
Men don't risk it all for angels . Lol,0,0
STAN HARDWORKING ANGELS I vote for @BTS_twt for #BTSBBMAs Top Social Artist Award,2,0
I started to question the angels  and the answer they gave was you said someone potty as they were straightjacketed for their own safety.,0,2
and let me just say that himchan looked 10/10 my ult is so handsome and his smile was like angels singing all around I LOVE,0,0
Sorry can't lie to angels so,0,1
Ich habe ein Video zu einer @YouTube -Playlist hinzugefügt: http:// youtu.be/9zFfRSeA1ls?a Breaking Benjamin - Angels Fall (Official Video),0,0
Yes exactly around 6! Oh I should have say hi to you. I saw the angels in America.,0,0
Wait until the Hells Angels show up along with the new released from Rikers Island come a knock I get https:// twitter.com/sh7401/status/ 860970308802457600 …,0,0
"Run and tell all of the angels This could take all night Think I need a devil To help me get things right",0,0
Angels and Airwaves ♫,0,0
We now have an @EliteDangerous division within @TeamMomentumVM called The Dark Angels hopefully our in game faction request gets excepted !,0,0
超遠距離です 無理っぽいんで 北朝鮮からロケット撃ってもらいましょうか（笑）,0,1
As Gods. Angels Given the Wisdom The Fortitude and the Complete Will to Save that http:// Persons.Life !!! Because Once the Body Gives,0,0
"Finster Saw the Angels " by Laura Veirs http://www. knowyoursong.com/Finster-Saw-Th e-Angels-by-Laura-Veirs-Lyrics.html … #FinsterSawtheAngels #,0,0
coloring book (chance the rapper) • angels •all night •blessings pic.twitter.com/z1EihW73Cn,1,6
[Orange Country Register] Transportation Celebration throughout May to showcase Fullerton’s best trains pla http:// sportspyder.com/teams/los-ange les-angels/articles/21414645 … #Angels,0,0
でも今さっき3つ埋まりました,0,1
me acaba de pasar por al lado dani la muerte con un par de los hells angels y me senti en Samcro,0,2
Peter Erskine - Angels And Devils is playing on http://www. groovenarrels.org,0,0
Pedophile hells angels gang has been rico ed many times its should be illegal for unpatriotic bikers to support 81 https:// archives.fbi.gov/archives/colum bia/press-releases/2013/hells-angels-members-convicted-of-racketeering-conspiracy-for-their-dealings-with-drugs-guns-armed-robbery-and-money-laundering …,0,0
Angels swimming in my blood,0,0
The Book of Enoch Tells The Nephilim Story How Angels Became: http:// youtu.be/pIm0ZscWx6I?a via @YouTube,0,1
#Angels and #positive thinking. Can #spirit guides show us how? http://www. amazon.com/Angelic-Thinki ng-Angels-Positve-Guidance-ebook/dp/B01BPNN5H0 … http://www. amazon.co.uk/gp/product/B01 BPNN5H0 … pic.twitter.com/632YPmyRyG,0,0
my stepdad is blasting System of a Down while he works and I just heard him scream "I CRY WHEN ANGELS DESERVE TO DIE",1,8
#Angels ain't pussies. They're dynamic but gentle #warriors http://www. amazon.com/Angelic-Thinki ng-Angels-Positve-Guidance-ebook/dp/B01BPNN5H0 … USA http://www. amazon.co.uk/gp/product/B01 BPNN5H0 … USA pic.twitter.com/5zK1POnZMj,0,0
Max & Angels bid you all a good night,0,0
The dark Trump truths in " Angels in America" http:// thebea.st/2qM94Ls pic.twitter.com/MCLaCG5X5n,9,21
誰もいませんよ？w,0,1
Homegirl ! LA is the City of Angels https:// twitter.com/calottery/stat us/859090154576805889 …,0,0
2017 Game 32 Post: #Astros at #Angels #MLB @LAANGELSINSIDER @RyanWKrol http:// laangelsinsider.com/2017-game-32-a stros-at-angels/ … pic.twitter.com/17nknk7WB5,0,1
Healing with the Angels If you’re in need of some healing try CLICKING HERE http://www. myangelcardreadings.com/healing pic.twitter.com/OS82uK5PoW,0,1
2017 Game 32 Post: #Astros at #Angels #MLB @LAANGELSINSIDER @RyanWKrol http:// laangelsinsider.com/2017-game-32-a stros-at-angels/ … pic.twitter.com/IS8UUqdc8P,1,2
It all started when these seven angels completely ruined my life. I just wanted to know their names. GO ARMYS #BTSBBMAs,0,0
Amei tanto as angels na capa da @VogueBRoficial . Não tenho capacidade de escolher a capa que quero. Oh gosh!,0,0
He encontrado una grabación genial de « Angels » en #Smule : http://www. smule.com/p/277328373_75 2560109 … #SingKaraoke,0,0
#Humans : Free Will's #esoteric spark lies dormant. #Angels : benevolent Watchers who gave up free will? Only serve? https:// twitter.com/jblackauthor/s tatus/857114313588449281 …,1,1
my angels pic.twitter.com/PRVedVVAN2,0,3
Where sceptred Angels held their residence,0,0
Cardinals ML +103 (1u) Mets O9 +105 (2u) Rockies TT O5.5 -115 (1u) Tigers ML +127 (1u) Angels O4 F5 +105 (2u) Mariners O8.5 -120 (2u),3,9
#BTSBBMAs — good night angels -army помните всё что вы делаете - важно и нужно. ещё раз напишу что люблю вас и вы моя семья ~♡ pic.twitter.com/EOCAct46ws,31,17
J'aime une vidéo @YouTube : "COUPAAAAABLE !! - Angels of Death [P13]" à l'adresse http:// youtu.be/mndYIj1BDNQ?a .,0,0
YES OMFG EVERY BIG TIME RUSH MEMBER ARE ANGELS,0,1
Boys' MSHSL: Academy of Holy Angels (6) at Eastview (11) - FINAL https:// goo.gl/KwfzV5,0,0
Rickie Lee Jones - Beat Angels,0,0
Check out 1980 Topps ANGELS 26 card NM team set HOFers RYAN CAREW Tanana Lansford Downing http://www. ebay.com/itm/-/25284784 5638?roken=cUgayN&soutkn=p5M6cc … via @eBay,0,0
My bitches look like angels  got stripes like a bengal,0,1
They all are pal. No doubt our Angels are buddys too.,0,1
in the city of angels,0,0
#NowPlaying Keith Jarrett > A Multitude of Angels > Part I (Live At Teatro Carlo Felice Genova / 1996) http:// lgf.bz/2gHaEw5 pic.twitter.com/Nu05nYrt4k,1,8
大丈夫です 寝てて下さい後ろから狙撃します （笑） って言いたい とこ何ですけど 自分は 他のフィールドで貸し切り に誘われているので残念ですが ドグマさんを狙撃できないんですよ（笑）,0,1
The performance of " Angels In America" at the National Theatre flew by. Standing ovation from everyone at the end. Roll on Perestroika! pic.twitter.com/z84eL3EEi2,0,0
Check out " Angels Cry" on #Smule : https://www. smule.com/p/261747422_12 61254528 … #SingKaraoke,0,0
Our 7 angels ... our 7 colors of the rainbow ... our beautiful boys ... we love you #BTSBBMAs,0,0
Jeff Carter of Hyde Park Angels on the Importance of Being Coachable in Entrepreneurship http:// bit.ly/2qc76ar,0,1
Podoba mi się film TOMORROW EVENTS DIVINE WHEEL in League of Angels 2 w @YouTube – http:// youtu.be/pp_oSNpHJ6c?a,0,0
@YouTube @TOPmedia_Kr #YoutubeReturnViewsLoveIs ' #teentop GOODNIGHT ANGELS . pic.twitter.com/uqKdvE4qv6,0,1
Wait and Not about angels make me cry,0,0
#444 #angelnumbers #angels #spirit #numbers #guides #thankful #grateful #protected #attention #awaken #Awakening #love #support #guidance pic.twitter.com/hIqp0ORAoc,0,0
Orioles acquire Kipper from Angels  Ynoa may go on DL - School of Roch http:// dld.bz/fF7ac,0,0
It would be easy to rico all hells angels and support clubs they openly support their gangs pedophiles and rapist @FBI don't want to pic.twitter.com/cxpv4fPIXB,0,0
I have tried to create a new one. A DM and I asked for everyone to stop using it. I don't even get notifications on half mine. It's odd.,0,4
I was really feeling angels cry but holy shit I got this is like a motivating jam playing that teaser over n over!,1,3
Only if u knew this was prophetic Ma....now #82ChibokGirls released..... Praise God. More roses from d little angels .... https:// twitter.com/obyezeks/statu s/860772666407616512 …,0,0
I am VERY happy that I received so much rose stuff from lush. My angels know me too well,0,2
早く来ないと席なくなりますよー！,0,1
Angels Fiesta under the Big A going,0,0
2 Tix! Angels Vs Houston Astros Saturday 5/6 **$300Value!**Mike Trout!** http:// dlvr.it/P4h0tv pic.twitter.com/C8fvbATccd,0,0
two angels @shaymitch @selenagomez for @unicornlisi pic.twitter.com/fZ9mYhyCj2,1,4
2017 Game 32: Astros at Angels http:// laangelsinsider.com/2017-game-32-a stros-at-angels/ …,0,3
Retweet for a chance to win a free game key by sunday #angels demons&men #indiedev #itch .io #smartolivegames #indiegame #gamegiveaway,4,3
Even Hell's angels ?,0,0
A DAY OF EXPLORING AND HIDDEN ANGELS IN PLAIN SIGHT http://www. betsiworld.com/hidden-angels- and-how-god-provides/?utm_source=ReviveOldPost&utm_medium=social&utm_campaign=ReviveOldPost …,1,4
At the National seeing Andrew Garfield in Angels in America. Though? To be honest. Almost more… https://www. instagram.com/p/BTxEk4Tjd75/,0,0
I’ve formed a team for the Yvonne's Angels Komen Central New York Race for the Cure®. Please join my team today. https:// goo.gl/lkbDdK,0,0
#Repost @IAMV_DUB : @TheGreenSocial Tonight at ANGELS w/ Your #GoneGreen Team …... http:// fb.me/sY2PZQBg,0,0
#Repost @IAMV_DUB : @TheGreenSocial Tonight at ANGELS w/ Your #GoneGreen Team … https://www. instagram.com/p/BTxEh4VApXz/,0,0
It all started with a yt video when these seven angels completely ruined my life. I just wanted to know their names. GO ARMYS #BTSBBMAs pic.twitter.com/KlOBeuAx4N,8,2
Angels exist here is di proof https:// twitter.com/cuddlejeon/sta tus/860963068670603264 …,1,1
angels,0,1
I’ve formed a team for the Yvonne's Angels Komen Central New York Race for the Cure®. Please join my team today. https:// goo.gl/lkbDdK,0,0
#NowPlaying Life Song by The Black Angels ♫ http:// spoti.fi/2pcJotj,0,0
Not about angels  beautiful tango she will be loved i'll take care of you don't forget about me lay me down confessions into you https:// twitter.com/rana_waleed__/ status/860240531951112197 …,1,0
Angels Lap Dancing Club - Open 7 nights a week. Perfect for Stag Parties and Private Events. #Angels #LapDance #HotGirls #Nightlife #Dublin pic.twitter.com/faJibtPHMd,0,2
Gostei de um vídeo @YouTube http:// youtu.be/YGZ519dUppw?aS UICIDAL … ANGELS - Division Of Blood (official video),2,0
FALLEN ANGELS I GUESS THEN,0,0
Epic fantasy at a great price. Get " Angels Without Wings (Part 1)" for just 99p until midnight https://www. amazon.co.uk/Angels-Without -Wings-Year-Part-ebook/dp/B01IFC9LTK … pic.twitter.com/icN4nXb5JM,0,0
May the Angels be with you!! pic.twitter.com/eqFnjdLuhU,1,2
This is why transparency is important. Where are the budget performance reports for FG and SGs? Anyway angels are in power nowadays.,2,0
❝I mean it looks good miss Marcarita.❞ Goku smiled taking a good look at the Angels bikini before bringing his hands together and rubbing>,0,1
Adicionei um vídeo a uma playlist @YouTube http:// youtu.be/luwAMFcc2f8?aR obbie … Williams - Angels,0,0
Fallen angels é fic com hot? — https:// curiouscat.me/shewantscamila /post/144839236?t=1494107589 …,0,1
Tis a fair comment to be honest! I actually quite like almost all their stuff to be honest! Clockwork angels pretty good prefer older tho!,0,0
(Excuse my face) I can't believe I meet them they're absolute angels ! #playlistlive @iamcornelia @mookentooken pic.twitter.com/Qdgtj8AUSb,0,2
Found amazing @witchergame cover of Wolven Storm by @malukah today - voice of angels !,1,1
Everyone's twatted at Buck House. Phil on the Guinness Harry on ket Anne done on Lambrini- all singing Angels while waiting for a curry.,1,1
Mezcla de lali en teen angels y lali monja me meo https:// twitter.com/lalibravery/st atus/860945026943156226 …,0,2
night night angels i am a happy bean i hope u are too,0,3
A Rural Shrine to New York’s Angels and Gargoyles http:// flip.it/ZI5vMn,0,0
The Angels have made a trade with the Baltimore Orioles involving BayBears pitcher Jordan Kipper. More details: http:// atmilb.com/2qNgm1A pic.twitter.com/iimmjELz0a,4,10
Dear Angels  you owe big time and I believe you should start paying back any time now.,0,0
This is that old feed.,0,3
Scary thing is: He has a better arm and is a better pitcher than the Batting Practice stuff Jered Weaver is lobbing up now for @Padres,0,0
FAR FROM 'Magnifique' folks. #Angels Acquire Damien Magnifico . #Patchup #BandAid,0,0
What nonsense! Those are conning devices to send said angels back up when their recon is done.,0,1
Nurses may not be angels  but they are the next best thing.” - To all the women and men that selflessly give of... http:// fb.me/1jRuJHQxT,0,0
ANGELS AND CLOWNS - tropical fish aquarium Tee Shirt T-Shirt 2XL Black #aquarium #shop http:// homeaquarium.space/details?asin=B 00LXH2XFE … pic.twitter.com/ViRCGtQAhw,0,0
*becomes extremely woke to all the angels i know why this dude.,0,0
And cue the chorus of angels singing,0,1
My angels,0,0
Friends are angels who lift our feet when our own wings have trouble remembering how to fly.,0,1
The demons protect me n the angels respect me,1,0
@bwill1130 did we go to the downs? and fallen angels indeed do live in hell. if you can call that living. preach it teach it,0,0
Paul van Dyk & Armin van Buuren: The Angels http:// fb.me/6mrOcbgN5,0,0
You need psychiatric help. Do you own lots of guns and thousands of rounds of ammo? Do angels talk to you? Fake Christian Real Nutter.,0,3
Marquei como visto Prison Break - 4x4 - Eagles and Angels http:// bit.ly/SvFzXy #bancodeseries,0,0
It's Here! For #FREECOMICBOOKDAY The Demon v. 10 Angels  new crime noir comics by myself @attibak and @JustinBirch ! http://www. cloudwranglercomics.com/the-demon-vs-1 0-angels/ … pic.twitter.com/C2uLdQjKQs,2,10
Cider award time and some cool moosic – attending W.M.D and Questions of Angels At The Chase Inn,0,1
Your coat is made of magic And around your table angels play And I will cry when ye go away I will cry when ye go away,0,1
I'm telling a secret respectfully Today I talked to my Angels & literally they listened & I was granted-thank you (amen)Hoot hoot baby!,0,1
SHOWING AND TESTING VALKYRIE ON A FAN ACCOUNT in League of Angels 2: http:// youtu.be/LozvczwlHNk?a via @YouTube,0,0
Wont He DO it!!!! #angels .on.assignment,1,1
that's u!!!!!,0,0
Tanya Roberts on Charlie's Angels 76-81 - http:// ift.tt/2pO7slT http:// ift.tt/2lEfMRF pic.twitter.com/azPcpYxA8p,3,4
FOR MY WOMB WHICH BROUGHT FORTH ALL OF MY ANGELS I LOVE YOUS AND I MISS YOUS AND YES I WOULD DO IT ALL AGAIN FOREVER IN A DAY TO,0,0
the angels protect me the demons respect me,18,26
Not about angels // Birdy,0,0
Right...i never leave early...,0,0
Walking out the tunnel...My little athlete. #baseball #baseballseason #nyc #angels #ball #dailylook #fatherandson ... http:// fb.me/6riFJJV9k,0,0
#Emprendimiento : Business Angels  incubadora y aceleradora ¿cuál es la diferencia? http:// goo.gl/rPiMZs,0,0
Friends are angels who lift our feet when our own wings have trouble remembering how to fly.,0,0
That seems like an #ANgels jersey that might be worth getting.,0,1
もう俺つきましたよw,0,1
origin world. unable to be free with other angels but unable to find the god he serves he is doomed to wander alone for eternity,0,0
look at this precious son. we gotta protect Hayden Christensen with all we've got because angels like him are rare https://www. youtube.com/watch?v=plJb6u rme_Y …,0,1
inspired by u posty. pls listen homie @PostMalone gods and angels (prod. by nikko bunkin) by zach https:// soundcloud.com/zachjacksonyz/ gods-and-angels-prod-by-nikko-bunkin …,4,4
i love real life angels https:// twitter.com/gryffeindor/st atus/860973736916398080 …,0,1
Angels are not invisible this is the demonstration pic.twitter.com/v9gXdkoLoM,7,16
#Angels Acquire Damien Magnifico #MLB @LAANGELSINSIDER @RyanWKrol http:// laangelsinsider.com/angels-acquire -damien-magnifico/ … pic.twitter.com/5x6aUGhSZ9,0,1
#handpainted #handyed#fashion #fashionblogger #angels #theonlyoneintheworld #fun #cool #color @… https://www. instagram.com/p/BTxDgn_gNSO/,0,0
#Angels Acquire Damien Magnifico #MLB @LAANGELSINSIDER @RyanWKrol http:// laangelsinsider.com/angels-acquire -damien-magnifico/ … pic.twitter.com/TuWDlkrYdI,1,2
I have definitely put any financial concerns in the hands of the angels !,1,1
#youtube Angels We Have Heard On High -- Instrumental Rock -- Pastor Brad http://www. youtube.com/watch?v=h8fG3U MNF_w&sns=tw …,0,0
D's picks MIA Marlins/NY Mets >9 NY Yankees/CH Cubs >7.5 HOU Astros/LA Angels >7.5 TX Rangers ml TX Rangers/SEA Mariners >8.5,0,2
Yooooooo @BigSean was so deep in my dreams last night and so was tazs angels God what are you saying?!,0,0
Those voices of angels . Thank you PH ARMY proud to be a member of these fam. #BTSWingsTourManila DAY2 https:// twitter.com/screamsjimin/s tatus/860856985054453761 …,0,3
バリケ裏で 銃構えながら寝ないで下さいね（笑） （BB弾で蜂の巣にされます）,0,2
RT @W_ Angels _Wings Honored to be named the 2015 IAN #Memoir of the Year! Thank you IAN! http:// clc.li/J8i pic.twitter.com/TQIzseqsNP,8,5
Projectable? He's one of the few winning pitchers in the system. This is why the Angels franchise is a FAIL.,0,0
Astros answer Angels rally in 10-inning win http://www. texasguardian.com/index.php/sid/ 253086033 …,0,0
"I didn't know there were angels that lived in San Bernardino" lmaooo probably the best pick up line someone has ever sent me,0,0
#Positivethinking with your #angels ' help. Possible? http://www. amazon.com/Angelic-Thinki ng-Angels-Positve-Guidance-ebook/dp/B01BPNN5H0 … for USA http://www. amazon.co.uk/gp/product/B01 BPNN5H0 … for UK pic.twitter.com/ETBMMbJ9oc,0,1
FAMILY | Spirit creatures - How do they affect us? http:// ow.ly/iMzx30blWod #Angels pic.twitter.com/nGz469Dj8k,1,1
@LouiseMensch @FBI @CIA @TheJusticeDept If prosecutors couldn't use RICO on Hells Angels the'll have a hard time using on Trump campaign! https:// twitter.com/LouiseMensch/s tatus/860967501508816896 …,0,0
Ayno ( • ̀ω•́ )✧ { his smile tho i love angels | #Flower | #플라워 } pic.twitter.com/OIJaejQxE8,11,10
Danny Espinosa / Danny Espinosa is not in the Angels ' lineup Saturday against https:// goo.gl/AphC9X #MLB #ANA,0,0
Look at that instead of Charlie's angels  they will be John's angels ...,0,0
Every time I see this baby bed it reminds me of Rosemary's Baby. @Angels Antiques & Flea Mall https://www. instagram.com/p/BTxDThqgJ9D/,0,0
bless the mcdonalds app i don't give a shit about the Angels  but they hook me up with a free craft burger.,0,1
When I was first introduced to this wonderful Energy Healing with the Angels I KNEW it was my purpose for being... http:// fb.me/1NVvUOnop,0,0
I'm not saying the Blue Angels flew right over our house but they flew RIGHT OVER our house. pic.twitter.com/uTOGQGJIjf,0,14
Bending Angels ~ ~ Book Blog Tour & Review! http:// buff.ly/2pNGqLB #LoneStarLit pic.twitter.com/P8dgrwUWzr,1,1
Barksdale AFB. Blue Angels . Always awesome!!!!! Thank God for our Military and their passion to defend our freedom! pic.twitter.com/IxypQqGJI9,1,11
@BTS_twt are angels #BTSBBMAs,0,0
Road trip Saturday. Headed to the Big A with brother @Dirkbobmcj to see @Angels play the Astros. #GetYourRedOn,0,0
Oh wow is it Lailat il8dr already? Or have the angels just descended from heaven a little early this year,0,0
You are indeed #ANGELS !!!! https:// twitter.com/msarahsanchez3 7/status/860972258768150528 …,1,4
Tomorrow...dem #630 boyz bacc at Angels ...pop out https://www. instagram.com/p/BTxDFwDjkpG/,0,0
