
BTEC Charlie's angels xx pic.twitter.com/oNhF70Sgsd,0,11
BLESS YOU BOTH YOU ANGELS,1,3
I love angels https:// twitter.com/vaporpjm/statu s/860968016015740928 …,1,2
#angels #butterwoukdntmelt #bff #socute @Melton Mowbray https://www. instagram.com/p/BTxK2XEFWBN/,0,1
#RRBC "With Angel's Wings" - Stephanie Collins ( @W_ Angels _Wings ) http:// amzn.to/296MBPp #mustread #BookBoost pic.twitter.com/hz27IFaeqc,15,2
Darryl cheated on Angel with her best friend. "Men are trash" no. Darryl is trash. Angels best friend is trash.,0,0
Vikings - T04E15 - All His Angels http://www. tvshowtime.com/show/260449/ep isode/5831454?ref=2c6cb57044346660f382a7b1c1d25c0c … me dolió pic.twitter.com/SxCwru5c1n,0,0
Pony: Giants (14) at Angels (7) - FINAL https:// goo.gl/oUdxLk,0,0
New friends. New statue room! #celestialawakenings #dragons #angels #fairies http:// fb.me/65Nm6Op66,0,0
#butt #fire sexvideo #angels #teacher wifesharing #nude fuck pic.twitter.com/hRKjaHEELn,0,0
#NowPlaying on gospelmusicexplosion Angels [5k] by Richard Smallwood #enjoypraiseandworshipwithministerrobinlynne http://localhost/,0,0
Aw thanks #Angels !!! You all are so wonderful! Thank you!,0,3
attending Noah's Flood at Cathedral of Our Lady of the Angels http:// fb.me/6buXLJgT9,0,0
Bronco: Angels (20) at A's (6) - FINAL https:// goo.gl/5iHNFC,0,0
Kentucky Derby on the video boards while the Angels take batting practice.,0,0
If the Angels came to St. Louis to play the Cards do you think Albert Pujols would get cheered or boo'd?,1,3
On the air from Lansing. Angels Field coordinator Jack Howell is pre game guest. Listen on Fox Sports 1045 & 1360 & http:// gobees.com pic.twitter.com/NfYY8a49SS,0,1
this episode is 2nd to the first weeping angels one as the scariest #DoctorWho,0,3
That place is def run by the hells angels,0,0
#TeamUnidoS @_chicadebatman º° @MonicaR926 º @Polethf_ Angels º @amega6 º @yagerlot01 º @Conymgwv … http:// vitw.it/link/logyo,0,2
4:46pm I'd Kill for Her by The Black Angels from Death Song,0,1
I LOVE ANGELS YOONGI IS SO LUCKY !!,0,1
Ready to watch the @KentuckyDerby . Julep by Angels Envy. pic.twitter.com/sjSkU7oUNu,0,0
Man These Streets Don't Got No Love Rest Up To All Cleveland Fallen Angels .,3,3
2NITE CIROC SUMMER COLADA SPECIALS & DELEON TEQUILA RELEASE PARTY SAT. MAY 6TH @ANGELS … https://www. instagram.com/p/BTxKaQnBayh/ http:// fb.me/8sOveSFuw,0,0
2NITE CIROC SUMMER COLADA SPECIALS & DELEON TEQUILA RELEASE PARTY SAT. MAY 6TH @ANGELS … https://www. instagram.com/p/BTxKaQnBayh/,0,0
Angeles y Flores de Bach. Gracias por todo nena. #selfie #friends #angels #bachflowers #happy … https://www. instagram.com/p/BTxKZVVj8ll/,0,0
La de White Sox Angels roja Dogers visitante Astros Texas Odor https:// twitter.com/Bvbblx/status/ 860966222288097280 …,0,0
Sorry to hear that Angels . Get well soon! Sending healing vibes!,0,1
Angels watching over us! #psalm91 Commission an angel painting or see this print and prophesy… https://www. instagram.com/p/BTxKXksFcbp/,0,0
so glad I met coral and izzy tbh bloody angels,0,2
Serving Aphrodite realness #djane #queer #gay #lifestyle #x -tra #whiteparty @Angels Events https://www. instagram.com/p/BTxKT1ThQip/,0,0
I have about two companies of Blood Angels and just found a bunch of unassembled marines...,0,0
Angels do exist #BTSBBMAs GO ARMY pic.twitter.com/0cMMprfjbg,1,1
I know on judgement day some SlayQueens will be asking Angels where they can charge their phones while waiting for judgement,0,0
Dodging angels,9,12
You are surrounded by loving and supportive angels  who are helping you change your life in beautiful ways. ... http:// fb.me/zFDg6lXi,0,0
I LOVE ANGELS !!,0,1
ReadersGazette: With Angel's Wings .W_ Angels _Wings #Womensfiction #Romance http:// readersgazette.com/world/moreinfo /B00GYL9DCA/ … With Angel's W… https:// twitter.com/i/web/status/8 60988051149008896 …,0,0
Wow angels,0,1
#PrayerRequest I #pray Heavenly Father for Your angels  with flaming swords to encapsulate me - body & mind Always In #Jesus Name,0,0
Read this cute experience of my lovely meeting her Angels https:// twitter.com/jaeblossoms/st atus/860822412040052736 …,0,1
angels * https:// twitter.com/angellovestori /status/860988441483456513 …,1,1
Just randomly picked Untrapped to win...then finds out has 56-1 odds. In the words of J.P. from Angels in the Outfield "it could happen",0,1
I added a video to a @YouTube playlist http:// youtu.be/-504g71bBE0?a A$AP Rocky - " Angels ",0,0
MLB: NY YANKEES/CHICAGO CUBS OVER 7 1/2 RUNS LA ANGELS CHICAGO WHITE SOX/BALTIMORE UNDER 9 RUNS PITTSBURGH,0,0
Not a great position for my guy. 0-38 from the 17 post. Still like him. Good odds on that McCracken,0,1
I'm surprised he doesn't say Blood Angels .,0,0
"Do not forget to show hospitality to strangers for by so doing you have shown hospitality to angels without knowing it." Hebrews 13:2 #SB4,6,15
Saw Angels in America part one this evening. Incredible. So vivid. Can't believe it's been 13 years since I saw the HBO version.,0,0
#Angels - C.J. Cron rehab assignment set #FANation http:// bit.ly/2qOW86I pic.twitter.com/N4InhgfcDf,0,0
#Angels - C.J. Cron rehab assignment set #FANation http:// bit.ly/2qOW86I pic.twitter.com/pi4FuCCV1s,0,0
#Angels - C.J. Cron rehab assignment set #FANation http:// bit.ly/2qOW86I #MLB pic.twitter.com/1n46KzdBOG,0,0
Jose Altuve is not in the Astros' lineup Saturday against the Angels .,0,0
#Angels - C.J. Cron rehab assignment set #FANation http:// bit.ly/2qOW86I pic.twitter.com/M2JwrnVSK5,0,0
#Angels - C.J. Cron rehab assignment set #FANation http:// bit.ly/2qOW86I #MLB pic.twitter.com/kqlOAjCgoK,0,0
#Angels - C.J. Cron rehab assignment set #FANation http:// bit.ly/2qOW86I pic.twitter.com/VU0twnX6Kb,0,0
#Angels - C.J. Cron rehab assignment set #FANation http:// bit.ly/2qOW86I #FantasyAlarm pic.twitter.com/TNjiJBgr3J,0,0
supportive angels https:// twitter.com/pentafun/statu s/860684785399640065 …,0,0
With Angel's Wings . @W_ Angels _Wings #Womensfiction #Romance http:// readersgazette.com/world/moreinfo /B00GYL9DCA/ … With Angel's Wings is the true story of #novels 8 pic.twitter.com/wrpXy8b2Xw,2,1
Hi sisfur Cinni #theaviators #angels,0,0
Our members are at @clubzindagi in @TribecaBar1 pl come & say hi xx @LGBTfdn @canalstmancs @LordMayorOfMcr @LGBTfdn_ Angels @PaulMartin101 pic.twitter.com/9Alqz35knx,10,29
. @LMcCullers43 y #LosAstros se alinean así ante los Angels . Jugada x jugada: http:// atmlb.com/2pSZ1V0 pic.twitter.com/GANMJKmyZC,2,3
MENTIRA QUE TEM ATÉ ANGELS NESSA PLAYLIST,0,1
【2012年2月22日発売！】吉木りさ『Beach Angels ビーチ・エンジェルズ 吉木りさ in 石垣島 [Blu-ray]』 http://www. amazon.co.jp/gp/product/B00 6LTO0X2?ie=UTF8&tag=08e3110-22&linkCode=shr&camp=1207&creative=8411&creativeASIN=B006LTO0X2&ref_=zg_bsnr_562030_9 …,0,0
Still in shock...the oldest son of the oldest son. Angels watching over us. https:// twitter.com/isiah_jasey/st atus/859965116649021441 …,2,0
Mark Leiter Jr. reaches the majors 23 years after his younger brother's death #angels #laa #MLB http:// sport-ne.ws/4j5r pic.twitter.com/iSpcUAY3bi,0,0
I can look at Infinite members all day. But WooGyu exhaust me too much so no energy to fangirl over other angels .,0,0
Trust in my self righteous suicide I cry when angels deserve to die In my self righteous suicide I cry when angels deserve to die,0,0
ADORING ANGEL Water Font Catholic Gift Prayer room Chapel Baptism Gift http://www. ebay.com/itm/2921085203 47 … Beattitudes✞Gifts #Garden #Angels #eBay,0,1
El hombre perfecto si existe esta leyendo este mensaje. @charlys_ angels _ @MarcoRico_,0,1
Don't forget 49ers Rams Chargers Raiders* Sharks Ducks Kings L.A. Kings A's Angels nice to have multiple Pro teams bringing in $$$$,0,0
The GoPro video from the Blue Angels flight is taking a long time to upload so here is a sneak peak........... http:// fb.me/zE2Sg5WK,1,1
Yes he does. "Upon them the curse of Allah and the angels and the people" we are the people ?..,0,1
Jose Altuve is not in the Astros' lineup Saturday against the Angels .,0,0
the angels exist pic.twitter.com/pbXJ9DDKRh,0,0
Evil greedy bloodthirsty bastards. Leave those Angels alone. #ShutTaijiDown #tweet4taiji pic.twitter.com/7n2IGtA93b,0,0
God gave the angels wings and he gave humans chocolate. Desserts,1,0
NEW FAV Claudio Gasparini - Angels Of Love (Original Mix) by @ClaudioGask https:// soundcloud.com/claudiogaspari ni/claudio-gasparini-angels-of-love-original-mix … on #SoundCloud,1,1
Boardman girl holds bake sale to benefit Angels for Animals http://www. wfmj.com/story/35358020 /boardman-girl-holds-bake-sale-to-benefit-angels-for-animals#.WQ5QYcatHOc.twitter …,1,0
Charley on school ore Charley the angels ore Charley Tobacco men men men,0,0
The AD Council - Food Angels,0,0
blessed that's all and angels do not bow to Mary. Jesus said "who is my mother",0,0
Working the Fiesta party then Angels game tonight first base side — feeling happy at Angel Stadium of Anaheim http:// fb.me/5t1wsBHzU,0,0
#NowPlaying The Young Presidents @youngpresidentz @RadioCandyHits - Where Do Angels Go on @Rock365Radio http:// rock365radio.com #R365R,1,0
#NP The Young Presidents @youngpresidentz @RadioCandyHits - Where Do Angels Go on @Rock365Radio http:// rock365radio.com,1,0
Got stuck in a Battersea pupper black hole and i have found these perfect angels and I want them with all my heart https://www. battersea.org.uk/dogs/max-millie,0,3
I vote for @BTS_twt for Top Social Artist at the #BBMAs . #BTSBBMAs My seven angels GO ARMYS,1,0
YAO Baseball League: Marlins & Angels Win http:// bernews.com/2017/05/yao-ba seball-league-marlins-angels-win/?utm_source=dlvr.it&utm_medium=twitter …,0,0
#Repost Devotional for Thursday Angels carry out their work without delay. Ezekiel 1: 14 And the living... http:// fb.me/3cs8hLSdB,0,0
“Better to be strong than pretty and useless.” ― Lilith Saintcrow Strange Angels,0,0
The Seraphim - the Seraphim are a collective of Angels most high led by their chief Seraphiel.… https://www. instagram.com/p/BTxJR5alZen/,0,0
THEATRE REVIEW | Angels in America National Theatre London http:// ift.tt/2plZVIz,0,0
Lol calm bro! Don't wake the angels,0,0
#prayerrequest #pray Jehovah Chereb bind demons on/near Old Golden Spring Road St Andrew #Jamaica & replace with holy angels In #Jesus Name,0,1
wit the Angels /kelly/baby/luci/Crowley/Mary/ketch/bmol sl to wrap up I wonder hw many mins S&D r gona b in the finale,1,1
MLB : Reds F5 Yankees/Cubs over 7.5 Padres F5 +.5 A’s F5 Angels F5 +.5 Kentucky Derby : 14 15 16 17 18,0,1
[Los Angeles Times] MLB | Three up and three down http:// sportspyder.com/teams/los-ange les-angels/articles/21414850 … #Angels,0,0
Whoever you are you are scoping out my angels,0,0
Psalms 148:2 Praise ye him all his angels : praise ye him all his hosts. #ACampaignOfLoveMCGI,23,21
She narrows her eyes and flies them to the front of the bunker "There were angels at your college waiting to kill you",0,0
Bu sefer de city of angels filmini izleyip salya sümük ağladım size iyi geceler bana pek değil,0,1
can't believe I finally met these wee angels tonight pic.twitter.com/J3R4UWIcg7,1,3
wow angels . I vote @BTS_twt for #BTSBBMAs,5,0
MLB White Sox +200 to win 1u Padres +220 to win 1u Angels +101 to win 2u Braves -115 to win 2u,0,0
THEATRE REVIEW | Angels in America National Theatre London http:// ift.tt/2plZVIz,0,0
"I have never met Jordana's children but I am sure they are little angels . Haha great I honestly thought it was in the trash or something.",0,0
when the singer in angels sings "jolene" and all you can think about it @jamie_genevieve,0,2
We 're angels and you? pic.twitter.com/jts5Pgy4Ob,0,1
Angel Reading by Monika for week 8 - 14 May #soulecting #angels #cards #readings @MonikasAngel http:// bit.ly/2qNktL5,0,0
I just expect you see all my light an walk with my angels  as well as love all my dark and… https://www. instagram.com/p/BTxI31DFo9Y/,0,0
He must have been more exhausted than he has prior believed for even when angels do not sleep he may have already fallen beneath its lull. https:// twitter.com/WingedTricxste r/status/860983479634247680 …,0,0
Gma; "oh crap looks like hells angels are after us" Me; "could be worse" Gma; "yea could be Donald trump".,0,1
the xx - angels,2,3
ENRRA To em "Not about angels " qual é pior?,1,2
MLB Sharp Action STL-ATL over Phillies WAS-PHI over MIA-NYM over SF-CIN over Rockies LAD-SD over DET-OAK over Angels HOU-LAA under,2,6
Anyone seem angels in america? I would love to see it but i live in australia aha. How was it? pic.twitter.com/ZaTyhSH21S,0,3
Is me or everytime that I look BTS I see Angels Not Today Chong! Jojun! Balsa! ARMYS GO I vote for @BTS_twt for Top Social Artist #BTSBBMAs,0,0
YAO Baseball League: Marlins & Angels Win http:// ow.ly/BBzr50bk1N0,0,0
#Astros Jose Altuve is not in the Astros' lineup Saturday against the Angels . http:// bit.ly/jMu7Md,0,0
Goodnight angels,0,1
"In the arms of the angels ..." pic.twitter.com/JWQfy7OXXU,7,21
The DaVinci Code Angels & Demons Inferno all by Dan Brown https:// twitter.com/bighomiebran/s tatus/860973497417428993 …,3,0
Thriving Ivory - Angels on the Moon https:// youtu.be/PipebgTa_DQ,0,0
bts took a great effort in learning all those long filipino sentences for the ph armys who went (on our behalf i guess). they are angels .,0,0
FCT Angels leaves Coal City Queens in a pile of dust bouncing back from their last game defeat.,1,0
In the arms of the angels,0,1
we have to keep praying your welcome ps love angels,1,1
#marriage then you have a bunch of little angels running around the house [asking were is daddy] with a bon fire going in the back yard,0,0
Good night my angels . Hope you will have a great dreams @NewHopeClub,0,0
Hola #Angels !! Hoy estaremos llevando acabo nuestro segundo concierto en #Kantares y… https://www. instagram.com/p/BTxIZr2D_3K/,0,0
the reasons to get post Akasha are. They don't really exist unless you're hosting angels,0,0
Teen angels,0,1
Pour la #TeamPeauDeMerde  je conseilles Angels on Bare Skin de Lush. #CoupDeCoeurSandokan #SandokanBeauty,0,0
Kecia this is the cutest video!! Omg I love you guys together!! True angels,2,1
THE VAMPS WERE INCREDIBLE 10/10 NEVER DISAPPOINT ME MY ANGELS XXX,0,0
u hmm angels n America should be REQUIRED READING FOR STUDENTS#####,0,0
@BOA-Beat of Angels Bucharest https://www. instagram.com/p/BTxIQn4jmkj_ cnziIhVXGeM0lCmsPlvS4kqwl00/ …,0,2
#WeLoveLA #Angels MLB | Three up and three down http:// srhlink.com/P4hPx5 #SportsRoadhouse,0,0
The kabahla the sign of angels Good night friends #angels -reading #support #love #healing … https://www. instagram.com/p/BTxIS0DgpZI/,0,0
I swear the only reason I used to watch charlie's angels is bc I had the biggest crush on them all... especially drew,0,0
The Kennedy men are the most perfect angels on this play https:// twitter.com/50sand60s/stat us/860667118647431169 …,0,0
Beautiful boys always running heavenly angels #affirmed,1,0
Drinking a Big Creek by @JekyllBrewing @Cowboys & Angels — http:// untp.beer/s/c449219736,0,0
大丈夫。 今日はニコニコ明日は本編のスタミュがあります!!!!!!生き残るしかすよ！,0,0
Those gals are 100% Angels very beautiful and Joe wants to hug them all!!!LOL!!!,0,2
#NowPlaying - Skillet - You're in My Brain/ Angels Fall Down http:// rockersdive.com,2,3
*they're * angels,0,4
ends in 10 mins 1974 Vintage Topps ANGELS 29 cards team set RYAN F.ROBINSON Pinson Singer May NM http://www. ebay.com/itm/-/25284786 5165?roken=cUgayN&soutkn=eK6xWo … via @eBay,1,0
I liked a @YouTube video http:// youtu.be/hrhsKIQqYlM?a APPARENTLY ANGELS ARE PAKISTANI?,0,0
Happy birthday angels Leo and Lenny!! https:// twitter.com/rogerfederer/s tatus/463766897574432768 …,0,0
Charlie's Angels . . @Pembroke Pines Florida https://www. instagram.com/p/BTxIIAUA7wxw kOLmSN7IQNxr2187Qkad-podgM0/ …,0,0
RessuREKTed to bring my cousin out along with my concrete angels @Alumbra Fridays https://www. instagram.com/p/BTxIHFeF8f3/,0,1
I don't know anything about Magnifico. But Kipper was in his second year at AA so that gives you an idea how Angels view him.,0,0
Celebrating my 2 angels this weekend actually melt my heart cutest pair happy bday's to my granny and grandad pic.twitter.com/BEbDL7ta85,0,14
What did I learn from Angels In America @NationalTheatre ? That it actually is possible to love @gough_denise EVEN more.,0,3
Mark Leiter Jr. reaches the majors 23 years after his younger brother's death #Angels https:// fanly.link/cfb2a8d080 pic.twitter.com/whPIDN84Qx,0,0
Surely we shall say hello during Against at least? Or if you're still around I'm going to @paperheartsmus tomorrow! Lucky you: Angels !,0,1
THE ONLY ANGELS I CARE ABOUT IS ACDG https:// twitter.com/itiskcmydudes/ status/860983517890490368 …,0,0
Oh that? Just a scratch you angels heal up ridiculously fast.... or does your god not care?,0,0
GUESS WHAT BOOK LOVERS! Little Angels is out in paperback! WOOT WOOT! http:// getBook.at/LittleAngelsPB #thriller #crime #mustread #drama #romance pic.twitter.com/8npaQ2Un02,0,1
Ehhh I prefer Angels,0,0
Picked up a couple more growlers of Cap'n N Strawberries at Brewery Becker. It's as if it was brewed by angels . #crunchberrycereal pic.twitter.com/7hYvPheYI4,0,1
I believe in angels Something good in everything I see I believe in angels When I know the time is right for me,0,1
She gets her angels and butterflies mixed up give her some slack,0,3
Aww what a shame: we could have had a hello chat! How was Angels in America? We should give each other in-London alerts in future!,0,0
Sounds of Angels https:// youtu.be/-oZNhPOVwcQ via @YouTube,0,1
I voted for @BTS_twt for TOP SOCIAL ARTIST #BTSBBMAs City of angels,0,0
Minor League (9-10): SC Nickols Accounting Padres (7) at Henke-Clarson Funeral Home Angels (6) - FINAL https:// goo.gl/a1Or1d,0,0
11:00 o'clock in the city of Angels and I'm in need of entertainment. HAPPY GET THE BEEMER.,0,0
Gunnevara!,0,0
Angels !! Please tweet #youtubereturnviewsloveis to @YouTube & @TOPmedia_Kr !! pic.twitter.com/fZo8SWhkPI,0,0
Sending love to all the women who are fallen angels on this earth due to a cruel & indifferent society.,0,0
Took my son blue angels today. Sound of freedom. Blessed to be an American. God bless our military pic.twitter.com/sk1i1XRATz,0,2
Girl dead for 48 seconds wakes up and claims angels r real? https:// twitter.com/taesolecito/st atus/860967158536392704 …,0,0
I vote @BTS_twt for #BTSBBMAs Top Social Artist Award im so lucky for having 7 angels in my life,3,1
LOOK AT THESE LITTLE BABY ANGELS I LOVE THEM pic.twitter.com/ZHl4wiIW6l,0,1
Don't know!,0,2
Happy birthday sweeties These angels r coming ur way with lots of love from me  may ur day be beautiful as u wish u all the best,0,0
I know the best team. Go Angels pic.twitter.com/YzdeCiLR82,0,1
Nurses are angels on earth... :) http:// fb.me/JlgaF2SQ,0,0
come back from being out and my housemates have put all my clean washing on the airer and radiators for me absolute angels x x,0,2
Inicia el encuentro de la J5 de la WLF entre Caimanes y Angels en el Velódromo Olímpico pic.twitter.com/NB1c9klpE5,0,9
,0,4
Fun fact I don't like the Angels,0,4
Yeee Love Live! Angels pic.twitter.com/qJGklqvcxE,1,2
#NOWPLAYING is "Fly To The Angels " by Slaughter! RT & Rate it NOW at http:// all80shair.com pic.twitter.com/K5wKlGiQJ8,1,3
Neither the angels in Heaven above/ Nor the demons down under the sea/ Can ever dissever my soul from the soul/ Of the beautiful Annabel Lee,0,0
When his dad pitched for #Angels  he lost his baby brother. Now he'a pitching for them both. #Phillies http://www. latimes.com/sports/mlb/la- sp-phillies-leiter-shaikin-20170506-story.html …,23,36
Picturehouses NT Live: Angels In America - Cinema City @jockywocky https://www. picturehouses.com/cinema/Cinema_ City/film/nt-live-angels-in-america-millennium-approaches …,0,0
Fly with angels @OregonMedicMike #homebound,0,1
Ist er jetzt bei den Pfand Angels ?,0,0
What about angels by birdy breaks my heart,0,1
It's a treat to watch the @Royals out here. So rarely I can watch em unless playing #Angels on @FoxSportsWest @FOXLA or @FS1,0,0
George Christie you scrawny little rat stop spamming The Angels Code - Outlaw Chronicles: Hell's Angels | Nonfiction Sonny is legend ur shit pic.twitter.com/SOjo1IMjwt,0,0
[Los Angeles Times] Mark Leiter Jr. reaches the majors 23 years after his younger brother's death http:// sportspyder.com/teams/los-ange les-angels/articles/21414759 … #Angels,0,0
may angels lead you in,1,7
They suck so much! I had one two weeks in a row at 2 different concerts and it was terrible. Friends that //know// are angels,0,2
#MLB #Astros Alex Bregman will start at 3B and bat 8th vs Los Angeles Angels on Saturday.,1,1
Do not look into people for angels you will only be setting them up for failure #TheChamp #ThinkBIGSundayWithMarsha,1,0
#Win a Test Driving the Tarot Prize Pk @pawsitiveliving https:// goo.gl/BcEdb3 5/10 #guidance #angels #doreenvirtue #radleighvalentine,0,0
☇•°☆@Angelblanco100 ☇•°☆ @insaurraldeh ☇•°☆ @Nena_Fan1 ☇•°☆@Lizchiste1 ♯ #TeamSharis ♯ ☇•°☆ @Polethf_ Angels ☇•°☆ @SharisLind ☇•°☆ @WilfelJ,1,1
Women are angels  men are... moose? https://www. instagram.com/p/BTxHJCYgIEe/,0,0
My condeleances to all parents and may your souls rest in peace little angels . https:// twitter.com/cnnbrk/status/ 860974961867051008 …,0,0
Airlines are no angels  malpractices galore in every airline and travelers continue to suffer so Govt should specify duration #NoFlyList,0,0
Check out Huge 30 + different BILL BUCKNER cards lot 1980 - 1990 Cubs Sox Angels Royals http://www. ebay.com/itm/-/25284786 7029?roken=cUgayN&soutkn=chWH3X … via @eBay,1,0
i can't believe angels exist. im truly blessed to be able to see this beauty with my own too eyes. gorgeous. https:// twitter.com/BLACKWVTCH/sta tus/860968681358143488 …,1,3
Angels Forever me da la vida https:// twitter.com/linodelrey_/st atus/860980944722898945 …,0,1
20 minutes to #posttime  which means time to break out the @Angels _Envy Kentucky Straight Bourbon. #KentuckyDerby143 #runfortheroses,0,3
Style Lab by Fashion Angels Print Zipper Case Clutch Cosmetic Bag Small NWT http:// dlvr.it/P4hGk8 pic.twitter.com/i0mY8mOPrt,0,0
Some people are actual angels I swear.,0,1
Airplanes cut through the clouds Like angels can fly we'll never die Sirens cut through the night #Songs5SOSLetDie,0,1
Waiver Wire: The #Angels have announced that they have acquired recently DFA'd right-hander Damien Magnifico from... http:// fb.me/18ZQEmxXb,0,0
Angels carry you dreams and wishes to God. But they also carry your worries and burdens http:// fb.me/14njZT64i,0,0
@NationalTheatre Angels in America is beyond words! A truly phenomenal evening that made 3 and a 1/2 hours fly by! Stellar performances.,1,0
Pic of the year..I see angels pic.twitter.com/tK5EgFDngZ,1,2
Reputation is what men and women think of us; character is what God and angels know of us. - Thomas Paine,1,1
Waiver Wire: The #Angels have announced that they have right-hander Jose Valdez for assignment. -Eric,0,0
Jack and Jack are my angels  thanks for exist and make me smile everyday pic.twitter.com/gKv18ulPNZ,0,0
Jack and Jack are my angels  thanks for exist and make me smile everyday pic.twitter.com/EkvvBeTvr0,0,0
#WeLoveLA #Angels Mark Leiter Jr. reaches the majors 23 years after his younger brother's death http:// srhlink.com/P4hFZP #SportsRoadhouse,0,0
Doro Pesch feat. Tarja Turunen - Walking with the angels https:// youtu.be/_3WFtStc7Nk putem korisnika @YouTube,0,0
Do you hold down then hit delete? Idk!,1,4
Angels never had to die like you me and Jesus! pic.twitter.com/SG68ikNe2o,0,0
So angels  angels please just keep on fighting Angels don't give up on me today..,0,0
@darcydonavan I do believe in angels because you are one of them. God bless you and your beautiful heart of gold.,2,2
SH: I may be on the side of the angels ... but don't think for one second that I am one of them.,0,0
Angels,0,1
#MLB • (O 8½) #Braves • #Reds (-128) • (O 8½) #Mets • #Yankees (+1½) • #Padres (+1½) • #Angels (+1½),0,0
ME ESCRIBIERON TEEN ANGELS YO LAS AMO #MTVVideoEgo #MTVArtArLali #MTVExPopLali #MTVInstaArLali #PremiosMTVMIAW,1,0
Angels on the Balcony is pretty high for me!,0,1
i got the devil in my head but angels swimming in my blood,0,0
Let me hear my angels beautiful voice #Z100Styles http:// bit.ly/HarryAlbumParty,0,0
I've been seeing angels in my living room,0,2
Harry siempre con los Angels ay,0,0
Not saying our moms aren't angels  but they definitely got down. I mean how you think we got here and daddy not still around?,2,2
" Angels  birdseed scum bucket French Whore..." Emmy-winning dialogue there #ColumboTV,0,3
#slender #ebony leggings #milano #transsexual summer #stockings angels pic.twitter.com/M6b2LzkvDK,0,0
Swami Sevaratna: Angels in the Night… http:// swamisevaratna.blogspot.com/2017/03/angels -in-night.html?spref=tw …,0,0
#ThingsJesusNeverSaid We don't need Angels to spread the Word. We got TV Evangelist's in private leer jets. Hell Yeah KennethJoelCref&&&,0,1
My angels pic.twitter.com/Q6hVen8yLE,2,7
all my mutuals? beautiful angels,0,4
"I know angels that would not father us for we are a school of darkness" @musicman_nkosi in The Collagist #90: http:// thecollagist.com/the-collagist/ 2017/3/18/mechanics-of-the-negro.html …,0,2
Do you think you'll be the guy to make the queen of the angels sigh? pic.twitter.com/UOwgAWj88I,0,8
What if to save little angels you have to become the monster? http:// myBook.to/LittleAngels #romance #bensonandstabler #suspense #mustread pic.twitter.com/0F4EYaFJvy,1,0
" Angels and Demons ",0,0
私も現実に帰りたくないすわ(´；ω；｀),0,0
my babes supporting justin actually angels https:// twitter.com/btschsplus/sta tus/860903510803697667 …,0,0
Everytime I wear a very sexy I realize why I buy dream angels push up only,0,0
