
@_EthanandGray @graysonscute @rosesfordolans FOLLOW THESE ANGELS PLEASE @GraysonDolan @EthanDolan,1,2
Sandbar Angels #SandbarChandler #Sandbartv pic.twitter.com/nMdHT90ngt,0,0
angels oh my i love them pic.twitter.com/Ft8J9Bu5xg,0,0
Blue angels pic.twitter.com/lv5BSI5Nw0,1,1
now my head is on backwards... and my feet are funny angels https:// twitter.com/yunglame/statu s/860544280527478784 …,0,1
What women do fucked up shit bro stop tryna convince yoself otherwise they not angels they just as bad as us,0,0
ouvindo despacito e k.o em looping com Angels pic.twitter.com/9fUxqc7WaV,0,1
dynamic duo,0,0
yung sa daras secret angels maganda rin audio,0,1
Its beautiful - one can imagine the angels praying it. I am Catholic too.,0,0
I liked a @YouTube video http:// youtu.be/eY6ERwMQudo?a Khalid - Angels (Stripped) (Vevo LIFT),0,0
Bringing you all bright blessings from Arch Angels Zadkiel and Amethyst of the Violet Ray of Divine Love for... http:// fb.me/yvPEuM5D,0,0
I entered to #win any book or eBook up to $10 from @angels _gp during the May I Suggest #Giveaway #Hop http:// angelsguiltypleasures.com/2017/05/may-i- suggest-giveaway-hop-may-6th-15th/ …,0,1
#MLB angels ML (+105) $500 to win 525,0,0
My New Book IN THIS MOMENT ANGELS ’ SWEET REFLECTIONS Amazon: http://www. amazon.com/This-Moment-An gels%C2%92-Sweet-Reflections/dp/1504335376/ref=sr_1_1?ie=UTF8&qid=1438608760&sr=8-1&keywords=In+This+Moment+Brenda+Rachel … pic.twitter.com/ZuJnOs8LsV,0,0
Angels friends are ugly lol,0,1
good night angels !,0,0
Robe Williams // Angels,0,0
White Coat Angels ！！,0,0
ohmyhearteu- they are so precious two cuties and pure angels . https:// twitter.com/btshdpics/stat us/860990072895811584 …,0,0
#onlyrockradio #promo #music #artists #bands #np @Bedrokkv8 - Angels or Demons http:// bit.ly/25tiorr,3,2
Check out Jim Shore-Certified International Angels -Four Seasons Cookie Jar http://www. ebay.com/itm/Jim-Shore- Certified-International-Angels-Four-Seasons-Cookie-Jar-/162477368923?roken=cUgayN&soutkn=UvvgdQ … via @eBay,0,0
When the base is full and you the Blue Angels in a parking lot. #urownflyover pic.twitter.com/5V6UQoJL5L,0,1
#TeamUnidoS @_chicadebatman º° @MonicaR926 º @Polethf_ Angels º @amega6 º @yagerlot01 º @Conymgwv º @Mercedhoy º @Ultramind2001,0,1
Buenas noches,0,4
Angels on greys anatomy>>>,0,0
Trouhoun,0,3
I liked a @YouTube video http:// youtu.be/zcBufqdSG9o?a Reptilian Angels !!! - Nephilim - book of Enoch,0,0
Angels exist https:// twitter.com/worldofmaglc/s tatus/860996474305486848 …,1,3
Calling all #angels and #miracles PLEASE back share & RT my #Kickstarter http:// kck.st/2pvPRgE #ellenhonich #crowdfunding #starvingartist,0,1
Amazing how Lucifer was the brightest of all angels only to chuck it away. I'll never understand this.,0,0
So go with me here: Angels are basically the Ood.,0,1
Dots are pilots who connect the angels,0,0
Doing the Angels tonight https://www. sportsaction.io/picks/5016812d ca91417ca2efc90c1cc5678a … pic.twitter.com/iuwyDI8Ods,0,0
Good MLB players but boys work on those abs & tighten up your butts!,0,0
thanks man! yea i really like ambient stuff. U2 30 seconds to mars angels and airwaves all those bands with an atmospheric effect,0,1
Happy Sunday tito God bless - from Dodong's angels,0,0
If we can get top pitching/player prospects for Cain/Herrera from the Nats for Hoz from the Yanks for Vargy from the Angels or Dodgers...,0,0
We're here at Fiesta Angels playing some fun interactive games. Be sure to swing by our booth for a chance to a premium prize! #ThatsSoSocal,1,1
I LOVE KIDS... Don't get me wrong. When I'm put on parties I dread it. At the start they are all nice little angels  they thenactlikedevils,0,3
Pilots are the angels who connect the dots.,90,907
Angels ’ C.J. Cron: Rehab assignment set http://www. thescore.com/news/1296161,0,0
So sorry Angels ! Rest relax and you'll feel better soon. We'll see you when you are able and well.,0,1
#NowPlaying The Supreme Angels - If It Had Not Been For The Lord On My Side,0,0
What angels pic.twitter.com/30Sc0jI5UC,0,0
you know what if AV wants to dick over this rangers team whatever. i have a summer full of watching these blessed angels . i'll be ok.,0,0
Oh trust in my self-righteous suicide I cry when angels deserve to die In my self-righteous suicide I cry when angels deserve to die,0,0
i don't think you trust in my self-righteous suicide i cry when angels deserve to die,0,0
A review of 1938's classic gangster movie ' Angels With Dirty Faces': http://www. thehighwindowblog.wordpress.com/2017/05/06/fil m-review-angels-with-dirty-faces-1938/ … #jamescagney #gangsters #films,0,0
When the sky opens up and the angels come down.. ashes to ashes... love https://www. youtube.com/watch?v=PdRVzo 2acUc …,0,0
5/20-5/21 Come learn to connect with your guides & guardian angels . Using nature meditation essential oils &... http:// fb.me/1dH7NKVDz,0,0
nah now what about angels is playing i'm sobbing,0,1
what about angels set me off,0,0
se aproxima nuestro primer #Evento Angels  reserva tu cupo y se parte de una experiencia unica  informe en nuestro inbox. pic.twitter.com/f5k3WndScB,1,15
Divine Healing provides angelic assistance in surrendering pain #grief #suicide #loss #angels #support @vonnesolis http:// bit.ly/divinehealingb ook … pic.twitter.com/SVULfntw2H,0,0
Bona nit,0,5
In the arms of the angels,0,2
Not saying I agree or disagree w/ it. However it's becoming an alternative protein source in some countries.,0,0
#WeLoveLA RT " #Angels Game face. pic.twitter.com/CUJGcGnayO " #SportsRoadhouse pic.twitter.com/pRbrwHeq0m,0,0
@Angels _Folch Yo soy Catalunya https:// buscandoenmiinmensidad.com/jo-soy-catalun ya/ … … Esta en Castellano para que nuestros vecinos y gentes de otros Países la entiendan,3,9
Angels In My Hair = amazing,0,0
The Angels - No Secrets,0,0
Congrats to Cheer Extreme Angels ! pic.twitter.com/9n02IxqQBd,1,3
He encontrado una grabación genial de « Angels » en #Smule : http://www. smule.com/p/847137395_75 7992618 … #SingKaraoke,0,0
Just want to thank @ImJosephMorris for being the reason I know Joseph's Angels,2,4
Love it... Hops had faded today but still in there.... (Pollen Angels - Scuttlebutt) http:// untp.beer/s/c449267040,0,0
look!! at!! these!! ANGELS !! pic.twitter.com/TvlIPXfTWt,0,2
Angels keep falling from the sky. I'll take the broken wings & learn… https://www. instagram.com/p/BTxOC2iFUfd0 xVblMhqGUzFKhZehP0pkIqBe600/ …,0,0
Non-fiction! She communicates with Angels . It's amazing.,0,0
Friends are angels who lift our feet when our own wings have trouble remembering how to fly.,0,0
I don't know any of you... But...I blocked her too... Sorry for your loss Bridget...no parent should watch the angels go first.. No...,3,8
Not at home tonight but stoked to watch my dude on the bump facing an Angels team batting .184/.295/.303 against him. https:// twitter.com/theaceofspaede r/status/855191932812840960 …,0,12
Owen's Angels,2,1
Mariah Carey - Angels Cry ft. Ne-Yo https://www. youtube.com/watch?v=DyGNfb KkMVE&feature=share …,0,1
Angels game tonight,0,4
why does Quavo float with the angels on this song? I'm inlove https:// twitter.com/sandra_iare/st atus/860996584535986176 …,0,0
Memorial Service for Community Hospice.... #grace @Saint Michael And All Angels Episcopal Church https://www. instagram.com/p/BTxN6OkFX-v/,0,0
Ruth you said dave had a wish to be me . You said Dave with a cunt was a Hells Angels that wished for my birth certificate . Get even !,0,0
looks like i may be getting the old team back together to snatch a bag next week french's angels originals,0,0
I added a video to a @YouTube playlist http:// youtu.be/JZtzuhnqyMc?a Henry Gruver: Fallen Angels Chained Beneath Streets of Rome!,0,0
@W_ Angels _Wings thanks for the RT :),0,1
Angels being hunted by Satan to fight back against white privlege,0,0
its basically the fantasy anime with a great mc you've always wanted its got demons fighting angels with humans stuck inbetween,0,0
I liked a @YouTube video http:// youtu.be/wpK2r7EfjEQ?a Music Only - Guardian Angels Come In ~ Peaceful Music Meditation Video,0,0
Damar had a great arc - it's incredible how different you feel about him at the end of the series than you did after Sacrifice of Angels,0,1
@CraigyFerg I saw the US Navy Blue Angels today at the Barksdale AFB Air Show. Thought you might like this. #AmericaFuckYeah #DangerZone pic.twitter.com/g7ek7IvxeS,0,1
I took a flight to Chile yesterday and got lucky enough to get the SAME flight attendants back! I wanna party with these angels .,76,1119
Love it!,0,1
download single D' Angels "Maafkan Aku" di http://www. reverbnation.com/dangelsband,0,0
I added a video to a @YouTube playlist http:// youtu.be/7u0VcRCrOr0?a ALERT WATCH REAL PROOF The Fallen Angels Imprisoned in Antarctica and,0,0
Andrew Garfield se gana a la crítica con “ Angels in America” https:// goo.gl/0j1SN9 pic.twitter.com/rvDpTrcbUO,0,0
angels https:// twitter.com/whatsaphan/sta tus/860992256831922176 …,0,0
Jeff Carter of Hyde Park Angels on the Importance of Being Coachable in Entrepreneurship http:// ln.is/tech.co/Qb2B3,0,0
#9: Witnessing of Angels : Witnessing of Angels Amazon Video ~ Patrick Macnee (7) Download: $1… https:// goo.gl/fb/VO9CXE #Faith #Spiritualit,0,0
AOA (Hangul: 에이오에이; an acronym for Ace of Angels ) is a South Korean idol girl group signed under FNC Entertainment. AOA debuted as an eight-,0,0
goodnight to these angels only pic.twitter.com/KcSII50ZzS,0,1
I've been seeing angels in my living room that have walked the sun and slept on the moon,0,2
#Angels #Archangels from on high here to help you live #spiritual and #happy anf lives http://www. amazon.com/Angelic-Thinki ng-Angels-Positve-Guidance-ebook/dp/B01BPNN5H0 … pic.twitter.com/lEcR3lC6uX,0,0
Jack and Jack are my angels  thanks for exist and make me smile everyday pic.twitter.com/jSXNle80rH,0,0
Jack and Jack are my angels  thanks for exist and make me smile everyday pic.twitter.com/kfha4lwv8N,0,0
Bangtan my precious angels,0,0
ive been playing angels of death for 3 hours straight and it was a wild ride u can ask shinji lol tired so im sleep now zzzz,1,1
MLB | Three up and three down #angels #laa #MLB http://www. laangels101.com/2017/05/06/mlb -three-up-and-three-down/ … pic.twitter.com/IxOJO4FmNC,0,0
MLB | Three up and three down #angels #laa #MLB http:// sport-ne.ws/4j6c pic.twitter.com/QHSErTNgrW,0,0
ILL JUST DIE THEN!!!!!!!!!!,0,1
@swvymusic heavens angels ... now that's the shit,0,1
Even angels como la banda sonora de mi vida.,0,0
I love living next to a pub on a Saturday night currently hearing angels being slaughtered on karaoke for the 7th time this evening,0,3
Now playing Angels by Big K.R.I.T.! http://www. CountryRapTunesRadio.com,0,0
RIP to all innocent angels perished in road accident.Mwenyezi Mungu awatie nguvu… https://www. instagram.com/p/BTxNb48AKgw/,0,0
Angelina Children & Louis: Monthly Newsletter We'll have a special section about the Anaheim Angels  I'll take photos in Anaheim.,0,0
I hope bangtan's healthy happy safe and warm I hope they're getting a lot of rest I hope they're eating proper meals I love my cute angels,12,24
ricky and bob are the sweetest angels in the world pls protect,1,4
Boas Noites,0,5
RT @YungLittlefoot : Shout out to @Mrcatchhiscut32 he's got angels up in heaven!,0,0
MAY 9th IT ALL ENDS HERE Books 1&2 #free with #UNLIMITED Special... http:// ln.is/b5d08 by #W_ Angels _Wings via @c0nvey pic.twitter.com/HT8mvSjrHR,0,0
[Fan Vs Fan: LA Angels Insider] Angels Acquire Damien Magnifico http:// sportspyder.com/teams/los-ange les-angels/articles/21415042 … #Angels,0,0
[Fan Vs Fan: LA Angels Insider] 2017 Game 32: Astros at Angels http:// sportspyder.com/teams/los-ange les-angels/articles/21415041 … #Angels,0,0
Saturday moods featuring my 3 angels pic.twitter.com/nuPw8bEE0v,0,1
. @HondaCenter til midnight last night. @KNX1070 6am to noon today then @Angels Stadium 4pm for @michaelaraujo55 . Life of an #announcer,4,48
Hello ! This is " Sounds of Angels " music and video by Adik Angel ! - https://www. reverbnation.com/artist/video/1 4489433?0 …,4,1
Totalmente,0,1
RCF Angels Game! #resolutioncrossfit #rcf #angels https://www. instagram.com/p/BTxNFC3ldBq/,0,0
hey angels im hot,0,0
#WeLoveLA #Angels O's notes: Britton Ynoa to DL; Asher Verrett recalled; Schoop sits; Kipper… http:// srhlink.com/P4hvPG #SportsRoadhouse,0,0
#WeLoveLA #Angels Saturday's Sports Transactions http:// srhlink.com/P4hvNX #SportsRoadhouse,0,0
I've been seeing angels in my living room !!!,0,0
little angels pic.twitter.com/HLUQjxzpt3,0,0
APM (POR): "Charlie's Angels ". YOUTH QUARTET 5th place. #EuropeanChampionship #Mouilleron2017 pic.twitter.com/tWbAkclmem,0,0
My angels I vote for @BTS_twt for the Top Social Artist Award #BTSBBMAs,2,0
angels supporting angels,0,0
awww LOOK AT THOSE ANGELS did u have fun love,0,0
. ╔╗╔╗╔╗╔╗╦╔╗╦ ╚╗║╝╠░║░║╠╣║ ╚╝╩░╚╝╚╝╩║╩╚╝ @Polethf_ Angels @alfgom47 @WilfelJ @xIM_G_W_VIx @HectorOscar4 @srone82 @Lu_Stratocaster @trovej0u,2,3
Corona National Little League: AA Angels (3) at AA Cardinals (12) - FINAL https:// goo.gl/YsEyHB,0,0
♡Ace Of Angels ♡,0,0
Kingdoms have fallen angels be calling none of that could ever make me leave.,0,0
I liked a @YouTube video http:// youtu.be/qVmMDVlytGE?a How To See ANGELS,0,0
angels deserve the world,0,0
#nowplaying Angels Of Liberty - Eat The Sun http:// cathedral13.com/blog13 #goth #deathrock #postpunk,0,0
There are certain people that when I see how they behave makes me believe they are angels,0,0
I've just watched episode S10E17 of The Angels ! https:// tvshowtime.onelink.me/3966595826?af_ dp=tvst%3A%2F%2Fshow%2F249116%2Fepisode%2F5961662%2Fdetail&af_web_dp=http%3A%2F%2Fwww.tvshowtime.com%2Fshow%2F249116%2Fepisode%2F5961662&referrer_id=5617502&source=auto-tweet … pic.twitter.com/xkgpx2m2YY,0,0
-حُب ام حرب يا فلان؟ -"لا فرق بينهما ف كلها اما ان تخرج قاتلاً او مقتولاً" -الحب بهذا السوء؟ -"اما ان يكون لك داء او دواء". #بوح_ angels,0,1
"It's too cold outside for angels to fly." - Ed Sheeran,2,2
ASAP Rocky - http:// long.live .asap *Fashion killa * Angels *Fuckin problems *phoneix *Wild for the night,1,1
@nebuIababy my two favourite angels who i LOVE,0,2
Shout out to @Mrcatchhiscut32 he's got angels up in heaven!,0,0
Therapists angels and goddesses (4 x 3) wmv #LOVEADDICTION #clips4sale http:// clips4sale.com/28067/11200553 via @clips4sale,0,0
MIGRANTS CREATE BARRACDE IN PARIS CALLING IT ISLAMIC STATE WELL TO ALL REMONERS YOU SHOULD BE LIKING THE SHOES OF YOUR BREXIT ANGELS ?,1,1
...a hilariously simplistic description of theatrical stage logic (power = up; angels fly off to the right; etc) to the crowd's bemusement.,0,0
goodnight angels,0,2
MAY 9th IT ALL ENDS HERE Books 1&2 #free with #UNLIMITED Special... http:// ln.is/efmjz by #W_ Angels _Wings via @c0nvey pic.twitter.com/nasjLTqt5s,0,1
#Lucifer quote for the day: "When angels fall they also...rise.",0,0
Wow I hope that's what all angels look like. That would be very sweet Jose M.,0,2
ANGELS https:// twitter.com/fatimaaaaaaaaa b/status/860979688386297857 …,0,0
Eso suena a los Hells Angels en un tiroteo que hay por internet sus fotos.,1,2
bn @sacha_bailen @QuimMsbd @notarioalcala @isifuerayo @alegna_g @lydiamp20 @angels _blaus @misabeliglesias @Evvuska https://www. youtube.com/watch?v=_QFgPt mM7Ps …,0,1
I configured webpack three times last week and I could swear the heavens opened and angels descended @jevakallio is my witness,0,3
THEYRE ANGELS I TEARED UP https:// twitter.com/danmaii/status /860956550852222976 …,0,1
OMG I just now only heard about her Stroke So Many Special Prayers & Angels All Around So much Love & Prayers.,0,0
#DoctorWho Didn't think it was that scary. Now the Weeping Angels can make you live an alternate life and slowly die - now that's scary.,0,1
Rick Astley - Angels On My Side http:// ln.is/www.youtube.co m/OExjo … vía @YouTube,0,0
Painful by StrongerEveryDay I wanna get high with the angels  and never come back down. But the d... http:// tinyurl.com/lrloudn #poetry,0,0
•˚*•.¸•° #TmUS friendship,0,0
25 Years Later ‘ Angels In America’ Returns To London http:// jd.fo/UO2Q via @jdforward,0,0
When you're about to commit a sin think about 3 things: 1-Allah is watching you 2-Death 3- Angels are recording you.,0,0
Victoria's Secret ANGELS BY VICTORIA'S SECRET VICTORIA’S SECRET DARLING MESH THONG PANTY pic.twitter.com/yVsGq2lsCC #Victoria 'sSecret,0,1
Amazing Blue Angels airshow! pic.twitter.com/zQotI45FEp,0,0
Join @amynewmark on a @ChickenSoupSoul podcast May 10th featuring my story "My Interstate Navigator" from Angels and Miracles pic.twitter.com/6S1vU5irAV,1,1
Sparkle up your things bright shiny #Wings of #Angels #Crystal #Stickers http:// bit.ly/RzRrrg #love #healing pic.twitter.com/rGlBljVMR4,0,0
Bambam was born the year after Tupac died. God needed someone to fill his shoes as the best rapper of all time so he sent one of his angels pic.twitter.com/Zh62WNcAcv,1,7
Grumbler? Cardinals vs Braves OVER 8.5 & Los Angeles Angels -102 #SharpAction #GrumblerBetting #SportsBetting,1,1
This film seems a little bit like the city of angels  another of my favourite films. #ghost,0,0
Every Muslim must believe in angels as we know from the Qur'an. "It is not devotion to turn your faces towards... http:// fb.me/UPpONdjV,0,0
EP out end of May! Featuring Pretty Boy Blood Diamonds Angels &Demons and Plastic! :) x,0,5
おはようございます！こちらこそイベントではお世話になりました!!まさかの同郷という事実に大興奮してしまいスミマセン！ 水色さんの双律本が最高すぎて、ここ数日、顔がにやけっぱなしです♪そして、もっと自分は頑張らねばな！と思いました(^-^)本当、福岡で双律語りしましょうね!!,0,0
『FMV』BTS (방탄소년단) || Angels By The Wings https:// youtu.be/UpEpcopsY4o vía @YouTube #BTSBBMAs LPTM QUIEN HIZO ESTE VIDEO???? LLOREE COMO IDIOTA,16,20
Thahajjudh is the best form of Tharbiyah witnessed only by Allah and angels while the people are sleeping. Let's practice.,1,2
Welcome to a place of healing ~ #newearth #angels #lifepathseven #forest #trees … https://www. instagram.com/p/BTxMORnDZ-Q/,0,1
watching someone play angels of death and if hatoful has taught me anything: do not trust the doctor,0,1
I've been seeing angels in my livingroom,0,0
Indians winner....Cubs and Angels are the late plays,0,0
#TeamUnidoS @_chicadebatman º° @MonicaR926 º @Polethf_ Angels º @amega6 º @yagerlot01 º @Conymgwv º @Mercedhoy º @Ultramind2001,2,1
5 of 5 stars to Bending Angels by Jack H Emmott https://www. goodreads.com/review/show?id =1990203487 …,0,0
I'm at Angel Stadium of Anaheim - @mlb for Houston Astros vs Los Angeles Angels in Anaheim CA https://www. swarmapp.com/c/8BdlaeDvzSJ,1,1
8)--- We are the people and WE (((( must )))) UNITE for HUMANITY for our NEW ANGELS (((( KIDS )))) - As we all... http:// fb.me/930QAwpKT,0,0
Houston Astros vs Los Angeles Angels Live http:// livestream-tvs.com/2017/05/06/hou ston-astros-vs-los-angeles-angels-live/ …,0,0
#Baseball - YAO Baseball League: Marlins & Angels Win http:// ift.tt/2plydM8,0,0
Tarnished Angels Concert with the New Horizon “The Dynamics” Band Tomorrow 7:00pm http:// snapd.at/tew3mpd,2,0
those dam. angels coming for you,0,0
Fallen angels fear no one Vendetta--new DeadlyCuriosities urban fantasyhttp://bit.ly/1NfC29Z,0,1
⊿The E.L.F ...My Angels My girls,0,0
If he's so magnifico why is he in AAA?,0,1
Pitbulls are angels with tails. #LoveABully pic.twitter.com/RHnMdVjeRp,0,0
If you're at UC Irvine Night with the @Angels today share your pix/posts with #UCIPride ! pic.twitter.com/EWhwG3Onl3,2,18
Me ha gustado un vídeo de @YouTube ( http:// youtu.be/QHtFUBhP460?a - Carlos Marco - Even Angels (feat. Blas Cantó)).,0,0
#BTSBBMAs I probably put more effort and time in these angels than I do in school lol GO ARMYS,0,0
Libras are angels that turn into devils. #AsTrollogy,0,0
The Atros have the best record in the #AL Get Our FREE #Pick for Houston Astros vs. Los Angeles Angels https:// goo.gl/YU8LmU #MLB pic.twitter.com/rNCHtsH2NX,0,0
YAO Baseball League: Marlins & Angels Win http:// bernews.com/2017/05/yao-ba seball-league-marlins-angels-win/ …,0,0
Jonghyun and hyunbins relationship kills me breaks my heart everyday how do such angels walk the earth https:// twitter.com/johsuahong/sta tus/860540088626798592 …,1,1
Walking down the streets looking for angels Everyone I meet looking for angels,0,0
Mam nowy film na playliście w @YouTube : Hildegard von Bingen - Voices of Angels - Voices of Ascension – http:// youtu.be/v6qFCYRQKVA?a,0,0
Going through this life looking for angels People passing by looking for angels,0,0
“ Angels can fly because they can take themselves lightly.” - G.K. Chesterton,1,2
レイラン「自分の名はレイラン、オラクル船団のフェオに住んでいる。仕事は主に暗殺や斥候などと多岐に渡る。そんな自分だが、最近 厳ついキャストに追い掛けられ『体を見せろ』と至極気持ちの悪い事を言われていて、仕事どころでは無い。誰か助けてくれ。」 Angels 「」,0,0
The Children's Area Monthly Newsletter: *News *Weather *Sports *Anaheim Angels,0,0
دايم اطيح معك ، واخر مرة طحت بسميرفك ، بس لعيب الله لا يضرك,0,0
Going through this life looking for Angels People passing by looking for Angels,0,0
My hand is still numb after 2 hours because I touched God and his five angels and I'm not even kidding pic.twitter.com/i1fFif8Dlf,0,2
I knew angels existed https:// twitter.com/sethsromans/st atus/860974968238206976 …,1,0
Buenas noches estrellas de la noche https://www. youtube.com/watch?v=7o_Y3F ALzyU …,3,6
thy fall is far #lucifer #art #darkart #artist #arts #dark #darkartist #thefall #demons #angels … https://www. instagram.com/p/BTxLviWBX0q/,0,0
On page 300 of 576 of Rebel Angels  by Libba Bray https:// goodreads.com/user_status/sh ow/130791287 …,0,0
Last Sept @Athletics vs @Angels with @JoeyWendle at second pic.twitter.com/5OCw6F2z3B,0,0
Sorry Angels . I hope you feel better soon.,0,2
Honky Tonk Angels #VinylRanch @Williamsburg Brooklyn https://www. instagram.com/p/BTxLmlyht1P/,0,0
I liked a @YouTube video http:// youtu.be/D3UxwQFzL30?a Blue Angels w/ Frank Weisser 2016 Oceana Air Show,0,0
Angels bro,0,0
#09/24/2017 Rev 12 Astonishing 1/3rd of Angels cast down to Earth see why in book http:// goo.gl/Z1dXSC http:// jesustweeters.com,0,0
Coke Angels でライブします。 Yumi Godsey SAGA LIVE GEILS '17.5.21.sun OPEN17:00 Start17:30 Adv￥2000　Door￥2500 +1ドリンク￥500 pic.twitter.com/yYFSRYS6Q7,0,0
@WoolieWoolz @AngriestPat Just looked up The Fallen Angels wiki turns out Harry Ness the guy with the bomber jacket is actual a Marine.,0,0
Drinking a Maple Angels by @BissellBrosBrew at @bissellbrosbrew — http:// untp.beer/s/c449245997,0,0
Shoutout to the biggest angels @GPinkSnapback and @4ousnapchat for helping others get noticed tonight ! You two are the best x,0,3
Great call on my part here,0,0
Now war arose in heaven Michael and his angels fighting against the dragon. And the dragon and his angels fought... http:// fb.me/8BjBBCCyB,0,0
Idiot,0,0
Now war arose in heaven Michael and his angels fighting against the dragon. And the dragon and his angels fought... http:// fb.me/16eTHumE2,0,0
@astros vs @Angels @8:07 PM #SaturdaySpecial : #FREE #DESSERT w/any 18" #BigDave #Pizza ! $2 drafts! #doubledaves #GoAstros #Astros #earnit pic.twitter.com/2DQSKmJLe2,0,1
THIS IS EXACTLY HOW UFOs FLY EARTH'S MAGNETIC RESISTANCE Levitron Cherry... http:// ln.is/tiC65 by #W_ Angels _Wings via @c0nvey,0,0
What a mother’s love can do! “When Angels Fly” by @MaryLSchmidt http:// tinyurl.com/jkklswf #RRBC #PDF1 #RPBP #IndieBooksPromo #bookboost,9,4
Rob Dougan - Furious Angels http:// fb.me/3iRo4SbjZ,0,0
The Black Angels - I'd Kill for Her - Death Song (2017),0,0
Friends are angels who lift our feet when our own wings have trouble remembering how to fly.,0,0
These Islamic terrorists had only 1 aim when they abducted these sweet angels : impregnate them to produce future jihadis and then abandon,1,10
シアトル発Crystal Angels のジュエリーを販売開始！　かわいいワイヤーアクセサリーですよ。　よかったら見てください。,0,0
The #MVP 's hit streak continues. http:// ln.is/MkJ9j (via MLB Fans) by #Angels via @c0nvey pic.twitter.com/bpqZ4g4VqK,0,0
Angels don't sleep. Neither will there be sleep nor break time in hell fire but torment and damnation for absolute eternity. Please repent.,0,0
Pain is all over me I need angels all around me,1,0
VOY A VER A RICH CHIGGA EN VIVO! Me siento la reina de los teen angels .,0,1
Me being emo rn: I cry when angels deserve to die,0,0
Angels of fluff. http:// fb.me/1m1ugrI1H,0,0
5/6 Astros @Angels [Game Thread] http:// ift.tt/2qc8FFe #angels,0,0
デマらしいよ,0,0
OSAA Mustang Baseball League: Mustang 9 Angels (4) at Mustang 9 Pirates (6) - FINAL https:// goo.gl/Zr80ah,0,0
The angels of my life pic.twitter.com/oAT04unepS,0,0
Now playing Angels Watching Over Me by Mama Byars! Listen live here: http:// soundofagape.out.airtime.pro:8000/soundofagape_a,0,0
Please RT? #travel #traveller Video: Hiking Angels Landing in Zion National Park http:// tinyurl.com/gq889z6,0,0
Rt if you're proud of these seven angels ! #BTSBBMAs pic.twitter.com/XjVKrRRjRO,6,2
Angels game on the 16th,0,0
I’ve voted for @BTS_twt for the #BTSBBMAs 2017 Top social artist Award My Boys My angels,1,0
@sonunigam @kumarpriya 2day is a special day for me..My 16th birthday.I wish my angels will bless me n I hope u will like this L VE YOU pic.twitter.com/ZV87WwRSoV,4,7
