
Congratulations,1,1
Congrats to Cheer Extreme Angels ! pic.twitter.com/9n02IxqQBd,1,3
Angels ♡ pic.twitter.com/web20ZCGKY,0,1
Let's get back on that win streak guys!!!,0,0
Whoever dates the twins protect them at all cost they are my precious angels sent from Heaven @EthanDolan @GraysonDolan,0,2
Angels rally for four in ninth to tie score but Astros win game 7-6 in 10 innings - Los Angeles Times http:// dlvr.it/P4jRxl,0,1
Read about the fallen angels who live below us - #RiseOfTheNephilim http://www. amazon.com/dp/B00S6KZSP8 - http:// bit.ly/2dgv7TA,0,0
i watched the angels take manhattan the other day and i cried years later ffflgn i didnt even expect myself too,0,0
The Piano Guys - Angels We Have Heard On High on Radio Santa Claus - Listen now! http://www. radiosantaclaus.com/listen/aac,0,0
NEW LOCAL DEAL: Los Angeles Angels of Anaheim Groupons http:// bit.ly/2qpVkG7 #MLB #LosAngeles pic.twitter.com/1iGfillo2r,0,0
NEW LOCAL DEAL: Los Angeles Angels of Anaheim Groupons http:// bit.ly/2qpVkG7 #MLB #LosAngeles pic.twitter.com/j0QtDQvdKx,0,0
NEW LOCAL DEAL: Los Angeles Angels of Anaheim Groupons http:// bit.ly/2qpVkG7 #MLB #LosAngeles pic.twitter.com/lXaIqRmuGy,1,0
#Music Hark the Peaceful Angels (60) - Radio 257 at #Christmas Music Station listen at : http:// tunein.com/radio/Christma s-Music-Station-s209552/ …,0,0
Let's keep voting guys Our angels appreciate what we are doing for them they noticed our love GO ARMY #BTSBBMAs,0,0
I got some hats. Want a free hat? May 11th is City of Tustin night at Angels Stadium. Go to the… https://www. instagram.com/p/BTxSp-MBrhP/,0,0
do angels exist? @Luke5SOS #VideoLove 5 Seconds Of Summer,1,0
A Rural Shrine to New York’s Angels and Gargoyles - The New York Times https://www. nytimes.com/2017/05/05/nyr egion/anonymous-arts-museum-rural-shrine-to-city-decorations.html?ref=todayspaper …,0,0
Best hitting tell pentington to assist today,0,0
Night lil angels  sleep well. I love you so much babies @Harry_Styles @Louis_Tomlinson @zaynmalik @LiamPayne @NiallOfficial,0,0
Dutry Angels Jouvay 2017 http:// fb.me/8tnhlVDdJ,0,0
"Comin' down the world turned over and angels fall without you there and I go on as you get colder always someone there." -Goo Goo Dolls,0,0
my two angels pic.twitter.com/l9gAz4EIgn,1,2
asian women are angels  delete this https:// twitter.com/cyborgsandwich /status/860948438862643200 …,56,109
Units: Natto Angels  Z Yasai Sisters & NO NAME #SuuChanFacts,0,0
Then they wanna sit there trying to act like angels . Please!,0,0
" Angels in America" at the @nationaltheatre is amazing. Perfectly played @russelltovey ! #travel #london #theater http:// ift.tt/2pT0xGL pic.twitter.com/WynSIye8qS,0,0
'Signs' from Healing with the Angels Oracle cards. Today you need to pay particular attention to any signs that... http:// fb.me/1XaYiuVhz,0,0
スウェーデン(メロ)デスバンドMiserationの2007年1stアルバムYour Demons - Their Angels ！マルチミュージシャンとしてDFやEoSやS.45などで活躍する(敬称略)Jani Stefanovićの在籍バンド！とにかく激烈！ pic.twitter.com/rSZFG1RClg,0,0
Thank u so much bon! It was a very emotional & special talk that made me feel even more grateful for Adore angels do exist,0,1
Dark Angels & Pretty Freaks #164 "Buffer": http:// youtu.be/X7FqIM-Y3Cc?a via @YouTube,2,1
#WeLoveLA RT " #Angels Snapping pics at @angelstadium ? Be sure to share them with #AtTheBigA ! They may be featured on our…" #SportsRoadhouse pic.twitter.com/IelHx5zXps,0,0
Los Angeles Angels vs Oakland Athletics Live http:// livestream-tvs.com/2017/05/06/los -angeles-angels-vs-oakland-athletics-live/ …,0,0
#Astros at #Angels  (L.McCullers vs J.Ramirez) 9:07 pm ET B-R Game Stat Sheet: http://www. baseball-reference.com/previews/2017/ ANA201705060.shtml … #getready,1,2
@Jackie_22 @azgreenday @bmoffatphotos @will__n this seems like 5 minutes ago. You're all rising seniors now. Still angels I'm sure. pic.twitter.com/o2iwi6Rqwc,0,3
See what it is like to patrol with the NYC GUARDIAN ANGELS part one #ROCKYPRATT https:// m.facebook.com/story.php?stor y_fbid=1280214922056678&id=100002045469441 …,0,1
When I wore #25 #firstpitch pic.twitter.com/IQD4iNpk1C,0,0
Angels OV 7.5,1,1
all of the angels must be lonely now without youuuuu pic.twitter.com/DauMmfNS2q,1,0
Angels,0,7
Yuk,0,0
I voted @BTS_twt for the Top Social Artist Award #BTSBBMAs 7 angels who taught us how to fly again,3,1
angels do exist,1,0
Someone's Angels @ATLsuper @TommyUsherAPS pic.twitter.com/FiXKaXGWyt,0,1
WE ARE EVER EVER 3 ANGELS,0,0
MLB Game Simulator: 9:07 PM EST - Houston Astros vs. Los Angeles Angels - SIMULATE THIS GAME NOW: https://www. cappertek.com/xSimulator.asp ?n=94690 …,0,0
City of Angels don't forget Arrow is on tonight @8pm on channel 5 also known as CW. #OlicityIsRising #Olicity,0,1
Good night and sweet dreems with angels,1,1
【音楽】Hark_the_Herald_ Angels _Sing_Instrumental https:// youtu.be/jA3-Hv0uBJg,0,0
this face is a work of art created by the angels WE LOVE YOU LILI REINHART pic.twitter.com/xRsyiubZVQ,3,2
#NP Abacu5 @abacu5 - Angels on @IronWavesRadio http:// ironwavesradio.com,0,0
BACK IN STOCK: Los Angeles Angels of Anaheim Tickets http:// bit.ly/2p1nDts #MLB #LosAngeles pic.twitter.com/s6t1iyKzBD,0,0
BACK IN STOCK: Los Angeles Angels of Anaheim Tickets http:// bit.ly/2p1nDts #MLB #LosAngeles pic.twitter.com/MMi4UxtZDE,0,0
BACK IN STOCK: Los Angeles Angels of Anaheim Tickets http:// bit.ly/2p1nDts #MLB #LosAngeles pic.twitter.com/SgH9G1Y1J3,0,0
#NP Abacu5 @abacu5 - Angels on @MidwestBG http:// midwestbroadcastinggroup.com,0,0
The only reason to watch @Angels PERIOD @jessreimagined @TaylorBlakeWard @Patrick_ONeal #MaybeSimbaToo pic.twitter.com/Owcfd2nwz8,0,1
Heavens gained two angels this week,0,5
to flay someone alive and keep them breathing. And angels are of hardier stock than most.",0,0
Two angels ; Zina Bean and Zhané We only have to do this one last time...RIP Princesses. pic.twitter.com/9kOiaag7Fg,2,4
-dodie and jon are angels -thomas likes my gay flag and said "represent!" -his butt IS bigger in person holy fricc -he's so warm awww,1,2
#NP Abacu5 @abacu5 - Angels on @RockInvasion http:// rockinvasionradio.com,0,0
MLB Game Simulator: 9:07 PM EST - Houston Astros vs. Los Angeles Angels - SIMULATE THIS GAME NOW: https://www. cappertek.com/xSimulator.asp ?n=94690 …,0,0
#NP Abacu5 @abacu5 - Angels on @MidwestBG http:// midwestbroadcastinggroup.com,0,0
#NP Abacu5 @abacu5 - Angels on @RockInvasion http:// rockinvasionradio.com,0,0
Tommy from al qaedas angels killed Paige parrucci from guns and hoses. pic.twitter.com/VVlN7ohsEo,0,7
It's like chocolaty angels high-fiving your taste buds.,0,0
#NP Abacu5 @abacu5 - Angels on @RockersUG http:// rockersunderground.com,0,0
#NP Abacu5 @abacu5 - Angels on @IronWavesRadio http:// ironwavesradio.com,0,0
#NP Abacu5 @abacu5 - Angels on @UnsignedHQ http:// unsignedheadquarters.com,0,0
Angels exist @camerondallas pic.twitter.com/xedfu5lLpO,0,0
The largest collection of Charlie's Angels memorabilia belongs to Jack Condon(USA) with 5569 items which he's been collecting since 1976.,0,0
At the angels game with y best friend #unlimitedangels pic.twitter.com/E60GYmj6qq,0,0
Even angels o in your bed? — even angels pero porque creo que me pasé escu... https:// curiouscat.me/rubenvira_/pos t/144903061?t=1494114623 …,0,0
ANGELS AND CLOWNS - tropical fish aquarium Tee Shirt T-Shirt 2XL Black #aquarium #shop http:// homeaquarium.space/details?asin=B 00LXH2XFE … pic.twitter.com/mGG9AWdEqr,0,0
I vote for @BTS_twt for the Top Social Artist award We’ll win this for the angels at Big Hit Entertainment #BTSBBMAs,0,0
i hate how cats get the rep that all of them are evil:/ mine are angels !!!,0,0
Big Fish! Break a leg Academy of Holy Angels - #SpotlightKids pic.twitter.com/OjMJHvlrYm,0,0
From Double A straight to the majors in one year. So proud to be apart of the AL West Division Champs the @Angels #RTTS @MLBTheShow,0,0
#NowPlaying - Call To Arms by @Angels - Listen now at http:// i99Radio.com ! pic.twitter.com/7G2449XCzH,0,0
Happy nurses week. to me you truly are all "warriors and Angels on Earth..thank you,0,0
Found it in my post-race self to do #plankaday plus 20 snow angels ! #fitness pic.twitter.com/T4neX9PwTj,0,0
Angels really do exist,0,0
RUN FULL FORCE ANGELS SWOOP DOWN AND GRAB MEAND NOW I'M SAFE AWAY,0,0
Sold! Angels will be serenading @e .e.frost (instagram) in the UK She's a divine poetess go read her pieces to... http:// fb.me/1p3ZhEC6e,0,0
DAPF #164. Dark Angels & Pretty Freaks #164 “Buffer”: http:// youtu.be/zFqcrpdH7Ns?a via @YouTube,0,0
I could be wrong too but I'm pretty sure he sign a healthy contract with the angels,0,1
I got angels all around me.,0,3
Goodnight i love these two angels so much pic.twitter.com/s54KhmGJdQ,0,1
Dude! That's my team! #Halos,0,1
. @Angels Please never stop posting pictures like this.,0,1
IN THIS MOMENT ANGELS ’ SWEET REFLECTIONS Amazon: http://www. amazon.com/This-Moment-An gels%C2%92-Sweet-Reflections/dp/1504335376/ref=sr_1_1?ie=UTF8&qid=1438608760&sr=8-1&keywords=In+This+Moment+Brenda+Rachel … #angels #spiritual #inspirational pic.twitter.com/V2NvEz3Rhp,0,0
UC Irvine Night with the @Angels ! #UCIPride pic.twitter.com/NbWKPf9PIj,1,14
LOL! this game was awesome my ana friend wanted to boost is Precision stats on me so i said in french "Wait i need to move or kicked AFK",0,1
I have such love for flight attendants. They are angels for sure,0,0
I uploaded a new episode "Dark Angels & Pretty Freaks #164 "Buffer"" on #spreaker #comic_books #haircut #sayings https://www. spreaker.com/user/dapfpod/d ark-angels-pretty-freaks-164-buffer?autoplay=1 …,2,2
OMG Ian just noticed ur tweet. Hope you'll be ok. Thinking aboot u. Sending Healing Guardian Angels tae Protect and Guide You through this,0,1
Dark Angels & Pretty freaks #164 "Buffer" We chat #BadHaircut #NotDrinking #Shopping #podernfamily & Much More! http:// traffic.libsyn.com/darkangelsandp rettyfreaks/Dark_Angels__Pretty_Freaks_164__Buffer_.mp3 … pic.twitter.com/El0NNKaWcL,1,0
Dark Angels & Pretty freaks #164 "Buffer" We chat #BadHaircut #NotDrinking #Shopping #podernfamily & Much More! http:// traffic.libsyn.com/darkangelsandp rettyfreaks/Dark_Angels__Pretty_Freaks_164__Buffer_.mp3 … pic.twitter.com/XEF2sD5eny,20,16
Dark Angels & Pretty freaks #164 "Buffer" We chat #BadHaircut #NotDrinking #Shopping #podernfamily & Much More! http:// traffic.libsyn.com/darkangelsandp rettyfreaks/Dark_Angels__Pretty_Freaks_164__Buffer_.mp3 … pic.twitter.com/tajuHatDSM,25,27
I'm on day two with no real bras I'm liking it. Thank you my guardian angels @natkeepnat @eckuluh @FrancescaTP,0,3
See what it's like to patrol with the Guardian Angels in Brownsville/ East New york Brooklyn NYC #GUARDIANANGELS https:// m.facebook.com/story.php?stor y_fbid=1280247398720097&id=100002045469441 …,0,1
Willie Nelson - Seven Spanish Angels http:// fb.me/3BIclFCFS,1,0
soulfhully: fluhters: ignoringx: fluhters: f l u h t e r s i g n o r i n g x Lazy Angels ... https:// tmblr.co/ZcsU6f2LNk0eJ,0,0
It's the angels verse the demons #uniminds #uniordie,0,1
First time... I saw glorious angels coming down from the heavens... I thought they would go to my position.... http:// fb.me/1lYuaRcyd,0,0
I liked a @YouTube video http:// youtu.be/gt0LkNiGlWs?a Felipe Andreoli - Angels and Demons - Angra [Playthrough],0,0
16x9 - Angels High: Pilot survives EPIC fighter crash caught on camera https://www. youtube.com/watch?v=SwI_0F NMRmk&feature=share …,0,0
Rockies Angels  Tigers Dombrowski,0,1
Angels Acquire Damien Magnifico; Designate Jose Valdez For Assignment - MLB Trade Rumors http:// dlvr.it/P4jJwL,0,0
Angels in America pt.1 was stunning! Amazing and beautiful acting by Andrew Garfield(!!)… https://www. instagram.com/p/BTxRJ8xBm29/,2,3
Dutty Angels Jouvay 2017 http:// fb.me/6ZOt3OXdY,0,0
#SaturdaySchmooze #RainySongs Angels Would Bowl #AngelsWouldFall #MelissaEtheridge #TheSimpsons https:// youtu.be/sqlYRtN3n0c via @YouTube,0,1
I think someone was selling DNA for #MLB ball players. Why do Rizzo and Trout look so similar. #Yankees #cubs #angels #twins,0,2
Halooosss @Angels @MLB #angels pic.twitter.com/CW91IF2ugb,0,0
A blonde receives a call from a masked serial killer what he doesn’t know is that she’s a member of The Charlie Angels . #MixUpMoviePlots,0,0
Amazing day to walk in the Blossom Festival Parade with these angels representing @KOAA ! #besties #flowerpower #blossomfestival pic.twitter.com/zbrGtPXx6w,1,3
minha assessoria nao me comunicou a tempo sobre o encontro das Angels . Devastada q so vi agora,0,0
night i love these angels so much ! pic.twitter.com/FthbwraKEO,0,0
Script: Who but I would have loved you? Who but I can see your good? Who but I would race Angels to see you happy? Who but I my love?,0,0
Breaking Benjamin - Angels Fall (Official Video) https://www. youtube.com/watch?v=9zFfRS eA1ls&feature=share …,0,0
Angels (prod. By KLVN BEATZ) by Chef Izzy #banger #newmusic #NowPlaying on #YouTube https://www. youtube.com/watch?v=9eXx-7 t2H1s&feature=share …,0,0
Watched the #KentuckyDerby on the field during battling practice with @Angels . #UnlimitedAngels @DrJimHamilton pic.twitter.com/8sgeixQTvr,0,13
every where i go i got two angels watching over me,0,0
dream with angels http:// fb.me/2YuxPLuK1,0,0
The angels been reading me to filth lately. Alright I get it.,0,0
PROTECT THESE ANGELS #BTSBBMAs pic.twitter.com/69a2bM8fMg,1,2
Cruel Angels ' Thesis [10 hour long kazoo cover],0,0
#NowPlaying Where Angels Play - Demo Remastered by The Stone Roses ♫ http:// spoti.fi/LUiCqJ,0,0
I added a video to a @YouTube playlist http:// youtu.be/YrXJxskL530?a Q-CAST: Aliens & Fallen Angels - The Great Deception,0,0
,0,0
#books The Belief in Angels by J. Dylan Yates http:// circleofbooks.com/2016/06/22/the -belief-in-angels-by-j-dylan-yates/?utm_source=ReviveOldPost&utm_medium=social&utm_campaign=ReviveOldPost … #comingofage,0,0
You can't spell #Evangelical w/o EVIL ANGELS . Remember Lucifer & Judas were religious too and they hid HATE behind religion too. GOD IS LOVE https:// twitter.com/kurteichenwald /status/860972918544715776 …,0,0
Don't wake me 'cause I'm dreaming of angels on the moon where everyone you know never leaves too soon,0,0
see you later my beautiful angels !! i love you all so so much @BTS_twt,0,0
"Papa said I should stay away from gods the most followed by fallens angels  demons vampires and lastly mad scientists" Kouki hummed.,0,0
The lady who sees angels @LornaByrne https://www. youtube.com/watch?v=9nq9a4 FVQEo …,0,2
EVEN ANGELS HIT THE GROUND,0,0
This Mother's Day we're offering free massages to Mums from the Three Minute Angels ! http:// dandenongmarket.com.au/news/mothers-d ay-2017 …,0,0
Yes! Honey lip scrub honey trap lip balm dark angels scrub and one of those foot pumice’s aaaaaand bath bombs lol,0,0
25-15 +$4991 L40 $700 Angels vs Astros (2 Picks) #FREE @http:// ibnsportswrap.com/freePicks.php AD 91-39-5 L135AD'S $700 Jazz vs Warriors *Premium,4,5
VMINKOOK ETTEOKE AM I SEEING AN ANGELS ? I voted @BTS_twt for the Top Social Artist Award #BTSBBMAs,0,0
I found true angels last night that saved me. I am thankful they put me at peace.,0,1
anyway i love you angels  and i'm proud of you always,0,0
Angels soared!!! #thesummit17 @Disney ESPN Wide World of Sports https://www. instagram.com/p/BTxQbr9FqnWC R50Eqs7DhJMIpKfxxJEPdfuNlM0/ …,0,1
My Angels . https:// twitter.com/lewisdelmar/st atus/860989113213870086 …,0,2
the lady that greets ppl at walmart is always calling ppl angels she honestly just made my day better pic.twitter.com/zq8wMOqKFE,0,0
We have had an incredible day at Pawty House One with the U.S. Navy Blue Angels doing flybys while performing at... http:// fb.me/3Hd2O1WcP,0,0
I added a video to a @YouTube playlist http:// youtu.be/9zFfRSeA1ls?a Breaking Benjamin - Angels Fall (Official Video),0,0
There is a very specific way to connect with your Guides & Angels . Learn how! http:// dld.bz/fmruY= pic.twitter.com/ZUxpLCYCSF,0,0
@theresa_may We must defend Mecca for his power lies there. The 3 fallen angels are very powerful & threaten him. May the Lord be with you.,0,0
lil talented angels . @TheVampsJames @TheVampsBrad pic.twitter.com/b90AI4lrfM,1,49
I voting for BTS for #BBMAs Top Social Artist Award because they are so special like a angels from the sky they are amazing #BTSBBMAs,0,0
That's what mythic angels do for you.,0,0
angels together angels 4ever x,0,0
Awesome #Inspirational #Spiritual Interview on http://www. onairwithsir.com #angels #music #book http:// onairwithsir.livesircuit.com/brenda-rachel- calls-up-to-talk-about-her-inspirational-book-in-this-moment-angels-sweet-reflections/ … pic.twitter.com/tpFhhtE48e,0,0
Tiffany Evans " Angels On Earth" #HappyJoyfulSpirit #PositiveMusic #FamilySafe,0,0
"Ecstasy and the Angels " on the photoblog http://www. geoff-franklin.com/photoblog/ecst asy-and-the-angels/ …  #surreal #passion #angels #photoart #gothic #photomontage #art #story,0,0
Exactly. Yet Quil acts like Tommy raided the office with 15 Hells Angels members beating ppl with bats.,0,1
Yes I couldnt as well until I saw them. It's like they're angels or something #BTSBBMAs,1,2
good night! i love reddie spagettinis™ and all of these angels xx pic.twitter.com/lGVZLRZ6bh,0,3
They say the good die young... RIH too all these young angels going to soon God was ready for y'all.,0,1
listening to Art Angels for the first time in a while and it is always refreshing,0,0
#Angels #AngelesDeLuz #Angeles #mensajesdeangeles #arcangel #arcangeles #Arcángeles #bendiciones #latidosluz #AngeLuz #CanaldeSeresdeLuz https:// twitter.com/AriannaSegen/s tatus/861001137461264385 …,0,0
Ohhh so NotSmurfAcc is yooooooouuu! haha nice,0,2
スウェーデンメタルコア/オルタナメタルバンドの2011年EP、Stronger！2ndアルバムからのリミックス曲などが収録されたEP。やっぱり Angels Of Clarityカッコイイな～。未発表局やアコースティックVer.など聴き応え十分の１０曲いり！ファンなら聞くしかない！ pic.twitter.com/nG0ggYiUxq,0,0
Good night/morning/afternoon/evening my Angels @Harry_Styles @NiallOfficial @LiamPayne @Louis_Tomlinson @onedirection,0,0
#Win a Test Driving the Tarot Prize Pk @pawsitiveliving https:// goo.gl/BcEdb3 5/10 #guidance #angels #doreenvirtue #radleighvalentine,0,0
Got to go now. Have a nice evening Carter's Angels :) Thanks for letting me think different about things. You all made valid points. #IAMOUT,0,2
Andrew Garfield se gana a la crítica con “ Angels in America” http:// dlvr.it/P4jBMq pic.twitter.com/7bERNqsLmH,0,0
Andrew Garfield se gana a la crítica con “ Angels in America” http:// dlvr.it/P4jBMw pic.twitter.com/CLBfp5FaXi,0,0
actual angels pic.twitter.com/8yN4maf9Dw,0,3
Hey look @bobo2194,0,0
I'm pointing out facts. Those people weren't there vs the Angels either for games 10/11. Before the streak. They bailed after 2016 https:// twitter.com/rpdroyals/stat us/861000227544748032 …,0,0
Trying to get on the big screen! Go angels !!! #unlimitedangels pic.twitter.com/SrqP1aZ1Ft,0,2
I pray for things like this to stop happening. Our children are innocent angels,0,0
Me too and I feel responsible. I invited her to be able to join in with other women and chat and I guess I made a mistake. I feel bad now.,0,3
Good night babes @angelcandice @lilyaldridge #Angels #CandiceSwanepoel #LilyAldridge #tb https://www. instagram.com/p/BTxPuqyBYpK/,0,1
The Angels protect me. The demons respect me - @CHXPO #quoteoftheday,1,3
I was looking for Hunter Thompson reading his Kentucky Derby piece and I ended with this CBC clip on Hell's Angels . https:// m.youtube.com/watch?v=ccyu44 rsaZo …,0,5
I feel you. One of my favorite players from the Angels was the great Rod Carew,0,0
@WizardWorld #DoctorWho weeping angels seen in Minneapolis. pic.twitter.com/6kMo5Mmfno,0,1
Joey really went to an Angels game and didn't take me wth that's rude,0,1
Tissues ready heart open You'll need both to read WHEN ANGELS FLY! http:// tinyurl.com/jkklswf https:// twitter.com/MaryLSchmidt/s tatus/860887116708016128 …,3,3
انا طحت ضد تيم سمورف فزنا على اخر ثانيه قسم قيم حماس,0,0
#Win a Test Driving the Tarot Prize Pk @pawsitiveliving https:// goo.gl/BcEdb3 5/10 #guidance #angels #doreenvirtue #radleighvalentine,0,0
be safe angels you're not alone eat proper meals & get a lot of rest you're important your health's important I love you so much @BTS_twt,41,56
Staff Nurse #GemmaRowbury JR Cardiology looked after me after my heart attack. JR SSIP looked after my wife recently. Angels all...,0,0
Angels among us https://www. instagram.com/p/BTxPiw1l2K0T TVYpf-pngA6VyooZtpQOgvhl440/ …,0,0
The #mustread book of this year. Heartfelt and inspirational WHEN ANGELS FLY! http:// tinyurl.com/jkklswf https:// twitter.com/MaryLSchmidt/s tatus/860887418890838016 …,2,2
bad_ angels Date her now https:// rebrand.ly/babesluts?ETpF #hotbabes #dating #snapchat pic.twitter.com/gswXEjlhgy,0,0
Charlie's Angels Farrah Fawcett Jaclyn Smith Kate Jackson http:// etsy.me/2mtpGV6 via @Etsy,0,0
@painting_ angels pic.twitter.com/kntjyzHysU,0,0
Good night angels  yes ARMY you all are my angels with BTS. I am voting for @BTS_twt for the TOP SOCIAL ARTIST AWARD at the #BTSBBMAs .,2,0
“If I speak in the tongues of men or of angels  but do not have love I am only a resounding… https://www. instagram.com/p/BTxPa5UDufL/,0,0
I grew up an A's and angels fan,0,0
American League Baseball: Angels (3) at Yankees (4) - FINAL https:// goo.gl/AyH3mR,0,0
Whaaa? Alison Workin Week Angels /Red Shoes? #greatalbum,0,0
What do you think of the beginning of Larry Peterson' @slipperywillie #YAFantasy 'The Demons of Abadon'? http:// ow.ly/ObInc #Angels,0,0
What do you think of the beginning of Larry Peterson' @slipperywillie #YAFantasy 'The Demons of Abadon'? http:// ow.ly/ObInc #Angels,0,0
What do you think of the beginning of Larry Peterson' @slipperywillie #YAFantasy 'The Demons of Abadon'? http:// ow.ly/ObInc #Angels,1,0
What do you think of the beginning of Larry Peterson' @slipperywillie #YAFantasy 'The Demons of Abadon'? http:// ow.ly/ObInc #Angels,1,1
What do you think of the beginning of Larry Peterson' @slipperywillie #YAFantasy 'The Demons of Abadon'? http:// ow.ly/ObInc #Angels,1,1
What do you think of the beginning of Larry Peterson' @slipperywillie #YAFantasy 'The Demons of Abadon'? http:// ow.ly/ObInc #Angels,2,0
BURNING HOT #MLB TREND: The OVER has cashed in 5 of the last 6 games for both the #Astros & the #Angels Markets: http:// bit.ly/2qDhLL2 pic.twitter.com/MyDor2yCqY,0,1
Especially when that bat is comin in at all different angels . Or when a ball comes screaming at you with a exit velocity of 95+,0,0
Do you bleed red or bleed blue? Both the Angels and Dodgers start in a little over an hour-grab… https://www. instagram.com/p/BTxPUPvgnSc/,0,0
#Patch "….depression….Blessed help from Angels ...." http://www. youtube.com/watch?v=ydv-os aweME …,0,0
@_EthanandGray @graysonscute @rosesfordolans FOLLOW THESE ANGELS PLEASE @GraysonDolan @EthanDolan 8,1,3
@_EthanandGray @graysonscute @rosesfordolans FOLLOW THESE ANGELS PLEASE @GraysonDolan @EthanDolan 7,1,2
pits are angels i literally need one someday so bad,0,1
@_EthanandGray @graysonscute @rosesfordolans FOLLOW THESE ANGELS PLEASE @GraysonDolan @EthanDolan 6,1,2
#Read #Paranormal #Romance "The Choice" by T.O. Bolseen about good/evil angels /demons love & sacrifice. - http:// bit.ly/2dJDs7q,0,0
Those are the first things I go for any time I get fries. They're like tiny little grease angels .,0,1
@_EthanandGray @graysonscute @rosesfordolans FOLLOW THESE ANGELS PLEASE @GraysonDolan @EthanDolan 5,1,2
@_EthanandGray @graysonscute @rosesfordolans FOLLOW THESE ANGELS PLEASE @GraysonDolan @EthanDolan 4,1,2
You ever just wanna take a moment and thank the divine for the angels they send onto the earth? Like LOOK AT THIS DAMN MEAL!! https:// twitter.com/TreMelvin/stat us/860991469665964032 …,0,2
BBC News - Angels in America: 8 reasons why it feels like heaven http://www. bbc.co.uk/news/entertain ment-arts-39791376 …,0,0
@_EthanandGray @graysonscute @rosesfordolans FOLLOW THESE ANGELS PLEASE @GraysonDolan @EthanDolan 3,1,3
Good morning angels,0,0
@_EthanandGray @graysonscute @rosesfordolans FOLLOW THESE ANGELS PLEASE @GraysonDolan @EthanDolan 2,1,3
***Fun warning!!! **** Open gym at Surprise Angels !! May 13th from 12pm to 2 pm. $10 members $15 non-members.,0,0
@_EthanandGray @graysonscute @rosesfordolans FOLLOW THESE ANGELS PLEASE @GraysonDolan @EthanDolan 1,1,2
The back story to "Healing With The Angels " by Doreen Virtue - https://www. youtube.com/watch?v=WpZl6k v_cTM …,0,0
* angels singing* (@Costco Wholesale in Missoula MT) https://www. swarmapp.com/c/hZzG9dMxZls pic.twitter.com/EJUtR4CLsZ,0,6
"Gut feelings" are guardian angels . Don't ignore em.,0,0
bad_ angels Date her now https:// rebrand.ly/babesluts?H8OLk #hotbabes #dating #snapchat pic.twitter.com/UCHHK9kX4b,0,0
#Prayers for this Great American Patriot who was killed defending our freedoms; may he be received by the #Angels http://www. foxnews.com/world/2017/05/ 06/us-navy-seal-killed-in-somalia-identified-as-15-year-veteran.html …,1,0
Sand angels http:// on.dstroy.co/2pNXBN2,0,0
Sand angels http:// on.dstroy.co/2pNXBN2 pic.twitter.com/4zR5uT8aZa,0,0
Sand angels @Rogers Park Chicago Illinois https://www. instagram.com/p/BTxPGNpAGdQ/,0,0
Speaking of angels  I talked to a therapist about u & ur impact in my life & she agrees you're an important part of my recovery my cure,0,2
pleaseeee follow me angels ilysm lol why am i even trying this will never happennnn @GraysonDolan @EthanDolan pic.twitter.com/hBWK9if4AC,0,0
“Though I speak with the tongues of men and of angels  and have not charity I am become as… https://www. instagram.com/p/BTxPFH_jmYB/,0,0
