
ken griffey sr on the Yankees card says outfield but primary is first,0,1
no but check out what I did during the Yankees series! pic.twitter.com/diymxhLJAu,0,0
All my predictions of Harper coming to the Yankees in 2018 have gone down the drain,0,1
que hijos de puta los de georgia prestaban servicio a los yankees en irak que bien que estuvo que les hicieran un par de terrenos por petes,0,2
After the #Yankees retire #DerekJeter 's #2 every single digit #number would be retired! @Yankees #RainyDay pic.twitter.com/eGj4hBsiLT,0,6
Nice of the Cardinals to whine and moan about every strikeout. Typical! Reminds me of the Yankees from Bad News Bears.,0,1
That's a little bit stupid....,0,0
I mean...the Jets ARE the worst team ever can't deny that...but as a new Yankees fan I cant hate,0,1
Clip Player: Sweeny Murti with Tino Martinez #Yankees #JeterNight https:// embed.radio.com/clip/61921056? ref_url=http://newyork.cbslocal.com/audio/wfan-other-audio/&ads_ga_page_tracker=UA-17434257-1&rollup_ga_id=UA-2438645-53&r20id=62 …,1,8
I think 'it must have been rewarding to root for the Yankees in the 90's-00's' is a hot enough take on its own.,0,0
Ke hagan cagar luego EEUU. yankees de mierda!!!,0,0
Coming up @SportzEdge  @Yankees rained out @RedSox beat the weather and @ConnecticutSun open the season tonight! See you in a few minutes.,1,0
ESPN is basically the red Sox and Yankees channel. Not suprising. They act like those are the two most important teams or something,0,0
ICYMI: No. 7 #yankees prospect Chance Adams has been promoted to swbrailriders for a Monday Triple-A debut.… https:// twitter.com/i/web/status/8 63431129591709696 …,0,0
' @espn Sorry future @Yankees . Only double digits for you. pic.twitter.com/F6K9IBhukK,0,0
The Flip!,0,0
@eleonbaz Yogi Berra estara en el top 10 de la historia de los Yankees ? Que opina ud.,0,0
The baby just realized one day the Yankees will buy trout....,0,0
@Yankees when I see u again!!! Jeter love u!!! pic.twitter.com/8E85ZpvVZw,0,0
Thank god 'cause I didn't have enough money for a yankees jersey,0,0
Fun while it lasted. #Yankees pic.twitter.com/o9jHmMeRU0,0,7
Ya les gustaría a los yankees tener un festival como #Eurovision  tan chulicos que se ponen ellos con su show business #culo #gallomanel,0,0
Hey @KenDavidoff since @RealMichaelKay didn't respond how do the Yankees select who appears during the 7th inning salute to veterans??,0,0
How many flatbill pinstripe Yankees hats b,0,1
The Yankees demanded at least a dozen inspections of the ball Eddie Cicotte was using during his two-hitter. http://www. southsidesox.com/2017/5/13/1563 6312/sox-century-may-13-1917?utm_campaign=southsidesox&utm_content=chorus&utm_medium=social&utm_source=twitter …,1,3
The #Yankees will celebrate Derek Jeter tomorrow but remember when he made a few quick stops with @TrentonThunder pic.twitter.com/7HyaDD5fT9,16,34
It looks like the rain should stop in time for a noon first game. I don't quite understand why #Yankees didn't schedule a split doubleheader,0,0
Casey like Jeter had his day with the Yanks @HemondDelhiSABR @Yankees http:// bit.ly/2rcFHBz,4,1
Yankees forsure lol https:// twitter.com/mlb/status/863 470350981406720 …,0,0
It just shows the Astros are a class act. Doesn't matter whether the Yankees do the same for our guy or not.,0,1
Yankees are pathetic. They'll retire everyone's number,0,0
@FOXSportsMX es q después de MAGALLANES no hay ningún equipo q se compare a los NY YANKEES,0,0
How Charles Jeter helped the boy who became the @Yankees Captain #JeterWeek http:// buff.ly/2pZKwjN pic.twitter.com/PiGxx9zNrd,7,17
Can the Astros keep pace with the Yankees all season? Who will win the World Series #AstrosNation ? http:// ss1.us/a/tbb7txv1 pic.twitter.com/b4Zf3j7DY7,0,1
Yankees ' Chase Headley rips ump ump rips back after helmet-spiking ejection http:// nj-ne.ws/tH4Ehfu,0,0
Yankees retire Derek Jeter’s number: How to watch live stream info start time – http:// CBSSports.com http:// pressaware.com/?p=43406 #sport pic.twitter.com/s1yehKojPw,0,0
Yankees -Astros play 2 on Jeter's day (May 14 2017) - http:// FOXSports.com http:// goo.gl/qK8K6n,0,0
Mais uma vez os yankees ficam mal na fotografia .,0,0
@ESPNStatsInfo how many yankees game were under .500 that derek jeter played in in his career record by season not all time,0,0
@Yankees can't wait for tomorrow! So much thanks for so much more than rings and Hits! For his leadership and class! https:// twitter.com/fitjetergirl/s tatus/863513267834163200 …,0,0
Yankees -Astros play 2 on Jeter's day (May 14 2017) – http:// FOXSports.com : Yankees -Astros play 2… https:// goo.gl/fb/HAFsqH,0,0
Because yankees are not hateful?,0,0
El número 2 debería ser retirado no solo del Yankees Stadium sino de todos los estadios de la MLB #JeterWeek,0,0
You mean Bryce Harper?? Typical Yankees fan pic.twitter.com/h4jIw0kblN,0,3
It's happening tomorrow. #yankees retiring #2 #DerekJeter . I can't wait. pic.twitter.com/Xpbuy51xFH,0,0
After selling Babe Ruth to the Yankees  the Red Sox did not win a World Series for 86 years. This was known as the Curse of the Bambino.,0,0
New York Yankees https:// twitter.com/bnightengale/s tatus/863509142249635845 …,0,1
He didn't wear a Jeter jersey. Pretty idiotic comments coming here.,0,0
Game over. Milroy Yankees - 1 New London-Spicer Twins - 6. Go to http:// iscorecast.com/?c=4e23653567 to see results or watch a full replay.,1,1
Wait. Matt Harvey is struggling because he once went to a Yankees game? https:// twitter.com/kevinseanfeene y/status/863512416994439170 …,0,3
RT @MightyQuinnATT : @CubsJoeMadd I dont agree w/ what you told the announcers '98 @Yankees had a much better rotation with 4.,1,2
YANKEES,0,0
Yo no me atrevería a nombrar 3 @Yankees .. diría 5-6 de 1977 para acá que los he visto...saludos @ErnestoDelValle #MLBxFOX,0,0
Who got some Yankees tix for tomorrow's game??,0,0
http:// ift.tt/2rcIQkJ Casey like Jeter had his day with Yankees #SportsTap,0,0
los mejores Yankees modernos son Jeter Rivera y Posada,0,0
Today in 1960s Baseball: Indians beat Yankees 85- on HRs from Jerry Kindall & Tito Francona (1962) http:// bit.ly/2bzQxzs pic.twitter.com/90x0J7GBI9,0,1
Thanks Captain. Simply the best.,0,0
The Greatest Team in Baseball History – The 1927 New York Yankees http:// dld.bz/f5HyJ #GreatestTeam #NewYorkYankees pic.twitter.com/QxCkzuWndC,0,0
Wow.. what a lineup!,0,0
Reebok MLB All Star Dual Running Pump Mens Shoes Size 8.5 NYC Yankees RARE http:// ift.tt/2qE7P4q,0,0
E os nazistas sucumbiram justamente p/ o exercito russo.Logo depois chegaram os yankees e Hollywood q escondeu os russos e idolatrou o US,0,1
Best team in is visiting N.Y. & taking it to the Yankees rn. Thanks to @Browns_Fan32 for the photo with . @jimmyfallon & some other guy. pic.twitter.com/81IfMEfdjy,17,29
No lo creo chapis inigualable,0,0
Harper will get a 10 year $400000000 from the Yankees . https:// twitter.com/Metsaniac/stat us/863512031621775360 …,0,0
Jesus Christ ESPN we know his number is being retired. Stop treating it like a national holiday.,0,4
@CubsJoeMadd I dont agree w/ what you told the announcers '98 @Yankees had a much better rotation with 4.,0,0
what about going to @Yankees Derek Jeter tribute night?? Wearing a Jeter jersey while employed by @Mets ?,0,0
me: did you know daddy yankees famous?? maria: who ?,0,0
New York Yankees vs. Minnesota Twins Please n https:// turriventas.com/event/new-york -yankees-vs-minnesota-twins-2/?utm_source=ReviveOldPost&utm_medium=social&utm_campaign=ReviveOldPost … #Música  #conciertos  #music  #show  #teatro pic.twitter.com/SODzZ5Vm58,0,0
Here's a @Yankees @BabyBombers prospect to start watching #Yankees The Yankees prospect we aren’t talking about https://www. lunosoftware.com/TeamNews/NewsI temDetails.aspx?newsItemID=1045563&redirect=1 …,0,1
And you may not care but owner does. And owner is the owner of the Twins. Not the Yankees . You better believe fans mean something to him.,0,0
I hate the Yankees but you can't hate on The Captain . https:// twitter.com/mav_15/status/ 863510595538178049 …,0,1
@mannymachadord byrce signs a 1 yr deal extension? get ready for the max contract offer from NY if both O's or Yankees don't win it all,0,0
Last night the T-Yanks mashed as season-high 5 HRs. Here are tonight’s game notes: http://www. milb.com/documents/8/7/ 0/230024870/5.13.17_TY_Game_Notes_3r5vzi7x.pdf … #Yankees,1,4
Last night the T-Yanks mashed as season-high 5 HRs. Here are tonight’s game notes: http://www. milb.com/documents/8/7/ 0/230024870/5.13.17_TY_Game_Notes_3r5vzi7x.pdf … #Yankees,0,0
Jeter Rivera Teixeira Judge Sanchez Bernie A-Rod O'Neill,0,1
Algún día volveré a ver a alguien como #DerekJeter en mis @Yankees ??? #Histórico #Leyenda #Idolo #JeterDeHerrera,1,17
Rainout Leads Yankees to Schedule Rare Single-Admission Doubleheader - New York Times http:// dlvr.it/P7plJp,0,0
Sitemize "Dünya Haberleri | Dünya Haberleri | Yankees 'in geçmişlerini bu şekilde tekrarlayacağını asla görm... pic.twitter.com/IEzipX512R,0,0
Thanks for the chance! #derekjeter #Yankees #sportswatertm,0,0
Buffalo chicken Mac and cheese at @Yankees stadium mmmmm pic.twitter.com/RRUGC1jdZQ,0,0
You'd like Austin's new stuff "The Yankees Stink" "The Jets are the worst team ever" Even hearing Yankees causes reaction #bradylevelpride,0,2
You're completely off base #Pun,0,0
mom really doesn't like the yankees pic.twitter.com/zIjqKgLJzH,0,8
#HoustonAstros #Astros #mlb Yankees -Astros play 2 on Jeter's day http:// dld.bz/fGNR7,0,0
Who wore Yankees No. 2 before Derek Jeter? A baseball lifer http:// nyp.st/2pwfotN via @nypostsports,0,0
how much are the Yankees kicking in?,0,1
#10 gone too. Personally not sure that #9 should be retired.....,0,0
#Topps Now To Offer Special #Jeter Cermony Cards on Monday #Yankees #sportsbiz – NY Sports Day https://www. nysportsday.com/2017/05/13/top ps-now-to-offer-special-jeter-card-on-monday/ … pic.twitter.com/tlfZCnahBb,2,4
The voice of the @Yankees John Sterling on @FoxSportsRadio 920 The jersey talking about Derek Jeter https:// youtu.be/sSckY6RrT88 #Yankees #Jeter,0,0
Imagine responding to the question "what do you do for a living" with "I'm the shortstop for the New York Yankees .",0,3
Rainout Leads Yankees to Schedule Rare Single-Admission Doubleheader http:// ow.ly/RYxp50btlZ4,0,0
@KFCBarstool bc they're not the Yankees duh,0,1
No. 6 pick in 1992 nets Yankees No. 2 Sent with @MLB At Bat. #Yankees . #MLB . http:// m.mlb.com/video/v1380349 283/yankees-draft-history-1992 …,0,0
Today's Astros- Yankees game postponed Sent with @MLB At Bat. #Yankees . #MLB . http:// mlb.com/r/article?ymd= 20170513&content_id=230001090&vkey=news_nyy&c_id=nyy …,0,0
Don't forget Pam Beesly of the '27 Yankees . https:// twitter.com/ringer/status/ 863510027927252993 …,0,0
Yankees gear up for Jeter's No. 2 retirement Sent with @MLB At Bat. #MLB . #Yankees . http:// mlb.com/r/article?ymd= 20170511&content_id=229697460&vkey=news_nyy&c_id=nyy …,0,1
Quiero la gorra rosada de los Yankees,0,0
Jeff Nelson @NYnellie43 talks #Jeter  #Yankees & Marlins mermaid flash on @FoxSportsRadio 920 The Jersey https:// youtu.be/VukYFEhUcqw @Yankees,1,0
Yankees retiran camiseta de Derek Jeter http://www. martinoticias.com/a/144837.html,0,0
Guys... the Yankees played real well last night. Wished I would have come down and watched a movie with you guys.,0,1
After a passing shower in Clearwater the tarp is coming off the field. The #Threshers have announced a 6:25 p.m. first pitch. #Yankees,1,2
After a passing shower in Clearwater the tarp is coming off the field. The #Threshers have announced a 6:25 p.m. first pitch. #Yankees,0,0
Wellll in that case I hope you behave yourself. Go Yankees ! And Tebow,0,0
#Yankees No. 19 prospect @Nick_Solak (Bourne '15) is 2/2 with his first @FloridaStateLg HR. http:// atmilb.com/2pH5xxi pic.twitter.com/RUFaEwgndJ,0,0
We may never see Yankees flex their history like this again http:// fractt.com/we-may-never-s ee-yankees-flex-their-history-like-this-again/ …,0,0
Seems fitting that in honor of Derek Jeter tomorrow the Yankees will play 2,0,2
LAST CHANCE to purchase #ALSAwareness Game tix for @RaysBaseball vs. @Yankees May 20th! #StrikeOutALS http:// bit.ly/GOTRays pic.twitter.com/6dMmgn4Z5D,0,1
Find out what Derek Jeter meant to one lifelong #Yankees fan. #Re2pect http:// calltothepen.com/2017/05/13/wha t-derek-jeter-day-means-to-a-lifelong-new-york-yankees-fan/ …,0,0
I love the guy but yeah let's face it. He's a DH. Total liability in LF despite that awesome catch against the Yankees .,0,0
We may never see Yankees flex their history like this again http:// dlvr.it/P7pgDz #yankees #nyy #mlb pic.twitter.com/nDCIAWhzK9,3,2
,0,0
No. 7 Yankees prospect Chance Adams will start for AAA on Monday. "It’s just one more step to where he wants to be.” http://www. trentonian.com/sports/2017051 3/chance-adams-officially-moves-up-to-aaa-thunder-washed-out-saturday-night …,2,0
Derek Jeter was in the bathroom when the #Yankees called to select him with the 6th pick in the 1992 MLB Draft. pic.twitter.com/IXF87GW7cQ,0,0
Ohh good god I wanna cry right now I wanna be 6 years old again to see 21 year old Jeter again but it's too late now I love u!!,0,1
@UniWatch @PhilHecken I hope I'm not the only one bothered by the NOB on the Yankees unis https:// twitter.com/espn/status/86 3446264188477440 …,0,0
Just tell us what year he will inevitably end up with the Yankees https:// twitter.com/BNightengale/s tatus/863508398221950977 …,0,0
Mets discord keeping them in eyeball game with Yankees - for now http:// nydn.us/2r4iqVV,0,0
Yankees 30 World Series rings by 2035? pic.twitter.com/vgMzaHnr8s,0,0
What players would be close to such a stat ?,0,0
Guess Yankees won't get Harper in 18,0,0
And when he was given a day off or was on the DL the games didn't mean shit #facts #statsandinfo,0,2
As a Yankees fan your analysis of Jeter was on point to me.,0,0
You guys televise enough of it? Lol,0,1
Pero en verdad son muchos mas de tres,0,0
this is a crazy stat. #Jeter #Yankees pic.twitter.com/rNh31TElSv,1,2
In other good news bet the house on Yankees tomorrow night? #JeterNight,0,0
Yankees fan to the end but I'm a huge Adam Jones fan.,0,14
if the yankees and padres offered you a deal. who would you go to buddy?,0,0
Ruth mantle y jeter,0,0
@Yankees hope u guys r staying dry or inning or running around with your shirts off I would love that @TheJudge44 please do that,0,0
@ernestodelvalle @eleonbaz #mlbxfox Saludos para ustedes cual es el top 3 de jugadores de los yankees en la historia?,0,0
On Golf: A Hush Over Punishments on the Yankees Rule Out Nothing,0,0
Hey look! Twins are in first place! But Yankees are in a wild card position.,0,12
No se porque a Bonds no. Lo ha llevado al HoF con o sin esteroides es el mejor bateador de la historia,0,1
He should just be sent down. He was 6 for 60!!!,0,0
[ Yankees ] With a preemptive rain out today - The Yankees will play two as they retire #2. Sunday's game to be a da… http:// ift.tt/2r3Kby0 pic.twitter.com/GlpijWOHj4,0,0
#concurso Concurso Totalplay: gana viaje al clásico del Diamante Boston Red Sox vs New York Yankees http:// concursos.mx.cgana.com/2017/05/concur so-totalplay-gana-viaje-al.html?utm_source=dlvr.it&utm_medium=twitter …,0,0
From May 16th issue of @Forbes  MLB teams w/ biggest payroll decrease from '16: Padres -40% Yankees -13.3% White Sox -13.2% Pirates -7.4%,0,1
Final May 12 2017 ••• #Yankees loss 3rd in a row and 2nd to #Astros Headley was ejected in the… https://www. instagram.com/p/BUDEHjsA93C/,0,0
Can't even tell ya the score but the & were #sports #yankees http:// ift.tt/2qEkkwu pic.twitter.com/igd4ApWIwV,0,1
That's pretty neat actually,0,0
https://www. ruthiansports.com/new-york-yanke es/2017/05/13/the-story-of-the-yankees-pitcher-who-never-pitched/ … The story of the Yankees ’ pitcher who never pitched By Matt Ferenchick Larry McClure’... pic.twitter.com/Car5UegF5f,0,0
Nothing makes me happier than @LIVIDLAURENN becoming her username when I talk about the Yankees .,0,2
No Believe me I have. Cubs and Yankees . And any team that is playing against any Boston team in any sport. https:// twitter.com/TheRealSeanK/s tatus/863506198947147777 …,0,6
Where is Special Assistant Rodriguez? @Yankees,0,2
Yup 2 games in total tomorrow. Have a good day Josh!,0,1
Mets discord keeping them in eyeball game with Yankees - for now http://www. nydailynews.com/sports/basebal l/mets-discord-keeping-eyeball-game-yankees-article-1.3162205 …,0,0
Now is your chance to meet @Yankees GM Brian Cashman Wednesday June 28th! Tickets are Limited so call (516) 739-0580 to order! pic.twitter.com/VuM9Wl56m9,0,3
Not sure why Alex Rodriguez isn't invited to Jeters retirement ceremony Yankees are treating A-Rod unfairly.,0,0
I want to be a Papi fan! @fdotny You stink and you smell. You better watch yourself in Valencia cause im gonna bend your Yankees hat.,0,5
Tell them MacDill Air Force Base's UNMITIGATED UNWARRANTED UNSUBSTANTIATED Pride of the Yankees sent you.,0,0
Jeter Mantle Ruth,0,0
yankees 's video https:// instagram.com/p/BUC0H86D0p-/,0,0
I'm not a Yankees fan. Does this HAVE to be on Sunday Night Baseball? Didnt we honor him enough already?,0,0
Not sure who I hate more Yankees fans or Cardinals fans. Probably Cardinals fans.,0,0
Yankees aren't treating A-Rod right.,0,2
Chance Adams top Yankees pitching prospect earns AAA promotion http://www. nydailynews.com/sports/basebal l/yankees/chance-adams-top-yankees-pitching-prospect-earns-aaa-promotion-article-1.3162334 …,0,0
#Yankees : Jeter angry after A-Rod interview http:// yanksgoyard.com/2017/05/13/yan kees-jeter-reportedly-angry-rodriguez/ …,0,2
It was a quarter that the Yankees would finish above the rays and a quarter the Red Sox didn't win first place I think,0,0
Hi Annie! It's boring without yankees lol. Have a good Saturday!,0,5
como odio a los yankees y la psicosis que manejan la concha de su madre,0,0
I will b/c I trust your judgement but (as you may know) Jete is not this #Yankees fan favorite guy. #understatement,0,0
So what's going to happen when there isn't enough jersey numbers to go around?,0,0
Fuck the Yankees  am I right? @Jerem6401,0,0
By noooooooo means an @Yankees fan but Jeter was one of the greats. #MLB https:// twitter.com/si_mlb/status/ 863499199496769537 …,0,0
Not exactly but I know i had money on the sox and you had Yankees so I'm confident as ever,0,1
WTF Bryce? One year? Oh well enjoy him in 2019 Yankees . Wont be buying any Harper gear. https:// twitter.com/sportscenter/s tatus/863473168832487430 …,0,2
No son tan fanático de los Yankees  pero DJ se lo merece. https:// twitter.com/primerahora/st atus/863498819857780736 …,0,0
Severino has an extra day to rest and wins the early game tomorrow New York Yankees ML -132.0 Full card: http:// CappedIn.com/RatedRSports,0,1
Might be hottest ticket of #Yankees season. Stadium is sold out and you can be sure tickets are going at a HUGE premium in secondary market! https:// twitter.com/TomSportsInc/s tatus/863506402840596480 …,0,0
The Yankees need to win both games tomorrow in honor of Jeter because he is the ultimate winner.,1,2
Asked my mom what she wants to do for Mother's Day out of all things she just wants to stay home & watch the @Yankees 's double header lol,0,1
New York City News Search (We may never see Yankees flex their history like this again) New York City News & ... - https:// 1newyorkcity.net/we-may-never-s ee-yankees-flex-their-history-like-this-again/ … pic.twitter.com/YFizqqIBGF,0,0
Hay un montón de yankees subiendo su foto con Lauren porque se la cruzaron. Justo en mi corazón latinoamericano pic.twitter.com/kcmXEkDnYb,2,1
Ok I'm sad cause I'm missing Daddy Yankees concert,0,0
Watching an A&E documentary DVD on the Bambino himself #BabeRuth . @Yankees @Bio @AETV @AENetworks,0,1
New York Yankees moneyline -132.0 PICK DATA: http:// CappedIn.com/posts/172623/m lb/houston-astros-vs-new-york-yankees-pick … @ratedrsportspod On it? RETWEET #Yankees,1,2
From @StaceGots ; The Unsung Heroes Of The #Yankees Bullpen - http:// go.shr.lc/2rcDdTw #MLB,0,0
Sure he can. During Civil War my Irish-American ancestors rioted & burnt NYC to the ground rather than fight the South and die for Yankees,0,1
@MLBTheShow just played a DD game vs. Yankees ... After game over network error occurred and isn't giving credit for the W!! #help #comeon,0,0
So? Wasn't his fault the league was segregated. He would still have 714 HRs if every color was represented. Remember he was an ace for RSx.,1,1
New With Sticke Yankees New Era MLB Snapback Hat Cap 27th World Series https:// goo.gl/SYR98N pic.twitter.com/4clmUOVlOL,1,0
@maddie_thomp16 - this guy stole ball from Yankees fan wearing a Michigan hat. https:// twitter.com/super70ssports /status/863471137711411200 …,0,1
@Yankees tomorrow's my 19th birthday and since I grew up loving idolizing and watching Derek jeter. You should give me some free tickets,0,1
The flip,0,0
@NASCAR @Yankees Heroes are BRAVE Women & Men in the Military. I have many Sports Heroes @JeffGordonWeb #DerekJeter Rank Up There #ClassActs pic.twitter.com/nK6biYv7s4,0,0
Damn Yankees - Coming Of Age (Official Video) http:// fb.me/8BL59okgi,0,0
(Borrowing from Yankees fans) Hip-hip-JORGE!!! https:// twitter.com/twins/status/8 63505691612282880 …,0,0
Happy birthday @Topsheff42 !!! Can't wait to see you shine in the bigs!!! Happy birthday! GO YANKEES,0,0
Had tickets to the rained out Yankees game getting drunk on Wild Turkey and watching Superbad instead ¯\_(ツ)_/¯,0,0
Congratulations to @Yankees legend Derek Jeter. The ultimate pro,0,0
I think it was the Yankees game goin on upstairs tbh,0,1
Finally came in today @TheJudge44 @Yankees #AllRise pic.twitter.com/AgIp48t3Ao,0,0
We may never see Yankees flex their history like this again http:// nypost.com/2017/05/13/we- may-never-see-yankees-flex-their-history-like-this-again/?utm_source=dlvr.it&utm_medium=twitter … #sports pic.twitter.com/dQv7pMzlOU,0,0
AARON JUDGE #1/1 2013 Leaf Memories Autograph Printing Plate RC Yankees http:// dlvr.it/P7pRPN pic.twitter.com/zmdFH0fCYY,0,0
Pasa que los Yankees dan muchas oportunidades de brillar. Sobre todo a alguien bueno como él.,0,0
When she campaigned in Chicago she said she was a Cubs fan in New York she said she was a Yankees fan,0,0
My boss gave me a 15 minute long reason why Bryce Harper won't sign with the Yankees and why he is unnecessary ...,0,0
RT @mlbtraderumors : East Notes: Red Sox Volquez Yankees  Mets https://www. mlbtraderumors.com/2017/05/east-n otes-red-sox-volquez-yankees-mets.html?utm_source=dlvr.it&utm_medium=twitter …,0,0
Here's the why: Rainout Leads Yankees to Schedule Rare Single-Admission Doubleheader https:// nyti.ms/2qdunHY,0,1
First team ever to use triple digit numbers? #Yankees #JeterWeek pic.twitter.com/6E2RDG5duZ,0,2
No 42 either. It was retired After Mariano,0,0
Derek Jeter ! #RE2PECT2JETER #Yankees,0,1
https://www. ruthiansports.com/new-york-yanke es/2017/05/13/chance-adams-top-yankees-pitching-prospect-earns-aaa-promotion/ … Chance Adams top Yankees pitching prospect earns AAA promotion Chance Adams has been promoted to Triple-A Scr...,0,0
Yankees retire Derek Jeter's number: How to watch live stream info start time - http:// klou.tt/wucgfzlvnc3l,0,0
https://www. ruthiansports.com/new-york-yanke es/2017/05/13/yankees-jeter-reportedly-angry-after-a-rod-interview/ … Yankees : Jeter reportedly “angry” after A-Rod interview By Steve Contursi The Yankees all-time hits leader ha...,0,0
WATCH: A-Rod sends his congratulations to former #Yankees teammate Derek Jeter ahead of Jeter's jersey retirement: https://www. fanragsports.com/now/rod-sends- congrats-derek-jeter-ahead-jersey-retirement/ …,0,3
https://www. ruthiansports.com/new-york-yanke es/2017/05/13/we-may-never-see-yankees-flex-their-history-like-this-again/ … We may never see Yankees flex their history like this again By George A. King III Sun... pic.twitter.com/98VTKoBVSl,0,0
"Well we have" - Yankees https:// twitter.com/masnKolko/stat us/863480961559908352 …,0,0
#LegiónMexicana Debutó Giovanny Gallegos en @LasMayores con los @Yankees _Beisbol : http:// serpentineros.com/2017/05/13/deb uto-giovanny-gallegos-mlb-los-yankees/ … pic.twitter.com/KVm8X2UnxC,0,0
We may never see Yankees flex their history like this again http:// cpmlink.net/L28HAA pic.twitter.com/6Kd1V4Sb7a,0,0
Yankees game rained out setting up monster Derek Jeter day - http:// klou.tt/stbhon6yvhp1,0,0
Yankees -Astros pospuesto por lluvia; doble jornada el domingo Enviado con @MLB At Bat @DereckJeter http:// mlb.com/r/article?ymd= 20170513&content_id=230031648&vkey=news_mlb_es&fext=.jsp&c_id=mlb …,1,2
Lamentablemente es un desastre Twitter. César nos contó el asunto de los inversores yankees para su periodismo en USA que desertaron.,2,4
We may never see Yankees flex their history like this again http:// nypost.com/2017/05/13/we- may-never-see-yankees-flex-their-history-like-this-again/?utm_source=dlvr.it&utm_medium=twitter … #sports pic.twitter.com/xy993YuQFW,0,0
0,0,0
nypost​.com >> We may never see Yankees flex their history like this again http:// buzztap.com/-uLUvxK,0,0
Brian McCann is torching Yankees  but not with his mouth - http:// klou.tt/19s55pkszatxq,0,0
Este es el año de los @Yankees _Beisbol @Yankees  la nueva generación @sgilsantiago @EliasGRpc pic.twitter.com/jjWtzJ4yHD,1,2
i sold henry to the yankees,0,0
Today Leonardo DiCaprio is exactly as old as George Steinbrenner was the day he bought the Yankees (15524 days). http://www. exactlyasold.com /,0,0
Pricing on remaining teams #topps #bowman #thehobby #cardcollector #whodoyoucollect #orioles #cubs #redsox #yankees #TradingCards #Cardinals https:// twitter.com/casebreakouts/ status/863430346154676224 …,1,0
If you will relive a bit of your youth tomorrow breathe it in deep. Because Derek Jeter may be the last #yankees http:// nyp.st/2qh26yg,12,16
