
They sure aren't at MMP watching the games...lol,0,1
On Sunday the @Yankees will retire No. 2. A tip my hat to The Captain. Always a class act. http:// ow.ly/bnHr30bFFSz,2,7
God knows how many times I've seen #DerekJeter on the field but defiantly took it for granted. #Number2 #TheCaptain #Yankees #Retired2 https:// twitter.com/Budweiser/stat us/863002484838739970 …,0,0
What's your fav team? Yankees ? Mines too,0,1
The @Yankees will be ceremonially retiring Derek Jeter's number on Sunday at Memorial Park in Yankee Stadium.... https://www. yoursports.com/link/15899162? ver=1&ref=G1bu-otag-empty-rrMlF …,0,0
Excited to read this book by @RichardSandomir about "The Pride of the Yankees " 75 years after it debuted in 1942. https:// twitter.com/richsandomir/s tatus/863434802632040448 …,4,6
Derek Jeter Praises Aaron Judge to Jimmy Fallon During 'Tonight Show' http:// festyy.com/qSzTTz #Baseball #MLB #AL_East #New_York_ Yankees pic.twitter.com/cOgfQ6BHVd,0,0
yanksgoyard​.com >> Yankees : Jeter reportedly “angry” after A-Rod interview http:// buzztap.com/-2V10RD,0,0
Derek Jeter Praises Aaron Judge to Jimmy Fallon During 'Tonight Show':… http:// festyy.com/qSzTTz #Baseball #MLB #AL_East #New_York_ Yankees pic.twitter.com/0DWAKJLA8y,0,0
Yankees will not have Bryce Harper next season. He just re-signed with the Nats for a record $21M+ via arbitration.,1,5
Chance Adams top Yankees pitching prospect earns AAA promotion http:// nydn.us/2r4ntWp,0,0
We may never see Yankees flex their history like this again http:// nypost.com/2017/05/13/we- may-never-see-yankees-flex-their-history-like-this-again/?utm_source=dlvr.it&utm_medium=twitter … #sports pic.twitter.com/YEqMiuiMiH,0,0
#8: New York Yankees Derek Jeter New Era Number Retirement 9TWENTY Adjustable Hat-Navy: New… https:// goo.gl/fb/slW7TD #Caps #Hats #Sport,0,0
"Rainout Leads Yankees to Schedule Rare Single-Admission Doubleheader" by WALLACE MATTHEWS via NYT https://www. nytimes.com/2017/05/13/spo rts/baseball/rainout-leads-yankees-to-schedule-rare-single-admission-doubleheader.html?partner=IFTTT …,0,0
Yankees : Jeter &quot;angry&quot; after A-Rod interview http:// yanksgoyard.com/2017/05/13/yan kees-jeter-reportedly-angry-rodriguez/ …,0,0
Yes sir. Do you know anything? That's my point..you Yankees ' fans only see pinstripes. You do realize the YES network is their home network?,0,0
We may never see Yankees flex their history like this again http:// ift.tt/2pwfi5c,0,0
'Thank You New York:' Derek Jeter pays tribute to NYC days before the Yankees permanently retire his No. 2 jersey. http:// apne.ws/2q6Ejmk,0,0
With no Yankees on because of the rain Mets will fill in for me tonight #MLB,0,1
Houston @NY Yankees  Postponed (via http:// thesco.re/theScore_App ) https://www. thescore.com/mlb/events/594 98/box_score …,0,0
Looking forward to going to @bflay @BarAmericainNYC tomorrow to celebrate 10 years with @LauraLS80 B4 @Yankees game!,0,1
There are @MLB teams who don't have as many names as that and those are only the single digits. The @Yankees history is AMAZING! #GoYankees,0,0
[ Yankees ] With a preemptive rain out today - The Yankees will play two as they retire #2. Sunday's game to be a da… http:// bit.ly/2qE0EsO,0,0
Yankees pls https:// twitter.com/Buster_ESPN/st atus/863498536125685769 …,0,0
I wonder...What will draw larger TV audience: #IndyCar GP on ABC or Derek Jeter NY Yankees No. 2 retirement ceremony on ESPN Sunday?,0,1
So tired of seeing rumored trade deals for @Yankees Brett Gardner by sports bloggers. Leave him be!,0,0
Hey @SiriusXMSports  why are we getting the Cubs broadcast on a @Cardinals home game? We aren't all Cubs/Red Sox/ Yankees fans,0,0
East Notes: Red Sox Volquez Yankees  Mets - MLB Trade Rumors http:// dlvr.it/P7pJJz #Yankees pic.twitter.com/GoVSepClKV,0,0
We love you DJ!,0,0
The Yankees prospect we aren't talking about - Pinstripe Alley http:// dlvr.it/P7pHy8 #Yankees pic.twitter.com/Rn19XBNFDS,0,0
Derek Jeter pens a letter to the city of New York as his number is retired by the @Yankees . https://www. theplayerstribune.com/michael-jordan -derek-jeter-legacy/ …,0,0
He will be a Yankee. We have to drop the loyalty BS. Owners are garbage anyways. He loves the Yankees and Hal will pay any sum.,0,1
I like the braves and Lakers and Yankees and Duke and Kentucky and Cavs and cowboys and patriots... I get it.,0,0
Ronald Torreyes Tyler Wade & Thairo Estrada are basically the same player and that is a valuable one. #Yankees,0,0
Unfortunate but yanks hands are tied. Rain in AM could cause delay clearing stadium. ESPN hard deadline for night game. People paid hundreds,1,0
"Rare" single-admission doubleheader. This is the 3rd one at home for the Yankees since 2014. Is that really "rare?" https:// mobile.nytimes.com/2017/05/13/spo rts/baseball/rainout-leads-yankees-to-schedule-rare-single-admission-doubleheader.html …,1,0
yankees さんの動画 https:// instagram.com/p/BUC0H86D0p-/,0,0
Thank you #DerekJeter for 20 yrs,0,0
Babe Ruth Yogi Berra y Derek Jeter,0,0
Stop dos is @DelBarrioDC . Gotta cover Christy's hat b/c I just realized she has on her Yankees paraphernalia. pic.twitter.com/1FVgXn03kJ,0,9
I mean they would probably ask the Yankees if they were going to ask anybody about winning multiple WSs,0,2
Sorry ladies I'll be there if it's a Sox v. Yankees game!,0,2
I've never seen a joke go over someones head so badly. In the words of our "great" president SAD,0,0
Going to my first Yankees game tomorrow! And then my second! Thanks @meeks1213,0,3
What's with the 16 yr old girl rants? The tix for DJ night sold4 hundreds. There is a poss of rain sun AM and if delay can't clear stadium.,0,1
http:// bit.ly/2oskBis Derek Jeter Praises Aaron Judge to Jimmy Fallon During 'Tonight Show': New York Yankees … http:// dlvr.it/P7pCc2 pic.twitter.com/fF30h8ZMqs,0,0
Derek Jeter Praises Aaron Judge to Jimmy Fallon During 'Tonight Show' http:// bleacherreport.com/articles/27095 01-derek-jeter-praises-aaron-judge-to-jimmy-fallon-during-tonight-show?utm_source=dlvr.it&utm_medium=twitter … #Baseball #MLB #AL_East #New_York_ Yankees pic.twitter.com/3qyQBFJh5H,0,0
You forget the Yankees have their own players to sign as well. And you gotta be careful. Machado is having a below average offensive season,0,0
Why the retirement of Derek Jeter's #2 with the Yankees is May 14 2017 http:// dlvr.it/P7nswC,0,0
#DerekJeter #2 #Yankees,0,0
Jajaja le lanza bien a todo mundo pero igual pierde con Yankees  #PedroMode #WhosYourDaddy,0,0
And the Yankees have 27 https:// twitter.com/ryanfitzy05/st atus/863500144418967554 …,0,1
Why the retirement of Derek Jeter's #2 with the Yankees is May 14 2017 http:// dlvr.it/P7nswC,0,0
Phillies will offer more than the Yankees for both Harper and Machado,0,0
I'm so glad the Astros are the team playing the Yankees to tip their cap to the Captain! https:// twitter.com/brianmctaggart /status/863459001102684160 …,0,0
Why the retirement of Derek Jeter's #2 with the Yankees is May 14 2017 http:// dlvr.it/P7nswC,0,0
Authentic Joe DiMaggio #joedimaggio #yankees #nyc #autographcollector #autograph pic.twitter.com/c0xE3eGw9M,0,0
Why is he wearing a Yankees cap if this is the case? https:// twitter.com/elijahsemaj_/s tatus/863245574564454404 …,0,0
Why the retirement of Derek Jeter's #2 with the Yankees is May 14 2017 http:// dlvr.it/P7nswC,0,0
Tomorrow. Immortalized forever. #2 #Jeter #Yankees #JeterNight pic.twitter.com/JxF1f4TlCL,10,22
It's not the dude in the Yankees hat ffs,0,1
Who wore Yankees No. 2 before Derek Jeter? A baseball lifer #Yankees #bhive http:// dld.bz/fGNAj,0,0
1927 Yankees - Plate Signatures Lot 2107290 http:// ift.tt/2qh2mxb,0,0
Derek Jeter to have his #2 retired with New York Yankees  May 14 2017 43-days before 43rd birthday 322-days after turning '42' pic.twitter.com/NgVPO0JD01,0,0
@SBrowngardt 2019 He's a Yankee. 2020 he's the Yankees new captain haha https:// twitter.com/ap_sports/stat us/863494861936357377 …,0,1
And just who do the Nationals think they are? They better not even THINK about disrupting the Yankees ' 2019 plans. I won't stand for it. https:// twitter.com/Buster_ESPN/st atus/863498536125685769 …,0,0
Guy grew up a Yankees fan and they'll pay whatever it takes for him. He's not staying in Washington.,0,4
There's no way he stays in DC when Yankees offer him $500M for 10 years. He can hit 75 HRs a year in The Bronx.,0,1
By much and most people hate the Canadien too,0,0
Bitch he remembered the Yankees cheating and not tryna get into that mess and ruin his legacy,0,0
Yankees could've matched it and gave him some extra fame https:// twitter.com/bleacherreport /status/863466462912106496 …,0,0
#BINewsUSA #Baseball #MLB Rainout Leads Yankees to Schedule Rare Single-Admission Doubleheader http:// owl.li/A3mq50btjYM,0,0
Why the retirement of Derek Jeter's #2 with the Yankees is May 14 2017 http:// dlvr.it/P7nswC,0,0
#BINewsUSA #Baseball #MLB Extra Bases: On Uniform No. 0 the Yankees Rule Out Nothing http:// owl.li/gR8b50btjYL,0,0
#MLBxESPN : Los 10 mejores momentos de Derek Jeter los que definieron la carrera del capitán de los @Yankees _Beisbol http:// ow.ly/SeVN30bH5IE,10,22
Are you kidding ? If the Yankees have a guy that strings 3 good games together they hang the bunting and give him his plaque !,0,0
Larry McClure was signed to be a pitcher for the #Yankees . He played just not as a pitcher. http://www. pinstripealley.com/2017/5/13/1563 2330/yankees-history-highlanders-larry-mcclure-ty-cobb?utm_campaign=pinstripealley&utm_content=chorus&utm_medium=social&utm_source=twitter …,0,3
Started to write a list realized I can't because I'm way too biased as a person toward Yankees and my favorite players.,0,0
hoy que iban a ganar los Yankees llueve,0,0
New York Yankees retirará este domingo el número "2" de Derek Jeter #MLB http:// noticierodeportivo.com/new-york-yanke es-retirara-este-domingo-numero-2-derek-jeter/ … pic.twitter.com/vUkDHHj0Wg,0,0
Can't wait to see this kid in @Yankees pinstripes... 20-2 minor league career record with 2.00 ERA in about 200 innings pitched. Stud! https:// twitter.com/NYDNSports/sta tus/863443387868999680 …,0,0
Yankees host Astros try to avoid third straight loss (May 12 2017) | FOX Sports http:// rincon-sports.com/2017/05/11/yan kees-host-astros-try-to-avoid-third-straight-loss-may-12-2017-fox-sports/?utm_campaign=twitter&utm_medium=twitter&utm_source=twitter … pic.twitter.com/ohM5I2aCrQ,0,0
Máximo honor al Capitán: Derek Jeter | Los Yankees retiran hoy el número 2 en su honor: http:// ow.ly/cCZT30bHqeX pic.twitter.com/WJ2P4zTMNc,24,35
Join the Yankees .....it's going to be greater https:// twitter.com/Buster_ESPN/st atus/863498536125685769 …,0,0
Not disagreeing Yankees are the best baseball franchise but most people hate them,0,0
One of my favorite Yankees of all time. Was pitching the day Ryan was born. https:// twitter.com/chasriverdogs/ status/863495657360850945 …,0,1
NIKE NEW YORK YANKEES MLB DEREK JETER JERSEY BLUE KIDS SIZE 6 https:// goo.gl/9dWKmf pic.twitter.com/qSm6DfIP7l,0,0
The Yankees knew.,0,0
I cannot wait to watch tomorrow's game. Go #Yankees https:// twitter.com/yankees/status /863471365931905024 …,0,0
Soon enough you're going to have to have a triple digit number to play for the Yankees lol https:// twitter.com/espn/status/86 3446264188477440 …,0,3
Most wins in the #AL since 2012 #Orioles 466 #Yankees 456 #Rangers 451 #Tigers 448 #MLB,0,0
Why the retirement of Derek Jeter's #2 with the Yankees is May 14 2017 http:// dlvr.it/P7nswC,0,0
#MATTCARPENTER #CHASEHEADLEY #DAVIDCONE #GREGORYPOLANCO #YANKEES #CARDINALS #PIRATES https:// twitter.com/fam_Denn/statu s/863497391277838336 …,3,1
Root for the home team. Hoping to catch the @Yankees or @Mets in action? Just ask our concierge for assistance. #PCme pic.twitter.com/93iBvPiYBi,0,1
Quiero una gorra de los Yankees,0,0
@Yankees Told Mom we have be home by 6pm for tomorrow's pre-game show. She's got so mad at me.,0,0
Why the retirement of Derek Jeter's #2 with the Yankees is May 14 2017 http:// dlvr.it/P7nswC,0,0
Why the retirement of Derek Jeter's #2 with the Yankees is May 14 2017 http:// dlvr.it/P7nswC,0,0
https:// youtu.be/KqKY2XXyHFM tutti in piedi per un #mito che si ritira #Jeter immenso #2 degli @Yankees Video imperdibile sono unici in questo,0,0
Yankees retire Derek Jeter's number: How to watch live stream info start time #JacksonvilleJaguars http://www. newslocker.com/en-us/sport/ja cksonville-jaguars/yankees-retire-derek-jeters-number-how-to-watch-live-stream-info-start-time/ …,0,0
Why the retirement of Derek Jeter's #2 with the Yankees is May 14 2017 http:// dlvr.it/P7nswC,0,0
The Yankees are gonna run out of numbers sooner or later,0,1
The team that was expected to write that monster check the Yankees  seem to have recently loss reason to spend that much. (Judge),0,0
Derek Jeter #Yankees debiera agotar uj turno mañana https:// twitter.com/MLBbeisbolSpai n/status/863493517116571654 …,0,2
#HowTo Yankees retire Derek Jeter's number: How to watch live stream info start time http:// ift.tt/2rdUaOy,0,0
Even us @Yankees fans love him for what he did for the museum!,1,3
I wonder what the crowd is going to be like for the first game of the doubleheader on Mother's Day... #Yankees,0,4
Why the retirement of Derek Jeter's #2 with the Yankees is May 14 2017 http:// dlvr.it/P7nswC,0,0
Why the retirement of Derek Jeter's #2 with the Yankees is May 14 2017 http:// dlvr.it/P7nswC,0,0
#DerekJeter2 #Jeterday #Captain @yankees _beisbol https://www. instagram.com/p/BUC-yxbD-wX4 h7xwU9LCMStb0pu9A1uHf1kq2Q0/ …,0,0
@Yankees the Mariners got close2 beingKnockedOut playoffWildcard.only5 gamesLeftone Game wild cardYouHostEast coast.road trip @DexterFowler,0,0
P.S. everyone in Norway owns a Yankees hat WTF,0,2
When Red Sox Yankees and Phillies have more money then Nats and orioles. Both will hit the market.,0,0
Better hope nobody gets hurt,0,0
Why the retirement of Derek Jeter's #2 with the Yankees is May 14 2017 http:// dlvr.it/P7nswC,0,0
@MooreThanGreat what do you do when the Yankees play the astros?,0,0
Got clean & sober 1/7/88 bought Yankees season tics 3/3/88 kept them till 2010 30 opening days in a row. Ur bro's final 6 gamesWAS THERE,0,0
LOOK: Derek Jeter pens thank you letter to New York before Yankees retire his number http:// dlvr.it/P7p0RL,0,0
I have @RedSox @Yankees tickets in my hands for July 15th. I am barely able to contain my excitement over this. @MBrownINCA1,0,3
Why the retirement of Derek Jeter's #2 with the Yankees is May 14 2017 http:// dlvr.it/P7nswC,0,0
In 75 years the Yankees will have to give out triple digit numbers https:// twitter.com/espn/status/86 3446264188477440 …,1,2
Dawg I hate the Yankees but yea they would ahha,0,1
Day/ night double headers are a thing and fairly common,0,0
AL East: #Orioles (22-12) #Yankees (21-12): 0.5gb #RedSox (19-17): 4.0gb #Rays (18-21): 6.5gb #BlueJays (16-21): 7.5gb,0,1
How many people watching this broadcast actually care about the Yankees ? Just asking,0,0
Why the retirement of Derek Jeter's #2 with the Yankees is May 14 2017 http:// dlvr.it/P7nswC,0,0
Why the retirement of Derek Jeter's #2 with the Yankees is May 14 2017 http:// dlvr.it/P7nswC,0,0
It's hilarious. My guess is dad thought of throwin knucks then remembered he was wearing a Yankees jersey at Fenway. Pick your battles.,0,3
#RE2PECT  MJ & o Eterno Capitão Derek Jeter !!! #nyc #newyorkyankees #yankeestadium #yankees … https://www. instagram.com/p/BUC-YFQB7Ay/,0,0
Why the retirement of Derek Jeter's #2 with the Yankees is May 14 2017 http:// dlvr.it/P7nswC,0,0
Why the retirement of Derek Jeter's #2 with the Yankees is May 14 2017 http:// dlvr.it/P7nswC,0,0
I must say folks the 9-10 Yankees are looking sharp. We had a great practice today ahead of Thursday's season opener!! #pinstipesforwinners pic.twitter.com/XWlaB9WhZc,0,4
Why the retirement of Derek Jeter's #2 with the Yankees is May 14 2017 http:// dlvr.it/P7nswC,0,0
Today's Yankees game has been postponed due to bad weather,0,0
HEY YANKEES ? LUNCHTIME OVER YET? GIVE ME MY FUCKING MONEY BACK,0,0
En la SOBERANA VENEZUELA NO HAY REPRESION se llama defensa y sobran DERECHOS​.Tambien sobran LAMECULOS yankees y majunches escualidos...,1,0
Jeter' feelings got hurt because ARod said what most players felt. Other teams prepared more for other players on the Yankees than him,0,0
I'm not worried. Aaron Judge is #99.,0,0
#derekjeter #yankees #thankyou #captain #retirednumber https://www. instagram.com/p/BUC-QcIhIR4/,0,0
RIP Yankees fans https:// twitter.com/nationals/stat us/863462388913385472 …,0,0
Why the retirement of Derek Jeter's #2 with the Yankees is May 14 2017 http:// dlvr.it/P7nswC,0,0
Why the retirement of Derek Jeter's #2 with the Yankees is May 14 2017 http:// dlvr.it/P7nswC,0,0
World Series prediction update: Yankees or Houston winning the AL and Nationals winning the NL,0,0
Why the retirement of Derek Jeter's #2 with the Yankees is May 14 2017 http:// dlvr.it/P7nswC,0,0
Yankees get another nationlly televised game. Big surprise there.,0,0
Why the retirement of Derek Jeter's #2 with the Yankees is May 14 2017 http:// dlvr.it/P7nswC,0,0
Why the retirement of Derek Jeter's #2 with the Yankees is May 14 2017 http:// dlvr.it/P7nswC,0,0
He was a lot more important to the Yankees championships than Andy,0,0
Fitting Mother Nature told the Yankees to fuck off w/ the Jeter shit years after he was paraded through the league like Weekend At Bernies,6,3
Tomorrow morning on the World Wide Web I will have a story on if the Yankees will ever have a No. 0 since it is only single digit left.,6,35
Loco eso pasa en todos lados. https://www. iiss.org/en/iiss%20voic es/blogsections/iiss-voices-2017-adeb/may-8636/mexico-murder-rate-9f41 … Mira como está México y no los yankees no quieren invadirles,0,0
By 3. With 2 more years meaning Montreal has more CPY by a decent amount. L.,0,0
Says the Yankees fan in the spurs hat lol,0,4
Why the retirement of Derek Jeter's #2 with the Yankees is May 14 2017 http:// dlvr.it/P7nswC,0,0
The Yankees have more championships than Canadians lol,0,1
Saved the most important digit for last!,0,0
Check out AARON JUDGE NY YANKEES 2013 BOWMAN RC Rookie Card Lot (2) HR LEADER -HOT! MINT! https://www. ebay.com/itm/1726724049 65 … @eBay,0,0
If you're willing to accept ties why not put a clock on the game? 8/18/06 Red Sox v Yankees - 9 inning game 4 hours and 45 minute,0,1
I miss DRob @Yankees bring him back,0,0
Why the retirement of Derek Jeter's #2 with the Yankees is May 14 2017 http:// dlvr.it/P7nswC,0,0
Gotcha. I don't think a guy like Mike Trout needed success at every level. He could succeed on the '27 Yankees .,0,0
@The_Raheel @johngranato @SeanUnfiltered do youuu think that the @Yankees are scared to play the @astros and bad weather was an excuse?,0,3
When ARod was w the Yankees the best SS played 3rd base,0,0
But giving a FREE GAME to those that are ALREADY GOING?? THOSE ARE MY TICKETS. I'm DON'T enjoy paying for strangers to see Yankee games,0,0
And I'm a die hard Yankees fan.,0,0
Yankees young outfielders are so promising it's tough for fans to be angry Ben Gamel is hitting .339.,0,0
Then the Montreal Canadians would be the best franchise in the world. L.,0,0
dusting my broom off for tomorrow!! #Sweep #GoJaysGo #LetsRISE,0,7
Latest @ShaneAndBriMan here: http:// traffic.libsyn.com/sportsandsorts /Sports__Sorts_37_mp3_1.mp3?dest-id=503824 … #Yankees #Mets #RedSox #Orioles #Cavs #Warriors #Spurs #Celtics #Wizards #NBA #MLB,1,3
#Yankees retire Derek Jeter's number: How to watch live stream info start time https:// unitedvanrentals.com / #NYY http://www. cbssports.com/mlb/news/yanke es-retire-derek-jeters-number-how-to-watch-live-stream-info-start-time/ …,1,1
Hey Yankees ...EITHER let us into the make up game tomorrow at 1pm OR offer me a refund. ONE OR THE OTHER. YOU CANT HAVE BOTH.,0,0
Why the retirement of Derek Jeter's #2 with the Yankees is May 14 2017 http:// dlvr.it/P7nswC,0,0
YANKEES -ASTROS PLAY 2 ON JETER'S DAY >>>> http:// bit.ly/2qf4reB <<<< #MLB #Yankees #Astros #BronxBombers #DerekJeter #DerekJeterDay #TMMQB,1,0
Couldn't stand the wait/stress/gamble/. 8214 were looking only 2251 left. Sometimes just gotta say heck and go for it! @Yankees #RE2PECT pic.twitter.com/IGs3cguvYk,0,1
people with tickets to Sunday night are in SHOCK at their free game! Well Imagine my shock at paying for YOUR TICKETS!! I HATE YOU YANKEES !,0,0
This rain is killing #NYC and the #Yankees,0,0
Happy about your FREE game tomorrow YOU'RE WELCOME. 3 of you will be sitting in seats that I PAID FOR and that the Yankees will not refund,0,1
I don't care about marketing or anything like that. I just care about championships. Yankees have many more championships than Cowboys.,0,1
Why the retirement of Derek Jeter's #2 with the Yankees is May 14 2017 http:// dlvr.it/P7nswC,0,0
Yo @Yankees fans! Check out these vintage #Yankees coasters while #AaronJudge continues to make baseball look easy. http:// etsy.me/2pqgmDY,0,0
I just hope he doesn't go to the yankees,0,0
Pelos de punta #JeterNight #Yankees #RE2PECT pic.twitter.com/AlsAmFlH66,7,12
#MLBxFOX el juego yankees Cubs 18 entradas,0,0
The Captain got his number retired today! Only double digits from here on out! #Yankees @Yankee… https://www. instagram.com/p/BUC9PyHjMX0/,0,1
On Uniform No. 0 the #Yankees Rule Out Nothing https:// unitedvanrentals.com / #NYY https://www. nytimes.com/glogin?URI=htt ps%3A%2F%2Fwww.nytimes.com%2F2017%2F05%2F13%2Fsports%2Fbaseball%2Fderek-jeter-new-york-yankees-st-louis-cardinals.html%3F_r%3D4 …,1,1
BALL GAME! #BlueJays win #4inarow #LetsRISE @IceQueenkmb @chris_woolridge @Nighthawk72 @h_farb @The_JayWalk @emo0401 @arethejaysin1st,1,3
Bloquemezclacal para la pared y chapa para el techo..Tiembla el nuevo estadio de los Yankees o el de la U of Phoenix..,0,1
WHEN I don't get a reply I will write attorney general's office this is BULLSHIT. And you stole $200 with no refund offer,1,0
The Yankees prospect we aren’t talking about - Pinstripe Alley http://www. pinstripealley.com/platform/amp/2 017/5/13/15633852/thairo-estrada-yankees-prospects-2017 …,0,0
He's going to the Yankees lol,0,0
It was all white back then,0,0
#Gorras #Gorra #MiColeccion #LaDeHoy #Yankees #BaseBall #NewEraMx #NewEraMx #neweraisthecap … https://www. instagram.com/p/BUC887LlxFZ/,0,0
The yankees,0,0
U know the mlb is more Puerto Rican and white then Black right,0,1
I liked a @YouTube video http:// youtu.be/JqdfmyIzkzw?a The Amity Affliction - Fuck The Yankees,0,0
what if I lived in Australia? I should just COME BACK ANOTHER TIME? While you give a freebee game and shut out ticket PURCHASERS????,0,0
The Yankees win all the time in part bc their fans don't accept their players sucking. They boo their asses off,0,0
Remember when Jeter was retiring and people were writing op-eds about how the Yankees would head into a decade of irrelevance? LOL,0,6
“now batting for your New York Yankees  number 3.5 Bryyyyyyce Harrrrrrrperrrrrrrr!!!”,0,1
BWW North Sub State Cullman/Vinemont ~ 10U A ~ Husky Select 10U def Central Yankees 9-1 @TourneyMachine,0,0
los yankees y sus politicas son lo mas peligroso del mundo.,1,1
おかずクラブゆいP「裸の（いぬ）太田と（おかずクラブ）オカリナさんが相撲を取ってて…」屋「それはもうS●Xやん!」（Apr.052015『New York Yankees 』）,0,0
Add that to the list of reasons I don't like the Yankees,0,1
Yeah it's that ol' New York/East Coast bias again. I hate the Yankees  but just on his roster of ladies he's been with alone I respect #2.,0,0
And didn't play against black people,0,0
East Notes: Red Sox Volquez Yankees  Mets http:// dlvr.it/P7npRP pic.twitter.com/MiajNt5qai,0,0
Twitter suggested that I follow the Yankees ....I feel disrespected.,0,1
East Notes: Red Sox Volquez Yankees  Mets http:// dlvr.it/P7npKv #BostonRedSox #BrockHolt #EdinsonVolquez #mlb #fantasybaseball,0,0
ok,0,0
HEROIN PROOF ur KIDS AMERICA https://www. pscp.tv/w/a-UbNDFlVmpZ ZFlBelBCS0x8MURYR3lWbmdFWlBKTZ1p9hwx9-t2UU-7cgDF1gCWCGIdaeZRzCwrNkls3vXd … #INDYCARGP #indycar #abc #yankees #impact #sounders #columbus #indiana #indy #Cincy,1,0
Yankees won't allow 0 or 00,0,1
Mañana Derek Jeter recibirá un homenaje en el Yankee Stadium al retirarle el número #Re2pect #TheCaptain #Yankees #MLB pic.twitter.com/G1QlwJgQbI,2,3
And drinking,1,0
#Boston_Red_Sox East Notes: Red Sox Volquez Yankees  Mets http:// dlvr.it/P7nnB3 #investment pic.twitter.com/tN5gdPT7VB,0,0
Why the Yankees game postponed fuck !,0,2
#Astros #CrushCity #GoStros #Tickets New York Yankees vs Houston Astros Tickets 05/14/17 (Bronx) DOUBLE HEADER http:// ow.ly/OGvD50btj01,0,0
Nice!!! This year I get a home game against the Yankees so I'm excited! The dome prob will be open then too,0,1
I can't wait for that douchebag to be a free agent and sign with the Yankees .,0,0
I can wait a year to give Bryce a $400M contract. #Yankees https:// twitter.com/darrenrovell/s tatus/863489886611001345 …,0,0
He didn't deserve those gold gloves. He got those based on his hitting and because he played on the Yankees . Same w/ several all-star gms.,0,0
Babe just used hot dogs.,1,0
Just don't get this. Will the Yankees do the same for Bagwell? Smh just ridiculous. Just feeding the monster in NY,2,3
I learn something new every day... thank you @NYYfan2442,0,0
The Yankees are bad imo,0,0
Nice going away gift. #Yankees https:// twitter.com/lastwordonspor t/status/863490819449384960 …,0,1
I had no idea either thank you for asking the question!,0,1
Check out BABE RUTH vintage 1980 TCMA #1 GMA 10 Gem Mint All Time Yankees #NewYorkYankees http://www. ebay.com/itm/BABE-RUTH- vintage-1980-TCMA-1-GMA-10-Gem-Mint-All-Time-Yankees-/172672426072?roken=cUgayN&soutkn=l5456y … via @eBay,1,0
its ok you can be a Yankees fan.. we're still cool ♡,2,2
Chris is done after 3 innings. 36 pitches. Nationals 6 Yankees 0. pic.twitter.com/PyVWNcBTKY,0,0
