
No. I have no illusions as to what the country IS. It's what it SHOULD be that makes me a realist.,0,0
Cathay Williams: born a slave she dressed as a man so she could serve in the US Army during the Civil War. There's your new statue. pic.twitter.com/7MlHlW5brB,64938,174616
Cathay Williams: born a slave she dressed as a man so she could serve in the US Army during the Civil War. There's your new statue. pic.twitter.com/7MlHlW5brB,64938,174616
São mesmo as bruxas,2,2
TD celebrations using the ball as a prop? Yep that's allowed now. pic.twitter.com/PSFkUbYmSQ,357,994
"Justice will not be served until those who are unaffected are as outraged as those who are" -Ben Franklin pic.twitter.com/MSRtHDVRBe,54257,119884
Actually as awful is all the rest is- I find that comforting,0,4
Federal Judge Rules Trump Incited Violence at Rally as Candidate #NoTrumpRallies #ImpeachTrump http:// time.com/4722209/judge- president-trump-rally-violence/ …,4803,6659
This clip is justifiably gaining fame as an example of live fact checking and the refusal to grant talking points. pic.twitter.com/RPFCO0L7DA,10963,23680
me as a parent pic.twitter.com/YoJM7aQ2V3,3793,5842
Pembukaan #SEAgame2017 yg bagus tapi tercederai dg keteledoran fatal yg amat menyakitkan. Bendera kita....Merah Putih. Astaghfirullaah... pic.twitter.com/k92SlDdBqB,22185,9101
Nicolino shuts down Mets as Marlins roll: The Mets were determined heading into this… https:// goo.gl/fb/hTQreX,0,0
Went to Fry's and got a price on it as well.,0,0
As a Black man you went and let those swaggerless Neanderthals experiment with your hairline You deserved this https:// twitter.com/kharifanacc/st atus/898419083598635009 …,12559,23412
mas as pessoas só querem saber se ela engordou ou não com quem ela ta namorando ou não https:// twitter.com/rihannanobr/st atus/899005787896512512 …,89,133
quero poder acordar todas as manhã ao teu lado,286,83
I just entered to win a Bath and Body Works prize pack as part of Surf Sand and Sons thank you giveaway! #Giveaway https:// wn.nr/T2ACRz,0,0
Retweet this if there's no amount of money that could get you to ruin your life by dressing up as a Nazi in front of thousands of cameras. https:// twitter.com/billpowers9/st atus/898851553087324161 …,19638,24960
Cartola é baseado na minha vida só faço as escolhas erradas,0,0
wasted as but still cleaned my room before i can sleep in it,0,0
i'm high as fuck lurking DEEP into japanese twitter SLAMMING the translate buttons to figure out what the fucks goin on,9151,48174
negocio é ficar as pampa com esse vinhão na baia,0,0
50 million down the drain As Tony Martial scores again pic.twitter.com/kbwLvURDQr,278,334
"n sei pq mulher pinta unha homem não faz questão disso" amigo talvez nem tudo q as mulheres façam seja pra agradar os homens só talvez,1939,2937
I love how everyone on twitter is as anti Social as me,1,1
Haha. Are you comfortable with Cooper Rush as the backup? Backup situation is scary,0,0
Fave season 6 scene was Emma's song as well as filming the #captainswan wedding @jenmorrisonlive #OUATSF,142,193
sou péssima em cortar relações com as pessoas pod cagar em cima da minha cabeça ferrar minha vida se falar um "oi" eu já tô lá "oi tdbom",622,512
You have outdone all my dreams I dreamt from my bedroom when I started this as a 14 year old boy I never expect to come this far thank you,39906,110160
this cute as fuck https:// twitter.com/rayhdz07/statu s/897228405485309952 …,152,256
The live drawing relay was so hilarious! As each piece was passed on they became more and more grotesque.,0,1
As vezes se retirar é o melhor pra todos. pic.twitter.com/9H2uQeUvVQ,11390,11338
She Crazy As Fuck that's why I love her.......,1,0
"Guri galinha" "Guria puta" Larguem os rótulos as pessoas ficam com quem quiserem e com quantos quiserem,43,45
Se certas mulheres soubessem qts Homens comprometidos eu já dispensei Elas iam me AMAR ainda bem que guardo as ... http:// fb.me/zZIAWmcU,0,0
Fave season 6 scene was Emma's song as well as filming the #captainswan wedding @jenmorrisonlive #OUATSF,142,193
acordaaa menina olha as novas regras,5,5
I'm reading a script where the writer describes a woman as athletic with the line "six percent body fat". I scribbled in red: "Is she dead?",768,3598
Bxkskck quando eu to alterada em público interajo até com as pessoas q passam na rua parece nem que sou anti social q E mando mts áudios,0,1
Were you not paying attention in Charlottesville? Statue was used as a focal point for those who wanted to claim white supremacy.,3,51
She threw her bag in the back keeping her box with her as she hoped in next to him "To escape..",0,0
imagine if white people fought against racism as hard as they fight for that boring song and that ugly flag https:// twitter.com/jaci_lane_/sta tus/898161203477975040 …,37658,85349
mesma coisa com as armys nem todas são ruins então pf n ha necessidade de sair difamando fandom alheio,0,0
He looks like a baller already. The celebration was class as well https:// twitter.com/fla_videos/sta tus/899047011890212864 …,0,6
E quantas vezes chorei ao ler as mesmas mensagem que um dia ja me fizeram sorrir https:// twitter.com/TheDobrev10/st atus/899019883144507394 …,85,26
Retweet this if there's no amount of money that could get you to ruin your life by dressing up as a Nazi in front of thousands of cameras. https:// twitter.com/billpowers9/st atus/898851553087324161 …,19638,24960
baekhyun: "bts são os melhores. exo-l's são as melhores também" nem acredito que essa guerra de fandom acabou com esse vídeo de 11 segundos pic.twitter.com/Sk6Bt9ijGb,8082,8654
Se tu me emprestar ela as vezes eu deixo,0,0
eu te devolvi as goivas né??? skdsjdskds ai trauma real daquilo,0,0
((You will do dumb and stupid things and I the beautiful Genius Gamer will protect you as your sidekick)),0,0
In the good Tea Party days we had NO arrests. Average conservatives don't go around looking for a rumble or to cause physical harm.,0,0
Fico muito feliz em saber que as pessoas se sentem bem me dizendo coisas ofensivas no anônimo até porque não me ofende em nada então é nois,0,0
the sprouse brothers completely switched Cole was the least fav with long hair and Dylan is as like "OMG HOT" with short hair and now +,0,0
quand t' as des frères et sœurs obligé t' as déjà dit cette phrase à tes parents "quand c'est lui tu dis rien hein",3144,1501
I miss Indy as well but I had a couple of really really good meals in Boston last week.,0,1
Mete bue piada ver gajos tds tolos com este rabinho mal sabem eles que estão a ser gozados à força toda e que este ass é do Kiko xD https:// twitter.com/atuamaehehe/st atus/898656293816324098 …,4818,2722
She deserved that. They all deserved that moment to be happy and connected as a fan and idols. pic.twitter.com/QRHaOYarYE,65,325
T' as des photos avec des gens sur ton portable avec qui tu ne parles plus que tu n'arriveras jamais à supprimer tellement ct bon ce temps là,42,44
Thom Singer has spent 7 years as a #solopreneur . Hear his story. #careers #business #biztips #Austin http:// traffic.libsyn.com/coolthings/CTE D_164.mp3 …,0,0
Gonna be a run on biotin as all these alt right bros rush to grow out their fashy do's,8,50
One day we're gonna talk about how the media is always portraying black women as angry and white women as innocent and docile. https:// twitter.com/daily_star/sta tus/898554330051170305 …,47153,106209
Alarmed lately??? So whats your plan as Senator Sir? We"ve been alarmed since killing day1. ....,1,18
Please don't take Hansol coming out as asexual as a reason to assume other idols sexualities. Remember that it's none of your business.,4359,6522
Que partida MONSTRUOSA do @LucasPaqueta97 . Acreditando em todas as jogadas até o final raça pura! E já deu uma assistência...,1527,4359
I N S P I R A S Y O N Laban fam! God bless us all. #PushAwardsKathNiels pic.twitter.com/aIehhry9VT,385,165
she actually said "black people have to be twice as good especially women. I'm perfectly OK with having to be twice as good." https:// twitter.com/Daily_Star/sta tus/898554330051170305 …,37160,85893
Yeah this is my default size. Overweight irl so might as well use it,0,2
Ces adultes qui ne répondent pas à ton "bonjour" mais qui ont le culot de dire que la jeunesse n' as plus d'éducation..,7118,5290
Estamos as duas que eu setembro vou começar plano denovo,0,1
What's your FC on the switch btw?,0,0
donne des choses que tu as appris grâce à Pierre — Que Jésus c'est pas un rappeur noir qui a des gros ... https:// curiouscat.me/4341555742/pos t/195539769?t=1503187198 …,1,1
No doubt Dak and Dez are criminals too might as well suspend them both and get it out of the way,0,0
眞鍋審判 技術、安定感ではNPB一、二の評価の高さであり、佐々木と並ぶ幹部候補生。一方、判定に文句言う選手に 露骨な仕返し（報復）ジャッジを行う審判であり、クレームを言う選手は少ない。 （実際は誤審でも、文句言いに来ないから誤審が見えにくい＝安定的評価ともいえるが・・。）,49,20
Topp Dogg's Hansol comes out as asexual http://www. allkpop.com/article/2017/0 8/topp-doggs-hansol-comes-out-as-asexual … pic.twitter.com/qd2WU1lkH2,1031,3479
Lap 30 P18 @DaleJr has been quiet on the radio as he picks up position in the @AxaltaRacing Chevy. #Axalta88,20,107
talvez ser sincera as vezes não seja a melhor opção,0,1
As a homosexual I'm quite reassured by Donald Trump not wanting a 7th century backwards wildly violent intolerant religion in the US.,86,525
Always gotta have those Garlic Knots as well!!,0,2
I voted for Alyssa Valdez as Push Sports Personality. Your turn! Vote for the Push Awards 2017 now! http:// pushawards.abs-cbn.com/push-personali ty-awards?uid=f838e20f4a507405d01aacc0677beebc …,2,5
Lions with 3 3-and-outs 2 near takeaways & 2 sacks in their first 3 defensive possessions. Jets are as bad as advertised.,3,25
i let lisette follow my rant..trust her with my life..my secrets....and in return she exposes me as a..a minkist...a minkinator,1,4
Deslizando as notificações você repara em uma em específica. Era do Justin... -Ly #MTVHottest Justin Bieber,93,21
Last night Daniel Craig officially confirmed he will return as James Bond for a fifth time. Story via @USATODAY http:// apple.co/2x4SOHQ pic.twitter.com/yhFVQYot3h,13,28
This is as important as anything else! Please tweet someone close to you to remind them that they are important too! pic.twitter.com/viO4uq7WAS,224,350
TD celebrations using the ball as a prop? Yep that's allowed now. pic.twitter.com/PSFkUbYmSQ,357,994
Retweet this if there's no amount of money that could get you to ruin your life by dressing up as a Nazi in front of thousands of cameras. https:// twitter.com/billpowers9/st atus/898851553087324161 …,19638,24960
My sister's fav thing to do is label me as a bitch in front of everyone.,0,0
AS LETTERHEAD when he cashed in his 401K that has tripled in value since TRUMP was elected. Hint: He hasn't. He's still riding TRUMPs Name!,0,1
@channelstv  did u use "disrupt" as opposed 2 "boycott" word? D thread z that u caped that IPOB threatened 2 disrupt#Anambra guba election? https:// twitter.com/Uchez2/status/ 898810587240476672 …,1,0
As a Black man you went and let those swaggerless Neanderthals experiment with your hairline You deserved this https:// twitter.com/kharifanacc/st atus/898419083598635009 …,12559,23412
As vezes se retirar é o melhor pra todos. pic.twitter.com/EUqfpzemBC,1519,1632
Nothing is as irritating like receiving low quality nudes,1,0
As Atty. Gen. he approved the FBI's wire tapping of Dr. MLK. Now what? http://www. slate.com/articles/techn ology/future_tense/2016/01/what_the_fbi_s_surveillance_of_martin_luther_king_says_about_modern_spying.html … #Charlottesville pic.twitter.com/JlmMduvOVC,680,1086
KKKKKKKKK AI SÓ OBSERVANDO AS EMBUSTE RINDO MT E VCS,0,0
pesco mt rápido as paradas só vou ligando uma coisinha na outra e qnd vou ver já descobri a história toda bobo é qm acha q me engana rs,11898,8514
POC: "I'm not afforded the same opportunities as my peers and there are facts and statistics that prove exactly why" You dumb asses: EMAILS! pic.twitter.com/Ko3rQiSMzK,0,1
I voted for James Reid as Push Male Celebrity. Your turn! Vote for the Push Awards 2017 now! http:// pushawards.abs-cbn.com/push-personali ty-awards …,0,1
This gone be me as a parent LMFAOOOOOOOOO pic.twitter.com/VS42iQyUNv,67395,98580
I have to admit that in my 10 years as a caker this was my first try at piping flowers. I'm so happy with how my... http:// fb.me/8rZu07geP,0,0
i hope it felt good seeing my hilary 2017 bumper sticker as i drove by,0,1
Elephants show powerful emotion as they mourn the loss of a young bull (cause unknown) near Tarangire Nat’l Park. Video by @ChemChemSafari . pic.twitter.com/xRerAtKbNJ,148,407
End coerced plea bargains. Don't jail anyone accused of assault on police as the only accusation of violence against them.,0,0
This is crazy as an multifandom I feel really sorry angry and sad! #괜찮아_K아미 #Please_Apologize pic.twitter.com/PizMyNaKgl,245,370
Já viram alguma mulher boazinha ser recompensada???? Nego n sabe dar valor às coisas que tem...... lamentável,59,94
There's a certain mechanic that was misdiagnosed as a bug in the Zelda game yall need to apologize for... @katemitiger LOL https:// twitter.com/AMAZlNGNATURE/ status/898789553573576704 …,1,4
quand t' as envoyé un message risqué et que la personne laisse un "vu" pic.twitter.com/71jR7PEfbV,6126,3904
qnd as paranóias vão embora e me deixam dormir pic.twitter.com/KvSPyO6h7u,2359,2100
Até pensei em vinganças. Mas não há nada melhor do que as voltas que o mundo dá.,373,459
As a doctor I fully support THIS #25thAmendment https:// twitter.com/thehill/status /899041549287292930 …,853,1798
@Symbiologica I was going to use probiotics or yogurts as "unknowns" for students to characterize in Micro lab this fall. drinks=fun too! https:// twitter.com/jasthuset/stat us/899043548447870976 …,0,0
Good news from k-army!! We did it fam As soon as the #Please_Aplogize ht got trended k-fandoms saw it too and on other-,2045,3362
morro de medo de acabar sendo invasivo com as pessoas q eu gosto por me preocupar dms com elas,2760,1742
Won't be important to you unless you watched wrestling as a child.,0,1
todo dia uma reflexao filosofixa diferente sobre as amizades que eu tenho,0,0
安静にするのにゃあ(´；ω；｀),0,1
It's so hard to date someone who isn't as smart as me because they never believe they wrong,0,0
When she fine as hell goofy not for everybody got goals and ambitions an can take a joke/clap back when you roast her ass pic.twitter.com/81xz4guYC3,17647,30398
Police in Finland say a knifeman who killed two people on Friday appeared to choose women as targets http:// bbc.in/2x0731k pic.twitter.com/WwuGdVUYoT,303,292
Companions of Holy Prophet (ﷺ) made gradual changes as Islam was revealed. Their example shows there can be no extremism in Islam #VOIsermon pic.twitter.com/ppahZs7NP2,9,8
Hoje tem #MostRequestedLive ! Se 'Friends' ficar entre as 3 mais pedidas a música toca em mais de CEM RÁDIOS! Estejam aqui às 20:00H.,26,22
I saw someone summarize the F/GO protag as "became savior of humanity through a craigslist ad" and that's actually completely accurate,208,212
Costco is coming for your house your family and your life. Nothing is beyond them. Actually really good if you appreciate hops as I do pic.twitter.com/rzmGrU4Yc2,0,1
@nyjets using Hackenberg as the starter is 0-16,0,0
kim seokjin is the only man i've ever unironically described as "dreamy".,105,250
Pence needs a mental check up as well! https:// twitter.com/huffpost/statu s/899057110893383680 …,0,0
GOOD IT BEGINS: Bannon Plotting Fox News Competitor As Curious Details Of Roger Ailes' Involvement Emerge http://www. thegatewaypundit.com/2017/08/begins -bannon-plotting-fox-news-competitor-curious-details-roger-ailes-involvement-emerge/ …,869,1287
Esse trecho ficará fechado para as obras ou somente para a remoção da passarela?,0,0
Just watched everything everything & the movie was just as good as I thought it would. @notnickrob @amandlastenberg,192,2568
I hate when people tell me my head big. Bitch! You think I don't see this big as forehead?,24,9
They may not find New York as kind as Boston was,0,0
Retweet this if there's no amount of money that could get you to ruin your life by dressing up as a Nazi in front of thousands of cameras. https:// twitter.com/billpowers9/st atus/898851553087324161 …,19638,24960
And if you can't teach others to be human even then u fail as a human,0,0
I want to feel free as the flowers pic.twitter.com/y363MpQMLj,164,185
Vehicles left dangling as car park collapses in Nottingham http:// fb.me/3AT4jXwi3,1,0
Harry as Fromage de Chèvre pic.twitter.com/Zh1vPlJ0Ji,137,222
As much as I hate how he's written there his expression makes up for most of it,0,0
ISIS jihadist stabs 8 people in Russia's Surgut today. MSM barely says anything because God forbid it shows Russians as victims of terror.,4469,6513
Welcome @sellpounds to Codex As The Newest Manager! pic.twitter.com/cyseabORoV,4,17
insanely funny that you can spend literal hours playing a mission as safe as possible in hitman or you can just pop two shots off and run,0,10
TD celebrations using the ball as a prop? Yep that's allowed now. pic.twitter.com/PSFkUbYmSQ,357,994
As FANZOCAS do @EvertonCardoso motorzinho homossexual tão tirando a calcinha nesse momento,3,2
ela deve ter bloqueado todas as camilizers pic.twitter.com/yhKLK8xZCQ,0,1
PETITION FOR A LIVE ACTION TANGLED MOVIE WITH JEN AND COLIN AS RAPUNZEL AND FLYNN @DISNEY,129,173
Rally round the flag boys she has me surrounded. Remember the uhuh what were we supposed to rememberoh yea The Alamo thats not itgosh,0,0
@CharlyCarusoWWE just put that failed cash in attempt in @BaronCorbinWWE face she may as well laughed,0,0
São mesmo as bruxas,2,2
sério tweetar "reciprocidade" não vai fazer as pessoas sustentarem seu ego,0,1
" As pessoas acham que eu não sei quando riem de mim mas eu sei. Eu só não sei sempre o porquê." Atypical está disponível. pic.twitter.com/Hqa4Clhdvn,908,3598
Ideal seria que todas as pessoas soubessem amar o tanto que sabem fingir.,2,2
Picking The Velvet Underground - Heroin as his walk on music too https://www. youtube.com/watch?v=6xcwt9 mSbYE …,0,0
Why am I levelling Shigure really? I don't even dare to use her as she is such taiha magnet?,0,0
As mães têm sempre razão porra  podr demorar a acontecer mas não falha,132,20
As vezes ou sempre?,0,1
I carried you as a burden cause you taste right.,0,0
Que partida MONSTRUOSA do @LucasPaqueta97 . Acreditando em todas as jogadas até o final raça pura! E já deu uma assistência...,1527,4359
Massive game today. It won’t be remembered as the “Big Bang”.,0,0
"Justice will not be served until those who are unaffected are as outraged as those who are" -Ben Franklin pic.twitter.com/MSRtHDVRBe,54257,119884
They love to sling shit just as much as urine Thanks to Obama + Soros terrorist school for KIds with out a mind! https:// twitter.com/StockMonsterUS A/status/899056233566445568 …,0,1
PETITION: Already 20000 signatures to designate Antifa as a terrorist organization. Sign & retweet. #Boston #FreeSpeech https:// twitter.com/miketokes/stat us/898686532474683393 …,1018,1106
The last name Lee has also become an unacceptable reminder of General Lee so that is now banned as well.,0,0
Antifa is as bad as KKK!,0,1
i don't think anyone could hate a group as much as they hate that one tbh,0,0
As long as they always have the McRibDLT on hand this won't be a problem.,0,0
These cultists have done as much damage to the Christian faith as jihadists have done to Islam. http://www. npr.org/2017/08/18/544 531424/trumps-evangelical-advisers-stand-by-their-man …,6464,12963
fic: two members start as fuck buddies-one soft one moody me: yes fic: but guess what me: Yes fic: the moody one falls in love first me: YES pic.twitter.com/m2mol5DJgl,2525,3779
Vou lá na rua oliveira comprar batata com as meninas o,1,2
Cops shouting "PLEASE MOVE AS FAR LEFT AS POSSIBLE" and it's like yeah bruh wtf you think I'm doing out here,8930,44834
This gone be me as a parent LMFAOOOOOOOOO pic.twitter.com/VS42iQyUNv,67395,98580
. And #kudos to @marty_walsh and his team for their leadership and moral stance on this issue and as a member of @ClimateMayors,0,1
as alwayss,0,0
Deus se um dia eu estiver prestes a perder as esperanças me ajude a lembrar que os teus planos são maiores que os meus sonhos.,280,377
That is as good a reason as any,0,1
كٌل الأمنيات والدعوات للكابتن الخلوق نواف العابد بالسلامه وأن يعود بافضل حال عن قريب باذن الله pic.twitter.com/EPUsulo1jJ,372,91
Unfortunately as I see it they have complete control over the future of btc. Reasoning:No one uses btc and that's all of our faults,0,3
QUANTO AS PROVAS https:// twitter.com/Viniciu7607864 1/status/899058018112778242 …,0,1
I voted for Karla Estrada as Celebrity Family of the Year #FamilyGoals . Your turn! #PushAwardsKathNiels (2),0,0
os migao vai pedi as cueca emprestada daqui uns dia,1,1
seeing seniors as a kid I thought they looked so old and grown like adults so PLEASE explain 2 me why we still all look like 6th graders,2432,9227
Retweet this if there's no amount of money that could get you to ruin your life by dressing up as a Nazi in front of thousands of cameras. https:// twitter.com/billpowers9/st atus/898851553087324161 …,19638,24960
The saying as you were comes from a city fan,0,0
As vezes penso se é só grosseria ou falta de educação mesmo...,0,0
imagine if white people fought against racism as hard as they fight for that boring song and that ugly flag https:// twitter.com/jaci_lane_/sta tus/898161203477975040 …,37658,85349
Retweet this if there's no amount of money that could get you to ruin your life by dressing up as a Nazi in front of thousands of cameras. https:// twitter.com/billpowers9/st atus/898851553087324161 …,19638,24960
A REAL president would applaud the peaceful thousands standing up to bigotry today. Instead he sees them as a personal insult. Disgraceful. https:// twitter.com/realdonaldtrum p/status/898988632551370753 …,1137,3181
[★TRENDING] ToppDogg’s Hansol Comes Out As Asexual In Live Broadcast ➜ Read more: http:// aegyo.me/5LFy,380,1344
single is as single does.,52,32
This gone be me as a parent LMFAOOOOOOOOO pic.twitter.com/VS42iQyUNv,67395,98580
Will the media show this form of hatred as well? We conservatives denounce Naziism KKK and racism. Does the left denounce Antifa? pic.twitter.com/lVFd1ELpxD,4788,7025
...back row as poor innocent put upon people. I was one of the artsy goth type kids. We were just as likely to get hassled by the...,0,1
Amanhã as manchetes serão: "Tite dê uma chance pro garoto".,1,8
19 is looking sharp as well.,0,0
Cathay Williams: born a slave she dressed as a man so she could serve in the US Army during the Civil War. There's your new statue. pic.twitter.com/7MlHlW5brB,64938,174616
No baby. If you prefer we could keep the bookshop as it is and turn the other broperty into a coffee shop like we talked about.,0,0
cuando mis amigos ( as ) empiezan a ver una serie que yo les recomendé y se creen mas fans que yo https:// twitter.com/IrvinLozano_/s tatus/896966283639615489 …,2139,1568
as soon as we do y'all fuck it up lol https:// twitter.com/papio_teeez/st atus/895123667021070337 …,4740,10755
I can check as soon as I find my copy of the farmer's almanac.,0,1
¡ @falcao ha marcado 7 goles en sus últimos 5 partidos dentro de la @Ligue1_ESP ! pic.twitter.com/u3eJE6wRZW,35,206
Can't stand when people downgrade state schools. I get a good education and I have as much fun but for a cheaper price,2,20
Man I'm baked as fuck. I don't know if the weather plays a part in all this.,0,1
when im jumping to conclusions so i ask my friend for advice but they're just as crazy pic.twitter.com/U0fZjJKLgF,1175,2491
@MsAnaMatronic Patrick Cowley?? Really?? Cannot believe my ears @BBCRadio2 #R2DD Loving tonight as ever vogueing in Blackpool Kenny x,0,0
Já passou da hora de aprender Que o corpo é nosso nossas regras nosso direito de ser Respeita as mina EMILLY NA GLAMOUR & GQ,31,9
I voted for Daniel Padilla as Push Male Celebrity. Your turn! Vote for the Push Awards 2017 now! http:// pushawards.abs-cbn.com/push-personali ty-awards …,0,0
Check out the extended #talkinghardwick with the talented @JaimieAlexander as a @nerdist podcast! https:// twitter.com/nerdist/status /898926614532182016 …,28,157
Maybe because she thinks that as a preacher her penchant for raping children would be tolerated! #PedoGate #PizzaGate #CatholicChurch https:// twitter.com/FoxNews/status /895621668416102403 …,1,1
This is Imani from CT. She just escorted Trump supporters through a crowd as a situation escalated. Here's why in her words: pic.twitter.com/R8W7XN58jk,37425,112592
Because you hit him with several links of truth. As well as putting him in his place.,0,0
Que partida MONSTRUOSA do @LucasPaqueta97 . Acreditando em todas as jogadas até o final raça pura! E já deu uma assistência...,1527,4359
Aqui está a foto do Fair-Play que dá cara ao respeito de ambas as equipas dentro e fora das 4 linhas. Um exemplo de desportivismo a seguir. pic.twitter.com/YXMkNNqu97,421,1350
For every drink the bar sells the DJ gets a shot as well it appears... #weddingday #wedding #drunkdj #amazing,0,0
Retired astronaut Cady Coleman hopes #Eclipse2017 brings us together as a crew of Spaceship Earth: http:// cnn.com/eclipse Content by Volvo pic.twitter.com/67EhpFz46z,126,320
will make another vlog as sort of an update to what is coming later tonight hopefully the audio actually fucking works this time,0,0
