
Nvm the vid was 14 min long as I remember and now it's only 8 min long,0,0
Que partida MONSTRUOSA do @LucasPaqueta97 . Acreditando em todas as jogadas até o final raça pura! E já deu uma assistência...,1527,4359
Tenham uma amiga igual a minha que vai para um rodízio e manda as fotos das pizzas que ela pega.,0,0
Life is good as fuck rn and it's only gonna get better.,54,38
qqln en qui tu as totalement confiance — arsène https:// curiouscat.me/alicedbrge/pos t/177636440?t=1503187193 …,0,0
This gone be me as a parent LMFAOOOOOOOOO pic.twitter.com/VS42iQyUNv,67395,98580
Lmao people just don't think in general and we all guilty as shit.,1,2
Oh yes ma'am she did! Read up on her. Eddie wasn't the first married man she slept with. She did (or tried to) with Jon Bon Jovi as well.,0,2
$ PSRU filing for 1st avail court date as urgent issue.TA getting served next week.Fake CEO AWOL!No prob.Nothing a bench warrant can't cure!,6,8
Make the best of what you have improvise! Hey as long as we have a roof over heads in our tiny room we all good! Life is great! 13,29,40
One day we're gonna talk about how the media is always portraying black women as angry and white women as innocent and docile. https:// twitter.com/daily_star/sta tus/898554330051170305 …,47153,106209
A classic technique of right wing propagandists is to portray dissenters on the left as being a cop killers please don't buy it.,111,273
The most amazing part of this story to me anyway is that Jamaal Tinsley was still in the NBA as of 2014. Who knew? http:// indy.st/2xcl1wC,3,21
Retweet this if there's no amount of money that could get you to ruin your life by dressing up as a Nazi in front of thousands of cameras. https:// twitter.com/billpowers9/st atus/898851553087324161 …,19638,24960
I fucking HATE people like this. A college is a college . A car is a car. A job is a job. As long as ur working toward ur shit n grindin https:// twitter.com/brianaaacantu/ status/898327706437165056 …,41619,88035
State funeral for German-born Ruth Pfau widely known as #Pakistan 's Mother Teresa who fought leprosy pic.twitter.com/IPrWM9Y9ve,225,967
I fucking HATE people like this. A college is a college . A car is a car. A job is a job. As long as ur working toward ur shit n grindin https:// twitter.com/brianaaacantu/ status/898327706437165056 …,41619,88035
@RealAlexJones @amtvmedia Possible FBI embedding themselves as Nazis in the AltRight https:// twitter.com/RickyVaughn_II /status/898717191255670785 …,0,0
@ShepherdRamsFB made my nephew Jason Bednarski's dream come true when they signed him as their first ever #TeamIMPACT player today! pic.twitter.com/zHfvO9teAT,26,44
BLM doesn't speak for me or for black America. As a black conservative male I DENOUNCE BLM,322,680
A FABULOUS session the other night with this sweet senior. So happy to have her as a 2018 Mystic Garden Spokesmodel! Love all her pictures pic.twitter.com/tbBEyH9R5T,2,8
Trump's 6 worst week as president are just so startlingly bad http://www. cnn.com/2017/08/18/pol itics/trump-worst-weeks/index.html …,37,110
As in heel spurs that prevented Trump from serving?,0,0
I haven't even started the Defenders yet and I'm already back in the hole as well -shrugs-,0,1
as you're a big Niall fan I suggest you rewatch the basketball vid,21446,44139
LIVE ACTION TANGLED - JEN AS RAPUNZEL COLIN AS FLYNN https:// twitter.com/captainswantla /status/899056970983919616 …,14,26
as vezes a gente só precisa de um cafuné e uma vitória do são paulo amanhã pra tudo ficar bem...,0,0
impossível eu ouvir uma música e não tuitar as partes q eu gosto,0,0
Well now.. Obama was not able to Take down the statues to the Civil-War but President Trump sure as hell was. Another Legacy for #TrumpTrain https:// twitter.com/mike4354/statu s/899057799665156096 …,0,1
Eu já me estou a lixar para as merdas que inventam agr mais que ncc sei que são poucos os que posso confiar,2,2
@unKayTrain_able just as u did excellent in the world cup. Boston was just as great in the way they handled the peaceful protests today.,0,0
Respeita as mulher ou pega suas coisas e some já que uma que me paril e ainda me ensinou a ser homem...,0,0
Serena was speaking about how people perceive her as being meaner because she’s black and y’all chose these pictures and proved her point. https:// twitter.com/daily_star/sta tus/898554330051170305 …,22780,49296
“Parents Google “Is my daughter overweight?” roughly twice as frequently as they Google “Is my son overweight?”” https:// gu.com/p/6nc3v/stw,0,0
T' as vu defenders ??,0,0
Dak to Dez! Might as well get used to seeing this! #ThrowUpTheX #CowboysNation pic.twitter.com/tRQrjKeidu,280,430
I haven't ever given it much thought! Ned Stark worked as most disturbing but Boromir was definitely the most tragic.,0,1
"Think of mercy as the currency of the kingdom." — @JMichaelGatlin1 #duluthvineyard,0,2
imagine if white people fought against racism as hard as they fight for that boring song and that ugly flag https:// twitter.com/jaci_lane_/sta tus/898161203477975040 …,37658,85349
My fave donghyuck era is definitely We Young!! He just looks so precious and happy Congrats on 600 followers as well you deserve it!,0,2
This lady just said she have a bean sprout as long as it's gluten free,0,0
#SURPRISE_SORIBADABTS Hashtag doesn't count as vote. Vote @BTS_twt on Soribada on PC / app. How to vote? Visit @SoribadaArchive,823,912
So fucked up that he wants to define a peaceful rally as anti police. He wants more hate. He puts police and protesters in danger. Evil. https:// twitter.com/realdonaldtrum p/status/898988632551370753 …,1385,6632
you and @taylorson will forever be the best space twins in any galaxy. Thank you so so much. Feeling bittersweet as all hell today. pic.twitter.com/hvDZHDJtvg,8,57
Kang motherfucking Kyungwon looks great as fuck my baby did that pic.twitter.com/KYOPPJcnFF,4,7
"Our country will soon come together as one!"...since it was YOU who divided the country I assume this means you're stepping down,0,5
Have you suffered an #injury in the last 3 years as a result of tripping on an uneven pavement? You may be entitled to #compensation . pic.twitter.com/yW1WKPflQd,1,1
she actually said "black people have to be twice as good especially women. I'm perfectly OK with having to be twice as good." https:// twitter.com/Daily_Star/sta tus/898554330051170305 …,37160,85893
Like in not saluting racists as a kid and later unconsciously you take in much more than u imagine joyjoy,0,0
imagine if white people fought against racism as hard as they fight for that boring song and that ugly flag https:// twitter.com/jaci_lane_/sta tus/898161203477975040 …,37658,85349
Só as melhores do jem,0,2
Stand with Atlanta live as they get ready to March to Martin Luther King's Church in Atlanta https://www. pscp.tv/w/bGdmFTFlV0t5 YmtuckRqQWd8MVlwS2ttQUxtckVKauvgmTCrsVDubHiXdULQtQ85BHPuntvtYNB_mbpCHRK- …,912,1676
เอาจริง ตอนแรกคิดว่าท่อน "Blackpink in your area" ในเพลง as if it's your last คือเสียงเจนนี่ แต่จริงๆคือเสียงลิซ่า,8063,849
faut vriment pas connaitre le foot pr parler comme ça. Ce sont d pros j'aurai d'ailleurs à dire l'inverse.,0,0
Tell Letterman trump was only the first wave. More imbound in 2018 as the economy is getting ready to take off.,0,1
Confesso que bate um pouco de tristeza quando minha mãe fala que vai ao mercado pq eu vou ter que subir com todas as compras.,0,0
As a dawg fan even I have to say how ridiculous that is https:// twitter.com/ugafootballliv e/status/894419099748618242 …,0,0
If the @dallascowboys have to go with 1-2 punch of #McFadden and #Morris . Production drop off might be a great as people think @CBSDFW,0,0
internet semi-wokes framing Boston popo commish as a resister bc he sorta disputed Trump tweet: his police came at protesters in riot gear,2,11
I'm being used?? Okay sure all I'm doing is calling things as I see them no communist here,0,0
imagine if white people fought against racism as hard as they fight for that boring song and that ugly flag https:// twitter.com/jaci_lane_/sta tus/898161203477975040 …,37658,85349
permit holders were Nazis and alt-right using "free speech" as a pretext. US citizens of good conscience showed up and coopted the rally.,0,2
That's a shame. Still looking great as always,0,0
Something for us to be reminded of and settle with. As Christians let's make this our most important habit... http:// fb.me/1zc8s1SoO,0,0
Yo @BaronCorbinWWE take a lesson from @WWENeville in looking for angry after a loss you looked as sad as your tummy #NXTTakeOverBrooklynIII,0,0
Bannon will be so effective at Breitbart it's almost as if THIS was Trump's plan all along... #StrategicMind,1095,2532
‘I’d like to know why I was cast as a murdering psychopath’ - #JamieDornan #TheFall [Interview: http://www. independent.co.uk/arts-entertain ment/films/jamie-dornan-interview-id-like-to-know-why-i-was-cast-as-a-murdering-psychopath-gillian-anderson-the-a7323221.html … ] pic.twitter.com/9tIRWCRx5p,14,53
Next up: Work I've always held strong beliefs that work and jobs as we know it are messed up. Few benefit most (workers) are left in,0,0
One day we're gonna talk about how the media is always portraying black women as angry and white women as innocent and docile. https:// twitter.com/daily_star/sta tus/898554330051170305 …,47153,106209
#Beta segue e ajuda Beta e pede PAZ. Repasse adiante pois os homens esquecem de amar a Deus sobre todas as coisas e ao próximo como a si.,3,4
YOU MAY BE ASTONISHED AS WELL! pic.twitter.com/bIKEdAxuPV,0,0
Donald Trump you as an entrepreneur should know better! Don't be used as a corporate guard. Encourage innovation and provide the resources.,0,0
You sure as hell won't see any tears on the left.,0,2
...mostrando seu dom... ohhh olha as novinha dançando em cima do somm... kkkkkk vizinhança tocando kkkk,0,0
Vcs só tão quotando as musicas que eu falei mal as que eu falei bem não só pra ter briga né seus caralhos de merda pic.twitter.com/3wJoyWeXLt,0,0
Hey #BlackTwitter this cop punched a pregnant woman in the back of her head as hard as he could. Help me get him fired! https:// twitter.com/brotherbenx/st atus/897867880594853888 …,40796,28472
Reminder: Your positivity should be a beam of light. People will rip you down & feed off you as a source. You are a guide not a savior.,0,2
Yo these little kids are stressful as shit,0,0
It had one of those riddle hint puzzles in the manual as well.,0,0
as vezes eu faço umas coisa que na hora parece legal mas ai dps eu fico me achando uma pessoa completamente idiota ???????????????????????,740,1065
He supported the same idea as the FBI. It's hackable and he warned of it. If you read the article you'd see thst,0,0
Hate crimes have doubled in the US as a direct result of your 'leadership'.,0,0
This is Imani from CT. She just escorted Trump supporters through a crowd as a situation escalated. Here's why in her words: pic.twitter.com/R8W7XN58jk,37425,112592
Kkkkkk estamos aqui apenas denunciando os males e verdades do amor e estendendo nosso poder as estrelas,0,0
Can you send me one as a gift? :'),0,0
We have Voldemort as our Governor. I couldn't be prouder. #Florida https:// twitter.com/JohnFugelsang/ status/898271791650615296 …,0,0
Jairus Brents materializes in the backfield as Waggner pulls off a goal line stand. pic.twitter.com/rMpag0E1rR,2,2
Eu defendo as pessoas que gosto até à morte dou o corpo ás balas se for preciso mas não me desiludam nem me magoem,3176,896
Fave season 6 scene was Emma's song as well as filming the #captainswan wedding @jenmorrisonlive #OUATSF,142,193
but labeling nazis as nazis is right isn't it?,0,0
This gone be me as a parent LMFAOOOOOOOOO pic.twitter.com/VS42iQyUNv,67395,98580
@lmjaguarrs me dá meu block querida já que todas as camilizers tem tá faltando o meu kkk,0,0
Im an exol and an Army so today as an exol I apologize for those who have created problems to ARMYS #Please_Apologize,451,1118
Will the media show this form of hatred as well? We conservatives denounce Naziism KKK and racism. Does the left denounce Antifa? pic.twitter.com/lVFd1ELpxD,4788,7025
as vezes eu me olho no espelho e penso GOSTOSA DO CARALHO,0,0
Não sei mano tenho que ir trocar as calças dela e comprar uma t shirt,0,1
#SebastianGorka is as authentic as a degree from #TrumpU & as good for America as an ebola outbreak. https:// amp.cnn.com/cnn/2017/08/18 /politics/gorka-credentials/index.html …,2,9
❝Well I still can do it.~❞ She let out a soft giggle before reaching out for a slice as well.,0,0
But they're also Muslims out there who don't care about you being a ex Muslim or gay (me as an example and many,0,0
#amwriting : I misspelt 'demographic' as 'demongraphic'. For some reason I found that funny #phd #phdchat pic.twitter.com/CKZysnDNNa,0,6
Ever had dreams so good your mad as hell when you wake up and realize they weren't real?,1,4
WHEN YOU TRY TO LIKE A TWEET BUT ACCIDENTALLY LIKE A TWEET IN REPLY TO ANOTHER TWEET RIGHT AS IT POPPED UP ON UR TL AND U PANIC,0,0
As vezes https:// twitter.com/Surveys4You/st atus/899049079757578240 …,0,0
Hate is a 4letter word & white color doesn't consent one2use this as its political weapon4white supremacy. VR all equal no matter Wut color. pic.twitter.com/abTSUjQuWE,0,0
Hardly. I'm using my voice just as you are using yours. You may speak louder but you aren't denying me my #FirstAmendment rights doing so,0,0
As meninas me chamando pra ir pra pagode gente eu não quero sair por mim eu ficaria dentro de casa com meu amor vendo filme agarrada,0,0
#sunset as we close in on the Tennessee state line after 9 hours on the road already. #roadtrip #eclipsetrip pic.twitter.com/OtvLx6YiEK,0,5
三┏( ^o^)┛ｲﾔｯﾎｫｫｫｫｫｫｨ,0,0
Thug Kitchen Promises Its One-Pot Indian Dish Is Fast as F*ck http:// bit.ly/2vNNLO6 #music #movies #celebrity #artists #internet,0,0
Nossa aonde eu estive esse tempo todo que não vi as pessoas ficando grisalhas?!...,0,0
SCREAM ADELE LYRICS AS LOUD AS YOU CAN #SaturdaysAtRachels,0,0
I voted for Kathryn Bernardo as Push Female Celebrity. Your turn! Vote for the Push Awards 2017 now! http:// pushawards.abs-cbn.com/push-personali ty-awards …,0,0
Seen yo pretty face soon as you came in the door,0,0
I think it means the same thing as when Spanish people say "tu fucky fucky",0,0
Again as though we are in his reality show!,0,0
Eu tinha perdido as esperanças no Paqueta mas hj a estrela brilhou,0,0
No argument to this - trends such as RE prices growing in 7-9 years cycles are highly predictable. On the other side there's stock market.,0,0
Esse sábado tá tão bom quanto as segundas,0,2
I will miss him terribly as well but I think he was promoted to a detective so he will not be a patrol trooper anymore.,0,3
As Bruce (RIP) would have said...... Didn't they do well! @DSPinkFloyd,0,1
Historical Fact And can not be argued as anything else. https:// twitter.com/kekistani_free /status/899057093692588032 …,0,2
Vou pra Antonieta sozinho... as aventuras do garoto sem amigo,0,11
Aprendemos com as séries q tudo fica melhor com cachaça e drogas,0,0
Me: what are you thinking? Joey: do you really want to know?Me: yes... Joey: we have 90 percent of the same DNA as a banana Lmao what?,0,1
The guys need you support more than ever now as they fight their war through the losers bracket!,1,6
porém tenho marcadores e cartões de todas as edições novas de livros é é isso que importa,0,0
Ele também soube reparar os erros durante o jogo com as substituições certas Rueda é foda e espero que ele não nos decepcione https:// twitter.com/vinnycrf_/stat us/899057121576312832 …,0,0
im srsly dying bc i always see him as cute especially after pd101 idk this is so wild im dead,0,0
What murty who got beat at Dundee but it's ok as we drew 1-1 at piggery tell me ur drunk,0,2
Lions with 3 3-and-outs 2 near takeaways & 2 sacks in their first 3 defensive possessions. Jets are as bad as advertised.,3,25
1 Chicago News Search Businesses (Baez Quintana Happ and bullpen star as Cubs hold on for 4-3 win) 1 ... - http:// 1chicago.org/baez-quintana- happ-and-bullpen-star-as-cubs-hold-on-for-4-3-win/ …,0,0
as soon as I see C N N I know its going to be FAKE news https:// twitter.com/JrcheneyJohn/s tatus/899028398189805572 …,0,0
#مؤسسة_العمار_لتسويق_التمور . . . . القصيم الاحساء المدينه المنوره . . . يارب توفيقك,0,0
As we get older we also forget our parents are getting older.,0,1
It usually takes a dense person to recognize another dense person. Welcome to the dense club. I nominate you as the president of the club.,0,0
BIG TURNOUT NO CLASH Huge counterprotest as 'free speech' rally ends https:// goo.gl/fb/qmrtQt #IHateTimWaterman,0,0
Steve Bannon is out as Trump's chief strategist https:// goo.gl/fb/U6jezb,0,0
and tell him thanks because now I have a friend who likes him as much as me.,0,1
How far? I'd prefer as close to the airport,0,0
AS Janji Angkat Kaki dari Suriah Setelah Kalahkan ISIS http:// rol.co.id/r/ouyink382,3,7
ai meninas querendo mostrar esses teaser do bts pra minha mae mas aposto q ela vai fica xingando as menina,0,0
With all due respect my mentor victims and their families in Barcelona are equally important as victims and their families in Sierra Leone.,0,0
i accept my fate as "this one person that draws phila/emmeryn",0,5
How traveling changes as a #travelblogger - http:// http:// wanderwithjo.com/10-ways-in-whi ch-traveling-changes-for-a-travel-blogger … #ttot Do you agree? pic.twitter.com/97uKQm3ysx,3,4
A falácia da liberdade sexual e as políticas do orgasmo tomaram conta do movimento destruindo completamente seu significado político mesmo. https:// twitter.com/lexiegreyws/st atus/899050378511228928 …,9,25
Sometimes your best isn't good enough for the next. As long as you know you did your BEST! That's all that matters,0,0
I voted for Julia Montes as Push Female TV Performance of the Year. Your turn! Vote for the Push Awards 2017 now! http:// pushawards.abs-cbn.com/push-performan ce-awards …,0,1
I keep restarting it every time I play it. Need to finish as well,0,0
Rich Brennan's voice will always live on in clip packages as the voice of the first #NXTakeOverBrooklyn .,0,0
Skater Andy Roy's prison-style sweet-and-sour pork is as gross as it sounds http://www. networka.com/stories/31263/ skater-andy-roy-makes-prison-style-pork-on-on-munchies … via @networka,0,0
Why does an hour nap always end up as 4/5 hours,0,0
~ look Marcus had as a child and teen. "If my aunt worried more about you instead of your older brother we wouldn't be having this talk.,0,0
frr t' as fai 20K avec un tweet tout pété jcompren pas lalgorythme,0,0
James 2:9 "But if you show partiality you are committing sin and are convicted by the law as transgressors" https:// twitter.com/jewelyteresa/s tatus/898628476697063424 …,0,0
2k better add hoodie Melo and rappers like Dave East as a package if the legend edition $100,0,2
I recently heard a certain President talk a lot about "both sides." He made as much sense as you do now which is...none.,0,0
I added a video to a @YouTube playlist http:// youtu.be/aBWOtZL_dug?a Your Favorite Shameful Flavors As Chips!,0,0
lane refers to his poops as "juice poops" & "together poops" there is no in between,0,2
Aquele futebolzinho as 22h aah :),0,0
No me gustó cómo te hablo pero me encantó tu forma de responderle,0,0
i fell into a tumblr hole and now I want to start a 3rd play through of DA2. because i need to romance Fenris as a mage i guess?,1,3
i love when they never interact but there's an amv on youtube featuring a promiscuous song acting as if they did meet but they never did,0,1
As ya do,0,0
JB comming out as bi would be awesome! Bi's will rule the world again.,0,0
Los primeros 15 partidos que no marco no se dice tanto supongo.,0,0
Me as vecina https:// twitter.com/roferoz/status /898880698529886212 …,0,1
Eu vi uma foto do meu irmão fazendo agachamento com 120 kilos só de ver as pernas ja bambeiam,0,1
I know this is like 3 years late but I read this as "this hoose is muge". Just wanted you to know. @Calum5SOS,0,0
She's as sweet as Tupelo Honey,0,0
Haven't got the foggiest. I might be able to help if you bought your stepson a tee-shirt with critters on the front as I know a few,0,0
que nem o unbroken com run em quase todas as músicas,0,1
Além de tds os problemas o que me irrita é a Brennan ceder às hipocrisias e conservadorismos do Booth,0,0
As a longtime Gangsta fan this happens a lot usually it's from shitty new readers who think Kohske is "just too lazy" which is disgusting,1,3
Os safados e ladrões políticos querem saquear o Brasil em mais R$36 bilhões...Para as ruas dia 27/08. #FundoEleitoralNao pic.twitter.com/dySBn8yWXp,12,11
17連ってしょぼくない？10連1と単発7ってことだよね？？？端数の7切り上げて20にしてやれよwwただでさえ無課金頭ゆるゆるキッズしかいないんだからさwwww,0,0
Adoro aprender as coisas com a Erika kkkkkkkk melhor professora kkkkkk,0,1
Quem sabe assim as pessoas parem de opinar na minha vida,0,0
IM IN THE SAME CITY AS TAEYONG,0,4
Yeah hope he's not deeply hurt and pass it as a joke.,0,1
Forgive errors as you were forgiven for 2012 mistakes - Atuguba Forgive errors as you were forgiven for 2012 mista http://www. ajeteys.com/forgive-errors -forgiven-2012-mistakes-atuguba/?utm_source=ReviveOldPost&utm_medium=social&utm_campaign=ReviveOldPost …,0,0
Matthew Hooton I don't like your appearing on MSM as a 'political commentator' when IMO you're a mercenary paid mouthpiece - a PR shill.,1,2
To com muita vontade de bloquear uma pessoa mas não consigo as vezes queria ser mais fria pq não tá dando,0,0
for a whole like 2 weeks around my birthday i use my bday as an excuse to treat myself to anything& everything i want& that never ends well,0,15
imagine being as great as why don't we I mean you never will be but just imagine,4,14
As porseleni as as as https:// twitter.com/cnnturkrenk/st atus/898884295237840896 …,0,3
Twitter has really been most helpful & sane introduction for me. I wouldn't have felt nearly as comfortable before I found this,0,3
what's up everyone it's Aleks better known as immortalhmeme,0,0
How is Nate Newton working as sideline reporter for Cowboys local tv? Didn't he get busted with a trunk full of weed a decade or so ago?,0,0
Deciue what you want and then act as uf it were impossible to fail - briantracy,0,0
all i remember about this book is it mentioning that the women's clothes were see-through and i was Very Into That as a ten year old.,0,0
Well this is it my friends. Enjoy #NXTTakeOver . Wish me the best tomorrow night as I prepare to livetweet #SummerSlam & make my moment.,1,7
Nunca mexa no que tá queto Às vezes você pode se machucar lembrar do passado quanto já sofreu,0,0
77% of US consumers whv have liked a brand on Facebook say they have saved money as a result. (Source: Lab 42),0,0
palhaçada as meninas não me responderem,0,2
Não aguento mais ... já tou fartinha de segurar as merdas das lágrimas,0,0
now all the mainstream news + politicians are like 'take down these statues! go home kkk! fuck mt. rushmore!' ummmmmm yes.. as we've said..,0,0
Noite especial aqui no Alliance Mind... baile dos casais... vejam as fotos na "história"! em… https://www. instagram.com/p/BX_qPkbnxGy/,0,0
Mike Cernovich tweeted that Trump supporters are going to show up dressed as Antifa,1,1
Nova adição às Mais queridas: The Smiths / Girlfriend In A Coma (2008 Remastered Version) http://www. deezer.com/track/5093623 @DeezerBrasil,0,0
Nova adição às Mais queridas: Aerosmith / Dream On http://www. deezer.com/track/68414397 @DeezerBrasil,0,0
soonyoung's resting and that's good to hear... scream as loud as you all can to energize them and make them happier...,0,0
Atlas Air Boeing 767 36NER (N661GT #A8B898 ) as U.S. Transportation Command flight #CMB346 OTT south east of #EDDC,0,0
Her flag is wonky as shit she doesn't give a shit about America https:// twitter.com/dyslexeic/stat us/899050164886937601 …,1,4
Posting results from #NXTTakeOverBrooklynIII as they happen,0,0
Amo suas dicas que você dá pro meu cabelo as massa... — Aaaah que bom https:// curiouscat.me/Martitarasta/p ost/195660276?t=1503187179 …,0,0
れいたんラブ,0,1
People assume as a NASCAR fan the one race I wanna see is Daytona 500. They are wrong if I could go to any it would be Bristol!!,1,2
"I suppose so. It's been surprisingly quiet as of late.",0,0
Still don't get it. And spewing falsehoods as usual.,1,2
#ءAnd it hurts me as hell That You can pass the day without me easily ..,0,1
As a healthcare advocate this is no surprise. People do not care about families access to healthcare or even nutritition.,0,1
Lol he said "unless there's evidence I would take it as BS" So where is his proof that banks hit her? Or proof Banks kissed someone else?,0,2
As vezes o indivíduo está louco nas drogas. http:// fb.me/6ZTYJeZax,0,0
Totally agree + he was this baron on talking smack. I wish they'd just let him be him as he'd do so much better but so would many others,0,0
残念、はずれです！ 明日もチャレンジしてください(^^) pic.twitter.com/xnQg5XvN3v,0,0
She spun around still leaning against the counter as he walked over to where she was standing. Though the female shuffled to –,0,0
Liar as unot to read anything written by u,0,0
FUGIR AGORAAA BASTA ME DAR AS MAOS VOCE TEM QUE CONFIAR NOS VAMOS TER QUE FUGIR AGORAAA FUGIR AGORAAAAAA,0,0
As cenas acabam por males entendidos enfim,0,1
When they come w/ torches shouting Nazi slogans ARMED with guns posing as National Guard there's nothing "free" about it. Hate speech.,0,0
" As soon as you fall in love with somebody they fucking die." How Bailey feels ab Grey's,2,3
