
They're chicken shits hiding behind masks. Vile as the organizations they are protesting.,0,0
Variety Stream As Always: http:// youtu.be/AFLX_89hvrs?a via @YouTube,0,0
Hey u sound great might as well do it both on @brealtv (Facebook and Twitter Account) U never know big dawg,2,0
as we draw near to God He draws us near to Him.,0,0
O clubismo doentio está acabando com o futebol antes de torcer as pessoas tem que ter bom senso!,0,0
É bue satisfatório ver as pessoas perderem perante os meus argumentos,0,0
I just loved the hustle as a young kid he made me a fan of baseball. Won't argue the spending but jeter made me a fan.,0,1
Is there any one so wise as to learn by the experience of others? - Voltaire #quote,0,0
Thanks Be To God for doing as He said. :-) http:// fb.me/vHj2W9nF,0,0
depois de tanto tempo eu consigo ver as melhores coisas/pessoas dentro do meu lar,2,2
My friend when you've come to the end of yourself join us as we look to this #PurpleDoritos . It will not fail you.,0,0
Estamos falando das condições de trabalho iguais as do negros se vc desconhece estude antes de opinar. Isso gerou até prob. diplomaticos,0,0
I honestly view not taking shoes off after you see the owner of the house take their shoes off as super disrespectful. It's just rude,2,20
You heard @KEEMSTAR #retweet this motherfucker also met this dude a couple years back he's not as bad as people have made him out to be https:// twitter.com/keemstar/statu s/899056364022108160 …,0,1
Yep it was an article by Dave Barry over 35 years ago intended as satire: https:// gentrystyle.files.wordpress.com/2013/08/ap-201 3-08-26-dave-barry-how-to-argue-effectively-satire.pdf …,0,1
I have a lot of favorites as well however I must say that I agree with you Season 14 has been incredible,0,2
Having beers black as my soul. Party on people. #MonksHouseOfAleRepute #SiouxFalls #CraftBrewery #BuyLocal #ontheroadwithJasmineCain pic.twitter.com/AVbbRAvFdF,16,104
Aaaaaaaa your friend looks so nice as Semi!!! pls let her know she's amazing!,0,1
Todo mundo tem um pessoa aquela pessoa que te faz esquecer todas as outras,1,3
And it's going to be funny as hell when he stays in school.,0,0
We regret to inform you all that something happened with our website and it has been removed we are working as fast as possible to remake!,0,1
em espanhol as coisas fica tudo mais engraçadas,0,0
CERTIFICATE OF APPRECIATION presented to @insxrt - Reezhel as an excelent wedding organizer crew pic.twitter.com/AadASaV97z,0,1
Except for Gorka Miller and until recently Bannon. I'd say being in the White House counts as having power.,1,16
As Turnbull looks for ways to make Australia safer I wonder if he has considered that maybe if we stop bombing innocent people may help.,6,4
Lembram quando o John dava as caras no periscope quase toda madrugada? Cantava tocava interagia mostrava o Moose... SDDS,2,7
@MrDtAFC you say United had a nice easy start yet you played Stoke and Leicester they're just as good as West Ham and Swansea,0,0
Desculpa precisava desabafar hahahahhaha as ultimas vezes q fui lá me arrependi demais,0,0
I voted for KathNiel as Push Group/ Tandem. Your turn! Vote for the Push Awards 2017 now! http:// pushawards.abs-cbn.com/push-personali ty-awards?uid=d98e892a8316919f7daa99617f7a0937 … #PushAwardsKathNiels,1,1
http:// ift.tt/2wsqS3M ☜[check Amazon] Excellent study resource. These books are time sensitive get the right edition. As a license exam… pic.twitter.com/J7R8FtktVo,0,0
When is this from? Was it as great as it looks?,0,0
quel homme !!! T' as embelli ma TL par ton amour pour le Real,0,0
iiiih as algemas vão se abrir....,0,0
Want some Bama callers for the podcast to week to get this shit talking going. FSU getting more and more humble as the game approaches,10,49
Às vezes bate aquela vontade né @_SnowExpress pic.twitter.com/j5QtqnPWn3,0,1
As usual George you turn passion into poetry on the canvas of North East fandom. Such a different to the usual banal reportage of #NUFC,0,0
O pessoal me largou pra trás pra levar as bolsas pra festa ta difícil,0,0
#jttxzara #7 Sunday morning selfie with my favorite Jamu Tun Teja & sunrise. I am as bright as … https://www. instagram.com/p/BX_qPC_gL-c/,0,0
I honestly view these antifa/ww2 memes as a giant pr coup for the broader left the kind that only wildly incompetent evildoers can give,0,1
Coming back as we are,0,0
donne des choses que tu as appris grâce à Scarp — Que je pouvais supporter les blagues de culs toute ... https:// curiouscat.me/4341555742/pos t/195539729?t=1503187175 …,0,1
#GoWithPringlesEntry My beautiful grand daughter is enjoying her Pringles as much as the lake! What Summer fun pic.twitter.com/iE2qz990xa,0,1
I liked a @YouTube video http:// youtu.be/aBWOtZL_dug?a Your Favorite Shameful Flavors As Chips!,0,0
HONESTLY and he was always the victim whenever he fucked up. t r a s h,0,0
Fourth consecutive win for @ClubAmerica as they defeat @LobosBuapMX 2-3 William Darwin Oribe #LigaMxEng pic.twitter.com/QwZ2L5ntBD,1,2
são pequenos os detalhes que fazem eu querer me matar as vezes,0,0
Cheguei agora a casa estou bue cansada e amanhã ainda vou acordar às 7am para ir correr...,0,0
I miss when the boys were abt to drop a album and the songs would leak before that and they would act as if nothing happened. It was so fun. pic.twitter.com/fMwlWNzWUC,21,77
'White Supremacy March" rally fizzles as thousands of counterprotesters swarm Boston https:// usat.ly/2xdzvfu via @USATODAY,0,0
after my initial round of screeching i'm really not as excited as i thought i was over javelin,0,0
overly happy. Clinging onto you as we got our bags and left the airport.},0,0
Not as turnt as when Bueno Mars was in town but still fun (@Eagle Street Grille - @eaglestreetstp ) https://www. swarmapp.com/c/6bYFKSaIcsk,0,0
Libs FURIOUS After Brutal List Of Obama’s “Accomplishments” As First Bla... https://www. youtube.com/watch?v=G7hEZ7 0Xz24&feature=share …,0,0
Saudade de quando eu não complicava as coisas.,1,0
É sempre interessante observar como as pessoas assumem coisas que não foram ditas. Então por favor: o que você acha que eu queria dizer?,0,0
I miss U terribly as well :(,0,0
Pete Wargent Daily Blog: Jobs market: not as slack as you think http:// petewargent.blogspot.com/2017/08/jobs-m arket-not-as-slack-as-you-think.html?spref=tw …,0,1
#NowPlaying As You Turn Away by Lady Antebellum ♫ http:// spoti.fi/2vcp7n2,0,0
An ex-friend is like that. Funny helpful and so on but as soon as he feels safe to say it he'll start talking shit about immigrants.,0,2
que sensação de felicidade dá quando tu pinta as unhas,1,2
Glad to have @nygmavictor @Kruzt_ @syntomne as the first 3 pick ups to the Synergy Sniping team welcome boys,1,16
Depois de trampar das 7 as 22. Eu só quero minha cama,0,3
O que deve pautar as relações sociais? A ciência é universal a religião não. Pensemos.,0,0
Esse filme " As branquelas" malaaa.,1,1
As 22:30 hrs no horário de Brasilia.,0,1
Challenge yourself as a Bowmaster! Try a new game with your friend! Join us! https:// itunes.apple.com/app/id11184316 95 …,1,0
Looking as round as a watermelon  looks good in pictures but a… https://www. instagram.com/p/BX_qOzTl5DsU SZoEnAcjvSuHPlsbOI-JSldKTI0/ …,0,0
You was ahaha talvez nao tenhas ouvido - also I played a lot of Mansionz and ZHU (especially " As Crazy As It Is" by Zhu),0,1
4 pessoas que dirigi em casa adivinha quem minha mãe manda sair pra comprar as coisas,0,0
Craigslist...Soros paying $25.00 an hour AntiFa BLM work as long as U like. Need U for 31/2 years. I might join at that rate!!,0,0
eu tento puxa assunto ele me corta olha que sou horrível pra puxa assunto e ter a mínima vontade de falar com as pessoas,0,0
Vim só pra ficar de babá dos meus irmãos mesmo. E olha que é o maior teatro da turnê delas e lotou as 4 sessões,0,0
Probably guessing that the dvla back then was run differently as to how it is now.. Given how it was dvla who told me it doesn't expire,0,1
Raquel é ridícula olha as coisas q ela ta dando rt só quero chora pq não tenho aquelas coisas pra comer,1,2
All of Team10 should be as well since they sat there and agreed and lied too. https:// twitter.com/thatssobeyonce /status/898784616831750144 …,1,1
Pence Calls Trump A 'Builder Of Boundless Optimism' Compares Him To Teddy Roosevelt PENCE IS AS HORRIBLE AS TRUMP http://www. huffingtonpost.com/entry/pence-tr ump-has-energy-can-do-spirit-reminiscent-of-teddy-roosevelt_us_5996f657e4b0a2608a6bd957 …,0,1
@ShawnMendes as cheesy it can sound you truly light up my life no matter what & I hope one day I'll get the chance to thank you in person,1,1
Might have to. Basically remove anyone I personally don't talk to and use it as an actual communication source lol.,0,2
Eu queria tanto ver as notícias do nuest todinhas mas n abre praticamente nada,0,0
"is wrong and creates panic"<=Try=>IS A PROPAGANDA #LIE BY #SUBVERSIVE #ENEMEDIA DESIGNED TO CREATE PANIC AND CHAOS AS DESIGNED BY #ALINSKY !,0,0
Keene usually referred to the farm as "Castleton Stud" & under his direction it became one of the greatest Thoroughbred operations of its day,0,0
As conversas com os meus amigos são sempre sobre o mesmo assunto,2,2
That's because of people like u n as long as people like u remain hateful it will always be divided,0,0
sim tragam as cruzadas de volta por favor já agora "tragam" a peste negra de volta também mas que só ataque neste tipo de gente,0,1
PETITION FOR A LIVE ACTION TANGLED MOVIE WITH JEN AND COLIN AS RAPUNZEL AND FLYNN @DISNEY,129,173
As musicas serão no berrante,0,1
Responde me as prguntas caralho — tou a tentar https:// curiouscat.me/Fatbaby/post/1 95662628?t=1503187172 …,0,0
Fui eu que as caguei https:// twitter.com/rtventura98/st atus/898204122373074944 …,0,0
Gil I have question:I always wanted to know when comes to touring with an artist and you as the creative director/choreographer does the ...,0,0
It happened to me as well x,0,0
Not everything will go as u expect in ur life. This is why you need to drop expectations and go with the flow of life. #SaturdayMotivation,0,0
Às vezes a gente se sente tão sozinha né,1,7
@BobbyMovie question...after i've done the never revoke thingdoes it applies to apps i install afterwards as well?,0,0
A #girl & her #bags things never change even as you get older #baglady next come the #shoes #addiction pic.twitter.com/wOMvhsG3HQ,19,9
@JoyAnnReid Thanks Joy!! Great show... you were awesome as you always are,0,0
@JoyAnnReid Superb program"The Politics of Hate." Stay strong as is your way and know that many of us across race and ethnicity pray 4 u.,0,0
/chuckles as I nods; of course~ so you are with me too wendy yah~,0,0
LA? as in los angeles,0,2
O que eu mais quero no momento: concluir a faculdade logo para não precisar estudar todas as noites,0,1
Patronage - Wikipedia https:// en.wikipedia.org/wiki/Patronage As well the term may refer to a type of corruption or favoritism in which a party in power...,0,0
The ones that mask their face are just as the kkk with hoods no diff,0,0
I'm already trying to get my hands on some im just broke as fuck,0,0
Não importa o quão estranho são as anotações nenom menines,0,0
The Del Mar Handicap gets the graded stakes action started here @DelMarRacing . As expected Itsinthepost and Ashleyluvssugar taking most $$,0,0
Remembrance of things past is not necessarily the remembrance of things as they were http:// bit.ly/1eFNWhF,0,0
Good thing I'm getting drunk as we speak cause I'm fucking sad,0,3
Hi I'm RazMansReality! Join me today as I give my NXT Takeover Brooklyn III & SummerSlam 2017 predictions. https:// goo.gl/sJiSkj pic.twitter.com/D7Z2F5Cyq9,0,0
Impressionante é só você ir morar junto com a pessoa que as coisas mudam!!!,1,0
21) uhh... there's such a thing as a Catholic movie? Chronicles of Narni? Lord of the Rings? Star Wars?,0,1
Kai would never hurt the female she was too important to him as she liked the same things as him and dressed the same and had body-,0,0
It's a complete ppl temperatures I'm checking as soon as we bump heads,0,0
*that moment when you see you have the same shoes as Dionne without knowing at first*,0,1
@lmjaguarrs Isso que você está fazendo não tem sentido nenhum. As meninas sempre falam que o amor supera o ódio.,0,0
Im gonna write a ttrpg that uses fidget spinners as the random dice element,0,5
pic.twitter.com/UaGMN0tQjS,0,1
He pushed his glasses up as they slipped down every so often since he had his attention on his feet while walking.,0,0
Ah mas as vezes tem junção de guri também,0,0
Bannon is as worthless as the white supremacists marching in Charlottesville.,0,0
As I confirm You hang with Nazis..you are,0,2
So you be stupid so he can be stupid as he grows?,0,1
I wish you saw the bigger picture it's clear as day but you don't see the vision,0,0
As an aside that was the lens through which JPII considered capitalism and liberalism. Feels like a long long time ago...,0,1
Someone bothered to look into old pictures being reported as taken today in Boston. Worth the look! https:// twitter.com/DustinGiebel/s tatus/898981118329982976 …,3,3
What typical ADL narischkeit as Israeli Knesset members routinely host Euro-Russian neo Nazis make common cause w anti-Semites like Orban. https:// twitter.com/JGreenblattADL /status/898656771010695169 …,0,1
Terus loe pikir anies salah ? Dasar otak cebong tukang bubarin pengajian kelojotan klw denger FPI di sanjung2,1,0
Liezel Pieters - Meer As Net Vriende,0,0
Yep as long as it works out. Sometimes people know you're just looking to strong arm a deal and won't give fair value or trade at all.,0,2
Damn i wish Moore had some arm strength as he makes solid decisions throwing the ball. Just can't drive the ball to his receivers.,0,0
Dozens arrested few injured as 40000 protesters descend on Boston http:// bit.ly/2x1IsJG pic.twitter.com/0PWyzY7cu2,0,0
Albany Police sent out a wild animal alert today. I almost didn't see it as the alerts are usually about pop up BBQS pic.twitter.com/mwtezrXIDT,0,0
ICYMI: National analysts 'disappointed' in Dez Bryant's anthem protest stance; comes off as 'selfish athlete' http:// p.d-news.co/jyiw,1,1
throw in juho's red hair too bc that has me equally as messed up,0,1
Congrats @Marlebean ! @Mardigroan picked your tweet as Tweet of the Day: http:// favstar.fm/t/894998290516 905985 …,2,1
I didn't expect that 'Soylent Green' was going to become a documentary.,0,0
It's time for #NXTakeOverBrooklyn . Hoping to see Ember Moon as NXT women's champion by nights end.,0,0
This is how I want to be as a dog parent https:// twitter.com/karissapukas/s tatus/899034429703593984 …,0,3
This shit won't ever stop. CNN is sitting back laughing as they keep on throwing fuel cans on the fire. Dividing America... Good job CNN,0,0
Eu tenho bue preguiça de responder às mensagens é por isso que demoro mt,0,0
Even tho they were "joking" that's nothing to joke about to someone with as many mental issues as I have.,1,1
When he saw that wink from you he knew exactly what you were really talking about. He smiled as he could feel his cheek changing colour. ~,0,0
In this case what if Deandre has been (God forbid as Heather was) 'hit by a car' as he was running off? Without film there's no proof.,0,1
I have Haru as Espeon because Psychic Akira is Umbreon because Dark.,0,1
Ganhou quase todas as bolas que disputou e ia com tudo em rodas as jogadas não economizou gás,0,1
Challenge yourself as a Bowmaster! Try a new game with your friend! Join us! https:// itunes.apple.com/app/id11184316 95 …,0,0
YONA: Stay happy as you are blessed #PushAwardsMayWards pic.twitter.com/DjiMELShpa,0,0
Eu estou pensando mt as vezes quero as vezes nao quero mais nada,0,0
As long as she has a lil class like half days https:// twitter.com/loveyurself_/s tatus/899055402729340929 …,0,0
i said to myself that i should go to bed earlier as i felt sleepy buuut it's now 1am,0,0
As far as I know he's active for the game,0,1
And truly music never affects you as much as it does when you're a teenager.,0,0
Mano as mina queria mostrar que dançava mais colegas fiquem suavonas n precisa disso chega aqui do lado e dança junto ué,0,0
Our hope is also that our Country will soon come together as one. Mr. President Thank you for your words.,0,0
Face reality as it is not as it was or as you wisr it to be. - jack_welch,0,0
I'm crying again laughing so hard as I scroll through that page,1,1
sofro ouvindo as musicas de Shawn Mendes devo criar esperanças? https:// twitter.com/mkarolqueiroz/ status/899057199640485888 …,0,1
Oh jr tem pessoas bue chatas tda hr comentar as mnhs histórias no ig,0,1
do you ever just leave hanging out with your friends and you miss them as soon as you leave even though you were with them for a whole day,0,2
and with the Accords Stark only can be involved if they tell him to as they now cant deal with every single problem.,0,0
Eu olho para cima e vejo as estrelas,0,0
Been binging on Drag Race and man do I hope to one day be as unapologetically myself as RuPaul is #goals,0,0
Oh boi don't I look disgusting today as usual #gross pic.twitter.com/VbBE7FwPtT,1,2
انسة سورية اقيم بالســــــــــــــــــــــعودية للـــــــــــــــــــزواااج http:// dld.bz/fRW4Q,0,0
Near as I can tell Frank Tanana used to be the record for AL lefties before Sabathia.,0,1
#Live today as though it's the last day of your #life on earth. For all you know it could well be - Scott Curran #inspiration #motivation,0,3
Gostei de um vídeo do @YouTube http:// youtu.be/WGwveP_-Kx4?a AS PIORES IMITAÇÕES DE PORTUGUÊS JÁ FEITAS || Jogando com Damiani,0,0
Ojala todos educaran y enseñar a sus hijos/ as así como lo haces vos! https:// twitter.com/Danilachepi/st atus/898004159328378882 …,1,0
I might as well jump in on this #HispanicsBreakTheInternet pic.twitter.com/GEw13b8Qzl,29,130
I love all the "open for a surprise" tweets that have cute animals as the picture.,0,0
A vida é curta viva. O amor é raro aproveite. O medo é terrível enfrente. As lembranças são doces aprecie.,1,2
Nothing is worse than not having any rights as a minority because an oligarch triggered race baiting to retain entrenchment Top that.,0,0
EXATAMENTE! Tô há 3 semanas malhando e minha vida melhorou 200% (Inclusive tô notando q todas as pessoas do Recife resolveram se exercitar),0,2
I think that's their Achilles heel: they're only bold as a mob. Take a picture and show it to them later and they'll cower. https:// twitter.com/paul_lander/st atus/898370042730921984 …,0,1
I am a good person and as it seems to be going overlooked on my own planet - I am hoping for a wider audience,0,1
Karthus is trash. but as an art student. I adore this splash art on a whole new level pic.twitter.com/zAtmq3a6rV,0,1
imo as a Mass Effect Fucker™ mass effect 2 and 3 are structurally the best for allowing them to tell a story most effectively,0,1
"Heaven is in your eyes bright as the stars we're under Oh is it any wonder I'm in the mood for love." pic.twitter.com/ngnIT36xjR,0,4
.. Se as más energias vierem contra ti vai contra elas; pois mal algum vencerá o bem que carregamos no peito,0,1
I am Sad - The death of policing as a profession in the Philippines via rapplerdotcom http:// s.rplr.co/MG68W3i,0,0
- wow. Well my parents are great and so were my grandparents. All flawed  as am I And I love them as well as myself.,0,0
Saved MI which is still the 'engine' of the country though not the Mustang it once was thus saving the country as republicants said no,1,4
OUPA 10 minutos e o vski vai dizer que as tendenciais são manipuladas,0,0
Online fans of Donald Trump refer to themselves as centipedes. pic.twitter.com/ccM6PTmG3C,0,0
Mano primeira festa que me dão muita coisa as pra comerrrr,0,0
"~ Juntando a guerra do jacaré e esse frio tá virando "Guerra Fria" " As coisas que eu sou obrigada a ler.,1,9
no offense but . what is impeaching trump going to do at all pence is just as bad as he is,0,4
Yea might as well,0,1
✑Kim Seok Jin as ❜Tear in my heart❛ ➸would do anything for the people he loves ➸beautiful ➸and knows it pic.twitter.com/IpF7BPmC6f,0,0
Friend told me there might be naked pics of Bayley coming out. Not cool. I think we as the Internet shall all refuse to look at them,0,1
State your intent to use this meditation as a tool to speed up the process of bringing harmony & unity #Love #Meditation #SolarEclipse2017 pic.twitter.com/0kd7XZmtdn,0,0
PORQUE AS PESSOAS PRECISAM TANTO "AMACIAR" O EGO PRA TERCEIROS AO INVÉS DE FICAR BEM CONSIGO MESMO?,0,2
8 seconds right as the camera whips back you can see the woman punch the back of his head at which point he turns around to swat her.,0,0
If it wasnt for JJones I'd love the #Comboys . As it is I like what the teams turning into,0,0
No more Mary Rose-style excavation as ships will be explored using VR instead http:// bilgitorbasi.org/no-more-mary-r ose-style-excavation-as-ships-will-be-explored-using-vr-instead/ … pic.twitter.com/XdJPUvuhMr,0,0
Respeita as mulher ou pega suas coisas e some já que uma que me paril e ainda me ensinou a ser homem...,8,23
Bushes Romney McCain & Rubio are Rhinos. I expected them to support @POTUS as we supported them. They have GOP Royalty Syndrome. Shame!,2,4
$ PSRU filing for 1st avail court date as urgent issue.TA getting served next week.Fake CEO AWOL!No prob.Nothing a bench warrant can't cure!,6,8
"With malice toward none with charity for all with firmness in the right as God gives us to see the right let... http:// fb.me/vkQk4wkE,0,1
JJ was my favorite as well followed by DD. I didn't like Luke Cage. I liked him but not the plot or villain of his series.,0,1
The Dictionary Humiliates An Ignorant #Trump With The Ultimate Troll Job After He Misspells Heals As Heels http://www. politicususa.com/2017/08/19/dic tionary-trolls-trump-ironically-misspells-heals-heels.html … #Resist pic.twitter.com/Hfq6ap4bz0,9,10
Às vezes sinto me mal a ver certos tweets de gente a reclamar dos namoros ou assim,0,0
IT BEGINS: Bannon Plotting Fox News Competitor As Curious Details Of Roger Ailes' Involvement Emerge http://www. thegatewaypundit.com/2017/08/begins -bannon-plotting-fox-news-competitor-curious-details-roger-ailes-involvement-emerge/ … #WAR,0,0
GrowthHackers: #GrowthHaking How Do You Start #Social Media #Marketing For Muay Thai? http:// growthhackers.com/questions/how- do-you-start-social-media-marketing-for-muay-thai?utm_source=twitter&utm_medium=GrowthHackers&utm_campaign=2142 … #As … pic.twitter.com/UdTPN8QR7H,0,0
Well as the Soup Nazi says..."No Degree for YOU" or Soup...or whatever,0,0
I heard an account today of an old lady protester holding a flag who had the flagged ripped from her by Antifa thugs as she fell to ground,0,0
As Kajal says calcium n raiza speak from their heart correct. They don like anyone so they whole heartedly bitch about them.perfect.,49,900
Kkkkkk vai querer sair com as brusinhas sexy ai,0,0
Incase you didn't know those men and women fought for freedom ( as stated) to chose to sit or stand. https:// twitter.com/jaci_lane_/sta tus/898161203477975040 …,0,1
Tenho saudades das minhas sardas que quando era pto mas na altura não queria ter... só damos valor às coisas quando já não as temos",1,2
I wish my dog didn't fart constantly in her sleep. For a dog as big is my forearm she fucking stinks,0,0
All of the Dedications went hard as fuck. No ceilings is forsure my fav Wayne tape ever. Something about that mf just goes so hard,0,0
リゾット「ファミチキください！！！！！！！！！！」プロシュート「いきなり大きい声あげないでください。うるさいですよ」リゾット「（ファミチキください）」メローネ「リゾット、直接脳内に……！」,0,0
#Trump still doesn't acknowledge or understand that many #Confederate statues erected in #JimCrow era as a means of intimidation.,0,0
to trump hotels and in some cases have been documented as overpaying by a large margin,0,2
was due to high altitude. u didnt even hear about it the next day or as it was happening on the news. Thats how deadly pot is so far for him,0,0
Don't think he's from Columbus so wouldn't qualify as a homegrown. Just former teammates with Crognale and Steffen. #CrewSC,0,0
Jsp si t' as pas compris mais on s'est bat les couilles,0,0
Eae @ACGOficial acabou as piadas ? Rsrsrsrsrs,0,0
@DanLeach971 I love your story and message. Sounded like a great day for you your dad & mom as well. Hopefully we'll meet soon. #keepitup,0,1
Si wsh t' as crue c'etait hypocondriaque qui va lui faire de la concu,0,0
お、インテか。良いイベントになりますように！,0,0
AnnaLee actually sat down with me and helped me organize toys to give to kids who don't have the same advantages as her,0,3
We live in a world where some FUCKING genius came up with Velcro shoes but people still wear lace-ups. We are regressing as a species,0,1
As Aaron Judge Cools Off So Do the Yankees - http:// lwosonbaseball.ms.lastwordonsports.com/2017/08/19/aar on-judge-cools-off-yankees/ … via @LastWordOnMLB #Yankees pic.twitter.com/8JkEkegp8H,2,2
On est d'accord! T' as un fav?,0,1
PISSSSEDDDDD AS FUCKKKK !!!!!!!!!,0,0
Obama DID speak words of hope. As in "I hope you believe if you like your plan you can keep your plan". Or "I hope ISIS is really a JV team",0,1
Choco tacos are just as much for the boys as saturdays are.,0,1
Friends are as companions on a journey who ought to aid each other to persevere in the road to a happier life.,0,0
Pfffft as if pic.twitter.com/titecgUPoO,0,2
It will cost probably twice as much here. If not more. :/,0,1
Only way. RT @MettaDamnFool : Got to RT @TaylorMieSean : As fuck. Go hard or go home https:// twitter.com/understand_bee e/status/899024188111040512 …,1,0
