
Tá aí uma verdade que até as viúvas tem que admitir https:// twitter.com/FlamengaoCRF/s tatus/899057412317085700 …,1,1
Jesus amadoooooo q vestido verde e esse separando as banhas #esquadraodamoda,0,1
Praying for @rushoffools tonight as they play #overflow2017 . Great event! BONUS: @kevinhuguley is preaching and playing. #DoubleDuty,0,6
Gostei de um vídeo @YouTube http:// youtu.be/HfPolIstKpU?aT Ô SMURFANDO E NÃO SEI?! - DESTRUINDO AS PARTIDAS NO CHALLENGER,0,0
- tu as 2 mois de vacances comme les élèves - oui... - et tu es payé? - Non je vends des quenettes pour m'en sortir...,2,1
Agr eu fico imaginando se a minha irmã vai ter um tb provavelmente vai ser as notas do celular,0,0
Man if Cooper is a legit center backup option as well as starting G that is a FA steal. #CowboysNation,0,0
They may have family members as their profile picture. Disagreeing with you politically doesn't warrant bullying.,0,0
My sister just said when she's 16 she wants a gwagon as her 1st car,0,5
And a friend you are as well! :),1,1
dsl bby toi mm tu l' as dit :/,0,0
Looking great as always!!!! Such natural beauty @WxLadyFelicia,0,0
As Aaron Judge Cools Off So Do the Yankees - http:// lwosonbaseball.ms.lastwordonsports.com/2017/08/19/aar on-judge-cools-off-yankees/ … #Yankees pic.twitter.com/gkUjv4zHkf,2,1
@realDonaldTrump As soon as either you resign or are hauled off in hand cuffs yes we will.,0,0
je men tape le coquillard de pourquoi t' as arreté youtube depuis 3 semaines et de combien t'es contente de me retrouver,0,1
Nearly 8 Million Face Starvation in Congo as Kabila Clings to Power http:// bit.ly/2wkD8nC,0,0
Just tryna be good to a man who gone be good to me simple as that,0,1
Aaahhhh that was strange and delightful okay I get the appeal ALSO I'm gonna use "double boom" as my go-to sex euphemism from here on out.,0,1
Fake news. Many??? No news of this elsewhere. Fake as it gets.,0,1
5-star big man Naz Reid names LSU as one of his two finalists http:// fb.me/Gk01Rpcf,0,0
"Why you even stand Soekjin ?" Me : bcs he is as weird as I'm *and show this video* https:// twitter.com/JinLoey/status /898921797386551296 …,1,1
Spirit Week starts this Monday!!Wolves make sure to show your spirit as we prepare to defend our home turf sat vs IMG #thisisourhouse pic.twitter.com/qAYVYfdqMq,25,43
As in I'll be home tmr so I'm coming over,0,0
@MSNBC The more you press people the harder they believe. As much as possible leave them alone and they'll calm down.,0,0
Eu amo as lives dele pic.twitter.com/yybN6WN1Gd,0,0
wow people are very disrespectful.while I don't feel the same as you doyou are entitled 2 your opinionwithout ridicule,0,1
I would always prefer a sprinting down the sidelines Davante BUT a Diving Davante for a 1st down is just as important! @MarquesEversoll,0,0
his beard is almost as boss as mine,0,1
some people better off as friends than relationship no hard feelings. It's life,2,1
The bruise is as real as Jakes and Erikas marriage killed his Disney contract now killing his YouTube fans she wouldn't be able 2 talk,0,1
Buddy I say this as a Virginian: stop embarassing everyone with your cornball Copperhead schtick. https:// twitter.com/coreystewartva /status/898209121907994626 …,0,1
Obrigada Flamengo não gosto de não cumprir com as minhas palavras https:// twitter.com/giomazzaeu/sta tus/899038525760258048 …,0,1
-first? *Arms outstretched the brunette passes a small smirk up to her Scot as she kneels to the height of her twins.*,0,0
This is as good as it's gonna get tonight ppl,0,1
This thread! She has the patience of Job as she breaks it down. #HispanicsBreakTheInternet and got Liza Sabater in teach mode! https:// twitter.com/blogdiva/statu s/898991614059716608 …,4,8
As Aaron Judge Cools Off So Do the Yankees - http:// lwosonbaseball.ms.lastwordonsports.com/2017/08/19/aar on-judge-cools-off-yankees/ … via @LastWordOnMLB #Yankees pic.twitter.com/fy4zgCjxOz,0,1
Encontrar alguém com quem se possa conversar é tão raro ... normalmente as pessoas só falam.,0,0
Tone blind as a bat,0,0
as minhas amigas são do melhor que há !!!,0,1
Smack is lit as fuck,0,0
he posted it as a Boston picture ..,0,0
Just shows as black on android marshmallow.,0,0
minha mae comprou uma almofada com uma mensagem motivacional pra mim mal sabe ela q eu ja perdi as esperanças com a vida,0,0
Women and cats will do as they please and men and dogs should relax and get used to the idea. -… https://www. instagram.com/p/BOgo-SyBJJ5/,0,0
caralho eu entro na tpm E TODAS as minhas amigas entram junto eu amo essa conexão de várias mulheres querendo matar várias pessoas de graça,0,1
Wha? A change of heart? Their 'wicked ideology' is simply Islam....thats it... as written. We've been 'bowing' & appeasing non stop #auspol,0,0
Ran into my baby @1milfie at the celebration as well! pic.twitter.com/Z6fCgAnbPU,2,2
Another one for @greg_doucette  tho I dunno if Charlemagne counts as a "dictator" per se. https:// twitter.com/BruceNV/status /899058068008255488 …,0,3
Yup as long as they are qualified! Can't believe the nerve and stupidity of some people,0,0
Eu agradeço mais a cada dia por ter as amigas que tenho hoje,2,4
Hey are you a fan of Electronic Sports also known as eSports™?,0,0
Às vezes a vida nos presenteia com encontros muito especiais... encontro de almas? Talvez! Certo… https://www. instagram.com/p/BX_qNNGgSqi/,0,0
Às vezes eu finjo ser normal mas aí fica chato e eu volto a ser eu mesmo.,0,0
- and let's not mention all the other members who were as well.,0,1
Great add on knowing Ss outside of school-for me-Using Twitter as a resource and spending time with my family outside- if you're asking me:),0,2
I took this as meaning don't give them a voice that they don't have. Countering their protests puts them on tv. Not showing up kills it,0,0
Nem senso ao ridículo e muito menos respeito com as pessoas.. além e claro de vergonha na cara,0,1
Salty as shit lol https:// twitter.com/persianrose1/s tatus/846188258182750215 …,0,0
TÔ INDO PQ NO MOMENTO TÔ SÓ IMAGINANDO AS DUAS LÁ DANÇANDO ESSA MÚSICA,0,0
The article is about universal health care as well as how we got social welfare so...,0,1
As a retired UPS exec never ever use that other company.,0,1
Might as well get it over right?,0,1
I wanna post the pic of wtf me & my sis just came across soon as we walked up in this creative spot today...but something telling me not to,0,0
Se fosse antes essa hora eu estaria bebendo aqui na frente de casa e já dando pt mais infelizmente as coisas mudam kkkkkkl,2,1
Vaz: "Tô na lateral mas sou zagueiro né" Paquetá: "Tenho que aproveitar todas as oportunidades onde tiver que jogar" A diferença rs,0,1
vai passar na globo as 21h?,0,2
And as well their primary funding sources Soros and numerous Democrat Party donors! Lock em up!! All of them!,0,2
Saudades? A gente sente mas as vezes se afastar é a melhor coisa a se fazer.,0,1
Why did Vitalik choose to create his own programming language in Solidity for Ethereum As opposed to Neo allowing… http:// ift.tt/2uU0fVP,2,2
Às vezes eu caio nuns perfis hahaahahahahahhaah pic.twitter.com/pieXDkOPjk,0,0
As pessoas são como músicas. Algumas falam a verdade e outras só fazem barulho.,0,0
That's awesome! I think my mom got me into it as a kid but I really developed a love for writing before my love for reading kicked in.,0,1
Me- omg why are my eyes watering so bad when I wear my contacts? Also me- realizes I've been using this as solution for the past week pic.twitter.com/oZRANudFMh,1,39
Is this what counts as a white supremacist these days? pic.twitter.com/0NXc3ubL4w,0,0
Theresa May has created a society where the poor need to save up to kill themselves as they can no longer afford to live. #ToryBritain https:// twitter.com/Greekboy8/stat us/899029468555214848 …,8,5
I voted for KathNiel as Push Group/ Tandem. Your turn! Vote for the Push Awards 2017 now! #PushAwardsKathNiels,0,0
N O M E P A S A. http:// fb.me/8ELtgHq6p,0,0
just as well we have the internet now,0,0
I want to applaud the many protestors in Boston who are speaking out against bigotry and hate. Our country will soon come together as one!,0,0
Acabou que o embuste estava em casa e não deu pra eu levar as caxias,0,0
Dead Space was never as big as Mass Effect was and attempts to make it that blew right in their face.,0,0
Moving just as fast as the cars buddy,0,1
He is effortlessly fine as fuck like i lowkey feel attacked idk how he does it? pic.twitter.com/XqLtdn3fGx,3,7
eu e a Ana Beatriz somos as duas pessoas mais choronas do mundo,0,2
@Lin_Manuel a question? as a boy roaming Ft. Washington & Ft. Tryon parks did you ponder the monuments & history & did that inspire...(1),0,0
E eu que sempre achava que tava sendo chata falando com as pessoas depois de um tempo comecei a cagar pra isso,0,0
Oh mete as reações dps,0,0
States to pick up slack on retirement savings as feds back out #financialplanning #moneymanagement #retirement https:// clclp.me/4RhB pic.twitter.com/Vi0ibFjkOc,0,0
Sobre essa noite: Amar e mudar as coisas me interessa mais.,0,0
Mas nós ainda conversamos não tem como conversar se ninguém responde as conversas sempre são só entre umas nunca todas estão lá,0,1
turtle finally using the copics i bought her if she don't send me those pics i'mma have to call u out as a weenie,0,2
When @Crleany_ says as a kid I always wanted to arrange a race with @usainbolt I think I'd smoke him,0,0
I just think as great as Zach Brown is at the Mo spot... You can plug the better Mike in Will Compton at the Mike. #Redskins,0,0
Nossa cara vendo as pessoas passar vergonha na internet pic.twitter.com/oPIWkyLbyI,0,0
I voted for Kathryn Bernardo as Push Female Celebrity. Your turn! Vote for the Push Awards now! http:// pushawards.abs-cbn.com/push-personali ty-awards?uid=d98e892a8316919f7daa99617f7a0937 … #PushAwardsKathNiels,0,0
You can be Christian. I don't care as long as it makes you happy. But don't try and lord your faith over others who are the same as you.,0,0
Next This Intellectual Ethnic Cleanser Who Is Counting On You To Treat His Views As Just One More Political Opinion,0,0
I also have a BNC connector crimper. I've admin'd a thinnet network. Wasn't as bad as Appletalk network. Nothing was that bad.,0,1
#OUATSF #EvilRegal 4Life #LongLiveTheEvilQueen #GoldenGirlsRockSF2017 pic.twitter.com/q8Q997qmjE,0,1
Here is a great gift for the knitting enthusiast in your life! Comes in a coffee mug as well! Smart Sayings-Amazon https://www. amazon.com/dp/B06XR9KN3V pic.twitter.com/xEk6jynalh,0,0
LMAO THEY HAVE THEIR OWN FAN BUT YET THEY USED THE CHEAPER ONES BECUZ CANDY FAN IS WEAK AS FUCK. LITERALLY NO WIND AT ALL AND IT'S LOUD AF pic.twitter.com/zGFnCiryy3,3,14
Good! She is no role model as a Senator representing her constituents! A treasonous faction!,0,0
Mano só uma coisa as pessoas mudam crescem e amadurecem. Se vc não aceita isso o problema não é meu...,1,4
Naomi’s name is too obviously feminine. It’d be funny if she had a mascule sounding name as well!,0,0
IT BEGINS: Bannon Plotting Fox News Competitor As Curious Details Of Roger Ailes' Involvement Emerge http://www. thegatewaypundit.com/2017/08/begins -bannon-plotting-fox-news-competitor-curious-details-roger-ailes-involvement-emerge/ …,1,0
@AETV I've never both looked forward to and dreaded a show as much as #ScientologyTheAftermath thank you for allowing us to see the truth,0,0
me: obsessed w making vcr filter edits also me: cant work out why ravi is using vcr as a hint for their red & blue concept,0,1
Yesterday @WeAreGROVES killing it as usual at @theroxy pic.twitter.com/YHJJw4dlbD – bei The Roxy,4,25
O bom é que eu sempre descubro as coisas ou chega até mim os fatos,0,0
Ha tbf I've met lots of lovely people from twitter. Some as recently as yesterday!,0,2
Bitch as the fuck but shit it might work better,0,1
I do not consider myself as a "MILSO" Bc the "grown women" in the groups act like 12 years olds. Also they treat others horrible.,0,0
" as pessoas nao sao más elas só estao perdidas" elas sao sim,1,5
HAHAHAHAHA Questão de referencial por exemplo; Considerando o ponto de vista de uma Aninha as coisas parecem um tanto grandes NHAAAAAAAAAA,0,1
I make a point of living as best how I want the world to be. My needs are no more important that yours. 19,0,1
e as casinha é baile de favela,0,0
As if we need one more thing to contribute to the traffic win… https://www. instagram.com/p/BX_qMT4nP1TH 7XcnDfKlq8I7WEhv4oxDdDzI3Y0/ …,0,0
As vezes tento enganar meu psicológico com medo de me iludir,0,0
I think so... I-I kinda started working for them as a double agent when they captured me...,0,0
TD celebrations using the ball as a prop? Yep that's allowed now. pic.twitter.com/PSFkUbYmSQ,357,994
The anticipation is killing me. Another banger as always I know!! #MrIncredible,0,0
* despite your begging I whip your breast as hard as I physically can*,0,0
I'm not as confident as I was during Wimbledon. So not taking that route! ;),0,1
大好き,0,1
That one eyed reflection makes her look cyberpunk as hell. pic.twitter.com/WmYRamnEko,0,2
I'm glad the Yankees have finally realized that Aroldis Chapman is barbecue. Worst pitcher in the league. Might as well put me in.,0,2
meu deus ele me achou em todas as redes sociais que horror,0,0
#DidYouKnow Banstead appears in the Domesday Book (1086) as Benestede. #Surrey #FactOfTheDay #Banstead,0,0
watched it a couple of nights ago. nowhere near as terrible as they made it out to be. i quite enjoyed it for what it was,0,0
Não acredito que as orcas inventaram as boas lembranças da infância. https:// twitter.com/revistanatgeob r/status/899045815296999424 …,0,0
Pegar un empujon es agresion cagon es insulto,0,0
as vezes sim vai skkskskkkw,0,0
As nossas discussões tem sempre um fim bonito porque ele sabe tratar do assunto sem merdas ensina-me as cenas como deve de ser!,0,0
Watching the race on @NASCARonNBC go @KevinHarvick  will watch as long as we can #Truckerswife,0,0
Just as "no-one has ever died from air pollution" - epic Junk Science.,0,0
kloonoa is good as fuck!!!,0,1
Formally recognize AntiFa as a terrorist organization https:// petitions.whitehouse.gov/petition/forma lly-recognize-antifa-terrorist-organization-0 …,0,0
Agora as moças vão chorar "ain time ruim" "ain prefiro Paulinho",0,0
Ja perdi as contas kkkk,0,1
Minha bateria não vai durar nem até as 22:00 eu tô bem triste,0,0
. @NICKIMINAJ obsession was real still is just not as bad thanks facebook for the reminder I owe you one pic.twitter.com/flAir1kabn,0,0
I pray Dylan works the same shift as me tomorrow bc I need my boyfriend we go days w/o seeing each other. In the end it'll be worth it,0,1
Andy is as scary as a box of kittens,0,0
SERIOUSLY if I have good money of course I'm going to help my kids as much as I can as long as I can https:// twitter.com/weeessleeey/st atus/898743598149062657 …,5,4
Welcome @sellpounds to Codex As The Newest Manager! pic.twitter.com/cyseabORoV,4,17
as vezes eu não tenho nem coragem de falar com esse bicho de tanto que eu vacilo,0,0
Duh.. #USA Voters know what democracy is..We Voted for our #POTUSTrump ..And also know what hatred ya have toward #Trump as well...,0,0
I look forward to the day that @Dauragon is recognized at large as one of the great thinkers of our time but horny.,4,23
American publishers present to Booksellers as their showroom #booksnz,0,0
O silêncio é tão contraditório: às vezes alivia outras vezes sufoca #umRei,1,0
eu e Larissa programando as paradas pra amanhã... "amg n podemos esquecer de comprar pirulito.." viciadinhas em doce,1,3
Caralho tá subindo as fotos pro drive desde de tarde,0,0
Who cares? Odds are none of the Jets QBs will likely start all 16 games. QB by committee as they tank,0,0
@sumuntu trying to carry me as I was laying dead on the curb in the middle of valley village,0,2
Lots of Employees Get Misclassified as Contractors. Here’s Why It Matters http:// googlejuices.com/lots-of-employ ees-get-misclassified-as-contractors-heres-why-it-matters/ … #leadershipandhrmanagementtrendingnews,0,0
Let there be as many Free Speech Rallies as people want. 1 stipulation No Weapons! #Over,1,1
Rebranding as soon as I come out of recovery.,0,0
As vezes evito companhia pois me sinto melhor,0,0
love how you tweeted this as i'm watching the video,0,0
Thats Wallace "The Twit" posing as a journalist. He is a bedwetter. Little boy Murdoch loves him.,0,0
You ever think "if I died right now who would be fake as fuck and act like they cared.",0,0
Take this one down as well https:// twitter.com/rappersposts/s tatus/886408796595269632 …,0,0
Socialism are about as far apart as Conservertives and Anacho Libitarians you'd know this if you study political science,0,0
Challenge yourself as a Bowmaster! Try a new game with your friend! Join us!efgydx https:// itunes.apple.com/app/id11184316 95 …,0,0
As pessoas são bem sem noção né Que Deus te perdoe linda,0,1
Amanhã às 6:30 na Band Rj  programa Milagres na TV com o Apostolo Cassio Mariano Não perca !!,0,0
O Senhor Jeová me abriu os ouvidos e eu não fui rebelde: não me retiro para trás. As minhas… https://www. instagram.com/p/BX_p9MEjT7t/,0,0
Entonces es más una agresión verbal que una física? xd Me voy de Twitter.,2,19
e eu tô muito satisfeita com as mudanças tô me tornando quem eu sempre quis ser,0,0
Com'on mate........ you've gotta laugh at the auto Leeds are going up songs as well,0,0
Delta force isn't better then 22SAS bore off cunts navy seals are good but not all that personally 22 all they way,0,1
I grew up on late 80's / early 90's NWA/WCW as my favorite because it was presented as real. There is where we are different.,0,0
Enzo contando as histórias dele é o mais engraçado kkk,0,0
Thats craxy Bells Two Hearted ale was really ranked #1 IPA over Pliny! And its nowhere near as "exclusive",0,1
é mec mec com as piranhas hj eu fuder na onda da maconha,0,0
My dog as my banner ^_^ pic.twitter.com/eraMNs7PlZ,0,1
He blocked u bec u have no life as a has been,0,5
Cowards cover their faces so you don't recognize them as they go city to city and collect their pay from the DNC!!!!!,0,0
Encontrar alguém com quem se possa conversar é tão raro ... normalmente as pessoas só falam. #umRei,1,0
키보드 대회 끝나면 바로 AS 맡겨요,0,0
Buddy looks soo freaking cute as a lion!,0,0
"Sounds like every cat I've heard." He patted down her head again nodding as he took the threat with ease. "They aren't easily harvested.",0,0
As energias que sugava eu me livrei,0,0
GLO1098 deverá chegar em GLO1098 em 15 min às 21:15 BRT http:// flightaware.com/live/flight/GL O1098/history/20170819/2335Z/SBGR/SBGL … #flightaware,0,0
O Luan vai mudar o visual para as novas músicas clipes e tal... #Acredito #Luan10,0,3
If I ever have a kid I'll try to keep up with their interests so I don't come across as that out of touch "back in my day" parent,0,2
Não vou responder as minas no snap pq come bateria e crédito rápido demais.,0,1
Sad you didn't play entire video how those 40 thousand stood tall against #WhiteSupremacists & #Nazi as 45 won't be able to comprehend much~,0,1
Not sure how to feel about tonights show. Looking forward to it as always but also depressed knowing it's the last until Oct #Nooooo#LivePD_,0,2
The only options for best song on After Laughter are as follows: told you so pool or tell me how. Try again.,0,1
As soon as you resign and GOP-iban go bye bye ... we'll be better.,0,0
Yes! after a couple years I'll have broken down and given you as much money as I can - Especially w/ the way you tell us to suck your dick,1,1
Os safados e ladrões políticos querem saquear o Brasil em mais R$36 bilhões...Para as ruas dia 27/08. #FundoEleitoralNao pic.twitter.com/gjiMKs3V0w,1,1
I can't wait to cosplay Tracer with you as mercy *lays down*,0,1
Em todas as profissões existem os bons e os maus. Eu não defendo meus colegas de profissão me espelhando neles pois cada um cada um né,0,1
You look cold. Want to use me as your blanket? #PushAwardsMayWards,7,0
Yeah but for the life of me I don't get it. Why now? They were just as bad last year as 100-years ago.,0,1
do nada vai aparecendo as candidatas ao premio na tl hauauhau,0,0
meus olhos não creem no que estão lendo mds como as gringas tiveram coragem de fazer isso não merecem o ídolo que tem pic.twitter.com/THrSiuIPvk,12,13
I voted for Nadine Lustre as Push Female Celebrity. Your turn! Vote for the Push Awards 2017 now! http:// pushawards.abs-cbn.com/push-personali ty-awards …,0,1
he hates me bcs i dont have loeeys as my username,0,0
So many people think of it as a business or a way of making money on the side,0,1
2. @nytimes There are multiple stories as to how #bubbletea arose in #Taichung #Taiwan . And what @#Taiwan #cuisine along w/ it?,0,0
No one calls me anyway might as well get a flip phone but hmmmm,0,0
as soon as possible,0,0
eu tô admirada com a determinação em dar block em todas as camilizers kkkkjj pic.twitter.com/krY4ZdP7AE,1,2
Acho que as coisas melhoraram agr,1,0
E me estresso dms c as pessoas ao meu redor rs,0,0
Cunt take a flying fuk to yourself u disrespectful loser!!! No wonder u are as u are,0,0
PINTARAM NADA UM OU OUTRO QUE PINTA AS VEZES mas gosto do castanho pode deixa,0,1
i had a lots of issues with my parents but none of them are related to how they treated me as a child,0,0
So I checked out the PlayStation games that I bought to see if they double as a soundtrack CD. None can do it unfortunately,0,2
A section of the Kitty Public Road is to be closed from Wednesday as the Ministry of Public Infrastructure steps... http:// fb.me/1bT3dxZqp,0,0
At Canada Hill Church . Reminiscing old memories during school days as boarding school students,0,1
as mais stan y-no do rolê pic.twitter.com/FICPr8ZTzY,0,1
that's what I thought too same shit as lance,0,0
비오는데.내가 왜 밖에있지요,0,0
As a Grammar Nazi I object to that thing's apostrophe.,0,1
Não vou ter tempo de acompanhar :( precisa ver as outras séries envolvidas ou da pra ver só ela de boa?,0,0
//fuck me... I gotta go to my main again as I'm heading out. If you know it great. If not good fucking luck,0,1
pq ele fala umas parada meio sem nexo que não condizem com oq é dito em outras aulas as vzs(agr eu n tô lembrando oq era) e eu n gosto+,0,1
HP would be my recommendation. Connects to everything and doubles as emergency work laptop when needed.,0,1
I've been watching for statements from our Pa Elected Representatives. I'm still watching. Politics as USUAL.-Reason Y we're in this mess,0,0
gosto mt n mas uso as vezes https:// twitter.com/senhorstoessel /status/899036781051600896 …,0,0
Sobre as últimas semanas: estão sendo os melhores dias da minha vida .,0,2
Nah it's calm they're friendly pets we've decided on cauliflower as a name,0,0
O Pedro compra-me batons cremes e cenas assim sempre que vais às compras,0,0
...very true I just compared you two using "they're both fucking insane" as the only point aslong as Speccy is Double D everything is fine,0,4
qnd eu quero uma pessoa eu vou cercando ela por todas as redes sociais até elas repararem na minha blz,0,0
Dzemailli Piatti AJH sont en feu et la défensive du RSL peine à suivre et à s 'organiser,1,3
Era sarcasmo s a r c a s m o y ¿en serio? ¿Stark? osea ¿STARK?,0,0
t' as besoin de quoi ? pic.twitter.com/ycsiOD0tzL,0,0
just as cute as u,0,1
"Let the children come to me... for the Kingdom of heaven belongs to such as these." - Mt 1914,0,2
Tô de banho tomado coloquei aquela blusinha para encontrar as novinhas! #meuBe em Japeri https://www. instagram.com/p/BX_qLg3hLH_/,0,0
"After the news broke traders at the New York Stock Exchange “literally cheered” according to a CNBC report." As did we all. https:// twitter.com/tvietor08/stat us/898966469513420804 …,1,9
Colocaram rápido as fotos do villaras,0,0
Salle pute ! C'est bon tu m' as retrouvé ?,0,0
(About Abel)Good... as long as he is doing well... That makes me very happy.,0,0
I like my hair short but I also wanna let it grow since it's not as damaged anymore,0,0
Verdade eu nao so amo os filmes como as musicas tudo cara sei la eu meio q viajo no tempo.,0,1
minho is protecting his title as the most supportive idol i see ♡,0,2
As merdas q a Marta descobre são fantásticas,1,2
Turnt talking about how pure Starbucks is as a company,0,1
i wish i loved myself as much as paris hilton loves herself https:// twitter.com/parishilton/st atus/898974580152389632 …,0,0
As meninas na sessão das 15h hoje #1 (fotos via @bebexinhagabie ) pic.twitter.com/h483DXy3Kt,6,15
Live each day as if your life had just begun. #PushAwardsMayWards,0,0
But still not quite as good as @sheetz,0,1
he's gets arthritis in that hand and he's just as useful as we are,0,0
Halka devlet bakmak zorunda dır tamam iş aş vermek zorunda dır sosyal devletin anlamı budur,0,0
as meninas já estão aqui,0,0
For 1 wont never look at him ever with respect after witnessing what i have as i prev stated punchin a dog is no diff and the criminal,0,0
Graduation can have a song as bad as "Barry Bonds" and still be GOAT,0,1
Live today as if the last and the next day as if in heaven. #PushAwardsMayWards,1,0
Bonganay said “reign of terror” intensifies under Duterte administration as children have also become targets of... http:// fb.me/1eZV8wPHh,1,1
donne des choses que tu as appris grâce à Joris — Je peux pas résumer en un seul poste ce que j'ai ap... https:// curiouscat.me/4341555742/pos t/195539691?t=1503187143 …,0,1
EU E AS GURIAS CHORAMOS NO FILME DE MEDO GSUIS SUPEROU DEMAIS MINHAS EXPECTATIVAAAS,0,0
Looks like her period is pretty rough this month.,0,0
slm güzellique — as https:// curiouscat.me/Handeaaras/pos t/195655365?t=1503187143 …,0,3
