
AL: tie between Jays, Yankees , Red Sox NL: Mets https:// twitter.com/KennySledge/st atus/854043277267480576 …	1	0	
Just saw a guy wearing a Yankees hat and Red Sox shirt. #oof #shoulditellhim	0	0	
New Tip - Chicago White Sox @New York Yankees , https:// tipstrr.com/tipster/pod/ti p/446976 … #Tipstrr	0	0	
Yankees Vs Red Sox Next Week	0	3	
New Tip - Chicago White Sox @New York Yankees , https:// tipstrr.com/tipster/pod/ti p/446973 … #Tipstrr	0	0	
New York Yankees - Chicago White Sox betting tip. Read in full > http:// zpr.io/PDpAt . Game one of the series between White Sox and Yanke	0	0	
The Chicago White Sox created an art-driven season ticket package for fans. http:// bit.ly/2pJ2OCL pic.twitter.com/4Fr9TGUHdB	1	2	
Come on #sox let's kick some Yankees ass.... https:// twitter.com/whitesox/statu s/854047857380401152 …	0	0	
White Sox , Cardinals https:// twitter.com/kennysledge/st atus/854043277267480576 …	1	0	
Retweeted Manuel mencia (@Manuelmencia82): Parley mlb machos ATLANTA OAKLAND HOUSTON hembras WHITE SOX PIRATAS... http:// fb.me/8HXhlnpyy	0	0	
pinstripealley​.com >> Yankees vs. White Sox Series Preview: time for a heat check http:// buzztap.com/-iREMP0	0	0	
"The Texas chapter of my life was terrific, but it is over. I'm excited to be a White Sox guy now." – @Dutch_Oven45 https:// cards.twitter.com/cards/vo769/41 t7o …	18	105	
Chicago White Sox playing good baseball Go Go Sox pic.twitter.com/Vh4SY42wVC	0	2	
White Sox top 10 prospects results from last week, all in one place: http:// fw.to/qJUI1VR	1	7	
http:// bit.ly/2pq2ABl GUARANTEED PICK - BY Tony Stoffo GAME: (961) Chicago White Sox vs. (962) NY Yankees DATE: 04/17 PRICE: $30.00	0	0	
#CentralCigarLounge presents MLB @MLB #MLB #Baseball #NewYork New York Yankees vs #Chicago Chicago White Sox ... http:// fb.me/vj9XO3PI	1	0	
Yön MLB-kierrokselle napataan: Houston (1,61) Cardinals-Pirates yli 7,5 (1,82) Yankees - White Sox alle 8,5 (2,00) #betsit #MLBfi	0	0	
I follow the White Sox , but I've been a baseball fan all of my life and a Jackie Robinson fan! Jackie Robinson truly was a class act!	0	0	
New trending GIF tagged hug, white sox , tres, chicago white sox , threeway, garcias, willy garcia, leury garcia, av… http:// ift.tt/2ppadYC	0	0	
April 16, 2017 at 01:57AM @gifsonfleek gifsarethenewtalking, hug, white sox , tres, chicago white sox , threeway, garcias, willy garcia, leur pic.twitter.com/g1Dw6f5vy4	0	0	
Parley mlb machos ATLANTA OAKLAND HOUSTON hembras WHITE SOX PIRATAS MINNESOTA alta ARIZONA-DODGERS. Suerte.	1	0	
Yanks aim to push streak to 8 vs. White Sox http:// dlvr.it/Nvzg0b #mlb #baseball pic.twitter.com/bT07WgDT6j	0	0	
Yanks aim to push streak to 8 vs. White Sox http:// dlvr.it/Nvzg1v #MLB #NOSN	0	0	
Yanks aim to push streak to 8 vs. White Sox http:// dlvr.it/Nvzg0G	0	0	
Yanks aim to push streak to 8 vs. White Sox http:// dlvr.it/NvzfsQ pic.twitter.com/g1aZ2XQ13x	0	0	
Yanks aim to push streak to 8 vs. White Sox : The White Sox wrap up a nine-game road trip with a three-game series… http:// dlvr.it/NvzfkS pic.twitter.com/QvhVGWluqk	0	0	
White Sox : Carlos Rodon Continues to Recover from Bursitis http:// ow.ly/VLmA50aU4NS	0	0	
Yeah but again...I see most of the big players potentially in on him. The Yankees are in better shape than the Sox ...and $$$$ to spend	0	0	
I'm a White Sox fan but be great to be around the senior class	0	1	
Trending Worldwide Top Ten Reasons David Letterman Always Wears White Sox http:// fractt.com/top-ten-reason s-david-letterman-always-wears-white-sox/ …	0	0	
7:05 PM Chicago White Sox lineup http://www. dailyfantasyrosters.com/mlb#CHW #MLB #MLBLineups #DFS #BASEBALL #FANTASYBASEBALL #WhiteSox	0	0	
Jose Reyes to the White Sox and in exchange the Mets give the White Sox T.J. Rivera	0	0	
Today's MLB Picks: 7:05 PM EST - Chicago White Sox vs. New York Yankees - 23 PICKS AVAILABLE (3 FREE) - https://www. cappertek.com/todaysPicks.as p?d=mlb-baseball-betting-predictions-chicago-white-sox-vs-new-york-yankees-monday-april-17-2017&gameID=93814 …	0	0	
#MLB Yanks aim to push streak to 8 vs. White Sox http:// dlvr.it/NvzVx1 pic.twitter.com/dSu2d5wHYm	3	2	
It's creepy and weird, sure. But it beats the hell out of more Cubs, Yankees , Braves, and Sky Sox . https:// twitter.com/talkendo/statu s/854039545339420672 …	0	0	
mlb​.com >> Yanks aim to push streak to 8 vs. White Sox http:// buzztap.com/-AbR9Y0	0	0	
Wow, I love @Listia ! I just won this for free, Chicago White Sox - 6 Cards https://www. listia.com/r25z8wr/BPTYRJ	0	0	
White Sox +140	1	0	
Yanks aim to push streak to 8 vs. White Sox Sent with @MLB At Bat. #MLB . #Yankees . http:// mlb.com/r/game_article ?gid=2017_04_17_chamlb_nyamlb_1&mode=preview&vkey=preview_web_home&c_id=nyy …	0	1	
Yanks aim to push streak to 8 vs. White Sox http:// ift.tt/2nVUNy6	0	0	
The White Sox won 2 out 3 this weekend. FYI YOU	0	0	
White sox and a's so far. Waiting on lineups for others	0	0	
So the Yankees get the White Sox for a 3 game set and we don't have to face Quintana. Things continue to look up for this team!!	0	4	
@MLBNetwork White Sox Jose Quintana for Yankee's Blake Rutherford and Dustin Fowler #therundown	0	0	
White Sox +135 +$1,350 #MLB #WhiteSox #ITwins #betting #tips #Winner #Results #profit #ROI #Win #Freebets	0	0	
White Sox @Yankees TRENDS pic.twitter.com/RtRvUK79Zx	0	0	
"Buster's Boner" is easily aroused by the Yankees , Red Sox , and Cubs.	0	2	
yaaaay mi mejor amigo y yo ya compramos boletos para MLB red sox vs yankees wuuuuu @beto8020	0	2	
Excited to see our rookie Montgomery face the White Sox tonight. Win or lose this season I'm really enjoying... http:// fb.me/7laX2GDv8	0	0	
670 The Score Interview: @JonHeyman talks Cubs, White Sox and MLB with @mullyhanley http:// cbsloc.al/2pq7oJL	0	1	
Cubs Ian Happ(or Javier baez) and Rob Zastryzny to the White Sox for Nate jones.	0	1	
@MLBNetwork Oriole's and White Sox : Mancini (ROY) Harvey and Mullins for Quintana and Cabrera #therundown	0	0	
White Sox ML +140	0	0	
Redsox send : Bobby Dalbec and CJ Chatham White sox send: Todd Frazier #therundown	0	0	
@MLBNetwork White Sox Jose Quintana for Astros OF Teoscar Hernandez, P Mike Feirs, OF Daz Cameron #therundown	0	0	
@BarstoolBigCat my friend says he likes the Cubs and the white sox because he "roots for the city" what are your thoughts on this?	0	0	
Your playoff teams if the season ended RIGHTNOW Orioles Tigers Astros WC: Yankees , Red Sox Nationals Reds Rockies WC: Diamondbacks, Marlins	0	0	
@MLBNetwork Nats: Austin Voth, Brian Goodwin and Jackson Reetz White Sox : David Robertson #TheRundown	0	0	
#White Sox lineup: Saladino, Anderson, Cabrera, Abreu, Garcia, Davidson, Sanchez, Smith, May https:// rotogrinders.com/lineups/mlb	0	0	
We've got half price wings and $5 microbrews today, plus lots of sports! The White Sox play at 6, the #Cubs play... http:// fb.me/1ZhifwaGE	0	0	
White Sox 4/17 - http:// bit.ly/mlblineups Saladino 2B Anderson SS Cabrera LF Abreu 1B A Garcia RF Davidson 3B Sanchez DH K Smith C May CF	1	0	
OTD in 1951 @Yankees Mickey Mantle makes his major-league debut, going for 1-for-4 in a 4-0 win vs Red Sox . YankeesHistory #Yankees	0	0	
Check out Chicago White Sox T-Shirt XLT Majestic Black NEW Est 1901 Tee MLB NWT #Majestic http://www. ebay.com/itm/-/18253413 7320?roken=cUgayN&soutkn=aez0Sb … via @eBay	0	1	
Check out Chicago White Sox T-Shirt XLT Majestic Black NEW Est 1901 Tee MLB NWT #Majestic http://www. ebay.com/itm/-/18253413 7320?roken=cUgayN&soutkn=aez0Sb … via @eBay	0	1	
#Yankees looking for win number 8 in a row tonight against the White Sox at home in the Bronx.	0	0	
What propects can you see the White sox getting for Jose Quintana?	0	0	
If Avi Garcia stays hot and continues to impress, do the white sox keep him or move by trade deadline?	0	0	
Let's check in on the prospects the White Sox acquired last offseason https://www. google.com/amp/s/www.yaho o.com/amphtml/sports/news/lets-check-prospects-white-sox-acquired-last-offseason-222233782.html …	0	0	
We've got half price wings and $5 microbrews today, plus lots of sports! The White Sox play at 6, the Cubs play... http:// fb.me/1F5NKkE7X	0	1	
I like one player not on the white sox , sue me lol	0	0	
I believe he's qualified to play OF for the White Sox https:// twitter.com/mlbtraderumors /status/854031317457149953 …	0	0	
(1/4) Monday's Games: 7:05 Pirates(120) at Cardinals(-130) 7:05 White Sox (141) at Yankees (-151)	0	0	
I would love @keithlaw to manage the White Sox if it just for not seeing such a futile strategy as a bunt anymore #stopbunting	0	0	
#Chicago White Sox Outfield Will Make MLB History Friday Night http:// buff.ly/2pFxyVi the 3 Garcias	0	0	
White Sox fans get upset easily lol	0	2	
I mean I'm a white sox fan but you're over there with 3 teams and counting ...	0	0	
Up next at 1pm. CST Matt Enuco from http:// OutsidePitchMLB.com with White Sox talk on ShawnSierraSports. http:// WLGKRadio.com	0	0	
Top #MLB Pick 4: CHICAGO WHITE SOX vsNEW YORK YANKEES go with #NEWYORKYANKEES (-143) make picks free: http:// bit.ly/qQqhb7	0	0	
MLB trade rumors: Should Yankees deal for White Sox 's Jose Quintana? - http:// NJ.com http:// dlvr.it/Nvyg7Q	0	0	
And the result was the White Sox then intentionally walked Brantley and Edwin GIDP to end the inning.	0	0	
The White Sox are mirroring the strategy that their crosstown rivals mastered. (by @jaf78 ) http:// on.si.com/2pJYljz pic.twitter.com/nuNdsQgyQQ	1	3	
It would of been cool to chat it up with another white Sox fan while watching the Knights	0	1	
El Parley de hoy: WHITE SOX , PIRATAS Y BAJA DE CACHORROS. pic.twitter.com/ezjOOPdab0	1	1	
White Sox vs Cubs – Game One – Chicago Picture https:// chicagoinformer.com/401232/white-s ox-vs-cubs-game-one-chicago-picture-28/ … pic.twitter.com/SYZmuIBqNw	0	0	
At this moment the White Sox are the best baseball team in Chicago #SouthSidePride @whitesox pic.twitter.com/efgQ5b9AFi	2	13	
Tonight's pitching matchup features Left handers Jordan Montgomery and Derek Holland as the Yankees take on the White Sox in the Bronx pic.twitter.com/5PzHZiuA3K	0	1	
"How the Cubs and David Ross help shape the White Sox world series roster." Article coming in 2020.	2	13	
Nice-let us know when you cover the White Sox	0	0	
The White Sox have dedicated Wednesday, May 10 as McAuley Night! Don't forget to purchase your tickets by April 21! http:// buff.ly/2pJLg9J	0	2	
Jordan Montgomery is the Yankees scheduled starting pitcher for tonight's game vs. CHI White Sox . 7:05 p.m. first pitch.	4	24	
Bases Are Loaded: Cubs- White Sox Brawl http:// basesareloaded.blogspot.com/2016/05/cubs-w hite-sox-brawl.html?spref=tw …	0	0	
@Yankees 7 in a row! Watch out Sox	0	0	
Bases Are Loaded: The White Sox Turn Another Triple Play http:// basesareloaded.blogspot.com/2016/05/the-wh ite-sox-turn-another-triple-play.html?spref=tw …	0	0	
How the lowly White Sox are modeling themselves after the Cubs http://www. si.com/mlb/2017/04/17 /chicago-white-sox-prospects-chicago-cubs …	0	0	
#BaseBall Update Chicago Sox at NY Yankees (7:05 PM ET) http:// sports.espn.go.com/mlb/scoreboard	0	0	
This is a hard argument because we will both be biased but this is why I don't think the cubs and white Sox will ever match	0	0	
The white Sox have no reason to trade him to a team that doesn't value him fully, because somebody in the league will	0	0	
Good guess. That's probably what happened. Are some actually in Red Sox uniform and others in White Sox ?	0	0	
What I want the #Yankees to do to the White Sox . pic.twitter.com/bO9gvblGUg	0	0	
Derek Holland, White Sox (6-5) are on road to face Jordan Montgomery, Yankees (8-4) tonight. Preview: http:// scoresandstats.chicago.cbslocal.com/baseball/mlb-p review.aspx?page=/data/MLB/matchups/g4_preview_8.html …	1	1	
ESPN is on a roll today, next they're gonna tell us how any team not named the Yankees , Red Sox , Cubs, or Dodgers shouldn't be on SNB https:// twitter.com/espn/status/85 4024180110635008 …	0	0	
Rienzo no Marlins e colocaram a foto do White Sox ... Acertaram nada , mas ta valendo	0	0	
White Sox Series Preview: South Side (Can't) Hitmen take on the Bronx Bombers #SoxGameday http:// theloopsports.com/2017/04/17/whi te-sox-series-preview-south-side-cant-hitmen-take-on-the-bronx-bombers … pic.twitter.com/5JiKBUybMg	3	3	
. @Gumbynation34 busca su 1ra victoria en #LasMayores ante los White Sox . : 7:05pm ET : WADO 1280 Previa: http:// atmlb.com/2oEMG6g pic.twitter.com/B2FJUpMhcs	4	9	
White Sox playing the Yankees today	0	1	
Some White Sox ideas: Quintana to Rox for Hoffman, Tapia, Marquez, Murphy Quintana to Stros for Tucker, Fisher, Reed, Whitley	0	0	
Heart cold, ice box Eyes closed, lights out Chicago White Sox Talk hard, pipe down	0	0	
For real though who wants to go to Fenway with me this year to see the Yankees and the Red Sox ?	0	0	
David Robertson to Texas for Yohander Mendez and Keone Kela? Would White Sox pick up half of remaining contract? #TheRundown	0	0	
2 Chicago White Sox New York Yankees 4/18 Tickets 3rd ROW Sec 236 Yankee Stadium http:// dlvr.it/Nvxzfn pic.twitter.com/yHoA3OJfFG	0	0	
The YANKEES and WHITE SOX go at it tonight at 7:05. Be sure to watch the game with friends at BRIDIE'S and enjoy... http:// fb.me/69byLA62h	0	0	
Me when I realized the Hawks are 0-2 against the Preds Bulls are 1-0 against the Celtics & the White Sox have a better record than the Cubs pic.twitter.com/Ay3rrYCcLk	0	3	
All our burgers & fries are just $5.95 on Burger Monday. 6-10pm New York Yankees VS White Sox 7pm! http:// fb.me/Ad77oE2p	0	0	
Huh, that's a weird way to spell "trade him to the White Sox for Robertson to help the Cubs' struggling bullpen" https:// twitter.com/kanesportsmedi a/status/853995960929857537 …	2	8	
White Sox get: C/OF Kyle Schwarber, 3B Jeimer Candelario Cubs get: SP Jose Quintana, P Carson Fulmer, OF Avisail Garcia, C Omar Narvaez.	1	0	
台灣進不多就想上官網買但偏偏官網又只寄加拿大是哪招.... Chicago White Sox MLB Authentic Collection 59FIFTY Cap Hats at http:// NewEraCap.com http:// shop.neweracap.com/Style/59Fifty- MLB-Authentic-Collection/20906301 …	0	0	
2014 Bowman Platinum Tim Anderson SP Refractor Prospect Card! Chicago White Sox ! http:// dlvr.it/NvxrNz pic.twitter.com/7oFrandppf	0	0	
#MLB : White Sox +137, Yankees U8.5, Braves -166, Cubs U7, Astros -156 (2u each) #TopTierPicks	1	0	
to be fair, the white sox and twins probably have the lowest ERAs because they've played each other six times...	0	2	
Package designs can attach emotions to a product, which the White Sox did for their season tickets #MarketingMonday http:// bit.ly/2oFLqBa pic.twitter.com/88p28nZZvC	0	0	
Go Go White Sox ! https:// twitter.com/adamhoge/statu s/853963115104546816 …	0	1	
Hahaha no one cares about how the white sox did this weekend. https:// twitter.com/paytonsun/stat us/853779306337759233 …	0	1	
Chicago White Sox @New York Yankees - Monday, April 17, 2017 - MLB Game Center - MSN Sports http:// a.msn.com/52/en-us/b401c 09d2Z2igbYkSM?ocid=st …	0	0	
Today's MLB Picks: 7:05 PM EST - Chicago White Sox vs. New York Yankees - 18 PICKS AVAILABLE (2 FREE) - https://www. cappertek.com/todaysPicks.as p?d=mlb-baseball-betting-predictions-chicago-white-sox-vs-new-york-yankees-monday-april-17-2017&gameID=93814 …	0	0	
TRIVIA ANSWER: Mike Tresh played 10 years with the Sox and son Tom Tresh was a 3-time All Star for the 1960s Yankees . #CaptTrivia	0	0	
Top #MLB Pick 1: CHICAGO WHITE SOX vsNEW YORK YANKEES go with Over 8.5 make picks free: http:// bit.ly/qQqhb7	0	0	
Are any of my followers White Sox baseball fans, or specifically Philip Humber fans???	0	0	
Recap: White Sox end an eighteen inning scoreless streak with a 3-1 win against the Twins http:// greatlakesgro.com/avisail-garcia -white-sox-matt-davidson/ … pic.twitter.com/UFjaerTPGA	0	0	
Recap: White Sox end an eighteen inning scoreless streak with a 3-1 win against the Twins http:// greatlakesgro.com/avisail-garcia -white-sox-matt-davidson/ … pic.twitter.com/9VMVSoZahL	0	0	
Astros send Francis Martes, Kyle Tucker, James Hoyt and A.J. Reed to White Sox for Jose Quintana.	0	0	
Twins & Wild have loss five in a row combined when they score just one goal or one run.Twins 2-1 & 3-1 to White Sox -)Blues 2-1 OT-2-1 & 3-1!	0	0	
I found myself liking them versus some truly awful white Sox lineups. Got reminded yesterday how bad the bullpen still is though	0	0	
just found out I'm going to Cubs vs. White Sox for my bday	0	12	
White Sox Prospect Update: pic.twitter.com/v0xhW4js2a	26	83	
Garcia's 10th-inning homer leads White Sox over Twins 3-1 http://www. espn.com/mlb/recap?game Id=370416109 …	0	0	
Joe Mauer goes 1-for-5 vs. White Sox on Sunday http://www. fantasypros.com/mlb/news/11280 6/joe-mauer-goes-1-for-5-vs-white-sox-on-sunday.php … via @DannyJ23 #fantasybaseball	0	0	
Trout to White Sox for Moncada, Giolito, Kopech, and Quintana	0	0	
Los White Sox activaron de la lista de paternidad a Melky Cabrera. Willy Garcia regreso a triple A. #MLB	1	1	
WHITE SOX successfully upgraded Larry Schroeder(Star 2)! http:// fb.me/2SVaFe3Rc	0	0	
Pretty satisfied with the Chicago White Sox so far if we can hang around 500 all year I would take that	1	1	
Oh I agree. Just aggravating. The dodgers Red Sox and Yankees could be 0-162 and people would continue to talk about them	0	0	
It's bad enough we gotta deal with the fucking Bulls, Bears, and White Sox suckery in this city, we ain't letting the Blackhawks go to that	0	0	
2 tix for Chicago White Sox Vs. Cleveland Indians 4/22 (US Cellular) $29 http:// ift.tt/2pJxNil	0	0	
Red Sox championships since Cuomo took office - 1 Yankees /Mets Championships since Cuomo took office - 0 Coincidence?	0	0	
I'm wearing all Red Sox gear today. I just made heavy eye contact with someone wearing all Yankees gear. We just nodded	0	0	
RT ChicagoSports: Series preview: White Sox at Yankees http:// trib.in/2oEY5nZ	0	0	
ThreeGarcia outfield makes MLB history in 2-1 White Sox victory - Chicago Tribune http:// crwd.fr/2nVzUD6 pic.twitter.com/paIkOymRWa	0	0	
Indians are good obviously. But the White Sox and Twins both unimpressive and likely bottom of the division.Bullpen needs serious attention	0	0	
For 2017 Bowman IMO, Best teams for breaks are: Tier 1: Yankees and Braves Tier 2: Reds, Cubs, Red Sox Tier 3: Giants	0	0	
You have the white sox after the 3-9 cardinals? Seriously?	0	1	
White Sox : Carlos Rodon Continues to Recover from Bursitis #whitesox #cws #MLB http:// sport-ne.ws/41nx pic.twitter.com/HgEMBVbrG1	0	0	
The White Sox refuse to trade with the Cubs, brah.	0	1	
WHITE SOX successfully upgraded Caden Schneider(Star 9)! http:// fb.me/IP4J2tc0	0	0	
WHITE SOX successfully upgraded Caden Schneider(Star 9)! http:// fb.me/6VKuJEbsY	0	0	
Series preview: White Sox at Yankees http:// trib.in/2oEY5nZ	4	3	
http:// bit.ly/2oMMiEK GUARANTEED PICK - BY Johnny Wynn GAME: (961) Chicago White Sox vs. (962) NY Yankees DATE: 04/17 PRICE: $40.00	0	0	
WHITE SOX successfully upgraded Jimmy Fisher(Star 5)! http:// fb.me/1jz7vRjwW	0	0	
WHITE SOX successfully upgraded Howard James(Star 8)! http:// fb.me/7Q5ohJSYM	0	0	
1-4 yesterday, -5 units. For today : Grizzlies +11 -109, Flames -125 @Betdsi , Pirates +130, White Sox +144 , DBacks +145	0	1	
Who's ready for the Yankees to take on the White Sox tonight!!??	1	15	
Mickey Mantle made his MLB debut 66 years ago today with the NY Yankees in right field against the Boston Red Sox . http:// ble.ac/1SpUGhy pic.twitter.com/4OZzl0ahGb	1	7	
Thanks will go white sox	0	1	
NY Yankees LF Matt Holliday (back) is questionable tonight versus the White Sox .	0	0	
NY Yankees LF Matt Holliday (back) is questionable tonight versus the White Sox .	0	0	
White Sox @Yankees TRENDS pic.twitter.com/VgUXZAkfcI	0	0	
Chicago White Sox 1B Todd Frazier (illness) is questionable tonight versus the Yankees .	0	0	
Chicago White Sox 1B Todd Frazier (illness) is questionable tonight versus the Yankees .	0	0	
My work may be seen by some of my family back in Boston: Garcia's 10th-inning homer leads White Sox over Twins 3-1 http://www. bostonherald.com/sports/red_sox /2017/04/garcias_10th_inning_homer_leads_white_sox_over_twins_3_1#.WPTqvNjfGTY.twitter …	0	1	
Also in The Week That Were I write about Derek Holland, Jose Abreu, DRob and the anemic White Sox offense http://www. writesox.com/2017/04/the-we ek-that-were-in-white-sox-what.html …	0	2	
I fell in luv with a white Sox player yesterday. Love at first sight. And I Googled him and he's Venezuelan!!! Of course, meant 2 b	0	0	
Detroit Tigers vs. Chicago White Sox trip is June 4th! Cost is $60/person and the Mitchell bus will depart from... http:// fb.me/5KlQ4lGr4	0	0	
http:// ift.tt/2pa8Yjk White Sox vs. Yankees pitching matchups #NYCnowApp	0	0	
NEW POST - The Week That Were In White Sox : What Are We To Make Of James Shields? http://www. writesox.com/2017/04/the-we ek-that-were-in-white-sox-what.html … pic.twitter.com/Wnq1vDZh68	4	11	
For all you people telling me that the White Sox or the Pirates are better than the Cubs... ITS APRIL 17TH...	0	0	
MLB Cardinals -131 2u White sox +144 2u Cleveland -144 2u	0	2	
The similar strategies between the lowly White Sox and the champion Cubs (by @jaf78 ) http:// on.si.com/2pqATuX pic.twitter.com/TpY6UOdG0m	6	9	
We have @JeffPassan on now talking Cubs, White Sox , MLB http:// 670thescore.com/listen	1	0	
#sports - 2 New York Yankees vs. White Sox 4/17 Tickets - PADDED SEATS http:// dlvr.it/NvwZFs pic.twitter.com/TcYFYpaqcj	0	0	
Hoping the Yankees and Sox can rejuvenate the best rivalry in sports. A lot of young talent, would be fun for many years to come.	0	1	
White Sox reinstate Melky Cabrera from paternity list ahead of tonight's game at Yankees http:// cbsloc.al/2pafBCc pic.twitter.com/5wVguPwATy	0	3	
Yankees and Sox today! Slow start this year but looking a whole lot better!	0	0	
#Lastminute_us 3 New York Yankees vs. White Sox 4/17 Tickets - PADDED SEATS $12.00 (0 Bids) End Date: Monday Apr-… http:// ift.tt/2ptUOX8	0	0	
We play the White Sox today. So How?	0	0	
White Sox : Carlos Rodon Continues to Recover from Bursitis #WhiteSox https:// fanly.link/3f04793aa2 pic.twitter.com/1Fj31HwwzP	0	2	
the white sox wouldn't even be able to beat the slammers	3	4	
Twins turn to Santiago in rubber match vs. White Sox (Apr 16, 2017) | FOX Sports http:// rincon-sports.com/2017/04/15/twi ns-turn-to-santiago-in-rubber-match-vs-white-sox-apr-16-2017-fox-sports/?utm_campaign=twitter&utm_medium=twitter&utm_source=twitter … pic.twitter.com/dCDbKPFvZR	0	0	
Top #MLB Pick 2: CHICAGO WHITE SOX vsNEW YORK YANKEES go with #NEWYORKYANKEES (-143) make picks free: http:// bit.ly/qQqhb7	0	0	
They're the greatest team ever that was bought... well besides the Red Sox & Yankees who've won repeatedly	0	1	
Chicago White Sox moneyline +145.0 PICK DATA: http:// CappedIn.com/posts/159488/m lb/chicago-white-sox-vs-new-york-yankees-pick … @Wronglines On it? RETWEET #ChicagoWhiteSox	0	1	
southsideshowdown​.com >> White Sox : Carlos Rodon Continues to Recover from Bursitis http:// buzztap.com/-BHbn68	0	0	
Parley MLB PIRATA=GANAR WHITE SOX =GANAR MITAD DE JUEGO CUBS=BAJA DODGERS=NO 1ER INING #FelizLunes @CHUVIJIMENEZ pic.twitter.com/1DfZs1KvMm	0	0	
A rotação titular dos Red Sox decepcionam. Mas os Yankees surpreendem	0	1	
http:// bit.ly/2ohVqON GUARANTEED PICK - BY Mikey Sports GAME: (961) Chicago White Sox vs. (962) NY Yankees DATE: 04/17 PRICE: $30.00	0	0	
yankees gon give the sox a whooping of a lifetime this series	0	0	
Melky Cabrera, whose daughter Mianna was born Friday, returns today to the White Sox from the paternity list.	2	7	
I will not be in Minnesota. Keep checking http:// Indians.com for updates. Will be back on the beat for the @White Sox series. pic.twitter.com/smBElHvdVS	0	20	
As an Illinoisan that listens to @TMKSESPN I'm very much excited for the Sox vs Yankees series. Hoping both teams have continued success.	0	0	
http:// bit.ly/2oi1cj5 GUARANTEED PICK - BY R&R Totals GAME: (961) Chicago White Sox vs. (962) NY Yankees DATE: 04/17 PRICE: $30.00	0	0	
With Soto on DL and Willy Garcia back in minors, White Sox have two players on the active roster with a batting average over .250	0	0	
The White Sox have reinstated Melky Cabrera from the paternity list | http://www. thedailydugout.com/news/the-white -sox-have-reinstated-melky-cabrera-from-the-paternity-list/ …	0	0	
White Sox have one dude in the bullpen with an ERA above 2.00	0	0	
Contention... for the 2017 white sox ... nah	0	0	
Think about it, the White Sox won 2 of 3 games without Melky. He's back in the lineup today. You might as well just give us the trophy now.	4	39	
White Sox are 6-5. If u want a winning team.	0	1	
Quick Hits: Yankees , Braun, Bellinger, White Sox , Kang - https://www. mlbtraderumors.com/2017/04/quick- hits-yankees-white-sox-kang.html … @whitesox	0	0	
#MLB | Transmisión En Vivo | Chicago White Sox vs New York Yankees | #Baseball http:// sportsbetparlay.com/mlb-transmisio n-en-vivo-chicago-white-sox-vs-new-york-yankees-baseball/ … pic.twitter.com/10sNufnHOQ	0	0	
#WhiteSox - Melky Cabrera rejoins White Sox Monday #FANation http:// bit.ly/2pab1nz #fantasyalarm pic.twitter.com/PJCRx1Pjx5	0	0	
#WhiteSox - Melky Cabrera rejoins White Sox Monday #FANation http:// bit.ly/2pab1nz #MLB pic.twitter.com/PA4tIMcaOw	0	0	
#WhiteSox - Melky Cabrera rejoins White Sox Monday #FANation http:// bit.ly/2pab1nz #MLB pic.twitter.com/gz4dTLRIw8	0	0	
#WhiteSox - Melky Cabrera rejoins White Sox Monday #FANation http:// bit.ly/2pab1nz #FantasyAlarm pic.twitter.com/fbe2ZNKW7M	0	0	
#WhiteSox - Melky Cabrera rejoins White Sox Monday #FANation http:// bit.ly/2pab1nz #WhiteSoxLineup pic.twitter.com/W5O264qf1Z	0	0	
I can't wait for the Yankees vs Red Sox races for AL East Titles to heat up in a few years!	0	0	
Check out 1958 Unmarked Checklist Topps#256 Luis Aparicio Chicago White Sox Team Card Fair http://www. ebay.com/itm/-/14235231 5325?roken=cUgayN&soutkn=M0GGBC … via @eBay	0	1	
