
Is this a thing royals do now? Prince Charles must be secretly trying out some of the Aurigny Dorniers to follow the trend too https:// twitter.com/SkyNews/status /864963526976315392 	0	0	
Westchester Bakery Scores 'Home Run' With Cake, Cupcakes For Yankees http:// dlvr.it/P9b6j0 pic.twitter.com/p7QWCAxXLG	0	0	
Westchester Bakery Scores 'Home Run' With Cake, Cupcakes For Yankees http:// dlvr.it/P9b6hz pic.twitter.com/eBqKxoS6rT	0	0	
Westchester Bakery Scores 'Home Run' With Cake, Cupcakes For Yankees http:// dlvr.it/P9b6S1 pic.twitter.com/vRmNMrS1VG	0	0	
Westchester Bakery Scores 'Home Run' With Cake, Cupcakes For Yankees http:// dlvr.it/P9b6j1 pic.twitter.com/dLtmcH4W8s	0	0	
Westchester Bakery Scores 'Home Run' With Cake, Cupcakes For Yankees http:// dlvr.it/P9b6hy pic.twitter.com/HgSxx6Kyl9	0	0	
Westchester Bakery Scores 'Home Run' With Cake, Cupcakes For Yankees http:// dlvr.it/P9b6X3 pic.twitter.com/b8WzUYDwHZ	0	0	
Westchester Bakery Scores 'Home Run' With Cake, Cupcakes For Yankees http:// dlvr.it/P9b6Vr pic.twitter.com/t03a5twyDj	0	0	
Westchester Bakery Scores 'Home Run' With Cake, Cupcakes For Yankees http:// dlvr.it/P9b6Rw pic.twitter.com/ZpGOnnMN5P	0	0	
Westchester Bakery Scores 'Home Run' With Cake, Cupcakes For Yankees http:// dlvr.it/P9b6Vm pic.twitter.com/KpEp47BuEH	0	0	
Westchester Bakery Scores 'Home Run' With Cake, Cupcakes For Yankees http:// dlvr.it/P9b6S7 pic.twitter.com/hi5COssbZ6	0	0	
Westchester Bakery Scores 'Home Run' With Cake, Cupcakes For Yankees http:// dlvr.it/P9b6S5 pic.twitter.com/jUvyjvlDGG	0	1	
Westchester Bakery Scores 'Home Run' With Cake, Cupcakes For Yankees http:// dlvr.it/P9b6Vl pic.twitter.com/Ya4Va6krK2	0	0	
Westchester Bakery Scores 'Home Run' With Cake, Cupcakes For Yankees http:// dlvr.it/P9b6Ht pic.twitter.com/5xTcme3NHi	0	0	
Westchester Bakery Scores 'Home Run' With Cake, Cupcakes For Yankees http:// dlvr.it/P9b6Vq pic.twitter.com/TipwiYprc6	0	0	
Westchester Bakery Scores 'Home Run' With Cake, Cupcakes For Yankees http:// dlvr.it/P9b6Rn pic.twitter.com/4GQKrDowHj	0	1	
Westchester Bakery Scores 'Home Run' With Cake, Cupcakes For Yankees http:// dlvr.it/P9b6S3 pic.twitter.com/LzxaRB5uD7	0	0	
Westchester Bakery Scores 'Home Run' With Cake, Cupcakes For Yankees http:// dlvr.it/P9b6Hm pic.twitter.com/kttnVulgrr	0	0	
Westchester Bakery Scores 'Home Run' With Cake, Cupcakes For Yankees http:// dlvr.it/P9b6Hq pic.twitter.com/JKt9KxHRdV	0	0	
Westchester Bakery Scores 'Home Run' With Cake, Cupcakes For Yankees http:// dlvr.it/P9b6Hj pic.twitter.com/1EgNvK9myR	0	0	
I added a video to a @YouTube playlist http:// youtu.be/TxDHuLh9VvU?a CAN MICKEY MANTLE HELP THE YANKEES TODAY!? | MLB The Show 17 Blast From	0	0	
Steinbrenner pleased with Yankees ' start, doesn't want to trade prospects http:// dlvr.it/P9b6FW pic.twitter.com/mnHklFocZS	0	0	
Westchester Bakery Scores 'Home Run' With Cake, Cupcakes For Yankees http:// dlvr.it/P9b68K pic.twitter.com/GA9qX2oSFB	0	0	
Jeter	0	0	
Westchester Bakery Scores 'Home Run' With Cake, Cupcakes For Yankees http:// dlvr.it/P9b68S pic.twitter.com/nC730j4N01	0	0	
Westchester Bakery Scores 'Home Run' With Cake, Cupcakes For Yankees http:// dlvr.it/P9b68G pic.twitter.com/HtGyXGgrMI	0	0	
Westchester Bakery Scores 'Home Run' With Cake, Cupcakes For Yankees http:// dlvr.it/P9b68X pic.twitter.com/3m9D8dOAkd	0	0	
Westchester Bakery Scores 'Home Run' With Cake, Cupcakes For Yankees http:// dlvr.it/P9b68V pic.twitter.com/sX4HkDmMTx	0	0	
Peekskill Bakery Scores 'Home Run' With Cake, Cupcakes For Yankees http:// dlvr.it/P9b68s pic.twitter.com/HWDs3keOqg	0	0	
Westchester Bakery Scores 'Home Run' With Cake, Cupcakes For Yankees http:// dlvr.it/P9b5v1 pic.twitter.com/861VvD5MMT	0	0	
Westchester Bakery Scores 'Home Run' With Cake, Cupcakes For Yankees http:// dlvr.it/P9b5sw pic.twitter.com/g5nzgnT4EE	0	0	
Westchester Bakery Scores 'Home Run' With Cake, Cupcakes For Yankees http:// dlvr.it/P9b5j1 pic.twitter.com/7Oof5Ah5dR	0	1	
Thank you Derek jester #2	0	0	
Two of my all time favorites! Thanks for all of the smiles and joy you provided me and all Yankee fans!	0	0	
#BeRoyal #TakeTheCrown #KCMO #Tickets ERIC HOSMER Kansas City Royals Bobblehead ASG MVP 2017 Season Ticket Hold... http:// ow.ly/mV6v50byFyS	0	0	
Stampede 12u Blue (4) at Omaha Royals (0) - FINAL https:// goo.gl/bXsNNk	0	0	
MOROCHA Yankees Team Total over 4 Boston Red Sox f5	4	2	
Best Teams Of #Baseball s 2015 Season Are Bums In 2017 http:// 53eig.ht/2rrNxrT #Royals #MLB #Mets #Cubs #LCS #BLueJays #Dodgers #Cardinals	0	0	
Yankees entrou em campo!	0	0	
#Terriers o #Royals acompaarn a @NUFC y @OfficialBHAFC a la @premierleague 2017/18. #Championship #PlayOffFinal https:// twitter.com/SkyBetChamp/st atus/864960466573037568 	0	0	
3-4 gan en los penaltis el Huddersfield de Wagner al Sheff Wed. Royals o Terriers a un partido de subir a Premier League. https:// twitter.com/SkyBetChamp/st atus/864960466573037568 	0	0	
I think you can find a more unattractive photo!	0	1	
The Royals Hosted A Tea Party For The Most Heartwarming Reason http:// s.einnews.com/hb6IFcns_K	0	0	
i didn't know john elway was drafted by the yankees .	0	0	
Bro if you see Regan tonight ask her if still want those Royals	0	0	
MLB CHEAT SHEET: Michael Pineda takes on the Royals in a favorable pitchers park. Is he the Pitcher to Build Around? http:// dkng.co/2pVo1df pic.twitter.com/aCk7jC3HJ8	0	2	
MLB Sharp Action CIN-CHC under MIL-SD under BAL-DET over Yankees NYY-KC over BOS-STL over	3	9	
Assume he was drafted by the Dodgers, had to play 2B for Arizona for two years, was DFA'd and then joined Yankees as asst hitting coach.	0	0	
@Royals How do I sign up to run in the live hot dog derby on Friday nights at the K?	0	0	
$$$ #FreePlayAlert $$$ #2Units #Royals #MLB #FirstFiveInnings #Banger #BeatingVegas365 #Hawaii  https://www. instagram.com/p/BUNZyr_gT-d/	0	0	
Did u catch any of the Royals games?	0	0	
2003 ALCS, Game 7: Red Sox at Yankees - Baseballs Best |... ###Sports #Sports https:// goo.gl/fb/OUsy6I	0	0	
Yankees : This witness is excused, your honor http:// yanksgoyard.com/2017/05/17/yan kees-sabathia-just-fine-3/ 	0	1	
Yeah.... Yankees are off to a good start and the royals left their heads up their ass	0	1	
Indeed. It's like they're Yankees fans expecting people from Boston to support their bias. You'd think the election would've opened their	0	1	
And he also won a MVP while on the Yankees too	0	0	
If #Yankees score 7 runs every game, we won't need a #Closer ...	0	0	
Here we come Royals ! #raisedroyal pic.twitter.com/H6XiYpEbvL	0	2	
Easy game for the Royals . Who even are Huddersfield?	0	0	
Needs music... Some French Quarter Dixieland Band playing Battle Hymn of the Republican Yankees	0	1	
MLB Picks - #Nationals #detroittigers #BlueJays #RedSox #Rangers #Cubs #Rockies #Yankees #WhiteSox #Mariners #Brewers (11 picks, 5 upsets)	0	0	
Loving it....I'd be loving it even more if they had split the series with Houston... oh well...	0	0	
I liked a @YouTube video http:// youtu.be/TxDHuLh9VvU?a CAN MICKEY MANTLE HELP THE YANKEES TODAY!? | MLB The Show 17 Blast From The Past Ep.	0	0	
Impressive! Considering he is a @RedSox ! Actually great job @joshbeckett for charity, where @RedSox and @Yankees come together https:// twitter.com/grantboone/sta tus/864615943862878209 	0	0	
Qu placer me da cuando los Yankees llenan de balas y bombas a los talibanes rabes	0	1	
Best result possible for the royals . Who are Huddersfield? #bbcefl	0	0	
After selling Babe Ruth to the Yankees , the Red Sox did not win a World Series for 86 years. This was known as the Curse of the Bambino.	0	0	
Named after 2 legendary @Yankees Anddrew is looking for some help please consider donating http://www. gofundme.com/2qcp89w	0	0	
Let's Go Royals ! #raisedroyal #djminja https://www. instagram.com/p/BUNZbq0F_pG/	0	0	
OVERLAY ALERT! Double Up Weds at @FanDuel Play an exclusive #DFS TRUE double up contest just for #FANation members. http:// bit.ly/2gWodYQ pic.twitter.com/WCyOPDtdqX	0	0	
Special place in hell for them.	0	0	
Paul O'Neill catches the final out of David Wells perfect game! (May 17, 1998) #Yankees #MLB http:// m.mlb.com/video/topic/64 79266/v2685733/minnyy-the-last-out-of-david-wells-perfect-game 	11	20	
When these 2 start wearing @Yankees pinstripes in 2 years #Yankees #NYY pic.twitter.com/mhU9vfG8SN	9	3	
Kyle Hendricks snuck into the Yankees clubhouse and is playing against himself https:// twitter.com/andrewmarchand /status/864953783792672777 	5	12	
Im a huge yankees fan.	0	0	
It really broke my heart when royals shrunk their wings and increased the prices.	0	1	
3 players the Yankees could target in free agency https://www. thescore.com/news/1284201 via @theScore	0	0	
3 players the Yankees could target in free agency http:// thesco.re/2rgmSRo pic.twitter.com/4iNpPYzYJ6	0	0	
#YankeesBisbol van en busca de amarrar la serie en Kansas City con Michael Pineda en la loma esta noche. Previa http:// atmlb.com/2qSQmFa pic.twitter.com/JxJksm3dNo	13	18	
The Royals Hosted A Tea Party For The Most Heartwarming Reason http://www. huffingtonpost.com/entry/the-roya ls-hosted-a-tea-party-for-the-most-heartwarming-reason_us_591c918ce4b03b485cae1388 	3	2	
Two of my all time favorites!	0	0	
No evidence. No case to be built. No obstruction of justice. We will see.. I cannot wait. Even pelosis crazy drunk ass agrees there.	0	1	
#Royals - Ian Kennedy likely to start Saturday #FANation http:// bit.ly/2qxK4rI #fantasyalarm	0	0	
#Royals - Ian Kennedy likely to start Saturday #FANation http:// bit.ly/2qxK4rI #MLB	0	0	
#Royals - Ian Kennedy likely to start Saturday #FANation http:// bit.ly/2qxK4rI #MLB	0	0	
#Royals - Ian Kennedy likely to start Saturday #FANation http:// bit.ly/2qxK4rI #FantasyAlarm	0	0	
#FRESHSPORTS 19 years ago today David Wells pitched a perfect game for the Yankees , while hungover. The Oral History: 	0	0	
"Top prospects" is a little vague. It could mean guys ranked in MLB top 100, Yankees top 5 or 10 or all 30 prospects.. maybe only 2 of top 3	0	0	
Why in the world is the NYC Puerto Rican Day Parade honoring a terrorist? And why are @ATT @CocaCola & @Yankees sponsoring this parade?	0	1	
19 years ago today David Wells pitched a perfect game for the Yankees , while hungover. The Oral History: http:// trib.al/pCESYXp pic.twitter.com/41eqYsy4Ow	144	290	
Tonight picks Yankees -1 110 to win 100 Rangers ml 128 to win 100 Cards ml 100 to win 100 Tigers -1 110 to win 100 Whitesoxs ml 50 to win 79	0	0	
Gracias @NewEraMx ! Se rifaron con mi gorra de los @Yankees #ThisIsthecap pic.twitter.com/TKwBg6gjJM	0	1	
For what it's worth, Seth Maness has options remaining. He'd be my guess on who the #Royals drop for Kennedy.	0	1	
*panics* Ugh...How 'bout those Yankees ?!?!	0	0	
Arod makes his broadcasting start with Royals / Yankees https:// twitter.com/foxsportspr/st atus/864901384365387776 	0	0	
*Spanish royals attend Princess Sofia's first communion http:// dailym.ai/2rpYSYy via @Femail	0	0	
As a Royals fan, we should rebuild, not make the postseason.	0	0	
As much as I hate the @Yankees , no one will ever be able to top @MarianoRivera entering games to #EnterSandman by @Metallica . Too perfect	0	0	
5/17 Yankees Lineup Vs KC: Gardner LF Sanchez C Holliday DH Castro 2B Judge RF Headley 3B Gregorius SS Hicks CF Carter 1B Pineda P #NYY	0	0	
Thanks for the follow @gabrielnyy right back at you. LETS GO #YANKEES http:// bxzoo.com	1	1	
So, Jason Vargas has been good at pitching so far this season... #Royals #RaisedRoyal pic.twitter.com/d48KGrF0qz	0	1	
I got royals too pic.twitter.com/jefi3MrSpv	1	1	
Liberalism is a mental disorder. They can't help it	0	0	
Yankees have to win tonight. No excuses.	0	0	
Thanks for the follow @yankeefansource back at ya! LETS GO #YANKEES http:// bxzoo.com	0	0	
Now that's a solid lineup top to bottom.	0	1	
Interesting arm for #Royals ext spr team is Janser Lara. FB 93-97, easy delivery, has touched 100 previously. Not much command of offspeed.	1	0	
They will fit it in. Twins cant keep on cancelling games just to stay in first place. My Yankees dont cancel games that much!	0	0	
ABSOLUTE FUCKIN OUTRAGE HUDDERSFIELD VS READING IN THE FINAL #htafc #royals	1	4	
So Jason Vargas has been pretty solid so far... #Royals pic.twitter.com/MSec4Kqc0c	1	3	
Thanks for the follow @nateMSY back at you! LETS GO #YANKEES ! http:// bxzoo.com	0	1	
Add like 3 more walks and that is every start AJ made for the Yankees besides the 2009 playoffs	0	1	
Ditto. Breds or royals for me	0	0	
Can the ace of the @Royals @duffkc41 lead them to the #postseason this year? pic.twitter.com/C1Dtkic5rt	2	12	
Yankees may toss them both maxes then whoever says yes 1st comes the other deal gets taken off the table	0	1	
Thanks for the follow @Yankeessman11 right back at you! LETS GO #YANKEES !! http:// bxzoo.com	0	0	
Who's going to the #Royals game tonight? #hashtag	0	0	
Buenas tardes, el patn debut en 2008 con @Yankees no con Boston. Saludos.	0	0	
Harvey will go to the Yankees and miraculously recover.	0	1	
Justin Moulds comes in to pitch the 8th for your Royals .	0	1	
MLB trade rumors: Yankees ' Yu Darvish pursuit key to landing Japan's Babe Ruth? http:// s.nj.com/4u7rPTF	0	0	
My first ever game watching the Royals was at Elm Park in 1982 vs. Huddersfield. A lot has changed over the years but not my support. #URZ ! https:// twitter.com/ReadingFC/stat us/864956656567951360 	0	0	
Thanks for the follow @CRiley1111 better be at Kauffman Stadium tonight... LETS GO #YANKEES ! http:// bxzoo.com	0	0	
I had no idea @RealMikeWilbon was this clueless about the MLB. How are the @astros not separated from the Yankees , Rockies, and Orioles? pic.twitter.com/wVwTSShxsA	0	2	
#Yankees Found a 1st Baseman https:// twitter.com/nashvillesound s/status/864959019450019842 	0	0	
Buy or sell? Steinbrenner says Yankees will be 'active' in free agency and trades http:// dlvr.it/P9Zs2B pic.twitter.com/QHQHvvXVYK	0	0	
con los que hay se arreglan. Adems, si ganan suficientes bancas, impondrn 2 bases militares yankees en Argentina	0	0	
Cummings lack of brain cells is obstructing anything he does	0	0	
Big Mike, let's go!	0	0	
In 2015 Alex Rios said the Royals "need to start playing baseball like civilized people. If the new rules promote civilized behavior, good.	0	0	
We just whipped the Yankees ass in their stadium how stupid is that	0	2	
@Yankees _Beisbol @Yankees esto es Venezuela #SOS	0	1	
End 7: Knights 9, Royals 9.	0	2	
Ned Yost says everything went well with Ian Kennedy today. He appears set to start Saturday, barring any surprises. #Royals	8	42	
By "baseball" it sure seems like you meant " Yankees fans" https:// twitter.com/theatlantic/st atus/864958886092181505 	0	0	
Thanks for the follow @_dactyl_ Back atcha.. LETS GO #Yankees http:// bxzoo.com	0	1	
No one doubts the Habs history...will always be the Yankees of Canada...but in hardest to do, 80s 4 in a row or Oilers 4 in 5 are ^	0	0	
Top 15 richest royals in the world and their worth - The amount of money they have is crazy! (With Photos) - http:// ow.ly/iW3l30bNTyG	0	0	
Cueto throws 2-hitter as Royals open 2-0 lead #Cueto https:// checkthescience.com/news/2800-cuet o-throws-2-hitter-royals-open-2-0-lead 	0	0	
Ahora un cana no puede entrar a un edificio PBLICO a buscar a un delincuente sin una orden judicial. Muchas pelculas yankees , chicos. https:// twitter.com/infobae/status /864942612951838720 	0	0	
How can a baseball team have played 7 more games than other teams in the same division? Rays have played 43 to the Yankees 36.	0	1	
Martin I swear it just winked at me and asked me to braise it! I just need some Jersey royals and I'm all set.	0	0	
Up eh Reading!!!! Mon the Royals	0	1	
If this idiot knew the law he wouldn't look so stupid	0	0	
The Yankees ' closer is on the DL. Today's injury breakdown is on Chapman's Rotator Cuff strain. http:// bit.ly/2rguRxV	1	1	
MLB Game Simulator: 8:15 PM EST - New York Yankees vs. Kansas City Royals - SIMULATE THIS GAME NOW: https://www. cappertek.com/xSimulator.asp ?n=95128 	0	0	
Let's do this #Yankees https:// twitter.com/yankees/status /864948218953596929 	0	0	
The #Royals should #DoABurger	0	3	
Thanks for the follow @AkaTheYoungMan back at ya! LETS GO #Yankees http:// bxzoo.com	0	0	
Forget #SecretEmpire . the Marvel comic to pick up today is #Royals by @Al_Ewing . This man is on Fire!	0	2	
In those days Now quite easy to get sent off Hence Royals down to 10 men on Saturday at Fulham Captain Paul McShane sent off for late tackle	0	1	
Thought about him too. But he actually has a pretty good track record against the Yankees , which surprised me.	0	0	
Gonna have to get you a Yankees jersey though	0	0	
best picture on internet today. This is not Fake News 2015 W.S Champs K.C Royals	0	0	
We stock Homegrown, Cornish New & Jersey Royals ;) RT @CynShine_ : Steak, scalloped potatoes, and corn on the cob for dinner tonight	1	2	
MLB trade rumors: How Yankees ' Hal Steinbrenner feels about dealing prospects http:// nj-ne.ws/JsVJ4n3	0	0	
The Astros are to this era's Yankees what the Mariners were to us in the Mid-90's... Keuchel = RJ, etc	0	1	
From the NYT "Trumps Statements Are Not an Obstruction of Justice"	0	1	
@MagicRockBrewCo tap is probably my favourite awayday pub of all time. Come on you Royals ! #pnefc	0	2	
#baseball Cool baseball site #Yankees #Orioles #MLB #website http:// tom-gillispie.blogspot.com/2010/09/cool-s ite.html 	0	0	
Royals , This is a notice that there are no classes today at John Burroughs Middle School.	0	0	
Just for you @ChrisSim93 Up the royals	0	1	
 part un de The Royals	0	0	
22 wake ups until I'm sitting at #TheK watching baseball. @Royals	0	0	
Wilbon's fatass needs to get off the air. "Astros aren't better than the Nationals or Yankees " stfu	0	3	
Chipper in '99 single-handedly drug a Braves team, that got wrecked by the Yankees in the WS, but hit .319, 45 HR, 110 RBIs, and 25 steals.	0	0	
Trumps statements aren't obstruction of justice https:// mobile.nytimes.com/2017/05/17/opi nion/trumps-fbi-comey-statements-are-not-an-obstruction-of-justice.amp.html 	0	0	
Hal Steinbrenner wants Yankees to hold onto top prospects http:// nydn.us/2rgxkbE	1	1	
BP from @SalvadorPerez15 #RaisedRoyal pic.twitter.com/DPekEABPgS	29	235	
They better play. I aint got shit going on tonight and the Yankees game isnt on tv	0	0	
Mandei o famoso Royals pic.twitter.com/n2gB73aizZ	0	1	
And we'll never be|royzls ( royals )	0	0	
http:// bit.ly/2rslKYo #freepick #MLB 05/17 (965) NY Yankees v. (966) Kansas City | NY Yankees -115 #sportsbetting	0	0	
#49erFaithful Royals , Vargas to take another shot at Yankees ... [FOX] #NinerFam #NinerGang #49ers http:// dld.bz/fHztb	0	0	
Today's lineups. #Royals pic.twitter.com/jDT2D3XvBc	0	2	
That's awesome!	0	0	
@InterCityFFC had to follow another royals fan!!!	0	0	
ai que sdds de the royals , nunca mais eu vi	0	0	
Back off the mighty Royals mate	0	0	
Dumb. There isn't even circumstantial evidence. Even if Trump said what they claim it's not obstruction. Just dumb liberals having a hissy	0	3	
Northern Weirdos are coming for u Southern Royals #tinpotplayoff	0	0	
@air_inkellz @BevUhLey_JO @joemo_63 @EliasSpurling showing some nursing alumni pride!	0	5	
The number one most derogatory term you can use in Massachusetts: Yankees .	0	0	
Yeah, that Yankees hat! What were we thinking!	0	0	
Let's just say I like sports, and i'm a fan of many teams!	0	0	
Hal Steinbrenner wants Yankees to hold onto top prospects http:// nydn.us/2rgxkbE	9	21	
Game 37: Yankees at Royals , 8:15 p.m. http:// dlvr.it/P9ZjLX #Yankees via @SNYtv pic.twitter.com/srGZ3KJDue	0	1	
Armed Robbery stealing St Louis IX crowns for covalent bond brothers gamer prizes? Kill the royals & kill the wealthy? Revolution destiny?	0	0	
Focused on 2017, Royals  Dayton Moore in no rush to sell off pieces http://www. kansascity.com/sports/mlb/kan sas-city-royals/article150943122.html#storylink=rss  pic.twitter.com/WbP6JnFLGc	0	1	
#SWFC didn't deserve it over two legs. Good luck to #HTAFC in the final- every chance against average #Royals . Carlos needs moving on.	0	2	
The Royals	0	0	
My grandparents were from 'Uddersfield. Going to be a great day out on May 29th for the Royals & the Terriers #200mill	0	1	
kansas jayhawk shirt with a Missouri Royals hat. Classic ku fan.	0	2	
Steinbrenner will consider adding; won't deal top prospects: NEW YORK (AP) - The Yankees may be buyers, not http://www. washingtontimes.com/news/2017/may/ 17/steinbrenner-will-consider-adding-wont-deal-top-pr/?utm_source=dlvr.it&utm_medium=twitter  pic.twitter.com/NKhu7loLwY	0	0	
Vargas is 0-5 with a 6.53 ERA against us	0	4	
Huddersfield or Reading? Got a feeling it will be the Royals	0	0	
When Steinbrenner would think about cashing in Yanks phenoms http:// dlvr.it/P9ZfYc #yankees #nyy #mlb pic.twitter.com/XAOyzgV4SF	1	1	
Nike Air Jordan 1 High Royals Sz 10.5 NWB http:// ift.tt/2rsku7o	0	0	
Buy or sell? Steinbrenner says Yankees will be 'active' in free agency and trades: Owner Hal Steinbrenner said the http:// dlvr.it/P9Zfdp	0	0	
I've been thinking about it a lot since last night's win.. It's not like the Yankees lineup is a breeze, let's be honest	0	0	
I like the line up , but I would switch hicks with headley.	0	3	
Washington and yankees just as good if not better??	0	0	
the build up to this final now is going to feel like forever, up the royals #ReadingFC	0	4	
Got to get a Yankees cap	0	0	
Either way - could be a nice problem for the Yankees to have.	0	1	
I must confess, the final teams going to Wembley were not who I expected them to be! now let's smash the Royals !!	0	0	
LOL! Ever heard of bulding a case beyond circumstantial evidence? He wa a building on a obstruction case. That's how it works	0	0	
S quero saber do resultado do jogo hoje.	0	0	
Today In 1951: #Yankees rookie Mickey Mantle (#6) slides into third - tagged out by the #Indians Al Rosen (#7) @UniWatch @PhilHecken #MLB pic.twitter.com/RZe6puWQDO	8	18	
@kat88RFC Royals wil win at Wembley I hope	0	0	
@RealMichaelKay do you think the yankees could get gerrit cole for frazier,mateo and/or sheffield?	0	0	
Too right - looking forward to joining the Royals throng on the 29th. Pleased for Huddersfield but hope we do the biz	0	0	
The speech alone ought to be some kind of gross insult, but odds are sadly he grabs a wife of one of the royals .	0	1	
#MLB  #Cubs (-1)  (O 8) #Twins  #Yankees (-132)  #WhiteSox (+1)  (O 7) #Padres	0	0	
Si Kermorgant marca en Wembley, me tio el pelo de azul! #Royals	0	0	
Nike Air Jordan 1 High Royals Sz 10.5 NWB http:// ift.tt/2pVcMl2	0	0	
Hard luck to the Cottagers & Owls. The Royals and Terriers will play-off for a place in the Prem.	2	16	
I really fucking hope Reading win the play off final #Reading #htafc #royals	0	1	
Jason Vargas, invicto en sus ltimas 10 aperturas en casa, se enfrentar a los Yankees . Previa http:// atmlb.com/2rsCIpu #LosReales pic.twitter.com/rtYBva5BqP	1	2	
seriously though, that's like some despicable #Astros shit right there Imagine if the #Yankees tanked a season	0	0	
weather that may help some runs to score Cubs 21mph out to CF 79* Cards 20mph out to LF 80* Royals 22mph out to LC 78* all may have rain	0	0	
@1karenannwalker Royals v Huddersfield town Play off final wow xxx xx	1	0	
The whole club is buzzing #royals #readingfc #ChooseSpeed #PlayLOUD @pumafootball https:// twitter.com/readingfc/stat us/864941845805056001 	0	0	
Wonder why if he's so "guilty" Comey didn't take swift action? That's the real obstruction of justice. Wait til fired then release.	0	1	
I have no friends in Kansas City that will go to Royals games with me.	0	1	
So it's the Royals v the Terriers on the 29th	0	0	
@FIVEpicksSPORTS Hermano, si juego el Runline de los Yankees de -1.5 que tienen que hacer los yankees ?	0	0	
From our seat at the press box at Kauffman stadium, Royals warming up. Yanks vs Royals 7:15pm https://www. instagram.com/p/BUNWmZyhBLJ/	0	0	
We may or may not be royals , you decide. #royals #lorde https://www. instagram.com/p/BUNWkzoBqpq/	0	1	
That was a great win. Are you a big Yankees fan?	0	0	
YANKEES BEAT ROYALS 7-1 BEHIND CC & RIGHT THE SHIP (REACTION): http:// youtu.be/MLn66PNBJUA?a via @YouTube	0	0	
@SportsFunhouse 2 do a show like his correctly, u have to watch every Yankees , Mets & Knicks, Nets & Giants, Jets & Rangers & Islanders game	0	0	
I wonder how many of those 29 teams are Yankees and how many are Astros. Lol.	0	1	
Hear #Royals manager Ned Yost RIGHT NOW on #TheDrive as he addresses the media out at The K.	0	3	
Circus??? Glass duo??? You gotta be either a red sox or yankees fan.	0	0	
well... all royals aren't we? #lufc	0	0	
Hal Steinbrenner is enjoying seeing the #Yankees  young talent produce this season | @DPLennon http:// nwsdy.li/2rsrWzz pic.twitter.com/2fqNEbvoMF	1	1	
It's a start that you have to just sit back and enjoy. #Yankees http:// bit.ly/2pKIHZr	0	0	
Huddersfield vs reading in the playoff final, Love to see both of them in the Premier League, it'd be amazing if Town made it #HTAFC #royals	0	1	
Royals eSports vs safe G | Best of 1 GBs: http:// youtu.be/SNc10yrftas?a via @YouTube	0	0	
Aaron Judge has been crushing it this season! #PinstripePride #Yankees #NYY #MLB #baseball #AaronJudge #AllRise pic.twitter.com/EJP1gTQju8	0	0	
Hola Don JCB. Hoy algn canal va a pasar el juego Yankees vs Royals ? Gracias. #BabyBombers #GoYanks	0	0	
It's a start that you have to just sit back and enjoy. #Yankees http:// bit.ly/2pKwgwQ	0	0	
Nike Air Jordan 1 High Royals Sz 10.5 NWB http:// ift.tt/2pVcMl2	0	0	
I liked a @YouTube video http:// youtu.be/TxDHuLh9VvU?a CAN MICKEY MANTLE HELP THE YANKEES TODAY!? | MLB The Show 17 Blast From The Past Ep.	0	0	
I like that	0	0	
Not really, considering the #Royals were godawful nearly my entire life. https:// twitter.com/fivethirtyeigh t/status/864946757561720833 	0	1	
C'mon the Royals !	0	0	
Which people do not need them exactly? Hard working? The more you're paid the less work you actually do, the Royals being a case in point	0	7	
