
ATS Stats Forecast: NYY 5.8 - K.C. 3.9 - Generated from 40 Previous Games #Yankees #Royals	0	0	
Kate Middleton Is Worried Prince George & Princess Charlotte Won't Behave On Pippa's http:// dlvr.it/P9WJH3 #Royals _Royce #Kate_Middleton pic.twitter.com/ANNAkW98qU	0	0	
No double play means no #royalmcdouble on May 17th. Maybe tonight game 2 against the stupid Yankees .	0	0	
Nice win	0	0	
Or as Jeff Sessions remember, The day the Yankees won.	0	0	
@revistafucsia menos es ms que tal las fotos ROYALS espantosas por favor hay que tener buen gusto para publicar en una revista	0	0	
quando royals csg te fazer chorar to rindo de nervosi	0	0	
. @M_G_Baseball wins 13-6 to move on to face HIU Royals at 3PM today, Knights will have to defeat HIU twice to reach the Nat'l Championship	5	4	
Nvm about Tanaka, he's signed through 2020	0	0	
New York Yankees Clean Up Cap - https://www. sal7.com/product/new-yo rk-yankees-clean-up-cap/?attribute_pa_color=23&attribute_pa_size=one-size  pic.twitter.com/UO3ar4U9oN	0	0	
1. The Blacklist 2. Gilmore Girls 3. The Royals 4. Grey's Anatomie 5. House of Cards #MeineFuenfLieblingsserien	0	3	
And he was worse than Kei Igawa on the Yankees	0	0	
BBCSport: Reading will be watching this one with interest. Who will play the Royals in the #Playoffs final? #SHE  https:// twitter.com/BBCSport/statu s/864908344485703681 	0	0	
@revistafucsia quien les dijo a ustedes que las fotos de ROYALS son bonitas?ni los paisajes ni la ropa ni las modelos nivel maquillaje fatal	0	0	
Yankees working to fix their Tanaka problem http:// dlvr.it/P9WG0S #Yankees via @SNYtv pic.twitter.com/7yms92NmKN	1	0	
Picks for today: 1U rangers phillies o10.5 (-110) 1U Yankees RL (120) 0.5U pirates ml	0	0	
So nice of Yankees to steal their OF dimensions.... https:// twitter.com/jimmyleiderman /status/864908731200528384 	0	0	
New York Yankees moneyline -126.0 PICK DATA: http:// CappedIn.com/posts/174225/m lb/new-york-yankees-vs-kansas-city-royals-pick  @TheSportFellas On it? RETWEET #Yankees	2	3	
#Yankees may have an answer to Masahiro Tanaka's problems More here: http:// bronxpinstripes.com/news-rumors/ya nkees-may-have-an-answer-to-masahiro-tanakas-problems/  pic.twitter.com/Ht1KYatbxP	2	14	
celtics yankees and chiefs fan? Was this guy just throwing darts at a map to pick his teams?	0	6	
Hola Alejandro, no haba visto tu mensaje hasta ahorita que entr, una disculpa. Puse un dato sobre el debut de Velzquez 	0	0	
Really proud of our softball team. Our girls are getting stuff done! Go royals .	2	7	
A Royals baseball cap.	0	0	
Born 5/17/48 Carlos May OF MLB 1968 - 1977 (White Sox, Yankees , Angels) 2-time All-Star 1969 1972 http://www. klmitchell.com #baseball pic.twitter.com/8pPQAFnxZv	2	3	
Showing our love for our @Royals . Its Tourism Day at the K. Come find us! pic.twitter.com/fo1yUMGfDX	2	6	
Derek Jeter New York Yankees T-Shirt Official MLB => http:// crwd.fr/2qsn7rO <= #buyitnow #sports #baseball #newyorkyankees #Jeter pic.twitter.com/fuwMwvwQGc	5	1	
@CMPunk Phil fuck ur cubs maybe u get another 100 year curse . lets go royals	0	0	
4 Tickets New York Yankees vs. Baltimore Orioles 6/9/17 Yankee Stadium: $120.00 End Date https:// goo.gl/fb/anxtSG	0	0	
Royals were going to pick any of these pitchers available-Cole, Hultzen, Bauer or Bundy. All were gone. Starling was a stud--solid pick.	0	0	
They said the same thing after Lou Gehrig passed away. There will be another one... when the time is right.	0	1	
Sadly we often miss the excitement of these common enchantments looking in anticipation for the high magic.	0	1	
#sportsbiz #sports #broadcasting #yankees #mlb #FoxSports https:// twitter.com/richarddeitsch /status/864902210114768896 	0	0	
New York Yankees Clean Up Cap - https://www. sal7.com/product/new-yo rk-yankees-clean-up-cap/  pic.twitter.com/9TnP0tZKn9	0	0	
It's taking all the effort in the world for me to not gloat about the Yankees being in first place....but they in first place y'all. 1st.	0	1	
Reading will be watching this one with interest. Who will play the Royals in the #Playoffs final? #SHEHUD & http:// bbc.in/2rrCP4I pic.twitter.com/P6uA3DOll9	11	37	
Celtics Chiefs Yankees Fan. https:// twitter.com/MylesJ2b/statu s/864625957285580804 	0	0	
To last ever New York @Yankees to wear No. 2, AllianzGI salutes Derek Jeter and the retiring of his number. @MLB #NYY pic.twitter.com/MasspxnPl8	0	0	
It's a wonder the Yankees were never arrested for the robbery they pulled on the Indians to get Nettles.	0	0	
I think of people from Jersey who drove out to the Bronx to see the Yankees when the place was literally on fire. St. Pete has no excuse.	0	1	
Any Yankees fans that can help me assimilate to the culture the pirates don't spend enough money for me to like them anymore	0	0	
This is how royals spend a Wednesday afternoon in London. . . #crown #royal #filter #selfiewednesday #selfie #london #rain #afternoon #mood  pic.twitter.com/BYOOzvAORL	2	0	
I fmtjw.	0	0	
Ma l a it good	0	0	
Bases Are Loaded: Pete Grays Leads St. Browns Over The Yankees http:// basesareloaded.blogspot.com/2016/05/pete-g rays-leads-st-browns-over-yankees.html?spref=tw 	1	0	
Tbh with the way vp play online, royals could beat them	0	0	
I mean anyone who can throw a ball across the plate can do well against the royals . Tomlin needs to go the bullpen ASAP.	0	1	
Heeeyy my letter got printed in Royals #3 #inhumans	0	5	
Staten Island Yankees lower advance ticket prices and online ticketingfees http://www. pinstripepower.com/2017/04/staten -island-yankees-lower-advance-ticket-prices-and-online-ticketing-fees/ 	0	0	
That would be so sweet - I'd be the envy of the neighborhood! And, the best way to visit SoCal is for fun! Thank you! #RaisedRoyal	0	3	
As a non Yankees fan it's amazing how likeable and well spoken A-Rod is.	0	0	
Dad: they should rename the Kansas City Royals to the Raymore Royals cause it sounds better haha Me: yeah... or they could just not do that	0	5	
Also the Cleveland Indians beating the Yankees in the playoffs (Major League filming)	0	3	
Me: I'm gonna pierce my ears (a joke) Mom: I will cut you off. You watch me	0	6	
Supposed partners @Yankees @YESNetwork blacking out another @NYCFC game!! Please explain. Show will go on! 9pm kickoff Footy trivia 7:30	0	5	
Fuck that going to the Yankees game on Monday	0	0	
A-Rod to make FS1 booth debut for Thursday's Yankees - Royals game http:// dlvr.it/P9W3z9	0	0	
@Koogs46 ripped Chapman from a program pack, too bad I already did Yankees team epic. Am I stuck quick selling	0	0	
Oh, right. David Wells. Was gonna say that Bartolo Colon didn't pitch for the Yankees until 2011.	0	0	
Girls' Golf: Royals stay near top of SEC standings - South Washington County Bulletin http:// ift.tt/2qx1oND #Golf #GolfNews	0	1	
What has gotten into Yankees outfielder Brett Gardner? https://www. fanragsports.com/mlb/yankees/go tten-yankees-outfielder-brett-gardner/?utm_source=dlvr.it&utm_medium=twitter  pic.twitter.com/DSQHOE8wOB	0	0	
Real Marid ML Juventus ML Monaco ML CSK Moscu ML Astros Houston ML Arizona D-backs ML Yankees NY RL -1.5 LIGANDO FUERTE @FIVEpicksSPORTS	0	0	
@angelicajane808 !!!	0	0	
Most profitable MLB teams #Rockies 25-15 +13.2u #Astros 28-12 +8.5u #Orioles 23-14 +8.3u #Brewers 22-18 +8.0u #Yankees 23-13 +7.8u pic.twitter.com/7krgzg5ezT	6	11	
Not as annoying as the Celtics, Yankees , Chiefs "fans" https:// twitter.com/mylesj2b/statu s/864625957285580804 	12	141	
Idk but this Royals game better be bomb tonight cuz ya girl only got 4.5 hours of sleep so I could go and I am c r a n k y	0	1	
Eu s falo merda no grupo dos Yankees . Hahahaha	0	1	
Yankees working to fix their Tanaka problem http:// dlvr.it/P9W0ht pic.twitter.com/ogueudTRDq	0	0	
Any budding royals out there? #Italy are giving away some of their oldest castles... #travel #rtw http:// buff.ly/2qqYco7 pic.twitter.com/GghL9hqoQ6	0	1	
Take this lightly fokes, it is a joke. There probably will never be another @Yankees Captain. pic.twitter.com/1J5HZKwudU	0	0	
Google - now violating your privacy on IPhone. Sign me up	0	2	
Come on Charlie look at the statistics - why can't U & DJ make up? It bothers me two of my favorite Yankees can't get along. Do it 4 the	0	1	
someone remind him about birther garbage he pulled everyday against BO.	0	0	
Liberacin de una estricta tradicin? #Royals https:// twitter.com/Milenio/status /864905379532201988 	0	0	
Comey violated his duty if he didn't report it. Let's see Comey's notes after Obama meetings	0	0	
socoro sim	0	0	
Here are the names of #Yankees prospects I'm okay with the team trading: -Nobody -No one -None	5	21	
Very excited for a new "pet project" at my alma mater @SanMarcosRoyals with @TheRobertVargas #muralist #art #performingarts #royals	0	4	
Over the last 3 weeks, #Yankees OF Brett Gardner has been one of the best players in baseball. What happened? https://www. fanragsports.com/mlb/yankees/go tten-yankees-outfielder-brett-gardner/ 	1	6	
Beauty @hannahbjeter is glowing in our #SS17 Mock-Neck One-Shoulder Metallic Knit Dress at hubby #DerekJeter 's #RE2PECT Ceremony @Yankees pic.twitter.com/YJn2LgNK2x	1	5	
https://www. ruthiansports.com/new-york-yanke es/2017/05/17/toolshed-most-impressive-lineups-staffs/  Toolshed: Most impressive lineups, staffs Triple-A Scranton/Wilkes-Barre ( Yankees ): Much has been made of New Y...	0	0	
Who would've thought Cutch "bolting for the Yankees " in 2019 just meant him signing a 1-year $5 mil deal to be their DH	0	0	
So excited for the #Twins reboot! #yankees #ronaldtorreyes #aaronjudge #twinsies pic.twitter.com/3BahsBTvBV	0	7	
4: Good work from @Furney1988 and @AnnaGreen03 earn the Royals a corner! @YeovilLadiesFC - @ReadingFCWomen	0	1	
i hate the Yankees	0	0	
So they don't ever need a wire then?	0	0	
Ahhh yes. #mets back in their familiar position of being the laughing stock of the #MLB & #Yankees regaining their arrogance at record pace	0	0	
eu to rindo KKKKKKJKKK essas contas antigas sao as melhores	0	0	
#royals https:// twitter.com/richarddeitsch /status/864902210114768896 	0	0	
Then they have issues just like the fans of other teams that follow the #Yankees account.	0	0	
And Comey kept this secret? How will Comey be punished for his obstruction of justice?	0	0	
Girls' Golf: Royals stay near top of SEC standings - South Washington County Bulletin http:// dlvr.it/P9Vt6S	0	0	
. @Yankees RF Aaron Judge (AFL 2014) enjoys stint on The Tonight Show: http:// atmlb.com/2rrMHLC pic.twitter.com/QZauKBYwd8	2	7	
The #RedSox haven't gotten swept in a series all year, besides the Yankees series where a game was rained out, they would have won it though	0	0	
Inconvenient truth about Derek Jeter compared to Alan Trammell and Lou Whitaker http://www. theoaklandpress.com/sports/2017051 7/pat-caputo-inconvenient-truth-about-derek-jeter-compared-to-tram-and-lou  My column #Tigers #Yankees #MLB	9	20	
That's all I be wanting royals or chic fil a	0	0	
In terms of where the orioles, Red Sox, and Yankees are in that division I would say yeah they are. I get all the prospects I do...	0	0	
Finally proof Comey covered up a crime	0	0	
Wish I lived there, Yankees tickets are 200 plus. Why I never go!!!!	0	0	
VAMO MATAR TODOS	0	0	
SIMN	0	0	
Lo que pasa en USA ya parece joda, parece una seguidilla de peliculas yankees #Texas #Waco	0	0	
All clubs receive revenue. Some clubs donate part of their revenue to the other clubs to help keep parity. Royals receive rather than donate	0	0	
To be fair we have a lot of fans stalking other teams accounts	0	0	
Pork and cider pie and Jersey royals caned tonight, and short ribs tomorrow - this midweek time off is great for arsing about in the kitchen	0	1	
Royals go down 1,2,3 in the top of the first. New London to the dish. #nrhss	0	0	
#MLB : Fueron los Yankees de Joe Torre la mejor dinasta de la franquicia? http:// dlvr.it/P9VqKT pic.twitter.com/wnOSQPjD1U	0	0	
#mlb #ebay #helmets #Yankees #WhiteSox #royals #OaklandAs #tigers #mariners #90s #Rangers #orioles #Brewers #twins http://www. ebay.com/itm/1726787041 29?ssPageName=STRK:MESELX:IT&_trksid=p3984.m1555.l2649 	0	0	
El 1ro de 652! Un da como hoy en el 1996, Mariano Rivera logr su 1er juego salvado de su carrera en las Grandes Ligas. #MLB #Yankees pic.twitter.com/XdJOGlioXO	0	2	
na epoca eu tive que pagar frete pq tava morando no interior, 2 alargs diferentes de 12mm + frete ficaram uns 45 royals :cc	0	0	
#MLB : Fueron los Yankees de Joe Torre la mejor dinasta de la franquicia? http:// dlvr.it/P9Vq7P	0	0	
I have 2 tickets to tonight's royals game, section 111 row e, $25 each OBO. Let me know if you want em	0	0	
There might be a bazillion dongs at the K tonight, if his wind keeps up. #Royals Holy F Wind.	0	0	
Why aren't the Royals playing a baseball game today? http:// baseball.seventeaswithmilk.com/site/kansas-ci ty-royals/1453352/ 	0	0	
Un da como hoy en 1998 David Wells lanza el 1er juego perfecto para @Yankees desde Don Larsen SM 1956 @InformativosTA @TeleAntillas2 https:// twitter.com/espnstatsinfo/ status/864903348260032512 	1	0	
#BeRoyal #TakeTheCrown #KCMO #Tickets (2) Tickets - 5/23/17 - New York Yankees vs Kansas City Royals (Field lev... http:// ow.ly/nvgp50byocI	0	0	
Centurion Hockey - Division 5: Royals beat Happy Sticks (8 - 4) http:// bit.ly/2lL7biP	0	0	
Yankees should not give up on Chris Carter #Yankees #bhive http:// dld.bz/fH3t2	0	0	
Gotta keep showing love to Captian Clutch! http:// Webaykicks.com #webaykicks#yankees  https://www. instagram.com/p/BUM-h19gPp_/	0	0	
McDonald's Ritual Partnership with Kansas City Royals Yields Double | LBBOnline https:// lnkd.in/eJsmmzA	0	0	
Royals by Lorde	0	0	
The next Baby Bombers are looking GOOD down on the farm. #Yankees http:// bit.ly/2rqtf1N	0	0	
All the Yankees fans here gross me out	0	3	
Only Dunshaughlin to be fair, Mam is from Coolock and Dad from Marino, wouldn't have their children growing up Royals , no way.	0	0	
Secret Empire, Daredevil, Royals , and Luke Cage all exceptional from Marvel this week. Perfect for a rainy, sleep deprived day!	1	3	
The next Baby Bombers are looking GOOD down on the farm. #Yankees http:// bit.ly/2rqf64T	3	6	
New York Yankees : Tyler Wade on the cusp of big league promotion - OutsidePitchMLB http:// dlvr.it/P9Vksn	0	0	
On this date in 1998, David Wells pitched a perfect game against the Twins First for Yankees since Don Larsen (1956 World Series) pic.twitter.com/K9tnQtH0hQ	78	203	
Listen to The Drive 4-6pm for your chance to win Kansas Lottery scratch tickets and Kansas City Royals tickets! #AD http://www. kfhradio.com/contest/spend- day-k-kansas-lottery#/  pic.twitter.com/zMc2fO3cJL	0	0	
Dean_ I'm Not Sorry [Dance Choreography by Royals ]: http:// youtu.be/WOq00et00M4?a via @YouTube	0	1	
With some butters and a Yankees cap	1	0	
Our @oldmanduggan looks back at the career of Christian Coln, arguing that he deserved better from the Royals . http://www. royalsreview.com/2017/5/17/1562 8868/remembering-christian-colon-kansas-city-royals 	3	21	
Hey CNN if you have planned to propose at a Yankees game you don't care if the Sox are kicking their ass - you still propose.	0	0	
@getlouislut	0	0	
Check out NWT New York Yankees M tank top sewn letters logos #LeeSports #NewYorkYankees http://www. ebay.com/itm/NWT-New-Yo rk-Yankees-M-tank-top-sewn-letters-logos-/162518677239?roken=cUgayN&soutkn=iKVkWy  via @eBay	0	0	
McDonald's Ritual Partnership with Kansas City Royals Yields Double | LBBOnline http:// lbbonline.com/news/mcdonalds -ritual-partnership-with-kansas-city-royals-yields-double-impact-on-the-field/#.WRyPZ3Vk56g.twitter 	0	0	
@achrisevans after your feature today I was not only compelled to get some jersey royals , they even took top billing over my lamb chops!!	0	0	
@NYCDailyPics #nyc #Yankees #yankeestadium pic.twitter.com/jJtIV01kq2	0	0	
. @abcsims takes a look at what Aroldis Chapman may be facing with his rotator cuff strain. http:// cbsloc.al/2rfuFPu #Yankees pic.twitter.com/FCyuh0xNt1	0	1	
I doubt the people who created it care what the royals think. Or indeed, maybe they hope they've done some damage.	0	3	
tu com bts @AmorHarryPotter	0	0	
. @Elboni4 se va de 4-2 con una carrera anotada en el arranque de la serie vs. Yankees . Resumen: http:// atmlb.com/2qSeXKo #LosReales pic.twitter.com/U96eompaxk	1	1	
There are great writers being laid off daily in sports media and somehow Lee Judge STILL gets to write about the #Royals . He's awful. https:// twitter.com/royalsreview/s tatus/864901745574637569 	1	0	
Damn Yankees - High Enough (Official Video) https:// youtu.be/l_uh8XjgLTE?li st=PL397560B12C7D5FFD  via @YouTube	0	0	
Fox Sports says Alex Rodriguez will make his game analyst debut on FS1 this Thursday night for Yankees at Royals .	0	0	
Of course it's during a Yankees game . Nobody cares	0	0	
At least the Yankees are good this year	0	1	
So if Comey withheld information on wrong doing what will he be charged with? Comey that is	0	0	
It's @fanduel Double Up Weds @FantasyAlarm . Double the FREE MONTHS of the Playbook PRO with new sign up. TODAY ONLY! http:// bit.ly/2akNQ45 pic.twitter.com/tklXLTQ1qj	0	0	
SVS released, signs with Giants, bats .461, drives in 5 vs us in NLCS, hits game-winning game-7 homer vs the Yankees in the WS. The End	0	4	
Everybody knew Gleybar was the Crown Jewel of prospects when the Yankees traded for him last year not Frazier @SportsFunhouse pic.twitter.com/t70qDM9uMG	0	0	
Pdte. Yankees elogia a Dellin Betances #AN7Deportes	0	0	
Fox Sports says Alex Rodriguez will make his game analyst debut on FS1 this Thursday night for Yankees at Royals . Kevin Burkhardt on pxp.	35	62	
Not really	0	0	
Albert Abreu will come off the DL to pitch on Friday for the @TampaYankees . #Yankees #MiLB	1	8	
Alright if someone DD's to the royals game I pick their big toe	0	1	
Author reflects on 'Big League Dream' of playing with Yankees - Page Six http:// dlvr.it/P9VdDT #Yankees pic.twitter.com/AyW1cRgc1H	0	0	
I hope they get his diary too. That's where the juicy bits will be.	0	0	
@Yankees ,do you support cop kiling terrorist? Withdraw your support of the Puerto Rican Day parade! George would never have let this happen!	0	0	
@_LocksOnly_ 5-Team Round Robin: Rangers, Rockies/Over, Yankees , DBacks (2-ways and 3-ways) @_LocksOnly_	0	0	
#Memorbilia 1967 Topps Who am I ? Uncut Strip w/ Babe Ruth Yankees http:// rover.ebay.com/rover/1/711-53 200-19255-0/1?ff3=2&toolid=10039&campid=5337975484&item=371579924364&vectorid=229466&lgeo=1&utm_source=dlvr.it&utm_medium=twitter  #Collectors #Sports pic.twitter.com/XnbwQIMJ6B	0	0	
Read the story and find out about the 50 Royals student athletes named to the MonDak Academic All Conference Team. http://www. lrscroyals.com/general/2016-1 7/releases/20170517f1dlby 	3	5	
No es " Yankees "? Maldito regaetn vuelve ms estpidos a los ya de por s malos CM...	0	0	
Esta noche juegan los Yankees (23-13) Vs. Royals (16-22) #MLB 8:15 pm. #Acierta ... http://www. aciertaonline.com pic.twitter.com/NC69ataTfo	0	0	
Still time to switch	0	0	
Ay chicos los yankees tienen la cabeza podrida y se nota muchsimo.	0	0	
You're going to tear up the NL!!! This guy from Kansas will be rooting 4 u and the Marlins...unless they play the Royals	0	1	
FS hate to unload this beauty but in need of some PP #yankees #goat #closer #collect #boom  https://www. instagram.com/p/BUM9d6mBAUs/	0	0	
Hereditary Grand Duke Guillaume and Hereditary Grand Duchess Stphanie of Luxembourg are https://www. instagram.com/p/BUM9cdqgutk/	0	0	
Yankees Running For Dear Life After Foul Ball Smashes Into Hornets Nest http://www. theonion.com/article/yankee s-running-dear-life-after-foul-ball-smashes--55911  va @theonion	0	0	
Men's Cafe Racer Leather Jacket http://www. ebay.com/itm/-/29204872 2240?roken=cUgayN&soutkn=JCMbcd  via @eBay #STRIPTHATDOWN #jxnelection #snow #Yankees Tornado Watch #CelebrateMizzou	0	0	
@Yankees . Our boys are hot this year !! LET'S GO YANKEES !!! This is our year. #2017=28	0	0	
The pyramids of Giza were built using almost entirely slave labour, lead by royals and officers, but built by slaves for their kings	0	0	
Just interviewed @drewbutera & @VarietyKC kid Delaney about knocking out breast cancer! Get your shirt @CharlieHustleCo ! @KCTV5 @Royals pic.twitter.com/bRjkBJpKmB	1	8	
Nice. The Saudi Royals get to protect themselves while promoting Islamic Jihad on the rest of the world. Zero Hedge http://www. zerohedge.com/news/2017-05-1 6/us-nears-record-100-billion-arms-deal-saudi-arabia 	0	0	
Well done to all of the lads	0	0	
Interesting read, cf. http:// issurvivor.com/1996/12/16/a-h oliday-card-to-the-industry-1996-first-appeared-in-infoworld/  but moreso CT #Yankees (-1) in King Arthur's Court http:// etc.usf.edu/lit2go/174/a-c onnecticut-yankee-in-king-arthurs-court/  #timetravel #bizint	0	0	
Jorge Bonifacio has long been on the #Royals  prospect radar and now has a chance to make an impact. http:// bba.am/6ObdMp	0	0	
somebody from the deepest borrow in Bronx boutta pull up wit a White Romper, Timbs, Yankees Fitted and chain wit a minny Henny bottle on it https:// twitter.com/raineyovalle/s tatus/864633308558315521 	0	1	
My buddies were at a Royals game a few years ago and had guys behind them yelling racial slurs at Jones in CF. So Curt is clueless.	0	0	
Went to Royals Chicken today and cashier had an @ohboyrecords hat on. We hit it off, naturally. @JohnPrineMusic	0	3	
Lmfaooo our Yankees are doing we'll be happy	0	0	
Yankees asses should stay away from interfering in Pakistan	0	0	
*Tai no te puedes cambiar a los Redsox, t eres de los Yankees * *Tai no te puedes cambiar a los Redsox, t eres de los Yankees *	0	2	
Royals Pulse Check http:// dlvr.it/P9VV7S pic.twitter.com/MqVooHwOJi	0	0	
#TIPS1390 VARGAS tiene 0-5 ante NY YANKEES con ERA de 6.64 y WHIP de 1.500. #PARLEY #MLB #PICKS #TRENDS #ODDS	2	0	
Great night at the #Madejski & great meeting @JohnSwift8 #royals #happyhusband #RFC #PlayOffFinal #Wembley pic.twitter.com/7n0imToieB	2	1	
I just entered to win a pair of tickets to see the New York Yankees from @pepsico http:// ulink.tv/218236-278ige_ twt 	0	0	
London Royals UK Brexshiters London Limeys England Lions (wait, that's taken isn't it)	0	0	
BUCK: He looks a lot like Biff Skittle at the plate. Biff didn't get past Spring Training with the Royals in 1969, but I can see Biff in him	1	4	
#BeRoyal #ForeverRoyal #KCMO #Signed Kansas City Royals Mike Moustakas Signed Autographed16"x20" Photo MLB COA http:// ow.ly/70Qq50bymgb	0	0	
Serious question, can the Royals bring the fences in at The K?	0	0	
@MC790	0	0	
Jorge Bonifacio has long been on the #Royals  prospect radar and now has a chance to make an impact. http:// bba.am/6ObdMp	10	20	
@Yankees _Bet bahis sitesi nerir misin?	0	0	
The royals acaba?*baila* new girl tb la veo y pll ya era hora jajaj	0	0	
As the Royals say: never explain- never apologise.	0	1	
Yankees prospects: Josh Rogers strikes out seven in eight shutout innings for Tampa http://www. pinstripealley.com/2017/5/17/1565 1666/yankees-prospects-game-results-statistics-josh-rogers-gleyber-torres-blake-rutherford  pic.twitter.com/NHHfx6jTM6	0	0	
Check out Mickey Mantle 1961 Post #4 New York Yankees #NewYorkYankees http://www. ebay.com/itm/-/23233668 9784?roken=cUgayN&soutkn=ZQ64PG  via @eBay	0	0	
Royals Honour Memory Of Forces Personnel At Buckingham Palace https:// youtu.be/nmIrgb2LAzs   @YouTube	0	0	
Hm for royals	0	0	
Mediados de Mayo y los sobrejirados Yankees siguen en 1ero en el este de la americana.	0	2	
#BaseBall Update NY Yankees at Kansas City (8:15 PM ET) http:// sports.espn.go.com/mlb/scoreboard	0	0	
49,820 @Yankees fans packed the Stadium for this Beanie Baby and were then treated to David Well's perfect game. http:// collection.baseballhall.org/PASTIME/valent ino-beanie-baby-1998-may-17  pic.twitter.com/8J8IR9n47d	9	27	
just being a tiger... TV Series the Royals Season 3 episode https://www. instagram.com/p/BUM8Yr3DPbjQ v_XBOabmEToIAt5zdnQnr83tVI0/ 	0	0	
We stock Homegrown, Cornish New & Jersey Royals ;) RT @Caitlinj913 : u know ur struggling when ur breakfast is cornbread and potatoes	0	0	
He's the reason I loved the #Yankees	0	0	
New Pick - New York Yankees @Kansas City Royals , https:// tipstrr.com/tipster/jwint8 15/tip/488438  #Tipstrr	0	0	
CC Sabathia bounces back for #Yankees against #Royals http:// ow.ly/IzxJ30bOmgE #nyy #nyc #mlb	1	0	
At least the Yankees I have are playing well	0	0	
Way to go Royals !! https:// twitter.com/warnerroyal/st atus/864897785715470336 	0	4	
If you're going to the June 10th event, check our IG story for an update. #BPCrew #Yankees pic.twitter.com/2aq5UStSU2	4	10	
When I was young pup in Navy and met my first Yankees , I was all "you eat a what?"	0	3	
I was more referring to great programs. Patriots, Buckeyes, Yankees , so forth. I shouldn't have said good.	0	0	
When I was a kid I used to put on my Yankees cap, blast Empire State of Mind and pretend I was Jay-Z #MyWeirdSecret	0	1	
Finally getting time to sit down and digest the events of last night #readingfc #Playoffs #wembley #royals pic.twitter.com/Fnc6iR9XcZ	0	1	
Royals Want For Topless Kate Pics  : http://www. thebingbing.com/celeb/4469515 , pic.twitter.com/a84LGG1kNW	0	0	
Parece que hoje no  meu dia	0	0	
Norwegian Royals celebrate National Day in Oslo Credit:dpa/Alamy http:// bit.ly/2pLO22U pic.twitter.com/qER7hwnJxt	0	0	
Watch #Yankees Outfielder Aaron Judge Talk To Fans About Aaron Judge #NYY #video http://www. gamedayishere.com/single-post/20 17/05/16/Watch-Yankees-Outfielder-Aaron-Judge-Talk-To-Fans-About-Aaron-Judge  pic.twitter.com/NFNar431OU	0	0	
TVD Bates Motel Orphan Black Reign GOT New Girl The Royals PLL Halt and Catch fire	0	0	
Tonight's #Royals starter, Jason Vargas, is 5-1 with a 1.01 ERA. A test for both the powerful #Yankees and the 34-year-old lefty.	5	6	
The #Yankees account has the most fans of other teams that follow & troll this account. It went from Jeter is overrated to Sanchez is lol	0	0	
Perfect 7th for the Royals !! Warner wins the Lawrenceville bracket to advance to NAIA World Series!!! #RoyalNation #NAIASoftball pic.twitter.com/C3wDouH6gx	38	71	
