
New York City News Search (Unmaking 25 years of Yankees lineups led to this juggernaut) New York City News & ... - https:// 1newyorkcity.net/unmaking-25-ye ars-of-yankees-lineups-led-to-this-juggernaut/  pic.twitter.com/CxzmdAWhdd	0	0	
I thought they were wearing Yankees hats and those creepy wall street shirts with the white collars	0	0	
Of course	0	0	
Buy or sell? Steinbrenner says Yankees will be 'active' in free agency and trades http:// ift.tt/2rsgvYx	0	0	
But she LOVES the Kansas City Royals	0	1	
Do you need a chaperone for the Royals game? We'll get some REAL BBQ too	0	0	
Buy or sell? Steinbrenner says Yankees will be 'active' in free agency and trades http:// ift.tt/2rsgvYx	0	0	
Hal Steinbrenner Says Yankees Could Be Buyers Before Trade Deadline, But Wont Sacrifice Top Prospects  http:// intelweb.biz	0	0	
Here's what Hal Steinbrenner had to say about how the #Yankees might approach the trade deadline: http:// cbsloc.al/2qSBZkp pic.twitter.com/ciifatuWtr	4	5	
Hal Steinbrenner Says Yankees Could Be Buyers Before Trade Deadline, But Wont Sacrifice Top Prospects http:// newyork.cbslocal.com/2017/05/17/hal -steinbrenner-yankees-trade-deadline/?utm_source=dlvr.it&utm_medium=twitter  pic.twitter.com/v28Ix2Uxvy	0	0	
The Royals Hosted A Tea Party For The Most Heartwarming Reason https://www. yahoo.com/news/royals-ho sted-tea-party-most-194246255.html?.tsrc=fauxdal 	0	0	
What offensive scuffling are #Royals enduring TY? Rank 30th w/.226 BA, .289 OBP, .644 OPS & LF Alex Gordon (.164) hits 9th 2nite vs #NYY	1	2	
I admit, this is a pretty solid piece by the boss. Check it out #BabyBombers #Yankees #ESNY @TheRealCk260 https:// twitter.com/elitesportsny/ status/864903370372513793 	0	2	
Would LOVE to hear #EnterSandman in person... especially as a #Yankees fan &fan of Mariano Rivera!! https:// twitter.com/GilletteStadiu m/status/864895818784014339 	0	0	
Yankees are too busy virtue signaling to give a shit.	0	0	
Saudi royals also known to be highlyself-reflective so even if DJT should imply something remotely provocative...	0	0	
As he shouldn't. They're just above average now, and will be even better when the kids are ready to really play. #Yankees	0	0	
No faith in the Red Sox or Yankees ?	0	1	
Nah though, I was saying he's going to opt out. He won't get the same annual money, but he'll get more years leading to overall more money.	0	0	
Unmaking 25 years of Yankees lineups led to this juggernaut http:// ift.tt/2qSZDgP	0	0	
Buy or sell? Steinbrenner says Yankees will be 'active' in free agency and trades http:// cbsprt.co/2qsIcBZ pic.twitter.com/U8KlxPNgPq	1	1	
Hal Steinbrenner Says Yankees Could Be Buyers Before Trade Deadline, But Wont Sacrifice TopProspects http:// wp.me/pZawQ-5NDv	1	0	
Buy or sell? Steinbrenner says Yankees will be 'active' in free agency and trades http://www. cbssports.com/mlb/news/buy-o r-sell-steinbrenner-says-yankees-will-be-active-in-free-agency-and-trades/?utm_source=dlvr.it&utm_medium=twitter 	0	0	
Buy or sell? Steinbrenner says Yankees will be 'active' in free agency and trades http://www. cbssports.com/mlb/news/buy-o r-sell-steinbrenner-says-yankees-will-be-active-in-free-agency-and-trades/?utm_source=dlvr.it&utm_medium=twitter 	0	0	
Hal Steinbrenner Says Yankees Could Be Buyers Before Trade Deadline, But Wont Sacrifice TopProspects http:// wp.me/pZawQ-5NDv	2	1	
Hal Steinbrenner Says Yankees Could Be Buyers Before Trade Deadline, But Wont Sacrifice TopProspects http:// wp.me/pZawQ-5NDv	1	0	
https://www. ruthiansports.com/new-york-yanke es/2017/05/17/hal-steinbrenner-why-yankees-could-be-big-spenders-soon/  Hal Steinbrenner: Why Yankees could be big spenders soon By Brendan Kuty | NJ Advance ... pic.twitter.com/avGNyC6FMf	0	0	
https://www. ruthiansports.com/new-york-yanke es/2017/05/17/unmaking-25-years-of-yankees-lineups-led-to-this-juggernaut/  Unmaking 25 years of Yankees lineups led to this juggernaut By Joel Sherman When Gene... pic.twitter.com/sKa96F49P2	0	0	
Well, 7 since 2006. But some may not. Royals and Phillies may have some fans that couldn't stand the bad years.	0	0	
Pct of PAs by #Yankees RH batters: 2015, 31.2. 2016, 40.1. 2017, 60.3. http:// nyp.st/2pUSesU	5	29	
Top 5 MLB teams with most Homeruns 1 Milwaukee Brewers 65 2 Washington Nationals 62 3 NY Yankees 58 4 Tampa Bay Rays 56 5 Houston Astros 55	1	0	
So excited to go watch the royals beat the Yankees tonight	0	0	
Me ha gustado un vdeo de @YouTube ( http:// youtu.be/03P-xYjh9AU?a - 5/16/17: Sanchez and Carter power Yankees to 7-1 win).	0	0	
sgtgrunt0331: Today (May 14, 2017) the New York Yankees officially retired #2. Thank you for all the... https:// tmblr.co/ZcDyql2Ll7DSn	0	0	
Column http:// nyp.st/2pUSesU the #Yankees have shifted to the right after historically benefitting from lefty power	11	27	
Los Yankees en NY son como el Amrica en Mxico, y adems cobran el agua a 6 dlares.	0	6	
Michael Pineda Vs Jason Vargas esta noche en Kauffman Stadium... #Yankees Vs #Royals , el segundo de la serie (1-0). #MLB	0	0	
What's Up with Jason Hammel? https:// goo.gl/gp6MdY #RaisedRoyal #Royals #MLB	0	1	
those whitesox uniforms were classic! Especially when they wore the "shorts" version!	0	0	
3 runs on 4 hits for your Royals this inning. End 4: Knights 3, Royals 3.	0	4	
I feel like he's really on my side so I let him slide on the Royals . ;) #cardsnation https:// twitter.com/jasonkander/st atus/864917392312463360 	0	0	
The Royals Hosted A Tea Party For The Most Heartwarming Reason HuffPost https:// politicsinformer.com/584425/the-roy als-hosted-a-tea-party-for-the-most-heartwarming-reason-huffpost/ 	0	0	
#Rays have played 43 games. Yankees will play their 37th tonight.	0	0	
Update: Clint Frazier just hit a moonshot off the video board in right center. I think that was 6 homers in BP. #Yankees https:// twitter.com/ByDJEberle/sta tus/864937110129836032 	0	1	
Desculpa mas este discurso anti Yankees de Hugo Chaves  ridculo. Eu trabalho em empresa americana e o que se aprende com eles  fenomenal	0	0	
Vahe Gregorian: Royals cant afford Jason Hammels struggles https://www. mhb.io/e/3nbyt/6 #MLB #Sports @vgregorian reports pic.twitter.com/qUcedIMG4O	0	0	
Parley para conseguir hoy miercoles 17 mayo;mlb beisbol; yankees baja,texas baja,san luis gana y toronto gana nba basket;boston alta suerte..	1	0	
Caroline of #Brunswick , later Queen of the United Kingdom as wife of George IV, was born #OTD 1768 http:// bit.ly/2rrIdor #royals pic.twitter.com/llINJWi8qS	3	6	
. @ARod to make FS1 booth debut for Thursdays Yankees - Royals game http:// nydn.us/2qSGfAl pic.twitter.com/tnPZNlgLNT	0	0	
 The Royals  The Big Bang Theory  Scrubs  The 100  Hannah Montana (don't judge me) #MeineFuenfLieblingsserien	0	2	
On May 17, 1953 the @Yankees and browns used a combined 41 different players in 1 game.	0	0	
A-Rod to make FS1 booth debut for Thursdays Yankees - Royals game http:// nydn.us/2pUau5Y	0	0	
Yeah he'll opt in. Not gonna get anywhere near what he's getting now. Hasn't shown true ace quality	0	0	
New Post New York Yankees owner Hal Steinbrenner open to trades, but not dealing top prospects D ... - https:// dailynewsinc.com/2017/05/17/new -york-yankees-owner-hal-steinbrenner-open-to-trades-but-not-dealing-top-prospects/  via @DNewsInc pic.twitter.com/vvYTCJO4A4	0	0	
(pitching for the Yankees , I assume?) https:// twitter.com/youremojistory /status/864921966486183936 	0	1	
Hal Steinbrenner: Why Yankees could be big spenders soon pic.twitter.com/CwY2su2o7V	0	0	
Readers could also start with Royals , but they may be a little lost. However, Ewing is letting the Inhumans Freak Flag fly and it's GLORIOUS	0	2	
Yankees (23-13) at Royals (16-22) 8:15pm ET! Big Mike on bump! I'm feelin a Homer tonight from The Judge! Let's Get It! #RE2PECT2JETER pic.twitter.com/IDUsYYQXAM	20	118	
#MLB #Lineup #Royals Escobar SS Moustakas 3B Cain CF Hosmer 1B Perez C Soler RF Moss DH Merrifield 2B Gordon LF Vargas P	0	1	
@YANKEES BREAKING NEWS FLASHSALE $75 GLEYBER TORRES signed ball FREE SHIP - ONLY 1 #1 YANKEE PROSPECT http:// p0.vresp.com/Sj6v8i pic.twitter.com/BQma4NZm5H	1	0	
How early would I have to wait in line to get a Reggie Jackson bobble head June 9th help a brother out #Yankees #NYYankees it's a 7:35 start	0	1	
#MLB #Royals Jorge Bonifacio will not be in the starting lineup for Wednesday's game vs New York.	0	1	
#MLB #Royals Alex Gordon will start at LF and bat 9th vs New York Yankees on Wednesday.	0	1	
How did the lyrics for " Royals " go again? "That kind of lux just ain't for us, we crave a different kind of buzz"? https:// twitter.com/billboard/stat us/864926016745197568 	0	0	
Derek Jeter Gives His Take on Yankees Rookie Aaro... http:// vid.staged.com/sViu #firefan #NFL #sports #games #superbowl pic.twitter.com/yV0pajNv67	1	3	
The New York Yankees were the first team to identify their players by number in 1929	1	1	
#MLB #Royals Whit Merrifield will start at 2B and bat 8th vs New York Yankees on Wednesday.	0	1	
No me va pordede as que no puedo seguir con The Royals . Me paso al ltimo de #GreysAnatomy que al final no lo vi	0	0	
Kevin Burkhardt, the Mets lost a star when they lost you.	0	0	
#MLB #Royals Brandon Moss will start at DH and bat 7th vs New York Yankees on Wednesday.	0	1	
#MLB #Royals Jorge Soler will start at RF and bat 6th vs New York Yankees on Wednesday. @JorgeSoler68	0	1	
You fellas better get yourself to @Q39KC then!	0	1	
Calling it: Clint Fazier will homer tonight. Hit 3 HRs in his 1st 6 BP swings. Told me today he's been waiting for warm weather. #Yankees	0	1	
Derek Jeter New York Yankees T-Shirt Official MLB => http:// crwd.fr/2pX5koG <= #buyitnow #sports #baseball #newyorkyankees #Jeter #retweet pic.twitter.com/pF9d1JHe2Y	2	5	
@CloudsCon for the royals family con, will u invite @AlexandraPark1 @JakeMaskall and @MrMaxBrown / cloudscon pour #TRFC invitez les vous ?	0	0	
Spanish royals attend Princess Sofia's first communion http:// dailym.ai/2rpYSYy via @Femail	1	0	
But for them to suggest that royals fans are immune to being bandwagon fans is dumb.	0	1	
Damn that dude is busy. Wasn't he just honored by the Yankees this Sunday? pic.twitter.com/MKDivBlHYG	0	1	
I'm continually excited about her Kansas City connections. #royals	0	1	
Would love to say hey tonight at the Royals Game!	0	0	
Kansas City's Tom Poquette bats against @whitesox pitcher Chris Knapp in 1976 at @Royals Stadium pic.twitter.com/utp6zSDVcj	5	26	
Royals lineup pic.twitter.com/A3fwH1klUK	6	29	
New York Yankees : Stock Up, Stock Down on Top 10 Prospects After 1 Month http:// bleacherreport.com/articles/27085 67-new-york-yankees-stock-up-stock-down-on-top-10-prospects-after-1-month?fue4 	0	1	
In the past couple decades, Royals , Marlins, Phillies, Angels, White Sox and Blue Jays have surrounded titles with real bad teams.	0	0	
Funny how this is the same player who missed two ground balls hit to him in series they had with the Royals ...	0	1	
Bueno, 90%. Los Cubbies son adorables, los odiosos del baseball son los Yankees (todo el mundo lo sabe).	0	0	
Steinbrenner: Yankees will be active in free agency (via http:// thesco.re/theScore_App ) https://www. thescore.com/mlb/news/13028 74 	0	0	
http:// bit.ly/2qSXOR1 #guaranteedpick #MLB 05/17 (965) NY Yankees vs. (966) Kansas City $35.00 #sportsbetting	0	0	
Yankees Celebrate One of Best Pitching Performances Ever on This Day in History http://www. 12up.com/posts/5016282- yankees-celebrate-one-of-best-pitching-performances-ever-on-this-day-in-history?utm_source=twitter.com&utm_medium=share  via @12upSport	0	0	
Damn he's been on 25 man roster for 45 days already	0	1	
#MLB : Steinbrenner: "Los Yankees estarn muy activos en la agencia libre. Tenemos bastante dinero para la prxima temporada". pic.twitter.com/fzBcZIIoub	3	0	
We don't just claim to Win we PROVE IT! Wednesday #MLB #PICKS include: #bluejays +110, #rockies +125, #redsox OV 8, #Yankees -130 #betting	1	1	
The Royals hosted a tea party for the most heartwarming reason http://www. huffingtonpost.com/entry/the-roya ls-hosted-a-tea-party-for-the-most-heartwarming-reason_us_591c918ce4b03b485cae1388?ncid=engmodushpmg00000004  via @HPLifestyle	0	0	
I think you mean go Yankees I don't cheer for the jays lmao.	2	0	
NEW YORK YANKEES BASEBALL CAP/HAT-NEW ERA 59FIFTY 7 1/2" BLUE-PINSTRIPE NR http:// ift.tt/2pUM0cK	0	0	
Japanese slowly running out of royals as princess renounces title to marry commoner http:// cnn.it/2qqZ4JP	1	0	
nope! i'm in a NL-Only league... no yankees	0	0	
2006 ETOPPS MICKEY MANTLE 18 CARD SET #68/999 RARE FRESHLY OPENED YANKEES http:// dlvr.it/P9Y9Bx pic.twitter.com/hScCFeaa2F	0	0	
It's American yankees don't wear adidas original	0	1	
We talked to @BryanHoch about #Jeter , #Tanaka & #Yankees future, CC, and more. Ep will be up tomorrow! Subscribe http:// smarturl.it/YankeesPodcast pic.twitter.com/X5N87wr4Wc	1	4	
Royals Pitchers Splits! Best vs RHB: Jason Vargas (.489 OPS against). Soria 2nd best Worst vs RHB: Jason Hammel (1.054). T Wood 2nd worst.	0	0	
Steinbrenner: Yankees will be active in free agency https://www. thescore.com/mlb/news/13028 74  (via http:// thesco.re/theScore_app )	0	0	
Last nights	0	0	
Got two tickets for the jays vs. New York Yankees in Toronto for august 8th. Dm if u want them	0	32	
#MLB #GrandesLigas Algunos considerando buen momento #Marlins #Miami cambio por Giancarlo Stanton ... #Yankees ???	0	1	
