
Red Sox Take Masahiro Tanaka’s Ass Deep Three Times, While Drew Pomeranz Turns In A Very Economic 123-Pitch,… http:// dlvr.it/PKTKht	0	0	
denverpost​.com >> “Learn baseball language.” Red Sox announcer says Masahiro Tanaka shouldn’t get a http:// buzztap.com/-8xZyFs	0	0	
Red Sox take Tanaka's ass deep three times, while Pomeranz turns in a very economic 123-pitch, five-inning victory: http://www. barstoolsports.com/boston/red-sox -take-masahiro-tanakas-ass-deep-three-times-while-drew-pomeranz-turns-in-a-very-economic-123-pitch-five-inning-victory/ … pic.twitter.com/qpWWeyrSMh	21	207	
New York Yankees vs. Boston Red Sox : What Happens Next - http://www. the3pointconversion.com/new-york-yanke es-vs-boston-red-sox-happens-next/ … pic.twitter.com/3Zu9SRma3w	0	0	
Red Sox spox: 'We do not share the views expressed by Jerry Remy during last night's broadcast.' http://www. nbcboston.com/news/local/Red -Sox-Announcer-Remy-Gets-Backlash-for-Translator-Comments-427017703.html …	0	1	
I wish he'd go back to being a Red Sox fan.	0	0	
BIF: Red Sox Reliever Joe Kelly Threw Aaron Judge a 102.2 MPH Fastball Before Striking Him Out	0	0	
Red Sox and Evil ones game 2 can't come soon enough.	0	0	
Vote for Aruba's very own, the Red Sox SS Xander Bogaerts, he's #ASGWorthy ! Last night they beat the Yankees ,... http:// fb.me/1WDLTN2gd	1	0	
You are only human. Plus, you are a Red Sox legend. Your apology is accepted.	0	2	
Fair enough but he Red Sox were not built around him nor were the Twins. He developed into a core player	0	1	
he's a hypocrite: what about when Daisuke Matsuzaka and Koji Uehara were playing for the Red Sox ? http:// fb.me/7BtqoeXd7	0	1	
The Red Sox tightened up the North Division race last night by moving all teams over .500 Standings 1) Braves 3-0 2) Rays 2-1 2) Red Sox 2-1	0	1	
How Red Sox friend helped Yankees ' Aaron Hicks break out #Yankees #bhive http:// dld.bz/fNpHn	0	0	
FROM THE SPORTS DEPARTMENT: NEW YORK (AP) — Boston Red Sox broadcaster Jerry Remy says pitchers such as Yankees ... http:// fb.me/Y81LVUfX	0	1	
Watch: Red Sox reliever Joe Kelly throws fastest pitch of MLB season http:// a.msn.com/02/en-us/BBCcg wU?ocid=st …	0	0	
Red Sox issue statement after announcer Jerry Remy slams Tanaka's interpreter use http:// ift.tt/2s449ts	0	0	
Fuck the Boston Red Sox and everyone associated with them. https:// twitter.com/washingtonpost /status/872455664559419394 …	1	1	
Aaron Judge gets two hits in loss to the Red Sox http:// pline.co/r/oQWDUVk ##FantasyBaseball	0	0	
Play ball! Drive a sportily wrapped car and @ZipcarBoston will donate to the Red Sox Foundation! #worththetrip pic.twitter.com/CBNHM0K7II	0	0	
Red Sox issue statement after announcer Jerry Remy slams Tanaka&#039;s interpreter use #cbssports http://www. cbssports.com/mlb/news/red-s ox-issue-statement-after-announcer-jerry-remy-slams-tanakas-interpreter-use/ …	0	0	
As the Red Sox take on the Yankees this week, here’s how #brands can target #baseball fans this summer: https:// goo.gl/38VsNF	0	0	
NowPlaying Red Sox - Juvenile ft Young Thug http://www. MusikNationRadio.com 09:57	0	0	
NowPlaying Red Sox - Juvenile ft Young Thug http://www. MusikNationRadio.com 09:57	0	0	
Twitter is purgatory. CNN is Hell. I look forward to Red Sox baseball in Heaven. https:// twitter.com/CaseyMattox_/s tatus/872466203138293760 …	0	1	
Last time a relief pitcher won the CY Young was in 1992. Feel like a certain Red Sox closer could stop that 25 year drought.	0	0	
On the other hand, my Red Sox are going to sweep the Yankees ... @Alek_Bittinger	0	0	
VIDEO: Joe Kelly Set a Red Sox Velocity Record Last Night With This Pitch http://www. 12up.com/posts/5104763- video-joe-kelly-set-a-red-sox-velocity-record-last-night-with-this-pitch?utm_source=twitter.com&utm_medium=share … via @12upSport	0	0	
Could we see David Ortiz back in a Red Sox uniform? https:// armchairallamericans.com/david-ortiz-ma king-comeback/ …	2	8	
Simmer down Goodman You know damn well @Yankees are way better than your Red Sox #LetsGoYankees	0	0	
He's retired in the DR on a beach cheering on the Red Sox with 2 presidentes in his hands listening to merengue, why would he come back? https:// twitter.com/wtpsports/stat us/872121159281672192 …	0	1	
Then he filmed a Red Sox fan peeing in the bathroom and beat up his gf lol	0	1	
#NFL Wire: Red Sox issue statement after announcer Jerry Remy slams Tanaka's interpreter use http://www. cbssports.com/mlb/news/red-s ox-issue-statement-after-announcer-jerry-remy-slams-tanakas-interpreter-use/ … …	0	0	
Red Sox broadcaster Jerry Remy: "Learn baseball language" instead of using a translator on mound http:// trib.in/2r1RRBA pic.twitter.com/vsz0Nqqz0s	1	0	
Yanks are conceding AL to the Red Sox by leaving Torres, Adams and Fowler on the farm. Sorry, but Clippard, Headley and Carter can't hack it	0	4	
Red Sox issue statement after announcer Jerry Remy slams Tanaka's interpreter use http:// dlvr.it/PKT9GS pic.twitter.com/4ylnDN75Pf	0	0	
I used to be a Brooklyn Dodgers fan. They left. Then Expos. They left. Then Red Sox : they stayed put. Bonus: hate Yankees like Brooklyn.	0	0	
Red Sox issue statement after announcer Jerry Remy slams Tanaka's interpreter use http://www. cbssports.com/mlb/news/red-s ox-issue-statement-after-announcer-jerry-remy-slams-tanakas-interpreter-use/ …	0	0	
Red Sox issue statement after announcer Jerry Remy slams Tanaka's interpreter use http:// ift.tt/2s449ts	0	0	
Red Sox analyst says Japanese Yankees pitcher should 'learn baseball language' http://www. foxnews.com/sports/2017/06 /07/red-sox-analyst-says-japanese-yankees-pitcher-should-learn-baseball-language.html … via the @FoxNews Android app	0	0	
#NFL Wire: Red Sox issue statement after announcer Jerry Remy slams Tanaka's interpreter use http://www. cbssports.com/mlb/news/red-s ox-issue-statement-after-announcer-jerry-remy-slams-tanakas-interpreter-use/ … http:// playerpress.com	0	0	
Red Sox Announcer Jerry Remy Says Pitchers Shouldn't Get Translators, Should "Learn Baseball Language" #arf http:// deadspin.com/red-sox-announ cer-jerry-remy-says-pitchers-shouldnt-get-1795876520 …	0	0	
Needs to turn it around quick cause the Red Sox are on our heels	0	0	
cbssports​.com >> Red Sox issue statement after announcer Jerry Remy slams Tanaka's interpreter use http:// buzztap.com/-QzI8b1	0	1	
Moreland, Ramirez, Benintendi homer as Red Sox top Yanks 5-4 https://www. boston.com/sports/boston- red-sox/2017/06/06/moreland-ramirez-benintendi-homer-as-red-sox-top-yanks-5-4?event=event51 …	0	0	
On a related note, as a person unlucky enough to get the subway car full of Red Sox fans, OH MY GOD WHY DID YOU HAVE TO LOSE BY ONE!?	0	0	
Red Sox issue statement after announcer Jerry Remy slams Tanaka's interpreter use pic.twitter.com/Ojer9AhEYf	0	0	
WHOA! Red Sox Hurler Throws 104 MPH Vs. Judge http:// ihe.art/vxaTyHc	0	0	
Red Sox issue statement after announcer Jerry Remy slams Tanaka's interpreter use http:// buff.ly/2rLCZo6	0	0	
Red Sox issue statement after announcer Jerry Remy slams Tanaka's interpreter use http:// buff.ly/2rLJjM4	0	0	
Red Sox issue statement after announcer Jerry Remy slams Tanaka's interpreter use http:// buff.ly/2rLDwXd	0	0	
#NBA Wire: Red Sox issue statement after announcer Jerry Remy slams Tanaka's interpreter use http://www. cbssports.com/mlb/news/red-s ox-issue-statement-after-announcer-jerry-remy-slams-tanakas-interpreter-use/ … …	0	0	
Red Sox announcer opposes in-game translators, tells pitchers to learn baseball language http://www. foxsports.com/mlb/story/bost on-red-sox-jerry-remy-announcer-translators-masahiro-tanaka-new-york-yankees-learn-baseball-language-060717 … pic.twitter.com/AN8Aq2NKzn	0	1	
Red Sox Analyst Remy Says Tanaka Shouldn't Be Allowed A Translator | SI Wire | Sports Illustrated - https://www. xaniatube.com/red-sox-analys t-remy-says-tanaka-shouldnt-be-allowed-a-translator-si-wire-sports-illustrated_881809906.html …	0	0	
CVS Health, Red Sox honor veterans with memorable Fenway experience http://www. pawtuckettimes.com/news/cvs-healt h-red-sox-honor-veterans-with-memorable-fenway-experience/article_0dc5e6f2-441c-11e7-b827-ef2c46314beb.html?utm_source=bambu&utm_medium=social&utm_campaign=TeamCVS&rx_source=bambu …	0	2	
Whew! Strange times in which we live. The only part that doesn't shock me is Red Sox beating Yankees .	0	1	
Red Sox hang on in power struggle with Yankees : http:// bit.ly/2rV1zoJ	0	0	
Red Sox fans get their pitching staff back and we start talking	0	1	
Yardbarker: Red Sox announcer does not think translators should be legal for mound visits http://www. yardbarker.com/mlb/articles/j erry_remy_says_i_dont_think_should_be_legal_learn_baseball_language/s1_9754_24110098 … via @yardbarker	0	0	
Aaron Judge gets two hits in loss to the Red Sox - Aaron Judge News http://www. fantasypros.com/mlb/news/11934 8/aaron-judge-gets-two-hits-loss-to-red-sox.php … via @FantasyProsMLB	0	0	
SUMMER UPDATE: Alex Kiszkowski is hitting .435 for the Vestment Red Sox thru 7 games this summer. https://www. hometeamsonline.com/teams/default. asp?t=&s=baseball&u=CSBLREDSOX&p=profile&sportsHQ=CSBLREDSOX&playerID=615443 …	5	7	
@JoeandEvan @EvanRobertsWFAN on another rough outing for Tanaka as #Yankees fall to the Red Sox . #BOSvsNYY http:// youtu.be/H0ZWZeXVojI?a	0	0	
IM LOVIN IT BOUT TO TAKE FIRST LETS GO RED SOX HAHAHA	0	0	
Red Sox announcer to Yankees ' Masahiro Tanaka: Lose interpreter, learn 'baseball language' - Washington Post http:// dlvr.it/PKT3C1	0	0	
The Red Sox plan to hold a charity marathon in Fenway Park this September! http:// ift.tt/2rLHqPy pic.twitter.com/5VbL9lhOLn	0	0	
Let's go red sox !!	0	0	
Bad equivalency. NESN employs him, not the Red Sox . Still a real bummer to hear from Remy, a guy I always really liked.	0	1	
Aaron Judge gets two hits in loss to the Red Sox http://www. fantasypros.com/mlb/news/11934 8/aaron-judge-gets-two-hits-loss-to-red-sox.php … via @CraigKrantz #fantasybaseball	0	0	
Jackie Bradley Jr. said Masahiro Tanaka's stuff was the same last night as when he shut out the Red Sox in April. https://www. fanragsports.com/mlb/yankees/an other-rough-start-tanaka-hard-explain-yankees/ …	0	1	
Red Sox issue statement after announcer Jerry Remy slams Tanaka's interpreter use http://www. cbssports.com/mlb/news/red-s ox-issue-statement-after-announcer-jerry-remy-slams-tanakas-interpreter-use/ … via @CBSSports	2	2	
OSAA Pinto Baseball League: Pinto 8 Red Sox (18) at Pinto 8 Cardinals (5) - FINAL https:// goo.gl/9dQgZz	0	0	
Red Sox Analyst Remy Says Tanaka Shouldn't Be Allowed A Translator | SI Wire | Sports Illustrated - https://www. videokron.com/red-sox-analys t-remy-says-tanaka-shouldnt-be-allowed-a-translator-si-wire-sports-illustrated_cec3c44c4.html …	0	0	
#SPORT #Baseball Red Sox announcer to Yankees ' Masahiro Tanaka: Lose interpreter, learn 'baseball language… https:// goo.gl/fb/v3pKgJ	0	0	
Looking at tickets for the Thursday Sox Yankees game and found out those satan worshippers have a huge section of seats labeled "no alcohol"	0	3	
Red Sox Bullpen Comes Through In Huge 5-4 Win Over Rival Yankees http:// nesn.com/2017/06/red-so x-bullpen-comes-through-in-big-5-4-win-vs-yankees-tuesday-night/ … pic.twitter.com/eorSP7HTbs	0	0	
Red Sox hang on to beat Yankees - The Boston Globe http:// dlvr.it/PKSzXK	0	0	
Last Night, Red Sox Closer Craig Kimbrel Did Something No Other MLB Player Has Done Before https:// offthemonstersports.com/2017/06/last-n ight-red-sox-closer-craig-kimbrel-did-something-no-other-mlb-player-has-done-before/ … via @otmsportsbos	0	0	
Red Sox Announcer Says Pitchers Shouldn't Get Translators, Should ;Learn Baseball Language&quot; http:// deadspin.com/red-sox-announ cer-jerry-remy-says-pitchers-shouldnt-get-1795876520?utm_medium=sharefromsite&utm_source=Deadspin_twitter … via @deadspin	0	0	
Let's be honest, the Red Sox should disavow Jerry Remy https:// twitter.com/bostonmagazine /status/872461778084614144 …	0	1	
The Red Sox are disavowing Jerry Remy's comments that foreign players should "learn baseball language":… https:// twitter.com/i/web/status/8 72461778084614144 …	0	0	
Boston Red Sox analyst says translators should be illegal #boston #analyst #translators #should #illegal http:// dlvr.it/PKSyQj pic.twitter.com/b7FMVtlm3w	0	0	
Last night was the most fun I've had watching a Sox Yankees game in a long while	0	0	
The Red Sox are disavowing Jerry Remy's comments that foreign players should "learn baseball language": http:// bit.ly/2sfKbv7 pic.twitter.com/3JIlsZ2kob	6	2	
Boston Red Sox analyst says translators should be illegal http:// dailym.ai/2rUitnd	2	5	
WHOA! Red Sox Hurler Throws 104 MPH Vs. Judge http:// bitly.com/2r1U3ZV #sports pic.twitter.com/2mN55TWvxd	0	0	
Yankee Stadium watching Red Sox Yankees last night. In NY for world oceans day, giving a quick… https://www. instagram.com/p/BVCrCKqFXV5/	0	0	
Red Sox Announcer Remy Says Tanaka Shouldn’t Get Translator http:// cbsloc.al/2sDqv1I http:// intelweb.biz	0	0	
Red Sox all day great offensively and pitching could possible be the best in the show !! #15dadbod	0	0	
What can the Minnesota Twins expect from a first overall pick? http:// bit.ly/2r5yvqi +1 BaseballBot #RedSox #MLB	0	0	
Boston Red Sox analyst says translators should be illegal #boston #analyst #translators #should #illegal http:// dlvr.it/PKStKm pic.twitter.com/f12pbC5h2A	0	0	
I'm sure it's ok when it's the Red Sox using the translator. Eff off @jerry_remy . Friggin fossil. Climb out from under your 1970 rock. https:// twitter.com/MLBONFOX/statu s/872456520990154753 …	0	0	
@TonyMarinaro Catching the final out for the Cabs WS win last season OR the Red Sox final out in 2004.	0	0	
In showdown against Aaron Judge, Red Sox ’s Joe Kelly brings the heat http:// badbodymagazine.com/in-showdown-ag ainst-aaron-judge-red-soxs-joe-kelly-brings-the-heat/ …	0	0	
How is it that I now hate the Yankees less than the Red Sox ? When did that happen?	0	0	
Details & "nuances" that can get lost without a translator. #xl8 Red Sox announcer says: Lose interpreter. http:// wapo.st/2r4JzUH?tid=ss _tw&utm_term=.2ba0896f7d72 …	0	1	
Red Sox announcer Jerry Remy says Masahiro Tanaka shouldn't be allowed to have a translator in mound discussions. http:// cbsloc.al/2sDqXNA pic.twitter.com/4UZO8zfVFm	1	2	
Red Sox Announcer Remy gets backlash for Tanaka translator comments. http:// trib.al/zNq73rw pic.twitter.com/AxT3rkbB2o	0	0	
Red Sox 's 3 HRs cut Yanks' East lead to 1 Sent with @MLB At Bat http:// mlb.com/r/article?ymd= 20170607&content_id=234723694&vkey=news_bos&c_id=bos …	0	0	
Check out these Boardshorts Red Sox fans!! Click here: https:// goo.gl/9BiJr6 http:// fb.me/2gqCkLs5W	0	0	
Red Sox announcer opposes in-game translators, tells pitchers to 'learn baseball language'... http:// fb.me/3skS5aASX	1	0	
Wednesday Red Sox Farm Report: Michael Chavis continues hot start to 2017 by going 3-for-4 http:// dlvr.it/PKSWmp #RedSox	0	0	
With a the win last night, Red Sox are only 1.0 game behind the Yankees . Tonight's a big one!	0	0	
“We do not share the views expressed by Jerry Remy during last night’s broadcast,” Red Sox spokesperson says… http:// toplocalnow.com/us/boston/at/1 0#t4625348 …	1	0	
Red Sox Announcer Remy Says Tanaka Shouldn't Get Translator http:// cbsloc.al/2sDqXNA	0	3	
#Baseball - Red Sox announcer to Yankees ’ Masahiro Tanaka: Lose interpreter, learn ‘baseball language’ http:// ift.tt/2sDmcnf	0	0	
Red Sox hang on to beat Yankees - The Boston Globe http:// dlvr.it/PKSmMx #Yankees pic.twitter.com/TTgcSLT10A	0	0	
Tanaka’s struggles continued Tuesday night as he was pummeled for three home runs by the Red Sox in the 5-4 loss http:// nwsdy.li/2qVFtPo pic.twitter.com/TZzvoY252e	0	0	
@Jerry_Remy You need to apologize to listeners; Tanaka; the interpreter; Red Sox & Yankees . Baseball unites us, your comments divide us.	1	0	
What do you think the Red Sox /NESN should do after Jerry Remy's comments about not allowing translators on mound visits?	0	0	
I guess when it's not a Yankee, Cub or Red Sox player....	0	0	
Yankee fans to Red Sox announcer: F*ck off! #GoYankees	0	3	
Red Sox announcer to Yankees ' Masahiro Tanaka: Lose interpreter, learn 'baseball language' http:// wapo.st/2r4JzUH?tid=ss _tw&utm_term=.d4825a619585 …	0	0	
@may_yo13 to bald Red Sox fan: "Bald is NOT beautiful!"	1	3	
For any of my NYC friends & family who are wondering, Yes, I'm still accepting birthday gifts ... such as Red Sox / Yankee tix	0	0	
" Red Sox announcer opposes in-game translators, tells pitchers to 'learn baseball language' " http:// ift.tt/2rB0fXs	0	0	
Red Sox announcer Remy: Tanaka shouldn't get translator for mound visit What? Dave O'Brien constantly translates YOU! #BuonesTardesAmigos	0	1	
In Jerry Remy's defense, "translators should be illegal" is not the worst thing said towards an opponent at a Red Sox game this year.	0	1	
Just ready to be up in KC watching the Red Sox and calling the hogs for @asben16 Talk about a great birthday present!	0	0	
Struggles of Yankees ’ Masahiro Tanaka Deepen Against Red Sox - http:// sport.sywix.com/struggles-of-y ankees-masahiro-tanaka-deepen-against-red-sox/ …	0	0	
Stay classy, Red Sox https:// twitter.com/washingtonpost /status/872455664559419394 …	0	0	
#not to worry about my @Dodgers #minor slump #We will be the class of the NL Scott!! Kudos on your RED SOX & HAN RAM starting 2 mash https:// twitter.com/blindscottbos/ status/872453712417042432 …	1	0	
Red Sox announcer opposes in-game translators, tells pitchers to ‘learn baseball language’. http:// foxs.pt/2sSZdDT	24	67	
3u Yankees v Red Sox under	0	0	
washingtonpost: Red Sox announcer to Yankees ’ Masahiro Tanaka: Lose translator, learn "baseball language" http:// wapo.st/2sfqFPq	0	0	
Just another reason to hate the Red Sox ! https:// twitter.com/washingtonpost /status/872455664559419394 …	0	0	
[FoxSport] Red Sox announcer opposes in-game translators, tells pitchers to 'learn baseball language' http:// foxs.pt/2r1EQIg	0	0	
Me when the Red Sox beat the Yankees . pic.twitter.com/kDruIQUibt	1	6	
Red Sox announcer to Yankees ’ Masahiro Tanaka: Lose translator, learn "baseball language" http:// wapo.st/2sfqFPq	0	0	
Red Sox announcer to Yankees ' Masahiro Tanaka: Lose interpreter, learn 'baseball language… https:// goo.gl/fb/HyPb24	0	0	
A racist associated with the Red Sox ? Now I've heard everything (rolls eyes)	0	20	
Red Sox announcer opposes in-game translators, tells pitchers to 'learn baseball language' http://www. foxsports.com/mlb/story/bost on-red-sox-jerry-remy-announcer-translators-masahiro-tanaka-new-york-yankees-learn-baseball-language-060717?utm_source=dlvr.it&utm_medium=twitter … pic.twitter.com/Up118s6J7w	0	0	
Red Sox announcer opposes in-game translators, tells pitchers to 'learn baseball language' http://www. foxsports.com/mlb/story/bost on-red-sox-jerry-remy-announcer-translators-masahiro-tanaka-new-york-yankees-learn-baseball-language-060717?utm_source=dlvr.it&utm_medium=twitter … pic.twitter.com/fNloB9vk9l	0	0	
Red Sox announcer opposes in-game translators, tells pitchers to 'learn baseball language' http://www. foxsports.com/mlb/story/bost on-red-sox-jerry-remy-announcer-translators-masahiro-tanaka-new-york-yankees-learn-baseball-language-060717?utm_source=dlvr.it&utm_medium=twitter … pic.twitter.com/SBLk7B1tCR	0	0	
Red Sox announcer opposes in-game translators, tells pitchers to 'learn baseball language' http://www. foxsports.com/mlb/story/bost on-red-sox-jerry-remy-announcer-translators-masahiro-tanaka-new-york-yankees-learn-baseball-language-060717?utm_source=dlvr.it&utm_medium=twitter … pic.twitter.com/n7kxrlNxwU	0	0	
Red Sox announcer opposes in-game translators, tells pitchers to 'learn baseball language' http://www. foxsports.com/mlb/story/bost on-red-sox-jerry-remy-announcer-translators-masahiro-tanaka-new-york-yankees-learn-baseball-language-060717?utm_source=dlvr.it&utm_medium=twitter … pic.twitter.com/Th8plnNZOL	0	0	
Red Sox announcer opposes in-game translators, tells pitchers to 'learn baseball language' http://www. foxsports.com/mlb/story/bost on-red-sox-jerry-remy-announcer-translators-masahiro-tanaka-new-york-yankees-learn-baseball-language-060717?utm_source=dlvr.it&utm_medium=twitter … pic.twitter.com/vqlp840fd1	0	0	
Red Sox announcer opposes in-game translators, tells pitchers to 'learn baseball language' http://www. foxsports.com/mlb/story/bost on-red-sox-jerry-remy-announcer-translators-masahiro-tanaka-new-york-yankees-learn-baseball-language-060717?utm_source=dlvr.it&utm_medium=twitter … pic.twitter.com/UnVYGHrVab	0	0	
Red Sox announcer to Yankees ’ Masahiro Tanaka: Lose translator, learn "baseball language" http:// wapo.st/2sfqFPq	36	39	
June 7, 1908: #Tigers turn triple play for 2nd straight game, setting an MLB record, but lose 2nd straight to Red Sox , 9-5	0	2	
Watch: Red Sox reliever Joe Kelly throws fastest pitch of MLB season http:// a.msn.com/02/en-us/BBCcg wU?ocid=st …	0	0	
Nah I think the Oakland Red Sox are going to win the Stanley Cup	0	4	
Watch: Red Sox reliever Joe Kelly throws fastest pitch of MLB season http:// fb.me/785QVDl9M	0	0	
Red Sox announcer Remy says Tanaka shouldn't get translator http:// turnto10.com/sports/red-sox /red-sox-announcer-remy-says-tanaka-shouldnt-get-translator …	0	0	
NY Sports2day: Liberty host Dream, 11 a.m. Yankees host Red Sox , 7:05 p.m. (watch on YES). Mets at Rangers, 8:05 p.m. (watch on SNY).	1	0	
MLB Game Simulator: 7:05 PM EST - Boston Red Sox vs. New York Yankees - SIMULATE THIS GAME NOW: https://www. cappertek.com/xSimulator.asp ?n=95850 …	1	0	
Red Sox announcer to Yankees ’ Masahiro Tanaka: Lose translator, learn ‘baseball language’ - The Washington Post https:// apple.news/A7Lh00tH9RjiVL 01iS9y7xQ …	0	0	
“We do not share the views expressed by Jerry Remy during last night’s broadcast,” Red Sox spokesperson says http:// bos.gl/VLyTa2J pic.twitter.com/h01SS0Hxh2	15	10	
Hes a hero here. Red sox nation must not Come with cultural competency classes. https:// twitter.com/coachleo_/stat us/872414682384142336 …	0	0	
Boston Red Sox moneyline +113.0 PICK DATA: http:// CappedIn.com/posts/182607/m lb/boston-red-sox-vs-new-york-yankees-pick … @Tkwins On it? RETWEET #BostonRedSox	2	2	
Watch: Red Sox reliever Joe Kelly throws fastest pitch of MLB season http:// a.msn.com/02/en-us/BBCcg wU?ocid=st …	0	0	
NY Tuesday Sports Scoreboard: Red Sox stain Yankees , 5-4. Rangers raid Mets, 10-8.	1	0	
weei​.com >> Wednesday Red Sox Farm Report: Michael Chavis continues hot start to 2017 by going 3-for-4 http:// buzztap.com/-o1785C #sportstar	0	0	
6-7-1950, Red Sox beat down the Browns 20-4, and this was only warmup for the following day. Clyde Vollmer & Vern Stephens each hit 2 HR. pic.twitter.com/td0qswnIWF	0	0	
CVS Health, Red Sox honor veterans with memorable Fenway experience http://www. pawtuckettimes.com/news/cvs-healt h-red-sox-honor-veterans-with-memorable-fenway-experience/article_0dc5e6f2-441c-11e7-b827-ef2c46314beb.html?utm_source=bambu&utm_medium=social&utm_campaign=TeamCVS&rx_source=bambu …	0	5	
Red Sox announcer wants translators banned: 'Learn baseball language' https:// sports.yahoo.com/red-sox-announ cer-wants-translators-banned-learn-baseball-language-014613750.html?soc_src=social-sh&soc_trk=tw … via @YahooSports #Baseball	0	0	
Red Sox analyst Jerry Remy says Masahiro Tanaka shouldn't be allowed a translator http:// ift.tt/2s3XsHL't-allo wed-translator/102582868/ … #sports	0	0	
Red Sox announcer says Japanese pitcher shouldn't get to use a translator, should 'learn baseball language' - http:// sportofday.com/2017/06/07/red -sox-announcer-says-japanese-pitcher-shouldnt-get-to-use-a-translator-should-learn-baseball-language/ …	0	0	
What a huge stretch the Red Sox have coming up... huge first win... now sitting only 1 game back #RideTheKellyTrain #OneHundredFour	0	0	
The Boston Red Sox received more solid pitching from Drew Pomeranz Tuesday night in New York in a 5-4 victory... http:// fb.me/6jX89Nj25	0	0	
(2/4) Today's Games: 7:05 Pirates(132) at Orioles(-142) 7:05 Red Sox (-105) at Yankees (-105) 7:10 Cardinals(-133) at Reds(123)	0	0	
Going w work to see the Yankees play the Red Sox and I forgot my party hat. Which is a Yankees cap, even though I'm not a fan necessarily :(	0	0	
weei​.com >> Wednesday Red Sox Farm Report: Michael Chavis continues hot start to 2017 by going 3-for-4 http:// buzztap.com/-o1785C	0	0	
Red Sox analyst Jerry Remy says Masahiro Tanaka shouldn't be allowed a translator http:// ift.tt/2sg3yVc	0	0	
Red Sox analyst Jerry Remy says Masahiro Tanaka shouldn't be allowed a translator pic.twitter.com/EzWdkmWTuu	0	0	
Red Sox Feel Good About Fast-Tracking Bryan Mata http:// bit.ly/2rB6sCD #baseball	0	0	
Boston sports folks, I need tickets for Friday's Red Sox games. Who can help me out?	1	2	
Wednesday Red Sox Farm Report: Michael Chavis continues hot start to 2017 by going 3-for-4 http:// dlvr.it/PKSWmp #RedSox pic.twitter.com/0tOtaMLq38	2	2	
Wednesday Red Sox Farm Report: Michael Chavis continues hot start to 2017 by going 3-for-4 http:// dlvr.it/PKSWlZ #MLB #Boston #RedSox pic.twitter.com/7giUPFihib	0	0	
New post: " Red Sox analyst Jerry Remy says Masahiro Tanaka shouldn't be allowed a translator" http:// ift.tt/2s3XsHL't-allo wed-translator/102582868/ …	0	0	
Today's MLB Picks: 7:05 PM EST - Boston Red Sox vs. New York Yankees - 8 PICKS AVAILABLE (2 FREE) - https://www. cappertek.com/todaysPicks.as p?d=mlb-baseball-betting-predictions-boston-red-sox-vs-new-york-yankees-wednesday-june-07-2017&gameID=95850 …	1	0	
Red Sox gotta hell of a Bullpen	0	0	
50 years ago today the Red Sox chose Hall of Famer Carlton Fisk in the 1967 MLB Draft	0	0	
I CANT WAIT TO GO TO THE RED SOX GAME NEXT WEEK WITH THE LOML	0	0	
