
Red Sox announcer Remy says Tanaka should learn 'baseball language' | The Japan Times http://www. japantimes.co.jp/sports/2017/06 /07/baseball/mlb/red-sox-announcer-remy-says-tanaka-learn-baseball-language/#.WTfJ-J3xnX0.twitter …	0	0	
Hey #bfc530 join us at Citizens Bank Park Phils V Red Sox June 15 !! DM @deem_ellen or @mrfieldmanchs BYOP ( Bring your own peanuts!) pic.twitter.com/kcgGDUobuI	0	3	
Masahiro Tanaka struggles again as Yankees ' rally falls short in 5-4 loss to Red Sox http:// ift.tt/2qVBXVc	0	0	
Jays lose again, Devon Travis of the Jays back on disabled list, Red Sox beat Yankees . Sports coming up @HallieCBC @OttawaMorning	0	0	
Eduardo Rodriguez, Boston Red Sox LHP, says Dr. Andrews told him 'take your time to get back' -… http:// dlvr.it/PKPfCf	0	0	
Red Sox analyst says Japanese Yankees pitcher should 'learn baseball language' - Fox News http:// dlvr.it/PKPdT0	0	0	
Boston Red Sox Visit the Bronx for the first time this season http:// fb.me/8m4AC8hNf	0	0	
Boston Red Sox Visit the Bronx for the first time this season http:// fb.me/1VKTlkNYQ	0	0	
Les Yankees , leaders, les Red Sox et les Orioles se tiennent maintenant en 2.5 victoires seulement, au tiers de la saison.	1	4	
Red Sox fan from Herts who's understanding girlfriend knows all trips to the USA require thorough review of the teams schedule #WeAreMLBUK	0	0	
Red Sox ? Became a huge fan when Pedroia came around. Jets? Thank you Mark Sanchez. Grizzlies? Mike Conley Jr. is one of my fav players.	0	0	
Après la victoire des Red Sox sur les Yankees hier soir, et celle des Orioles dans le même temps, l'AL East se resserre encore!	1	4	
For me (not counting hometown Seahawks and Mariners) I'm Red Sox /Jets/Grizzlies. I have a case haha	0	0	
MLB Game Preview: Boston Red Sox vs. New York Yankees - 6/7/2017 - 7:05 PM EST - READ HERE: https://www. cappertek.com/b.asp?b=mlb-ga me-preview-boston-red-sox-vs-new-york-yankees-wednesday-june-07-2017 …	0	0	
2003 ALCS, Game 7: Red Sox at Yankees - Baseball’s Best |... ###Sports #Sports https:// goo.gl/fb/Dagq48	0	0	
Red Sox Announcer Jerry Remy Says Pitchers Shouldn’t Get Translators, Should "Learn… http:// deadspin.com/red-sox-announ cer-jerry-remy-says-pitchers-shouldnt-get-1795876520 … pic.twitter.com/0TzNvmfs4z	0	0	
Struggles of Yankees ’ Masahiro Tanaka Deepen Against Red Sox https:// sport24top.com/?p=48049 #sport #news #football #tennis #basket #live #stream	0	0	
Jake Peavy, taking time off for family, said he's received overtures from several clubs, but not the Red Sox . http:// trib.al/PI2iY8O	0	0	
Red Sox announcer Remy says Tanaka should learn ‘baseball language’ http:// ift.tt/2sCBmc8	0	0	
Red Sox announcer Remy says Tanaka should learn ‘baseball language’ http:// ift.tt/2sCBmc8	0	0	
Boston Red Sox hang on to defeat New York Yankees #Yankees #bhive http:// dld.bz/fNmeX	0	0	
Good pick on the Red Sox man	1	1	
Red Sox announcer Remy says Tanaka should learn ‘baseball language’ https:// rssfla.re/5937c0959f9d51 6a01558566/red-sox-announcer-remy-says-tanaka-should-learn-baseball-language …	0	0	
Boston Red Sox broadcaster Jerry Remy says pitchers such as Yankees right-hander Masahiro Tanaka shouldn’t be al... http://www. japantimes.co.jp/?post_type=spo rts&p=1187772 …	0	0	
Red Sox announcer Remy says Tanaka should learn ‘baseball language’ http:// bit.ly/2s3vwUn #japan	0	0	
Red Sox 5, Yankees 4: Boston shows off home-run power in win - The Providence Journal http:// dlvr.it/PKPJB2	0	0	
Red Sox announcer Remy says Tanaka should learn ‘baseball language’ http:// ift.tt/2sCBmc8	0	0	
New Tip - Boston Red Sox @New York Yankees , https:// tipstrr.com/tipster/thegre atwhitecapper/tip/514664 … #Tipstrr	0	0	
Red Sox announcer Remy says Tanaka should learn ‘baseball language’ http:// ift.tt/2sCBmc8 #JapanTimes #news	0	0	
Red Sox announcer Remy says Tanaka should learn ‘baseball language’ http:// ift.tt/2seZhB6	0	0	
Since the year 2000, the Boston Red Sox and St. Louis Cardinals have combined for an astounding 7 world series appearances.	0	0	
#MLB : NY Yankees-BOS Red Sox 4-5 CIN Reds-STL Cardinals 13-1 DET Tigers-LA Angels 3-5 TB Rays-CHI White Sox 2-4 #baseball	0	0	
of course i'd notice that he's wearing a red sox hat in the first and a yankees in the second. smh https:// twitter.com/giumkid/status /871781982065139712 …	0	1	
I liked a @YouTube video http:// youtu.be/ZXGoxM8ru_8?a 6/6/17: Trio of homers leads Red Sox to 5-4 victory	0	0	
New Tip - Boston Red Sox @New York Yankees , https:// tipstrr.com/tipster/tonypa t/tip/514653 … #Tipstrr	0	1	
Pawtucket Red Sox vs Syracuse Chiefs, Jun 07, 2017 – Live Stream, Score, Prediction http:// ht.ly/8pE850bZIEp	0	0	
2003 ALCS, Game 7: Red Sox at Yankees - Baseball’s Best |... #Sports http:// dlvr.it/PKPCH4 #Sports	0	0	
Red Sox analyst says Japanese Yankees pitcher should 'learn baseball language' http:// fxn.ws/2sCq2gg via… https:// twitter.com/i/web/status/8 72371017129316353 …	0	0	
FoxNews: Red Sox analyst says Japanese Yankees pitcher should 'learn baseball language' http:// fxn.ws/2sCq2gg v… https:// twitter.com/FoxNews/status /872371017129316353 …	0	0	
FOXNEWS: Red Sox analyst says Japanese Yankees pitcher should 'learn baseball language' http:// fxn.ws/2sCq2gg v… https:// twitter.com/i/web/status/8 72371017129316353 …	0	0	
Red Sox announcer to Yankees ' Masahiro Tanaka: Lose translator, learn 'baseball language' - https:// news.bridgeward.com/red-sox-announ cer-to-yankees-masahiro-tanaka-lose-translator-learn-baseball-language/ …	0	0	
Red Sox announcer Jerry Remy says translators visiting mound should be illegal http://www. rightrelevance.com/search/article s/hero?article=d7570e9779f76af49f2c1746e5ae153917ca4d11&query=boston%20ma&taccount=bostonmarr … pic.twitter.com/MbuHyQ7Zqx	0	2	
FoxNews: Red Sox analyst says Japanese Yankees pitcher should 'learn baseball language' http:// fxn.ws/2sCq2gg v… https:// twitter.com/i/web/status/8 72371017129316353 …	0	0	
FoxNews: Red Sox analyst says Japanese Yankees pitcher should 'learn baseball language' http:// fxn.ws/2sCq2gg v… https:// twitter.com/i/web/status/8 72371017129316353 …	0	0	
New Tip - Boston Red Sox @New York Yankees , https:// tipstrr.com/tipster/tonypa t/tip/514617 … #Tipstrr	0	1	
Red Sox analyst says Japanese Yankees pitcher should 'learn baseball language' http:// fxn.ws/2sCq2gg via @RyanGaydos pic.twitter.com/j8yn2Qpkhr	36	133	
@jimmyfallon @TheRealDratch I ended up w/an xtra front row ticket to Friday's Red Sox game. Any friends in the area? #sullyanddenise #youaaa	0	0	
Boomer and Carton: Yankees face off versus Red Sox WATCH at: http://www. friendlydb.com/item/11908428/ boomer-and-carton-yankees-face-off-versus-red-sox-watch-at … pic.twitter.com/TdEe2Mou9x	0	0	
Red Sox announcer to Yankees ' Masahiro Tanaka: Lose translator, learn 'baseball language' http:// wapo.st/2r4JzUH?tid=ss _tw&utm_term=.96cf2cf28b42 …	0	0	
In showdown against Aaron Judge, Red Sox 's Joe Kelly brings the heat http:// fb.me/12O1eLZ6W	0	0	
Buckley: Red Sox must take care of Drew Pomeranz - Boston Herald http:// dlvr.it/PKP3KB	0	0	
Give me a break. He wouldn't say that if Tanaka pitched for the Red Sox . More Sox paranoia from their broadcaster.	0	0	
#Cortesía @espn_beisbol : #MLBxESPN : Tres cuadrangulares de los Red Sox (Moreland, Hanley,… https://www. instagram.com/p/BVCBZgQjQyt/	0	0	
Jennings: Increase in home runs would be big asset for Red Sox http:// fb.me/8tfcAjd0w	0	0	
#sports Watch: Red Sox reliever Joe Kelly throws fastest pitch of #MLB season http:// a.msn.com/02/en-us/BBCcg wU?ocid=st …	0	0	
Behind Drew Pomeranz and three home runs, Red Sox power past Yankees to climb within one game of AL East lead http:// fb.me/SEOZNssd	0	0	
Today's MLB Picks: 7:05 PM EST - Boston Red Sox vs. New York Yankees - 3 PICKS AVAILABLE (1 FREE) - https://www. cappertek.com/todaysPicks.as p?d=mlb-baseball-betting-predictions-boston-red-sox-vs-new-york-yankees-wednesday-june-07-2017&gameID=95850 …	0	0	
New York Yankees vs Boston Red Sox June 6, 2017 | Oddsmaker Pressbox http:// news.oddsmaker.ag/major-league-b aseball-sports-betting-match-up-previews-for-tuesday-58/#.WTe3RpQF30s.twitter …	0	0	
Red Sox analyst says Japanese Yankees pitcher should 'learn baseball language' http:// ow.ly/MjXF50bZHzN	0	0	
Ghost Boss says The Red Sox will be in First Place tomorrow~yay!!	0	0	
Yes,I'm agree~Ghost Boss said to me ,Yay!! I'm super happy now.Because, Red Sox won !!	0	0	
My grandfather was a huge Red Sox fan and Ted Williams had to have had one of the greatest #nicknames of all time. The Splendid Splinter	0	0	
Typical Cardinal, but no accounting for gas in Cali, Red Sox fans road-tripping this Illini team names of this point that we live like.	0	0	
Buri hits walk-off single, Red Sox sweep Sioux Falls West http:// roofersiouxfalls.com/buri-hits-walk -off-single-red-sox-sweep-sioux-falls-west/ …	0	0	
In showdown against Aaron Judge, Red Sox 's Joe Kelly brings the heat http:// chicago.dailydigest.us/2017/06/07/in- showdown-against-aaron-judge-red-soxs-joe-kelly-brings-the-heat/ …	0	0	
@BostonRedSoxPR #losredsox Hey Jerry, how about Los Red Sox ? http://www. bostonglobe.com/sports/redsox/ 2017/06/06/jerry-remy-says-yankees-pitcher-masahiro-tanaka-shouldn-get-translator/4MpsVbghMKHmb5ekCFM1wJ/story.html …	0	0	
Red Sox announcer wants translators banned: 'Learn baseball language' https:// sports.yahoo.com/red-sox-announ cer-wants-translators-banned-learn-baseball-language-014613750.html …	0	0	
Red Sox announcer to Yankees ' Masahiro Tanaka: Lose translator, learn 'baseball language' http:// ift.tt/2rA15U4 Schmidt, a three-time NL…	0	0	
Red Sox analyst says Japanese Yankees pitcher should 'learn baseball language' http:// ift.tt/2rzGsaM June 6, 2017: New York Yankees star…	0	0	
#MLB FT New York Yankees 4-5 Boston Red Sox | Sumário do Jogo http://www. meusresultados.com/jogo/KpXVnnfC/ #sumario-do-jogo …	0	0	
Red Sox analyst says Japanese Yankees pitcher should 'learn baseball language' http:// ow.ly/vYtb50bZGRd	0	0	
Download NEW FREE #MLB New York Yankees - Boston Red Sox 06.06.17 #Yankees #RedSox http:// tinyurl.com/zyda49k	0	0	
http:// ift.tt/2rzVYDu #npb #KeiIgawa [CBS Sports]The Red Sox are staring down the barrel of a terrible contract with Pablo Sandoval, bu…	0	0	
http:// ift.tt/2rzRCw4 #npb #HidekiOkajima [The New York Times Baseball]Hideki Okajima joined the Boston Red Sox in 2007, the same year …	0	0	
http:// ift.tt/2rA8V0c #npb #HidekiOkajima [ http:// bosoxinjection.com ]The Red Sox left-handed relief pitching depth is being tested this we…	0	0	
Just learn English Jerry Remy drags the Red Sox into controversy with his attitude towards internationally-based... http:// fb.me/wPnAFK9N	0	1	
Red Sox announcer Jerry Remy says translators visiting mound should be illegal https:// boston25.com/2r0Hluj	3	11	
HA !! Red Sox are still in Second Place, Ghost Boss !! Ha !!	1	1	
Red Sox analyst says Japanese Yankees pitcher should 'learn baseball language' http://www. foxnews.com/sports/2017/06 /07/red-sox-analyst-says-japanese-yankees-pitcher-should-learn-baseball-language.html … via the @FoxNews Android app	0	0	
Jays lose to A's again and Devon Travis back on DL, Red Sox beat Yankees , Orioles win. Stanley Cup gm 5 Thurs. @infomorning @InfoMorningCB	0	0	
Red Sox hang on to beat Yankees http:// a.msn.com/02/en-us/BBCd0 zQ?ocid=st …	0	0	
Jays lose to A's & Devon Travis back on DL, Red Sox beat Yankees , @seguincbc @infoamfred @HanceCBC @InfoAMSJ @JonnaBrewerCBC @CBCMoncton	2	0	
Jays lose and Devon Travis back on the disabled list. Red Sox beat Yankees , Orioles win. @mitchcormierCBC @islandmorning @CBCPEI	1	0	
Jays lose to A's again, Red Sox beat Yankees , sports on the way. @AnthonyGermain @BerniceCBC @centralmorning @CBCLabrador @CBCNL	0	0	
Watch: Red Sox reliever Joe Kelly throws fastest pitch of MLB season http:// a.msn.com/02/en-us/BBCcg wU?ocid=st …	0	0	
Baltimore Orioles Boston Red Sox MINT Season Ticket 6/1/17 2017 #MLB Stub $2.99 - https:// grabyourtickets.net/baltimore-orio les-boston-red-sox-mint-season-ticket-6117-2017-mlb-stub-2-99/ … | | Price : ... pic.twitter.com/4p9QTfUmmD	0	0	
Boston Red Sox hang on to defeat New York Yankees https:// goo.gl/tWTbFI #sports	0	0	
In showdown against Aaron Judge, Red Sox 's Joe Kelly brings the heat http:// ow.ly/ZmeB50bZFHc	0	0	
Struggles of Yankees ’ Masahiro Tanaka Deepen Against Red Sox https:// nyti.ms/2rTI8wl	0	0	
In showdown against Aaron Judge, Red Sox 's Joe Kelly brings the heat http:// es.pn/2sRi8is :-)!!	0	0	
#SPORT #Baseball Red Sox analyst says Japanese Yankees pitcher should 'learn baseball language' - Fox News: Fox… https:// goo.gl/fb/UN1W2h	1	1	
Red Sox hang on to 5-4 victory over Yankees WATCH at: http://www. friendlydb.com/item/11908128/ red-sox-hang-on-to-54-victory-over-yankees-watch-at … pic.twitter.com/kFQqoplyWk	0	0	
Nothing just me more hyped than going to see Yankees Red Sox tomorrow	0	1	
masslive​.com >> Craig Kimbrel is Boston Red Sox 's MVP even more than Chris Sale but John Farrell needs http:// buzztap.com/-I8AL90 #sportstar	0	0	
Streaking Cubs pull away from Marlins for 10-2 win http:// bit.ly/2rAeb3V +1 BeanTownBot #RedSox #MLB	0	0	
Royals' Moustakas homers to halt Astros' win streak at 11 http:// bit.ly/2rzRAEw +1 BeanTownBot #RedSox #MLB	0	0	
Gallo's 17th homer puts Rangers ahead in 10-8 win over Mets http:// bit.ly/2rzXq8W +1 BeanTownBot #RedSox #MLB	0	0	
Hahn returns from DL to pitch Athletics past Blue Jays 4-1 http:// bit.ly/2rAe88f +1 BeanTownBot #RedSox #MLB	0	0	
Red Sox announcer to Yankees ' Masahiro Tanaka: Lose translator, learn 'baseball language' http:// ift.tt/2seFYbc	0	0	
#Baseball - Red Sox announcer to Yankees ’ Masahiro Tanaka: Lose translator, learn ‘baseball language’ http:// ift.tt/2sC82CB	0	0	
Red Sox analyst says Japanese Yankees pitcher should 'learn baseball language' https:// goo.gl/fb/SogX8h http:// bit.ly/whiteboardNOW	0	0	
Craig Kimbrel is Boston Red Sox 's MVP even more than Chris Sale but John Farrell needs to be careful with him -… http:// dlvr.it/PKNVYC	0	0	
Red Sox analyst says Japanese Yankees pitcher should 'learn baseball language' https:// goo.gl/Fq3AB8 #fox -news	0	0	
2004 ALCS Gm7: Ortiz's homer gives Red Sox early lead https:// youtu.be/dyFhFtLsa-k via @YouTube And this!! !!	0	0	
Nah fuck it just like the Red Sox the @Cardinals you just made the list!!! #deadtome #dfs #allhitters pic.twitter.com/w1Ohk32J8o	1	1	
Struggles of Yankees ’ Masahiro Tanaka Deepen Against Red Sox http://www. revengenews.com/struggles-of-y ankees-masahiro-tanaka-deepen-against-red-sox/ … http:// fb.me/2Y14ZNaDX	0	0	
Struggles of Yankees ’ Masahiro Tanaka Deepen Against Red Sox http://www. revengenews.com/struggles-of-y ankees-masahiro-tanaka-deepen-against-red-sox/ …	0	0	
Struggles of Yankees ’ Masahiro Tanaka Deepen Against Red Sox http://www. revengenews.com/struggles-of-y ankees-masahiro-tanaka-deepen-against-red-sox/ …	0	0	
Struggles of Yankees ’ Masahiro Tanaka Deepen Against Red Sox http://www. revengenews.com/struggles-of-y ankees-masahiro-tanaka-deepen-against-red-sox/ …	0	0	
Red Sox announcer to Yankees ' Masahiro Tanaka: Lose translator, learn 'baseball language' http:// ift.tt/2seFYbc #breakingnews #news	0	0	
Red Sox announcer to Yankees ' Masahiro Tanaka: Lose translator, learn 'baseball language' - Washington Post #sports	0	0	
Red Sox announcer to Yankees ' Masahiro Tanaka: Lose translator, learn 'baseball language' http:// ift.tt/2seFYbc	0	0	
3-0 SWEEEEEP! Red Sox ML DBacks -1.5 RL Under 8.5 Braves/Phillies Past 4 Days 15-4 +$8,880 at 79% DM for SALES http:// Rainmanpicks.com/Packages pic.twitter.com/ARcPIjDJrX	25	39	
Red Sox analyst Jerry Remy says Masahiro Tanaka shouldn't be allowed a translator http:// dlvr.it/PKNQb7 #MLB pic.twitter.com/XB0k9U5f9g	4	4	
Red Sox analyst says Japanese Yankees pitcher should 'learn baseball language' http://www. foxnews.com/sports/2017/06 /07/red-sox-analyst-says-japanese-yankees-pitcher-should-learn-baseball-language.html …	0	0	
MLB Game Simulator: 7:05 PM EST - Boston Red Sox vs. New York Yankees - SIMULATE THIS GAME NOW: https://www. cappertek.com/xSimulator.asp ?n=95850 …	0	0	
Red Sox analyst says Japanese Yankees pitcher should 'learn baseball language' https:// goo.gl/fb/vrejbX	0	0	
Tanaka's struggles vs. Sox tighten East race #Yankees http:// dld.bz/fNk3z	0	0	
In showdown againste, Red Sox ’s Joe Kelly brings the heat https:// sport24top.com/?p=48000 #sport #news #football #tennis #basket #live #stream	0	1	
Red Sox analyst says Japanese Yankees pitcher should 'learn baseball language' http:// bit.ly/wwsKlG	0	0	
http:// bit.ly/2oskBis Struggles of Yankees ' Masahiro Tanaka Deepen Against Red Sox - New York Times: New York… http:// dlvr.it/PKNKRW pic.twitter.com/zAUrg2oyG5	0	0	
Moreland, Ramirez, Benintendi homer as Red Sox top Yanks 5-4 http://www. virginislandsdailynews.com/ap/moreland-ra mirez-benintendi-homer-as-red-sox-top-yanks/article_f935a925-a8f5-57ff-bce3-3a2a91844ec4.html …	0	0	
I had my phone make a pick while in my pocket I am a red sox fan and it picked NY to win today while phone was in my pocket	0	2	
Boston Red Sox hang on to defeat New York Yankees - Craig Kimbrel retired Aaron Judge for the final out and rec... http:// ow.ly/8H6v50bZEpV	0	0	
Moreland, Ramirez, Benintendi Homer As Red Sox Top Yanks 5-4 http:// oil.fuelspace.com/2017/06/07/mor eland-ramirez-benintendi-homer-as-red-sox-top-yanks-5-4/ …	0	0	
UPI Latest News: Boston Red Sox hang on to defeat New York Yankees #UPI #Latest #News https:// rssfla.re/5937a47a9f9d51 6a021ca676/boston-red-sox-hang-on-to-defeat-new-york-yankees …	0	0	
How bout those Red Sox ? https:// twitter.com/redsox/status/ 872284378319261696 …	0	0	
Red Sox Announcer Remy Says Tanaka Shouldn't Get Translator #announcerremysaystanaka #translator http:// tinyurl.com/y8q5t7f5 @iosentinel	0	0	
Red Sox notebook: Eduardo Rodriguez won’t return until knee is 100 percent https:// boston-informer.com/224804/red-sox -notebook-eduardo-rodriguez-wont-return-until-knee-is-100-percent/ … pic.twitter.com/a2yPXQFJUy	0	0	
In showdown against Aaron Judge, Red Sox 's Joe Kelly brings the heat http://www. 15minutenews.com/article/123383 894/in-showdown-against-aaron-judge-red-soxs-joe-kelly-brings-the-heat/ … #Sports	0	0	
Red Sox analyst says Japanese Yankees pitcher should 'learn baseball language' - Fox News http:// dlvr.it/PKNCqT	0	0	
Red Sox analyst says Japanese Yankees pitcher should 'learn baseball language' https:// goo.gl/fb/mscVGe	0	0	
Red Sox announcer wants translators banned: 'Learn baseball language' https://www. yahoo.com/sports/red-sox -announcer-wants-translators-banned-learn-baseball-language-014613750.html?.tsrc=fauxdal …	0	0	
Boston Red Sox hang on to defeat New York Yankees http:// upi.com/6539598	0	0	
http:// ift.tt/2r09GB5 #npb #YasuhikoYabuta [Reuters]The loss went to the Red Sox ’s second reliever in the sixth, Daniel Bard (2-2). Yas…	0	0	
http:// athleets.com/#mlb updates background-image #103 http:// athleets.com/mlb/bgimage_la rge/RedSox.png … for Boston Red Sox #RedSox #VOTEREDSOX pic.twitter.com/4mkhHRtgOf	0	0	
New: John Farrell Explains Craig Kimbrel’s Multi-Inning Outings For Red Sox http:// bit.ly/2rKyaeD	0	0	
It's always a good day when the Red Sox beat the Yankees	5	9	
Red Sox hang on to beat Yankees http:// dlvr.it/PKN9lF pic.twitter.com/STQW9vSDry	0	0	
masslive​.com >> Craig Kimbrel is Boston Red Sox 's MVP even more than Chris Sale but John Farrell needs http:// buzztap.com/-I8AL90	0	0	
#celeb Red Sox announcer Remy says Tanaka shouldn’t get translator http:// ift.tt/2rK4cHJ	0	1	
Craig Kimbrel is Boston Red Sox 's MVP even more than Chris Sale but John Farrell needs to be careful with him http:// s.masslive.com/sstnQtR	3	2	
In showdown against Aaron Judge, Red Sox 's Joe Kelly brings the heat http:// ow.ly/9gW050bZDRR	0	0	
News Red Sox announcer Remy says Tanaka shouldn’t get translator http:// ift.tt/2rK4cHJ	0	0	
6/6 MLBN Showcase: Red Sox vs. Yankees http:// fb.me/5oRy59d2D	0	0	
#DreamSports In showdown against Aaron Judge, Red Sox 's Joe Kelly brings the heat http:// ow.ly/bD5q50bZDzb	0	0	
6/6 MLBN Showcase: Red Sox vs. Yankees - https:// theglobalherald.com/66-mlbn-showca se-red-sox-vs-yankees/204779/ … - #Baseball pic.twitter.com/LlxBsu5QM3	0	0	
In showdown against Aaron Judge, Red Sox 's Joe Kelly brings the heat http:// ow.ly/YHRQ50bZDn8	0	0	
#Deportes In showdown against Aaron Judge, Red Sox 's Joe Kelly brings the heat http:// ow.ly/BBVT50bZD1q	0	0	
paid for a flight and airbnb in Boston, Red Sox tickets, and @KingOfTheDot #MASS3 tickets all in a damn day.	0	1	
http:// ift.tt/2rTi6JG #npb #TomoOhka [Arkansas Online]2000 Tomo Ohka of the Pawtucket Red Sox (AAA Red Sox ) became the third pitcher in…	0	0	
Red Sox announcer Remy says Tanaka shouldn't get translator (from @AP ) https:// apnews.com/b775933a8cc345 23ab7ab1a5dadb1f37 …	0	0	
#Baseball - Red Sox analyst says Japanese Yankees pitcher should 'learn baseball language' http:// ift.tt/2qZBVjr	0	0	
In showdown against Aaron Judge, Red Sox 's Joe Kelly brings the heat http:// dlvr.it/PKN3pG #sports #headlines pic.twitter.com/oQzBGuzeKx	0	0	
Buckley: Red Sox must take care of Drew Pomeranz https:// boston-informer.com/224799/buckley -red-sox-must-take-care-of-drew-pomeranz/ … pic.twitter.com/pkk5rXAirs	0	0	
Red Sox analyst says Japanese Yankees pitcher should ‘learn baseball language’ http://www. streetcurb.com/2017/06/07/red -sox-analyst-says-japanese-yankees-pitcher-should-learn-baseball-language/ …	0	0	
Red Sox analyst says Japanese Yankees pitcher should ‘learn baseball language’ http://www. streetcurb.com/2017/06/07/red -sox-analyst-says-japanese-yankees-pitcher-should-learn-baseball-language/ …	0	0	
Red Sox analyst says Japanese Yankees pitcher should ‘learn baseball language’ http://www. streetcurb.com/2017/06/07/red -sox-analyst-says-japanese-yankees-pitcher-should-learn-baseball-language/ …	0	0	
Red Sox analyst says Japanese Yankees pitcher should ‘learn baseball language’ http://www. streetcurb.com/2017/06/07/red -sox-analyst-says-japanese-yankees-pitcher-should-learn-baseball-language/ …	0	0	
In showdown against Aaron Judge, Red Sox ’s Joe Kelly brings the heat http://www. dailytribune.org/2017/06/06/in- showdown-against-aaron-judge-red-soxs-joe-kelly-brings-the-heat/ …	0	0	
In showdown against Aaron Judge, Red Sox 's Joe Kelly brings the heat http:// dlvr.it/PKN2tc	0	0	
In showdown against Aaron Judge, Red Sox ’s Joe Kelly brings the heat http://www. dailytribune.org/2017/06/06/in- showdown-against-aaron-judge-red-soxs-joe-kelly-brings-the-heat/ …	0	0	
Red Sox suck so matters	0	1	
Lmfao I'm an asshole. I lied to my dad and told him I'm a red sox fan and got mad hype when they won.	0	1	
Did you see what the Red Sox announcer said today?	0	0	
http:// goo.gl/Oe38WR Struggles of Yankees ’ Masahiro Tanaka Deepen Against Red Sox http:// ow.ly/R8aV50bZBIg	0	0	
sports - @MLB scoreboard > Cardinals-1/Reds-13 / Pirates-5/Orioles-5 F10 / Padres-2/Dbacks-10 > Red Sox -5/ Yankees -4 / Cleveland-3/Rockies-11	0	0	
New post: " Red Sox analyst says Japanese Yankees pitcher should 'learn baseball language'" http:// ift.tt/2r4zmY9	2	0	
Red Sox analyst says Japanese Yankees pitcher should 'learn baseball language' http:// ift.tt/2r4zmY9	0	0	
Red Sox analyst says Japanese Yankees pitcher should &#039;learn baseball language&#039; #foxnews http://www. foxnews.com/sports/2017/06 /07/red-sox-analyst-says-japanese-yankees-pitcher-should-learn-baseball-language.html …	0	0	
Red Sox analyst says Japanese Yankees pitcher should 'learn baseball language' pic.twitter.com/Z1UXZfR1e3	0	0	
In showdown against Aaron Judge, Red Sox 's Joe Kelly brings the heat https:// goo.gl/fb/PTFUVL #DSNSports	0	0	
#DownwardDog #TeamOmundson No offense against Aaron Judge, Red Sox 's Joe Phelps #nowplaying Officially	0	0	
AAA Fresno Grizzlies @1.85 2U Pawtucket Red Sox @1.60 1.5U PPD	1	1	
Red Sox hang on to beat Yankees #nyc #sports #twitter pic.twitter.com/Knx2A5XoWz	0	0	
Boston Red Sox Majestic Baseball Jersey #15 Dustin Pedroia Large Reptile Design http:// ift.tt/2sRkwWC	0	0	
Dom Dimaggio autographed signed baseball with JSA COA BOSTON RED SOX http:// ift.tt/2rTf8ou	0	0	
Red Sox analyst says Japanese Yankees pitcher should 'learn baseball language', if you know what i mean	0	0	
Ted Williams Boston Red Sox Signed 8X10 Photo GAI COA GLOBAL AUTHENTIC http:// ift.tt/2sRxUK6	0	0	
( Red Sox analisti, Japon Yankees sürahisinin 'beyzbol dili öğrenmesi' gerektiğini söyledi) - https:// deylihaber.com/red-sox-analis ti-japon-yankees-surahisinin-beyzbol-dili-ogrenmesi-gerektigini-soyledi/ …	0	0	
Red Sox analyst says Japanese Yankees pitcher should 'learn baseball language' http:// ift.tt/2r4zmY9 #politics	0	0	
In showdown against Aaron Judge, Red Sox 's Joe Kelly brings the heat https:// goo.gl/fb/Ns1Axn	0	0	
http:// ift.tt/2seNcMv #npb #DaisukeMatsuzaka [Sports Illustrated]Before proceeding, a quick note: While BA ranked newly signed Red Sox …	0	0	
http:// ift.tt/2qVAZbG #npb #DaisukeMatsuzaka [ http:// cheatsheet.com ]When the Red Sox bid $103 million for six years of Daisuke Matsuza…	0	0	
Red Sox analyst says Japanese Yankees pitcher should 'learn baseball language' http://www. conservativejunction.com/2017/06/07/red -sox-analyst-says-japanese-yankees-pitcher-should-learn-baseball-language/ …	0	0	
Red Sox analyst says Japanese Yankees pitcher should 'learn baseball language' http:// ift.tt/2r4zmY9 #foxnews #fox #news	0	0	
Foxnews #Headlines Red Sox analyst says Japanese Yankees pitcher should 'learn baseball language' http:// ift.tt/2r4zmY9	0	0	
Red Sox analyst says Japanese Yankees pitcher should 'learn baseball language' pic.twitter.com/IgP5lQeV8U	0	0	
Red Sox analyst says Japanese Yankees pitcher should 'learn baseball language' http:// ift.tt/2r4zmY9	0	0	
