
Check out Alex Rodriguez 10 baseball card lot Inserts Included Yankees Die Cut See Photos http://www. ebay.com/itm/-/25300459 3234?roken=cUgayN&soutkn=oWHZSm … via @eBay - Kenny Lessing	0	0	
El cuerpo se me va, hacia donde tu estás (8) Angels - R. W.	0	1	
...but there was one provo guy from San Diego who converted us all to Padres fans so we'd stop fighting in the mess hall.	0	0	
Win tonight or we riot! @Yankees	1	1	
Angels 4. In paradisum: http:// youtu.be/LG6NLEwZ62Q?a via @YouTube	0	0	
I bet Cashman is getting his ninja on and the Yankees will have a larger than expected trade in the next few weeks.	0	0	
@JCBOYD_SPORT360 buenas tardes el juego de los yankees de hoy sera transmitido por television?? Saludos.	0	0	
MLB Wednesday: Angels (+192) Orioles (+165)	0	0	
Protected by Love by Jennifer Ryan: Review https:// thebookdisciple.com/protected-love -jennifer-ryan-review/ … via @thebookdisciple	0	1	
NEW: FALLEN ANGELS Marvel Comics #4 (Plastic Sleeve) Discount Shipping https:// goo.gl/YWeL7o #marvelcomics	0	1	
Angels Live Lets go!	0	0	
Let's go #Yankees pic.twitter.com/DhNuIvLJay	0	2	
天照「巫 天照だ。よろしく頼む」	0	0	
Reminds me of Boy Scout camp in New England one year, there was a troop from NY who were @Yankees fans and most other troops @RedSox fans...	0	0	
Falling, Angels Among Us complete series: a story with heart & soul. Can love conquer all? pic.twitter.com/EgvRRrtodM http:// ow.ly/ASnT30cvNQO	3	2	
lohud​.com >> Bird gets cortisone shot, first base still concerns Yankees http:// buzztap.com/-oE23B3	0	0	
Check out Dave Winfiled 52 Baseball card lot HOF, Yankees , Inserts, SeePhotos 1979 #Yankess http://www. ebay.com/itm/-/25300459 2448?roken=cUgayN&soutkn=OsVuTu … via @eBay - Kenny Lessing	0	0	
. @SdotKimble will the Yankees win another game this season?	0	0	
Angels 「会いたい人がいるとか、見たいものがあるとか、やりたい事があるとか。生きる理由はそういう些細な事の積み重ねでいいのだ」 Daxis「なんかあったのか？」	0	0	
フェ：ルートに「ウサギ跳びでグラウンド一周」って言われたから、手のひらをウサギの耳みたいにして頭にあててぴょんぴょん跳んだら怒られちゃったんだ〜…なんでだと思う？ 朝：(ばかわいい)	0	0	
¿Cómo responderán los Yankees al volver a casa tras su slump? http:// ow.ly/HNI230cLoHz pic.twitter.com/MgyYVvI2Fp	0	0	
@Yankees Time To Hit Panic Button? http://www. buzzchomp.com/new-york-yanke es-hit-panic-button/ … 7 game losing streak bad sign for good team #Yankees #MLB #debate	0	0	
@Yankees Time To Hit Panic Button? http://www. buzzchomp.com/new-york-yanke es-hit-panic-button/ … 7 game losing streak bad sign for good team #Yankees #MLB #debate	0	0	
The Yanks could of had this guy as their closer instead of the woman beater chapman! #Yankees https:// twitter.com/acklaw/status/ 877648342364246016 …	0	1	
The #Yankees send Jordan Montgomery to the mound to stop the bleeding. Come follow along with us in the game thread! https://www. pinstripealley.com/2017/6/21/1584 9126/new-york-yankees-vs-los-angeles-angels-jordan-montgomery-vs-ricky?utm_campaign=pinstripealley&utm_content=chorus&utm_medium=social&utm_source=twitter …	0	9	
Nolasco's going to perfect game the #Yankees and I'll be stuck on the recap. https://www. pinstripealley.com/2017/6/21/1584 9126/new-york-yankees-vs-los-angeles-angels-jordan-montgomery-vs-ricky?utm_campaign=tylerdnorton&utm_content=chorus&utm_medium=social&utm_source=twitter …	0	0	
Se acerca la fase final de las Grandes Ligas y los Yankees de Nueva York no están logrando cerrarla de la mejor... http:// fb.me/1nU5jgWO8	0	0	
The Transformers movies saga can apparently be explained by the George Costanza / Yankees treatment. http:// uproxx.it/2rX5M7v pic.twitter.com/qze6XUGuM0	8	14	
Participate in the Book of Choice Giveaway Hop, hosted by @FLYLeFReviews , & enter to win $25 Amazon CG (INT)! http:// reviews.flylef.com/2017/05/09-BoC -signup.html …	0	1	
Thanks @BankofAmerica for the chance to see my @Yankees in action! #MLBmemorybank #sweepstakes	0	0	
@BankofAmerica please enter me into the Yankees Experience sweepstakes #MLBmemorybank #Sweepstakes	0	0	
Thanks @BankofAmerica for the chance to see my @Yankees in action! #MLBmemorybank #sweepstakes	0	0	
And 8 straight losses.	0	0	
#Angels kinda. I had high hopes of him adding stability to our revolving rotation.	0	0	
After collision Sat. & surgery today @TorresGleyber is undeterred & vows to rehab & return @Yankees @Yankees _Beisbol https://www. lavidabaseball.com/gleyber-torres -dream-deferred/#.WUrxuwQMewg.twitter …	4	5	
angels really do exist, rest easy ev https:// twitter.com/malorii_alexis s/status/877653820104253440 …	0	4	
Listen to me sing " Angels " on #Smule : https://www. smule.com/p/250603337_13 88428275 … #SingKaraoke	0	0	
The @Angels are in town to play the @Yankees at 7:05 pm est listen of @Foxsports640 with the pre-game now #Angels #Yankees #MLB #Baseball	0	0	
Thanks @BankofAmerica for the chance to see my @Yankees in action! #MLBmemorybank #sweepstakes	0	0	
New York Yankees , LeBron James & Metta World Peace Pay Tribute to Prodigy http://www. billboard.com/articles/colum ns/hip-hop/7841010/prodigy-death-rapper-tributes-sports-figures … via @billboard	0	1	
The Yankees .	0	1	
Jugadas que me agradan #MLB #Batimore RL +1.5 #Oakland RL +1.5 #Twins RL F5 -0,5 #Yankees RL F5 -0,5 #Arizona RL F5 +0,5 Éxitos	3	2	
Y'all act like girls who don't like to party are angels lmao shorty be in the house suckin a different dick every Saturday	62	134	
Yankees have a promising future https:// twitter.com/Cut4/status/87 7650038331031553 …	0	0	
Rush - Clockwork Angels Tour - The Garden https:// youtu.be/EsBNzf5JlZA via @YouTube	1	2	
The people in the back screaming are me	0	2	
Good morning angels	0	3	
Dance class is canceled for this evening. Sorry for the inconvenience.	0	1	
Guidance card of the day...FAITH. Today, the angels remind us of our free will. We always have a choice. A choice... http:// fb.me/1eCJhgAc0	0	0	
No... WORSE than that. Ninjas & their most trained assassins are angels compared to them. Billy and me are also protected by them sometimes.	0	0	
South Summit 2017 reunirá a los principales fondos y business angels interna... http:// buff.ly/2sRVURh #europe #startup via @Spain_StartUp	0	0	
#NowPlaying Brian McCarthy Nonet - The Better Angels of Our Nature on #TNGCRadio the #WorldEclectic #AfroJazzy #FunkyBluesyBeats	0	0	
Geri Halliwell – Angels In Chains https:// genius.com/Geri-halliwell -angels-in-chains-lyrics …	0	1	
'' If Assad is EviL, Are His Opponents the Angels PUTIN's Counter Question 4m WorLD https:// youtu.be/CpzMq0jyWgw	0	1	
They talk to us like strangers and talk to celebs like angels .	2	6	
This smells like what I imagine an angels vagina to smell like. Heavenly pic.twitter.com/mKIODxCyVa	0	2	
If Chris Carter remains at 1st base and Tanaka continues to vomit awfulness every 5 days for the Yankees , Boston will have a decent run.	0	1	
My beloved New York @Yankees : 40 min til we end skid. Not since '98 (even '78!), have I seen a team w/ more spirit, joy & talent. #wegotthis	0	0	
The Yankees have lost seven straight. I'm ecstatic.	0	0	
#Yankees 38-30 vs LAA 37-37 Gardner-LF Hicks-CF Judge-RF Holliday-1B Castro-2B Sanchez-DH Gregorius-SS Headley-3B Romine-C *Montgomery	3	2	
A casual mid photoshoot pose with Nashville angels Jenn Bostic and Sarah Darling http:// fb.me/6jyp8yOAs	0	1	
Girardi On WFAN: Yankees ’ Struggles Extend Beyond Chris Carter http:// cbsloc.al/2sVEsM0 http:// intelweb.biz	0	0	
Meeting some internet pals soon & though they're angels who've done no wrong I'm still wracked with anxiety over em seeing my physical form	0	23	
"And it came to pass, as the angels were gone away from them into heaven, the shepherds said one to another, Let us now go ev..." ~Luke 2:15	0	0	
I like a challenge.	0	1	
used to live in Edinburgh: Drink/Eat @JosephPearces , Broughton St Deli, @angels _food , @RadissonEDI , chez Jules, @FriskyFroyo	0	1	
My pretty awesome Blue Angels Ocean City Air show footage from the weekend! https:// youtu.be/DibRZPXTHJc	0	1	
@BergeyLisa @nataya93 playing over the air in the City of Angels ... https:// twitter.com/whatsonkroq/st atus/877653356243636224 …	0	0	
THEY'RE SUCH ANGELS https:// twitter.com/Hj_0601/status /877445046097686528 …	0	0	
David Guetta ft Justin Bieber - 2U (The Victoria’s Secret Angels Lip Sync) https://www. youtube.com/watch?v=RqcjBL MaWCg&feature=share …	0	0	
Rawlings Official Yankees 100th Anniversary Baseball Unsigned Logo http:// ift.tt/2ssb8LB	0	0	
I'm not an atheist anymore, these are angels laughing pic.twitter.com/qCqp4RkW9A	0	1	
Aaron may be a Judge, but Cody is the Constitution!	0	1	
This is what vaseline is for	0	0	
RT ChiliPeppers: Listen to “Goodbye Angels ” now on Spotify #RHCP #TheGetaway https:// open.spotify.com/album/5nsPxa5D cIGon1O3qxLSvL …	0	0	
IM SOBBING THEY ARE ANGELS THEY DIDNT HAVE TO DO THAT https:// twitter.com/tourde_cbus/st atus/877642587229835264 …	10	33	
Angels - @chancetherapper https:// twitter.com/kelaiepi/statu s/876988846268977158 …	0	0	
@gerihalliwell - Angels In Chains A tribute to George Michael and the profits will be send to… https://www. instagram.com/p/BVnkmihjwzA/	0	0	
Yeah, lots of wall scrapers to the opposite field over there. http://www. hittrackeronline.com/detail.php?id= 2017_2283&type=hitter …	0	0	
when angels cry	0	0	
we love you too.	1	5	
If Robbie Williams played angels I'd loose my shit	0	8	
Nothing gets the mentions going like a factual chirp about the Yankees and red Sox	0	4	
Dragon and angels in tsne 2D 3D map QuickDraw #art #NewYorkCity http://www. formafluens.io/doodlemap.html ?set=dragon&country=DE … pic.twitter.com/0KnrbtP5YW	2	5	
I will say having @JeffFletcherOCR on Angels twitter is awesome. Always good stuff from him	0	0	
Recreation bus trip to the Yankee Game tonight! Geeat seats section 135 hopefully @TheJudge44 hits one out to us. @Yankees	0	0	
Siiii , lo vi. Yankees y Boston están peleando por el primer lugar...Lol	0	0	
now playing Rush - Clockwork Angels Tour DVD - Clockwork Angels https:// youtu.be/1JUK-P1_xqw via @YouTube	0	1	
White Angels ??? https:// twitter.com/Silau25/status /877652929469009920 …	0	0	
ANGELS INVADE the area of why we are afraid and FIX IT NOW !	0	0	
#Yankees Mariano Rivera's career ERA at home was 2.46. His road ERA was 1.94.	0	0	
8)--- We are the people and WE (((( must )))) UNITE for HUMANITY for our NEW ANGELS (((( KIDS )))) - As we all... http:// fb.me/44izW5pmp	0	0	
Working on a blog post about how problematic it is to call special ed teachers " angels ," tell them they're "going to heaven," etc.	0	3	
*are angels https:// twitter.com/heavlol/status /877651402935472129 …	1	2	
He signed with the angels	0	0	
" Angels doesn't feel.such things... and if they do, they don't say it."	0	0	
It's time for baseball in New York! The Yanks and Angels will matchup tonight on 1160/107.1 with pregame starting now.	0	0	
Framtiden Är Redan Här ! Har bloggat lite om NEW YORK YANKEES igen å OPTIMISMEN vi känner trots 7 raka förluster... https:// yacatchme.com/2017/06/21/fra mtiden-ar-redan-har/ …	0	0	
Thank God for his angels of protection	0	1	
#Cubs have now completed five season series, v. #RedSox , #Rockies , #Dodgers , #Padres , and #Yankees . And lost them all.	0	0	
Are you telling me that #Ellsbury is going to come back and #Hicks is going to sit???? Is that an "organizational" decision too?? #Yankees	0	2	
Anyway sleepy times. Good night Shuu Iwamine, if you're out there	0	0	
Ugh I love the @Angels and their twitter	0	4	
did you just imply Angels is a bad song?!	0	0	
Game Thread: Angels at Yankees 7:00 PM ET http:// ift.tt/2tuLpR0 - Go to the link to find online streams of the event, enjoy.	0	0	
Yankees better go back to winning tonight	0	1	
I look forward to the next Yankees first baseman, because Chris Carter is a flat tire and they can't count on Greg Bird anytime soon.	1	13	
Listen to “Goodbye Angels ” now on @Spotify #RHCP #TheGetaway https:// open.spotify.com/album/5nsPxa5D cIGon1O3qxLSvL …	331	1392	
"Slider? The only thing 'sliding' is Nolasco out of the Angels rotation after giving up b2b DOUBLE DONGS to Holiday and Judge in the 2nd!!!"	0	5	
Joe Girardi says Chris Carter's numbers aren't all that different from last year. http:// cbsloc.al/2sV8mzO #Yankees	0	0	
In #Syria War, there are NO angels , only MONSTERS May he RIP https:// twitter.com/ragipsoylu/sta tus/877651978146459648 …	1	2	
Angels RHSP Ricky Nolasco, who is 1-2 with a 5.91ERA in 4 career starts against the #Yankees , is tied w/Tanaka in AL most HR against (21)	1	1	
Moms are such selfless angels !!! They deserve the world and then some	1	1	
No better way to celebrate the #summer solstice than watching some #Yankees baseball!! @Yankee… https://www. instagram.com/p/BVnkYl_DeLi/	0	0	
WOW! Author @bradmeltzer threw out the first ball at Yankees Stadium. Congrats! https:// twitter.com/bradmeltzer/st atus/877556163281289217 …	0	7	
(New York Yankees Baby / Infant Go Team 3 Piece Creeper Set 6-9 Months) http:// allstarsportsfan.com/product/new-yo rk-yankees-baby-infant-go-team-3-piece-creeper-set/?attribute_pa_size=6-9-months … Baby / Infant Sizes 3 Piece Creeper ...	0	0	
There's no way he believes that. Why are you doing this to me Yankees ? https:// twitter.com/oysterbaybombe r/status/877643172888883200 …	0	0	
May Allah send angels to comfort his family, to whisper "sabr" in their ears, and grant her Jannah https:// twitter.com/umarfaruksadik /status/877253216093839360 …	0	1	
Dream with the feathers of angels stuffed beneath your head #np The Regulator - Clutch https:// open.spotify.com/track/1mTU4spq vM4ToSxL5iufN8 …	0	0	
Rays are creeping up and you and the Yankees . 2.5 games	0	0	
Joe Girardi says it's easy to make Chris Carter the scapegoat, but other factors are to blame for #Yankees ' skid. http:// cbsloc.al/2sV8mzO	1	1	
NEW Dark Angels & Pretty Freaks #podcast #170 "Circle Yurt" Our latest from #Jamaica ! #Fav5 things about... http:// fb.me/1w5qw3wLT	3	3	
demons, angels ...i'm willing to use whatever i can to save the people.	0	0	
Bernie Williams @bw51official on advice to @TheJudge44 : "Don't change anything!" (In live stream with @BrandonSteiner ) #Yankees	0	0	
No problem! Bars of the crossing keep randomly going up and down. Took an ambulance a bit to get through.	0	0	
List of pitchers since 1913 to have an ERA of 2.00 or less on the road. (min. 1,000 IP in career): #Yankees Mariano Rivera	0	0	
about the Yankees thinking Chris Carter is there BEST option pic.twitter.com/lHK8AXCy4b	0	6	
The TV that Judge smashed! #nyy #yankees #aaronjudgesmash #99 @Yankee Stadium https://www. instagram.com/p/BVnkSKOlqUT/	0	0	
Check out Los Angeles Angels Cooperstown Collection Ball Cap Fitted 7 3/8 Wool Blend #NewEra http://www. ebay.com/itm/Los-Angele s-Angels-Cooperstown-Collection-Ball-Cap-Fitted-7-3-8-Wool-Blend-/331951036291?roken=cUgayN&soutkn=JlJDHJ … via @eBay	0	0	
There is a heresy of Antinomianism but it was God who gave the Law (through Angels & a mediator) to a people, for a time and with a purpose. https:// twitter.com/victoryolaleye /status/877652049726504960 …	0	0	
Am not u dumb idiots I made all the intercession one , and the angels and jinn U forget and loop for boot again out	1	0	
Gostei de um vídeo @YouTube http:// youtu.be/RqcjBLMaWCg?aD avid … Guetta ft Justin Bieber - 2U (The Victoria’s Secret Angels Lip Sync)	0	0	
when angels cry :D	0	2	
The Angels know before you do exactly what you need...let it all unfold breathe. Awesome Day. https:// twitter.com/DoreenVirtue/s tatus/877632233523249153 …	0	0	
@DonegalHour My friend Helena @Busybeaders is making GAA angels in all county colours. Are you serious about your GAA and want to bring luck pic.twitter.com/k9F5tOn1pr	0	1	
@Lucas_Splatoon yooo have fun at the Yankees game	0	1	
THEY COULD AT LEAST GO WITH THE SAFEST AND STANDARD OPTION 7YEARSWITHTT BUT WHY ISNT IT WINNING I HATE ANGELS	0	0	
when angels cry !!	0	3	
Thanks 4 stay with #뉴이스트 despite everything. You are angels . https:// twitter.com/jrisbae/status /877624563848273920 …	0	0	
Market research: would a high angels share single barrel be interesting to people? We find these are the honey barrels, but also true in KY?	0	4	
@Mets y'all better rep for @PRODIGYMOBBDEEP the way The @Yankees did! QUEENS!!! #QGTM	0	0	
Girardi: Yankees ' Struggles Extend Beyond Chris Carter http:// cbsloc.al/2sV8mzO	1	0	
What's more fun than summer? The angels make friends, thwart a bully and solve the disappearing goat #mystery . https://www. amazon.com/Donna-Dolf/e/B 00JP7O9Y2 … pic.twitter.com/aB3FbTqUkh	0	0	
when angels cry te juro q te vas a matar xq louis es tan angelical en esa fic como lo es en la vida real	0	1	
#LaylatulQadr ..tht is worth a thousand months of prayers in which angels descend upon us not to leave the smallest space uncovered on earth	23	46	
#cardoftheday is six of water.we r now in cancer.the sensitive n water sign.all about listening… https://www. instagram.com/p/BVnkKlUj-11/	0	0	
The New York Yankees are Freemason clones conducting a hyper-sigil! I get all my news from tweets!	0	0	
More Yankees money pouring in tonight?	0	1	
Girardi on WFAN: #Yankees ' struggles extend beyond Chris Carter. http:// cbsloc.al/2sV8mzO pic.twitter.com/9mBpGUdOnO	1	2	
六本木ヒルズやべぇ。 ドラえもん大量発生じゃんか。 前野さんと見に行ったんだけど、ちょっとドラえもんいすぎて何が何だかわからなかった（笑）(t)	0	0	
goodnight,, i love this talented man with all my heart and i love my angels and mutuals a whole lot pic.twitter.com/iJUWKmaZWo	0	0	
What a Thrill. Congrats.	0	1	
Can't believe Yankees -205 that's a auto NO PLAY	0	4	
Adding #MLBPicks : #Indians / #Yankees parlay +138. #MLB #sportscapping #SportsBetting #gambling	0	0	
good morning angels	0	5	
I know it's crazy. @VladGuerrero27 gotta pull some strings and get that young man in an @Angels uniform.	0	1	
Cardinals 1 unit, Yankees 1 unit, Cleveland 1 unit, Twins 1.5 units, Seattle 1.5 units, Dodgers 2 units	0	0	
why is this happening to me and also why didn't i notice it BEFORE NOW	0	0	
can you take on my feelings, angels and demons	0	0	
Oh, Mr. Judge was handled pretty well last night and the Yankees are reeling bro! 7 in a row reeling. That game was garbage!	0	1	
Just watched this lady's car spin out and almost flip over in the rain with her baby inside... I thank god for gaurdian angels pic.twitter.com/QWrE70BWh0	0	5	
Can't believe #Angels let Fister walk. They have eight pitchers on their 40 man roster on the DL.	0	0	
Check out @FreshhMaxx ‘ Angels Of Bonnie & Clyde’ on The U Store @WGTSDB http://www. us1magazine.com/#!the-gud-tyme z-show-u-store/c1dxd …	1	0	
Thank you to @principalitysta stewards & @swpolice and PCSOs for keeping us all safe tonight at @robbiewilliams concert. #thankyou #angels	2	3	
Play him at 1B	0	0	
My angels keep on blessing me and the ppl around if they are willing to follow correctly	0	0	
Χίλια μπράβο Angels Team Athens! http:// fb.me/1ox6jNIl3	1	1	
Zille against the Angels | http:// bit.ly/2rWQPST	0	0	
#NowPlaying Birdy Not About Angels http://www. radionomy.com/letshearitfort hegirls- … #streaming #streamingonline #music	0	0	
Abraham and the Three Angels #symbolism #tissot pic.twitter.com/T9M8XsYApW	0	0	
Montgomery (4-4, 3.78) leads all #MLB rookies with 66K and has allowed the fewest HR (8) by any of the #Yankees 5 starters	3	0	
PARANOiA를 KCET ~clean mix~로 리믹스한 작곡가, 그 곡을 깨기위해 점심값을 아껴가며 도전한 학생은 먼 훗날에 만나서 Synergy For Angels 라는 곡을 만들게 된단다.	0	0	
Geri Halliwell - Angels in Chains https:// youtu.be/NmT2aSEayWQ via @YouTube	0	1	
Yankees game tonight pic.twitter.com/YHa2OYfvhw	0	7	
He does love his Angels #RobbieWilliams pic.twitter.com/Y8nUcUGdkK	0	1	
I meant angels but angles work too	0	0	
@JeffFletcherOCR do you have any recent Angels payroll columns? Interested on what Hamilton coming off the books impacts the outlook.	0	0	
Tim Tebow Gets Apology from Yankees Farm Team After Mascot 'Tebowed' - https://www. vm-videos.com/tim-tebow-gets -apology-from-yankees-farm-team-after-mascot-tebowed_c0c59ea5b.html … #VMVideos	0	0	
Gostei de um vídeo @YouTube http:// youtu.be/77vjNNzYchs?aA vantasia … - The Seven Angels - Legendado [ O Senhor dos Aneis]	0	0	
Yankees have lost 7 in a row. They have not lost 8 in a row since 1995. Yet their bats are so cold that they need a mirracle to win tonight	0	1	
I love blue angels aesthetic in vrains but I fucking haaaate her idoru voice	0	0	
If hypothetically the Angels are still in it at the deadline, what kind of move do you think they could and/or should make?	0	0	
"You and i say goodbye felt the angels cry"	0	0	
@infiniteyounges I just want to say, good night, sweet prince, may flights of angels sing thee to the rest. #성종아사랑해	0	0	
Blah blah blah. 0-7. Turn it around before yet another season is wasted.	0	0	
With Nolasco on the hill for the Halos.. I like the Yankees chances. Nolasco is garbage Weav!	0	0	
Yankees Avoid Sweep And Leave Home On High Note http://www. pinstripepower.com/2016/08/yankee s-avoid-sweep-and-leave-home-on-high-note-12/ …	0	0	
I use 9-5, tea tree toner, angels on bare skin, and vanishing cream	0	6	
fuck, those angels are hard to kill #tentabulge #eribot	0	0	
Oh Lord, I thought angels were just in heaven	0	0	
Did the angels steal your wines? pic.twitter.com/SII5NLKOLy	0	0	
Another HUGE break. Wake up tonight #Yankees & Thank you @Royals pic.twitter.com/3IXmQnJI6m	0	0	
Ok, so I understand this "Slants" is bad but "Niggas With Attitude" is OK? How abt "Damn Yankees "? "Dead Kennedys"? "Butthole Surfers"? STFU https:// twitter.com/washingtonpost /status/877646891835695104 …	0	0	
Grand Opening Of Seven Angels Of Heaven, Inc.: http:// youtu.be/4XdBDvNkRw8?a via @YouTube	0	0	
"It ain't oven, 'til it's oven" @Yankees #YogiBerra8RIP #OneLetterOffQuotes pic.twitter.com/g1GBxAPVXy	0	0	
#DFAClippard	0	1	
regrann from yuliawati.nst - There are some angels surround me. I… https://www. instagram.com/p/BVnjx9ZHgNm8 DVY28qW69UAPAUH0J2JewzSDwA0/ …	0	0	
All of these QB contracts will look like chump change when Bryce Harper goes to the Yankees for a billion dollars	0	2	
pic.twitter.com/Yd62TweXpM	0	1	
I see I wasted my time. Some haters will hate instead of thinking rationally. Conspiracy theory? If you think reps and Dems are angels ...	0	1	
Who will have The edge at the #HRDerby . Retweet for @Cody_Bellinger or like for @TheJudge44 #Dodgers #Yankees #MLB pic.twitter.com/ESXlNZVvtd	86	59	
That #Dodgers fan is trolling the #Yankees twitter account & tweets nothing intelligent but expects nice responses	0	0	
At this point Bill Buckner would be a better option. #Yankees https:// twitter.com/SlidingIntoHom e/status/877646887309852672 …	0	1	
Judge plays @home w/ a short RF for 81 games. A check swing will leave the yard.	1	1	
In my happy place at Yankee Stadium. Please win. Go Yankees . pic.twitter.com/SYrblyFSbj	0	11	
You looked good that day! TJ and his 70 mph pitches just out lasted you guys...	0	1	
#OOC "Cowboys & Red-Headed Angels " RP vs @Fighting_Champ @UWENetwork #OTTXX http:// live.uwelegacy.ca/topic/11032083 /1/ …	1	1	
Mlb>The 7 biggest factors in the Yankees ' 7-game losing streak - Why.. http:// bit.ly/2rSWjD8 #MLB pic.twitter.com/nAVcBlo49l	0	0	
Yankees going for 8 in a row tonight pic.twitter.com/Q3x0kykzAL	0	0	
I don't care about this stat or who plays first base. I just want to see us win. Enough hard luck losses already.	0	2	
Calling All Angels and Abraham-Hicks Lovers http:// buff.ly/2syopka #BookClubs #UpForDiscussion #BookLovers #WritersLife #BookWorm #Spirit pic.twitter.com/N3995UccDZ	0	0	
Freeman is doing this to make his team better. Angels have a good SS, Braves don't have a good 3B, but have both an Elite 1B and a Good 1B.	0	0	
They are both angels sent from heaven	0	1	
turns out we aren't your angels soz	0	0	
Is the #Yankees "Organization" smoking crack?? it seems like a no brainer to bring up #Austin !!! #TeamTyler all the way!!!	0	3	
I liked a @YouTube video http:// youtu.be/lILihKH7FBM?a MARVELL - ANGELS (Nelson Mandela Tribute)	0	0	
don't give your full confidence to anyone.. Remember that the devil was one of the angels ♡	0	2	
(New York Yankees Baby / Infant Go Team 3 Piece Creeper Set 3-6 Months) http:// allstarsportsfan.com/product/new-yo rk-yankees-baby-infant-go-team-3-piece-creeper-set/?attribute_pa_size=3-6-months … Baby / Infant Sizes 3 Piece Creeper ...	0	0	
That's my Bae	0	0	
Out of this world & so mind blowing what @TheJudge44 does! #AllRise #GoYankees pic.twitter.com/Id9dv1Cro6	0	0	
you misunderstand. the yankees are an evil team but baseball is not an evil sport - every football team is evil because football is evil	0	4	
Matt Adams is fueling the braves lineup, EYJ is not fueling the angels	0	0	
i reaaaaaaaaaaally hope sonny doesn't go to the yankees	0	0	
New Era 59fifty MLB New York Yankees Cap Size 7 1/4 New Old Stock! http:// ift.tt/2rWNrr5	0	0	
Estoy contigo	0	0	
Post #cxnyc activities. #yankees #yankeestadium @Yankee Stadium https://www. instagram.com/p/BVnjpDYF8KM/	0	2	
Zille against the Angels http:// ift.tt/2sCbOwe	0	0	
Stadium bound with @RealTweetsMcgee .. HOW YA DOIN YANKEES	0	1	
Começa a tocar angels de the xx eu já sinto uma paz dentro de mim	0	0	
Only 3 I like tonight Indians -1.5 (-120) 2* Angels +1.5 (+105) 1.5* CWS/Twins U 9.5 (-120) 1* Will hope to climb the ladder here.	0	1	
They are due, but I knew Pineda at - 300 last night was a joke. Montgomery not great, edge to Angels . Yankees offense has been poor.	0	0	
Also it seems as my last 7 #Yankees game have all come via free tickets. Can't remember last time I actually purchased a ticket here	0	0	
