
Would Chris Carter have caught that? Matt Holliday unable to come up with a popup. E3 #Yankees	2	6	
I feel like the Yankees boy my hittas can't miss	0	0	
Matt Holiday allows a foul ball to drop. Chris Carter makes that play! #yankees	0	3	
So Nelson Cruz is in a T Mobile commerical wearing a Mariners jersey but asking if he could watch the Angels game on some other dudes phone	0	0	
Ya aussi les yankees a rds 2	0	1	
Promise you it's like angels eat hazelnuts and they're like yo bro humans got to try these	0	0	
@YESNetwork @Yankees - is that Ricky Nolasco or Greg Maddux? #YANKSonYES	0	0	
remember when bible AD had angels as MEN OF COLOUR and it was the best biblical casting choice in history? pic.twitter.com/qW7cdQxhkP	2	24	
Longest day of the year.. sitting outside listening to the Yankees instead of watching. It's beautiful out	0	0	
These children are real angels , may God bless 'em & everything in their lives become normal again Ameen	0	7	
Wish someone could explain to me why Brett Gardner NEVER runs anymore. It's maddening to see a leadoff hitter w/ speed do nothing #Yankees	0	0	
Watch New York Yankees vs Los Angeles Angels LIVE STREAMING HD FREE BASEBALL MLB http:// pupless.com/watch-new-york -yankees-vs-los-angeles-angels-live-streaming-hd-free-baseball-mlb/ … pic.twitter.com/ZMrExFvGX1	0	0	
hope the angels will bring you back to me	0	0	
LeBron James, Metta World Peace, Yankees Pay Tribute to Prodigy | Bleacher Report http:// bleacherreport.com/articles/27171 25-lebron-james-metta-world-peace-yankees-pay-tribute-to-prodigy?utm_source=twitter.com&utm_medium=referral&utm_campaign=programming-national …	0	1	
Rough start for Yankees stack	0	0	
26. Aquatic Angels segment - Lindsay Ellingson, 2011 pic.twitter.com/PEfgpQkMTB	1	0	
No. The pugs are sweet baby angels who are very friendly.	0	1	
Just in case the Yankees decide to suck tonight pic.twitter.com/DfsCczPYoD	0	16	
I always thought London air conditioning was powered by the faint breath of angels . Angels who were very far away.	0	1	
Angels release SP Doug Fister at his request http:// dlvr.it/PP648m	0	0	
Angels release SP Doug Fister at his request http:// dlvr.it/PP646Y	0	0	
To get a FREE 1 card reading with the A Pocketful of Angels Cards CLICK HERE http://www. pocketfulofangels.com/orderform pic.twitter.com/9nu70Ez8o0	0	0	
レイラン「自分の名はレイラン、オラクル船団のフェオに住んでいる。仕事は主に暗殺や斥候などと多岐に渡る。そんな自分だが、最近 厳ついキャストに追い掛けられ『体を見せろ』と至極気持ちの悪い事を言われていて、仕事どころでは無い。誰か助けてくれ。」 Angels 「」	0	0	
Angels , much like mountains, do not exist...	0	0	
¿Cuáles piezas buscarían los @Yankees _Beisbol para reforzarse en julio? #LasMayores #MLB Entérate http:// atmlb.com/2srYoEM pic.twitter.com/cIa9DpXfjb	6	8	
Intermedia // Джери Холлиуэлл вспомнила Джорджа Майкла в клипе « Angels in Chains» (Видео… https:// goo.gl/fb/jGcHrx	0	0	
Archangel Michael is the captain of all the angels and archangels. He serves on God's blue ray which is the ray of protection.	13	30	
Feliz Solsticio!!! : estoy viendo Los Angeles Angels vs New York Yankees	0	0	
Yankees just lost Aaron Judge, he is now guessing pitches ala AROd watching right down middle of plate with two strikes.	0	0	
pensar que antigamente o povo curtia soad só pelo som e pq "i cry when angels disearve to die", sem nem sacar o que tinha por trás	0	0	
@loosewomen Thor Dark World inspired soundtrack for Londoners overcoming terrorism. Real Guardian Angels do really exist out there	0	0	
I'm sorry but who hurt you. We are angels https:// twitter.com/scroogebosss/s tatus/877661785129484288 …	0	0	
Richie is posting about soccer even though I brought him to a Yankees game...some one let me know why that is..	0	2	
Happiness is taking your grandson to a @Yankees game. pic.twitter.com/FzwqyCGXlM – bei Yankee Stadium	0	30	
LA Angels vs. New York Yankees 6/22/17 – Predictions Pick Preview and Odds: The LA Angels … https:// goo.gl/fb/n1q5it	0	0	
Beware the Angels .....	0	0	
I'm currently watching the Yankees too	0	0	
Impromptu #Yankee game! Happy #summer #baseball #yankees (@Yankee Stadium - @mlb for @Yankees @Angels in Bronx, NY) https://www. swarmapp.com/c/47K79E7qLEX	0	0	
That's an odd approach with 2 strikes. He didn't do that before. Why start now?	0	0	
In honor of #NationalSelfieDay & almost 4 month in #NYC , time for a @Yankees games! pic.twitter.com/8lJmTQ4UUo – bei Yankee Stadium	0	19	
Omg omg I want 2 thank my angels @penisstagegirl @linnylinc I'm at #TheTotalPackageTour Gracias!I got upgraded from the 300 to the 100 babe! pic.twitter.com/5chZMWvD4m	0	2	
Don't joke lol. The #Yankees bats have gone quiet in their last 7-8gms!	0	0	
B-1st: IT’S A RALLY! RBI singles by @TitoPolo23 , @GosukeKatoh and Sharif Othman. BIG 3-run 2B by Jhalan Jackson! #Yankees 6, #FireFrogs 1.	1	0	
today was one of the harder days of my life but i know i have one of the most beautiful angels watching over me now i love you devin ray	0	3	
るぅ「さいきんは第二の生活にも慣れて、『喰事』もたのしくなってきたよ(>ω	0	0	
Lets go yankees !!	0	1	
Join me in the magic of Destination: Dreams! https:// lucktastic.com/twShareFunnel pic.twitter.com/tnteqBAIqI	0	0	
Happy day to you April, Oliver and Taj! See you soon!	0	0	
Angels 0 Yankees 0 [Top 2nd] [0 Out] [0 balls] [0 strikes] ... No one on [P: #47 Jordan Montgomery] [B: #2 Andrelton Simmons]	0	0	
Dodgers have Seager and Bellinger playing like MVP's Lakers are getting Paul George Galaxy getting Zlatan City of Angels in the come up	0	1	
I really need the @Phillies & @Yankees TO WIN #TONIGHT	0	0	
Happy Father's Day! @yankees #fathersday #yankees https://www. instagram.com/p/BVnr00OFOXi/	0	0	
viendo Los Angeles Angels vs New York Yankees	0	0	
Rick Astley - Angels On My Side @rickastley I this song. https://www. youtube.com/watch?v=cc91Ef oBh8A&feature=share …	2	3	
If you think that the #Yankees should bring up #TylerAustin , then RT this tweet or tweet on your own with the hash tag #TeamTyler	0	0	
Angels Yankees let's go	0	0	
Lol yankee fans panicking always makes me smile! Let's go angels !!!	0	0	
@Yankees @lzhernandez02 pic.twitter.com/MoWaGC2S3i	0	1	
Underdog market? They call themselves the Los Angeles Angels ....	0	0	
Angels Notes: Doug Fister exercises his opt-out http:// newsbry.com/angels-notes-d oug-fister-exercises-his-opt-out/ …	0	0	
Yankees tilt after the 1st	0	0	
All we need is god our guardian angels and love That will heal all	0	0	
watching Los Angeles Angels vs New York Yankees	0	0	
Knew I shouldnt have went with the Yankees ..gonna score like 3 runs and be so disappointing	0	1	
@Yankees @lzhernandez02 pic.twitter.com/smkCehqhc1	0	1	
If the Yankees would quit guessing thatd be great	0	0	
Nolasco is awful. #Yankees need to drop 8 on him. He's legit bad	0	1	
Angels 0 Yankees 0 [Bottom 1st] [2 Out] [0 balls] [0 strikes] ... Man on first [P: #47 Ricky Nolasco] [B: #17 Matt Holliday]	0	0	
Ricky Nolasco - Los Angeles Angels (1 today, 2/3 IP, 14 pitches)	0	0	
I fade chalk stacks. Yankees	0	0	
Various Artists Angels In The Snow - Now Playing http://www. irishtouristradio.com	0	0	
Angels Notes: Doug Fister exercises his opt-out http:// bit.ly/2sX7qdK	0	0	
#Angels @#Yankees [B1-2o]: Aaron Judge (looking; 1) RHP Ricky Nolasco (1) Seq: SL○ FT ff FF○ s3: 93.7mph Four-seamer	0	0	
We were able to speak and read God ordered the Angels to teach Adam all there is to know about the earth.	0	0	
Why Yankees feel stuck with Chris Carter, more Brian Cashman takeaways http:// s.nj.com/Muo9vMj	0	0	
Yankees should be the only team allowed to shift	0	0	
Good Evening Angels , Hoping you are all enjoying your Weds. I've been super duper busy. Sending you lots of love, Dancing Angel Rachelley xo pic.twitter.com/xLpnv70Bkx	0	0	
Let's go @Yankees , we must WIN in an new W steak! @Annnyynyg @Mandaaa1727 @NYsportsfan2015 @jennaNYfan @NYYCoolJoe @JeterGoat @BabyBombers	0	2	
Leyendo: Hells Angels /Into the abyss by Yves Lavigne. #hellsangels #yveslavigne #biker #road … https://www. instagram.com/p/BVnrpwmj7WP/	0	0	
Quiero decir q a mi when angels cry me aburrio bai — try me bitch https:// curiouscat.me/lwtxhappily/po st/167507838?t=1498087639 …	0	0	
Ça peut autant être un coup des chiens yankees que des chiens wahhabis. Ils se valent dans la destruction des pays arabes.	0	0	
Robins appear when angels are near	1	0	
And angels pic.twitter.com/1u9GjJHN0S	0	0	
Yet the Yankees have lost 7 in a row… so there’s that	0	1	
WATCH: Why Yankees replace Chris Carter with Tyler Austin yet http:// s.nj.com/KPjIPGR	0	0	
Let's brake this 7 game losing streak @Yankees	0	0	
A few minutes late today. Go Angels , get those Yankees !	0	0	
9 game losing streak vs 7 game losing streak. #Yankees https:// twitter.com/BryanHoch/stat us/877668911776399361 …	0	2	
@Yankees @lzhernandez02 pic.twitter.com/OJ4fmVieOT	0	1	
That's how they're going to have to win right now. I can't stand anyone in that bullpen. Especially clippard.	0	0	
I guess I gotta switch my angle now take a positive look hit a blunt, big brother wit the angels now.	0	0	
Sacred Fire https:// youtu.be/MY3EwgdIhRQ via @YouTube ~ Angels of the Violet Flame . . . pic.twitter.com/iSg3ioQGO2	0	1	
Angels 0 Yankees 0 [Bottom 1st] [1 Out] [0 balls] [0 strikes] ... Man on first [P: #47 Ricky Nolasco] [B: #99 Aaron Judge]	0	0	
Yankees need to win tonight	0	0	
MLB: $700 *FREE PARLAY* YANKEES / TWINS -ML's (WIN $933) - See more at: http:// ibnsportswrap.com/freePicks.php#sthash.8ziA2ADO.dpuf …	2	1	
I mean I like the Yankees but I'd feel like a fraud and I'm not a gryffindor but Jess and I feel similarly abt many aspects of hp!	0	2	
two angels pic.twitter.com/9rr7NV0Z1h	0	0	
Still in the 1st, the T-Yanks bat around as @GosukeKatoh and Sharif Othman add RBI singles. #Yankees lead the #FireFrogs , 6-1.	0	0	
@justaskinnyboy @KatieSSpeaks @AndreaLausell are all angels from literal heaven and I love them so much	0	1	
So, will the Yankees make me fling shiate at the TV for consecutive nights?	0	0	
Andrelton Simmons is a magician. #Angels	0	1	
فتحت الرسالة بالغلط	0	0	
Good news for the Yankees : the Angels have lost each of Ricky Nolasco's last nine starts. He’s 0-6 with a 5.51 ERA in that span.	13	62	
#FREE Tears for Her Dragon (Dragon Guard Series Book 16) by Julia Mills http:// amzn.to/2rEcv73	0	0	
Alright @Yankees let's get back in the win column tonight	0	2	
Lord please let the Yankees win today	0	0	
Nas - Some Of Us Have Angels https:// youtu.be/Dr30pimzqF0 via @YouTube // Jinns..	0	0	
Angels would trade in their wings for these. pic.twitter.com/IAc5TA5uiJ	1	6	
For I am convinced that neither death, nor life, nor angels , nor principalities, nor things present,... https:// tmblr.co/ZQ9A-r2M_2H1X	0	0	
https://www. ruthiansports.com/new-york-yanke es/2017/06/21/yankees-hey-no-kidding-its-getting-late-early-out-here/ … Yankees : Hey, no kidding, it’s getting late early out here By Steve Contursi The Yankees and their current sl...	0	0	
Lets just hope Montgomery can go 7 and betances and Chapman can pitch 8&9 cuz if I see Tyler Clippard tonight Im gonna start breaking things	0	0	
https://www. ruthiansports.com/new-york-yanke es/2017/06/21/watch-why-yankees-replace-chris-carter-with-tyler-austin-yet/ … WATCH: Why Yankees replace Chris Carter with Tyler Austin yet By Brendan Kuty | NJ Adv... pic.twitter.com/pbKOslaqq8	0	0	
all of our angels deserved the world :( i Miss them so kyvh omg	0	1	
I miss when the yankees scored 8 runs a game and ended games in the first 3 inning	0	0	
The demons respect me, The angels protect me	1	0	
For I am convinced that neither death, nor life, nor angels , nor principalities, nor things present, nor things... http:// fb.me/6IX27Jdt6	0	1	
Angels in the rain	0	0	
Lets Go Yankees !! #NYYankees pic.twitter.com/ZDL7byzoxZ – bei Yankee Stadium	0	0	
@kpoppinkluv 固定リツありがとうございます♡ フォローさせていただきました！	0	0	
This is how low the bar for the #Yankees is right now. I'm excited for a lead off walk. In the 1st inning.	0	0	
Special kids are heaven's blessing to parents. Angels on earth. Their eyes and smile reflect purity of soul. #ALDUB101stWeeksary	7	2	
watching Los Angeles Angels vs New York Yankees	0	0	
one month since our gorgeous angels got taken away xxx I love you forever, I mean it. always with me and never forgotten. rest beautifully	2	7	
omg my ultimate bias and bias wrecker. you guys look so handsome, as always!!! I love you two so so so so much, my perfect angels .	0	0	
@ziyo00 固定リツありがとうございます♡ フォローさせていただきました！	0	1	
Time to get back on track, #Yankees	0	2	
Yankees better win tonight and break my #espnstreak losing streak.	0	0	
Mirroring Claybin, Gardner starts things off with a walk for the @Yankees .	0	0	
28. Silver Screen Angels segment - Lindsay Ellingson, 2012 pic.twitter.com/EvEhcoZN4X	1	0	
https:// youtu.be/13KgHSS6URE Feel the spirit in the earlier version. It's palpable in 2012 compared to the depressed 2017 version. Angels	0	0	
Angels 0 Yankees 0 [Bottom 1st] [0 Out] [0 balls] [0 strikes] ... Man on first [P: #47 Ricky Nolasco] [B: #31 Aaron Hicks]	0	0	
Yankees need to be all over Nolasco tonight	0	1	
Kid in front of me at Yankee game has a "CAVS IN 8. LBJ THE GOAT" sign. Yankees fans are the WORST	0	5	
I think it's better if Ricky walks guys like Bridwell did, rather than throw meatball pitches these #Yankees can crush. #Angels	0	0	
Plan your weekend June 23-25: Pride parade, Lego art, Tampa Theatre beer fest 'Barley's Angels ' | Things to do in... http:// fw.to/EiImhzE	0	0	
I'm going to miss my angels @SineaddeVries @StephanieLGray @Megha_Boss @AshleyMova pic.twitter.com/cKJsQeLSQ0	6	48	
Game time #Yankees #Angels #玉子焼き pic.twitter.com/WR13z0qsOo	1	5	
i felt like i know more angels through pd101	0	0	
Let go Yankees it's time to get back to winning ways	0	1	
A lead off walk for Gardner to start the game! #Yankees	0	2	
Posts from Angel's Guilty Pleasures for 06/21/2017: http:// eepurl.com/cTpy41	0	0	
The Nexis Secret: A YA Novel . @HartzlerBarbara #YA #Fantasy #Romance http:// readersgazette.com/world/moreinfo /B00ZGUOHLW/ … Angels . A Seer. A secret strugg #novels 1 pic.twitter.com/lHM7AV3A2A	0	0	
#Prodigy R.I.P. Prodigy sad to lose you. Pain no more. Thank you for the lyrics. Fly with the angels	0	0	
of course it was Rutgers Day at YS and Ash was in the announcing booth and Jimmie was there .. should have went	0	2	
Why do Yankees Angels games take so long lol	0	0	
UM ANGELS EXIST https:// twitter.com/chwvln/status/ 877634650981765120 …	1	1	
So far I've seen: Nats (me, does that count, lol), Yankees , Angels , Cubs, Red Sox (wtf are they doing here??) and Blue Jays	0	0	
#StopSleepingOnTARA T - They A - Are R- Real A- Angels	7	6	
that's right sweetie, thunder is just angels bowling. lightning is angels taking pictures. and rain is the angels taking a pi	0	0	
Thanks @BankofAmerica for the chance to see my @Yankees in action! #MLBmemorybank #sweepstakes	0	0	
Sorry @RealMichaelKay I've watched the last 15 games in a row. Going to take one for the team to get a win tonight! #go #yankees	0	0	
Dear Dad, I love you and the Yankees !	0	0	
Come on @Yankees let's score a lot of RUNS and win today	0	0	
This feels like a get healthy night for the #yankees against Ricky Nolasco and his 5.01 ERA.	0	3	
A worst relief pitcher for Yankees last year. He was like clippard last year	0	1	
ESPYS here come the Judge! Phrase being used long b4 NY knew about this #BulldogBornBulldogBred all-around nice guy/athlete.	0	0	
Beautiful day for a ball game. Let's end this losing streak! #yankees #baseball #mlb … https://www. instagram.com/p/BVnrJboDxAH/	0	0	
Angels release SP Doug Fister at his request http:// dlvr.it/PP61cK	0	0	
Angels release SP Doug Fister at his request http:// dlvr.it/PP61b9	1	1	
Not About Angels https://www. instagram.com/p/BVnrKM9Fez3/	0	0	
Angels release SP Doug Fister at his request http:// dlvr.it/PP61bS	0	0	
Yankees 's offence is very facinating this year. I'd like to see them at Yankees Stadium.	0	0	
#Angels Look pic.twitter.com/Iy2wdrReyn	0	2	
angels , the lot of them	0	1	
@TeamCrisciRacin	0	1	
Two angels	0	2	
Othman with a single up the middle Katoh scores after stealing a base 6-1 #Yankees	0	0	
"GODS" fallen angels and demons can impress themselves as " ideas ' IN MATTER !	0	0	
If they keep playing well. Unfortunately ,the Yankees #1 prospect Gleyber Torres is out for the year. They might have brought him up for 3b.	0	0	
I would love to see another one of his multi homer games that he has had in the past #Yankees	0	0	
Yankees should put up about 45 runs on Nolasco tonight	0	1	
@Wilnerness590 Vladdy Stories I recall him leading off for the Angels @an ASG, taking100mph outta the zone yard. A microcosm of his talent	0	0	
how could u be so mistaken i guess angels can only see others as the same	0	0	
Nolasco hasn't had a good season by any means this year. If the @Yankees are to snap this losing streak, this is they guy to do it against.	0	0	
Angels Flight A Harry Bosch Novel - #prepper http:// bit.ly/1rwugUp	0	0	
Scotty and Todd are angels pic.twitter.com/wm9GBxde2C	1	4	
Think if he was playing with the Yankees or Red Sox, he would be a front runner for MVP.... his cycle hardly got a mention outside of Denver	1	2	
If the #Yankees don't beat Ricky Nolasco today I am done with hoping for the playoffs this year.	0	0	
Surely we can beat Ricky Nolasco today right?? #Yankees	0	0	
Enjoying an evening of Yankees Baseball. Rest and relaxation. Third baseline seating.	0	0	
Hey @Yankees , end the losing steak tonight.	0	4	
Cool	0	0	
Big things to come from Jordan Montgomery of the #Yankees . Leading all rookies in strikeouts.	0	0	
Collab with my angels : @oraltwjnk @rachelcmakeup @chwehan @CHAMPAGNESUNS @glowspice @hondreanicole @ridimakeup <33 :)	0	10	
Jordan Montgomery had good first inning and now Yankees can take lead with Aaron judge #all rise	0	1	
写真はまだ積もる前に撮った前野さん。レギュラーじゃない仕事でたまたま一緒になったんですが、この時はこんな大雪になるとは思ってもみませんでした…(t)	0	0	
Let's Go #YANKEES	0	0	
弟が帰ってきて、明日受験がんばってね、ってにこにこしながらランドセルから給食のクロワッサン出してきた。給食我慢してまで…( ;o; )こんないい弟をもってほんとによかったよ pic.twitter.com/H5zmxDThH7	0	0	
Preciso aprender a fazer trufa se não a Mariana vai me falir	0	0	
Ahhh, if only it had been the 2nd! I'd have loved to go to this, but not enough to miss Angels in America. https:// twitter.com/WaterstonesPic c/status/877506987889762305 …	0	1	
Me too! :) #Yankees https:// twitter.com/JRRestaino/sta tus/877667370126512128 …	1	0	
be safe, angels you're not alone eat proper meals & get a lot of rest you're important, your health's important I love you so much @BTS_twt	10	27	
watching Los Angeles Angels vs New York Yankees	0	0	
#MLB (4U) YANKEES F5 TT o3 -130 (2U) PHILLIES/CARDINALS F5 u5 -130	0	0	
I was there.	0	0	
I'm gonna run of words tonight if the Yankees lose to Ricky Nolasco	0	0	
yankees are going to win 15-3	0	1	
No first inning runs... progress. #Yankees	0	0	
Let's Go Yankees !!	0	0	
Yankees : It&#039;s sure getting late early out here http:// yanksgoyard.com/2017/06/21/yan kees-need-front-office-help/ …	0	0	
Lo estoy buscando y no lo tienen	0	0	
Damn Yankees	0	0	
Montgomery works around the leadoff walk! Nolasco gives up a lot of homers, Yankees hit a lot of homers. Let's make this happen!	0	0	
Now that's it's been brought to my attention I think it's the makeup and angels as to why she looks Kim to me lol	0	4	
WATCH: Me yelling at your face for a full minute | http://www. nj.com/yankees/index. ssf/2017/06/watch_why_yankees_replace_chris_carter_with_tyler.html … #Yankees	0	3	
Hey @Yankees , why are there 15 entrances for 50000 people? Asking while I stand outside the stadium missing the game.	0	0	
my roommates are literal angels la while me a total shaitonirojim	0	0	
BIG thank you to the @alzassociation and @lzhernandez02 for coming by the Stadium! #ENDALZ pic.twitter.com/779t54fdwj	99	486	
I wish good night sweet dreams to you too @mikeshinoda and @ChesterBe may the angels guard your dreams. Never forget this: -	0	3	
Bien dicho!!!!	0	0	
I hope the Yankees lose 3/4 of the game then magically pull a Brady for your Birthday	0	1	
Let's go Yankees ! pic.twitter.com/PgQZ6i7tP0	0	0	
It's a little sad watching Albert Pujols now & remembering the terror he used to be. Second night in a row #Yankees pitching got away w one.	0	0	
Nice to see #Montgomery get through the inning with no damage!!!! #Yankees	0	2	
No damage inning for Montgomery. Let's Go Yankees . Let's put Runs on the board !!!	1	5	
Shit lit RT @lesliewithano : Nothing I hate more than taking the 4 train when there's a Yankees game	0	0	
New York City News Search ( Yankees On Demand: One Step Ahead) New York City News & Search - https:// 1newyorkcity.net/yankees-on-dem and-one-step-ahead/ …	0	0	
It's what I get for living in CA. Thank god MLB changed the blackout rule because I'd be ballistic if I was stuck with Angels b'cast.	0	1	
#angels vs. #Yankeed pic.twitter.com/QLKn4vrBR3	0	2	
MLB Play : Over 10 /10.5 in NY Yankees vs LA Angels	0	0	
Thanks to a generous support we brought the @chsaabaseball Champions to @Yankees Stadium for tonight's game against the @Angels pic.twitter.com/ICkKYEObzd	1	0	
#LetsGoYankees #Angels (37-37) Vs #Yankees (38-30) R. Nolasco (2-8, 5.01) Vs J. Montgomery (4-4, 3.78)	0	0	
Finally made it @yankees #yankeestadium #nyyankees https://www. instagram.com/p/BVnq0KXl7W1/	0	0	
Montgomery gets out of the 1st inning with no runs, let's go hit! #Yankees	0	0	
Do you know, did Fister refuse another MiLB start or had Angels seen enough and released him?	0	0	
I liked a @YouTube video http:// youtu.be/AwtcNu2omCk?a Angels Caught on Camera: True Stories of Divine Intervention	0	0	
Do Angels fans have more baseball smarts than other teams? Try the hot new game that lets you find out! http://www. predictbaseball.com pic.twitter.com/xskMqqOIDI	0	0	
Do Yankees fans have more baseball smarts than other teams? Try the hot new game that lets you find out! http://www. predictbaseball.com pic.twitter.com/mH3Bq4yqmi	1	1	
If there is something I learned in Persona 5, I've learned to have a seething hate for all angels except for Dominion.	0	4	
Eureka! I figured out how to include celestials/ angels in Radiant! I can't believe I didn't think of this before	0	1	
#Angels was that Ricky Nolasco sportin' a #FOHAWK ?	0	0	
See Andrew Garfield, Nathan Lane & More in the Trailer for National Theatre Live's ANGELS IN AMERICA Broadcast http://www. broadwayworld.com/article/VIDEO- See-Andrew-Garfield-Nathan-Lane-and-More-in-the-Trailer-for-National-Theatre-Lives-ANGELS-IN-AMERICA-Broadcast-20170621 …	0	0	
Any scoreless inning pitched by the Yankees is a big achievement at this point.	1	3	
@thacoachmike has to be jealous seeing @j3vans1_ hanging out with the Yankees tonight. #GoPokes	0	1	
#Yankees a scoreless first!	0	1	
Shorthand and the Language of Angels – S&L Short Clips https:// youtu.be/ChlP_3E15Ao via @YouTube	0	0	
I agree!!! Love having the Yankees to look forward to	1	1	
Angels 0 Yankees 0 [Bottom 1st] [0 Out] [0 balls] [0 strikes] ... No one on [P: #47 Ricky Nolasco] [B: #11 Brett Gardner]	0	0	
Good job Montgomery!!! #Yankees	0	0	
But y'all know I love my Yankees . Still hate you tho how bou dat	0	0	
I liked a @YouTube video http:// youtu.be/xN2Aw7kO4-4?a Tim Tebow Gets Apology from Yankees Farm Team After Mascot 'Tebowed'	0	0	
#Gumby #Yankees will go to hit not trailing yet.	0	0	
Castro just saved a run #Yankees	0	0	
アメブロを更新しました。 『断捨離は続く・・・　粗大ごみを出したり、フリマに出たり』 http:// ameblo.jp/angels-rainbow /entry-12285558602.html …	0	0	
A "zero" put up in the first. Baby steps #Yankees	0	3	
Happy Summer angels , shop this cute scalloped dress on http:// COLLECTIONSBK.COM (link in profile)… https://www. instagram.com/p/BVnquZgF8sc/	0	0	
Good start for Montgomery! #Yankees	0	3	
No @Mets hat? Or at least @Yankees !	0	2	
Road Dog Play computer rooting for LA Angels , on paper looks one sided: (will yanks lose 8 in a row: 7 players hitting over .333 vs Nolasco)	0	0	
nope	0	0	
Not bad, Monty. #Yankees	0	1	
يمه منهم	0	0	
i never thought i would be homesick for myrtle beach yet here i am, miserable in the city of angels	0	4	
#capnight #MobilizingNYY #yankees #mlb #cannon #bxbomber2011 @Yankee Stadium https://www. instagram.com/p/BVnqqn6FNoK/	1	0	
Can't believe it's ALREADY been 1 month since the 22 angels were stripped from their life. Fly high angels , always in my thoughts.	0	3	
@MLBTV @MLBFanSupport How come the Yankees vs Angels game is unavailable to be watched live in Australia?	0	0	
Dr. David Altchek to perform Tommy John surgery on Yankees ' Gleyber Torres: 4 insights http://www. beckersspine.com/sports-medicin e/item/37196-dr-david-altchek-to-perform-tommy-john-surgery-on-yankees-gleyber-torres-4-insights.html …	0	0	
angels :-( https:// twitter.com/Gotham3/status /768137348479590400 …	0	0	
M.L.B. (20h05) em http://www. teletelabrasil.com +Opções* (PC, Mobile e Console) 1) Angels X Yankees 2) Cardinals X Phillies *Opções na Playlist	1	0	
Angels 0 Yankees 0 [Top 1st] [2 Out] [0 balls] [0 strikes] ... Man on second [P: #47 Jordan Montgomery] [B: Yunel Escobar]	0	0	
Please win today. #Yankees	0	0	
Actually that's false cause the Yankees Finna sweep the sox in the AL championship	0	0	
