
Happy 54th B-Day to former Mariners, Astros, D-Backs & Yankees Ace Cy Young winning P Randy "The Big Unit" Johnson!	0	0	
This hasn't aged well... #RedSox #Yankees https:// twitter.com/tim_cook/statu s/873378191217504257 …	0	0	
Whole city of cheaters RT @mashable : The Boston Red Sox used Apple Watches to cheat against the Yankees , report says http:// on.mash.to/2iZFqm2	0	1	
Boston Red Sox Use Apple Watch to Help Steal Signals from New York Yankees https:// goo.gl/fb/z8recr	0	0	
OF Austin Hays joins the @Esurance #CallUpWorthy club with his first promotion to the @Orioles ! pic.twitter.com/cGFXEnQSxT	10	26	
The Margin: Red Sox caught using Apple Watch to steal signs from Yankees http:// ow.ly/y4fp50dRzd3	0	0	
Jealous @Grace4Joy1328 @Yankees	0	1	
The Margin: Red Sox caught using Apple Watch to steal signs from Yankees http:// ift.tt/2x9lzY8	0	0	
Report: Red Sox used Apple Watch to steal Yankees ’ signs http:// ift.tt/2wDFdK1 #Denver	0	0	
[TECH NEWS] Red Sox said to use Apple Watch to steal signs from Yankees - CNET http:// ift.tt/2xMm4Ev	0	0	
Ahora #EnVivo por http:// bit.ly/ESPNplay NEW YORK YANKEES vs. BALTIMORE ORIOLES por la #MLBxESPN .	0	1	
"Report: Red Sox Used Apple Watch to Steal Yankees ' Signs" by THE ASSOCIATED PRESS via NYT http:// ift.tt/2eD2odT	0	0	
All aboard the express to success! Next stop: Yankee Stadium! Take 30 seconds to enter Fiverr + New York Yankees ... http:// bit.ly/2eISN9d pic.twitter.com/6HOKGYXQrk	0	0	
Rudy Monteagudo Tip: Red Sox stole signs from Yankees , others using Apple Watch http:// ow.ly/5gB450dRzca	0	0	
Boston Red Sox Used Apple Watches to Steal Signs Against Yankees - The New York Times #Wow lol https:// apple.news/AVjkfSgjdR-Oqu jjnN0vYAQ …	0	1	
I didn't realize this was what the #RedSox had in mind when they said they wanted to lead the league in steals... #Yankees #stealingsigns	1	2	
The Margin: Red Sox caught using Apple Watch to steal signs from Yankees http:// ow.ly/Bh3150dRz9W	0	0	
North Korea Rolls Out "Hunting Yankees " Video Game Where Players Kill US Soldiers by Sniper Fire http://www. thegatewaypundit.com/2017/09/north- korea-rolls-hunting-yankees-video-game-players-kill-us-soldiers-sniper-fire/ …	1	1	
They are not letting a Yankees gate get away. @orioles	0	0	
Red Sox stole signs from Yankees , others using Apple Watch http:// stjr.nl/2xN1tzQ	0	0	
The Boston Red Sox used Apple Watches to cheat against the Yankees , report says https:// goo.gl/fb/d7ujPg #TechText	0	0	
Boston Red Sox Used Electronic Devices to Steal Signs Against Yankees • r/baseball http:// fb.me/MX25B3f8	0	0	
OF Austin Hays joins the @Esurance #CallUpWorthy club with his first promotion to the @Orioles ! pic.twitter.com/9LzN6BDrEF	34	80	
It's hard to be late when Joltin' Joe expects you to be on time.... #NationalBeLateForSomethingDay ( : Milo Stewart Jr.) @Yankees pic.twitter.com/sg0vmByewZ	8	30	
Red Sox reportedly caught using electronic devices to steal signs from Yankees http:// ow.ly/SwZe50dRyXZ	0	0	
@JoeNBC @DickieV @Buster_ESPN @mikebarnicle Sad- Yankees bust Red Sox in high-tech cheating scandal | New York Post http:// nypost.com/2017/09/05/yan kees-bust-red-sox-in-high-tech-sign-stealing/ …	0	0	
Hoy 20.05 VIVO MLB New York Yankees vs Baltimore Orioles http:// fb.me/6EPLyJZ3s	0	0	
Hoy 20.05 VIVO MLB New York Yankees vs Baltimore Orioles http:// fb.me/94l9BTW3d	0	0	
Stay classy, Boston. SMH. Boston Red Sox Used Apple Watches to Steal Signs Against Yankees https:// nyti.ms/2xML9z1	0	0	
Boston Red Sox Used Apple Watches to Steal Signs Against Yankees https:// nyti.ms/2xML9z1	0	0	
Red Sox said to use Apple Watch to steal signs from Yankees - CNET http:// ow.ly/lhxa50dRyT8	0	0	
Red Sox reportedly caught using electronic devices to steal signs from Yankees http:// ow.ly/Pdal50dRyU2	0	0	
It has nothing to do with cheating. There is no proof the Yankees used that to their advantage.	0	0	
Where is the info on the Yankees using the YES network to steal signs? Oh right half truth reporting from the NYTimes	0	1	
Pitch'em tight	0	0	
SpeedeNews: Joe Girardi firmly denies Red Sox's accusation against Yankees http:// ow.ly/jBBm50dRySD	0	0	
Red Sox stole signs from Yankees , others using Apple Watch - MLB has determined that the Boston Red Sox stole s... http:// ow.ly/eHMP50dRyPz	0	0	
Boston Red Sox Used Apple Watches to Steal Signs Against Yankees https:// nyti.ms/2xN42SH	0	0	
Report: Red Sox used Apple Watch to steal Yankees ’ signs. http:// kron4.com/2017/09/05/rep ort-red-sox-used-apple-watch-to-steal-yankees-signs/ …	2	2	
Report: Red Sox used Apple Watch to steal Yankees ’ signs. http:// kron4.com/2017/09/05/rep ort-red-sox-used-apple-watch-to-steal-yankees-signs/ …	0	1	
. @nytimes : "Boston @RedSox Used Apple Watches to Steal Signs Against @Yankees " https:// nyti.ms/2xN42SH via @nytimes > #bospoli #nycpoli @MLB	0	0	
“ @th3j35t3r : Boston Red Sox Used Apple Watches to Steal Signs Against Yankees >> http:// nyti.ms/2xML9z1 ” Yea, but they did signed the EULA!	0	0	
Not sure they're getting this game n at all! Here it's Supposed to rain for the next 3 days for the most part	0	0	
Or maybe the Yankees just suck?	0	1	
Report: Red Sox used Apple Watch to steal Yankees ’ signs http:// wp.me/p5hgGs-2CKW	1	2	
@Yankees Cheating & winning games is trademark of RedSox. They are not worth to lead AL East group.	0	0	
Let's do this!!! LETS GO YANKEES !!! #NYY @Yankees @YESNetwork	0	1	
Los Yankees acusan a los Medias Rojas de robo- http:// bit.ly/2xN1mEn #Venezuela	0	0	
If the Yankees cheated they would use a Rolex cause the Yanks are classy	0	5	
Who are the Yankees to Judge whether what they did was cheating, anyway?	0	0	
Red Sox stole signs from Yankees , others using Apple Watch http://www. tallahassee.com/story/sports/m lb/2017/09/05/mlb-determined-red-sox-stole-signs-yankees-using-apple-watch/635034001/ …	0	0	
THIS JUST IN: Red Sox brass says Bill Belichek told them "it's only cheating if you get caught". #newyorkyankees #yankees , #bostonredsox #…	0	0	
Red Sox stole cybersigns electronically against Yankees	0	0	
That's really sad that you have to use electronics to get edge on the Yankees come on!!	1	32	
Vamos al aire con ESPN Martes de Grandes Ligas: #Yankees vs. #Orioles . Tendremos que esperar a que pase la lluvia en Baltimore.	0	18	
Whether football or baseball, New England teams MUST cheat!!! SMH Red Sox Used Apple Watches to Steal Yankees Signs https:// nyti.ms/2xML9z1	0	0	
on the Big Screen @Yankees @Orioles @Phillies @Mets	0	0	
Yankees Orioles has been delayed	0	0	
All around good guy and great Oriole.	0	0	
Boston Red Sox Used Apple Watches to Steal Signs Against Yankees - The New York Times https:// apple.news/AVjkfSgjdR-Oqu jjnN0vYAQ …	0	0	
They have to cheat. That's the only way they can beat the Yankees .	0	0	
#MartesQueTeQuieroMartes demorado por lluvia. #Yankees vs. #Orioles #ElCaminoESPN pic.twitter.com/DQPcDcqRRH	8	29	
Red Sox reportedly caught using electronic devices to steal signs from Yankees	0	0	
The Yankees are in a rain delay #Yankees	1	4	
Talking about adding a new variable to #Yankees - #RedSox rivalry. Technology! https:// twitter.com/nytsports/stat us/905197162153349120 …	0	0	
Nah, ya yo vi en History que ganan los Yankees . https:// twitter.com/lasprovincias/ status/905188794680430593 …	0	0	
Red Sox said to use Apple Watch to steal signs from Yankees – CNET http:// ift.tt/2gEcr2U pic.twitter.com/hbJZLMtPPx	0	0	
HALF scoops. He left out the part about the Yankees stealing signs through the Yankees network	0	0	
When was the Yankees accused of this haven't seen anything bout it really	0	0	
Realistically, can't imagine the #orioles putting him on the mound with WC race as tight as it is, and he's never been to the majors.	0	0	
Red Sox stole signs electronically against Yankees - ESPN https:// goo.gl/fb/wAJSHo	0	0	
RedSox reportedly used Apple Watch to relay signs by Yankees catchers during series last month at Fenway Park. http:// toplocalnow.com/us/san-jose/at /15#t7590161 …	0	0	
Boston Red Sox Used Apple Watches to Steal Signs Against Yankees https:// nyti.ms/2xML9z1	0	1	
Raining in Baltimore. Hope they get the @Yankees game in tonight.	0	0	
Hey @Orioles first pitch time or PPD? pic.twitter.com/TFNWokm4cW	0	0	
#再入荷 速報 あの人気商品が帰ってきました 早いもの勝ち #47BRAND #フォーティーセブンブランド #Yankees #ヤンキース #MLB #メジャーリーグ #CAP http:// item.rakuten.co.jp/honkakuha/9317 14205 … pic.twitter.com/kztKtnNrY1	0	1	
The Yankees have won 15 of the 22 starts this year made by LHP CC Sabathia (11-5, 3.71), who has made 250 career starts for NYY.	0	1	
exactly...this is a distraction from more important issues (i.e., that the Yankees might have been doing it too)	3	5	
LOS YANKEES !!!! https:// twitter.com/ESPNmx/status/ 905201379353952256 …	0	0	
Time for @Yankees Baseball. Let's get another win tonight & inch close to 1st Place. Go Yankees ! #NYYvsBAL #PinstripePride #YANKSonYES #LGY	0	0	
pic.twitter.com/rXyZA3bb4U	0	3	
HALF a baseball story. He apparently doesn't report the part where the Yankees used their YES network to steal signs	0	0	
Tuesday night Orioles game thread: vs. Yankees , 7:05 #Orioles https:// fanly.link/45801cc6de pic.twitter.com/nWhFr7G06R	0	0	
Red Sox said to use Apple Watch to steal signs from Yankees - CNET http:// ift.tt/2xMm4Ev	0	1	
The Boston Red Sox used Apple Watches to cheat against the Yankees , report says http:// travelwirenews.com/the-boston-red -sox-used-apple-watches-to-cheat-against-the-yankees-report-says-386157/ … via @eturbonews	0	0	
Red Sox stole signs electronically against Yankees #RedSox https:// fanly.link/e5bc51d3ad pic.twitter.com/KZExuSMp8x	0	0	
Red Sox stole signs from Yankees , others using Apple Watch #DetroitTigers https:// fanly.link/8ad98560fc pic.twitter.com/5C9ZpEyB9N	0	0	
Red Sox stole signs from Yankees , others using Apple Watch #Pistons https:// fanly.link/5123d14541 pic.twitter.com/RnzatbToOf	1	0	
Report: Red Sox used Apple Watch to steal Yankees ’ signs #Rockies https:// fanly.link/dc2e3c7e81 pic.twitter.com/DmNZ7cCJ0r	1	0	
#AppleWatch Red Sox caught using Apple Watch to steal signs from Yankees - MarketWatch http:// ift.tt/2f0N7UP	0	0	
#AppleWatch MLB: Red Sox Used Apple Watch to Steal Yankees ' Signals - Newsmax http:// ift.tt/2gKdkKZ	0	0	
#AppleWatch Red Sox used Apple Watch to steal signs from Yankees - Comcast SportsNet Bay Area http:// ift.tt/2f1nljp	0	0	
As a @Yankees fan, I think it's only fair if the @RedSox are banned from the @MLB , Fenway Park demolished and the red B is outlawed forever https:// twitter.com/SportsCenter/s tatus/905184655632203780 …	0	2	
จะ customize เสื้อ yankees แบบนกุก เห็นราคาละแบบเออไม่เป็นไรไม่เอากะได้555555555555	0	0	
Ex: SCLOOSI: The Red Sox were caught using an Apple Watch in the dugout to steal signals from the Yankees https:// twitter.com/nytimes/status /905163675480281088 …	0	1	
The Margin: Red Sox caught using Apple Watch to steal signs from Yankees http:// ift.tt/2x9lzY8	0	0	
The Red Sox Used Electronic Devices, Including Apple Watch, to Steal Signs Against Yankees https://www. dub.io/tw/25807872 #baseball pic.twitter.com/6H8PhwxU0D	0	0	
Red Sox said to use Apple Watch to steal signs from Yankees - CNET http:// ift.tt/2xMm4Ev	0	1	
Report: Red Sox used Apple Watch to steal Yankees ' signs http:// dlvr.it/Pl2W8c	0	0	
Red Sox stole signs from Yankees , others using Apple Watch http:// noconow.co/2vJAGqQ	0	0	
Who cares, let them cooperate and lay down penalties moving forward. I'm sure my Yankees have done things too.	0	0	
Guess they found it hard to deflate the baseballs.	0	1	
I guess everybody steal in Massachusetts lol first New England now Boston Red Sox stealing the Yankees signs	0	0	
$ AAPL : Red Sox caught using Apple Watch to steal signs from Yankees : http://www. StockNewsWires.com/aapl-red-sox-c aught-using-apple-watch-to-steal-signs-from-yankees/ …	0	0	
Boston Red Sox Used Apple Watches to Steal Signs Against Yankees via @NYTimes . https://www. nytimes.com/2017/09/05/spo rts/baseball/boston-red-sox-stealing-signs-yankees.html …	0	0	
Os 7- Yankees 5	0	1	
Boston Red Sox Used Apple Watches to Steal Signs Against Yankees https:// nyti.ms/2xN42SH	0	0	
@brent_honeywell coming with that Ill passive aggression!! they calling folks from AA now. Don't worry, you start game 4 for bulls!	0	0	
Boston red sox stole signs electronically against new york yankees ►Sports News Today: http:// youtu.be/P_KBEGo7584?a qua @YouTube	0	0	
Boston Red Sox Used Electronic Devices to Steal Signs Against Yankees http:// ift.tt/2w4cevv	0	0	
#Orioles to call up OF prospect Austin Hays: https://www. fanragsports.com/news/orioles-c all-austin-hays/ …	0	0	
Yeah, but it was the Yankees , so... http:// fb.me/1hZbpua0O	0	0	
Boston Red Sox Used Apple Watches to Steal Signs Against Yankees http:// ift.tt/2gLlOS1	0	0	
The Red Sox should be forced to forfeit all wins vs Yankees @mlb #cheaters	0	0	
Boston Red Sox Used Apple Watches to Steal Signs Against Yankees - The New York Times https:// apple.news/AVjkfSgjdR-Oqu jjnN0vYAQ …	0	0	
Boston Red Sox Used Apple Watches to Steal Signs Against Yankees https:// nyti.ms/2xML9z1	0	0	
Red Sox caught using Apple Watch to steal signs from Yankees - MarketWatch http://www. marketwatch.com/story/red-sox- caught-using-apple-watch-to-steal-signs-from-yankees-2017-09-05 …	0	2	
Pretty sure the Red Sox filed a very similar complaint against the Yankees ...	1	1	
Et tu, Tim? Boston Red Sox used Apple Watch to steal pitching signs in games against Yankees http:// appleinsider.com/articles/17/09 /05/red-sox-used-apple-watch-to-steal-signs-in-games-against-yankees …	0	0	
It's not that #RedSox steal signs that I'm critical of. Everyone does. It's a skill.It's the fact that they suck at it; got caught #Yankees	0	0	
Smh, Yankees are just mad we're still in 1st #GoSox https:// twitter.com/nytimes/status /905163675480281088 …	0	1	
Loser. He'll care when the Yankees win the division	0	0	
I get the joke - we got caught -so everyone does it .. sorry this is same guy who railed against Yankees and steroids until Ortiz got popped	0	0	
Stealing signs and still couldn't beat the Yankees , embarrassing	0	0	
#RedSox #Yankees #WatchGate pic.twitter.com/vbtw5CO8NC	0	0	
Tonight I am an Orioles Fan... but lets go Sox pic.twitter.com/GAR6dZh6fB	0	0	
Red Sox soooooo trash for that bullshit they pulled on the Yankees	0	0	
FUCK the Yankees	0	1	
Red Sox said to use Apple Watch to steal signs from Yankees - CNET http:// ift.tt/2xMm4Ev	0	0	
Boston Red Sox Used Apple Watches to Steal Signs Against Yankees - The New York Times https:// apple.news/AVjkfSgjdR-Oqu jjnN0vYAQ …	0	0	
Red Sox used Apple Watch to steal signs from Yankees http://www. csnbayarea.com/athletics/red- sox-used-apple-watch-steal-signs-yankees …	0	0	
The Yankees (74-63) arrived in Baltimore at 3 a.m. on Monday, and went on to beat the Orioles in a game that started 11 hours later.	1	4	
Red Sox Used APPLE Watch to Steal Signs Against Yankees ... https:// goo.gl/9CMYgn #drudge -report	0	0	
Got my beef pasta and diet @drpepper on deck and getting ready to watch @CC_Sabathia and my @Yankees take on the Orioles , GO BRONX BOMBERS!!	0	0	
Wait Pete we lost 3 of 4 over this last weekend against the Yankees	0	0	
Aww, looks like Sale wasn't comfy in his Red Sox uniform. pic.twitter.com/xWr7Q9MMGp	0	0	
Rain delay beer - Drinking a Smooth Sail Summer Ale by @HeavySeasBeer at @orioles — http:// untp.beer/s/c500494541	0	0	
Isn't it interesting no one on Red Sox denied wrong doing (in fact all but confessed)and Yankees have publicly denied it. Sox muddy water	0	0	
[SB Nation: Camden Chat] Tuesday night Orioles game thread: vs. Yankees , 7:05 http:// sportspyder.com/teams/baltimor e-orioles/articles/22489585 … #Orioles	0	0	
I am shocked! Shocked!! @NYTimes : @RedSox Used @Apple Watches to Steal Signs @Yankees https:// nyti.ms/2xN42SH	0	3	
The @Orioles bring up @BowieBaysox OF Austin Hays for the first time, making him @Esurance #CallUpWorthy pic.twitter.com/0wXnDeMcgD	17	41	
Los Yankees acusan a los Medias Rojas de robo http:// bit.ly/2x91Qrg	0	0	
MLB: Red Sox reportedly used Apple Watch to steal Yankees ' signs http:// ift.tt/2vJxzio	0	0	
Was that supposed to be clever?	0	0	
Boston Red Sox Used Apple Watches to Steal Signs Against Yankees #RedSox #Boston #Spaygate #AppleWatchGate #MLB https:// apple.news/AVjkfSgjdR-Oqu jjnN0vYAQ …	0	0	
The Yankees having excessive members that use roids: No problem	0	0	
So did I get this right.. Red Sox stole Yankees signs and still lost????? Is that right????	0	10	
Red Sox said to use Apple Watch to steal signs from Yankees - CNET http:// ift.tt/2xMm4Ev	0	0	
Red Sox stole signs from Yankees , others using Apple Watch http:// dlvr.it/Pl2Vgv pic.twitter.com/fg0NyKUaZu	0	1	
You saw Giants last year? You know there is an investigation in to the Yankees too? Lol	0	0	
Lmfaooooooo Eagles trash too and ya Yankees and ya shape up https:// twitter.com/Josecampana28/ status/905198688502505472 …	0	0	
How the Red Sox used an Apple Watch to steal signs from the Yankees http:// fb.me/wGZkBoet	0	0	
When did the New England Patriots start playing the New York Yankees !? #OnTheEdgeOfRules	0	0	
News flash #Yankees fans... they're investigating you as well for being involved. Not just the #RedSox https:// twitter.com/Spoked_B/statu s/905202772584345600 …	1	1	
The Margin: Red Sox caught using Apple Watch to steal signs from Yankees : Add one more practical use… http:// dlvr.it/Pl2VJF MARKETWATCH	0	0	
Boston Red Sox Used Apple Watches to Steal Signs Against Yankees https:// nyti.ms/2xN42SH	0	0	
Got that feeling that the #yankees game is going to wind up being postponed	0	0	
The Red Sox used Apple Watchs to steal signs (what pitch was gonna be thrown) when they were playing the Yankees	0	1	
Red Sox reportedly caught using electronic devices to steal signs from Yankees https:// goo.gl/fb/KdbGt9	0	0	
Baltimore Orioles Season Ticket - 2017, 2016, 2015, 2014: $5.43 End Date: Friday Sep-15… https:// goo.gl/fb/w1DaVo	0	0	
2 Tickets Toronto Blue Jays vs. Baltimore Orioles 9/11/17 Rogers Centre: $233.10 End Date… https:// goo.gl/fb/EnzRmJ	0	0	
Are the #Yankees really whining about the Red Sox stealing signs? Not like that hasn't been done for 150 years or anything.	0	0	
2 Cleveland Indians vs Baltimore Orioles 9/09 Progressive Field Lower Box: $0.99 (0 Bids… https:// goo.gl/fb/6nSGbG	0	0	
The Margin: Red Sox caught using Apple Watch to steal signs from Yankees https:// bankinformer.com/776005/the-mar gin-red-sox-caught-using-apple-watch-to-steal-signs-from-yankees/ …	0	0	
It's not cheating if it's against the Yankees . It's activism.	0	1	
I had vowed to use my Apple Watch for good & see that I could have been using it for evildoing. #redsoxsuck #Cheating #Yankees	0	0	
The Boston Red Sox used Apple Watches to cheat against the Yankees , report says https:// goo.gl/fb/D9Thhr	0	0	
Call it what you want, but its nothing new. Only illegal part was having electronic device. Many teams including the Yankees have done same	0	0	
So the Sawks state the #Yankees steal signs with their #YES feed. Could Boston with the #NESN feed? As Beau Brummels sang, "Laugh, Laugh.''	1	2	
Los Yankees acusan a los Medias Rojas de robo https:// goo.gl/NYtR2s	1	0	
Red Sox stole signs electronically from Yankees , other teams http:// es.pn/2wDaA7N via @ESPN App http:// es.pn/app	0	0	
Rob Manfred ties Red Sox, Yankees ' sign stealing allegations to rivalry http:// fw.to/27CCWvD	0	0	
The fact that the Red Sox had to use an Apple watch to steal signals to defeat the Yankees just shows how superior the Yankees are. https:// twitter.com/nytimes/status /905163675480281088 …	0	0	
Watch Baltimore Orioles vs New York Yankees LIVE STREAMING HD FREE MLB BASEBALL http:// pupless.com/watch-baltimor e-orioles-vs-new-york-yankees-live-streaming-hd-free-mlb-baseball/ … pic.twitter.com/cJAQgrrr1T	0	0	
Lmao cry babies @Yankees	0	0	
So did Dunkin Donuts steal those signals from the Yankees ?	0	0	
Oh, no, I understand that. I was posting in the vein of "how lame that we won" from the Yankees perspective. I should have been more clear.	0	1	
Any eta of game to start? Drove all the way out here for the game	0	1	
hypervocal: Yankees bust Red Sox in high-tech sign stealing http:// bit.ly/2xMWkaS pic.twitter.com/amhoxTVjmE	0	0	
RE: #Orioles Austin Hays - consistency. really good shit when the "jump" between Hi-A & AA is factored, identical production across both lgs pic.twitter.com/3Qru8Xx6zE	0	1	
Report: Red Sox Used Apple Watch to Steal Yankees ' Signs - Bloomberg http:// ift.tt/2vJzK5y #Apple	0	0	
Boston Red Sox Used Apple Watches to Steal Signs Against Yankees https:// nyti.ms/2xML9z1	0	0	
Make arguing with Yankees more fun! Let us know when you get "bingo." pic.twitter.com/M9DSs81pcw	4	14	
Report: Red Sox Used Apple Watch to Steal Yankees ' Signs - Bloomberg http:// ift.tt/2f1cGFn	0	0	
Nuestro encuentro en Baltimore esta retrasado debido al clima. Compartiremos más información cuando sea disponible. #YankeesBeisbol pic.twitter.com/XkO8FAVxZA	10	33	
"No chance": Joe Girardi denies Red Sox's claims #Yankees were also stealing signs http:// nyp.st/2j1fQgG pic.twitter.com/2jEn1tAbBL	5	2	
Boston Red Sox Used Apple Watches to Steal Signs Against Yankees https:// nyti.ms/2xML9z1	0	0	
The Orioles (70-68) have dropped 8 of their 13 games vs. NYY this season.	0	0	
Let's Be Honest, "Cheating" against the Yankees , is like cheating against a Card Shark. #RedSox	0	0	
Boston Red Sox Used Apple Watches to Steal Signs Against Yankees https:// mobile.nytimes.com/2017/09/05/spo rts/baseball/boston-red-sox-stealing-signs-yankees.html?referer=https://www.reddit.com/r/apple/.compact …	0	1	
Report: Red Sox Used Apple Watch to Steal Yankees ' Signs an hour ago https:// goo.gl/GZq2fu	0	0	
New Yorkers are far too cool for Apple Watches.. definitely a provincial Boston thing #Yankees #PinstripeNation #NYY https:// twitter.com/nytimes/status /905163675480281088 …	0	0	
Report: Red Sox used Apple Watch to steal Yankees ' signs - Killeen Daily Herald https:// apple.news/AfRJQ1fXKPVmM_ QFeIJzelQ …	0	0	
Brilliant marketing by @Apple ! @RedSox @Yankees #iwatchgate #mlb	0	0	
pic.twitter.com/vfDcekFYsn	1	2	
Cheating ass @RedSox . Stealing signals against the @Yankees . But I remember the cheating chants @AROD got at Fenway. Hypocrites!	0	0	
Red Sox stole signs from Yankees , others using Apple Watch. http:// rssfeeds.indystar.com/~/457204880/0/ indystar/pacers~Red-Sox-stole-signs-from-Yankees-others-using-Apple-Watch/ …	0	0	
BUT HIS RINGS	0	1	
Almost something out of a @greatdismal novel. Red Sox Steal Yankees ' Signs w/ Apple Watches https:// nyti.ms/2xN42SH	0	0	
Boston Red Sox Used Apple Watches to Steal Signs Against Yankees https:// homeimprovementtipsfl.wordpress.com/2017/09/05/bos ton-red-sox-used-apple-watches-to-steal-signs-against-yankees/ …	0	0	
Report: Red Sox used Apple Watch to steal Yankees ' signs Startribune https:// spotline.net/Startribune/re port-red-sox-used-apple-watch-to-steal-yankeessigns-fbb555a0d150 …	0	0	
Report: Sox stole Yankees ’ signs using Apple Watch http://www. newsday.com/sports/basebal l/yankees/red-sox-admit-to-stealing-signs-from-yankees-using-apple-watch-report-says-1.14113210 … via @Newsday	0	0	
csnne​.com >> Rob Manfred ties Red Sox, Yankees ' sign stealing allegations to rivalry http:// buzztap.com/-90jiAp #sportstar	0	0	
The New York Times: Red Sox Used Electronic Devices to Steal Yankees Signs. http:// google.com/newsstand/s/CB IwhdSK_jk …	0	0	
Been to many rain delays this yr, but our @Orioles always get the games in. Have tix for tomorrow, supposed to rain also earlier in the day.	0	0	
"Boston Red Sox Used Apple Watches to Steal Signs Against Yankees ” https://www. nytimes.com/2017/09/05/spo rts/baseball/boston-red-sox-stealing-signs-yankees.html …	2	3	
Yankees bust Red Sox in high-tech cheating scandal http:// ow.ly/bplw30eWehR	0	0	
(parece que el Apple Watch sí sirve de algo después de todo) Red Sox Used Apple Watches to Steal Signs Vs. Yankees : https:// nyti.ms/2xML9z1	0	0	
Trash the Red Sox night just can't help themselves the YANKEES DO NOT DO ANYTHING WRONG NOT REDSOXS FOR LIFE	0	0	
How fitting... @RedSox use #BigApple 2 cheat on #BigApple team #yankees #AppleGate #howboutdemapples	0	0	
Red Sox said to use Apple Watch to steal signs from Yankees - CNET http:// ift.tt/2xMm4Ev	0	0	
Report: Red Sox used Apple Watch to steal Yankees ' signs - NEW YORK  -- The Boston Red Sox have reportedly (cont) http:// tl.gd/n_1sq5pm0	0	0	
Yankees bust Red Sox in high-tech cheating scandal http:// nyp.st/2j0AvS7 via @nypostsports	0	0	
Entonce Boston robando señas, relojes inteligentes.Y así dice son fuertes. @Kiaritahh @RocioBourdierd @Jaime_Tom @JinRaynier @ElFanaticoDom	0	2	
Looks like there may be a rain delay.... — watching New York Yankees vs Baltimore Orioles	0	0	
Red Sox reportedly used Apple Watch to steal Yankees ' signals http:// dlvr.it/Pl2TPS	0	0	
Houston should host your home games against the Yankees next week if this hurricane keeps its track. I will gladly go and root for rays.	0	3	
Report: Red Sox used Apple Watch to steal Yankees ' signs https:// goo.gl/fb/wfnqQd #headlines #rt	0	0	
you boston redsox suck your in big trouble go yankees	0	0	
Dam #Yankees ! luckily @CasknFlagon has tvs so we can pretend he's having dinner w/us. pic.twitter.com/lhrVspLMbP	0	9	
The Yankees are being investigated as well . All the teams try to steal signs . It has been part of the game forever . No issue .	0	0	
New post: "Red Sox said to use Apple Watch to steal signs from Yankees - CNET" http:// ift.tt/2xMm4Ev	0	0	
Close to two hour delay ahead? May have to postpone,try double header tomorrow, weather permitting.We'll see,fingers crossed!	0	0	
Lmfao let em watch naked bitches in peace	0	0	
