
Yesterday, Manny Machado was named the AL Player of the Month for August. Retweet for a chance to win this autographed baseball! #Birdland pic.twitter.com/R9X5eRNBoK – bei Oriole Park at Camden Yards	3316	923	
Specifically: the Yankees formally filed their complaint with MLB about the Red Sox on July 18.	106	344	
Specifically: the Yankees formally filed their complaint with MLB about the Red Sox on July 18.	106	344	
Boston Red Sox Used Apple Watches to Steal Signs Against Yankees - http:// NYTimes.com https:// mobile.nytimes.com/2017/09/05/spo rts/baseball/boston-red-sox-stealing-signs-yankees.html?_r=0&referer=https://t.co/gun9zolCpT?amp=1 …	107	142	
Yankees fan: What time is it? *Looks at apple watch*	3	10	
#Yankees @YESNetwork What is the EST of the game tonight?	0	0	
Specifically: the Yankees formally filed their complaint with MLB about the Red Sox on July 18.	106	344	
Tim Cook says new version of the Apple watch will actually let you steal signs from the Yankees without also getting clobbered by them.	25	95	
Stealing signs isn't cheating. And if you actually read the article you'd read that the Yankees were using Yes cameras for the same thing-.-	0	1	
Paraguay - Uruguay. Para los Yankees debe ser el Eslovaquia - Eslovenia Sudamericano.	84	285	
Specifically: the Yankees formally filed their complaint with MLB about the Red Sox on July 18.	106	344	
They deserve each other	0	1	
Report: Red Sox Used Apple Watch To Steal Yankees ' Signs http://www. wbal.com/article/262296 /53/report-red-sox-used-apple-watch-to-steal-yankees-signs …	0	1	
Red Sox reportedly used an #AppleWatch to steal signs from rival Yankees http:// bit.ly/2vJWLFD https:// twitter.com/DigitalTrends/ status/905213987750502400 …	0	0	
Yankees are coming for that division title	0	0	
Red Sox reportedly found guilty of using Apple Watch to steal Yankees ' signs @theoldgreywolf See this? https://www. washingtonpost.com/amphtml/news/s ports/wp/2017/09/05/red-sox-reportedly-found-guilty-of-using-apple-watch-to-steal-yankees-signs/ …	0	0	
Spoken like a true @Yankees fan!	0	0	
Tim Cook says new version of the Apple watch will actually let you steal signs from the Yankees without also getting clobbered by them.	25	95	
I have a problem w/BSox mgmt not being more aggressive in banning fans like those that heckled Orioles outfielder Adam Jones	0	0	
Joey Rickard: Rad Jock Rye I #Orioles	0	0	
Evidence that the Red Sox stole signs vs Yankees and communicated them to the Manager via apple watch.	0	0	
New post (Red Sox stole signs electronically from Yankees , other teams) has been published on BRONX VOICE - http:// bronxvoice.com/red-sox-stole- signs-electronically-from-yankees-other-teams/ … pic.twitter.com/i7pFYHPmYn	0	0	
Red Sox caught using Apple Watch to steal signs from Yankees : report http:// ift.tt/2eIfaez	0	0	
An-Magritt, this is a global game, and I think this is an end of Us, if Yankees let to provoke themselves - they fabricated too many shits..	1	1	
Por si no lo sabían aun los @RedSox fueron encontrados utilizando Apple Watch para robar señales a los @Yankees (y otros)	0	0	
Como van los Yankees ?	0	1	
Report: Red Sox used Apple Watch to steal signs from Yankees , other teams https://www. thescore.com/news/1366326 (via http:// thesco.re/theScore_app ) Wow!	0	0	
I think there's something in the water in Boston. Yankees bust Red Sox in high-tech cheating scandal | New York Post http:// nypost.com/2017/09/05/yan kees-bust-red-sox-in-high-tech-sign-stealing/ …	0	0	
Have to be honest, I really don't care who spies on the Yankees and how they do it as long as it gets done	0	0	
Best part is the Yankees caught them by spying on their bench. It's really awesome for both teams!!!	0	1	
Boston Red Sox Used Apple Watches to Steal Signs Against Yankees https:// nyti.ms/2xML9z1 レッドソックスがアップルウォッチでサイン盗みしていた？	0	0	
Así van a estar los llorones aficionados a los yanquis cuando sepan que no va a proceder si queja de llorones de la primaria pic.twitter.com/Crvh30FgdQ	0	0	
How many players have done the Yanks, Mets and Dodgers? He had an aesthetic obligation to leave the Yankees - the Grandy Man???!!!	0	0	
Red Sox stole signs electronically from Yankees , other teams - ESPN: ESPN Red Sox stole… https:// goo.gl/fb/FCYS5c	0	0	
Yankees blew the whistle because commish happened to be in Boston right now. Bush league	0	1	
Anyone have word about the @Yankees game ? Is it a double header tomorrow ?	0	0	
Latest update from the Red Sox Apple watch: 5.5 4.5 3.5 2.5 1.5 #Yankees	0	0	
Not surprised #yankees fu7k redsox #patriots @michaelrapaport 🖒 https://www. instagram.com/p/BYrbncpnL4C/	1	0	
Red Sox reportedly found guilty of using Apple Watch to steal Yankees ' signs http:// wapo.st/2gKWvj4?tid=ss _tw&utm_term=.673bc6e0beb5 …	0	0	
Red Sox reportedly used an Apple Watch to steal signs from rival Yankees http:// ift.tt/2x8C8Dk #Dubai #Tech #Digital #Inbound #Advertisi …	0	0	
Yankees acusan a los Medias Rojas de robarle las señas http:// ift.tt/2eIqojp	1	0	
Between the fing beards and that hairdo, I'm happy the @yankees have rules about grooming.	0	1	
Saw him and Bebe Neuwirth in Damn Yankees in 1994!	0	0	
Do we know when the Yankees game is on?	0	0	
I'm very upset with @MLB .. Postpone the damn game already.. They both have off days on Thursday. #Yankees #Orioles	0	0	
#MLB | Medias Rojas usaron Apple Watch para robarle señas a los Yankees | http:// bit.ly/2xNcocS pic.twitter.com/ZW5CWZdKCu	0	1	
Stopped raining basically. I'm sure game will be played tonite considering tomorrow's forecast and the importance of the game	0	2	
Yankees are under investigation too	0	0	
[ http:// CNET.com ] Red Sox said to use Apple Watch to steal signs from Yankees - CNET http:// dlvr.it/Pl2yGl	0	0	
The @RedSox were caught using electronics to try to steal signs against the @Yankees #MLB #CAUGHT	0	0	
If you ain't cheating, you ain't trying. Boston Red Sox Used Apple Watches to Steal Signs Against Yankees https://www. nytimes.com/2017/09/05/spo rts/baseball/boston-red-sox-stealing-signs-yankees.html …	0	8	
how much longer have we got for the yankees to start	0	0	
el futbol me chupa los dos huevos pero como los quiero cuando hablan de eso y no de cantantes yankees que no las escucha ni la familia	0	21	
Well played @RedSox @Yankees https:// twitter.com/goldenknights/ status/905213860788895744 …	0	0	
The Red Sox Used Electronic Devices, Including Apple Watch, to Steal Signs Against Yankees <= no honor, no character https://www. nytimes.com/2017/09/05/spo rts/baseball/boston-red-sox-stealing-signs-yankees.html …	0	0	
And still can't beat the Yankees https:// twitter.com/bleacherreport /status/905170412191051777 …	0	0	
We are @Yankees fans, but this @RedSox sign-stealing investigation seems whiney...is that a word?	0	8	
Apple Watch is key to losing 3 out of 4 to the Yankees .	0	0	
In 2005, they had 6 left vs. Boston. In 1978, 7 vs. Boston (not including playoff). In 1964, they had no games vs. Orioles and ChiSox.	0	1	
ALRIGHT YANKEES LETS GET THIS WIN. I KNOW YOU GUYS CAN DO THIS SO LETS GET THIS DONE. #LetsGoYankees #NeverGiveUp	0	0	
Red Sox reportedly used an Apple Watch to steal signs from rival Yankees : http:// bit.ly/2wDP42I	0	0	
Red Sox caught using Apple Watch to steal signs from Yankees : report http:// ift.tt/2eIfaez #CBC	0	0	
I loathe the Yankees , live BoSox, but this is a new low. Can't abide.	0	0	
Dan Duquette: Orioles 'very vigilant' in competitive AL East amid Yankees -... #Orioles https:// fanly.link/3c0a35afef pic.twitter.com/uGY84bSkpF	0	1	
@tsnmikehogan What signs Mike actually are the Yankees claiming Boston are stealing? Weren't they 4-41 with RISP? Feel free to steal more!	0	0	
In the face of N.K. nuclear standoff 2nd place @Yankees only care about baseball sign stealing. Sad.	0	1	
Future Orioles RF	0	0	
Red Sox said to use Apple Watch to steal signs from Yankees - CNET http:// dlvr.it/Pl2y7Y pic.twitter.com/vZf699LAjL	0	0	
Giveaway: Winner gets choice of Reggie Jackson/Brooks Robinson signed card. Must follow & RT. Let's see how this goes... #Orioles #Yankees pic.twitter.com/U2lz07YFSY	14	3	
Red Sox reportedly found guilty of using Apple Watch to steal Yankees ' signs https://www. washingtonpost.com/news/sports/wp /2017/09/05/red-sox-reportedly-found-guilty-of-using-apple-watch-to-steal-yankees-signs/?utm_source=dlvr.it&utm_medium=twitter … #sports pic.twitter.com/NN9FmRtPCX	0	0	
Los yanquis no son famosos por sus títulos sino por las maneras de ganar. Y además es lo más fácil del mundo, como ser casa en el Blackjack	1	0	
11 of 12 baseball's with low psi, per Yankees	0	3	
Raises the question did @RedSox cheat when they down 3-1 to the @Yankees the year they won World Series @MLB	0	0	
A timely resolution? How is this timely? Any ideas on how to watch the Yankees tonight?	0	0	
MLB determined Red Sox stole signs from Yankees using Apple Watch. Outrageous! https://www. usatoday.com/story/sports/m lb/2017/09/05/mlb-determined-red-sox-stole-signs-yankees-using-apple-watch/635034001/ …	0	0	
New post: MLB: Red Sox reportedly used Apple Watch to steal Yankees ' signs - Los Angeles Times http://www. BaseballNewsandScores.info/110942	0	0	
New post: How should MLB punish the Red Sox for cheating against the Yankees ? - USA TODAY http://www. BaseballNewsandScores.info/110941	0	0	
I've never done a giveaway on this site... let's try a #Yankees - #Orioles themed one during the delay.	0	1	
The Yankees Are Suckers for Letting the Red Sox Steal Their Signs https://www. theringer.com/mlb/2017/9/5/1 6257624/new-york-yankees-red-sox-sign-stealing-apple-watch-spygate?utm_campaign=theringer&utm_content=entry&utm_medium=social&utm_source=twitter … via @ringer	0	1	
Medias Rojas usaron Apple Watch para robarle señas a los Yankees http:// gunow.co.ve/post/Medias-Ro jas-usaron-Apple-Watch-para-robarle-senas-a-los-Yankees-Ovacion-Deportes …	0	0	
Let me help you out @ICEgov , Fifth Avenue between 56th and 57th streets. I'm sure #NYPD will welcome the help. Good luck and thank you!	14	54	
Report: Red Sox used Apple Watch to steal Yankees ' signs http:// ift.tt/2j10skv	0	0	
Do you ever just stay on the Yankees page tbh	0	2	
Medias Rojas usaron reloj Apple para robar señas a Yankees - El Nuevo Diario https:// elnuevodiario.com.do/medias-rojas-u saron-reloj-apple-para-robar-senas-a-yankees/ …	1	0	
So why do the Yankees have a video of the "Red Sox" stealing signs? Probably cause they were doing the same shit. pic.twitter.com/8N7vHHCpUk	0	0	
RT @washingtonpost : Red Sox reportedly found guilty of using Apple Watch to steal Yankees ’ signs http:// wapo.st/2w4mgNj #SCOMSport	0	0	
#RedSox w/ a runner on second at Fenway vs #Yankees , April/July: 2 for 36 Red Sox w/ runner on second at Fenway vs Yankees , August: 9 for 24 pic.twitter.com/SNlFq9ogHG	2	1	
Oh and looks like the Yankees cheat as well I guess they use a tv to steal signs or something the Red Sox counter complained see NY cheats	0	0	
Red Sox said to use Apple Watch to steal signs from Yankees – CNET http:// itruck.news/red-sox-said-t o-use-apple-watch-to-steal-signs-from-yankees-cnet/ … pic.twitter.com/QAw58H8Mrs	0	0	
Yankees 7, Orioles 4 : Hard Labor - The Orioles jump out to an early… https://www. instagram.com/p/BYrbXUNHTXe7 CNtoSX_hoH10kWDS8cN4cTeivY0/ …	0	0	
The Red Sox got caught using Apple watches to steal signs against the Yankees http:// ift.tt/2wDM4U4	0	0	
They'd be second. Rays, Orioles , Jays are bad this year.	0	0	
pic.twitter.com/w7rHVAFSkf	0	0	
Boston Red Sox Used Electronic Devices to Steal Signs Against Yankees http:// a.msn.com/02/en-us/AArlX tT?ocid=st …	0	0	
. @Yankees series against @RaysBaseball next week may be moved due to Hurricane Irma http:// nydn.us/2wDZJu2 pic.twitter.com/8qvIkLOgdW	4	1	
Boston Red Sox Used Apple Watches to Steal Signs Against Yankees https://www. google.com/amp/s/mobile.n ytimes.com/2017/09/05/sports/baseball/boston-red-sox-stealing-signs-yankees.amp.html …	0	0	
It's not just the Pats! @bensimmoneau !!! Yankees bust Red Sox in high-tech cheating scandal http:// nyp.st/2j0AvS7 via @nypostsports	1	16	
Cheatin ass Red Sox still lost the series to the Yankees AND they will NOT hold onto the AL East.	0	1	
the yankees did and I have no prob. Catcher responsibility control signs. Plus the Red Sox are horrible right now. Signs didn't help	0	0	
Robando señas @RedSoxBeisbol a @Yankees _Beisbol con “tecnología” reloj Apple en dugout algo le aprendieron a sus hermanos @Patriots https:// twitter.com/nytimes/status /905163675480281088 …	0	0	
Boston Red Sox Used Apple Watches to Steal Signs Against Yankees via @NYTimes https://www. nytimes.com/2017/09/05/spo rts/baseball/boston-red-sox-stealing-signs-yankees.html …	0	0	
Red Sox stole signs electronically from Yankees , other teams - http://www. espn.com/mlb/story/_/id /20593927/boston-red-sox-stole-signs-electronically-new-york-yankees-other-teams … via http:// news.google.com	0	0	
I'm reading Red Sox are being accused of stealing signals from Yankees for using Apple Watch. Wait, what?!	0	1	
Red Sox caught using an Apple Watch to steal signs from Yankees http:// fb.me/1yODRsaUP	0	0	
Can we all agree that the #RedSox #Yankees signal scandal is really just the opportunity Timex has been waiting for?	0	0	
If I had an Apple Watch, I'd use it to cheat against The Yankees , too.	0	1	
Literally in the original news story it says the Yankees are using YES cameras to do the same thing.	0	0	
Nope, season series vs Red Sox is completed, #Yankees finished 11-8 vs the Sawx in 2017	0	1	
Report: Red Sox used Apple Watch to steal Yankees ' signs http:// bit.ly/2xMZFXB pic.twitter.com/3IWPtVkRfo	0	1	
Yankees cheated all the time. Look at A-Roid.	0	0	
Shocker, the teams gonna turtle and the Yankees will be back by a game n half. Losing all faith in these clowns.	0	0	
Hi all! Red Sox caught using Apple Watch to steal signs from Yankees http:// dlvr.it/Pl2xLc #SportsHub just got posted.	0	0	
So pumped for @TheAustinHaysss . Remember calling his first pro HR in Aberdeen last season. He's just kept mashing this yr too. #Orioles https:// twitter.com/orioles/status /905191595703750656 …	1	1	
Tenemos varios campeonatos, algunos más que ustedes... bueno.. muchos más asi que no es necesaria una mascota, el show está en el diamante	0	0	
Red Sox said to use Apple Watch to steal signs from Yankees – CNET http:// bit.ly/2x8lT9i	0	0	
Red Sox reportedly used Apple Watch to steal Yankees ' signals https://www. engadget.com/2017/09/05/red -sox-reportedly-used-apple-watch-to-steal-yankees-signals/ …	0	0	
Yankees snitches	0	2	
And they went 8-11 vs the Yankees this year. I'm sure they did it verse other teams too.	0	0	
They were doing it about a month ago and stopped after a complaint was filed...but I'm all for making fun of the Red Sox whenever. Go Yanks	0	1	
Or how about the Orioles ? They haven't made a WS and they have an astronomically higher payroll than us & a small market size.	0	0	
No one can replace the Captain, but @DidiG18 's been doing a great job since joining the #Yankees and is only getting better. Congrats, sir! https:// twitter.com/Yankees/status /905193499578028033 …	1	1	
A lot of good that did you lol #yankees https:// twitter.com/espnnewyork/st atus/905176236938248192 …	0	0	
It's a great ballpark. Be sure to get out on Eutaw street. Enjoy!	0	1	
Against the Yankees , it is practically one’s patriotic duty!	0	1	
MLB: Red Sox stole signs from Yankees using Apple Watch http:// tnne.ws/2xNtEOW	2	5	
I bet they were. So were the 1927 Yankees .	0	0	
Breaking News: The Red Sox Were Caught Cheating Against The Yankees https:// bars.tl/Vu6u/YDXYwwHAcG	0	1	
@CardCuts	0	1	
Glad im not the only one!	0	1	
I agree! What do you have of Crosby. Hate the guy.	0	0	
Yankees have a legacy of A-Rod, Pettite, Giambi, Clemens, so...	0	0	
@JustinVerlander I thought only @Indians steal signs. Have u complained about the Yankees and redsox?	0	0	
Boston Red Sox Used Apple Watches to Steal Signs Against Yankees https:// nyti.ms/2xML9z1	0	0	
Boston Red Sox Used Apple Watches to Steal Signs Against Yankees - The New York Times https:// apple.news/AVjkfSgjdR-Oqu jjnN0vYAQ …	0	0	
my dad calls mike trout his baby boy imagine what heartbreak he's gonna go through when he leaves us for the yankees shdkjsjdjsjs	0	0	
Boston Red Sox stole signs electronically against New York Yankees , other teams http://www. espn.com/mlb/story/_/id /20593927/boston-red-sox-stole-signs-electronically-new-york-yankees-other-teams …	0	0	
TJ i am very sorry I wish I could but I am not able to sell photos due to licensing issues. I wish i could (you have no idea). I am sorry	0	0	
Orioles DFA Aquino, Showalter talks about Hardy (game delayed) - School of Roch http:// dld.bz/gd6bd	0	0	
Se mantiene la lluvia en Baltimore. #MartesDeGrandesLigas #Yankees vs. #Orioles @ESPN_Beisbol pic.twitter.com/vrJrc2qC7X	11	33	
With no Yankees game, going to watch the Boston vs Toronto game...GO JAYS...	0	0	
	0	0	
@fiverr and @Yankees don't hold it against me that my family is from Boston! #TheGameChanger #pleaseretweet https:// fiverr.us.launchpad6.com/contest/1/entr y/276 …	0	0	
Jerry Hairston? Wow....he plays for the Orioles & Colts? Wow	0	0	
Un obsequio... pic.twitter.com/F0InQqLY5V	0	1	
If the Sox have been doing this all season against other teams, that's a problem. I doubt they just did it against the Yankees .	0	0	
The Commissioner's statement is more critical of the Yankees than the NYT report, suggesting a hometown bias. https:// twitter.com/bostonglobe/st atus/905198124364378116 …	0	0	
when my boss gives my tickets to the Orioles Yankees game but of course it decides to monsoon	0	0	
After hitting 32 HRs and collecting 95 RBIs this season, Austin Hays was officially called up to the #Orioles : http:// atmlb.com/2x9tS6g pic.twitter.com/BIPJdM5D61	14	44	
Red Sox, Yankees , and MLB brass react to Boston cheating http:// dlvr.it/Pl2xFQ pic.twitter.com/Cr23Kp2QfJ	0	0	
Top story: Boston Red Sox Used Apple Watches to Steal Signs Against Yankees http://www. nytimes.com/2017/09/05/spo rts/baseball/boston-red-sox-stealing-signs-yankees.html … , see more http:// tweetedtimes.com/v/13867?s=tnp	0	0	
Red Sox reportedly admitted to improperly using electronic devices to steal signs from rival New York Yankees : http:// on.nbcdfw.com/PMGY9q5	5	5	
REPORT: Red Sox Caught Cheating Against Yankees http:// fb.me/1ssWY7IFG	0	0	
washingtonpost: Red Sox reportedly found guilty of using Apple Watch to steal Yankees ’ signs http:// wapo.st/2w4mgNj	0	0	
Boston Red Sox Used Apple Watches to Steal Signs Against Yankees http://www. nytimes.com/2017/09/05/spo rts/baseball/boston-red-sox-stealing-signs-yankees.html … , see more http:// tweetedtimes.com/RayLopeztiana? s=tnp …	0	2	
Top story: Boston Red Sox Used Apple Watches to Steal Signs Against Yankees http://www. nytimes.com/2017/09/05/spo rts/baseball/boston-red-sox-stealing-signs-yankees.html … , see more http:// tweetedtimes.com/HernanPhotoMkt ?s=tnp …	0	0	
Top story: Boston Red Sox Used Apple Watches to Steal Signs Against Yankees http://www. nytimes.com/2017/09/05/spo rts/baseball/boston-red-sox-stealing-signs-yankees.html … , see more http:// tweetedtimes.com/4_5_H?s=tnp	0	0	
#Source : #RedSox lost 3 of 4 to the Yankees during weekend series because of iOS updates and iCloud backup.	0	1	
Red Sox stole signs electronically against Yankees http:// fb.me/8M9h9sAUy	0	0	
Yankees were tipped off when they noticed someone actually wearing an Apple Watch #RedSox	0	1	
See ZephFoto at Yankee Stadium! Help us win Fiverr & the Yankees ’ Game Changer Contest! https:// fiverr.us.launchpad6.com/contest/1/entr y/239 … #TheGameChanger #LP6Contest	0	0	
yankees are too dawg sox not the only team being investigated	0	1	
#TMBgunner @Apple #BostonRedSox @BostonRedSoxPR @RedSox @Yankees https:// twitter.com/nytimes/status /905163675480281088 …	0	0	
Red Sox reportedly used an Apple Watch to steal signs from rival Yankees https:// goo.gl/mecHpr #EmergingTech #IoT pic.twitter.com/MfjuALsQpJ	0	1	
Red Sox reportedly used an Apple Watch to steal signs from rival Yankees https:// goo.gl/mecHpr #FutureTech #IoT pic.twitter.com/4dKTxjJi7L	0	0	
Boston Red Sox Used Apple Watches to Steal Signs Against Yankees - The New York Times https:// apple.news/AVjkfSgjdR-Oqu jjnN0vYAQ …	0	0	
Brault played Joe Hardy in high school in "Damn Yankees ." I played Mr. Applegate in my school's production. Follow me for more #sportsfacts	0	0	
Still Taking Classes, Promotion, Playoffs, A Chat With Frederick Keys SS Chris Clare https:// goo.gl/fb/4thf5R #Orioles #MiLB #Birdland	0	1	
Watching the Blue Jays and Red Sux game. Hopefully the Yankees game doesnt get postponed tonight 1-0 Jays	0	0	
Boston Red Sox Used Apple Watches to Steal Signs Against Yankees - The New York Times ( ) https:// apple.news/AVjkfSgjdR-Oqu jjnN0vYAQ …	0	0	
A blast to right by @GosukeKatoh puts the T-Yanks on the board in the 4th. 7th HR of the season with Tampa. #Yankees trail, 5-1 in Dunedin.	0	0	
Red Sox said to use Apple Watch to steal signs from Yankees - CNET: Boston reportedly says… https:// goo.gl/fb/qmEUcG	0	0	
I have nasty memes involving bears & sidney Crosby but not victims of a bombing	0	1	
Descobri de onde são os símbolos desses bonés, o LA é dos Dodgers e o NY é dos Yankees , a era internacional Empire State of Mind é real	0	0	
The #Yankees streaming from the dugout won't get the clickbait, but is equally "illicit."	0	0	
@Orioles and @Yankees are in a #raindelay	0	0	
Rob Manfred on Red Sox investigation: There's no rule against sign-stealing http:// dlvr.it/Pl2wdq #Yankees pic.twitter.com/mRo8dQO6y1	7	4	
Oh boy... Boston Red Sox used apple watches to steal signs against Yankees ! https://www. nytimes.com/2017/09/05/spo rts/baseball/boston-red-sox-stealing-signs-yankees.html … @RedSox @Yankees #RedSox #MLB	0	0	
The Yankees went 11-8 against the Red Sox this year, so I guess this didn't work at that well.	0	0	
Top story: Boston Red Sox Used Apple Watches to Steal Signs Against Yankees http://www. nytimes.com/2017/09/05/spo rts/baseball/boston-red-sox-stealing-signs-yankees.html … , see more http:// tweetedtimes.com/YourMindCanHea l?s=tnp …	0	0	
Top story: Boston Red Sox Used Apple Watches to Steal Signs Against Yankees http://www. nytimes.com/2017/09/05/spo rts/baseball/boston-red-sox-stealing-signs-yankees.html … , see more http:// tweetedtimes.com/NoDwnCarIns?s= tnp …	0	0	
North Korea Rolls Out "Hunting Yankees " Video Game Where Players Kill US Soldiers by Sniper Fire http://www. thegatewaypundit.com/2017/09/north- korea-rolls-hunting-yankees-video-game-players-kill-us-soldiers-sniper-fire/ …	0	0	
Top story: Boston Red Sox Used Apple Watches to Steal Signs Against Yankees http://www. nytimes.com/2017/09/05/spo rts/baseball/boston-red-sox-stealing-signs-yankees.html … , see more http:// tweetedtimes.com/iTedi?s=tnp	0	0	
Jajaja no te metas con Wally mi estimado... ustedes ni a mascota ni gracia tienen. Un equipo gris como su uniforme.	0	0	
First the patriots using videos of prior super bowl to their advantage and now the Red Sox? Should Yankees get awarded wins? #metfan	0	0	
The Yankees have sucked at a lower rate than all other baseball teams in MLB history. That's just math.	0	0	
How should MLB punish the Red Sox for cheating against the Yankees ? | For The Win via @forthewin http:// ftw.usatoday.com/2017/09/boston -red-sox-cheating-like-the-patriots-belichick-new-york-yankees-mlb …	0	0	
Yankees acusan a los Red Sox de usar tecnología para robar señales https://www. albat.com/lasmayores/Yan kees-acusan-a-los-Red-Sox-de-usar-tecnologia-para-robar-senales-20170905-0023.html …	0	0	
Top story: Boston Red Sox Used Apple Watches to Steal Signs Against Yankees http://www. nytimes.com/2017/09/05/spo rts/baseball/boston-red-sox-stealing-signs-yankees.html … , see more http:// tweetedtimes.com/CEEKTechnology ?s=tnp …	0	0	
Cover Story: Boston Red Sox Used Apple Watches to Steal Signs Against Yankees http://www. nytimes.com/2017/09/05/spo rts/baseball/boston-red-sox-stealing-signs-yankees.html … , see more http:// tweetedtimes.com/jcsacouto?s=tnp	0	0	
Top story: Boston Red Sox Used Apple Watches to Steal Signs Against Yankees http://www. nytimes.com/2017/09/05/spo rts/baseball/boston-red-sox-stealing-signs-yankees.html … , see more http:// tweetedtimes.com/ellitweets?s=t np …	0	0	
Wether we did it or not you still have to hit the ball and we haven't been! So what are the Yankees crying for like they have never cheated	0	0	
Thanks! I don't trash talk that much like others. If anything I get into it more with my nephews about hockey then I do with other people	0	1	
[MLB: Orioles ] O's No. 2 prospect Hays joins outfield mix http:// sportspyder.com/teams/baltimor e-orioles/articles/22490083 … #Orioles	0	0	
Break News: Boston Red Sox Used Apple Watches to Steal Signs Against Yankees http://www. nytimes.com/2017/09/05/spo rts/baseball/boston-red-sox-stealing-signs-yankees.html … , see more http:// tweetedtimes.com/deepcell?s=tnp	0	0	
@GlobeChadFinn did the NYTimes get a jump on the Globe. It seems as though the Red Sox are stating the Yankees were doing it as well.	0	0	
Yet the Yankees shouldn't? Stop being a hypocrite	0	0	
Manager Joe Girardi denies Red Sox claims that the Yankees also stole signs. http:// thesco.re/2eDJvra pic.twitter.com/WYBQLKqNf2	0	7	
T-4th: HOME RUN, @GosukeKatoh ! A solo blast over the wall in right puts Tampa on the board. #BlueJays 5, #Yankees 1.	1	7	
Top story: Boston Red Sox Used Apple Watches to Steal Signs Against Yankees http://www. nytimes.com/2017/09/05/spo rts/baseball/boston-red-sox-stealing-signs-yankees.html … , see more http:// tweetedtimes.com/pingmicro?s=tnp	0	0	
