
Idk why they'd have to cheat to beat the Yankees anyway.....	0	1	
#Yankees last championship team had AROD and MELKY CABRERA! CHEATERS! #steroids	0	5	
Coño! Bueno mientras seguiré con el @BlueJays vs #LosRobaSeñas	0	0	
trending from LOT http:// ift.tt/2x8Z6dK : Boston Red Sox Used Electronic Devices to Steal Signs Against Yankees http:// ift.tt/2f1nof4	0	0	
Boston Red Sox Used Apple Watches to Steal Signs Against Yankees - The New York Times https:// apple.news/AVjkfSgjdR-Oqu jjnN0vYAQ …	0	0	
Oh wait, now they Blaming Toddfather	0	0	
Estas yankees son de otro mundo	0	0	
Red Sox caught using an Apple Watch to steal signs from Yankees http:// nydn.us/2f0Nuys That figures! All those Boston teams are cheaters.	0	0	
She must have been a fan of Elvis. Or former Orioles first baseman and Hall of Famer, Eddie Murray. pic.twitter.com/dOX9VteMGi	0	0	
Yankees fans live on twitter lmao	0	0	
... And the Yankees game is in rain delay :/	0	1	
iSpy: Red Sox caught using Apple Watches in scheme to steal signs from Yankees - Macworld https:// apple.news/AbMQZ7bHIOQqXF ikyqg-Ucg …	0	0	
Current situation in Baltimore #Yankees #Orioles pic.twitter.com/UPES27J87z	0	5	
The #Red Sox used Apple Watches to steal signs against the #Yankees The 28 other fan bases: pic.twitter.com/esVgmENcqd	0	2	
If they *were* stealing The @Yankees ' signals, they were #DoingItWrong . Cuz, um, The @RedSox lost 3 of 4 this weekend.	0	1	
Damnit @RedSox we're better than this. This is a @Yankees thing to do	0	0	
MLB commissioner promises ‘thorough investigation’ of #RedSox , Yankees sign-stealing charges http:// bos.gl/umct9pS pic.twitter.com/eHHLLyn4AG	2	4	
Red Sox reportedly caught using electronic devices to steal signs from Yankees https:// goo.gl/fb/3yHD2y http:// bit.ly/whiteboardNOW	0	0	
@maryycarol7 Tweet from TweetCaster - @CBSPhilly : Report: Red Sox Used Apple Watch To Steal Yankees ' Signs http:// cbsloc.al/2gLeSUU	0	1	
It shows the RedSox can't beat the Yankees straight up LMAO!!!! #babyBombers	0	0	
I guess ill watch the cheating @RedSox until the Yankees start	0	2	
LOL. Shame Shame. https://www. cbssports.com/mlb/news/repor t-red-sox-caught-using-electronic-device-to-steal-signs-from-yankees/ …	0	0	
If they *were* stealing The @Yankees ' signals, they were #DoingItWrong . Cuz, um, The @RedSox lost 3 of 4 this weekend. https:// twitter.com/nytimes/status /905163675480281088 …	0	0	
No truth to the rumor that Eric Mangini is a special "video consultant" for the Yankees	0	0	
Because the Yankees have never done anything wrong ever?	0	0	
Congratulations!	0	0	
Red Sox stole signs electronically from Yankees , other teams - via @ESPN App http:// es.pn/2j1adPp	0	0	
Orioles host Yanks with chance to slice wild-card deficit http://www. espn.com/mlb/preview?ga meId=370905101 …	0	0	
#RedSox used Apple Watches to steal signs from #Yankees by communicating with people watching the SP-C externally	0	0	
To be honest I already know the Sox aren't making it to the World Series and neither is the Yankees ! But we need to get a power hitter 2018	0	0	
Pete who at MLB approved the Yankees secretly taping the RSox on a fishing expedition, or did Cashman tape and tell on his own?	0	0	
in the AL the Yankees are LMAO	0	0	
King Stu!	0	2	
Gay remake of Romeo and Juliette where one of them plays for the Yankees and the other for the Red Sox	1	2	
@Yankees Please change your hair policy immediately. Thank you. https:// twitter.com/talkhoops/stat us/905209684159692800 …	0	0	
Red Sox stole signs using AppleWatch against Yankees via @ESPN App http:// es.pn/2wDaA7N http:// fb.me/8DtDg6We1	0	0	
Red Sox used Apple watches to steal signs against Yankees . #Applegate #Belichick #ItsANewEnglandThing #BostonSportsGuyApproves	4	23	
I want all wins against the Orioles rescinded immediately	0	0	
Red Sox said to use Apple Watch to steal signs from Yankees - CNET https://www. cnet.com/news/boston-re d-sox-apple-watch-smartwatch-to-steal-signs-from-new-york-yankees/#ftag=CADf328eec …	0	0	
Report: Red Sox used Apple Watch to steal Yankees ' signs: NEW YORK (AP) -- The first-place Boston… https:// goo.gl/fb/pVBAmq @NewsSyndicator	0	0	
Red Sox stole signs electronically from the Yankees What a bush league move from a classless organization http:// es.pn/2j1adPp	0	0	
Red Sox said to use Apple Watch to steal signs from Yankees - CNET https:// goo.gl/fb/DZgx6Y	0	0	
Red Sox stole signs using AppleWatch against Yankees via @ESPN App http:// es.pn/2wDaA7N	0	0	
#Yankees #RedSox https:// twitter.com/Charlie_Ricker /status/905183399790465025 …	0	1	
Report: Red Sox used Apple Watch to steal Yankees ' signs http:// on.ksdk.com/2gEd1Oj pic.twitter.com/3hF90ESC4f	1	2	
Oh, I suspect there will be repercussions.... #MLB #RedSox #Yankees https:// twitter.com/nytimes/status /905163675480281088 …	0	0	
iSpy: Red Sox caught using Apple Watches in scheme to steal signs from Yankees : It seems that the Red Sox were doing a lot more with their…	0	0	
Report: Red Sox Used Apple Watch To Steal Yankees ' Signs http:// cbsloc.al/2gLeSUU	0	6	
Went to Bdubs during a Yankees game, ordered and received my wings within 7 minutes. Life's good man.	0	7	
EEUU le empata a Hondura y van 1-1. Faltan dos fechas, si los yankees terminan en repechaje van contra SIRIA. THE BEST MATCH OF STORY	0	0	
My favorite player doing good things!	1	2	
pic.twitter.com/nAi6EHxziT	0	0	
Where is all the Headley haters now that he balling out?	0	0	
@RedSox cheated against @Yankees using apple they were caught on tape doing it and have admitted doing it for weeks mlb must forfeit wins!! pic.twitter.com/nVzfL47J13	0	0	
[MASN] O's game blog: Notes on Austin Hays, Alex Wells and more - Steve Melewski http:// sportspyder.com/teams/baltimor e-orioles/articles/22489838 … #Orioles	0	0	
"Red Sox" technically by rule they didn't do anything wrong if what the Yankees are saying they stole signs.	0	0	
@OllieNYankees One of the bad things about playing on the road is that it's perfect here in New York but not where the Yankees may be.	0	1	
I'm curious if the Yankees used YES to steal signs or if the Red Sox are just being petty. Either way, stop cheating in sports! #MLB	0	0	
Red Sox reportedly caught using electronic devices to steal signs from Yankees http:// fxn.ws/2iZn70t	0	0	
Boston Red Sox Used Apple Watches to Steal Signs Against Yankees https:// nyti.ms/2xML9z1 よりによってヤンキース相手にかよ	0	0	
It's good for baseball? HAHAHAHAHA. If it was the Yankees OH MY GOD look at those bastards cheating oh my god unbelievable man	0	0	
@ESPNStreak SM the start of the Yankees -Baltimore game is delayed due to rain	0	0	
Stealing signs in baseball. What are your thoughts on this subject? Redsox vs New-York- Yankees http:// fb.me/2zzPzH8Qi	1	2	
If the #Yankees reach the ALDS who would you rather face	1	0	
Well everyone cheats tbh, we know of the Yankees cheating against us too, we're just not snitches :)	0	1	
But apparently it wasn't just versus the Yankees .	0	0	
Red Sox said to use Apple Watch to steal signs from Yankees - CNET by Terry Collins via CNET News http:// ift.tt/2gK9TUy	0	0	
The Apple Watch is useful for something: Boston Red Sox Used Apple Watches to Steal Signs Against Yankees https:// apple.news/AVjkfSgjdR-Oqu jjnN0vYAQ …	0	3	
El juego de mis #Yankees se demoró para ver poder ver a Venus! #Martesdegrandesligas #ElCaminoESPN	0	0	
Red Sox allegedly used Apple Watches to steal signs from the Yankees . http:// cnet.co/2wDGukA pic.twitter.com/uMkNFqcDcW	0	0	
Cause somebody caught the yankees personal with laptops live streaming the game... gunna rat on the sox and burn their own bridge too haha	0	0	
SEPT 5 @Yankees vs. @Orioles in Baltimore (Part 1): http:// youtu.be/Dd7gGUvSVak?a via @YouTube	0	1	
How does one use an Apple watch to steal signs? #MLB #Yankees #RedSox	0	0	
Didi is also the best shortstop in baseball and it's not even close.	0	3	
Chances it'll be canceled?	0	0	
Red Sox, Yankees , and MLB brass react to Boston cheating http:// dlvr.it/Pl2js0	0	0	
Boston Red Sox Used Apple Watches to Steal Signs Against Yankees via @NYTimes https://www. nytimes.com/2017/09/05/spo rts/baseball/boston-red-sox-stealing-signs-yankees.html …	0	0	
Boston Red Sox Used Electronic Devices to Steal Signs Against Yankees http:// ift.tt/2gDUWjc http:// ift.tt/2gEai7u pic.twitter.com/IH6yqcOWl8	0	0	
Exactly. So playing the victim is hilarious	0	0	
A qué hora es el @Yankees vs @Orioles ? @ESPN_Beisbol	0	0	
Report: Red Sox used Apple Watch to steal signs from Yankees , other teams (via http:// thesco.re/theScore_App ) https://www. thescore.com/news/1366326	0	0	
Red Sox looking for tips #yankees #yankessnation #nyyankees #nyy #yankeesuniverse #pinstripepride #bronxb … http:// ift.tt/2gLHP37 pic.twitter.com/ec07x1P9g9	1	2	
Eliminate the Yankees dress code for this masterpiece https:// twitter.com/stacegots/stat us/905208479408955393 …	0	0	
#MLB #Watch "Red Sox admit to using electronic devices to steal signs vs. Yankees | SC6 | ESPN" on YouTube - https:// youtu.be/un56IOwujvY	0	1	
" @LVBP_Oficial : José Altuve igualó marca de Luis Aparicio #Astros #Orioles #MediasBlancas http:// ow.ly/r8lM30eUFTl "	0	0	
Boston Red Sox Used Apple Watches to Steal Signs Against Yankees - The New York Times https:// apple.news/AVjkfSgjdR-Oqu jjnN0vYAQ …	0	1	
The Yankees ? No shit...	0	0	
The Red Sox have, reportedly, been caught cheating vs. Yankees , using electronics to steal signs. No way Bill Belichick isn't involved.	1	3	
Actually, if the Yankees were smart they would have done that to the visitor’s dugout a long time ago.	0	0	
Recently @jbvdeberry revealed she didn't know what the Texas flag looks like, and today she bought whole wheat tortilla. SMH. Yankees . pic.twitter.com/3RR8CsxlP1	0	10	
@FerAlvarez señor qué pasa con el juego de yankees	0	0	
RichTVXChannel: "Boston Red Sox Used Apple Watches to Steal Signs Against Yankees " by MICHAEL S. SCHMIDT via NYT… https:// twitter.com/i/web/status/9 05181890344357893 …	0	0	
Jod..iba a ver a los Yankees y esta lloviendo en Baltimore..nada vamos a ver a Venezuela dañarle el caminao a los Argentinos!!!	0	0	
#Beisbol Comisionado de MLB habló del robo de señales entre Red Sox y Yankees http://www. albat.com/lasmayores/Com isionado-de-MLB-hablo-del-robo-de-senales-entre-Red-Sox-y-Yankees-20170905-0029.html … #Baseball	0	0	
REPORT: Red Sox Caught Cheating Against Yankees | 12up http://www. 12up.com/posts/5498506- report-red-sox-caught-cheating-against-yankees?a_aid=40022 …	0	0	
"I love it. It fires up the rivalry once again!" - Red Sox fan responds to cheating allegations during the Sox v. Yankees series. #7News pic.twitter.com/oQxYAReuCr	6	6	
The Red Sox got caught using Apple Watches to steal signs against the Yankees (Tyler… https:// goo.gl/fb/t4pSWo	0	0	
Ya los yankees están ganando para mí y esta demorado el juego https:// twitter.com/FerAlvarez/sta tus/905203863623532547 …	0	1	
He still hasn't beaten the Yankees yet. In addition, the Indians have made him look silly, and he hasn't started once against Houston!	0	0	
Red Sox stole signs from Yankees , others using Apple Watch http:// on.lsj.com/2vJXWor pic.twitter.com/v2nSzg89ex	0	0	
Maybe the Yankees DID think of it, but you can't steal from anyone but the best. No need to lower themselves to the Sox level.	0	0	
Checked the forecast, seems like it's gonna rain on and off till 10pm. Hard to see #Yankees playing a game tonight	0	0	
I will! Especially with Yankees game rain delayed! Go Jays	0	1	
Keep playing hard and stay classy @Yankees . Show ever @RedSox and boston fan in general that class wins no matter the score.	0	1	
Or jester faking he got hit by the pitch we or scanchez sucker punch	0	1	
Les Red Sox auraient volé des signaux aux Yankees http:// rc.ca/Pl2jCY	2	0	
Soooo what, whatever the #RedSox did... Yankees still suck..buncha roided out thugs there...	0	8	
Boston Red Sox steal signs against the Yankees using Apple Watches to take the lead in the MLB #2150bm https:// apple.news/AVjkfSgjdR-Oqu jjnN0vYAQ …	0	0	
Boston Red Sox Used Apple Watches to Steal Signs Against Yankees https:// nyti.ms/2xML9z1	0	0	
How to wait out the rain #Orioles pic.twitter.com/3a6m4zjJ2J – bei Hilton Baltimore	0	1	
Product #Reviews : Red Sox said to use #Apple Watch to steal signs from Yankees http://www. robinspost.com/news/reviews/5 95245-product-reviews-red-sox-said-to-use-apple-watch-to-steal-signs-from-yankees.html … #News	0	0	
Boston Red Sox Used Apple Watches to Steal Signs Against Yankees - The New York Times https:// apple.news/AVjkfSgjdR-Oqu jjnN0vYAQ …	0	0	
Red Sox reportedly used an Apple Watch to steal signs from rival Yankees http:// bit.ly/2gEouwX	0	0	
Les Red Sox auraient volé des signaux aux Yankees http:// ift.tt/2vK4vYp	0	0	
iSpy: Red Sox caught using Apple Watches in scheme to steal signs from Yankees http:// ift.tt/2xMV87x	0	0	
Yankees fan: What time is it? *Looks at apple watch*	3	10	
Cheating isn't cheating if its against the yankees	0	0	
Boston Red Sox Used Apple Watches to Steal Signs Against Yankees - The New York Times #PlayFair https:// apple.news/AVjkfSgjdR-Oqu jjnN0vYAQ …	0	0	
https:// goo.gl/cEHdj7 Austin Hays #DACA #Back2BCPS #Yankees #firstdayofschool #HurricaneIrma Episode IX Sanaa Lathan Sloane Steph 97	0	0	
The Margin: Red Sox caught using Apple Watch to steal signs from Yankees https://www. findmyinvesting.com/2017/09/05/the -margin-red-sox-caught-using-apple-watch-to-steal-signs-from-yankees/ … pic.twitter.com/iRoSKJB6oS	1	0	
Red Sox reportedly used an Apple Watch to steal signs from rival Yankees https:// goo.gl/5tg8KX #WearableTech #IoT pic.twitter.com/1fXXDTaFLu	4	0	
Boston Red Sox stole signs electronically against New York Yankees , other teams http://www. espn.com/mlb/story/_/id /20593927/boston-red-sox-stole-signs-electronically-new-york-yankees-other-teams …	0	0	
Or Jeter pretending to tag a runner out and then bragging about cheating...	0	0	
I ain't on no Yankees shit, but it is very Boston-like to use Technology to steal signs. Bill Belichick won 3 super bowls doing it.	0	0	
Lol so true that why I hate more then any fan base ever	0	0	
Red Sox said to use Apple Watch to steal signs from Yankees - CNET https://www. cnet.com/news/boston-re d-sox-apple-watch-smartwatch-to-steal-signs-from-new-york-yankees/#ftag=CAD590a51e …	0	0	
The Yankees should have just sent fake signals and let them steal them	0	0	
Bogaerts no sirve para nada..había que traer un bat de poder ., ahora a lamentarse y a espiar a los Yankees para ganar ! Que horror !	0	0	
What a joke, yes using watches was wrong but genius lol. Yankees look worse for snitching! Bunch a whiny babies. Snitches get stitches!	0	0	
Let's go Yankees pic.twitter.com/co6Lezqj4a	0	0	
iSpy: Red Sox caught using Apple Watches in scheme to steal signs from Yankees http:// ift.tt/2xMV87x	0	0	
Oreos x Yankees não tá passando no WatchESPN por causa de rain delay Só falta o jogo do Braves também não passar pelo mesmo motivo.	0	0	
Wouldn't be a terrible thing. Yankees don't play well in the Trop if I'm not mistaken	0	2	
The dangers of #technology . #WatchGate @TechCrunch @RedSox @Yankees https:// techcrunch.com/2017/09/05/the -red-sox-used-an-apple-watch-to-steal-signs-from-the-yankees/ …	0	1	
#Orioles No. 2 prospect Austin Hays is on his way from Bowie to Baltimore after being promoted for late-season push http:// fb.me/1uJcbgGaD	0	0	
And we still beat their ass 3 out of 4 games. #Yankees https:// twitter.com/nytimes/status /905163675480281088 …	0	0	
Boston Red Sox Used Apple Watches to Steal Signs Against Yankees - http:// NYTimes.com https:// mobile.nytimes.com/2017/09/05/spo rts/baseball/boston-red-sox-stealing-signs-yankees.html …	0	0	
Working at orioles is hilarious	0	0	
#ibleedpinstripes #yankees pic.twitter.com/TyDb7BTmAt	0	1	
Red Sox allegedly used Apple Watches to steal signs from the Yankees . http:// cnet.co/2wDGukA pic.twitter.com/Mxqo0qWuhs	0	0	
Congrats to @TheAustinHaysss for being called up by the @Orioles ! Looking to see you make an impact in big leagues! #Birdland	0	1	
Saw Camden Yards in Baltimore on my way back from D.C. just now. Where the Yanks are playing the @Orioles tonight in Baltimore! Go @Yankees pic.twitter.com/xKlnAbfRLQ – bei Oriole Park at Camden Yards	0	1	
Please NO RAINOUTS!!!!! I look forward to the #Yankees game all day!!!	2	8	
Start of tonight’s Orioles - Yankees game delayed due to rain http:// sports.wnst.net/mlb/boxscore.a sp?gamecode=370905101 … pic.twitter.com/sEQPQloi3P	0	0	
Red Sox reportedly caught using electronic devices to steal signs from Yankees http://www. foxnews.com/tech/2017/09/0 5/red-sox-reportedly-caught-using-electronic-devices-to-steal-signs-from-yankees.html … via the @FoxNews Android app	0	0	
Boston Red Sox Used Apple Watches to Steal Signs Against Yankees https:// nyti.ms/2xML9z1	0	0	
Yankees get a taste of their own medicine https:// twitter.com/SportsCenter/s tatus/905184655632203780 …	0	0	
Is @RedSox ' Devers checking his @MLB @Apple Watch before hitting the tank off @Yankees ' Chappy? pic.twitter.com/homj58sGz8	0	0	
Your right bro the yankees are perfect! pic.twitter.com/3ssHpHZzg8	1	6	
What kind of penalty should the Red Sox face? Do you believe the claims that the Yankees were using their own electriconics? #SPM230 https:// twitter.com/sportscenter/s tatus/905184655632203780 …	0	1	
the red sox may have stolen the signs but the yankees stole your heart im sorry im sorry im trying to remove it	0	3	
New: Red Sox Caught Using Sophisticated Electronic Doohickeys To Steal Signs From Yankees : Gothamist http:// ift.tt/2eJ9txb	0	0	
Compro 4 asientos para sentarse el sólo... y no se sabe como llego ese otro fanatico #Yankees y le hizo un show públicamente	0	1	
Make sure you get him the TRIPLE STACK!!!!!!	0	0	
No justification for anything Sox may have done, but I'd an @espn exposé on @MLB conveniently delaying Yankees ' mild brawling punishments	0	0	
Sign Machado instead @Yankees https:// twitter.com/maddc8/status/ 905208165918171136 …	0	1	
Hoping playoffs Yankees vs AZ maybe?	0	0	
#MLB : #RedSox stole signs from #Yankees , others using #AppleWatch https:// usat.ly/2eI5RLR	2	0	
Just like the Cheatriots must be taking tips from Beicheat! Lol @YESNetwork @Yankees @NYYankeesBlog @DidiG18 @ElGarySanchez #Cheaters #sad https:// twitter.com/re2pect2jeter/ status/905175291420659713 …	0	1	
José Altuve igualó marca de Luis Aparicio #Astros #Orioles #MediasBlancas http:// ow.ly/r8lM30eUFTl	0	0	
@orioles your boy has tix for tomorrow's game... Any idea when you'll call the game due to weather so a man ain't got to travel for nothin	0	0	
Any update on how long they are thinking?? I'm sitting at the hotel waiting	0	0	
Report: Red Sox Used Apple Watch To Steal Yankees ’ Signs http:// 215.team/11812/report-r ed-sox-used-apple-watch-to-steal-yankees-signs/ …	0	0	
Scary to think that cheating only makes them 2.5 games better than the Yankees at the current time	0	1	
@billburr yo Billy bean bag! Boston Red Sox Used Apple Watches to Steal Signs Against Yankees - The New York Times https:// apple.news/AVjkfSgjdR-Oqu jjnN0vYAQ …	0	0	
Boston Red Sox Used Electronic Devices to Steal Signs Against Yankees http:// a.msn.com/02/en-us/AArlX tT?ocid=st …	0	0	
Red Sox stole signs electronically from Yankees , other teams - ESPN http:// dlvr.it/Pl2h6X pic.twitter.com/gvu81Bsf45	0	0	
José Altuve igualó marca de Luis Aparicio #Astros #Orioles #MediasBlancas http:// ow.ly/r8lM30eUFTl	0	1	
#LetsGoYankees Beat the Hated Orioles #BronxBombersAreBack #AllRise #BelieveinNewYork pic.twitter.com/60FaSiFsSo	1	0	
@MLBNetwork guide shows Yankees at orioles or blue jays at Red Sox. But, I got nationals and marlins. ???	0	0	
Looks like a double header tomorrow are Yankees off Thursday?	0	0	
Entonces van a perder hoy de nuevo.... https:// twitter.com/PamelaL21/stat us/905208311531921409 …	0	0	
So the @Yankees video recording the @RedSox dugout is ok?	0	0	
Red Sox Used APPLE Watch to Steal Signs Against Yankees ... http:// drudge.tw/2x8DNJh	0	1	
Mr. Jay says "it's all good". Score 0-5 vs Tampa Yankees . pic.twitter.com/TCJ6QIZrdi	0	3	
Broo ahora tiene que pujar doble con los Yankees & Argentina.. #QueDifícil	0	1	
Let's go Yankees ! https:// twitter.com/benjamin_moore /status/905196492004122624 …	0	2	
MLB: Red Sox reportedly used Apple Watch to steal Yankees ' signs https:// goo.gl/fb/RpvfnR	0	0	
And the Yankees used (allegedly) the cameras from the YES network to steal Red Sox signs.	0	0	
https:// twitter.com/i/moments/9051 68346429214720 … Those cheating bastards #Yankees	2	2	
Red Sox stole signs electronically from Yankees , other teams - ESPN #sports	0	0	
I thought the Yankees might catch the Red Sox by late September. Turns out they caught them red handed two weeks ago. #yankees #RedSox #ouch	2	9	
It's pouring at Camden Yards and now they've asked fans to relocate to covered areas because of lightning. #Orioles #Yankees	0	1	
It's pouring at Camden Yards and now they've asked fans to relocate to covered areas because of lightning. #Orioles #Yankees	0	2	
maybe Bryce coming to the Yankees and having to cut his hair is actually a good thing. https:// twitter.com/maddc8/status/ 905208165918171136 …	5	24	
Boston Red Sox Used Apple Watches to Steal Signs Against Yankees https:// nyti.ms/2xML9z1	0	0	
Such a class human being. I hope u do get your World Series win Curtis. Nobody deserves it more. Just remember u will always be missed here.	0	0	
You do realize the Yankees did this in their bullpen, right? Even the Cubs have TV monitors to watch the broadcast from their bullpen. https:// twitter.com/dan_omara/stat us/905165003526942721 …	0	0	
Check out Sonny Gray Signed Autographed ROMLB Baseball Auto New York Yankees *Bleeding* http://www. ebay.com/itm/-/15268698 0933?roken=cUgayN&soutkn=wrbzmq … via @eBay	0	0	
Red Sox stole signs from Yankees , others using Apple Watch: Baseball official https:// usat.ly/2eI5RLR via @USATODAY	0	0	
@NYCKING Red Sox stole signs from Yankees , others using Apple Watch: Baseball official https:// usat.ly/2eI5RLR via @USATODAY	0	0	
Red Sox caught using an Apple Watch to steal signs from Yankees - NY Daily News http://www. nydailynews.com/sports/basebal l/yankees/red-sox-caught-apple-watch-steal-signs-yankees-article-1.3471319 …	0	0	
Red Sox caught using an Apple Watch to steal signs from Yankees http:// nydn.us/2f0Nuys	5	17	
We are already under a rain delay at Camden Yards and now fans are being asked to seek cover because of lightning. #Orioles #Yankees	2	4	
Boston Red Sox Used Apple Watches to Steal Signs Against Yankees - The New York Times https:// apple.news/AVjkfSgjdR-Oqu jjnN0vYAQ …	0	0	
En un juego entre @SFGiants y @Yankees , ¿quién crees que ganaría? #MLB ThisIsTheCap #NewEraCarib pic.twitter.com/RckpPCnslA	0	4	
Yay! He lives here in my hometown of Summerville SC!!!	0	1	
Report: Red Sox used Apple Watch to steal Yankees ’ signs http:// dlvr.it/Pl2gWf pic.twitter.com/mVV2fGjHOK	0	0	
Yankee fans have 2 sets of rules. One for them and one for everyone else.	0	0	
(Red Sox stole signs from Yankees , others using Apple Watch) - CLOSE A ... - http:// cincylink.com/red-sox-stole- signs-from-yankees-others-using-apple-watch/ … - Cincy Link - pic.twitter.com/VUy1ItR8wZ	0	0	
Red Sox reportedly caught using electronic devices to steal signs from Yankees https:// goo.gl/fb/mcRZ4L #IHateTimWaterman	0	0	
@TwitterNews As a baseball fan Im sorry to read this Can anyone be honest ever Go Yankees	0	0	
Orioles adding Austin Hays to expanded roster - School of Roch http://www. masnsports.com/school-of-roch /2017/09/orioles-adding-austin-hays-to-expanded-roster.html …	0	0	
His official hashtag is #HaysTrain by the way	1	3	
9/5/17 Cheer for: Tigers. Ugh, Darn Yankees . A's. Rays. Braves. MARINERS #GoMs	0	0	
Red Sox, APPLE watch, Yankees New York Big Apple. Pun puzzle pieces are there. You guys can put them together	0	2	
Boston is scum	0	1	
@MLBNetwork will the yankees game be back on once they play?	0	0	
Red Sox get "caught stealing" signs with Apple Watches. #RedSox #Yankees #Apple #MLB #SportsBiz #MARK301 https:// twitter.com/bleacherreport /status/905170412191051777 …	0	3	
Boston Red Sox Used Apple Watches to Steal Signs Against Yankees https:// nyti.ms/2xN42SH	0	0	
Red Sox reportedly caught using electronic devices to steal signs from Yankees | Fox News http://www. foxnews.com/tech/2017/09/0 5/red-sox-reportedly-caught-using-electronic-devices-to-steal-signs-from-yankees.html …	0	0	
Yankees bust Red Sox in high-tech cheating scandal http:// fb.me/6rgdaHuUh	0	0	
Finally a killer app for the Apple Watch: beating the Yankees https://www. nytimes.com/2017/09/05/spo rts/baseball/boston-red-sox-stealing-signs-yankees.html … #IoT #wearables	1	1	
And Yankees don't have team of cheaters remember 2004 afrud knocking the ball out of our players glove oh wait that doesn't count	0	1	
Full of cheaters. Yankees fan all the way!!!!	0	0	
The Red Sox used an Apple Watch to steal signs from the Yankees https:// techcrunch.com/2017/09/05/the -red-sox-used-an-apple-watch-to-steal-signs-from-the-yankees/?ncid=rss … pic.twitter.com/M6RM2UStZO	0	0	
http:// newsworld.press/?p=4448 - Red Sox stole signs electronically from Yankees , other teams pic.twitter.com/lpCTbOo28b	0	0	
tfw the Yankees game is delayed and you were looking forward to listening to it on the train	0	0	
Come on, let's get this spanking started already #Yankees	0	1	
#AppleWatch innovation? #RedSox caught using  Watch to steal signs from @Yankees - h/t: @SeanKlenert http://www. nydailynews.com/sports/basebal l/yankees/red-sox-caught-apple-watch-steal-signs-yankees-article-1.3471319 …	0	0	
Boston Red Sox Used Apple Watches to Steal Signs Against Yankees ! #wearables #digitalhealth #baseball https:// mobile-nytimes-com.cdn.ampproject.org/c/s/mobile.nyt imes.com/2017/09/05/sports/baseball/boston-red-sox-stealing-signs-yankees.amp.html …	1	0	
