
Orioles fans were content for a year or 3 with a winning record and making playoffs now we expect to make playoffs and want another WS	0	0	
"Red Sox stole signs from Yankees , others using Apple Watch" http:// ift.tt/2gJjoU8 pic.twitter.com/VKHvhryPHn	0	0	
The start of tonight's New York Yankees at Baltimore Orioles game has been delayed.	1	1	
As a #Mets fan, I can not stand the #Yankees . I mean CAN NOT STAND. But after what #RedSox got caught doing today, I'm rethinking things... pic.twitter.com/OknksgTJBN	0	4	
Lol and their response was basically "yeah we did it but we think they're stealing from us too!" go yankees !	0	1	
7-6 Yankees win	0	1	
Ya they'll help by donating Apple watches	0	0	
They aren't "blowing it" either theyre still in first place the Yankees just exceeded expectations	0	0	
Boston #RedSox Used an Apple Watch to Steal Signs Against #Yankees @MarshaCollier That's a great feature #techradio https:// mobile.nytimes.com/2017/09/05/spo rts/baseball/boston-red-sox-stealing-signs-yankees.html?referer= … pic.twitter.com/DDzx7Kex3p	0	5	
So is Bellechiek a security consultant for the Sawx? ? #RedSox #Yankees https:// twitter.com/nytimes/status /905163675480281088 …	0	0	
#NYY #Yankees https:// twitter.com/jared_carrabis /status/905173627053670401 …	0	0	
Report | Red Sox accused of using Apple Watch to steal Yankees signs #yankees #nyy #MLB http:// sport-ne.ws/6ux2 pic.twitter.com/6sJhZz7eEp	0	0	
Boston Red Sox Used Electronic Devices to Steal Signs Against Yankees ? http:// a.msn.com/02/en-us/AArlX tT?ocid=st …	0	0	
Boston Red Sox Used Apple Watches to Steal Signs Against Yankees https:// nyti.ms/2xN42SH	0	2	
Yankees bust Red Sox in high-tech cheating scandal, using Apple watch. @TheCyberRisk http:// nyp.st/2j0AvS7 via @nypostsports	2	1	
So Will is a Yankees fan now?	0	0	
Yankees bust Red Sox in high-tech cheating scandal | New York Post luv it http:// nypost.com/2017/09/05/yan kees-bust-red-sox-in-high-tech-sign-stealing/?utm_campaign=SocialFlow&utm_source=NYPTwitter&utm_medium=SocialFlow&sr_share=twitter …	0	1	
Red Sox stealin Yankees signs & all AL East forever but stoopidly-took 86 years to win World Series- Apple Watch http://www. barstoolsports.com/baseball/break ing-news-the-red-sox-were-caught-cheating-against-the-yankees/?_branch_match_id=433743555108907050 …	0	0	
Finally, there is an Applegate! #RedSox #Yankees pic.twitter.com/1Sa0CcqI5R	0	0	
no, buddy! Red Sox only! MLB hasn't said anything about the #Yankees TRY AGAIN!	0	0	
REPORT: #RedSox used #AppleWatch to steal #Yankees signs http:// fb.me/YxmwWCfK	0	0	
Red Sox caught stealing Yankees signs over weekend using Apple watch http:// nypost.com/2017/09/05/yan kees-bust-red-sox-in-high-tech-sign-stealing/ …	0	0	
What is it with Bostonians? First, Patriots now Red Sox?	0	0	
Tipppy Martinez (Baltimore Orioles ) Signed (Black) MLB BASEBALL !! http:// ift.tt/2wFkzrB	0	0	
Red Sox stole signs from Yankees , others using Apple Watch https:// usat.ly/2eI5RLR via @USATODAY	0	0	
http:// MLB.com At Bat, 6:34 PM, The start of tonight's Yankees - Orioles game in Baltimore will be delayed due to inclement weather.	0	0	
@Joenbc , Yankees bust Red Sox in high-tech cheating scandal: http:// nypost.com/2017/09/05/yan kees-bust-red-sox-in-high-tech-sign-stealing/ …	0	0	
Sad day 4 #MLB when #RedSox deploy #AppleWatches to steal signs form #Yankees catchers. #RedSoxCheat #PatriotsCheat #BostonCheats #GoYankees pic.twitter.com/w3a5HSoG2h	2	5	
Old school Orioles Magic theme song in its entirety!!!!!	0	1	
Boston Red Sox Used Apple Watches to Steal Signs Against Yankees http:// ift.tt/2vJrmmJ 61	0	0	
Red Sox Caught Stealing Signs From Yankees : Report | NBC Connecticut http://www. nbcconnecticut.com/news/sports/Re d-Sox-Caught-Using-Apple-Watch-to-Steal-Signs-From-Yankees-442799543.html … via @nbcconnecticut	0	0	
Kinda glad I didn't get tickets for the Yankees / Orioles game tonight	0	0	
@billburr of course the Red Sox and Yankees cheat! Now, maybe a retweet for an amazing cause? https:// twitter.com/alloystang/sta tus/904849584274460672 …	0	0	
Yankees game isn't going to be played we are here at the stadium	0	0	
I promise this is my last tweet: Sox were dumb and skeevy to use Apple Watch. Yankees suck for tattling. John Farrell needs to go.	0	0	
The Red Sox reportedly used an Apple Watch to relay signs by the Yankees catchers http:// nbc4dc.com/jOy0UWh	4	3	
Red Sox reportedly used Apple Watch to steal Yankees ’ signals http:// engt.co/2xMTxhX Sponsored by: http://www. frontiernetworks.ca	0	0	
Yankees didn't have half their players for a month, no one feels sorry for he Red Sox having injured players everyone has them	0	0	
Boston Red Sox Used Apple Watches to Steal Signs Against Yankees via @NYTimes https://www. nytimes.com/2017/09/05/spo rts/baseball/boston-red-sox-stealing-signs-yankees.html …	1	2	
Red Sox stole signs from Yankees , others using Apple Watch #RedWings https:// fanly.link/dc0f0083b0 pic.twitter.com/jK2CzByDOu	0	0	
even when they cheat they can't beat the Yankees in a season series https:// twitter.com/sportscenter/s tatus/905184655632203780 …	1	3	
Report: Red Sox used Apple Watch to steal signs from Yankees , other teams (via http:// thesco.re/theScore_App ) https://www. thescore.com/news/1366326	0	0	
Boston Red Sox Used Apple Watches to Steal Signs Against Yankees - The New York Times https:// apple.news/AVjkfSgjdR-Oqu jjnN0vYAQ …	0	2	
Baltimore Orioles - New York Yankees em http:// SofaScore.com #SofaScore pic.twitter.com/PFRePunz1j	0	0	
My home town team, SF APPLE, conspired with Evil Empire Red Sox to technologically beat my beloved NY YANKEES . Boston teams cheat!	0	0	
"Boston Red Sox Used Apple Watches to Steal Signs Against Yankees " by MICHAEL S. SCHMIDT via NYT Sports https:// buff.ly/2wFPeoC via @nytim …	0	0	
The commissioner already spoke the story is dead Yankees and sox both are gonna get fined every team does it In their own way it's fine	0	0	
I can't wait to hear the #Yankees announcers on YES network talk about this tonight - it's going to be epic	1	9	
Boston Red Sox Used Electronic Devices to Steal Signs Against Yankees https://www. reddit.com/r/baseball/com ments/6yaos8/boston_red_sox_used_electronic_devices_to_steal/?ref=share&ref_source=twitter … via @reddit	0	0	
#RedSox more efficient at what other teams already do. #AppleWatch And why were the #Yankees filming the other teams dugout?	0	0	
Rain delay with school and work tomorrow #INWYW	0	1	
Report: Red Sox used Apple Watch to steal signs from Yankees , other teams http://www. msn.com/en-ca/sports/m lb/report-red-sox-used-apple-watch-to-steal-signs-from-yankees-other-teams/ar-AArmc7F?ocid=ob-tw-enca-693 … pic.twitter.com/Ce5QbSzzbg	1	1	
Buck showalter finding out the red soxs were caught in the Apple Watch cheating pic.twitter.com/JKUvVknkyS	0	1	
Joe Girardi firmly denies Red Sox’s accusation against Yankees http:// ift.tt/2gEj8BZ	0	0	
The Orioles are calling up outfield prospect Austin Hays #orioles #MLB http:// sport-ne.ws/6uwv pic.twitter.com/GB7j2V7s2G	0	3	
lol I just like it when it is more of a cold fight with Sox vs Yankees	0	0	
And y'all still lost #Yankees https:// twitter.com/twittermoments /status/905175053938991108 …	0	0	
Red Sox reportedly caught using electronic devices to steal signs from Yankees http:// ift.tt/2vJPS79 #breakingnews #news	0	0	
Lingering rain delays the #Orioles game #Birdland #Baltimore pic.twitter.com/X7rLTz3zCK	1	2	
Yea, the Yankees are the epitome of class	0	0	
Red Sox stole Yankees ' signs using an Apple Watch via @axios https://www. axios.com/red-sox-stole- yankees-signs-using-an-apple-watch-2481902831.html?utm_source=twitter&utm_medium=twsocialshare&utm_campaign=organic …	0	0	
The Boston Red Sox used Apple Watches, other electronic devices to steal hand signals from Yankees , other - iMore https:// apple.news/AsM3gDujgS7mZN DbIWiJr7A …	0	0	
LET THE YANKEES DO THIS AND EVERYONE AND THEIR MOMS WILL BE ON OUR ASSES FOR ETERNITY. https:// twitter.com/nytimes/status /905163675480281088 …	0	0	
Red Sox said to use Apple Watch to steal signs from Yankees - CNET http:// dlvr.it/Pl2Ldp #Tech pic.twitter.com/3h66yUiGtr	1	0	
Friday, he clears up the whole Earhart thing (Amelia. Ron never had a thing.), and retires!	0	1	
contra os Yankees pode	0	0	
Red Sox stole Yankees ' signs using an Apple Watch http:// ow.ly/Q0HF30eWd7M #MLB #AppleWatch #RedSox #Technology #Yankees	1	0	
Red Sox said to use Apple Watch to steal signs from Yankees - CNET http:// dlvr.it/Pl2LSj	1	0	
PLAY BALL! #Yankees at #BlueJays Game 1 - North Div. Cham. Series Notes: http://www. milb.com/documents/0/1/ 8/252615018/9.5.17_TY_Game_Notes.pdf … Radio: https:// tunein.com/radio/Tampa-Ya nkees-Baseball-Network-s198323/ …	2	9	
Guess the final score of the Yankees /O's game tonight and get one month free on my VIP page	0	2	
#RedSox stole signs from Yankees , others using Apple Watch http:// on.wlbz2.com/2wG1p4O via @usatodaysports pic.twitter.com/2by7StSPnh	0	0	
Do you guys want some apple juice? @RedSox oh sorry I forgot I should've used emojis as signs so you understand #TooSoon ? #NYY #Yankees	0	0	
Red Sox spying on the Yankees . Yeah sounds like them. #SpyGate	0	0	
Hey did you hear the Red Sox stole signs from the Yankees ? pic.twitter.com/ITaMxWD5gA	0	4	
#BearsNation #Bears #ChicagoBears Red Sox reportedly used Apple Watch to steal Yankees ' signs http:// dld.bz/gd5Tr	0	0	
Stealing signs is a part of baseball Jesus Christ every level does it. Yankees fault for having easy signs https:// twitter.com/BleacherReport /status/905170412191051777 …	0	2	
They are tuning up their Apple watches. They don't work with heavy cloud cover.	0	0	
Los Yankees también https:// twitter.com/jcarrilloroman o/status/905175177809539073 …	1	1	
Boston Red Sox Used Apple Watches to Steal Signs Against Yankees - The New York Times https:// apple.news/AVjkfSgjdR-Oqu jjnN0vYAQ …	0	0	
#Yankees bust #Red Sox in high-tech cheating scandal #MLB http:// nyp.st/2j0AvS7 via @nypostsports	0	0	
Red Sox reportedly caught using electronic devices to steal signs from Yankees | Fox News http://www. foxnews.com/tech/2017/09/0 5/red-sox-reportedly-caught-using-electronic-devices-to-steal-signs-from-yankees.html …	0	0	
#RedSox stole signs from Yankees , others using Apple Watch http:// on.wcsh6.com/2wG1i9o via @usatodaysports pic.twitter.com/9jXPYaYKoT	0	1	
Report: Red Sox used Apple Watch to steal Yankees ' signs http://www. wtoc.com/story/36295078 /report-red-sox-used-apple-watch-to-steal-yankees-signs …	0	0	
http:// newsworld.press/?p=4445 - Red Sox stole signs electronically against Yankees pic.twitter.com/sje5PpeYGY	0	0	
#sportscards Paul O’Neill 2016 Topps Tier One Auto on card Signed Oneill New York Yankees http:// dlvr.it/Pl2L72 pic.twitter.com/HMw2kbAWWi	0	0	
Check out Zippo "New York Yankees " Logo Lighter, Brushed Chrome, Z939 - NEW #Zippo http://www. ebay.com/itm/Zippo-034- New-York-Yankees-034-Logo-Lighter-Brushed-Chrome-Z939-NEW-/142403984085?roken=cUgayN&soutkn=xZv7c6 … via @eBay	0	0	
Report: Sox stole Yankees ’ signs using Apple Watch http://www. newsday.com/sports/basebal l/yankees/red-sox-admit-to-stealing-signs-from-yankees-using-apple-watch-report-says-1.14113210 … via @newsday . Cheaters gonna cheat -New England	0	0	
Check out Zippo "New York Yankees " Logo Navy Blue Matte Lighter, 8260 - NEW #Zippo http://www. ebay.com/itm/Zippo-034- New-York-Yankees-034-Logo-Navy-Blue-Matte-Lighter-8260-NEW-/142393061856?roken=cUgayN&soutkn=MJmjGh … via @eBay	0	0	
Fuck the Red Sox. Trash ass team and they tried to flip it on the Yankees to save face. What a joke. https:// twitter.com/sportscenter/s tatus/905184655632203780 …	1	2	
Hey @MLB #RobManfred should stay out of players personal lives and regulate cheating by @RedSox v. @Yankees . Stop double talk! @MLBNetwork	0	0	
BREAKING: photo of Boston Red Sox's smart watch #RedSox #Yankees pic.twitter.com/Syh0XGVnCn	0	0	
Orioles Designate Jayson Aquino, Promote Austin Hays http:// ift.tt/2f06ld1	0	0	
@MLB @Yankees @NFL sports show with Ian Pettigrew @BIGEAST @UnderArmour https://www. pscp.tv/w/bH3MdTE0MDQy NDR8MWxER0xrWFdwcG1LbQi7W1bq5zMP4oK5QQnApUkfRFjiyS6Hvs6jxTZ_d068 …	0	0	
#AppleWatch Red Sox stole signs from Yankees , others using Apple Watch - WLBZ-TV http:// ift.tt/2gK9Xnj	0	0	
It's a lot easier to predict the outcome of a baseball game than the powerball.	0	0	
New top post: Visited Delmarva over the weekend. http:// ift.tt/2eDwqy4 pic.twitter.com/XfCsw4Wa2j	0	0	
Looks like first pitch id going to be delayed!!! #Yankees / #Orioles	0	1	
#Boston #RedSox Used Apple Watches to Steal Signs Against #NY #Yankees https:// nyti.ms/2xN42SH #MLB #technology #ethics #sports	1	1	
The energy at the secondary complex was amazing! Great first day to start a great school year! Here's to a year full of great days!	2	4	
Oh my Boston Red Sox on another level of cheating #Yankees #NYY #BleedBlue	0	0	
I'm sure Red Sox fans are proud! Yankees bust Red Sox in high-tech cheating scandal	0	2	
Yet it was against multiple teams over several weeks but just the Yankees are suckers? LMAOO Boston fans are fucking losers https:// twitter.com/ringer/status/ 905194308172746753 …	0	0	
Just stop using the same excuse for why the Yankees aren't in first place and why Sox should be killing as if they aren't injured and young	0	0	
Boston Red Sox Used Apple Watches to Steal Signs Against Yankees https:// nyti.ms/2xML9z1 Cheaters!	0	0	
Besides the fact that he Yankees haven't won a series at Tropicana in years.	0	0	
The Sox also filed a claim against the Yankees for using a camera in center field to steal signs.	0	0	
The Red Sox used an Apple Watch to steal signs from the Yankees , according to a report by the New York Times. http:// toplocalnow.com/us/new-york-ci ty/at/17#t7588246 …	0	0	
Apparently the Yankees have video evidence of it happening	0	1	
Baseball Veteran Brings Wisdom and Faith to the Yankees https:// buff.ly/2eDgifQ #BaseBall #Yankees #MLB #NewYork Go http:// FortheKingsGlory.org pic.twitter.com/WvHhyQkNCk	0	0	
Remember The Yankees have been accused of cheating in the past. pic.twitter.com/boUs3qNNGE	0	0	
Check out Zippo "New York Yankees " Logo Lighter, Navy Blue Matte - NEW #Zippo http://www. ebay.com/itm/Zippo-034- New-York-Yankees-034-Logo-Lighter-Navy-Blue-Matte-NEW-/142437645651?roken=cUgayN&soutkn=mGvzkM … via @eBay	0	0	
Tampa Yankees look to be "co-champions" of the FSL Just need two wins against Dunedin pic.twitter.com/TTKPMTVbIt	0	2	
u know the Yankees steal signs with a yes camera right?	0	0	
"Red Sox reportedly caught using electronic devices to steal signs from Yankees " via FOX NEWS http:// ift.tt/2eCTEUY	0	0	
They're*	0	2	
Yankees and Red Sox are really even teams dude	0	0	
Boston Red Sox caught using Apple Watch to steal signs in games against the Yankees & others https:// 9to5mac.com/2017/09/05/red -sox-apple-watch-sign-stealing/ …	0	0	
I bet it's going to be alot of pointing fingers at the yankees and some mud slinging at Jim Irsay for shits and giggles	0	0	
Can you please send me the winning Power Ball numbers?	0	0	
How the Red Sox used an Apple Watch to steal signs from the Yankees http:// ift.tt/2iZOkzY pic.twitter.com/4NUWE0Uxxf	0	0	
Breaking: Manfred isn't a Yankees fan anymore. https:// twitter.com/chad_amaral/st atus/905189293555109889 …	0	1	
So the #RedSox cheated in order to lose three out of four games last weekend? Oh BRAVO! #Yankees	0	0	
#Indians manager (and ex-Boston manager) Terry Francona reacts to the #RedSox #Yankees sign-stealing story in @nytimes . pic.twitter.com/KTi5f9mGlz	2	5	
Red Sox said to use Apple Watch to steal signs from Yankees - CNET http:// ift.tt/2w3KiIk	0	0	
. @nytmike scoop: The Boston Red Sox were caught using an Apple Watch to steal signs against the Yankees . http:// nyti.ms/2wDPm9A pic.twitter.com/MJ3hF3xZHx	4	3	
Report: Red Sox used Apple Watch to steal Yankees ' signs #Lethbridge #bhivec http:// dld.bz/gd5UT	0	0	
#Boston #RedSox Used #AppleWatch to Steal Signs Against #NewYork #Yankees via @NYTimes https://www. nytimes.com/2017/09/05/spo rts/baseball/boston-red-sox-stealing-signs-yankees.html …	0	0	
Report: Red Sox caught using electronic device to steal signs from Yankees https://www. cbssports.com/mlb/news/repor t-red-sox-caught-using-electronic-device-to-steal-signs-from-yankees/?utm_source=dlvr.it&utm_medium=twitter …	0	0	
Orioles Designate Jayson Aquino, Promote Austin… http:// dlvr.it/Pl2KNZ #AustinHays #BaltimoreOrioles #JaysonAquino #mlb #fantasybaseball	0	0	
ARE U KIDDING ME	0	0	
#Yankees #Orioles game 2 Lets go @Yankees	0	0	
North Korea Rolls Out "Hunting Yankees " Video Game Where Players Kill US Soldiers by Sniper Fire http://www. thegatewaypundit.com/2017/09/north- korea-rolls-hunting-yankees-video-game-players-kill-us-soldiers-sniper-fire/ …	0	0	
The #orioles must be trying to figure out how to use an Apple Watch.	0	2	
I agree.	0	0	
En media hora comenzamos con ESPN Martes de Grandes Ligas: #Yankees vs. #Orioles . ¡Pónganlas a enfriar!	6	37	
Yankees bust Red Sox in high-tech cheating scandal | New York Post @billburr buncha cheatahz, dude http:// nypost.com/2017/09/05/yan kees-bust-red-sox-in-high-tech-sign-stealing/ …	0	0	
Baby Birdland Roundup 9/4: Austin Hays Has Nice Day, Ofelky Peralta Solid https:// goo.gl/fb/orkffo #Orioles #MiLB #Birdland	0	2	
The shitty Red Sox admitted to stealing signs from the Yankees and they're only 2.5 games up after	0	1	
Tommy Kahnle says the #RedSox are "known to try to take signs" | http://www. nj.com/yankees/index. ssf/2017/09/red_sox_have_a_bad_reputation_as_sign_stealers.html … #Yankees	3	12	
Their just scared . Go yanks	0	2	
The Mets were caught cheating using their Palm Pilots.	0	0	
So clearly the sign stealing vs Yankees didn't work dropping 3-4. #losers what will you do about it @MLB as usual probably nothing!!	0	0	
The Red Sox used an Apple Watch to steal signs from the Yankees http:// feedproxy.google.com/~r/Techcrunch/ ~3/_O_qoATRTkc/ … #AppleWatch #Wearables #baseball #Cheating #yankees	0	0	
Orioles 6 Yankees 5	0	0	
Boston Red Sox Used Apple Watches to Steal Signs Against Yankees https:// nyti.ms/2xML9z1	0	0	
http:// bleacherreport.com/articles/27316 06 … … If Red Sox & Yankees r both stealing signs-they should b disqualified 4 the season & Orioles will b in 1st place	0	0	
Joe Girardi firmly denies Red Sox’s accusation against Yankees http://www. distinctathlete.com/joe-girardi-fi rmly-denies-red-soxs-accusation-against-yankees/15038 …	0	0	
Did the #RedSox really steal signs from the #yankees with Apple Watches? Didn't they lose that series? Time for a new tactic...	0	0	
Orioles purchased the contract of OF Austin Hays from Double-A Bowie.	0	0	
Headley is 9 for his last 19 (.474) with 3 HR's. He's also .321 in total since the All Star Break.	0	1	
Report: Sox stole Yankees ’ signs using Apple Watch http://www. newsday.com/sports/basebal l/yankees/red-sox-admit-to-stealing-signs-from-yankees-using-apple-watch-report-says-1.14113210 … via @newsday	0	0	
Boston Red Sox Used Apple Watches to Steal Signs Against Yankees https:// nyti.ms/2xN42SH	0	0	
Report: Red Sox accused of stealing Yankees signs with an Apple Watch. Details LIVE at 5 p.m. on 7News http:// toplocalnow.com/us/boston/at/1 6#t7586401 …	0	0	
Same sadly	0	1	
nycgov: Commuters waiting for the #4 train at 161 Street station near Yankees Stadium #inTheBronx . pic.twitter.com/W9HKbav7Lc	0	0	
The @redsox wins against the @yankees should be forfeited. This is outrageous. https:// mobile.nytimes.com/2017/09/05/spo rts/baseball/boston-red-sox-stealing-signs-yankees.html … @MLB	0	0	
Can't decide if the #USMNT back 4 or the #Orioles rotation is more frustrating	0	0	
#Yankees vs #Orioles who you got?!	0	0	
LOL u know I something funny earlier the Boston red Sox was caught cheating against the new York Yankees that's really bad	0	0	
well... it's against the Yankees so it's all good	0	0	
Lol, as commissioner said, they are investigating both teams sign stealing is common, and its too bad the yankees act like children.	0	1	
Lol... We'll see. I see some motivation that we're only 2.5 back and this shit about the Sux.	0	0	
I'm not surprised, and the Yankees STILL spanked them! https:// twitter.com/sportscenter/s tatus/905184655632203780 …	0	0	
Lol every team does this. The Yankees are just being babies. https:// twitter.com/nytimes/status /905191957785440256 …	0	0	
"Alexa, spy on the Yankees ." https:// twitter.com/evankirstel/st atus/905142739171495943 …	0	0	
He is better than Jeter	0	1	
What's the punishment for this #Redsox & #Yankees situation	0	0	
I know, crazy to believe teams try to get an edge, Yankees caught using yes network monitors too. Anyways how the Red Sox record vs NY	0	0	
Yooooo they deleted it! It was their game broadcast in the dugout. Hahaha	0	2	
Boston Red Sox Used Apple Watches to Steal Signs Against Yankees - The New York Times Technology Gone wrong https:// apple.news/AVjkfSgjdR-Oqu jjnN0vYAQ …	0	0	
So it's useful after all: Boston Red Sox Used @Apple Watches to Steal Signs Against Yankees via @NYTimes https://www. nytimes.com/2017/09/05/spo rts/baseball/boston-red-sox-stealing-signs-yankees.html …	0	1	
"Red Sox stole signs from Yankees , others using Apple Watch" http:// ift.tt/2gEpUHT pic.twitter.com/pizQXx6U0Y	0	0	
Boston Red Sox Used Electronic Devices to Steal Signs Against Yankees http:// fb.me/w452JGLT	0	0	
@MTort41	0	0	
Boston Red Sox caught using Apple Watch to steal signs in games against the Yankees & others https:// 9to5mac.com/2017/09/05/red -sox-apple-watch-sign-stealing/ …	0	0	
Same	0	0	
Red Sox reportedly used Apple Watch to steal Yankees ' signals - Engadget http:// google.com/newsstand/s/CB IwpZXM9jU?oc=wa … via @GoogleNewsstand	0	0	
Red Sox stole Yankees ' signs using an Apple Watch https:// lnkd.in/dKzqYAP	0	0	
Didn't help they win games against the Yankees , lmao. #Bums #CheatCheatCheat #NothingToShowForIt https:// twitter.com/sportscenter/s tatus/905184655632203780 …	0	0	
https://www. ruthiansports.com/new-york-yanke es/2017/09/05/joe-girardi-denies-red-sox-counter-cheat-claims-no-chance/ … Joe Girardi denies Red Sox counter-cheat claims: ‘No chance’ By Corey Masisak Yankees ... pic.twitter.com/jhrOxQC7xl	0	0	
Yankees @Orioles to be delayed https:// rotogrinders.com/news/mlb	0	0	
Status Update: Yankees @Orioles to be delayed https:// rotogrinders.com/news/mlb	2	0	
#Yankees East edges #Nationals , 2-1, to force a decisive third game tomorrow in the Gulf Coast League Finals: http:// atmlb.com/2gEhuAm pic.twitter.com/XEObPIu5NI	10	14	
First pitch est?	0	4	
Lol brilliant. Hate the Yankees https:// sports.yahoo.com/report-red-sox -used-apple-watch-steal-yankees-signs-elaborate-scheme-205933556.html?soc_src=social-sh&soc_trk=tw … via @YahooSports	0	0	
Rain out?	0	0	
http:// ift.tt/2f0WAvc Joe Girardi firmly denies Red Sox’s accusation against Yankees #SportsTap	0	0	
9-7 Yankees	0	0	
Orioles e Yankees vai atrasar (chuvas)	0	0	
So apparently New York Yankees baseball strategy is to accuse the first-place team of cheating instead of being... http:// fb.me/8ZhyS5i9C	0	0	
Report: Red Sox Caught Using Apple Watch to Steal Signs From Yankees http://www. nbcboston.com/news/local/Red -Sox-Caught-Using-Apple-Watch-to-Steal-Signs-From-Yankees-442799543.html … via @nbcboston	0	0	
Boston Red Sox Used Apple Watches to Steal Signs Against Yankees https:// nyti.ms/2xN42SH	0	0	
307 Mike tells Buck he knew he would be great Mgr. 407 Recaps SB Victory for Billick. 507 tells Joe he knew Green would be great. #Smirks	0	0	
Against any other team it would be wrong. Against the Yankees ? Totally fine.	0	1	
Orioles Designate Jayson Aquino, Promote Austin Hays http:// ift.tt/2f06ld1	0	0	
Ohhhhhhh daaammnnn. There you go again Bean Town. Buncha #cheetahs #lametown #Yankees #LEGGO #GETEM https:// twitter.com/nytimes/status /905163675480281088 …	0	1	
REPORT: Red Sox Stole Yankees Signs Using an Apple Watch http:// dld.bz/gd5AN	0	1	
#guaranteedpick #MLB 09/06 (969) NY Yankees vs. (970) Baltimore RICKJSPORTPLAYS #sportspicks #expertpicks http:// bit.ly/2wFxKc2	0	0	
Red Sox reportedly caught using electronic devices to steal signs from Yankees http:// ow.ly/CdIH50dRy1N	0	0	
Tu no te enteraste, los Red Sox usaron apple watchs para robarse la señal de dugout de los yankees en la serie del fin de semana	0	1	
El equipo de @redsox le roba las señales a @yankees con Apple watches. Ahora bien, ¿Qué… https://www. instagram.com/p/BYrRm8dnD3j/	1	0	
The Yankees videoed the Red Sox dugout!	0	1	
He even said that he's going with the hot hitter... I can't remember what he was questioned about... So you don't? I hope he's gone. Ugh	0	0	
“Hey, Siri. What sign did the Yankees ’ catcher just give their pitcher?” https:// twitter.com/AppleSupport/s tatus/905196347212648448 …	0	1	
Oh good, it's Jeremy Hellickson. #orioles	1	6	
#sports Red Sox caught using Apple Watch to steal signs from Yankees : report http:// ow.ly/7yAW50dRxXZ	0	0	
Red Sox stole signs from Yankees , others using Apple Watch: Baseball official http:// ow.ly/ZsjU50dRxRz	0	0	
Sick of cheating-Boston Red Sox Used Apple Watches to Steal Signs Against Yankees https:// nyti.ms/2xML9z1	0	0	
Unless he wins 6 championships and has 3,000 hits plus 276 home runs no	0	0	
Red Sox Caught Using Sophisticated Electronic Doohickeys To Steal Signs From Yankees http:// gothamist.com/2017/09/05/red _sox_sign_spying.php … via @Gothamist	0	0	
A new report says the Red Sox used an Apple Watch to steal signs from the NY Yankees . This after their failed attempt to deflate a baseball.	1	1	
Y va una para cada ciudad Yankees .. Imaginate que cada ojiva es 10 veces mas potente que Hiroshima	0	0	
Lol if someone called you out for committing a crime, you'd want to get that person in trouble too. Yankees did nothing lol, move on. https:// twitter.com/rfinnerty83/st atus/905194784616321024 …	0	2	
