
The Fords sweep their Doubleheader with wins against Devon Prep 14-8 and Penncrest 10-0 as part of their "Striking Out Breast Cancer Event"	3	7	
There will be a deal for HCG question is price... My bet is on Worthless or very close to it.. As a business they are finished https:// twitter.com/mr_silbergleit /status/858470284092985345 	3	11	
It' s a rainy day here in #Vancouver but I don't mind with this beautiful canopy in full https://www. instagram.com/p/BTfRGlrB5lT/	0	0	
A tecnologia evoluiu de tal forma que nem tempo para pegar numa arma terias.  melhor apostar na vida e deixar as medidas extremistas ahah.	0	2	
Vou comer, tentar baixar as msicas e os vdeos e ser feliz	0	0	
ontem no role as mina tudo pelada de saia, costas aberta morrendo de frio e eu mo suave la toda agasalhada	1	2	
As soon as I get settled again, I will do all the writing sprints!!	0	3	
Srio que meus pais ficam me empurrando as filhas dos amigos deles no existe nada mais constrangedor	0	0	
90'+ - Keep breathing... @wfc2 cross is a bit high as Newton manages to grab it #VANvSAC	0	1	
as novinha gama, os alemo tem medo	0	1	
golden week starts. go to orange farm in the morning. tea w/ a cousin at mahalo. dinner w/ aunt family at ohuna. d. goes to friend' s wed.	0	0	
Ex-Spiders' FA signings: WR Brian Brown (Cowboys), S David Jones (Patriots), DT Winston Craig (Eagles). Brown is a Hermitage alum. pic.twitter.com/p5LHxIsFKT	22	32	
A gente que  bandido, mete logo um filho, vocs que  morador, as mulher no sentem dor #DasAntigas	0	1	
Inveja  aquela coisa que faz mal de quem sente e para quem sente.. no sei como as pessoas conseguem armazenar e potencializar isso	0	0	
Doing some collages. That' s a journal. pic.twitter.com/77hIZzGQ2z	0	0	
Just like a bird you know when it' s time to migrate	0	0	
It' s a Lush night	0	4	
Doing it all by myself as I am used to, as should be done	0	0	
They played us tough as well! Keep working we see y'all https:// twitter.com/mlb333/status/ 858461993807654912 	1	1	
Or not. At least not a K. Baby steps.	0	0	
Make things as simple as possible but no simpler - Albert Einstein	0	0	
Got a couple of fools holding up Russian flags at Trump' s rally. Got taken down by people in the crowd.	0	0	
I'll let you joke all the time and soon as I clap back you don't wanna play.	0	0	
the suite life of zack and cody but refurbished as a gay drama	1	7	
I wonder if you think about me as much as I do you..	0	1	
today has been so slow buy easy and my new coworkers are funny as shit im really Glad .	0	0	
num sei, mas deve ser por isso q as novtimas nao largam do seu p ne am kkkkkkkjjjjj	0	1	
I was a blogger who became a journalist and I did it to become legitimate. I wanted standing, the public s trust and respect.	0	0	
let' s play a game called: Will I Ever Stop Promoting That One Drawing	0	5	
It' s my Friday from work & I took a nap already. I might have to step out tonight.	0	0	
T' as rien fait mdrr	0	0	
Following highly publicized examples of a lack of consideration for POC in the US, believe that POC' s being upset at us is an issue	0	0	
as vezes queria desaparecer por determinado perodo de tempo e dps voltar como se nada tivesse acontecido	243	170	
" Few CB' s can close on the ball quite like Tabor, he s notched an int or a pass breakup on 26.5 percent of his targets the last 2 yrs "	2	3	
O mundo seria melhor se as pessoas fossem mais diretas.	0	0	
I just earned the 'Pale as the Moon (Level 6)' badge on @untappd ! http:// untp.beer/s/b188229144	0	0	
I feel like my bosses wish CJ was here to wait tables bc I sure as hell cant compete	1	1	
I took a sip of beer today and that kids is the wildest thing that' s happened to me since the stair falling incident of '09	0	0	
w	0	0	
como me falaram hoje quanto mais expectativa tu cria menos as coisas se realizam	0	0	
as if you've just put fury in the same class as mayweather hahahahaha	0	0	
If the fans don't want him, may as well let him join #Bulldogs today. #NRL https:// twitter.com/abcgrandstand/ status/856611439976501249 	0	0	
It' s a lot of different ways google it.	0	0	
When people dont have iPhones I really get confused as to why?	0	0	
TRAIN AVAILABILITY 11 Running Trains as of 08:00 AM, April 30, 2017	0	0	
Comecei a beber agora e s paro na segunda. De agora em diante todas as besteiras postas aqui no possuem efeito algum. BBMP!!!	0	3	
not to question you but isn't listing both SFW and NSFW as same price a bit redundant? :P	0	1	
Ai desculpa, li mal as entrelinhas n	0	1	
"Next year we might make it more interesting for them and turn up, but there' s a big chance that we'll be back here instead." Ha ha ha ha	0	0	
I'm glad there' s a good reason this time! Always asleep kim lol	0	2	
Full blown dementia. As if he' s all alone in a closet, mumbling to himself.	2	55	
I'm drinking tea from a mug with my face on it. My dad' s house has its perks.	0	0	
Eu tenho muita raiva de certas pessoas A gente tenta ficar de boas Mas as vezes no d! S quero matar e mandar pro trtaro	0	0	
Vc me deixa triste as vezes	0	0	
Na rua andando de bike, olhando as crianas brincando, relembrando minha infncia e ouvindo vrias msicas...	0	0	
* as they arrive at her planet*	0	0	
It' s a battle of the super heavyweights #NXTOrlando	1	1	
It' s just sloppy designers or printers thinking they can re-create the logo as the client couldn't be bothered keeping a Vector version.	0	2	
Does it matter ? As long as legit college right ?	0	0	
Surprisingly, there' s a progress report out for Surge 14. Good job, #wmata https://www. wmata.com/service/status /details/upload/Surge-14-Progress-Update-4-28v1.pdf  pic.twitter.com/X6DCo3bxAM	0	0	
Weeh rakyat pd nyesel tu yg coblos jokowi pas pilpres jgn ngeles loe lihat aja nti pilpres 2019 jokowi maju pasti nyungsep 20% kalah total	0	0	
Estava vendo as fotos de uma balada que vai ter evento amanh e fiquei meio assustado	0	0	
Pillpoppinpova bragging and smug as ever flaunting with her orthopedist pic.twitter.com/bfVKRz1e7Z	2	6	
I WISH THIS WAS AS RAD AS THE SETLIST THEY HAD HERE HUHUHU THEY INCLUDED QUIT AND CURRENT LOCATION HERE WTF IM CRI https:// twitter.com/thisislany/sta tus/858467102465937408 	0	0	
Chamorro @USCTrojans footballer making Guam proud as @Colts after #NFLDraft2017 https:// twitter.com/ZBNFL/status/8 58388217602727936 	0	1	
so glad my besties love day drinking as much as I do https://www. instagram.com/p/BTfRGMUA1H1o K_bvRcz28-Wg5AcQ_nf5pgGBd40/ 	0	0	
sounds about right. Inbreeding, it' s a wonderful thing.	0	0	
Alone as fuck tbh	0	1	
Will classic characters such as Antman and Rihad be appearing in these LORE videos?	0	0	
Sim gente, sei que prometi Live as 8:00, mas hj t foda, vou no mercado ali e j volto	0	1	
It' s in a frame lol. Got put away when we moved.	0	0	
@TitaniumBackup Hello! I subscribed to http:// MyTi.cloud earlier last year, but I can't get my refund as Wallet isn't supported in UAE	0	0	
I JUST FOUND THIS POST ITS APRIL 2017! THERE' S A LAWLESS PAST CRIMEHISTORY RAMPAGE ONGOING WITH GODS GLOBAL SPACE CONDEMNATION LOOMING! pic.twitter.com/K9FMa6twCn	0	0	
I've been using Quizster for that as well.	0	1	
i imagine she always wears the backpack as like a "coverup" for her wings in the summer so they dont overheat because they're metal	0	1	
N that' s not including half of the other shit that goes on a beat face like primers eye shadows lipsticks n so on	0	0	
once i take my wig off, it' s a wrap .	1	0	
Listening to Trump. Master at fomenting hate among Americans. What abt aspiration? Never show him sympathy. He' s a scorpion and will sting	0	0	
get ready to head back to the east coast as grand theft auto liberty ... #gaming pic.twitter.com/gFrLRjjRRZ	0	0	
Nova adio s Mais queridas: Hugo Fontana / Bolro de Ravel http://www. deezer.com/track/134303794 @DeezerBrasil	0	0	
Nova adio s Mais queridas: Chino y Nacho / Andas En Mi Cabeza http://www. deezer.com/track/354286321 @DeezerBrasil	0	0	
Nova adio s Mais queridas: Audioslave / Like a Stone http://www. deezer.com/track/851057 @DeezerBrasil	0	0	
As usual, @FoxNews or FALSE NEWS as I call them, distorts the facts or basically just lies like good old @realDonaldTrump ! https:// twitter.com/phil_mattingly /status/858448384897818627 	0	0	
I liked a @YouTube video http:// youtu.be/CzwtmbNJMUg?a *NEW* BLACKJACK' S GUN GAME! | Black Ops 3	0	0	
It' s a @TLC night for me #SYTTD & #Nate &Jeremiah #ByDesign !  #TLC	0	1	
she owns a Jaguar and he' s gonna own the Jaguars	0	1	
DEVHEAD #dev If the Moon Were Only 1 Pixel - A tediously accurate map of the s  http:// joshworth.com/dev/pixelspace /pixelspace_solarsystem.html  , see more http:// tweetedtimes.com/v/1548?s=tnp	0	0	
I can catch a tennis ball on the back of my hand. It' s more impressive than it sounds.	0	0	
Maree( as she pounds on my feet: DiDi Me: ohh that feel good gimmie a foot tub Starts to rub my feet Me: I'm... http:// fb.me/3Cp1lVpEi	0	0	
Nuo and Aquino for ______? Could be Bleier ( as Roch noted earlier) and a RHP. No other LHP available. Lee stays in Norfolk. #Orioles	0	1	
Wishing upon a star is as far out as the eyes can see.... Dreaming of greatness is as close as the mind can produce.	0	0	
A9: As for advice, speak out loud and proud. Never back down and don't be afraid to take action #cripthevote	2	2	
e ai gente?? cad as sociais porra... ses tao com friooo?? Vodkka esquenta!!  se sentindo sozinho	0	1	
coworker asked how much sleep i get a night i said 13 hours usually "omg that' s so long that' s why you're so tired all the time" NO BITCH	0	2	
Not a single person reached out to touch Trump as he walked by them, Stepford? #donaldtrump	0	1	
my bff killing the game as per usual https:// twitter.com/ilysbx/status/ 858470288450883588 	1	2	
As pessoas vo te desiludindo .... e muito fds S a mim	3	4	
well peter. i hope for your sake that you never ever get a girlfriend. im saying this to you as a loving friend!	0	0	
I was gonna offer to unfollow and come back as #400 but someone beat me to it	0	0	
Yeah that' s  a lie for me...	0	2	
Melhor coisa so as festinhas na casa do Charles, cheguei aqui agr e t tocando Pink Floyd. PINK FLOYD, BICHO, CHARLES  MARAVILHOSO MESMO	0	0	
I truly hope all goes as planned. It' s not fun having someone in your family going through such things. Especially a parent. :(	0	1	
I watched "Brimstone", & it made me want to beat @TheGuyPearce up for real but then I remembered he' s just a really good FUCKING actor!	0	0	
Maybe not but give him a little more time. He' s the real deal https:// twitter.com/mequantum/stat us/858470099598036992 	0	0	
Por no querer ela comprar uma roupa nova j que todas as outras esto velhas ?	0	0	
s vezes queria ficar num cantinho pensando na vida	0	1	
3. A dog man and a girl who' s always studying	0	0	
I bought a new BD player, and it' s nice, but it doesn't have a digital display on the front, which is a feature I really like.	0	0	
It' s been a good day. Got to see some of my favorite patrons and help some people. I feel much better in my soul than I did Monday.	0	9	
eu acho muito estranho quando um menino pede pra ficar comigo tipo voc ja viu as outras garota???????  cego?????? t desesperado?????	3	3	
i am surprised trump didn't want to wear a strap-on, have photo taken and have headline read "Trump' s Got a Bigly Penis" https:// twitter.com/thehill/status /858430034146717696 	3	5	
You know it' s a slow box-office weekend when it' s Saturday night and the Union Square Regal is a desert	0	1	
AH J'AI TROUVER UN GLITCH! t' as une ASUS Realtek toi aussi ?	0	0	
Ponyville ponies are not known to camp out next to a small amount of underpants during the show' s hiatus.	0	0	
Thank you in advance I don't wanna dance I dont need your hands all over me If I want a man Then I'mma get a man But it' s never my priority	0	0	
I'm determined to meet him one day and tell him in person how grateful I am to him for all he' s done for me. Such a great guy.	0	0	
And she' s a member of a church so it' s just gonna be mass discomfort. I may have to smoke a damn blunt first. I don't see another way.	0	0	
DESLIGARAM AS TORNEIRAS	0	0	
eles podiam fazer sorteio , qual seria as chances de 7 em 7 bilhes sermos ns ? da pra sonhar n ?	0	1	
Jesus Christ it' s from a song "young Dolph- All of Them" lol	0	0	
Zapps makes a Drago' s Charbroiled Oysters chip.	0	0	
BREAKING: Chris Muller will sign with the Colts as an undrafted free agent. pic.twitter.com/Tyu3xNBk74	8	30	
Queres ser valorizada? Vai pa India la as vacas so sagradas	0	0	
imagine Red that isn't so *physically* expressive (like Feldon, as you pointed out).	0	9	
A rolling stone gathers no moss. This one' s not rolling anytime soon. Forster, NSW #ilovensw @ https://www. instagram.com/p/BTfRF2mh4H8/	0	0	
#Trump proved that MSM and Hollywood are irrelevant and impotent after firing all blanks at Trump as they tried in vain to hand it to HRC https:// twitter.com/FoxNews/status /857990075531091970 	0	0	
I wish I was at Trump' s rally rn just so I could have joined in on that "CNN sucks" chant.	0	2	
No  o amor que di, o que di so as pessoas, suas mentiras, suas iluses, que chegam roubando o melhor de ns...	0	0	
A9: Advice would be don't put up w/ willful ableism, but realize that it' s best if ppl hear from PwDs as to their needs/issues #CripTheVote https:// twitter.com/disvisibility/ status/858469701571227648 	2	2	
entao eu sou como todas as outras? https:// twitter.com/swnjuyeonz/sta tus/858470462543675392 	0	0	
PSA: my crush on @usher is just as big as it was in middle school. #boo	1	2	
. todas as gordinhas so safadas cr kkkkk	0	1	
Adam Eaton to miss the rest of the season with a torn ACL in his left leg. That' s a huge blow to the #Nats	0	0	
Trump is such a low life. Anything to make him feel better. How can he think he' s worth anything.	0	23	
Why was Bernie pimping a mayoral race +dissing our candidate in GA-6 as being insufficiently "progressive" (whatever the fuck THAT means)?	0	0	
tenho muita mania de falar cara as vezes eu falo com minha me "isso cara"a ela fica "vc t achando que est falando com suas amiguinhas?"	0	0	
It' s also just a simple ass question https:// twitter.com/harlemgetsmone y/status/858468593083789313 	0	0	
As @ukpolice don't arrest or charge muslims for rape, sexual assault, making death threats, assaults, FGM you can't trust #UKGov statistics https:// twitter.com/davidjwbailey/ status/858459247272742912 	0	0	
As previously stated. Bad degrasse	0	0	
I liked a @YouTube video http:// youtu.be/zcFbRwyHeFM?a Let' s Rant: Identity Crisis, The Iris Prismdonna Story	0	0	
Cuckold Captions 5   Wife\&#039;s New Boyfriend (II) (Pag #porn http:// realcuckolds.xxxlog.co/2017/04/29/cuc kold-captions-5-ae-wifes-new-boyfriend-ii-pag-4/ 	0	0	
There is a competitor running around wearing a Tickle Me Elmo pajama set on and she' s still serving looks.	0	1	
Some scars never heal. Especially those particular scars. Still my all-time favorite #WHCD bit after Colbert- as -COLBERT in front of Dubya.	0	0	
Four cocktails in 35 minutes. Just your average Saturday as a bookseller. #BookstoreDay	1	9	
bar hard enough to put me in a coma for four months...I have seizures." I frowned at you. "It' s ...just something I have to live with."	0	0	
[ A faint smile as if Takumi was insinuating something ridiculous.] It' s a demonstration. Let your body relax into it and try moving around.	0	1	
Era legal quando a Paige saa com as amigas e a gente tinha fotinhas lindas pra baixar mas desde que ela comeou a namorar...	0	0	
I am no one' s weapon....they may have made me....but I'm a free to do as I wish	0	0	
Emma' s mom told me I look like a hooker so	1	15	
Yup ...u can use it as a substitute for mince...nicer to me that way too	0	0	
YASSS It' s time for a great show Littleman :Chilling http://www. liveme.com/media/play/?vi deoid=14935083791212716464&area=A_US&countryCode=US&kid=2&s=838451274067738624&shareto=Twitter  pic.twitter.com/A8yV2vIaSY	0	0	
Oh, dang, just get over yourselves, for God' s sake! Stop crying, finish school, get a job and just live. Just LI VE your life!	0	1	
That' s why we drafted a lot of OL in the draft... oh wait never mind	1	1	
Seriously. He gave me a book to look at with all these magic posters in it and it' s pretty awesome. I'm stuck in my own world now.	0	0	
Aquele momento em que tu olha tua galeria e resolve tuitar todas as fotos	0	0	
30th April 2017 Attempt to define life seems to be difficult as every individual are born with most specific... http:// fb.me/7GMcba5vi	0	0	
America, we really too old to have donald trump as our president. Smfh	0	1	
From your mouth to God' s ears.... we moved to a smaller apartment, that did the trick	0	1	
@POTUS marks 100 days w rally dissing media!...and WHCD attendees wish they were THERE?... @carlreiner needs to produce comedy w him as star!	0	0	
How to really achieve your goals, as told by a psychologist: https://www. weforum.org/agenda/2017/03 /heres-how-to-really-achieve-your-goals-from-a-top-psychologist/?utm_content=buffer76ff9&utm_medium=social&utm_source=facebook.com&utm_campaign=buffer 	0	0	
Thanks @IslandersHKY for an amazing season, there were a few bumps along the way but it was a fabulous ride, can't wait to see what' s next!!	0	2	
Nico' s a legit godsend https:// twitter.com/Nicolaterino/s tatus/858448662380380161 	0	0	
I wish Ryan liked me as much as he liked Star Wars.	1	7	
Yep, he' s a fluky piece of work.	0	0	
I liked a @YouTube video http:// youtu.be/ACDFdkULz9w?a 2 NOOBS TRY TO ENTER THE WORLD' S SAFEST HOUSE...	0	0	
KAQKANSMAJA TEEEE AMO E TO CHEIO DE SAUDADE DE VDD, TAS SUMIDA MAS AS PORTAS DE SUCUPIRA E DO MEU CORAO ESTAO ABERTASSS	0	0	
Um relacionamento pra dar certo, tem que ser as duas pessoas dando o melhor de si, no tudo depender de uma s.	0	0	
Despreparo Se as reformas em andamento conduzem ou no o pas para um futuro melhor, s com o andar da carruagem.... http:// fb.me/YLUUh5Or	0	0	
That is my point, I noticed the MSM trying to use Glamor Shots to bring Chelsea' s number up from a 2.	0	2	
You dress up as a genocidal dictator and dance around with a hammer and sickle?	8	118	
That' s fine. Have a good one.	0	0	
LMAO...There' s no hope for this guy he' s as deep in denial as they can get. http:// fb.me/syILaCRa	0	0	
The whole opening to this Trump speech is a really odd attack on the media... the guy is a space cadet. Really, he' s a weird loon	1	0	
Amanha tenho jogo as 10 :)	0	1	
#change swapper that' s classed as cheating not haveing it cheaterrrrrrrrrr@barrychuckle	0	1	
s vezes ser orgulhoso  bom, mas as vzs no	0	0	
na hora de sair as pessoas somem, isso me irrita	0	0	
A and D Organic Blueberries at sunset and it' s 83.3 F pic.twitter.com/bJ8E7K8zQL	0	0	
Literally no idea but I'm hoping it' s Dril under a pseud https:// twitter.com/pipsuxx/status /858470387381927940 	0	4	
Random draft lottery thoughts a )Avs winning means mack would be in play, devils could have hall - Patrick- kovie as a line next year.	0	0	
Want hundreds of new YouTube subsribers today? Sign up as a Featured Passenger at http:// SubscriberTrain.com !	0	0	
If you are LPU (prior to 21/04), you have to register- and that' s it! M&G sign ups will proceed as usual. #WeAreLPU #DatPhotoTho #LP2017 https:// twitter.com/LPFanCorner/st atus/857384611416084481 	5	12	
I dot my i' s with a picture of my face.	0	0	
" Ja botou as cartas na mesa antes mesmo de eu falar que quero jogar "	0	1	
Spend as much time with the people you love. It makes your day so much brighter!	0	0	
Trump' s PA rally screams insecurity, & rightfully so for a #POTUS w lowest approval rating in modern history. #WHC #trump100days	4	21	
Wowowow you know that place?? Haha that' s amazing. I left those two comics a few weeks back when I visited for the 1st time!	0	0	
N	0	0	
And all of a sudden, you find a couple hundred articles on Ty Cobb that you never knew existed ... that' s the beauty of TBI.	0	1	
Devil Sold His Soul just played A Fragile Hope in full and it' s killed me. One of the most important records of my youth. pic.twitter.com/PTx8zg429J	1	13	
It' s weird as hell it doesn't fit https:// twitter.com/semigodx/statu s/858470441933041664 	0	0	
I know The Void and Blackcoat' s Daughter are streaming on Amazon for $3 a rental and I'm tempted	0	0	
How' s it feels to have a blue hair?	0	0	
"About as brave as a potted plant."	0	0	
Considerando que eu fui dormir as duas da manh e acordei as oito, era pra eu estar morrendo de sono. Mas a vida gosta de pregar peas.	0	0	
It' s delicious. I'm secretly a wealthy patron fomenting labor unrest to overthrow the government but I won't stop drinking fancy beverages	0	1	
Tudo depende do jeito que vc quer reagir as coisas	0	3	
No caso ia dizer que tu quisesse conversar estou aqui porem as vezes a gente so quer no falar ne? enfim, se precisar de mim, to logo aqui	0	0	
At qnd vai perder jogo pq perde as chances ao finalizar? Em deciso isso  existe. Um detalhe pode decidir e depois lamentamos as chances.	0	1	
i volunteer as tribute https:// twitter.com/madeintyo/stat us/858463093751291904 	0	0	
Wait! I need you for something! No I'm kidding. Just seeing what it was like to be as annoying as my ex. Eat choc, be merry.	0	1	
Sober as a judge then night before bank holiday and I'm spewing my guts up.. fantastic	0	2	
So here I am, digging the music at #nojazzfest and who' s in the #books tent? @BillLoehfelm signed a "Devil in her Way" for me @SINCnational	0	0	
@CNNPolitics he' s a joke	0	0	
Saturday Night Social: Hosted by a Man Who Took Six Days to Finish the London Marathon Dressed as a Gorilla http:// ift.tt/2oTBhy0 pic.twitter.com/SmhR4ReoM6	0	0	
i can't believe i'm alive at the same time as @troyesivan ? wow such a blessing	0	10	
taa_king_smiles_' s photo https:// instagram.com/p/BTdHHTTAkLl/	0	0	
Trump: Now before we talk about my first 100 days, let' s rate the media' s first 100 days. They are a disgrace as you know.	1	3	
It' s mad how crazy people get over a boxing match lol	0	0	
or the other? As a team, we have work to do to fix this. No doubt we are going to knock heads BUT who either of us are with is no ones ~	0	0	
i put on half of my makeup today and thats about as good as it'll get	0	0	
Sorry guys for not having this up yet :/ the audio' s nearly done. Just been having a lot of personal issues to deal with. pic.twitter.com/qcPDUgArd8	0	5	
My #dog likes to find happy humans at the park and claim them as her own. She' s such a lover! pic.twitter.com/HqrOKC61LZ	2	10	
	0	0	
Quand t' as pas de plan de carrire et de vritable objectifs professionnels c'est dur de te donner  fond sur tes tudes	1	3	
I can never end a text or whatever without saying lol it' s becoming such an issue bet I annoy the life out of everyone	0	1	
It' s a wasted pick	0	0	
Le rappeur Nix nest plus un coeur  prendre. Il s est mari aujourdhui! ... Regardez !!! http:// fb.me/1bLtHuehx	0	1	
Quero as festas juninas, cad?	1	0	
That' s the best jobs, a found the night get applying :)	0	0	
Are you ever going to stop working on 6th street?  Eventually but right now I'm only 21 and it' s a fun... https:// curiouscat.me/Xoxozoe_e/post /141849454?t=1493510309 	0	0	
I actually love spending time with my mom.. it' s nice to have a "girls" night lol	0	2	
It' s #springgame season. That football coach' s hot wife...might just be a #hotwife - read Bruce' s tale. #BBC https://www. amazon.com/dp/B06XWGMW3V/	0	0	
My story, if anyone is interested. Started as polite & carefully worded questions to his discrediting of @mikefarb1 https:// twitter.com/dark_wisdom_/s tatus/858457687847301120 	0	1	
Okay but do I get bad bad bad tattooed in just Paul' s writing or try and get it in Les' and Jakes as as well	0	1	
This is just, what' s the word? President Trump refers to Elizabeth Warren as 'Pocahontas' https:// twitter.com/i/moments/8580 24917677350913 	0	0	
I like the Budokai series but not as much as I like tenkaichi, I hate 1 cause you can transform. Wtf??Infinite world was disappointing.	0	0	
We're always on the same level, it' s a trippy mind connection to share with someone	0	1	
As someone how always loves supporting new and upcoming VA seeing so many new faces really makes me proud to support dub anime!!!	0	1	
As vezes me surpreendo com a minha capacidade de fazer tanta merda	0	1	
rip rj as usual	0	0	
YASSS It' s time for a great show Live.me Official: #livemebirthday http://www. liveme.com/media/play/?vi deoid=14935097502596702460&area=A_US&countryCode=US&kid=2&s=808787045912150016&shareto=Twitter  pic.twitter.com/J7xAltxsJu	0	0	
Ender' s foot doesn't seem to be a problem tonight. That' s great news.	0	0	
Drinking a Tropicmost Passionfruit Gose by @wickedweedbeer @Trenzalore' s Back Garden  http:// untp.beer/s/c446503763	0	0	
Cara, serei uma me maravilhosa, na moral.. t treinando super com as meninas da unidade..	1	0	
c faz as tarefas de casa todo arrumando?	0	0	
Now that' s a WR signing that makes me go	0	2	
It' s like a rare car just sitting in the garage you just have to admire it	0	0	
Lets have a fun night and show him iowa isnt as lame as Floridians think	0	0	
I agree, he gets an A from me as well	0	3	
Carter' s first time on a trampoline. I think he likes it #BabyFirst #BabyFun #Brothers @ https://www. instagram.com/p/BTfRCukj1p7/	0	0	
There' s a few songs I love, but I find myself skippin through the majority. Wish there was more Albarn singing instead of all the features	0	0	
I wish for an app that' s like a historical google maps (satellite view) for nyc that shows u and/or lists what all locations used to be	0	15	
One of my accounts literally went under it for a couple of days and despite having money in savings I still got charged. It' s maddening.	0	0	
it' s a war lmao	0	0	
got cute asf yesterday for a let down , that' s why im ugly & in the house with no hopes of going out tonight ready for work tomorrow	1	0	
It' s not a statistic if you're just assigning a number to correlate with your opinion. That' s the opposite of statistics.	0	1	
Vejo mta gente falando da contribuio sindical mas nunca vi ningum questionar as anuidades da OAB, CREA.	3	31	
