
as perguntas que fazemos a ns mesmos so revelaes	0	0	
To de cara as gurias falam que querem marcar encontro mas na hr todas somem	0	0	
This is the days that the House works in 2017! As you can see, not much time left for these do nothings! pic.twitter.com/eIzZp3g8Wc	206	146	
Acendi as velinha do meu quarto fiz um ch e t aqui ouvindo sonzinho bem de boa	0	0	
He must be a college student, cuz he' s not even phased. My dude has 3 papers due this week and a final on Monday, he'd rather be dead. https:// twitter.com/abc/status/857 957613304139776 	79968	153995	
YASSS It' s time for a great show (MCM) IBOSSUP : #CakeMeUp #CoinDr http://www. liveme.com/media/play/?vi deoid=14935088727156210628&area=A_US&countryCode=US&kid=2&s=846075981596196864&shareto=Twitter  pic.twitter.com/5xYPvaoWwE	0	0	
"I'm alive again, more alive than I have been in my whole entire life. I can see these people' s ears perk up as I begin." - No Love	13	13	
He must be a college student, cuz he' s not even phased. My dude has 3 papers due this week and a final on Monday, he'd rather be dead. https:// twitter.com/abc/status/857 957613304139776 	79968	153995	
Ganha a metdade e resolve: vc vai ter tudo. Faa as contas e veja se vale a pena. E seu $$$ recolhido ser gasto pelo Estado.	0	0	
Mdrr j'avoue on ce connat pas mais bref envoie tu n' as rien  perdre	1	0	
Pizza' s a fave. Here' s a tasty recipe for homemade #pizza crust. Have fun with the toppings! http:// buff.ly/2pS2F41 #pizza pic.twitter.com/MGlPDCLrUC	25	49	
Tomorrows video is a long post basically talking about how #WTFU personally affects me and as a result y'all who watch my content.	0	0	
More on H-Block: "Cillian Murphy as the ringleader of the escapees, Jamie Dornan as the planner. The film will seek financing at Cannes" pic.twitter.com/LU7B3Z5gDm	67	389	
#WVU center Orlosky adds to Eagles pipeline as undrafted free agent http://www. thedaonline.com/sports/article _61ac3e94-2d36-11e7-86e3-d34ec2a11309.html 	8	19	
Just got sad as fuck. I literally hold so much fucking shit in cuz if I say anything I get yelled at and told I'm wrong so fuck it I'll j	0	1	
YASSS It' s time for a great show N Er Dy :Well that didn't wor http://www. liveme.com/media/play/?vi deoid=14935034793452751905&area=A_US&countryCode=US&kid=2&s=841252389201117184&shareto=Twitter  pic.twitter.com/0PGgmLIOAO	0	0	
This was defined as corrupt in 1824. To think how far America has built out corruption since then... pic.twitter.com/1nhdpajLit	349	620	
she looks like she' s leaning in for a kiss and he' s like um were just friends https:// twitter.com/sunnysabrinas/ status/858460273690025984 	5	8	
@i_t_ s _38   1	1	1	
Estou feliz pq cresci no tempo onde jogavamos as escondidas na rua com amigos, invs de jogar o dia todo no ipad	3905	1028	
its not a collab, just been writing w her. but yeah u guys should be prepared for anything she releases coz she' s literally so next level!!! https:// twitter.com/Iamwithccabell o/status/857983398073311232 	3186	6025	
Also! Retweet this to VOTE as well: https:// tinyurl.com/MikeCAA #NBAcommunityassist #MikeConley	237	65	
Granada relegated from La Liga despite hiring this tactical powerhouse a few weeks ago. It' s a funny old game. pic.twitter.com/eBFIn8kWct	549	840	
s queria uma familia que me desse liberdade pra formar uma opinio sobre as coisas sem ser julgada por cada milmetro da mesma	28	12	
Into the lofty temple now with speed,-- A huge cave hollowed in the mountain' s side,-- (Bk 6)	0	0	
We will now see how @Sofie_Jean performs under the pressure of a severe toe injury. Show will begin in one minute, let' s see how she does.	0	3	
J meteram o bloco sovitico no meio, e, srio que as pessoas acham que a senzala era uma cozinha??? Navio negreiro era o que? Cruzeiro? https:// twitter.com/surra/status/8 58336136497856513 	7	6	
as coisas que penso em fzr no do certo to meio frustrada	0	0	
I think bi women are fetishized and bi men are ostracized if they're even acknowledged as being "real" https:// twitter.com/TheAngryFangir l/status/858340210928738304 	1292	1935	
It was an honour for Dami to sing with Kim Bum Soo as she grew up loving his songs on all the famous Korean dramas https:// twitter.com/orbinaut_orb/s tatus/858336525863485441 	2	5	
MC	13	36	
Negative people want to spread their negative energy as far as they can to make everyone else as miserable as they are. Don't feed into it	37	81	
eu n aguento tu me obriga kkkk por isso to tentando dormir as nove da noite	0	0	
let' s keep on creating beautiful memories together for a very long time #1000DayswithEXOL pic.twitter.com/v7AQaNiWts	521	548	
or so evil they want to "hurt" the wife and still don't realize they hurting they son as well	0	0	
If a grown man can look at a 12 year old girl & describe her as "seductive," regardless of what she' s wearing, he' s the problem. not her. https:// twitter.com/staronline/sta tus/857880291024568320 	100858	159749	
#doublebreasting "is a toxic mechanism brought up as a union busting technique from the US" @gilmcgowan #ourtime2017 #LabourStandards	4	5	
I mean. Who' s gonna sit through and read a 50 tweet solo about a space monkey shitting, brushing her teeth, showering and shaving ?	0	0	
7-10 range...i actually think this is also a win for Chris Thompson as well	0	0	
He must be a college student, cuz he' s not even phased. My dude has 3 papers due this week and a final on Monday, he'd rather be dead. https:// twitter.com/abc/status/857 957613304139776 	79968	153995	
As soon as I'm back to normal I'm eating 4 bags of chips and dip, 2 large pizzas, and 52 chicken wings	0	9	
I hope @88DrewPearson gets some endorsement $$ for yesterday' s performance. Will help make up for $150 bonus I gave him as an UDFA in 1973.	348	1157	
My friend went on a hunger strike & died - I wonder how many will hold out till that happens - I bet you none will die (PUSSY" S )	0	0	
there' s always a sing along backstage when @JoyceManor comes on the change-over playlist.	285	2565	
TUDO sobre as eleies que decidem o futuro da Europa! E Venezuela na OEA! Xadrez Verbal http:// xadrezverbal.com/2017/04/29/xad rez-verbal-podcast-93-eleicao-na-franca-europa-e-venezuela-na-oea  pic.twitter.com/E49uwWMuin	20	85	
          .. #___ pic.twitter.com/Mm98lubuHe	30	3	
I introduced the #NoRexAct to ensure the Trump Admin can never grant Exxon' s request for a waiver from U. S . sanctions against Russia. pic.twitter.com/8omM71SzTQ	4811	9783	
"Saturday Night Live" has seen a "yuge" ratings boost in the first 100 days of Donald Trump' s presidency. pic.twitter.com/rLdgxv6pRO	479	1292	
Utah had as many players drafted in this year' s draft as BYU has had in the last 8 drafts combined.	34	109	
i love to b cool as hell	0	1	
There' s a difference between an opinion with which you disagree and an outright lie -- esp a lie about something that may kill people. https:// twitter.com/nachristakis/s tatus/858388828528275456 	56	137	
As much as I need food, I really need sleep so badly.	43	38	
A las 21:15 quiero 100RT' s . Pueden? RT #MTVINSTAARVIGNA #PREMIOSMTVMIAW	108	0	
The Bible uses the same word for "keeping" the earth as for "keeping" God' s law. Climate change is a moral issue. #climatemarch #MoralAgenda	924	1970	
Idc my school SLAPPED for prom best I seen far as columbus Idc if y'all @me idgaf !!!	11	17	
Everyone' s a gangster until a gangster walks into the room. pic.twitter.com/Pvr33NozRN	1246	1274	
Trump will be reelected in a landslide, skippy. He s already raised over $41 million. #TRUMP2020 pic.twitter.com/cgOSnLZyVI	0	0	
God I wanted to be half as cool as Claudia. I STILL want to be half as cool as Claudia	0	2	
Jean-Gabriel Pageau has now joined J. Lupul as the only 2 players in NHL history to record 4 goals in a playoff game including the OT winner https:// twitter.com/StatsCentre/st atus/858443507962454016 	39	83	
As vezes cansa correr atrs. Pq doi, e pq vc n v progresso, ento desiste com o tempo, aos poucos. As pessoas tem q andar juntas n correr	1	3	
I remember those days as well. When so many things were different.	0	0	
I'm giving away an @NVIDIAGeForce 1070 to a lucky FOLLOWER that RT' s this, yes, you're welcome. Yes I'm the best. pic.twitter.com/wlwQsh8cMt	11870	3653	
Join @JackKosakowski as he shows you the how to get C-Suite to invest in a long-term #socialselling program http:// gag.gl/wZtjG9 pic.twitter.com/vcvLoCnzgj	94	8	
Noodle is from Boston and much as I hate to admit it as a New Yorker they know their bagels Panera has baked goods which approximate bagels	0	6	
Yep stuck in mediocrity. Where Reinsdorf' s want to be. Wade will be back. Butler too. This FO is a joke!! Man up Mike Reinsdorf. Fire them!	0	0	
Manchester United' s injury crisis is so bad that they might be forced to name their 300,000- a -week club captain in the starting line-up. pic.twitter.com/kspaw0LibU	455	956	
A las 21:15 quiero 100RT' s . Pueden? RT #MTVINSTAARVIGNA #PREMIOSMTVMIAW	108	0	
Leaves are falling from the sky as far north as Sulphur Springs from the Canton tornado	1	0	
Decepes mudam sentimentos e tambm mudam as pessoas.	556	478	
"I'm fine for not being cute, as long as it means I can protect you!" -Elizabeth(about Ciel)	0	0	
Who' s ready for a very special episode of GTA 5 play as a cop mod?!	114	501	
Confirmed: All editions of the #Wikipedia online encyclopedia blocked in #Turkey as of 8:00AM local time https:// turkeyblocks.org/2017/04/29/wik ipedia-blocked-turkey/  pic.twitter.com/hI9tn4bHe5	2831	999	
I think I figured put why people hate cops and try to shame them as much as possible Cuz they want to commit as many crimes as they want	0	0	
It' s a bet. I accept cash and cash. https:// twitter.com/BigPlayAK/stat us/858469405000257536 	9	61	
They might appreciate you as a harsh critic or just a coincidence.	0	0	
Honored to join Indigenous leaders and native peoples as they fight for climate justice. Join me in standing with them. #ClimateMarch pic.twitter.com/Zrgt090lI6	5510	21022	
Women are leading the resistance. They stand for care & safety for all. As gov I will join their fight https:// medium.com/tom-for-virgin ia/12-ways-i-will-stand-with-virginia-women-as-governor-1473504e86eb  #VADemDebate	19	42	
That' s a good point. Perhaps they ran out of those with records. We need more information then.	0	0	
Same as Washington state pic.twitter.com/xuvFuJ5lDK	0	1	
Hj as meninas vo aturar eu cantando todas as msicas do Dilsinho	0	0	
I do not accept the Expos and the Nationals as the same franchise. I liked the Expos. Thou dost not like ye olde Nationals.	9	71	
@cadeyrenee it' s hard to believe you are old enough to be going to Prom. You sure are a beautiful young lady inside and out! pic.twitter.com/V541ffvaxQ	0	5	
Who' s ready for a very special episode of GTA 5 play as a cop mod?!	114	501	
Happy to say I will be joining the @Ravens as a punter. So thankful for this opportunity and I can't wait to get to work.	495	3066	
You see this shit ....this is why it' s hard for me to give a fuck lol https:// twitter.com/kayswank__/sta tus/858041941732339713 	1	2	
'For to be free is not merely to cast off one' s chains, but to live in a way that respects & enhances the freedom of others' #FreedomDay pic.twitter.com/vJLSIgLXnC	534	727	
Yeah Alfred down as well as little bro	0	1	
quando vc digita as palavras td errado e envia com preguia de arruma e a pessoa entende tudo q vc escreveu pic.twitter.com/OpcaJMW4hn	1045	787	
You can't get a tattoo these days without someone saying you've copied someone or you're "matching" someone. That' s not the case folks.	16267	54659	
Assim como as flores, nossos sentimentos tambm morrem.	482	332	
Almost 20% of Pres. Trump' s first 100 days were spent at Mar- a -Lago http:// abcn.ws/2qiR3US pic.twitter.com/qh2lKIrQFa	397	369	
I SEE HAMILTON TONIGHT! it' s a short caption because i'm literally on my way to san francisco https://www. instagram.com/p/BTfRQH_hoHi/	1	7	
	0	4	
Who is this? HE HAS A KEY! What' s his job? HE' S A KEY MAN! What does the key unlock? A DOOR! What does the door go to? HIS HOUSE! MY HOUSE! pic.twitter.com/yVgmg4H8tl	1	8	
#Work by @Rihanna (ft. @Drake ) is definitely #StuckInOurHeads this year at the #RDMA as the Best Song to Lip Sync To! Congratulations! pic.twitter.com/zj8DlGKubL	668	1401	
Enquanto alguns alunos esto curtindo as baladas noturnas no Rio de Janeiro eu estou me preparando psicologicamente para o simulado	10	15	
Who' s ready for a very special episode of GTA 5 play as a cop mod?!	114	501	
I love stanning a man who' s owned 2 spots on the top of the charts for 3 years straight. Legends only	73	158	
Remember, you only live once. So tweet as much as possible. Non-stop if you can, time is running out people!	406	770	
God, I was just checking his album & as soon the beat dropped I had the best reaction ever! My new summer song...wow	0	1	
Namore algum que te ame tanto quanto o cidado de bem ama as lixeiras e as vidraa de banco vitmas das manifestao	155	172	
Louisville RB Brandon Radcliff signed with Indianapolis Colts as undrafted free agent, his brother says http://www. courier-journal.com/story/sports/c ollege/louisville/2017/04/29/louisville-rb-brandon-radcliff-signed-indianapolis-colts-undrafted-free-agent/308011001/ 	59	126	
I love how President Trump is so appreciative to his supporters.He doesn't act as though he' s above the people. #TrumpThePeoplesPresident	0	0	
Trump' s accomplishments so far - Got us out of economy issue - Lowered gas prices - Marriage for a .. Oh that was OBAMA! Trump did nothing	198	822	
Engaging&converting today s empowered #B2B #buyer requires a new approach - insert: #SocialSelling @linkedinselling http:// bit.ly/2pt7i1L pic.twitter.com/eMI3pRTHA2	8	4	
	0	1	
Blue as fas as the eye can see #vitaminsea #moretonbay @Jumpin Pin South-Straddie https://www. instagram.com/p/BTfRP1WlqCp/	0	0	
vc n sabem como  bom deitar no peito de quem a gnt ama, e esquecer tudo os problemas, as coisas ruins e s se sentir amada e importante	139	142	
Current weather in #Turriff . It' s 7.8c Wind 7.2Mph a Light breeze from ESE. Rain since 12am 0.0mm.	0	0	
Going undrafted doesn't decreases your abilities as a player, just decreases your margin for error! Remember that!	1195	2706	
There' s a difference between an opinion with which you disagree and an outright lie -- esp a lie about something that may kill people. https:// twitter.com/nachristakis/s tatus/858388828528275456 	56	137	
Pretty Reef as in Shareef?	1	2	
The MSM never misses a beat to slam him. He gives as good as he gets. What comes around goes around.	0	5	
Watch as this Pikachu plays Warframe :D http:// twitch.tv/steampunk_kovar @KlumaArmyTV @TwitchTexas @TwitchDesktop @FollowTrainTV pic.twitter.com/EjYUC1rtis	1	0	
If My Girl and @RemoDrive Both Drowning And I Can Only Save One Catch Me At My Girl Funeral Rolling fat ass blunts	70	203	
when u come home happy af and ur mom starts yelling as soon as you walk in the door pic.twitter.com/tgmR1b1taC	1206	3172	
. @realDonaldTrump is congratulating himself on #trump100days . It' s actually been a terrible assault on civil rights: http:// bit.ly/2qbByAK pic.twitter.com/QvhDmmy2jS	32	36	
A synonym? 2008. Absolutely without question. Started long before but that' s when the train derailed.	0	0	
A gray-haired Will Ferrell, as George W. Bush, received a standing ovation at #NotTheWHCD http:// thr.cm/UwDewc pic.twitter.com/hTkk7i8M37	117	331	
He must be a college student, cuz he' s not even phased. My dude has 3 papers due this week and a final on Monday, he'd rather be dead. https:// twitter.com/abc/status/857 957613304139776 	79968	153995	
Pedroia referred to that sloppy, two-error play in the seventh inning as a snowball fight.	5	23	
shoutout to the pansexual people who described their sexuality as them just liking who they like" or liking people.	0	1	
O medo fere mais profundamente que as espadas.	9	7	
Lula, no RS: querem destruir tudo o que Getlio fez http://www. tijolaco.com.br/blog/lula-no-r s-querem-destruir-tudo-o-que-getulio-fez/  via @tijolaco Vamos para as trincheiras em 2018 !	1	1	
Remember this as Trump attacks "Hollywood actors": Trump has a star on the Hollywood Walk of Fame.	406	1001	
That' s a pretty big wedge. Hope the first Monday trade days crowds are safe!! https:// twitter.com/LoneStarStorms /status/858469281914335232 	1	0	
ho' s "keep it REAL" about everything except being a ho. #byDeRayTheHo '	18	32	
Here' s a pic of only 2 gyms of 6 in an auxi gym of a high school in Minneapolis! #WOW #CollegeAtmosphere pic.twitter.com/SKBDtGFq4J	0	2	
No doubt Fury is a legend , but can't take nothing away from AJ' s heart to win a doggy fight , fury v AJ should be the real exposer	0	1	
                   ... #___ pic.twitter.com/ciFrEZz2jm	34	5	
Honored to join Indigenous leaders and native peoples as they fight for climate justice. Join me in standing with them. #ClimateMarch pic.twitter.com/Zrgt090lI6	5510	21022	
Keep quiet, nothing comes as easy as you. Can I lay in your bed all day. I'll be your best kept secret and your biggest mistake.	0	8	
I dont give a shit about anyone s stinky azz unwanted opinions about what I do for a living BYE pic.twitter.com/SKHheiuEWg	1	16	
Good Morning ADN & ALDUBarkads!. Have a blessed sunday mga bibi' s @aldenrichards02 @mainedcm #MAINECosmoCOVER pic.twitter.com/j1miVqqJO0	1	0	
. @POTUS : "Let' s rate the media' s 100 days... As you know, they are a disgrace." #TrumpRally #trump100days pic.twitter.com/tub6O9PoT4	0	0	
Artist here? I wasn't too invested in the order of my choices; so long as I get one of them, I'll be fine. But it is a little annoying.	0	1	
It' s funnier if you think of it as the people who aren't able to handle Burning Man but have a TON of disposable income. The could have gone	0	0	
vai ser essa foto em todas as redes sociais sim pq eu t apaixonadssima nela	0	0	
ESPECIAL CHRIS EVANS E SUA PEITOMANIA Claramente ele explica as coisas melhor se pegar no boob do Seb @SebastianStanBR pic.twitter.com/ayQWaPYCIZ	28	38	
As long as its one she' s big enough to fit in.	0	0	
$25 during missha.official' s sheet mask sale gets you a long way! This will definitely last me https://www. instagram.com/p/BTfRQBWDU3s/	0	0	
Yook sungjae!! The one who chose not to take off his clothes as usual  pic.twitter.com/gFFmVEoFt1	10	19	
Thank you so much to @livebeaming for choosing me as a contest winner! After a long week of https://www. instagram.com/p/BTfRP1ZFmyX/	0	0	
Am I doing something wrong? Like... I went over to CT tonight as masculine and when it came to https://www. instagram.com/p/BTfRP8XDKi-/	1	1	
Hope everyone' s having a good day !	99085	211228	
Fique bem informado com as ultimas noticias de tudo que acontece em Joo Pessoa -PB. Siga nosso instagram e curta... http:// fb.me/6ZiQNac8s	0	0	
A simple poll to test @YouGov bias. Have you as a #Labour voter had a survey about your voting intentions? I haven't #Yougov	1	0	
Headed off to Adams State in the fall to be a grizzly swimmer pic.twitter.com/o7C6yk0BOL	10	88	
YOU GAY AS HELL	0	0	
Carroll can guard Love. love is nothing like giannis, the only glaring negative aspect of carrolls game as a 4 is his rebounding ability	0	0	
As a student the most comforting words you'll ever hear are " I haven't started either"	396	1157	
This was also a night that made Tyson Fury' s performance against Klitschko look even better. Fury toyed with him. Joshua had a hard battle	370	616	
o fara so as marias da espanha	0	1	
If a grown man can look at a 12 year old girl & describe her as "seductive," regardless of what she' s wearing, he' s the problem. not her. https:// twitter.com/staronline/sta tus/857880291024568320 	100858	159749	
#PArally hecker - "that' s right. get him outta here. get him out." u. s . a . chants	0	1	
The Patriots have signed twin brothers Cody and Jacob Hollister (yes, both of them) as undrafted free agents. http:// nesn.com/?p=719204 pic.twitter.com/LbDnMym70R	50	129	
Tak usah Nervous.. Kan yg lolos AS Monaco.. https:// twitter.com/allunamaharani /status/858470084552966144 	0	0	
" As promessas uma mera iluso, as palavras eram sim e agora no "	0	1	
Seems like a protester is being removed rn at Trump' s rally in Harrisburg.	0	1	
A large group of HW actors & Washington media are consoling each other in a hotel ballroom in our nation' s capital. #StraightUp #MAGA	0	0	
as msc foram mt boas	0	0	
George W left Obama a total mess, whether you like it or not, that' s the truth.	0	3	
Im multifandom trash as always but I feel like I annoy ppl who follow me for one thing and not the another :(	0	1	
Nova adio s Mais queridas: Falco / Holiday Foi Muito http://www. deezer.com/track/15421076 @DeezerBrasil	0	0	
"I truly believe my first 100 days as President are the best in this country' s history!" http:// bit.ly/2oWK2I5 pic.twitter.com/dXRaxPzm5u	0	0	
CAN WE ALL JUST APPRECIATE HYUNGSIKS BEAUTIFUL TANNED SKIN HE' S A GLOWING BEAUTY pic.twitter.com/UrhiyPAUH5	598	729	
Husband came home thrilled that the NRA has identified him as a threat to the nation. I thought I was just a piddling professor!	4	12	
'There' s no hope for you You give too much away And you don't know How To Take......' B A N K n https://www. instagram.com/p/BTfRP59B4jU/	0	0	
There' s no reason a group of legislators, most of whom are men, should be telling women what to do with their bodies, says @RalphNortham	78	146	
+ just what' s a big trend (like I look bad with winged eyeliner so I don't really do it) also make sure foundation actually matches	0	0	
More people watched #AprilTheGiraffe give birth than 45' s inauguration, proving we'd rather see a giraffe' s vagina than a horse' s ass.	779	1503	
, no gosta de mim , mais curte as fotos d minha filha , n d pra entender n , se no gosta de mim no curta nem as fotos dela ,	0	0	
Who' s ready for a very special episode of GTA 5 play as a cop mod?!	114	501	
Met a little girl who was cosplaying as Groot. All she said for our entire conversation was "I am Groot", and it was perfect. #PCKC	395	5908	
Has got adrenaline in it , that' s my rant over good fight hope klitschko demands the rematch as per the contract	0	0	
Conservatives arent big fan' s of some of things being associated with alt-right but a lot of people are calling out people who aren't in AR	0	0	
As usual, someone is quick with the Wikipedia update on @JGPageau ' s page. @Senators pic.twitter.com/6qYIWc8o2N	48	65	
Assim como as flores, nossos sentimentos tambm morrem.	482	332	
it' s called 'someone out there loves you' when it should have been called 'underrated and deserved a spot on the b-sides' pic.twitter.com/sL2834kjBh	76	135	
As compensation for any ill will caused by #fyrefestival Official Staff has announced all attendees will get an extra hour in the ballpit. pic.twitter.com/Us58auYPSB	7105	16830	
A ' s before baes.	18	8	
What a great idea: bailing moms out of jail so they can be with their kids on Mother' s Day! Please RT & donate if you can! @SisterSong_WOC https:// twitter.com/swopbehindbars /status/858375227742486529 	47	45	
I liked a @YouTube video http:// youtu.be/Jf7gag2M2Ro?a Yesterdays | Ep.5 -- It' s Xxpen$ive To Be Me	0	0	
As coisas que eu tenho de ouvir	0	0	
most of em talk like they hoes but ain't about actually bein a hoe it' s sickening https:// twitter.com/gavin86oneill/ status/858470209040125954 	0	1	
. @SBTonline gostariamos de ver na programao as novelas Dos hogares e Cachito de Cielo com a grande atriz Elizabeth Valdez @elizabethvaldz !	0	0	
In honor of That' s so Raven coming back as Raven' s Home, I decided to create my own fan picture promo, what do you guys think? pic.twitter.com/SJEgxMeEBm	2	8	
So it' s not a " fact " it' s just your opinion it will prove to be in the future. Time for bed.	0	1	
Mesmo que as coisas no estejam correndo como ns queremos, sempre temos motivos para agradecer a Deus.	81	64	
velho na moral no 2 bimestre vou recuperar todas as minhas notas ruins, 1 bimestre foi s pra testar juro	6706	2443	
They have a 1.2 Billion Dollar Presidential Library to build so yes make that money. It' s legal.	0	0	
YASSS It' s time for a great show Chris M : #CoinDrop http://www. liveme.com/media/play/?vi deoid=14935088157661051350&area=A_US&countryCode=US&kid=2&s=841997831912292352&shareto=Twitter  pic.twitter.com/uOGFigASR3	0	0	
I J U S T W A N T T O T H A N K G O D F O R E V E R Y T H I N G . RETWEET IF YOU DO.	30605	18261	
Looks like she' s doing a little sole searching.	1	4	
Que as coisas boas se multipliquem.	428	242	
You see an ass so fat and you already know it' s a fckn rock booty	0	0	
"That' s the sad thing, though, my mom is such a cunt"	1	4	
I thought they identified him as Eric Clanton?	1	3	
I'm not gonna have a car and it' s six hours round trip and I don't know if they will	0	0	
as we prepare for bland hockey interviews please never forget the best draft lottery interview of all time pic.twitter.com/jMuqS8zK2l	0	1	
YASSS It' s time for a great show   : http://www. liveme.com/media/play/?vi deoid=14935099876969588033&area=A_AR&countryCode=EG&kid=2&s=832588747937153024&shareto=Twitter  pic.twitter.com/wk0XBh10Zj	0	0	
T igual as Meninas Super Poderosas https://twitter.com/ahtrouxa/status/849247490415235072/photo/1 pic.twitter.com/hnvEOUl8Dl	672	287	
Another shot from the stage (iPhone pano) as I was beginning my #adobe #premierepro demo of new features... #NABShow2017 pic.twitter.com/vB6fV8jSwk	3	32	
she' s pretty as fuck https:// twitter.com/livecivil/stat us/858015851743719424 	127	287	
Sure thing Thanks! Let me know when you start There' s just a lot of little things that popped out at me #SaveAgentCarter #ACViewInTheDark	0	0	
McDonald' s in the city of Sdertlje in the country formerly known as Sweden. pic.twitter.com/TBIXPa98WF	4133	4372	
"What' s it like having a sister?" pic.twitter.com/l0LBFrJqdO	6227	13968	
@jvseters happy morning, hello can you count me as one of your good friend mr. john am vickie thanks God bless	0	0	
there s a show on food network all night called KIDS BBQ CHAMPIONSHIP. they are all the opposite of chopped jr. contestants: unpolished, odd	0	4	
