
YASSS It' s time for a great show baby_destine_PN :Destine here http://www. liveme.com/media/play/?vi deoid=14935080246476047074&area=A_US&countryCode=US&kid=2&s=782202471417643008&shareto=Twitter  pic.twitter.com/VTbUqTaxDt	0	0	
My Aunty Is Not A Hoe & She' s Not Crashing Mercy Aigbe' s Marriage - Niece Of Miss Stunner Reacts http:// fb.me/7mAjWeEnq	0	0	
Love is as beautiful as two people choose to make it!	0	0	
He' s actually spouting "historical accuracy" about a TV show that features a dude breaking every law of physics and stone angels that walk.	0	7	
Coz nothing' s better than the early morning breeze!! Especially after a looong #NightOut #ItsMorningAlready pic.twitter.com/PvPEPAHFlA	0	1	
Lad unless AJ has a royal rumble time machine, he' s never gonna get credit from all the "experts" on here	0	0	
as I always say. HEY FIONA?!!! https:// twitter.com/rexidius/statu s/858465639400210432 	1	1	
4:20 on willie nelson' s birthday: a true national holiday	0	0	
Did you hear Mike Pence actually try to sell Trump as having worked for the American workers before he took office? He uses visa workers &	1	2	
The MPO is as useful as the Pope' s balls	2	2	
i love when my mom yells at me as a joke but then i start crying , it' s not like i told her to stop doing that this morning.	0	0	
Credit to @Klitschko snowing his perseverance during the fight & his continued class after. Two warriors. Changing of the guard as predicted	0	0	
Ternyata Iwa K Ahoker ya? @sahaL_ AS @na_dirs @NusronWahid1 @PartaiSocmed @kurawa @basuki_btp @ssirah @ardianasmar https:// twitter.com/islamedia/stat us/858467852076109824 	0	0	
i hope so, it' s a brand new record	0	0	
Ta brabo de enxergar as coisas nesse cel com essa tela	0	1	
I want Madara, but....RITSU IS FIRST PRIORITY. I'll try to use as little daiyas as possible to get the event 5.	0	0	
Why is he selling tickets? Oh, right, because he' s Trump. But seriously, shouldn't a president' s speech be a public event? @maggieNYT https:// twitter.com/maggienyt/stat us/858462929691267072 	0	0	
It was a highlight in mine as well! Thank YOU for everything! I love you even more!	0	0	
"Wonderful~" A smile formed onto the woman' s face seeing her reaction. "Since you're excited do you have something in mind to eat?"	0	0	
Its 9pm, its nice to be seen as cars for lesbians	0	0	
I'm freezing	0	0	
like if it' s busy as we r more worried about gettin food out than clearing bin like y'all don't like waitin so don't complain it' s not tidy	0	0	
Could be, but as an American I have trouble getting past the leader-envy	0	0	
idk if i should take it as a blessing that these dont work on modded kik or not pic.twitter.com/W66UQ96hue	0	2	
She has NO PLACE in the White House. She' s a grifter selling her shitty goods made in sweatshops.	0	0	
I remember you as being taller than that.	0	0	
Making it tough to believe we would know nearly as much about it IF Hillary was in deed our POTUS. The hypocrisy is real on both sides 2/2	0	0	
If you want to be book friends, please say hi to me at @OutlandishLit !! I love you all, thanks for having me as your co-host #readathon	0	16	
THANKS FOR TAKING MY CALL AS ALWAYS, I REALLY APPRECIATE IT #RESPECT @stevecofield @MadDogRadio	0	0	
It' s also a weed discord.	0	0	
usa o sorriso pra fazer seu dia mais feliz, no pra esnobar as pessoas dizendo que  melhor que elas(es)	0	1	
What' s the deal for the night? Someone help take a nigga mind off of life.	0	1	
Thank you!!!For all those who classify me as rude cos i think this https:// twitter.com/SenaByta/statu s/858361948324466688 	0	0	
Brandon up on Ocean Springs 6-0 on 2 two run HR' s and a Solo HR, bottom of 4th. Mississippi Star Matt Warren had 1 of the 2 run HR' s	0	0	
Not as lost as you think	0	0	
I've never been as horny as these police officers are after finding like two grams of weed in this woman' s car on 'Cops'	0	0	
Proud as can be of these boys. Down to 5 players and they won two games in 3 hours against teams that want to run and press. Takes and	1	7	
smp que estou mal as pessoas mandam me fotos de lontras hahah	0	0	
a / s /l?	0	0	
I feel the need to spend whenever I'm really sad and that' s a problem.	1	1	
It' s been done before. Ahmad Thomas will look to follow in @_tonyjefferson ' s footsteps as an undrafted free agent safety. #Sooners https:// twitter.com/ahmadthomas13/ status/858469509014974467 	4	18	
Se as meninas continuarem evitando ir a premiaes pra no esbarrar com a Camila, entao elas no vo em nenhuma viu.. pq futuramente..	0	1	
It' s because trump hasn't done anything positive, what a baby, because of trump I am embarrassed to be an American ! #CNN	0	3	
I love this comment on my CuriousCat but a part of me wonders if it' s someone I know really well or someone who "thinks" they know me. pic.twitter.com/Cy1Qyvh4t7	0	0	
Eu tendo de todas as formas possveis no ser mal interpretada no que falo mas parece que as pessoas preferem entender de outra forma.	0	0	
as you want them to I find in these situations.	0	1	
ela sempre vem me perguntar o nome das musicas dele a bichinha toda linda cantando as musicas orgulho	0	0	
I think my babies closet is completely Carter' s and Mud Pie. I have a problem.	0	1	
And BTW Yankees crowd before was way different than now where is lot of invest on players NOW they look and comment on every AB	0	0	
Does Trump have the most limited vocabulary for a president in U. S . history?	0	0	
No sei o que est congelando mais, o meu nariz, os meus ps ou as minhas mos	0	3	
Bom, aproveite as migalhas, se fosse pra ser justo seria a forca	0	1	
f a b u l o s a	1	0	
So my grandpa just told me my great great great grandfather was a professional gambler.... FAT S /o to him lol	0	5	
That' s the point people can just charge their cars instead of buying gas. They're also gonna start making batteries for solar powered homes	0	0	
TY this is an area the NRA does need to work and not let media portray them as something else	0	0	
What is absurd is basing opinions on bs and thinking they have the same value as opinions based on science. @NAChristakis @JoyceCarolOates https:// twitter.com/nachristakis/s tatus/858388828528275456 	0	0	
adoro tornar as coisas difceis para aqueles que pensam que controlam tudo e todos	0	0	
Esquecer um pouco as coisas	1	1	
Athletics and Astros are scoreless at the end of the 3rd. Pitching: OAK A Triggs, HOU J Musgrove (ESPN) http:// ift.tt/11YUSLM	0	0	
The ultimate conversation piece as featured in GQ Use code "GarwoodFan" and save 15% https:// goo.gl/hNF5c0	0	0	
Minha me leva as coisas a outro nvel https:// twitter.com/dontbesweet/st atus/858470765376794624 	0	0	
Esses vndalos no nos representam, a melhor resposta que poderia dar a eles e todoas as marias seria sua raa que vemos sempre...	0	0	
If you think I'm just a foolish kid ruled by his emotions, that' s fine. (To Tobi) #Sasuke #Bot #Naruto	0	0	
s vezes  interessante se afogar	0	1	
"Does anyone remember who our opponent was?" @realDonaldTrump asks. As if on cue, crowd chants: "Lock her up." But he didn't, so....	23	71	
Comentou "nem acho ela tudo isso", o fdp de sacanagem pegou o user da garota e comeou a curtir todas as fotos dela, queria me matar :)	0	1	
From John' s Blog: Attitude- It' s A Choice! #JMTeam http:// bit.ly/1Sw7OC0	2	2	
thANK U AS WELL I LOVE U MORE	0	1	
RDH' s @MontePaulsen presented a preview of the 1st #PassiveHouse district here in North America at #21IntPHC ! pic.twitter.com/H7RC1sQmTP	1	5	
"My house mates are banging" as in... having sex.... I fucking teared up at Michaels response pic.twitter.com/wjwe1J0ej7	0	3	
B a d A n i m e T w e e t s pic.twitter.com/9Tel869Www	0	0	
Thanks everyone for all the support all year as well as today on my birthday! I have been spending most of the day https://www. twitch.tv/zaxforever/p/3 e2db581-987f-47ef-a557-37ac3da6f1f4 	0	0	
Are you looking for a part-time work at home job? Here' s a massive list of 99 companies that offer part-time jobs... http:// fb.me/8FJPf9PAg	0	0	
Dawkins #SelfishGene has created a massive case of #belief #addiction even amoung university Prof' s .	0	0	
That was my top guess as far as you were concerned lol...I really like Foggy and Karen Page, myself.	0	1	
Continuing our Living the Resurrected Life series tomorrow as we walk through the topic of doubt. Hope you can join us. 10:30am.	2	0	
It' s a wonderful feeling https:// twitter.com/sexualgif/stat us/858184317675163648 	1	1	
Yes. Record as you will want that on play back. Over and over again.	0	1	
"Para aqueles que esto curiosos... AYTO  real... as pessoas so falsas." Essa frase se aplica perfeitamente pro AYTO BRASIL! https:// twitter.com/mikehalpern92/ status/858423351206871044 	4	17	
Well I guess that a good thing cause it' s pretty expensive	0	0	
Eu sou daquelas pessoas que no suporta ouvir as outras pessoas a mastigar	0	1	
wrong ! Karachi was built mostly during Charles James Napier era late 1840' s	1	2	
Who knoweth whether thou art come to the kingdom for such a time as this? Esther 5:14 #Esther pic.twitter.com/efjSQyKafv	33	66	
11 Wolverines drafted through 6 rounds...most of any school. We're officially back on the scene as a pro factory. #GoBlue #TheHarbaughEffect	0	0	
Most of the time, steroids are not given as a first line treatment. study deceivingly picks on PCPs but specialists are very likely to use	0	0	
What do you do when you are talking to a girl and she says "What' s CQ?"	0	3	
Really just wanna be a stylist for the simple fact that there' s so many people that need help styling themselves	0	0	
I can't believe no one seems to notice how freaking skinny his funnel is let' s stop paying attention to this one and just get a Dolgoch	0	1	
#RavensHome HOLY SHIT I AM SO FUCKING PUMPED, THAT' S SO RAVEN WAS MY SHIT AS A KID, BRING IT	0	1	
Another shot from the stage (iPhone pano) as I was beginning my #adobe #premierepro demo of new features... #NABShow2017 pic.twitter.com/vB6fV8jSwk	3	32	
So a colleague has complained to my boss that I've offended him. My response was that I'm offended he' s offended	0	0	
So much for all that anti-China talk as a candidate... https:// twitter.com/washingtonpost /status/857976283325751298 	0	0	
Like looking at the liberal retards that voted Hillary, funny as hell	0	0	
So there' s a movie theater like, an hour away that' s showing Your Name. Trying to decide if worth or if I should look into...alternatives.	0	0	
Salutes u as u possibly descend into enstars hell	0	0	
played there all the time as a kid...glad it' s all worked out after the roof collapse and everything https:// twitter.com/RyanRecker/sta tus/858413218762555394 	0	6	
-- He added playfully, holding out one of his arms to her as he stood before the door. "Haa... Here I am!"	0	0	
Can YOU #EscapeWilsonsHeart ? Escape then take the quiz & you could win a Rift + Touchand a copy of Wilson' s Heart! http:// ocul.us/WHtwescape	1	0	
to bff: we so gross in public but idc just as long as im witchu ew	0	0	
Love it! Such a shame there' s no ability to undiscover something, and discover it again . Would love to relive my BM epiphany/stolen soul	0	0	
Why is MSNBC broadcasting trump' s ego rally? Greta and Hugh are just the beginning. Rachel, Joy. Ari and Lawrence,.u need a spinoff	0	0	
sure. To the doom of us all. Great. Congrats AB. you're as guilty as the rest. WHAT A BAR!	0	0	
Tonight' s Game 2 between Creighton and Xavier has been cancelled. Really good chance the Musketeers leave Omaha with a 1-0 series win.	1	0	
Yay! I'm so hungry and I'm starving *i said as I giggled*	0	0	
No he isn't. Kelly is a good QB. He' s just a moron.	0	0	
@FaithHill thanks for an amazing show last night. We were there celebrating my wife' s defeat of cancer. Thank you & Tim for a great night!! pic.twitter.com/CFCyWxk1qA	0	0	
The dog on bgt oh my he' s a fluffy beast	0	0	
upon further investigation, that "big reversal in 10-year spec shorts" wasn't that big. current positioning same as late nov to early feb pic.twitter.com/2n7wadUGHj	2	2	
Great fit here! He' s automatically the best return specialist on the team already, with a head coach that loves special teams! Awesome!	1	0	
SHE' S GOT A WIRE FOR A WAISTLINE. WAIST A MOVE || VOICEMAILMOSKATO RIDDIM GET IT NOW ON @itunes @amazonmusic ... http:// fb.me/7R8m3KnRl	0	0	
It' s not just his pretty face, but his whole aura that draws her to him. Alright, a miracle...love is a miracle. It gives life to things,	0	0	
No, not at all. But I haven't been able to afford a CRANE so far to shoot like Ophuls - maybe that' s what you're thinking of?	0	1	
What' s this talk about a ledge grab limit?	0	1	
10 km en 50 minutes 40 secondes. Proud. As . Fuck. Pis j'aurais pu https://www. instagram.com/p/BTfRAHJD0k5A KCnTM0IYlk3Dymtpaf85HVEzgY0/ 	0	11	
Ooooh, what time and where abouts? I was thinking about hitting up Up Down cause it' s been a while	0	0	
Perfect. He can step in Crabtree' s spot in a couple years.	0	0	
"Quando reconhecer que nada pertence a voc, sua relao com as coisas e as pessoas vai mudar para melhor."	1	6	
That' s a good description - yes times goes on and things change - hope you're doing well Boris	0	3	
it' s a good think you're pretty...........	1	0	
Jeannette' s Demetrious Cox, a DB from Michigan State, will sign as a UDFA with the Bengals.	16	35	
As pessoa tem umas atitude tao nd a ve q a gente fica achando elas tao idiota q pprra	0	0	
Too bad they're perceived as less woke due to the DVa skin	0	0	
Howie needs Barnett and Jones to pan out in three years. Otherwise he' s gonna use Joe Douglas as his scapegoat to keep his job.	0	1	
Can someone send me a bunch of memes that I can edit and put in my brother' s senior letter?	0	0	
It' s a beautiful day but y'all still ugly	0	0	
as i said, im far from against greenish lighting schemes for that purpose, but im finding this neon green superillumination a bit much.	0	1	
tbh I want to do an entire set for grisha to Rifle' s Spiral which would be a very poor investment of time, and yet	0	2	
E essa moda dos bigodinho dos mano ae pego n, q at as mina to usando	0	0	
@theborneopost @CMOSarawak Salam 1Msia. Sarawak Govt must now add in sports into their agenda. MSSM' s failure a bit hard to swallow!	0	0	
"Can we get a manager, I think we have a blowjob situation in the men' s fitting room ..." LOL I love my job.	0	7	
@IndyCar is this a practice session about to happen? We're in the stands and have no idea what' s going on	0	1	
Boycott NYT! We need to support supportive companies, bypass the Exxon products as well.	2	4	
I lay my sword by Ur feet. as Husband	0	4	
I found the cure for my insomnia. It' s Calle La La Land. I just don't get it. Boring as fuck.	0	1	
As pessoas se arrependem, tenho que aprender isso	0	0	
Who' s ready for a very special episode of GTA 5 play as a cop mod?!	114	501	
One of my friend' s date didn't take her to prom after she bought a dress. Didn't want to go but now we are getting her ready. #GetHerToProm	0	2	
This is our fav part as well!	0	1	
nem parece que  um embuste s vezes.	0	0	
Unclear. In theory, pay 15% on LLC income, pass it through as cap gains, pay LTCG rate on that. https:// nyti.ms/2pdhSev	0	0	
As long as Canadians are pacifists this will continue	0	0	
Tenho vontade de parar em todas as paredes de SP pra tirar fto.	0	0	
What pushed the virgin patriot to post that? I was watching the A ' s game and missed it.	0	0	
O problema dos erros e que as vezes eles beijam bem	0	0	
As Oscar Wilde once said, 'the only people you know who're normal are the one' s you don't know very well!'	0	0	
So you are considering yourself to be a anak jawi now? Who' s your induk jawi (daddy)?	0	0	
This girl I've known since 3rd grade got arrested for murdering someone life comes at you fast as fuck holy shit	5	70	
You'll never find happiness if you run back to whatever broke you. You'll be treated like shit for as long as you let yourself be.	4	21	
Two years ago I declared being covered in cat hair as part of my brand and so it is	0	1	
Cad as caprichetes Mally???? https:// twitter.com/tamararocham/s tatus/858469321101783041 	0	0	
Fizemos as fotos, comemos sushi e agora viemos pro cinema	0	1	
When you get a shower & don't plan on washing your hair but it gets wet anyways so you might as well have just washed it	0	0	
O sea, S .E est admitiendo que la integracin del PC a la coalicin le rest gobernabilidad?	0	0	
That' s a huge window, no wonder you have heat loss	0	0	
You should start referring to them as "the cunts"	0	0	
It was a busy day for the McKeever' s !!! We performed at @sactomofo today and had some amazing https://www. instagram.com/p/BTfRMwYlBVj/	0	0	
RICHES OF THE SPHINX Video Slot Casino Game with a PHARAOH' S FREE SPIN BONUS: http:// youtu.be/KB3wkqwomsI?a via @YouTube	0	0	
Alpha-N s BMW M4 Is A Cheap Alternative To TheCS http:// car-antenna.net/alpha-ns-bmw-m 4-is-a-cheap-alternative-to-the-cs-2  pic.twitter.com/YIaV4JGxC6	0	0	
13 r e a s o n s w h y w a l l p a p e r pic.twitter.com/RExLyfC92k	0	0	
Also do not like this portrayal of Joelle as this thirsty chick waiting on Reggie to notice her. Reggie is a fuckboy #DearWhitePeople	0	1	
Speech from #Trump is hilarious - actually makes no sense;not in terms of view/tone, but it' s a series of disconnected half-baked soundbites	0	0	
tentar agradar as pessoas e s tomar no cu  foda	0	0	
Sunday late morning ? Let' s get up and feel fresh sunshine and spring wind God bless you with a wonderful day # #YooAhIn pic.twitter.com/OasovdwYA5	0	1	
It' s not a waste of time if you're getting paid to do it, fam	0	0	
I liked a @YouTube video http:// youtu.be/INcnB2PD950?a Dept. of Justice Cops #151 - YouTuber' s React (Criminal)	0	0	
I got a wig through the post today~ Made out of bum hair... It' s brilliant....but . . . . . It keeps blowing off...	0	0	
Hilarious seeing Trump running a campaign rally without realizing he' s already the President	0	2	
It' s a lot of reasons	0	1	
Have had similar situations as Zenyatta and Luci >.< you have my sympathy	0	1	
SpotifyCares: hannahwhaleee Hi Hannah, help' s arrived! Can you DM us your account' s email address? We'll take a lo https:// twitter.com/i/web/status/8 58468769609510912 	0	0	
It' s their record release today. They're playing a few nights at troubadour this weekend for it. I'm bummed I'm missing it :/	0	0	
Boto as coisa no forno, da esqueo o tempo q  pra deixar no forno, deplis esqueo o tempo q j faz q t no forno e no fim tudo queima	1	1	
That dumbass went off SON' s headline only & didn't even bother to read the data that GH have a 15 week low in one demo & can't get a 1.9 pic.twitter.com/OC4oXjDq6C	4	9	
someone' s blasting young MA outside my window and as annoying as it is im even more annoyed that i knew what' s playing the second it started	0	4	
Grab your playoff towels, Patrik Elias posters, and a nice bottle of bleach. It' s gonna be a loooong night	0	1	
As long as you love me #EMABiggestFanJustinBieber	0	0	
Agreed, he' s got a year left on his contract I think and I can't see anyone biting our hand off for him!	0	0	
Really I'm a ugly as nigga but that molly and that perfect stroke will make her reconsider.	0	0	
estou deixando de lado, as coisas/pessoas que no me levam para frente	0	0	
BTS was really cool! Great dancer and singing skills. Unfortunately the stage, sound and VCR not spectacular as I excepted. They need more.	0	4	
Okay this is everything, you're gorgeous as always and your dog is the cutest thing evaaa https:// twitter.com/saphirdolan/st atus/858391695381213185 	1	3	
You are welcome @cjluna00 - Congrats and good luck as you embark on your next chapter. #WordUpCards https:// twitter.com/cjluna00/statu s/858416061972189184 	1	5	
Se eu pudesse excluiria todas as redes sociais menos o Twitter	0	1	
Mate, you're the same as me, I think. You're not fat at all. Maybe we could both do with losing a few pounds though. I'll race ya.	0	0	
[2] community I'm from is out of my reach. It' s not a matter of a crusty few getting moved out, it' s a takeover of our community	0	0	
SpotifyCares: mattost Alright! Could you DM us your Spotify account' s email address? We'll take a look under the h https:// twitter.com/messages/compo se?recipient_id=497340309 	0	0	
Hope this makes you as happy as it made me https:// twitter.com/fiirtationship /status/858385411227385859 	0	3	
Wally: it' s not a talking cat. it' s talking, so that makes it a cat. Milliana: now I get it! Happy: "THAT MAKES ABSOLUTELY NO SENSE AT ALL!"	0	0	
It' s nice to see a president more interested in his voters then he is in pandering to Hollywood and the media	7	16	
posta as fotos do encarte aaaaaaaaa tem as letras? o meu ainda no chegou	0	0	
Happy birthday homie hope it' s a good one !!! @BlakeRock3	1	1	
Is it still regarding your concern last April 28, 2017 as disconnected line? Thank you!	0	0	
Live Overseas and don't want to miss a minute of the action at tonight' s band launch? Baje has you covered.... http:// fb.me/1TMVA21bt	5	4	
A donde el mando a Rosa E. Rodrguez el tweet donde incitan a matar a PNP' s el 1 ero de mayo? https:// twitter.com/Panorama24H/st atus/858469938184556544 	0	1	
I liked a @YouTube video http:// youtu.be/8zkmpyDBFZk?a Master' s Sun OST -Who Are You (Ending Theme)	0	0	
Lilly Peppertree: Lilly' s Spell by Julie Hodgson http://www. amazon.co.uk/dp/B01ALH9EX0/ ref=cm_sw_r_tw_dp_26dVwb0PGE36Y  via @AmazonUK 99p for a while.. grab a copy while you can pic.twitter.com/FnQdUAxSyz	9	4	
Did you know that cats have evolved specifically to sucker people into taking care of them? That' s why they can mimic a baby crying.	0	0	
Took a couple L' s but you know I'm on a roll now	1	0	
What' s a diet?	0	0	
I really hope I'm not a burden on anyone that' s supposed to be a friend, ugh....	0	0	
And you're spreading when I pop you like a button Honey, where' s your child? Alligator smile	0	0	
Saban s Power Rangers Movie DVD / Blu-ray Gets A Release Date! http:// fb.me/7OZ8ZOevj	0	1	
*Le empiezan a dar block l@s aludir@s !* https:// twitter.com/resiciossa/sta tus/858301567526678530 	0	0	
God it seems like,,, a fever dream there' s no way the world could be so kind to my gay ass??	0	1	
Saturday Night Social: Hosted by a Man Who Took Six Days to Finish the London Marathon Dressed as a Gorilla http:// ift.tt/2oTBhy0	0	0	
Estou high as fuck	0	0	
I would rather have a guy say sup fag to me than hey beautiful but that' s just me	2	18	
As much as I want to search flights, Kayak keeps pushing me to search for hotels. I get it you make money on hotels.	0	3	
her but it' s worth a try I do think of you everyday it sticks to my lips without forgiveness	0	0	
Mexico s Government Warns U. S . A . to Not Build Border Walls http:// blabber.buzz/politics/conse rvative/141782-mexicos-government-warns-usa-to-not-build-border-walls 	0	0	
I think I read the comments as a jab at the closed mindedness of the "establishment"...I could be wrong...	0	1	
Either that or they consider themselves all "People of color" and so again, anyone who came and paid would be sees as a "white supremacist".	0	1	
http:// ift.tt/2oJzyjw Major Report Prompts Warnings That the Arctic Is Unraveling. The polar region is warming more than twice as fast a  pic.twitter.com/EY2wMIc08q	1	1	
I'm in pieces. It' s tearing me up but I know. A heart that' s broke is a heart that' s been loved. #SupermarketFlowers #EdSheeran #Divide	0	0	
I-it' s not like I have a crush on Guren or anything. That would be stupid!	0	0	
Wow il est mauvais de faire sa...la sa prouve bien qu'il aimer pas Jess , car si tu as aimais une fille tu te doit de la respecter	0	3	
#IamLinda as this government is failing our young people. #bcpoli #bcelxn17 pic.twitter.com/aP12HjZKSu	9	12	
No caso as drogas tem ~receita~ mas tamo a na dependncia https:// twitter.com/marcoscopio/st atus/858426218827436032 	0	0	
PlayGirlz	0	0	
When he' s a douche but you're douche, too, so it works	0	0	
It' s been a year and it' s still not that great https:// twitter.com/HotFreestyle/s tatus/858169042884075521 	0	0	
Poha que isso gays to com uma dor de cabea desde as 17h da tarde SE FUDER QUE RAIVA	0	0	
I gotta say it' s nice not having a dog in this draft lottery fight #CBJ Also if Vegas wins it' s rigged. If the Kings win I will laugh.	1	2	
Cmo me va a costar tanto encontrar un lugar de tres dormitorios a 350.000 Pasen datos chicos/ as	0	0	
Indiana' s round barns now qualify as an endangered species. #RescueParty2017 #10MostEndangered pic.twitter.com/JKyTFlxMcW	3	6	
Bitch u thought I has a crush lol no it' s Britney bitch	0	0	
e u m e s m a https:// twitter.com/iludidapqp/sta tus/858453028172697600 	0	0	
S /o to the person who just did a major hit and run on my street	0	1	
Aww, Max! It' s okay, I know you love it here~ (@Cookiemto as Max) pic.twitter.com/JNwh4fm2eD	0	0	
"It' s funny that you have a stupid fucking president." - a Saudi watching Trump' s anti-white house correspondent' s dinner speech in PA.	0	0	
There' s a bird screaming "Eric" outside my house I want to die	0	0	
Life hack: watch a horror movie in the dark with some headphones in and it'll feel like someone' s in the house	0	2	
Let' s offer a Pepsi to Antifa commie protesters. pic.twitter.com/x2raHd6o2L	0	0	
Carrinho de rolim no atiava as piriguetes... https:// twitter.com/carolaffonso15 /status/858470224366116864 	1	1	
i'm happy, happy as shit.	0	1	
Trump is such a thin skinned baby that he skipped the correspondents' dinner. He' s the biggest joke.	0	0	
Can't believe me ma was dead offended by me "that' s the only sausage you'll be getting joke, it was half a compliment, thank me later	0	0	
I used Shazam to discover My Body' s A Zombie For You by Dead Man' s Bones. https:// shz.am/t50844567	0	0	
It seems as though Warren and Trump are on the same side : the " I want to control you " side .	0	0	
Let' s not forget. Last year a couple UDFA edged out some veteran WRs. Nobody safe. Ear. Your spot.	1	5	
Well Seattle Seahawks have a pretty good team this year let' s go Seahawks	0	1	
