
FoxNews: .POTUS: "Let' s rate the media' s 100 days... As you know, they are a disgrace." #TrumpRally #trump100days pic.twitter.com/PcYNqaJYd7	0	0	
	0	0	
Trump' s demand Seoul pay for THAAD will test ties as Moon presidency looms http:// dlvr.it/P1c42f	0	0	
all the ex acts have yet to achieve an era as iconic & successful as Bangerz, facts are facts. Stay pressed.	0	4	
Yas . I'll be there as soon as I leave here!	0	0	
Ah, Josh wine! I know it well. Apparently it' s made by a guy named Joseph who goes by Josh for short. Not sure how you make that leap but ok	0	1	
This is a rather #Leftist thing to say, no? Another example of Nazis' s ripping-off the Left while claiming faux- #Victimhood . #Pathetic . https:// twitter.com/literacyisgood /status/856922842427830272 	1	0	
fds as msicas dele batem bueeeee a cena  que a fcil e a ignorante parecem iguais se pensares nisso	0	0	
I liked a @YouTube video http:// youtu.be/ybndOPcYtwY?a Sharla' s Birthday!	0	0	
The only ice time I had a problem w/ was Smith' s and SkaJay' s . The Buchnevich thing is a head scratcher but I'm not a coach...	0	0	
T	0	0	
The best part about following you is the clearly unbiased opinions such as this one. https:// twitter.com/esmith_50/stat us/858466744314339328 	0	0	
The worst feeling as a GK is feeling like you've let your team down. The best is when you know your teammates have your back. Gracias Bros!	0	6	
of course honey.. it' s about wanting to be as much a natural girl as we can be for girls like us.. dm anytime if you need a sympathetic ear	0	1	
Let' s play pugs and 10 mans over playing a scrim. #LoveIt #NoDedication	0	0	
I admire Ruth as a queer and proud politician so much Why Do You Have To Be Tory	0	0	
tenho uma teoria de que existem dois tipos de pessoas as pessoas que esto sempre em relacionamentos e... as que no esto	0	0	
But its like everyday..lol, Marathons use to be on holidays and junk, at least it used to be, I guess they do it as filler now.	0	0	
Lol nah I guess you didn't get it. I was saying it' s probably a promo scam that the promoter left the banner up for that long	0	0	
@SportingKC My first Sporting KC game! It' s already great as they play Nina Simone.	0	0	
It' s like a giant friggin mental ward!!	2	4	
PROS confirma que se vendeu p/ a eleio de Dilma. E por quanto se vendeu pra votar a favor do golpe? E pra apoiar as reformas de Temer?	3	0	
if you ever want to live in Illinois just remember that there' s a tornado warning every time there' s a thunderstorm	0	1	
Happy birthday to my sweetheart, my friend and wife. It' s been a great joy knowing and marrying you. pic.twitter.com/xDmEix30Hm	0	0	
On s 'amuse  boycotter F.Fillon en laissant la place  MLP puis on incite  voter Macron... pas mal le plan!	0	0	
Relaxing in the lobby as we await our opening this Monday, May 1st! pic.twitter.com/E85aesTFjd	0	1	
eu to tendo um ABC as duas to shippando os namorados delas e elas to BRIGANDO PRA VER QUEM SERIA O TOP E O BOTTOM pic.twitter.com/Fcd2UcnnLJ	1	2	
@ANZ_AU now that i have had my credit card scammed to the value of $36K why not get some simple Smarts like Email or SMS as an Alert DOH	0	0	
As meninas estao aqui p ir p republic	0	3	
I'd have to do some hard pressed soul searching to place it #1 but man it' s close! Such a dope film!	0	0	
@POTUS @realDonaldTrump Why should anybody be loyal to a man-child who' s only loyalty is yo his bank account. Impeachment is coming quickly https:// twitter.com/tedlieu/status /858427885593346049 	0	0	
"Take em all" becomes a much more agreeable song when you imagine "them" as the 1%	0	5	
Pres @jokowi : We wish to see @ASEAN advance together., Never let anyone and any nation get left behind as ASEAN moves forward #KTTASEAN	2	1	
wait was this not meant as a joke imma just step out cuz im a freak	0	0	
Dinner and drinks with a view. Oh and... C- A -P- S CAPS CAPS CAPS!! https://www. instagram.com/p/BTfRJ-KhN0EI SeATI4tG_YzDn6GQVo1U2o8M3k0/ 	0	1	
I love A .C.E' s fandom yall know	0	1	
Finalmente esto vendo que as coisas saram de controle e o dio t insuportvel	0	0	
A branch in the lake? Sorry it' s bad	1	0	
#Roofing Tip - Gambrel roofs are also referred to as a barn style roof http:// local-roof.com #roofingcompany #roofreplacement #localroof pic.twitter.com/p9Sj5HXQbh	0	0	
Why are ppl apparently upset at people acknowledging AJ' s Nigerian roots?I'm sure he himself is a proud Nigerian or have I missed something?	1	4	
You were ! New stuff sounds amazing, it' s gonna be a Banger of an album. #2Weeks	0	0	
Prefiro as verses em espanhol	0	0	
Tucano tem bico comprido pra em toda licitao e merenda se meter, mas penas de bronze como as aves do... http:// fb.me/3GSFUio4A	0	0	
that' s what happens in a country run by Fascists https:// wingsoverscotland.com/wp-content/upl oads/2017/04/ygf.jpg  https:// wingsoverscotland.com/wp-content/upl oads/2017/04/IMG_9099.jpg 	0	3	
Spoil Mum this Mother' s Day with a DIY Foot Soak Here is what you'll need... -  cup Epsom salt - 2 Tbsp.... http:// fb.me/1TkbjgbnE	2	3	
Well, there' s a heck of a story. #amreadingfantasy http://www. atlasobscura.com/articles/tolki en-cs-lewis-disney-snow-white-narnia-hobbit-dwarves 	1	2	
#NBA NWT MAJESTIC #Boston #Celtics WORK AS A TEAM LONG SLEEVE SHIRT NBA XLARGE XL http:// dlvr.it/P1c3sG #BasketBall #Forsale pic.twitter.com/qIiFPR3aAf	0	0	
Vibes:: it' s nothing like a cute sandal https://www. instagram.com/p/BTfRJ6-FM3i/	0	0	
Trump' s attempt to roast the press is about as good as his first 100 days.	1	5	
. @MarvinMusquin25 continues to lead as the white flag flies! #SXonFOX pic.twitter.com/3zuZrNng6b	1	2	
correction THERE' S NOTHING A BUCKET OF SPIDERS CAN FIX EW OMG	0	1	
T' as supp quoi ? Excuse de pas tout le temps tre au tel tu rponds toujours  la seconde prt toi mdr ?	0	0	
IRONIC! Mexico Deported Charles Manson As An Undesirable Alien Back In 1960 http:// truthfeed.com/ironic-mexico- deported-charles-manson-as-an-undesirable-alien-back-in-1960/69253/?utm_source=dlvr.it&utm_medium=twitter  pic.twitter.com/czN9mfdGdg	0	0	
mas antes disso preciso comear as aulas de muai thai e voltar a estudar DESSE ANO NAO PASSA	0	0	
George is priceless - as usual. https:// twitter.com/georgetakei/st atus/858465781742436352 	0	0	
I love your mom tho. she' s such a sweet peach	0	0	
@Benim_Duam thanks for the follow we appreciate you. P. S . we msg u a lil something ;) http://www. digitalarchitecturesolutions.com	0	0	
If he can run like John Wall, I would like to see him in cover 2 with Julio Jones, I know Julio' s first reaction maybe WTF? You a Safety?	0	1	
@sabrinamajeeed As salam u alaikum. Can you Please retweet this message to spread the word for our upcoming event jazakallahu khayran pic.twitter.com/WsOdzZgg5A	0	0	
That is elite shot conversion from Vardy. I've said it all season - just as potent + lethal as last season, just massively inferior service pic.twitter.com/qQPXrCWBvG	1	1	
Eu detesto quando as pessoas batem na porta do meu quarto e ficam "Abre aqui"	0	1	
Marshawn Lynch has a full page message to Paul Allen and Seahawks fans in Sunday' s Seattle Times http:// dlvr.it/P1c3pr pic.twitter.com/eOSBObXELV	0	0	
People are gonna hate regardless so mind as well do you	0	2	
even on a rollercoaster, @adamkovic ' s look of confusion persists.	0	3	
That' s a good looking football player right there. #Pappoe https:// twitter.com/CNee247/status /858413731650437122 	0	0	
Mas  aquela coisa, nem sempre as pessoas so destinadas a permanecer, as vezes s a ter uma breve passagem e um milho de ensinamentos	0	3	
New Apple Park Drone Video Shows Off Last Minute Construction as Opening Draws Near http://www. macrumors.com/2017/04/29/new -apple-park-drone-video/ 	1	0	
Looking back on it that' s such a silly thought process. Now I just want to live a happy life and be a genuinely good person.	0	3	
Sent a pic about Bob Ross into the chat n Suzanne' s sending paragraphs about how much she lives him I have high regrets	0	2	
Pq que as msicas brasileiras so 1000 vezes mais triste que as portuguesas? Eu fico ???? Parece tudo to mais triste	0	0	
Most of the Berners I know are as sanctimonious as he is. They blame DNC for Hillary winning Primary (cheated) and loss 2 DJT	0	0	
>>  - http:// dlvr.it/P1c3kK A ' s Thought web-Log pic.twitter.com/VLcfSOn9tV	0	0	
This whole "my man buying his BM a Mother' s Day gift" topic...	0	0	
the most beautiful quote ever. seriously after you've read it... it' s a game changer. take time to read this, it will be worth it! pic.twitter.com/d0ApX1h1aF	1	0	
How can you not like @elitomac ? Skills, work ethic and a nice guy.. It' s cuz he hasn't drank the kool-aid isn't it?!	0	0	
@VannahAlbanez Twice is only what we know. This guy must eat Perjury Cereal for Breakfast. He' s a liar.	1	4	
Ew all these females look nasty as hell on snapchat	0	1	
J'ai une question srieuse  te poser en PV si possible, et je veux juste ton point de vue s 'tout. Pas de truc craignos, promis jur crach.	0	0	
CELEBRATIONS WORLDWIDE as the champions secure 6 in a row unbeaten,the like no one has seen since sevco WON 1-1 at paradise..hurting sevvies	0	0	
I'm legally married as well just need to have the actual party wedding. Can't wait.	0	1	
Found a Transponder Snail! What' s inside? Mystery barrel' s shocking secret!! http:// bnent.jp/optc-den2e/ #TreCru pic.twitter.com/bbtnvg1c4J	0	0	
)Tinubu reveals how Osinbajo reacted when he was nominated as Buhari' s running mate https:// madailygist.com/tinubu-reveals -how-osinbajo-reacted-when-he-was-nominated-as-buharis-running-mate/ 	0	0	
E as que misturam os dois mais o video do lagarto fugino das cobras WATCH GRIMM ON NETFLIX https:// twitter.com/axfgmix/status /858466155803148288 	2	3	
Bro that' s a build a bear	0	1	
You use Pocahontas as an insult...	0	0	
Now that' s a creepy photo. https:// twitter.com/WFMY/status/85 8146321076674560 	0	0	
Do they offer mafia like "cleaners" so it' s like the shooting never happened? Guy just disappeared. Asking for a friend...	0	0	
pengajian SIHIR, apa lu terlalu bego kaga ngarti hukumnya SIHIR di Alquran, ohh pantes ajeh goblokya gusmus blg adzan buat manggiil tuhan	0	0	
Marshawn Lynch has a full page message to Paul Allen and Seahawks fans in Sunday' s Seattle Times http:// dlvr.it/P1c3fK #reddit #nfl	0	0	
Trump fans want their own echo chamber, where only their views are validated, and opposing views are dismissed as fake news. Not good.	0	0	
Nova adio s Mais queridas: Michel Tel / Ai Se Eu Te Pego! http://www. deezer.com/track/111004614 @DeezerBrasil	0	0	
About as meaningful as yours. Go back to your blog.	0	0	
Happy Saturday! Here' s a sign to make you chuckle. :) #funnysignoftheday pic.twitter.com/915wKtL0eW	0	0	
It' s time for me to start a new chapter and get away from this negativity	0	2	
This is his only act. Surely people will get bored and frustrated once they realize he' s a one-trick pony. https:// twitter.com/Cirincione/sta tus/858470178543333376 	0	0	
Trump' s demand Seoul pay for THAAD will test ties as Moon presidency looms http:// dlvr.it/P1c3j7	0	0	
apaga os videos porno pesam muito e sai de grupo as coisa do zap sao salva dentro do cel	0	0	
Fossil fuel electricity & ur battery' s rare earth metals, wow. Could you find a way to use some ethanol & really explode your CO2 footprint?	0	4	
I am excited as well! :)	0	1	
Democraps are building a wall around Trump. They like walls when it' s in their favor!	0	0	
I won a game by 150 point at Hawaii stage. Let s play together![ http:// goo.gl/PKD66U ] #Bowling_King	0	0	
who' s tryna take a ride in my new whip because me too	0	1	
I just saw a guy using a unicycle as a way of transportation...and I'm pretty sure he' s living the life	0	0	
I lost my tv remote but u know what, it' s ok cause it' s 2017 and I have an app on my phone that is a remote too	0	3	
Let' s rate the media' s 100 days cause as you know they are in disgrace, said trump. Media coverage has been purposely negative/Lies continue	0	0	
Enter KOA' s Behind The Sign Giveaway. Win a Keystone Outback 2017! #KOAGiveawayEntry @KOAKampgrounds http://www. behindthesigngiveaway.com/go/?refCode=20 151&eventTypeID=2 	0	1	
Se voc mudar a maneira de olhar para as coisas, as coisas mudaro. Aprenda a enxergar as oportunidades, solues... http:// fb.me/3FQ1BCEiF	0	0	
#NFL #Broncos QB Kyle Sloter has been signed as an undrafted free agent by the Denver Broncos.	0	0	
Wow... perhaps he' s missing a gene.	0	2	
in 2017, if your news isn't a circle jerk of your current opinions - it' s invalid or "fake news."	0	0	
I think they are already posturing about Patrick saying he gets injured and stuff same as last year talking about Dubois so much because	0	0	
Its either that or go stroke more egos in d.c.,I see it as he' s hangin with the people rather than a bunch of douche bags pic.twitter.com/l8utLdyRy2	0	0	
but that' s my pov, I totally understand why you could think it wasn't a good ending for him	0	0	
well practiced throat to tilt what was left of it into him. Thankfully it wouldn't be enough to kill him but he sure as fuck was going to--	0	0	
Nope I just use the FOX Sports GO app it' s a whole lot easier than trying to find it	0	0	
Mando umas indiretas no twitter q as vcs nem eu sei para quem so	2	0	
A Spring Thaw? Trump Now Has 'Very Good' Words for China' s Leader - New York Times http:// dlvr.it/P1c3cV #trump #stocks pic.twitter.com/q6A3APh1JA	0	0	
Emerge asks the candidates: As Governor of Virginia would you create an anti-hate crimes act? @RalphNortham @tomperriello	1	0	
Se at o Adam repete as blusinhas quem sou eu n	0	0	
I wish getting out of the bed was as easy as getting into bed.	4	0	
Soldier Main Grinding Ranked | Join me as I carry :D http://www. twitch.tv/venocity_ #SupportSmallStreamers @Small_Streamers @SupStreamers	0	0	
Soon as u put the pressure on it was over best talk ever after fight very humble & respectful done trade justice	0	0	
There is a reason people used to wear hat' s !	0	0	
It' s like you're staring into my soul. It' s bullshit that there hasn't been a real sequel. TTYD is one of my favorite games of all time.	0	130	
Trump skips WH Correspondents Dinner because he' s a pussy	0	0	
Estava a ver as minhas fotos antigas, eu mudei bu	0	0	
(* )(* )	0	0	
My new sounds: d a r k s y d e - crystal lake https:// soundcloud.com/darksydeoffici al/d-a-r-k-s-y-d-e-crystal-lake  on #SoundCloud	0	0	
A guy deserves a second chance. I agree. But the NFL is treating violence against Women as just "character issues" that' s troubling	0	1	
Chelios is an assistant coach and Lidstrom lives in Sweden. Draper is already a member of the front office as a "special assistant" to KH.	0	0	
Let em know bruh, it' s a Q thing https:// twitter.com/qumhar/status/ 858468624197177344 	0	0	
i took this a year ago but i still think it' s one of the best pictures i've ever taken @gillianmcferren pic.twitter.com/BMlH8ErTaa	4	51	
I will never understand women who have unprotected sex say it' s a surprise pregnancy...	0	1	
What could a new study on vouchers mean for Trump' s education agenda? @leahaskarinam asks https://www. theatlantic.com/education/arch ive/2017/04/do-vouchers-actually-work/524676/?utm_source=twb 	3	1	
This was a pretty tasty episode. I like this guy as a super guest. Second only to Jason.	0	1	
It' s a nice day in DC. Why not hit a day party. pic.twitter.com/WpS0PAVEN5	1	5	
When your watching a sports game and it' s coming down to a game winner. pic.twitter.com/hUZtAzkjtS	0	0	
Also, did you know that 0,2% of EU population could originate legislation through Citizens' initiative? But sure, let' s call it a dictature https:// twitter.com/RebetikoWalrus /status/858468608107847680 	0	0	
"There are a million ways to surf, and as long as your smiling your doing it right"	0	2	
If he' s that bad, then why is him being elite even a topic? The tweet was clearly a joke and you didn't take it as such.	0	0	
Apparently in Kansas there' s a blizzard warning?	0	0	
how are you so worried about a prom that' s not even yours like what	0	1	
Victorian regional rail services will get a $1.45 billion upgrade as part of Tuesday' s state budget. #9News http://www. 9news.com.au/national/2017/ 04/30/03/32/victoria-announces-tax-hikes-before-budget/?ocid=9newsmtw 	1	0	
s vezes quando minha amiga fala que eu sou muito melhor sem @, s vezes eu acho que ela est certa	0	1	
It' s a great day to be a Dawg! #BulldogBrotherhood	1	2	
Friends hail woman, 86, killed trying to stop attack as hero - WAOW - Newsline 9, Wausau News, Weather, Sports - http:// dlvr.it/P1c3dj	0	0	
It' s a shame that my LTE works better than my wifi	0	2	
He' s a guardian angle... Mr. Cuddles! pic.twitter.com/UnjMMNzmUv	0	0	
Chemotype I flowers labelled as Chemotype II flowers, net HC Type III recall. #MuchAdoAboutCBD	2	3	
I've heard that sometimes a bad flu can cost you your sense of smell. That' s the only explanation.	0	1	
one pollster in Wisconsin told me, some people who voted for Trump voted for a black man as president and the first lesbian senator. https:// twitter.com/aravosis/statu s/858470103863762945 	0	0	
It' s a serious matter https:// twitter.com/ogundamisi/sta tus/858242530529378304 	0	0	
I'd be more concerned about a president turning down money after his presidency. That guy would be corrupt as fuck.	0	0	
1. It' s in LA 2. I open tomorrow so I'm not going anywhere near a bar.	0	0	
Dungey 2nd, Tomac 8th with 1 to go. That' s a difference of nine points.	8	44	
Second Time Around The Hubcap As Art: Sat, Apr 29 2017 10:00 AM California Center for the Arts, http://www. thingstodoinescondidoca.com/details-E0-001 -094682055-6@2017042910/Second_Time_Around_The_Hubcap_as_Art_Escondido/?utm_source=dlvr.it&utm_medium=twitter  #Escondido	0	0	
The NSW government in particular has been critical of having to subsidise states such as Queensland under the... http:// fb.me/5ps8NaCQw	0	1	
lmao just searched reviews on the Burger King I work in n some of these people' s complaints mean they deffo have never worked n a food place	0	0	
The blue oval is special. Can't believe this was 13 years in a row going to the @DrakeRelays for me and it' s still awesome!	1	4	
without this movie, black bands would not be respected as much. https:// twitter.com/quuay__/status /830938594453880832 	0	4	
Who Has the biggest influence on you as a teenager ?	0	3	
thank you for letting us know how you are. I'm glad things are going as well as they can be. you have such strength!	0	1	
- "Completa, chefia?" - "No, no. Troca as oito baterias, por favor!" Ah o futuro... http:// fb.me/7HT8vZTXW	1	0	
#TheResistance plans to sneak up on you and bite you on the Arse. It' s only a matter of time #RiseUp https:// twitter.com/gregabbott_tx/ status/858466161868115969 	1	1	
Tenho que ir l no pub com os guri e as guria mas a vontade  zero	0	1	
Her first award as a solo artist! I'M SCREAAAMING!!! CONGRATULATIONS MY LOVE. https:// twitter.com/archivekarla/s tatus/858468631230984192 	0	0	
This is horrible he has to learn to put his hoof down! Only so many carrots that' s a bunch of BS!	0	0	
Av got ma heed in ma hands. My worldview has been changed. A don't know what direction' s up n which is down. I'm lost in this world.	0	2	
. @POTUS : "Let' s rate the media' s 100 days... As you know, they are a disgrace." #TrumpRally pic.twitter.com/kDuAcUmeW0	0	1	
There are 11,000 people there. With JUST AS MANY standing outside just to be close to him. He is their champion. He is our hope. #TrumpTrain pic.twitter.com/MHd7TtOJb1	3	11	
Haidyn uses her pencil as her wand . OMG I'm dying	0	1	
ciara and i planning our future as roommates in paris and having a cat named d'accord and having cute ass blogs rt ur kink	1	3	
And blame yon horrible third bairn. I'm the last runt oot o' a femily o echt. Thank fuck it' s too late for these shites tae target me now.	0	0	
It came from Catholic church as well as the Irish penchant for anti-government terrorism & supporting every tin-pot terrorist group going.	0	1	
It' s the equivalent of a white woman becoming the editor of Ebony magazine.	1	1	
me & jo have done everything together for as long as i can remember	1	5	
I see the need that' s why as someone who grew up in Mexico know that a wall is not the best way You take the money from cartels that works	0	0	
Thanks mom for make me being alive in the same era as Niall Horan pic.twitter.com/AvXLzuL0a7	2	2	
acho q vou imbra com as meninas aq em casa mrm	1	1	
It' s sad that these people believe in this con artist...who has done nothing in his 100 days..except a Supreme Court Justice...SAD	0	0	
If we show up, we will be purveyors of hope in a world that' s desperate to receive it. @steveryancarter @WillowCreekCC #WillowCOH	2	5	
It' s got a little do with. But all I'm saying is, watch their film they are both gonna be just as good. If boulware is faster he goes.	1	2	
Felicity sighs sitting up as he spoke "i know i have no filter but I don't want my mother talking to you like that."	0	1	
As my two-year-old would say, "Les!"	0	0	
Stray Thoughts: 4/29/2017 It s funny, how a simple little mention of something can take you back to a ... https:// tmblr.co/Zz1OLt2L8kV2p	0	1	
We had such a great time cheering on our sister as she bravely shared her testimony last night at Woodside Bible... http:// fb.me/6AQaMIcRF	0	0	
A Poll Tax to be precise. In Reith' s day wirelesses were luxury household goods.	1	1	
        http:// dld.bz/e3Jaa	0	0	
And a lot of people had a visceral respect and love for her. As for the "visceral dislike"- it' s called misogyny.	0	0	
... I do not think I will ever understand your track of mind. Perhaps you are just what westerners refer to as "kinky". https:// twitter.com/Feral_Renegade /status/858470271711408128 	0	0	
Todas as meninas vo dormir aqui em casa amanh, to bem felizzzzz	0	0	
I feel you.. I actually put the show behind as I only care about Lana and her scenes, but still :/	0	1	
Who gives a fuck he' s crap	0	0	
Best of luck to @G_Ward1 who' s joining the @Eagles family. Once a Coog, always a Coog! Thanks for the memories in H-Town #GoCoogs	0	0	
(`;;)    	0	0	
If it weren't for Rand, Ted Cruz, Louis Gomert & a handful of others, NO ONE on the GOP side would have Trump' s back.	0	0	
You've been severely propagandized. The cure won't come to you on time if you treat belligerence as a virtue.	0	0	
US warship sails within striking distance of North Korea as Donald Trump slams tyrant Kim Jong Un s failed ballis https://www. thesun.co.uk/news/3443226/n orth-korea-missile-test-donald-trump-response-aircraft-carrier-war-threat-kim-jong-un/ 	0	0	
In the last 2 days Ive:almost stepped on a snake ,had a brown recluse spider crawl up my leg ,and now I was just chased by wasps life' s gr8	0	1	
Well, that' s a problem. I told people science wouldn't get "covered up". Perhaps I was wrong. https:// twitter.com/careygillam/st atus/858368553837264897 	0	0	
Getting divorced can be a trying time, both emotionally and financially. But it s important to take the right... http:// fb.me/Z6dHkcw8	0	0	
I liked a @YouTube video http:// youtu.be/DzDDilK38zM?a The Heathers The Musical soundtrack but it' s only the title of the song playing	0	0	
This is painful. Painful as hell. This isn't President Trump. This is candidate Trump with access to nuclear weapons.	0	1	
Just a tinny look at today' s cook pic.twitter.com/wmzljMqJBt	0	0	
Really!! He has to rallies truth by talking about who lost the election! He' s like a freaking tween with behavior disorder	0	0	
Ironic that the @NHL changed the #NHLDraft lottery rules as soon as there were more #Canadian franchises. @NHL is a US driven league.	0	0	
I just earned the 'Pale as the Moon (Level 8)' badge on @untappd ! http:// untp.beer/s/b188229404	0	0	
Draft is a crap-shoot! We got the best available qb at spot we didn't sacrifice anything. Maybe it' s time we get lucky!! Lol!!! https:// twitter.com/sportsboytony/ status/858470299175702529 	0	1	
Found a Transponder Snail! Oars comes back as a henchman of Moria?! http:// bnent.jp/optc-den2e/ #TreCru pic.twitter.com/WyJ4rcC5mj	0	0	
" As he slowly and softly slid into her DMs..." - excerpt from millennial erotica	0	0	
Okay I got a super buzz...like so fast!	0	0	
Got out of bed at 12:30 to eat, went back to bed, just woke up from a nap. That' s how today' s goin.	0	2	
I liked a @YouTube video http:// youtu.be/oikCyrqFLso?a What' s in an OP? - The Heartbreaking Beauty of Your Name	0	0	
I'd be one of the people who die. Fighting a terminal illness that' s expensive w/health care. Please fight hard against this travesty.	2	2	
We need to change this as soon as possible!!!	0	1	
Tucano tem bico comprido pra em toda licitao e merenda se meter, mas penas de bronze como as aves do Estiges:so blindados pela justia BR https:// twitter.com/cynaramenezes/ status/858433127638867968 	0	0	
dps de algumas coisas terem acontecido, atualmente prefiro tirar minhas prprias concluses sobre as pessoas...	0	0	
yung feeling na sinalihan mo na lahat ng G/ A ' s tapos di ka talaga mapipili AHUE	0	1	
Chinese Industrial Fluoride Suppliers Openly list Sodium Fluoride as 'Insecticide' and 'Adhesive Preservative' in... http:// fb.me/sXyksusG	1	0	
No aguento o @curtindo as fotos dessas piranhas, nao fode	0	1	
Former Ohio State and Kent State CB Najee Murray to the #Browns as an UDFA	7	4	
That s a lie..youve learned a lot in 100 day ! HOW to lie for your LIAR in chief! SAD	0	0	
She' s such a sweetheart https:// twitter.com/lexifullerr/st atus/858468161561165824 	0	0	
Parece q,no RJ,ainda  se convenceram de q a polcia tem o monoplio do uso da fora,e q manifestante  tem o direito de fazer quebra-quebra	0	0	
"I love you" - @TheRedVipre "I know." - @hiJenpai (Yes this is real life, we are officially married as of today!) pic.twitter.com/OLa204cY6M	15	222	
@as _yukimura  https:// twitter.com/cosnatton/stat us/854651610571579392 	0	0	
@realDonaldTrump making a further A-hole of yourself at rally as usual	0	0	
